No,Url,Valid,Message,Issue-url,Tag,Category
213,https://api.github.com/repos/alibaba/pouch/commits/182f7b85a4593138262c26d07ed6af6befdaa54d,False, bugfix flaky test case create container ability open stdin even though attach yet otherwise pouch start command attach stdin work well therefore pouch create need support flag keep stdin open order make case easy read use stdinpipe instead github.com pty need signed wei fuweid89 gmail.com, , ,None
214,https://api.github.com/repos/alibaba/pouch/commits/84f7aa6c38b1bba1ad9c88059cd1d2e363a21884,False, test add test case, , ,None
215,https://api.github.com/repos/alibaba/pouch/commits/e378474b63ef4233d74790caadca257d42377b16,False, delete omitempty privileged api signed ziren.wzr ziren.wzr alibaba inc.com, , ,None
216,https://api.github.com/repos/alibaba/pouch/commits/01bc2a0c8d481c32a946d26556c35a64c0855a89,False, bugfix support rich mode container signed michael wan zirenwan gmail.com, , ,None
217,https://api.github.com/repos/alibaba/pouch/commits/172a38701b906218857234b269d340d281317085,False, remove cri wrapper using grpc interceptor signed zhuangqh zhuangqhc gmail.com, , ,None
218,https://api.github.com/repos/alibaba/pouch/commits/357ca75474b9f777f0c5b6f0fc7db566a650dd9a,False, refactor cri simplify newstreamserver move common util pkg utils signed zhuangqh zhuangqhc gmail.com, , ,None
219,https://api.github.com/repos/alibaba/pouch/commits/38c2ca70b9fa0b96d6688beb2c94be4417314c88,False, test upgrade cri e2e test v1.12 signed zhuangqh zhuangqhc gmail.com, , ,None
220,https://api.github.com/repos/alibaba/pouch/commits/c46ab5b740b2419dd451c23dff4fe897b9c7c42a,False, test add new checkpoint apis opts config ulimit.go signed willsmisi 764947976 qq.com, , ,None
221,https://api.github.com/repos/alibaba/pouch/commits/3997e543ab1695ce31adbd6ceec680bea0727e8b,False, test make happy sometime sleep 0.01s container maybe stopped sleep host restart container failed signed rudy zhang rudyflyzhang gmail.com, , ,None
222,https://api.github.com/repos/alibaba/pouch/commits/71853ea83e05a949d8e578f9a82475c2cf694786,False, test change test image change test image busyboximage signed rudy zhang rudyflyzhang gmail.com, , ,None
223,https://api.github.com/repos/alibaba/pouch/commits/ce78f7f7b8ec8850d0bba8145fa38a6922464dc1,False, pas snapshot label context signed allen.wang allen.wq alipay.com, , ,None
224,https://api.github.com/repos/alibaba/pouch/commits/d70d763d431d0dd0ad982072a6492f1b300832ed,False, reset vendor containerd v1.0.3 signed allen.wang allen.wq alipay.com, , ,None
225,https://api.github.com/repos/alibaba/pouch/commits/c7620bec191ad7199cfb7bffb1d6103660748d6a,False, test try make case happy signed ziren.wzr ziren.wzr alibaba inc.com, , ,None
226,https://api.github.com/repos/alibaba/pouch/commits/22bfd53a50708f48d54b7b837f32114b7a8c54fc,False, refactor refect setup spec mount refact setup spec mount make logical structure override default spec mount container config setup container mount spec mount setup modify extra configs spec mount sort spec mount signed rudy zhang rudyflyzhang gmail.com, , ,None
227,https://api.github.com/repos/alibaba/pouch/commits/2f6a8269b03d8507872e45cf62d15f7c0bccc9fe,False, feature support multiple snapshotter pouch support different runtimes like runc kata kata default filesystem ready slow enhance file system kata use qcow2 block device introduce big problem runc default snapshotter overlay kata use qcow2 enhance runc use qcow2 since block device kata use overlay want better performance want strategy make two runtimes happy would use hook plugin implement different snapshotter different snapshotter provided pouch default snapshotter set context context set user signed ace tang aceapril 126.com, , ,None
228,https://api.github.com/repos/alibaba/pouch/commits/f92c3407ae862a5c4cd8e40d1dbb7d08347a0ce4,False, doc auto generate pouch cli doc via code signed pouchrobot pouch dev list.alibaba inc.com, , ,None
229,https://api.github.com/repos/alibaba/pouch/commits/4df6ef775915f81e2a855145d3f57438690d52c9,False, bugfix return stop container time error add timeout context call kill rpc request return stop container time error check make entrypoint script  cat eof tmp start.sh dev zero mnt test ddfile count 1000000 eof  prepare disk partition different disk rootfs dev sdb  mkfs.ext4 dev sdb mount dev sdb mnt data  prepare loop disk  mkdir mnt data test dev zero mnt data test test.raw count 128 mkfs.ext4 mnt data test test.raw mount mnt data test test.raw mnt test  start container bind mnt test freeze file system make hang  pouch run name stop test mnt test mnt test tmp start.sh home start.sh inc.com pouch busybox 1.28 home start.sh fsfreeze mnt data test  stop container check whether stop hang ...  pouch stop stop test  signed rudy zhang rudyflyzhang gmail.com, , ,None
230,https://api.github.com/repos/alibaba/pouch/commits/5bc59815b6e85bb9d84aae3f0bae38c7cbf25b7e,False, test use runc build source code build runc alibaba runc source code running test every month cherry pick commit opencontainers runc need release new version signed ace tang aceapril 126.com, , ,None
231,https://api.github.com/repos/alibaba/pouch/commits/beef8f89dfbbc4c5242d42b9661e73b2c9b31c29,False, add refactoring testnewruntime signed scy1993 21851406 zju.edu.cn, , ,None
232,https://api.github.com/repos/alibaba/pouch/commits/05c8c8713f8998ef66088ab866f6cc5c364d9978,False, doc add component owner backup project signed allen sun allensun.shl alibaba inc.com, , ,None
233,https://api.github.com/repos/alibaba/pouch/commits/c1d31b818af38c78abcbe4130fcd4ca48197e0c2,False, fix wrong time unit using delay.seconds show second explicitly signed zhuangqh zhuangqhc gmail.com, , ,None
234,https://api.github.com/repos/alibaba/pouch/commits/05086b9ce332866847729705756faf7153a7cc2b,False, fix outdated x509 key pair testing together add script regenerate signed zhuangqh zhuangqhc gmail.com, , ,None
235,https://api.github.com/repos/alibaba/pouch/commits/1592a6057523b43223f2e5abd3e86fa9eb0a340b,False, add daemon config allow multi snapshotter allow multi snapshotter pouchd signed allen.wang allen.wq alipay.com, , ,None
236,https://api.github.com/repos/alibaba/pouch/commits/d28d0b0852e6c9f8ba33be5344c3ddffbb264a10,True, bugfix add snapshot label config containerd.io gc.root label mean content snapshot removed use snapshot snapshot removed removing image default add containerd.io gc.ref.snapshot snapshot name label image config remove snapshot user try remove image close 2556 signed wei fuweid89 gmail.com,https://api.github.com/repos/alibaba/pouch/issues/2556,kind/bug,None
237,https://api.github.com/repos/alibaba/pouch/commits/b19f6694e0ccc549d58c785cc7e5e1394e9ec354,False, fix typo comment signed zhangyue zy675793960 yeah.net, , ,None
238,https://api.github.com/repos/alibaba/pouch/commits/4a4fc2d8e95d67b83e6749fb641032ac7f98e859,False, fix typo signed alex jia chuanchang.jia gmail.com, , ,None
239,https://api.github.com/repos/alibaba/pouch/commits/523e40a3ec216755e5c2c15c508c44dc42802f90,False, daemon replace error warning synchronize snapshot update sync loop function collect usage snapshot util success mean many error message written log failed get usage snapshot error easy trigger monitor tool replace writing error warning log signed alex jia chuanchang.jia gmail.com, , ,None
240,https://api.github.com/repos/alibaba/pouch/commits/2a033d00f2a999ef8ca0adb95ce9c7242ba768f3,True, signed fengzixu hnustphoenix gmail.com bugfix repair script creating k8s cluster pouch revise binary path pouchd delete systemctl enable pouch related http github.com alibaba pouch issue 2610 final commit pouch 2018. thanks pouch happy new year,https://api.github.com/repos/alibaba/pouch/issues/2610,kind/bug,None
241,https://api.github.com/repos/alibaba/pouch/commits/f0d82540e61d7505029095c7749f9f91fdaad2cf,False, fix typo signed alex jia chuanchang.jia gmail.com, , ,None
242,https://api.github.com/repos/alibaba/pouch/commits/8c327f1abcf23d292ea6fdf7bcea6f1706d5a62b,False, feature add container stats api client side signed zhangyue zy675793960 yeah.net, , ,None
243,https://api.github.com/repos/alibaba/pouch/commits/8d442c0001a0518e65d52f7af69f8618f8bc2eec,False, test add new testing runtime signed alex jia chuanchang.jia gmail.com, , ,None
244,https://api.github.com/repos/alibaba/pouch/commits/54dd513523bdc25a87d6f2dfc8d444f59808474f,False, fix outdated crictl command doc signed zhuangqh zhuangqhc gmail.com, , ,None
245,https://api.github.com/repos/alibaba/pouch/commits/7eb077e626c3b8c03dbc7c827929e931e5f75191,False, test api_ulimit_test add test ulimit signed alex jia chuanchang.jia gmail.com, , ,None
246,https://api.github.com/repos/alibaba/pouch/commits/daeca08e65b1a4731c16116014d8b1a6d58bac97,False, test optimize time run test case signed ziren.wzr ziren.wzr alibaba inc.com, , ,None
247,https://api.github.com/repos/alibaba/pouch/commits/18f35269d6ea49955e3a5b5b292f65be19906efa,False, doc auto generate pouch cli doc via code signed pouchrobot pouch dev list.alibaba inc.com, , ,None
248,https://api.github.com/repos/alibaba/pouch/commits/43beebe16081ae153cd1832674fe779c6b156e8a,False, doc auto generate pouch cli doc via code signed pouchrobot pouch dev list.alibaba inc.com, , ,None
249,https://api.github.com/repos/alibaba/pouch/commits/28bca821a28a5ebaae76672c83264d066f833869,False, feature split image pull interface actually real pull interface containerd image pull need unpack run container need split pull operation two operation fetch unpack let pouchd deal pulled image signed ace tang aceapril 126.com, , ,None
250,https://api.github.com/repos/alibaba/pouch/commits/2ffcfb9d9a17d3a0d69ec2ed0c8b904af7ef17ea,False, config disable snapshot syncer default cri report disk usage contaienr inode number however iteration take long time number file much based think disable default user want use set config signed wei fhfuwei 163.com, , ,None
251,https://api.github.com/repos/alibaba/pouch/commits/0b1415217a77ceb9b68561a125305fdc0a4dc47c,False, test change test image container create test change test image docker.io library alpine busyboximage signed rudy zhang rudyflyzhang gmail.com, , ,None
252,https://api.github.com/repos/alibaba/pouch/commits/7e4c8997a83faa417318437db8257d312c7e28ac,False, test aggregate update test case reduce time signed allen sun allensun.shl alibaba inc.com, , ,None
253,https://api.github.com/repos/alibaba/pouch/commits/e45b243a8d0d4e40eefa6de4f2ca7b699a746745,False, test aggregate deveice bps iop case reduce time signed allen sun allensun.shl alibaba inc.com, , ,None
254,https://api.github.com/repos/alibaba/pouch/commits/d09f9f75414ee4449ad743a3a8242d6485a80cfc,False, enhance modify actionscounter signed zeromagic anthonyliu zju.edu.cn, , ,None
255,https://api.github.com/repos/alibaba/pouch/commits/ae86ab385234fc2025f4ae7968c92299bf209f42,False, test fix take effect fix check error test alway get pas even test fail signed ace tang aceapril 126.com, , ,None
256,https://api.github.com/repos/alibaba/pouch/commits/b34d3183b166bee14bfeeab604972c79343eb80c,False, feature add rest field container inspect response signed allen sun allensun.shl alibaba inc.com, , ,None
257,https://api.github.com/repos/alibaba/pouch/commits/684c6e55dcf4073d4b6a8bc2ffced949e5d634e5,False, bugfix make pouchd support top paused container signed allen sun allensun.shl alibaba inc.com, , ,None
258,https://api.github.com/repos/alibaba/pouch/commits/b357815af21a6548e70fd3a4adf2558e3b38be41,False, refactor modify output formatting info command signed xiao hac zju.edu.cn, , ,None
259,https://api.github.com/repos/alibaba/pouch/commits/d30a76e55ab8cf720b3ac6d0e59774cf6a012f09,False, upgrade move 1.1.0 signed wei fhfuwei 163.com, , ,None
260,https://api.github.com/repos/alibaba/pouch/commits/4ecaf862e75dff9f726ca7f4bb396ff32b5ff01c,False, doc auto generate pouch cli doc via code signed pouchrobot pouch dev list.alibaba inc.com, , ,None
261,https://api.github.com/repos/alibaba/pouch/commits/563237fe4700565a0a245e88f6cd694713d400eb,False, test add test case parse_test.go signed willsmisi 764947976 qq.com, , ,None
262,https://api.github.com/repos/alibaba/pouch/commits/68519ab737f99f4c541b6e99575b8a4aa77104b8,False, doc auto generate pouch cli doc via code signed pouchrobot pouch dev list.alibaba inc.com, , ,None
263,https://api.github.com/repos/alibaba/pouch/commits/0334f3e710d520dc72020a60eace0c15967a8198,False, remove unused member daemon config listencri member daemon config unused listencri first added commit 05e492390 commit 05e492390 pushed jan merged mar listencri deleted commit 05e492390 merged jan mistake deleted listencri added back merge 05e492390 signed wang rui baijia.wr antfin.com, , ,None
264,https://api.github.com/repos/alibaba/pouch/commits/48e07336209488c166b6c7c7bac0e70f4ed07897,False, cri add daemon configuration statusresponse extra information statusresponse cri return runtime extra information map info one key map patch add daemon config another key value daemon configuration json format patch example get pouch root dir statusresponse signed wang rui baijia.wr antfin.com, , ,None
265,https://api.github.com/repos/alibaba/pouch/commits/b680418bd84654e4c9f25e1db925348223f49512,False, test add default shm size test signed ace tang aceapril 126.com, , ,None
266,https://api.github.com/repos/alibaba/pouch/commits/5b1cffad54ef6ed923f889df40eebe82da219a0d,False, fix change shm size option instead append change shm size mount option instead append one size option remove set shm size user define mount since mount destination duplicate runtime spec cause error signed ace tang aceapril 126.com, , ,None
267,https://api.github.com/repos/alibaba/pouch/commits/0c466eda633509de3dae7064682a39a01c2c2e0b,False, oci add pouch default runtime spec use pouch default runtime spec instead containerd default spec compare containerd spec remove root process env cmd nonewprivileges user rlimits linux cgroupspath exist default spec remove mount run used add allowed device add cgroup mount signed ace tang aceapril 126.com, , ,None
268,https://api.github.com/repos/alibaba/pouch/commits/b19cbf62901fc176b6b6036e7e97131d5e339327,False, test add test case signed maoyiwei jsmyw95 qq.com, , ,None
269,https://api.github.com/repos/alibaba/pouch/commits/7783bb1ed082e76717f89d0b73a00d1a331e0041,False, test add unit test case func parseenv signed jahentao jahentao qq.com, , ,None
270,https://api.github.com/repos/alibaba/pouch/commits/53025442a6704c2234b07ae2d95504793f788160,False, enhance use bit operation get device major minor signed leno hou lenohou gmail.com, , ,None
271,https://api.github.com/repos/alibaba/pouch/commits/7b088488e708e4c24a2eb2e6d4ac65a19cd4fc89,False, bugfix miss mount point mode volume container mountpoints container come container use volume set mountpoints old mountpoint set volume mode new container must keep volume mode signed rudy zhang rudyflyzhang gmail.com, , ,None
272,https://api.github.com/repos/alibaba/pouch/commits/a3d6a2b7e89944c39b13739b801a97f5e773d8ff,False, test synchronize branch tool dev release 1.12 recently many change pouch cri k8s cri tool cri tool given synchronization build stable release 1.12 branch instead old tool dev need synchronize pouch part signed alex jia chuanchang.jia gmail.com, , ,None
273,https://api.github.com/repos/alibaba/pouch/commits/3470d89cc9ea20248742f095ae713242257a1879,False, doc fix document path issue signed alex jia chuanchang.jia gmail.com, , ,None
274,https://api.github.com/repos/alibaba/pouch/commits/7e5da0bf583b576187d07232b74abee1da5ff397,False, support choose storage driver signed allen.wang allen.wq alipay.com, , ,None
275,https://api.github.com/repos/alibaba/pouch/commits/a426842059139fa8c5c378e2b6855e69faa092bd,False, doc auto generate pouch cli doc via code signed pouchrobot pouch dev list.alibaba inc.com, , ,None
276,https://api.github.com/repos/alibaba/pouch/commits/5e2c01d029820701f63921f5beaaf6c56a94eb8d,False, upgrade cri sync k8s 1.12 signed starnop starnop 163.com, , ,None
277,https://api.github.com/repos/alibaba/pouch/commits/1eb14ac7186515e92aad3854c25714b447d9c2a2,False, doc auto generate pouch cli doc via code signed pouchrobot pouch dev list.alibaba inc.com, , ,None
278,https://api.github.com/repos/alibaba/pouch/commits/c7f57ea9ef54ad5ac1daefd186e9dde219968c0a,False, test http_utils_test add case func boolvalue signed maoyiwei jsmyw95 qq.com, , ,None
279,https://api.github.com/repos/alibaba/pouch/commits/73256bffc1d89b0b571f6217f1946c97cbb8ed1c,False, feature addd publish cli flag signed zhangyue zy675793960 yeah.net, , ,None
280,https://api.github.com/repos/alibaba/pouch/commits/9e879af8eba28d7c3f3f8bad9b22fa7c771e1a3e,False, doc unix prefix socket cri signed wei fhfuwei 163.com, , ,None
281,https://api.github.com/repos/alibaba/pouch/commits/e99d1f87b49eeca0950f6a261eb8f301bde2337d,False, bugfix also consider duplicate item slice signed ziren.wzr ziren.wzr alibaba inc.com, , ,None
282,https://api.github.com/repos/alibaba/pouch/commits/c6a184ab6e26593ac696d6ba056c45b1fc1421bc,False, test simpler test remove check exitcode check output error enough signed ace tang aceapril 126.com, , ,None
283,https://api.github.com/repos/alibaba/pouch/commits/3e77989162bf7373a1fd7a2c2f7cca361a06fae4,False, bugfix container log path map initialized existing business signed starnop starnop 163.com, , ,None
284,https://api.github.com/repos/alibaba/pouch/commits/7bac615666420b6018caaa22c20a4ac5e9ca332a,False, doc auto generate pouch cli doc via code signed pouchrobot pouch dev list.alibaba inc.com, , ,None
285,https://api.github.com/repos/alibaba/pouch/commits/a340d95d1fca42ab9ecd2fbfe5bd1efc4a9efcd9,False, bugfix use string convert int64 use instead string imagesize otherwise get messy display signed wei fhfuwei 163.com, , ,None
286,https://api.github.com/repos/alibaba/pouch/commits/fe8bd4a6e3dba1a073d7073423a17ad2cfd18361,False, bugfix container write cgroup privileged clear mount option container get privileged make cgroup writable add test signed ace tang aceapril 126.com, , ,None
287,https://api.github.com/repos/alibaba/pouch/commits/a1033711969963b0e04c0406780de6f453551ce5,False, doc auto generate pouch cli doc via code signed pouchrobot pouch dev list.alibaba inc.com, , ,None
288,https://api.github.com/repos/alibaba/pouch/commits/8d4eb1e59d33fd4c51453c938d047719ca7e4971,False, bugfix copy data mode use volume mode copy image data parent directory sub directory copied cause volume directory empty copy image data need sort mountpoint string length destination directory signed rudy zhang rudyflyzhang gmail.com, , ,None
289,https://api.github.com/repos/alibaba/pouch/commits/50917ef0f950735a654827b8c397a2e3dfad7683,False, bugfix delete upperdir workdir deleting container taken pouch signed ziren.wzr ziren.wzr alibaba inc.com, , ,None
290,https://api.github.com/repos/alibaba/pouch/commits/ca885d72feee9d17396d4017e63d7c83ec02eab6,False, bugfix issue vet signed joseph lee joseph.t.lee outlook.com, , ,None
291,https://api.github.com/repos/alibaba/pouch/commits/f6c1ec360e95cb2c49082f8fa6c9de2130c32058,False, return valid image user image uid signed changyaowei 156511344 qq.com, , ,None
292,https://api.github.com/repos/alibaba/pouch/commits/f1d832a756e88b82a0a967eb9d6308160cfb6cc1,False, feature implement feature reopen log cri signed starnop starnop 163.com, , ,None
293,https://api.github.com/repos/alibaba/pouch/commits/ecce43e45f9168e3c67ad876720a669743acbc18,False, test add image config test refact test merge common image add image config test signed rudy zhang rudyflyzhang gmail.com, , ,None
294,https://api.github.com/repos/alibaba/pouch/commits/2ccc17dddc65aa4b9324ba7d9abd97e9bbcf6a16,False, test update existing tag image case test case fail use existing tag name override existing tag signed wei fuweid89 gmail.com, , ,None
295,https://api.github.com/repos/alibaba/pouch/commits/9446798eb3c85f93e5fce68de9d8d778a97bb7e6,False, fix volume copy data test make compatible rich mode container signed zhuangqh zhuangqhc gmail.com, , ,None
296,https://api.github.com/repos/alibaba/pouch/commits/7101cf23cf2681ed5890b4ff834e85bff442c6de,False, fix volume test fails custom version pouch make compatible different situation signed zhuangqh zhuangqhc gmail.com, , ,None
297,https://api.github.com/repos/alibaba/pouch/commits/0270a7922622c5450c1b7cdff7de58a85d598fe0,False, doc auto generate pouch cli doc via code signed pouchrobot pouch dev list.alibaba inc.com, , ,None
298,https://api.github.com/repos/alibaba/pouch/commits/40fea823b54bb1302256bc9f8e9379a632619718,False, bugfix fix jsonfile flaky test signed zhangyue zy675793960 yeah.net, , ,None
299,https://api.github.com/repos/alibaba/pouch/commits/755f40db208e5d9dbfc91bb8c8255739182b6b5a,False, fix compatible multi host result returned hostname split space scanner split token line default signed zhuangqh zhuangqhc gmail.com, , ,None
300,https://api.github.com/repos/alibaba/pouch/commits/4b642eb80c4339a7b38aab48e2edd3bfbc3e70c6,False, test add exec privileged test signed ace tang aceapril 126.com, , ,None
301,https://api.github.com/repos/alibaba/pouch/commits/d6f20196e7568e637fcfe3ebb55c1aa01ece882b,False, cli support privileged exec signed ace tang aceapril 126.com, , ,None
302,https://api.github.com/repos/alibaba/pouch/commits/b39acedfa2c26ceb7204977638c6def71d8c92c2,False, feature add capability exec process add current container capability exec process signed ace tang aceapril 126.com, , ,None
303,https://api.github.com/repos/alibaba/pouch/commits/b8ce8e489cbf3b3d9508e6de6a87d77ef4673edc,False, feature fullfill network scope field fullfill scope value returned pouch network list inpsect signed mathspanda mathspanda826 gmail.com, , ,None
304,https://api.github.com/repos/alibaba/pouch/commits/92dd0d5fab3f2fcab1f162ced31cd31a5147577a,False, doc auto generate pouch cli doc via code signed pouchrobot pouch dev list.alibaba inc.com, , ,None
305,https://api.github.com/repos/alibaba/pouch/commits/0ae7ed72868f129d9e5c3915bec661f9d6fb7c9e,False, clean temporary test file clean tmp test signed wang rui baijia.wr antfin.com, , ,None
306,https://api.github.com/repos/alibaba/pouch/commits/be7e0026010010849977a01d8e957eec803481e6,False, fix copydata bind mount add test copydata action enabled mount volume image example root hostname pouch run name test2 home baijia.wr volume var docker.io library busybox latest var spool www root hostname home baijia.wr volume spool www without patch data copied form container dir var host dir home baijia.wr volume unexpected copydata disabled bind mount signed wang rui baijia.wr antfin.com, , ,None
307,https://api.github.com/repos/alibaba/pouch/commits/3cc45c34376155acb09b177012149b9b1fa49f5f,False, feature add support maximum log size max number log file add max size max file flag followed log opt pouchd example pouchd log opt max size 100m log opt max file rotate container log size exceeds 100mb saved log file note max size max file flag supported jsonfile driver signed wangrui baijia.wr antfin.com, , ,None
308,https://api.github.com/repos/alibaba/pouch/commits/6a9505faf90754be16e60b91be411fbbf2d082c1,False, feature add cross building support signed leno hou lenohou gmail.com, , ,None
309,https://api.github.com/repos/alibaba/pouch/commits/cae1ca233b7208251c6fe4354383f3e658bf1683,False, test add test case configuration daemon signed alex jia chuanchang.jia gmail.com, , ,None
310,https://api.github.com/repos/alibaba/pouch/commits/401e130fbe4c3a5b1d04b1425252322da497d1e3,False, refactor fix part megacheck issue signed zhangyue zy675793960 yeah.net, , ,None
311,https://api.github.com/repos/alibaba/pouch/commits/9ed34bbf9ad1389c49ae0cb52d58e66e68876a36,False, update runc version 1.0.0 rc6 update runc version used integration test signed ace tang aceapril 126.com, , ,None
312,https://api.github.com/repos/alibaba/pouch/commits/401167e32da938934022c5987220aff748a3dd14,False, doc auto generate pouch cli doc via code signed pouchrobot pouch dev list.alibaba inc.com, , ,None
313,https://api.github.com/repos/alibaba/pouch/commits/aa61bb1a1ee1790d9806c69b9a6e12190043816d,False, feature add volume filter signed zhangyue zy675793960 yeah.net, , ,None
314,https://api.github.com/repos/alibaba/pouch/commits/cb5f2226152a53b05cea2485dc1776f272790838,False, cleanup runtime.caller const func name signed zhangyue zy675793960 yeah.net, , ,None
315,https://api.github.com/repos/alibaba/pouch/commits/d7d94df71d8333c7bc879d7230475d1a21b615b5,False, test fix criu test criu test completed check criu image file dumped restored container specified process signed ace tang aceapril 126.com, , ,None
316,https://api.github.com/repos/alibaba/pouch/commits/9ee2a819a5dfc085700d7f64d2d7ca8e51ff825b,False, bugfix recover container whose restart policy always host restart signed michael wan zirenwan gmail.com, , ,None
317,https://api.github.com/repos/alibaba/pouch/commits/043a3ae4b3dc1e915b85ff63c30cafc13f5f14d6,False, doc add zyecho maintainer signed allen sun allensun.shl alibaba inc.com, , ,None
318,https://api.github.com/repos/alibaba/pouch/commits/8908c68a26ba7f4bf37cb8ee38f7e3088a1e35ab,False, bugfix fix get mountpoint metadata fix get mountpoint metadata local volume driver signed rudy zhang rudyflyzhang gmail.com, , ,None
319,https://api.github.com/repos/alibaba/pouch/commits/ae255c8aebfa960991c5239279af6fc7708436d1,False, fix fail resolve correct target directory home dir resolve correct target path home dir home dir must relative path must file create directory exist return target directory directory symlink symlink container rootfs cause setting quota error signed ace tang aceapril 126.com, , ,None
320,https://api.github.com/repos/alibaba/pouch/commits/397224365eb4b74efa15342af7d46b2bcef915c1,False, doc auto generate pouch cli doc via code signed pouchrobot pouch dev list.alibaba inc.com, , ,None
