No,Url,Valid,Message,Issue-url,Tag,Category
321,https://api.github.com/repos/alibaba/pouch/commits/7da75d171189055fda1dda44861e64823240c914,False, doc auto generate pouch cli doc via code signed pouchrobot pouch dev list.alibaba inc.com, , ,None
322,https://api.github.com/repos/alibaba/pouch/commits/b6c46b8f4ad293ab18a1895930226f9e9eef6fb3,False, bugfix generate sandboxid stored advanced signed starnop starnop 163.com, , ,None
323,https://api.github.com/repos/alibaba/pouch/commits/ac54ffbc74922e5bbe51da3b0d9f6b975a13d202,False, bugfix fix creates network specify ipam opt signed tim xiaoxubeii gmail.com, , ,None
324,https://api.github.com/repos/alibaba/pouch/commits/cd6a60e0b25f1909e7653a4271d1c1f9bf1487ba,False, enhance add meaningful field log error msg signed leno hou lenohou gmail.com, , ,None
325,https://api.github.com/repos/alibaba/pouch/commits/ef0efaa815dd415c61b761793c44ff0694126c71,False, test refactor volume test signed zhangyue zy675793960 yeah.net, , ,None
326,https://api.github.com/repos/alibaba/pouch/commits/ff90685934c0054be0784d391da26bcb941fd4a6,False, test fix bug test add start lxcfs get root dir pouch daemon instead var lib pouch modify ipv6 test alikernel signed rudy zhang rudyflyzhang gmail.com, , ,None
327,https://api.github.com/repos/alibaba/pouch/commits/f614b69ef28a79ccafc603f91980d4f04df67731,False, bugfix cleanup containerd container restart policy cleanup action taken restart policy restart action failed new container keep name old one cleanup old one restart policy order make happen add cleanup function hook signed wei fuweid89 gmail.com, , ,None
328,https://api.github.com/repos/alibaba/pouch/commits/f360419cb94d9ee3a25757ba7b64517a2669679e,False, test fix blkio test case signed ziren.wzr ziren.wzr alibaba inc.com, , ,None
329,https://api.github.com/repos/alibaba/pouch/commits/e441275572152d6859f2f737dd9d8bd4ece286f8,False, fix indentation typo command help description also indentation defect client document doc commandline .md auto generated signed wang rui baijia.wr antfin.com, , ,None
330,https://api.github.com/repos/alibaba/pouch/commits/c09bb1c7a86fe73eb5ce5699547816dfb2caaeb7,False, test api_blkio_test add new checkpoint signed alex jia chuanchang.jia gmail.com, , ,None
331,https://api.github.com/repos/alibaba/pouch/commits/4cce334b130f6e9be8873bacb43e6274d1423b12,False, .circleci disable megacheck megacheck consume memory 4gb circleci limit container 4gb 2cpu add checker travis job since many job want remove check signed wei fuweid89 gmail.com, , ,None
332,https://api.github.com/repos/alibaba/pouch/commits/ebebba842c0cfeafeb306161c6c874029080b738,False, doc auto generate pouch cli doc via code signed pouchrobot pouch dev list.alibaba inc.com, , ,None
333,https://api.github.com/repos/alibaba/pouch/commits/f292b753087c9f38220153b4663a57a2e32e64eb,False, release pouchcontainer 1.0.1 version signed wei fuweid89 gmail.com, , ,None
334,https://api.github.com/repos/alibaba/pouch/commits/c523380ba3290355ce32d0e4d87c18e69a75f9a8,False, feature use ringbuffer make log blocking configurable signed starnop starnop 163.com, , ,None
335,https://api.github.com/repos/alibaba/pouch/commits/c279a1777d8826f36033c09c8fb3a7e745f50f0f,False, feature add volume quiet flag support signed zhangyue zy675793960 yeah.net, , ,None
336,https://api.github.com/repos/alibaba/pouch/commits/c3f1b197d07967d51d5089337c6ce610824f593b,False, linter add markdown link check check link whether alive signed allen sun allensun.shl alibaba inc.com, , ,None
337,https://api.github.com/repos/alibaba/pouch/commits/5355fe0307cee8bd76743e0eab310b304d8204e7,False, doc auto generate pouch cli doc via code signed pouchrobot pouch dev list.alibaba inc.com, , ,None
338,https://api.github.com/repos/alibaba/pouch/commits/d63ad25a73eefb002efda0df966647571b2efc39,False, bugfix fix incorrect size container attached tmpfs volume size mount point size incorrect container mounted tmpfs volume example size tmpfs volume created size mount point show signed mathspanda mathspanda826 gmail.com, , ,None
339,https://api.github.com/repos/alibaba/pouch/commits/c40d6e4cd1ca67730f5804f3333ecd0b7b221228,False, doc fix dead link doc cri signed starnop starnop 163.com, , ,None
340,https://api.github.com/repos/alibaba/pouch/commits/ad4b9b5cb6859b38634474eccaefe15e5c97c26a,False, change flag port publish signed cpaasarch yaofang.zjl alibaba inc.com, , ,None
341,https://api.github.com/repos/alibaba/pouch/commits/4d421ec1448d03ed47967891e65c6d13e26bba5f,False, doc fix dead link dragonfly change link dragonfly doc since dragonfly refactor signed ace tang aceapril 126.com, , ,None
342,https://api.github.com/repos/alibaba/pouch/commits/b22c4bdf8cb84fe466431fe383195fe60a2c853b,False, doc update contributing.md add example link help new contributor know write commit message sign signed wei fuweid89 gmail.com, , ,None
343,https://api.github.com/repos/alibaba/pouch/commits/e7dc811068b64844b62847937deb7b358c3ff699,False, feature enable ipv6 networking add ipv6 fixed cidr daemon flag add ipv6 validation integration test signed leno hou lenohou gmail.com, , ,None
344,https://api.github.com/repos/alibaba/pouch/commits/f56babd4cb39f63a2d071ae2826e6490cc60c5d9,False, vendor update github.com alibaba libnetwork bitseq signed leno hou lenohou gmail.com, , ,None
345,https://api.github.com/repos/alibaba/pouch/commits/b2fae86800676b011f604de19b5523a606d58d2d,False, fix make cpuquota validation compatible docker refactor logcreateoption validation enable developer see wrong signed zhuangqh zhuangqhc gmail.com, , ,None
346,https://api.github.com/repos/alibaba/pouch/commits/8acae577835aa8ebd05550c042477fd98a58174b,False, doc auto generate pouch cli doc via code signed pouchrobot pouch dev list.alibaba inc.com, , ,None
347,https://api.github.com/repos/alibaba/pouch/commits/af17db3574b3543f44d4866f0750828a3ad35124,False, enhance add goconst check signed mathspanda mathspanda826 gmail.com, , ,None
348,https://api.github.com/repos/alibaba/pouch/commits/6b34f08665756d8c73740af15f950117260a44fc,False, bugfix fix repeated string reported goconst signed mathspanda mathspanda826 gmail.com, , ,None
349,https://api.github.com/repos/alibaba/pouch/commits/a5bdf5acf5288d3f0521feeea8c9853b1cf8025b,False, refactor use raw system call instead clone read stdout boost signed simoncqk cqk0100 gmail.com, , ,None
350,https://api.github.com/repos/alibaba/pouch/commits/e7e89c859ebd844296bf9e69f6ebb1cf073c7a7d,False, doc auto generate pouch cli doc via code signed pouchrobot pouch dev list.alibaba inc.com, , ,None
351,https://api.github.com/repos/alibaba/pouch/commits/4237a68a6dc31394e152c84d47c49181949c95ae,False, doc pouch gvisor signed codejuan decbug.com, , ,None
352,https://api.github.com/repos/alibaba/pouch/commits/d16badfce62af6190d951ee6b101449aef4382ab,False, doc enable nvidia gpu 2.0 pouch signed codejuan decbug.com, , ,None
353,https://api.github.com/repos/alibaba/pouch/commits/4ea75a16878aa41f3a728ec857ed6a546a3c26ef,False, feature nvidia gpu 2.0 make compatible k8s signed codejuan decbug.com, , ,None
354,https://api.github.com/repos/alibaba/pouch/commits/9a98a659f2de3eca95c6be1384c100b5ab7132f3,False, feature support image filter flag signed zhangyue zy675793960 yeah.net, , ,None
355,https://api.github.com/repos/alibaba/pouch/commits/401e132f27ff8a7e3216f71b5d55423d87234e95,False, doc auto generate pouch cli doc via code signed pouchrobot pouch dev list.alibaba inc.com, , ,None
356,https://api.github.com/repos/alibaba/pouch/commits/2da028d830c13d3279f25dbb19aedfe7e4476c1f,False, bug fix meaningless cli option type signed mathspanda mathspanda826 gmail.com, , ,None
357,https://api.github.com/repos/alibaba/pouch/commits/69278d919b71b9394713a811e4c64a71c2c7c172,False, bugfix use fixed version cni instead master branch signed starnop starnop 163.com, , ,None
358,https://api.github.com/repos/alibaba/pouch/commits/e6e9c1a35ba1a3b9c0f1c7b8eeaa20f2af83ac72,False, bugfix use netnspath dynamically signed starnop starnop 163.com, , ,None
359,https://api.github.com/repos/alibaba/pouch/commits/55ca8599b9cb2f622cab92beefe428f9eab10907,False, doc cli update golang version kernel version use golang 1.10.4 describe requirement linux kernel update versionexample signed wei fuweid89 gmail.com, , ,None
360,https://api.github.com/repos/alibaba/pouch/commits/0ecdefb1f38b086d75917ef141c925f893f582ab,False, add deadcode checking gometalinter signed allen sun allensun.shl alibaba inc.com, , ,None
361,https://api.github.com/repos/alibaba/pouch/commits/c7a568eb933da415f1eed25c95f09957af009679,False, refector refect pouch volume module return error create volume exist refect volumeid volumecontext remove unuse field selector volumecontext set directory quota check limit device get volume size extra field add option set volume size also use size 10g  size 10g opt.size 10g set volume size merge volume error pkg errtypes remove unuse package pkg serializer signed rudy zhang rudyflyzhang gmail.com, , ,None
362,https://api.github.com/repos/alibaba/pouch/commits/a8ee96efaf88eaa72459afb94e2478ab88784063,False, feature support api plugin signed zhuangqh zhuangqhc gmail.com, , ,None
363,https://api.github.com/repos/alibaba/pouch/commits/26b6d5f9e7d12bf118335ad3ed7d979dbbb27f30,False, signed fengzixu hnustphoenix gmail.com feature modify function name prometheus registry change function name related http github.com alibaba pouch pull 2429, , ,None
364,https://api.github.com/repos/alibaba/pouch/commits/e75917587ac1a9fe661ebb182c40734c5d372575,False, fix kata use runv annotation kata runv two different hypervisor based runtimes use general name annotation signed flyer103 flyer103 gmail.com, , ,None
365,https://api.github.com/repos/alibaba/pouch/commits/4968f0eb2bcfcc915323fb660ad79be2a4655cb9,False, set debug trace back print stack trace routine created user panic signed zhuangqh zhuangqhc gmail.com, , ,None
366,https://api.github.com/repos/alibaba/pouch/commits/c4c5be88b1e3012f34b75f56e2d6a1b4a73deca0,False, kata workaround passthru net mode get pod signed ace tang aceapril 126.com, , ,None
367,https://api.github.com/repos/alibaba/pouch/commits/fbf37ed571bea53a02c69360d3a6d2cac7c073bc,False, enhance run travis document change save resource time signed wei fuweid89 gmail.com, , ,None
368,https://api.github.com/repos/alibaba/pouch/commits/bc76c245f901229d01389cf82218cd297f9dcc2a,True, feature optimise logic using prometheus use custom registry replace default upgrade package called client prometheus add new dependent package called promhttp related http github.com alibaba pouch issue 2395 signed fengzixu hnustphoenix gmail.com,https://api.github.com/repos/alibaba/pouch/issues/2395,kind/question,None
369,https://api.github.com/repos/alibaba/pouch/commits/58d409dc195b914364aec6460510d09273c6cbfa,False, doc user general pouchlinter linter pouch code signed allen sun allensun.shl alibaba inc.com, , ,None
370,https://api.github.com/repos/alibaba/pouch/commits/3d97439f8ac6fc2e94b3da3a0741403bc5084ed5,False, test refactor api_pause_test use util func signed zhangyue zy675793960 yeah.net, , ,None
371,https://api.github.com/repos/alibaba/pouch/commits/d5f4216518e16eec5bfd438de927c922ad3a1cbc,False, doc add ucloud production adopter signed allen sun allensun.shl alibaba inc.com, , ,None
372,https://api.github.com/repos/alibaba/pouch/commits/50817960133d391a547633bb2f5b9e7700a7cc27,False, doc auto generate pouch cli doc via code signed pouchrobot pouch dev list.alibaba inc.com, , ,None
373,https://api.github.com/repos/alibaba/pouch/commits/2b5fad7180be2fe23eda6d19c84e3258c04460d6,False, feature add rule type validation signed zhuangqh zhuangqhc gmail.com, , ,None
374,https://api.github.com/repos/alibaba/pouch/commits/69b5035c9529c62164a29d0ee512809f7bf0ae3f,False, bugfix fix deadcode report gometalinter signed zhangyue zy675793960 yeah.net, , ,None
375,https://api.github.com/repos/alibaba/pouch/commits/b83956bde6f3a83b517d04a1a5b88b89d205f123,False, refactor redesign container pouch signed wei fuweid89 gmail.com, , ,None
376,https://api.github.com/repos/alibaba/pouch/commits/193263031f53f949158f548b00b0a5a329a40042,False, feature support dns related flag creating container pouch cli signed mathspanda mathspanda826 gmail.com, , ,None
377,https://api.github.com/repos/alibaba/pouch/commits/023f02bf5434eac97f705a7e4d440c83a5746f84,False, tool add fix_quota_id tool add fix_quota_id tool fix multi quota one volume mount path signed rudy zhang rudyflyzhang gmail.com, , ,None
378,https://api.github.com/repos/alibaba/pouch/commits/638b38fa9a09ae52922a900d611817b69e017d7c,False, bugfix fix pouch inspect doe return port networksettings signed tim xiaoxubeii gmail.com, , ,None
379,https://api.github.com/repos/alibaba/pouch/commits/d41ecf058c13d10b7e96adf5335a8225d1e7e448,False, feature replace kubernetes deployment step allinone apt aliyun mirror signed mathspanda mathspanda826 gmail.com, , ,None
380,https://api.github.com/repos/alibaba/pouch/commits/fe4864d0e565a5b159736fb51283b073f2674697,False, doc auto generate pouch cli doc via code signed pouchrobot pouch dev list.alibaba inc.com, , ,None
381,https://api.github.com/repos/alibaba/pouch/commits/eb49d7c198f54c7ffcf95e8493f45d82b34863c3,False, doc remove pouchcontainer swagger since use official one signed allen sun allensun.shl alibaba inc.com, , ,None
382,https://api.github.com/repos/alibaba/pouch/commits/9cede334538ac50115d0e7c31caf4cf5974dd19a,False, doc update golang version dockerfile correct 1.10.4 signed allen sun allensun.shl alibaba inc.com, , ,None
383,https://api.github.com/repos/alibaba/pouch/commits/520aa6b0b89e19ff6f3b94960a97aba16ca730e7,False, bugfix add missing license vendor github.com prometheus client_golang vendor package miss license add back signed wei fuweid89 gmail.com, , ,None
384,https://api.github.com/repos/alibaba/pouch/commits/8142201a79561a98eebeeba2253eeb6e7b1dbb9d,False, support create container given signed allen.wang allen.wq alipay.com, , ,None
385,https://api.github.com/repos/alibaba/pouch/commits/bbba1293f175fe9b055b4444619fc72b98d8f26e,False, feature support get security option daemon show daemon security option include four part seccomp apparmor selinux userns signed ace tang aceapril 126.com, , ,General
386,https://api.github.com/repos/alibaba/pouch/commits/87544ad66cdeb8990e86cadaf729b3d0f0c676a5,False, vendor update github.com contiv executor update github.com contiv executor vendor signed rudy zhang rudyflyzhang gmail.com, , ,None
387,https://api.github.com/repos/alibaba/pouch/commits/fdbc0cbcc8ef3e4205a308ca3fc19e3003857b56,False, doc auto generate pouch cli doc via code signed pouchrobot pouch dev list.alibaba inc.com, , ,None
388,https://api.github.com/repos/alibaba/pouch/commits/825128d4e4dd7f2702dbfb25db6f8b2abfd64913,False, doc add build tag description signed ace tang aceapril 126.com, , ,None
389,https://api.github.com/repos/alibaba/pouch/commits/f0dc71603fc6df657002bd783cb1cfd22168a45c,False, refactor refactor security spec security parameter include seccomp apparmor new privilege implement good refactor part create new spec signed ace tang aceapril 126.com, , ,General
390,https://api.github.com/repos/alibaba/pouch/commits/e1e11a284cb55f5b8524cc58f334caf98a65afcd,False, vendor add opencontainers runc libcontainer apparmor add package opencontainers runc libcontainer apparmor apparmor used signed ace tang aceapril 126.com, , ,None
391,https://api.github.com/repos/alibaba/pouch/commits/8293d477d627c8510a163b1e4f7c7534a2d51a9a,False, vendor remove unused vendor package github.com resty resty github.com magiconair property github.com ini ini github.com containerd containerd version github.com alibaba pouch libcontainerd github.com microsoft winio vhd signed fengzixu hnustphoenix gmail.com, , ,None
392,https://api.github.com/repos/alibaba/pouch/commits/8776494eef35ac624a88c58e123364e36de897b1,False, feature add close func store backend signed michael wan zirenwan gmail.com, , ,None
393,https://api.github.com/repos/alibaba/pouch/commits/b29253569cbf5c79654f59ba863a1d8f742a0695,False, doc auto generate pouch cli doc via code signed pouchrobot pouch dev list.alibaba inc.com, , ,None
394,https://api.github.com/repos/alibaba/pouch/commits/c835be88716631db43b0503869051216f5658f58,False, refactor use return fast make code readable signed allen sun allensun.shl alibaba inc.com, , ,None
395,https://api.github.com/repos/alibaba/pouch/commits/a3b5c25ae7a8310af9238fbace3e4a1fc48e94a2,False, tool remove package builder pouch release pouch yum apt source always need update builder script change git commit sometimes change belongs release version based case using repo handle package builder better current one signed wei fuweid89 gmail.com, , ,None
396,https://api.github.com/repos/alibaba/pouch/commits/9bf53d1d4c0a5fdf55a0b23da1984f36a54c1de3,False, refactor combine function one file since function like getdevid getnodeip ... related host system info move one file easy controll signed ace tang aceapril 126.com, , ,None
397,https://api.github.com/repos/alibaba/pouch/commits/7006be43e9782c0c8b31b291ceeeb89ede661a52,False, remove redundant log signed zhuangqh zhuangqhc gmail.com, , ,None
398,https://api.github.com/repos/alibaba/pouch/commits/b32efbb624345829f2416c22c563586243be2390,False, bugfix get address hostname get address hostname alibaba server default route enable pouch cri address default route initialize cri pouchd signed rudy zhang rudyflyzhang gmail.com, , ,None
399,https://api.github.com/repos/alibaba/pouch/commits/4f6e6256cd3e5f0b9a64f861c1b0bebc711d8b94,False, doc auto generate pouch cli doc via code signed pouchrobot pouch dev list.alibaba inc.com, , ,None
400,https://api.github.com/repos/alibaba/pouch/commits/1ceb1e9532dd613756639624ea1f77b7da0edabb,False, refactor refact pouch hook plugin refact pouch hook plugin add plugins code binary building instead hook_plugin.so add cri plugin detail see doc feature signed rudy zhang rudyflyzhang gmail.com, , ,None
401,https://api.github.com/repos/alibaba/pouch/commits/143227da5a48435f7993adc9bdca564349742964,False, test refactor test code use inspect func signed zhangyue zy675793960 yeah.net, , ,None
402,https://api.github.com/repos/alibaba/pouch/commits/2f3ee4c3184d71f262289149981f063755726b4c,False, doc auto generate pouch cli doc via code signed pouchrobot pouch dev list.alibaba inc.com, , ,None
403,https://api.github.com/repos/alibaba/pouch/commits/737a60cb870fae7a29fbc1fa6deeaf064f567176,False, doc update field doc deploy kubernetes pouchcontainer, , ,None
404,https://api.github.com/repos/alibaba/pouch/commits/21705912b26f6dd75331e72b476f14af99de7257,False, feature add trunc flag pouch image signed zhangyue zy675793960 yeah.net, , ,None
405,https://api.github.com/repos/alibaba/pouch/commits/7ce620b63fc60810ce2c70c560ee21562b709779,False, upgrade swagger 0.17.1 correct several test case signed zhuangqh zhuangqhc gmail.com, , ,None
406,https://api.github.com/repos/alibaba/pouch/commits/17eb976b43e83fbfdc40cc3dc000564c1d929be0,False, doc update issue template github already support different issue template added three bug report feature request question pouchcontainer, , ,None
407,https://api.github.com/repos/alibaba/pouch/commits/fc4396f7de906d76263d07710aa86cf850421102,False, test refactor cli stop test case signed zhangyue zy675793960 yeah.net, , ,None
408,https://api.github.com/repos/alibaba/pouch/commits/5ad887d876d930999e19fd2c2e54f37a18e5754b,False, test add new check point signed alex jia chuanchang.jia gmail.com, , ,None
409,https://api.github.com/repos/alibaba/pouch/commits/72a1ea5503665f4ef50c1237ef5833df32f05078,False, test make stopinwrong test complete signed zhangyue zy675793960 yeah.net, , ,None
410,https://api.github.com/repos/alibaba/pouch/commits/5b66e676368857fa34762314641e87d541c2bac5,False, doc auto generate pouch cli doc via code signed pouchrobot pouch dev list.alibaba inc.com, , ,None
411,https://api.github.com/repos/alibaba/pouch/commits/a9ed8c131ce21896a4f5627f62ecf82e931a0f58,False, test add unit test called signed fengzixu hnustphoenix gmail.com, , ,None
412,https://api.github.com/repos/alibaba/pouch/commits/66c384a83bc671d8b9e8ab5cc641429b6117d550,False, doc add document signed michael wan zirenwan gmail.com, , ,None
413,https://api.github.com/repos/alibaba/pouch/commits/6de45fe2a553d0dbf42f183e7601b4e084c3c842,False, bugfix judge enablement libnetwork resolver network mode signed mathspanda mathspanda826 gmail.com, , ,None
414,https://api.github.com/repos/alibaba/pouch/commits/6a6c159f637289a63e64b905889a229bd082c669,False, fix dead code clean code format default section never hit due strings.count limitation strings.splitn slice word part dead code patch fix fix dead code clean code format signed alex jia chuanchang.jia gmail.com, , ,None
415,https://api.github.com/repos/alibaba/pouch/commits/693cca7e79980e8ec40c128637f6e1ec1f0c73ab,False, bugfix allow exec attach ttymode container non tty client signed zhangyue zy675793960 yeah.net, , ,None
416,https://api.github.com/repos/alibaba/pouch/commits/76482170e7c690b38f5a431e652304546f3b6af2,False, doc auto generate pouch cli doc via code signed pouchrobot pouch dev list.alibaba inc.com, , ,None
417,https://api.github.com/repos/alibaba/pouch/commits/ffab192f9dd5fc018ae7e60559a2dfd9f0028827,False, doc auto generate pouch cli doc via code signed pouchrobot pouch dev list.alibaba inc.com, , ,None
418,https://api.github.com/repos/alibaba/pouch/commits/a6c1601011870f2fc305215c8601bbce485d9b5f,False, test add testcase cli exec opt signed zhangyue zy675793960 yeah.net, , ,None
419,https://api.github.com/repos/alibaba/pouch/commits/ee5caee72bff879988209598d732e2bccf95aae9,False, bugfix allow run cmd attach ttymode container non tty client signed zhangyue zy675793960 yeah.net, , ,None
420,https://api.github.com/repos/alibaba/pouch/commits/4106b91c157a7fd784e0d9ff69299d1289adebf0,False, bugfix distinct init process exit exec process exit signed michael wan zirenwan gmail.com, , ,None
421,https://api.github.com/repos/alibaba/pouch/commits/e0efa2e8dd458566c97c527703083d4802ee43e5,False, test fix integration test deleted container created signed mathspanda mathspanda826 gmail.com, , ,None
422,https://api.github.com/repos/alibaba/pouch/commits/a0376b3e65eb565926baaf51e6ef01044d57cce3,False, bugfix remove metadata remove container failed signed starnop starnop 163.com, , ,None
423,https://api.github.com/repos/alibaba/pouch/commits/53bd8962b9bbdc914262012a73c7bc1e8514f529,False, bugfix start cli setrawmode tty mode terminal signed zhangyue zy675793960 yeah.net, , ,None
424,https://api.github.com/repos/alibaba/pouch/commits/b09380864d199aad70e5b40ec437068c3394ad83,False, test start cli test test file signed zhangyue zy675793960 yeah.net, , ,None
425,https://api.github.com/repos/alibaba/pouch/commits/b9787ddbd1a19bd95a9eae22234886a28caff9a8,False, doc fix usage run pouch command non root user signed flyer103 flyer103 gmail.com, , ,None
426,https://api.github.com/repos/alibaba/pouch/commits/fb0d5e30b705c18a36b2913ddbb84e4ea35d553d,False, refactor refact daemon log change log level get method info debug add log show set disk quota information signed rudy zhang rudyflyzhang gmail.com, , ,None
427,https://api.github.com/repos/alibaba/pouch/commits/555e253ed8a83af3e9e2d5ccb550cf1ad32462ae,False, upgrade go1.10.4 version update .travis.yml .circleci config.yml make sure run client unit test fix golint error signed wei fuweid89 gmail.com, , ,None
428,https://api.github.com/repos/alibaba/pouch/commits/e0392bafed85ff9b08354e3921bd4e588e15a320,False, bugfix update branch cri tool updated signed starnop starnop 163.com, , ,None
429,https://api.github.com/repos/alibaba/pouch/commits/7d423ecd93e9501ddc95e7eb66c6993bf0f95ac1,False, bugfix put sandbox store created avoid uncontrolled sandbox container signed starnop starnop 163.com, , ,None
430,https://api.github.com/repos/alibaba/pouch/commits/e110aa9397b154ce031c16aa08ee7df8d669914b,False, test add new checkpoint signed alex jia chuanchang.jia gmail.com, , ,None
431,https://api.github.com/repos/alibaba/pouch/commits/4ff1fb2d6579937351b40b0492f986cdb6ebe85a,False, test api_ports_test add new checkpoint signed alex jia chuanchang.jia gmail.com, , ,None
432,https://api.github.com/repos/alibaba/pouch/commits/181ac0f57b3985cc61a1633eb506f9badc273ad4,False, test add new checkpoint signed alex jia chuanchang.jia gmail.com, , ,None
433,https://api.github.com/repos/alibaba/pouch/commits/f53196f9c263541baafa4d2ac4aea93cb2bf91a5,False, output log install criu test alway hang installing criu thing time ago add log make sure blocked see 2298 signed ace tang aceapril 126.com, , ,None
434,https://api.github.com/repos/alibaba/pouch/commits/b2542f1376d667886868028120f2347ab8e07ab3,False, doc auto generate pouch cli doc via code signed pouchrobot pouch dev list.alibaba inc.com, , ,None
435,https://api.github.com/repos/alibaba/pouch/commits/221e84287a0d1c75ad00c64538d9656221765e0d,False, enhance add retry helper method trylock ctrd maybe hold lock concurrent request might fail serve request frequently case pouchcontainer retry specific duration reduce number failed request signed wei fuweid89 gmail.com, , ,None
436,https://api.github.com/repos/alibaba/pouch/commits/f417382cdeccad9402d904680a647b9303366a2c,True, merge pull request 2320 zhuangqh refactor minor refactor several change,https://api.github.com/repos/alibaba/pouch/issues/2320,size/M,None
437,https://api.github.com/repos/alibaba/pouch/commits/16971f112391e87d1f6a772c603e962889253c2f,True, merge pull request 2253 ace tang package add bash completion file rpm,https://api.github.com/repos/alibaba/pouch/issues/2253,size/S,None
