No,Sha,Valid,Message,Issue-url,Tag,Category
152,dad0aa1ea50f4e01cb472450bd76796756191bd3,False, swift package manager suppress sandbox exec homebrew crucial due homebrew use sandboxing travis remove make clean var certain version swiftpm library longer necessary restores previous behavior partial revert, , ,None
153,9b009cb408afb08e3b32d234adb7a8ee5f1be627,False, remove library dependency swiftpm llbuild reinstate struct bug tool swiftpm package resolution resulted disregard crucial resolved fileâ resolving branch based dependenciesâ¹ would put position needing commit apple swift package manager specify dependency apple swift llbuild branch based style also criterion working swift 4.2.x manifest compilation _and_ working swift 5.x manifest compilation commit apple swift package manager could found addition confusion around llbuild sqlite3 linkageâ² made criterion even confusing note initializers method struct difference previous incarnation found v0.33.0 reinstate struct callsites codebase test removing longer necessary import struct foundation.url removed import spmutility makefile remove complication previously supported llbuild sqlite3 linkage working swift 4.2.x compilation necessary support building macos high sierraâ³ homebrew bottling infrastructureâ http github.com apple swift package manager pull 2197 http github.com apple swift llbuild commit diff l10 http wiki http github.com homebrew brew blob 7dd0466 library homebrew mac xcode.rb l18, , ,None
154,c570cf47273aa80ef1b26128c8032b849b83c186,False, add workaround swift 5.1 compiler crash credit michaelmcguire contributing fix, , ,General
155,37850ac2d03eaf86ff77ccde9e0fc007da999b69,False, user named travisâ case insensitively return early rather expose test flakey interference currently seen exemption somewhat heuristic applies broadly xcode environment swift package manager environment others additional discussion visit http github.com carthage carthage pull 2862, , ,None
156,55e416a9905b3541153aeb24312334aba06259db,False, fix fetching race condition 2832, , ,None
157,68abf2d73791720457f5be1aab4b57df86483f88,False, improve submodule performance use submodules used 2795 add force parameter clone submodules cache avoid direct git recursive submodule update use cached implementation recursive submodule cloning move git irrelevant part cloneorfetch git.swift back project.swift add function move function, , ,None
158,60aaf683dc4e5d446c2b64704e7c02b80de45ba3,False, fix building spm 2823 adding direct dependnecy llbuild, , ,None
159,b8f21b7f8a5056df3be154c6240f1b82eb41359c,False, remove pipe carthage outdated step 2830, , ,None
160,1e72bd389c02ab2641e353f02c9e513262d59d57,True, merge pull request 2809 kalkwarf bugfix concurrent dsym stripping bugfix concurrent dsym stripping,https://api.github.com/repos/Carthage/Carthage/issues/2809, ,None
161,e80d6706797d97bd4a8cba8a14ab8a1d5688540f,False, renamed argument filtered identical framework, , ,None
162,b465ba1369cafc4fcf258867093e13f863f793a5,False, added additional information error, , ,None
163,a90f85126976561ae3440026853723793a3ce449,False, fixed typo, , ,None
164,e41076782bed7b3609a53f4662480058a65e9a4e,False, add character asciialphabeth 2806, , ,None
165,f622fafbec25ba3aaf7acbb1ddd1da2098cde8a6,False, add .xcfilelist documentation 2798, , ,None
166,7cb0e6ab571f0ce32e9f94bf9a24cb80371be226,True, merge pull request 2800 blender fix build carthage swift 5.1 update code swift 5.1 compatible,https://api.github.com/repos/Carthage/Carthage/issues/2800, ,None
167,6375e0203172eb19cd46c672fe564bf67de02609,False, update code swift 5.1 compatible, , ,None
168,2942fbcfe8c801e555884b5270c9520d81e5db36,True, merge pull request 2797 carthage update deps swift version update swift version 4.2 necessary dependency update,https://api.github.com/repos/Carthage/Carthage/issues/2797, ,None
169,d67249392b4d9c0ea3f5d02f2bb2653d2d882b11,False, suppress warning, , ,None
170,5d301bf111a3ecc72059e3f089a9dbd6ad2b8a6a,False, update swift version 4.2 necessary dependency update, , ,None
171,fd3c9d9454e97c8bd10018bb37476c7fad403ee3,True, merge pull request 2796 kalkwarf bugfix 2788 bugfix 2788,https://api.github.com/repos/Carthage/Carthage/issues/2796, ,None
172,a217a583375b8461055fb56346b94eae3d2b3d63,False, added comment explaining weâ working tmp, , ,None
173,2d066f0db1a12761aa3bc12e328802c56aba07c0,False, self.base filemanger, , ,None
174,e30998c5756929d736b195982191cc6f3c7ed980,False, nest call, , ,None
175,e43ad4d69ae4e97511ca639667926dcfe25ff5e0,False, use default filemanager instead private instance, , ,None
176,80fe44dde33e4df521528a57ce318c56cfa47410,False, simplified logic multiprocess safe lipo, , ,None
177,483d4328f6ca5b7f7760d4cf27b91643442e4451,False, reject invalid archive fix 2791 reject archive containing duplicated framework name authored florian fittschen ffittschen gmail.com, , ,None
178,0acf9e1251c03ed9d600a93260f4aba6e203261b,False, modify package atomically, , ,None
179,e5cc68d29d33760769291ba346caa04ff8b396af,False, reject archive containing duplicated framework name 2765, , ,None
180,a74e0fcd24af903d78b0b43d6c36af5a9f1ec4ef,True, merge pull request 2784 carthage lint detect carthage typo swiftlint add custom rule detect possible carthage typo,https://api.github.com/repos/Carthage/Carthage/issues/2784, ,None
181,fc0166b4827736bac2c804fc928797f1a742c455,True, merge pull request 2785 carthage address lint violation address swiftlint violation,https://api.github.com/repos/Carthage/Carthage/issues/2785, ,None
182,c860edbdbb4b45ba4f8504dd64ef6f15352288a1,False, import struct, , ,None
183,86e5c08bbc67f7a6efc255ea845047a2a28ee0da,False, swiftlint address violation, , ,None
184,d4b72feedac970ec53cf8a87ca8c221d83790986,False, swiftlint address violation, , ,None
185,fb52e07071fb26b1b888c31a31961f4fecde5458,False, swiftlint address line_length violation, , ,None
186,caf654674d7625d0b0d3f2091cff146311372667,False, swiftlint address violation, , ,None
187,743c886a7c529d2ca5ae5f2756fe1f2329b47c20,False, swiftlint add custom rule detect possible carthage typo, , ,None
188,386fbf3ee5e53c3b7c033cbdae26a9dadd4bda0e,True, merge pull request 2781 sstadelman master resolve 2780 resolve build failure projectspec test due swift_version,https://api.github.com/repos/Carthage/Carthage/issues/2780, ,None
189,f1810b274d1c005458204a8a68d68563e9cff72c,True, merge pull request 2766 heliotropix outdated pipe error devnull update readme pipe carthage outdated error dev null,https://api.github.com/repos/Carthage/Carthage/issues/2766, ,None
190,5ac5d4dd994580706f9827a091db948babf18a77,True, merge pull request 2776 hlineholm hlineholm copy incomplete dsyms copy dsyms incomplete,https://api.github.com/repos/Carthage/Carthage/issues/2776, ,None
191,a6039ec1f1ca2c28a6268d1186699e751a5a3dcc,False, resolved build failure projectspec test, , ,None
192,8fbe84176164077a4fa00767ea4f882014713be8,False, correction previous commit modifying carthage outdated command, , ,None
193,1c32a7cb72cf2219d3938d264665433d48126167,False, check dsymids frameworkids joint, , ,None
194,dae36671bf444aad0338878523a54c8c255b42e1,False, readme building 2778 command carthage update platform macos otherwise build framework platform well also change macos, , ,None
195,70f5b2c51c78fb5440155346063f792347c893d9,False, update readme small addition command run carthage outdated error network connection causing build xcode fail change pipe error dev null silencing warning allowing build succeed, , ,None
196,0b66cef4046a196cf04f39877b541f7102725e80,True, merge pull request 2761 giginet use hasher avoid warning xcode 10.2 carthagekit,https://api.github.com/repos/Carthage/Carthage/issues/2761,enhancement,None
197,945f80f33df75c0a9a315761e50babe84e8eed98,False, avoid warning, , ,None
198,c8ac06e106b6b61f907918bfb2b7a5c432de4678,False, bump version 0.33.0, , ,None
199,87e2198888e9db788255b6cdfb32ff454364923f,True, merge pull request 2741 carthage revert authorization header redirected request revert passing authorization header redirected urlsession request,https://api.github.com/repos/Carthage/Carthage/issues/2741, ,None
200,0ebf70ef8a981395f352cc3f88d11929b2607c4b,False, swift package manager homebrew pas disable sandbox flag homebrew might enact sandbox see http github.com homebrew brew blob db02f93 library homebrew sandbox.rb, , ,None
201,3aad8e7985a38244627d6349069097db2d0fd06f,True, merge pull request 2748 victornouvellet bugfix swift header file sim macro fix merging swift header file xcode 10.2,https://api.github.com/repos/Carthage/Carthage/issues/2748, ,None
202,bd7e987ed1b1772b1fa331cdd1a68622e8eca367,False, add missing include directive add missing include directive definition include needed authored mert buran buranmert gmail.com, , ,None
203,a2593c97f5c310b0402165266d33d1e3f0e0ac72,False, add missing line end file add missing line end file remove newline end file llvm warning, , ,None
204,d2133a380b03184f65568945c96bfcdb5c45ed43,False, revert pas authorization header across redirected request reverts commit, , ,None
205,bbf5b719c86d6c30a97ec7997a7636f2f9e3b4ec,False, revert pas authorization header redirects within github reverts commit, , ,None
206,f7f9bf1c019529ccffdf5bc9e2ec774f33c8f5e3,True, merge pull request 2740 jdhealy conform xcode 10_2 swift stdlib static library swift package manager accommodate swift toolchain without swift_static directory standard library,https://api.github.com/repos/Carthage/Carthage/issues/2740, ,None
207,52d0bb3f8471bef5dc0aeb0cb4762ed773ce0202,True, merge pull request 2739 jdhealy update resolved prettycolors curry update resolved prettycolors curry,https://api.github.com/repos/Carthage/Carthage/issues/2739, ,None
208,427ed023deefd2b88bc983f1d71770f996e8af90,False, swift package manager accommodate swift toolchain without swift_static directory standard library toolchains swift 5.0 development snapshot 2019 still contain usr lib swift_static directory xcode 10.2 bundle swift package manager maintains compiling swift standard library executables statically default http github.com apple swift package manager commit, , ,None
209,499c2622d87ff5e4ddd1b985d8b2ed9bad888a89,False, update prettycolors v5.0.2, , ,None
210,c51bc12d693eb5262210a8874cd746e1374f7daf,False, update curry v4.0.2, , ,None
211,5879be2b7c5af2a8ae62691de2c4cff27d318e01,True, merge pull request 2723 shepherd dog bugfix add functionality merge swift header file,https://api.github.com/repos/Carthage/Carthage/issues/2723, ,None
212,3c823780b7daf0f24b9409b236f0e11ca27007f4,False, handle situation file able created, , ,None
213,51a007a4abbb389ef8d704a0c48dd0acdbac7eec,True, merge pull request 2734 jlawton ssh batch mode use ssh batch mode git attempt prompt user hang,https://api.github.com/repos/Carthage/Carthage/issues/2734, ,None
214,d21c86d642a33ec6a002f11e4c7249ba22a78e8a,False, refactor code use conditional based upon whether target simulator provide consistent behavior across xcode swift version, , ,None
215,ee27f9e0de26f5a823d6a6c9fb85fe98c66fc57c,False, force unwrap optionals since would nil due programmer error, , ,None
216,6c6e150a2de78d353f332c823a67bf49086b7584,False, update name framework, , ,None
217,88548450baf75a1fc851db75fa502f2f30581fc0,False, merge branch master bugfix, , ,None
218,34db22ce1ea461462e598a4104b40a7946c901bf,True, merge pull request 2720 carthage use specific swiftpm tag use specific swiftpm tag,https://api.github.com/repos/Carthage/Carthage/issues/2720, ,None
219,693e3b1f1acb95bb95df804b610739b41c219682,False, use ssh batch mode git attempt prompt user hang, , ,None
220,52ae54af2e7c534c530245514cf6f6d8ddeafc99,False, add todo comment get merged yet, , ,None
221,a2f889f5444e12b1118f2fe5b4c5d39f8b2c4d9d,False, change space tab, , ,None
222,d26c484222e9685841dc189fcfcca35b9ff85aeb,False, clean code based upon feedback code review, , ,None
223,4dca4bf177a9be2bbf1be798b20b697647bd4605,False, add functionality merge swift header file resolve issue swift different architecture conditional block swift header, , ,None
224,52e2cf9c7a4bf04c0f1a0c8f32ffa35f2eed5786,False, fix result deprecation, , ,None
225,433a6f077c118ee7192edd2c4a2c2790752d63bb,False, use swiftpm tag instead master, , ,None
226,c47beba3e243ca8ba4d85065ae9da9279a3043bf,True, merge pull request 2707 openium fix 2677 version objc framework make optional objc framework,https://api.github.com/repos/Carthage/Carthage/issues/2707, ,None
227,602e99905e95284fde8d1f472bf6fbd622c1cfcf,False, make optional objc framework, , ,None
228,660183242837a6c75ee3b38b0ede16c6ac015094,True, merge pull request 2713 nxsoftware redirect auth pas authorization header across redirected request,https://api.github.com/repos/Carthage/Carthage/issues/2713, ,None
229,df04aa86731811ea1f82e05363af37503d97f5c3,False, pas authorization header redirects within github, , ,None
230,444224eaac53c37a9549733b434f3de181f3d836,False, pas authorization header across redirected request, , ,None
231,1c3e23a3dffc7f19ccd6dd8073454bb39fdfafa5,True, merge pull request 2704 franklinyu doc readme mention macports readme,https://api.github.com/repos/Carthage/Carthage/issues/2704, ,None
232,c02694137f0b59c56c7153382f2bfd1bfee9ad8e,False, mention macports, , ,None
233,0c4c64916f9505fd7fbcded6001e83915c572ecf,True, merge pull request 2617 cosynpa tree fix tree issue,https://api.github.com/repos/Carthage/Carthage/issues/2617,enhancement,None
234,4937add2db22db23a76cbb9495a33acb886c91b6,True, merge pull request 2696 shepherd dog xcode beta fix backwards compatibility fix issue carthage find simulator using xcode 10.1 installing 10.2 beta,https://api.github.com/repos/Carthage/Carthage/issues/2696, ,None
235,1840b7c2bbc91ca2e3872972e8573db189a77a6e,False, make change clarify test context, , ,None
236,88c64b0049b908cc624b1938c17fdd7cecaa3f33,False, rename context describe intent clearly, , ,None
237,c40b7bf765d19be45a14944802821667a97166ae,False, make recommended naming tweak, , ,None
238,435c562a39f3714e9b0f71c008bf07dac4d83d95,False, fix tree issue, , ,None
239,6f7eac225d73c8477f53bd8b77f43abba0d90982,False, add test data test, , ,None
240,2edf04ed60a9fd18c44daa9379586050513e321b,False, make recommended code refactoring make thing little efficient, , ,None
241,a63eeb8eb5e923389194f07d3abdf0520d656f27,False, refactor code find sdks available device, , ,None
242,8a288534e8f5dea7fea1473b82f9bcf5d87a0395,False, fix issue latest version set simulator version unavailable, , ,None
243,803941b858c1c1351ccc1c4e1fa1b6028ea2d8b6,True, merge pull request 2693 kmcbride xcode beta add xcode 10.2 beta simulator support,https://api.github.com/repos/Carthage/Carthage/issues/2693, ,None
244,1496dfd79b998fa1532bda654309d1bb2e348eaa,False, convert space tab, , ,None
245,4b97f37c3e2d1cb2d0d6177031aaec7ef05a5e36,False, refactor simulator platform version parsing, , ,None
246,a34dd02fd68a961517e74e8ef1b93e8637d820e5,True, merge pull request 2695 mxcl make xcodeproj fix contributing make bootstrapâ instruction,https://api.github.com/repos/Carthage/Carthage/issues/2695, ,None
247,79fe469e6e5fe2a972301532376756dc91d767bd,True, fix contributing make bootstrapâ instruction add make xcodeproj line generates working xcodeproj extra work required libswiftpm see http github.com apple swift package manager tree master example package info fix 2692,https://api.github.com/repos/Carthage/Carthage/issues/2692, ,None
248,29cd24ac185baf7eb0ac8ea3abbc388304990b0e,False, update simulator test, , ,None
249,3d050d29165096774d2236c3bc067eabf6bf6679,False, add simulator test resource xcode 10.2 beta, , ,None
250,b7575b59c26f18a8c4ca9d99b2abacbc5d833049,False, fix validity simulator test resource, , ,None
251,f1f7b5cec242fe2dae7d7f9e99c44088eb154d72,False, normalize simulator platform name add support xcode 10.2 beta reformatting name match previous version 12.0, , ,None
252,0c3bb67d8251a29e6ded96569f61d690af148ca6,True, merge pull request 2689 divinedominion patch add link binary specification json,https://api.github.com/repos/Carthage/Carthage/issues/2689, ,None
253,83fae063fc1b91b7eca75f99f094e3b380e8eaa1,False, add link binary specification json, , ,None
254,a5f34f431c3fb735826ccd016318c73bbf33273c,True, merge pull request 2670 carthage use version swiftpm use version type swiftpm,https://api.github.com/repos/Carthage/Carthage/issues/2670, ,None
255,16a8c72faf8b343e433bc433dfe4612fb88e5d34,True, merge pull request 2678 salbertson patch add reviewed hound badge,https://api.github.com/repos/Carthage/Carthage/issues/2678, ,None
256,ea07bf3607b561bf0313d7b05941607e73cf7597,False, add reviewed hound badge, , ,None
257,1ce8c6241bbfcc74c7b08b1b829c28bf8255bbd4,False, test newer version, , ,None
258,507c221cef19e950a3413a81ddbd9158b199dad0,False, update quick nimble, , ,None
259,5582595ac42ab93d8b633113f872b19cfa222bd6,False, drop xcode, , ,None
260,a8f42b077d262c441ea8e3a9d4a32f60b50eed63,False, use version type swiftpm, , ,None
261,c31b3f5261d9ac1927ad26cb0543f9202bec1a39,True, merge pull request 2672 carthage remove xcodeproj file remove,https://api.github.com/repos/Carthage/Carthage/issues/2672, ,None
262,5f71fe82b7ce7a54f39fb12b9d1027ef5cca6679,False, remove, , ,None
263,db9f656d55f23f39a7359702f961c7d45ec117ed,True, merge pull request 2665 carthage build swiftpm build swiftpm,https://api.github.com/repos/Carthage/Carthage/issues/2665, ,None
264,79ddcacc92955e1d979f18754bef6006b81a220e,False, build exclusively swiftpm, , ,None
265,2514c75d4fd5382649d891f8701f7a59e4cfb79a,True, merge pull request 2664 carthage build swiftpm without specifying deployment target build swiftpm without specifying deployment target,https://api.github.com/repos/Carthage/Carthage/issues/2664, ,None
266,d947ecbeb6de80cba257def5979405f0ba59e999,False, show error input file list readable 2668, , ,None
267,2d03af8b94e83843cff0be2fcb539f37ed20d18c,True, merge pull request 2667 carthage clean model type clean model type,https://api.github.com/repos/Carthage/Carthage/issues/2667, ,None
268,b432ed64f602db7dbf41152a84f8dc5d64811fce,False, older version swift synthesize semanticversion hashable, , ,None
269,46474fd7dc610e7beaa25e9df5698e7aaa52ddcb,False, support older version xcode swift, , ,None
270,7baa4b91859fd63688a4b5214f5f6c6651b6bc79,False, use synthesized equatable hashable implementation, , ,None
271,6ca6953bcd7e7e68a40097135db8835f7b029cb0,False, remove unused versiontype protocol, , ,None
272,35e382912e5f62968a9074f4f283860f17671c86,False, build swiftpm without specifying deployment target, , ,None
273,0aee76db5e5172edb1c618e4d303acfd1af741c2,True, merge pull request 2636 blender fix current version file produce .version file current project,https://api.github.com/repos/Carthage/Carthage/issues/2636, ,None
274,e0a6272db0b5ecd1046045a871edb28eedf7f265,True, merge pull request 2660 musbaalbaki fix typo fix typo lauch launch readme.md file,https://api.github.com/repos/Carthage/Carthage/issues/2660, ,None
275,e4773a802f92b6946042dc15e57a7541ff987024,False, fix typo lauch launch, , ,None
276,0d6800165ea28821e04a0da63e445477058ef490,False, merge branch master http github.com carthage carthage fix current version file, , ,None
277,252c171f8c8d8427e6d748e3cded20f9e8f826a3,False, default origin present, , ,None
278,a89a5e52860a68277d47153c60f14d586607abee,False, guess name current reporistory based popularity remote url, , ,None
279,8e3bbdc2f3e5742862e9ca7014f7b5cff770e9ff,False, produce .version file current project, , ,None
280,19e5e558a48d7ce0a0913a4379a5e391acf763b7,False, remove existing item git cloning submodules 2654 fix error try switch using submodules, , ,None
281,dc2fb36fa2a91d5876442001ae0af530764ddbc2,False, cartfile reject git ssh protocol github origin doe make sense, , ,None
282,9b80722a348930f4608aec81591f220f996b88e4,False, sync submodule content, , ,None
283,014f01908bccbd2f16ebd7c57fc62cf1579fba07,False, sync submodules submodule directory otherwise submodule syncs submodules project using submodules large number dependency may large number submodules save quite bit time, , ,None
284,c3f09cec080649e7dd791845b3eae842c18217c5,False, delete zip archive creating new one, , ,None
285,491a80fd52a9085e85ad4ac5da45c543a0b74696,False, add xcode version information versionfile 2585 add version versionfile fix test case rename store swiftversion framework use fix parsing tweak tab width rename fix errormessage, , ,None
286,8baaf5a60d8e2c701d3deb4526d5ecc57c4039cd,False, check dsym swiftlang clang version, , ,None
287,6f2ed77cb5330f8352262b7b2425325bd26f92b6,False, remove existing item git cloning submodules 2654 fix error try switch using submodules, , ,None
288,42b55b381ce77df1ac5939040ccb748f0dfdbf51,False, cartfile reject git ssh protocol github origin doe make sense, , ,None
289,368a13ea6e3e30b22c007cb2be1906f7dc92f055,True, merge pull request 2643 carthage sync submodules individually sync submodules submodule directory,https://api.github.com/repos/Carthage/Carthage/issues/2643, ,None
290,bcdc283c10cd18237abb20b07c204a14cccfc6a3,True, merge pull request 2648 blender fix issue 2641 acrhive zip update issue 2641 delete zip archive creating new one,https://api.github.com/repos/Carthage/Carthage/issues/2648,archive,None
291,b2de7403583f2be91fa776aa270f2e0c691275ff,False, delete zip archive creating new one, , ,None
292,da14bf65a97d5af3e5eee418d64df8428b99b435,False, add xcode version information versionfile 2585 add version versionfile fix test case rename store swiftversion framework use fix parsing tweak tab width rename fix errormessage, , ,None
293,325b9d12c6eb52de0a9a52da50759a3e0822fe17,False, sync submodule content, , ,None
294,35890bd386ec09dff5f15a0b66538fd8b496574d,False, sync submodules submodule directory otherwise submodule syncs submodules project using submodules large number dependency may large number submodules save quite bit time, , ,None
295,2b5fe84ddaf28eff2a89bbc0d7830fb733328a17,True, merge pull request 2622 blender fix issue 2619 cache build fall back get swiftlang clang version dsym,https://api.github.com/repos/Carthage/Carthage/issues/2622, ,None
296,d29c3fe3d7e9bdc8a65405b90d99397836c1e191,False, update code style simulator decoding 2633 update code style simulator.swift update simulator decoding match former behavior, , ,None
297,8dea448b9b2814dadb6130dbf8bae4171487dd69,False, bump version 0.31.2, , ,None
298,c6278ee0d539bca5099063ef50202a1c18b849cf,False, test xcode 10b61 simulator json output accurately reflect apparent key including availability key order may match, , ,None
299,8fa83d5230afcfff74ceadd8995d3686048259de,True, merge pull request 2630 olejnjak fix xcode10.1 fix available simulator simctl json output parsing changed xcode 10b61,https://api.github.com/repos/Carthage/Carthage/issues/2630, ,None
300,c7f292da537bb58b92610fd5faf593a1b888ba3a,False, revert revert revert cartfile reject git ssh protocol github origin doe make sense reverts commit, , ,None
301,492e4abb76cb58c12f33b077a2522be66e921062,False, fix xcode 10.1 available simulator, , ,None
302,0f561eeeab04fe9ef646ea0c4cc8a167967292b7,True, merge pull request 2625 artemnovichkov copy framework description update function error copy framework reflect file list support,https://api.github.com/repos/Carthage/Carthage/issues/2625, ,None
303,0e2cdf721c71139edfe3bf0689c34b2b6ce876bd,False, update function error copy framework reflect file list support, , ,None
304,4dcb39b797b270e2cc67a2101227cef1057c3c9d,False, merge branch master http github.com carthage carthage fix issue 2619 cache build, , ,None
305,380d492480a785c706e15c3d2527a881ed8fcbf3,True, merge pull request 2624 carthage fix warning fix warning string interpolation produce debug description,https://api.github.com/repos/Carthage/Carthage/issues/2624, ,None
306,d8514cc0f2f628669b7b7c412593712967fb5887,False, check dsym swiftlang clang version, , ,None
307,ee21c325481451ce578d0efef89b034efe1fbb76,False, fix warning string interpolation produce debug description optional value mean make explicit swift 4.2 xcode, , ,None
308,38062d1c55b1d283478fa8abf43812155ea08e50,False, revert revert cartfile reject git ssh protocol github origin doe make sense reverts commit, , ,None
309,784cd382ea7440c34a91b19adb6ae0c4d5f9dcbc,False, bump version 0.31.1, , ,None
310,899d8a5da15979fd0fede39fe57b56c7ff532abe,False, pad modified header appease homebrew homebrew version 1.7.6â¹ pass ldflags enable use use swift via xcodebuild other_ldflags needed least temporarily placement other_ldflags xcodeflags change formula carthage 0.31.1 published homebrew stay order enable brew install head carthage fail inreplace http github.com homebrew homebrew core blob 85ea337 formula carthage.rb l19 l22 match everything line preceding space other_ldflags formula carthage 0.31.1 remove inreplace see http github.com homebrew brew release tag 1.7.6 see http github.com homebrew legacy homebrew issue 20233, , ,None
311,3997478a4070a069fbc2eca130a66878431d4968,False, revert cartfile reject git ssh protocol github origin doe make sense reverts commit, , ,None
312,7b82783c026ba37a4387b1d94f720f8395e5581c,True, merge pull request 2606 giginet support xcode101 fix issue find available simulator xcode 10.1 beta,https://api.github.com/repos/Carthage/Carthage/issues/2606, ,None
313,a06c13bcb7bab9f1d0b17d90891500099b681c29,False, add test parse unavailable simulator, , ,None
314,2d4f8d232374370edb9166811fcf277c715add9b,False, add test parse simulator xcode 10.1, , ,None
315,41bc72983da84bde2f1d75dd9c8571fa098df988,False, support simctl xcode 10.1, , ,None
316,d34dad5852eabd70ca26d613e6afc8fec369148d,True, merge pull request 2601 carthage validatespec dictionary order validatespec rely dictionary order,https://api.github.com/repos/Carthage/Carthage/issues/2601, ,None
317,3930515cdb8a6d0ccb6cf94e4f265359cb34988a,False, validatespec rely dictionary order problematic especially swift 4.2 later, , ,None
