No,Sha,Valid,Message,Issue-url,Tag,Category
318,58b703f45e8dca867085c8c255bc4fcf3d092129,True, merge pull request 2586 giginet swiftlint support houndci,https://api.github.com/repos/Carthage/Carthage/issues/2586, ,None
319,3d49236912c69964d298ab5466bcaf89dc22ad55,False, add .hound.yml, , ,None
320,7ff04f7836140d832794e307f5b3243714242e00,False, disable swiftlint travis, , ,None
321,733e9a89f75da6d6900aa3469bbe8fb064d7999a,True, merge pull request 2569 carthage reject github deps non http scheme breaking cartfile reject git ssh protocol github origin doe make sense,https://api.github.com/repos/Carthage/Carthage/issues/2569, ,None
322,99e09de67a1b7d6447619918eb20289ff5e55a42,True, merge pull request 2591 xcfilelist add support .xcfilelist file copy framework,https://api.github.com/repos/Carthage/Carthage/issues/2591, ,None
323,04994e9e844d53220d8796a648a7dad12a5808c9,False, bump version 0.31.0, , ,None
324,b768a76da2dc1c095a8b159aca42fc68de8d01c9,False, add support .xcfilelist file copy framework, , ,None
325,c8d71b7d18862bc9538d85e42bc822f1cafbf39b,False, execute make lint travis, , ,None
326,14d899a0bc312d5ca6767849071d49feb360db5e,False, add lint task makefile, , ,None
327,10f521a4e43b15bfdb3ba92e95d157f86375fc03,False, fix error, , ,None
328,dde07fb7268bfb464d27c94c4d25f14121d509e4,False, apply swiftlint, , ,None
329,9192623a0487dd88e855ca1df91cb11249b8b695,True, merge pull request 2574 carthage refactor buildscheme refactor buildscheme bit,https://api.github.com/repos/Carthage/Carthage/issues/2574, ,None
330,037f7c19836ab4313383da71dfb2cfadc6e2efa9,False, refactor buildscheme bit replacing collect isempty check take first, , ,None
331,30ff52d85d58a69b0d94dd72e9df55c831c4cc36,True, merge pull request 2571 carthage remove swift 4.1 shim remove unnecessary swift 4.1 shim,https://api.github.com/repos/Carthage/Carthage/issues/2571, ,None
332,794f1c26ba4904ae1c579ba031b8c3dcaad7869c,False, remove unnecessary swift 4.1 shim, , ,None
333,a4d61d60ed691351703c02fe1ec854c9acd6e692,False, cartfile reject git ssh protocol github origin doe make sense, , ,None
334,4c58c721bf1f4a674e0a2c98ffb16c572272d837,True, merge pull request 2538 carthage update dependency breaking update dependency,https://api.github.com/repos/Carthage/Carthage/issues/2538, ,None
335,28d7070bfca26e708bf968efa24f1daf64c4a044,False, update nimble 7.3.0, , ,None
336,59cc98000ef3e523ffc19c8888161c7eb9cb0378,False, update tentacle 0.12.0, , ,None
337,1af44a2d428e30ba07bc170fee8485e2261a35ef,False, update reactivetask 0.15.0, , ,None
338,b549ec69642477f851b269cd0e5de44ae23e1d7d,False, update readme reflect build requirement, , ,None
339,f682676b211b43ae0b196959bc7de214369fb187,False, wip update dependency, , ,None
340,cedbe9eed529bae22aa0620f0483a7be6e50329c,True, merge pull request 2561 giginet improve parsing device breaking fix issue package watchos built xcode beta,https://api.github.com/repos/Carthage/Carthage/issues/2561, ,None
341,fd9ef3045b6811f2b69ca8577388a91c95357bde,True, merge pull request 2551 jasonboyle symlink binary symlink build folder binary downloads,https://api.github.com/repos/Carthage/Carthage/issues/2551, ,None
342,0c974f2ad6005aaf0703da52673a21c0bbc23653,False, remove unused initializer, , ,None
343,0585faac2d341503e172e35115a969321a4e5438,False, use semantic version, , ,None
344,78d54306953a0413fa15de77aa29ff7e3f11c76f,False, remove unused test, , ,None
345,b662808d6a4065f17b0851564ee3664d57ef45b7,False, merge remote tracking branch origin master symlink binary, , ,None
346,114805fc451d5074874414d2b7ceb0f65ea9d436,True, merge pull request 2563 martnst patch update readme.md,https://api.github.com/repos/Carthage/Carthage/issues/2563, ,None
347,f42c169a788fe3b274eddf2640c57ab453888c8d,False, update readme.md change last two step quick start bullet point actually sub step adding new run script phase extra step, , ,None
348,88d3c81c93c5f59856785212bf59ef00925ed2cb,False, add platformname error, , ,None
349,1899c45f72ac5fd90e8a8f7b399723a52a37efbe,False, avoid using iuo, , ,None
350,47b80ed6ec588280f65fdfd93d9a080d4503b8e7,True, merge pull request 2523 jasonboyle carthage verify proposal implementation carthage validate command,https://api.github.com/repos/Carthage/Carthage/issues/2523, ,None
351,ed4571af9bb64df7a441698f88794b73c84635c7,False, use var empty fake path, , ,None
352,0811ae6d4933c70be51623b804b260285394a491,False, address review comment, , ,None
353,becf74cd29d38b6e229835ef6cff10310d701072,False, fix typo, , ,None
354,9b9331d55240ca48af1f80c36d75fa7a29aa40f7,False, fix test, , ,None
355,04ac9326b7f937f1f1022eb9465546cb16772632,False, rename fixture simulator, , ,None
356,272308782715ea8de0aa18c4d2128c69d2c14156,False, move simulator, , ,None
357,6ddbc087dce3e65e61202fca928f271d0b9465dc,False, add spec, , ,None
358,9e8cc22269a26a76957a43a0937415ce9b0d55d7,False, implement, , ,None
359,7ea10134de8ccf2bdf33a15e033da219de134a62,False, return error simulator could found, , ,None
360,2662f7f94842236e6b038eb41ade850cef4fceb3,False, raise error available simulator found, , ,None
361,0027d118857946f2bd39fc6d645f6b8600080e48,False, fix typo, , ,None
362,abcbd3b08ca154bc6632921f2d6e66817b9317d0,False, fix test, , ,None
363,34dbcdfaf339059ecdf49be7b8cd082e3ddebd6e,False, fix warning, , ,None
364,f99ad6fee6a51ad71a5cf0260b3590cf5a3df383,False, add import, , ,None
365,cee9e8b4e48eeec9eb5b957c6630800223a06af5,False, rename, , ,None
366,042464da2b3ff370e56a3b07f76ebe346bce9cd8,False, search latest version, , ,None
367,228c02308e41a90d6c912743bae04a5d3418a24c,False, add comment, , ,None
368,81f3931b56eefea5d58ecd14db577bb1251fc873,False, improve parsing simulator, , ,None
369,9503e2c07d9f839dfee3601be8ef0a9f471d2d5f,True, merge pull request 2556 sgl0v use binary updated documentation use binary option,https://api.github.com/repos/Carthage/Carthage/issues/2556, ,None
370,89d934eccc7a885ce600d933141c459a10b47316,False, updated documentation use binary option, , ,None
371,204ba2891466c2b02384e509b629e1ca91b68110,False, add comment, , ,None
372,af9bcca707a4e310a79ff2ef0014d3e6d77af526,False, add validate shell completion, , ,None
373,bf49e52b2f8d11d386bce20e563f38ea77221044,False, alphabetize command, , ,None
374,81179318b449c3c40b892d22ff2750ed288b5d79,False, simplify validate implementation, , ,None
375,977d0c59b9de96c7f5c336b8b4a7e6e4682004be,False, fix test xcode 9.2, , ,None
376,3146a0faad9367b942670874e8d111e73c363b85,False, add test incompatibility requirement, , ,None
377,b36fb5520e7f6f57a2cf0ff13283531f0eefb3c3,False, add test invert requirement, , ,None
378,576a245777a5273ea418fec628f54365eacc6cf7,False, add static incompatibility requirement, , ,None
379,c557718c72f096852435380e0be90644a6e5ab4f,False, add typealias, , ,None
380,c763fde3ff47bce8ae74ae7da262ce6ac1c30db6,False, add static invert requirement, , ,None
381,bc7250a88fc6aa2b364ea3ebf754b3ec64d7aebf,False, move filtering incompatible requirement inside signal chain, , ,None
382,de0785d9d7edea9f13f924c2f0f6c8c6e456aa17,False, limit concurrency, , ,None
383,83d584ae480f2acdbf4f5e2da31cf0138e749513,False, generate incompatibility line using functional style, , ,None
384,1b1a6e31095b42fa153b9d049998415c8fe83e4f,False, update comment, , ,None
385,1e27682e95c997d659f500028edf43c9ce4ce4f9,False, symlink build folder binary downloads, , ,None
386,2cc9f887ae45afef63db7ae30f71c55db917072b,False, change verify validate, , ,None
387,12daa87fa69c8709f93d495b07d86bdfd6e78a19,False, merge remote tracking branch origin master carthage verify, , ,None
388,c0fd5f7beda7fffc2ed385d242598ec6d62fe4e8,True, merge pull request 2546 sebastian hojas version_timeout use different queue version check timeouts,https://api.github.com/repos/Carthage/Carthage/issues/2546, ,None
389,0ef5b3606fbffededff7c7dc375aaf74f0314980,False, update documentation make remoteversion generic, , ,None
390,cfc5ac140fc95db7a03bcf46839fac67ce5850df,False, abstract logic fetch remote version carthagekit, , ,None
391,88bc28ee2aa8ac73c0e8754016ed72b8d34d50d5,False, rename buildversion remoteversion, , ,None
392,a0abb1f2af46e528302cfc227540c1ccf682e92a,False, use different queue version check timeouts using first queue cause timeout event never executed, , ,None
393,8ad4a555433835a5b88f25fc441af7fd0d3d3d7c,True, merge pull request 2548 carolanitz master archive add supported pathextensions untar,https://api.github.com/repos/Carthage/Carthage/issues/2548, ,None
394,af7e5850a29a63f6dd9c5bb3356f3296af81011f,False, archive add supported pathextensions untar, , ,None
395,bfb5580d96758a21ee1627a168cc89e35d2b16ae,True, merge pull request 2542 carthage bundle executableurl use instead object,https://api.github.com/repos/Carthage/Carthage/issues/2542, ,None
396,c8aca2f3a10d6ffb72a95f2e2e2b2989a1c9c0ee,False, use instead object, , ,None
397,04402c731b4ee8b7c9e829e7472613ef9af8e8e0,True, merge pull request 2537 brentleyjones doc copy framework warning doc add warning use copy framework non application,https://api.github.com/repos/Carthage/Carthage/issues/2537, ,None
398,4e854b8e15955b60d5b17460f64f19ef6d3eae5b,False, doc add warning use copy framework non application, , ,None
399,01fcd25e8c71f2bc16be132a98cb2f03d1caa7ee,True, merge pull request 2535 carthage swiftlint fix swiftlint fix various violation,https://api.github.com/repos/Carthage/Carthage/issues/2535, ,None
400,aae2091e3480fb5afd1e8b53140911499f10bbc5,False, swiftlint temporarily disable rule, , ,None
401,315fba68f4e57e37d3ab11a0774df084411f51cf,False, add .editorconfig http taylorhakes.com post github tab formatting, , ,None
402,6fd9e2aac9631f52ba9231038fea2e5220d0afe9,False, swiftlint fix various violation, , ,None
403,0e7fac7c1ee4aa8f423792b2e7612ba339234236,False, swiftlint fix nesting violation, , ,None
404,af488294615af94c20bc9a4dea8ca1b50f499ab5,False, swiftlint fix violation, , ,None
405,4a366ad9a15bac0d4750053d686ba7aca49166cb,False, swiftlint fix violation, , ,None
406,d55a231acd6c51e8064feaa9f1b775ebf80a43fe,False, swiftlint fix opening_brace violation, , ,None
407,956501ecb38fc1c0209ed1948366ddfe7812b068,False, swiftlint tweak rule warning threshold, , ,None
408,3a9d67d12e77830c368dc804f2b0360f3e73f9b2,False, swiftlint rule doe work well tab, , ,None
409,00cd36495365a6dea9615885f3a5ccc640dcef3b,False, update comment verify, , ,None
410,9101cf82ab37ce3f886c35f34f6a84034d6d1f74,False, clean, , ,None
411,93125205e462771822e61ce93d25ecf2b57009d5,False, clean test error message, , ,None
412,e1fafd729f7e1a5c7b13c1a3df8fafb04da81607,False, fix bug verifycommand, , ,None
413,92d20038c1cacdbbdd77d20f6a8f167c7a4249df,False, rename update comment, , ,None
414,b71e29136472ac2ed6c8a9ccfbca16ae1c124286,False, convert tuple array dictionary, , ,None
415,2fb7565c4f52f120ce676d6129bacc3b3787bf91,False, rename requirement, , ,None
416,5c72cefbf3f6dd259c8527645c228af39dafd1dd,False, clarify verify command description, , ,None
417,60fa3f698259eecf8cf9ca6482058811075ef2b4,False, rename verifyfailed, , ,None
418,3927d9c52c960f3ca3398874ff722b852e8ce94a,False, make resolved cartfile required parameter, , ,None
419,359983785824d848b8067a6493623f6d041b23d3,True, merge pull request 2527 carthage swiftlint autocorrect swiftlint run swiftlint autocorrect,https://api.github.com/repos/Carthage/Carthage/issues/2527, ,None
420,ec18766ab4fe5f7c21d8ee00c04b142d80579d74,False, swiftlint run swiftlint autocorrect, , ,None
421,eb80ffdc5226544adb6eb20469500fd0c060359a,True, merge pull request 2507 chuganzy use archive action instead load build setting,https://api.github.com/repos/Carthage/Carthage/issues/2507, ,None
422,633aa7df8566ca5605ec986e1cbdb1fb9c716da0,True, merge pull request 2522 carthage swiftlint swiftlint remove custom rule favor unnâ,https://api.github.com/repos/Carthage/Carthage/issues/2522, ,None
423,d135e5848a80be4caba12b01069981968e6c7c64,True, merge pull request 2524 3lvis patch improve instruction prebuilding framework,https://api.github.com/repos/Carthage/Carthage/issues/2524, ,None
424,a53bd2644096b78e39880ecc7a6765ddc46270fb,False, update way archiving, , ,None
425,9b1d19eae65e27bb20f891f605f4df447d72efe0,False, rename error case, , ,None
426,260f6cd28e8ff208247ec4aeef54c834d6768cfc,False, improve instruction prebuilding framework 0.30.1 http github.com carthage carthage release tag 0.30.1 introduces simpler way archiving command introduced http github.com carthage carthage pull 2438 work great, , ,None
427,49235f0af6770d8068a2c50c9a1a777e2d4689ce,False, error instead printing failure, , ,None
428,409efe39a645336ea1572f41686b35cd653fd758,False, swiftlint remove custom rule favor http github.com realm swiftlint blob 0.26.0 rules.md unneeded break switch, , ,None
429,67ddba3217728e0b298e387a4f4e202178f1cbc2,True, merge pull request 2520 carthage swiftlint redundant optional initialization swiftlint remove custom rule favor ofâ,https://api.github.com/repos/Carthage/Carthage/issues/2520, ,None
430,a676c70e3a0d48fb83108ca39ef70ff1175d8adc,False, swiftlint remove custom rule favor redundant optional initialization http github.com realm swiftlint blob 0.26.0 rules.md redundant optional initialization, , ,None
431,bde907d6e8d45862baae1e2b7ac907a0de4090a8,True, merge pull request 2518 marcoconti83 fix semver parsing patch fix semver parsing many dot,https://api.github.com/repos/Carthage/Carthage/issues/2518, ,None
432,bd1267faf9e7f261dcffdc0a52f633bd8ce9af5c,False, fix semver parsing many dot many dot present version parsed invalid semver, , ,None
433,b476d2116d37d56180ac984f01254cdb41ad33b2,False, add unit failing unit test version parser test hightlight current semver parsing fails malformed version containing many dot, , ,None
434,2a8d6c38349b2480a35b36edbcceb907cbfb46f9,False, carthage verify, , ,None
435,256ae62dfd9529ce2177ac876092cf632031ce0d,True, merge pull request 2510 jdhealy xcode9â xcode9â use xcode 9.4 image alongside xcode 9.2,https://api.github.com/repos/Carthage/Carthage/issues/2510, ,None
436,6cf6e1ea2a59f7b7577d40fecfa0a1fb3fb4f524,False, use xcode 9.4 image alongside xcode 9.2 homebrew http github.com homebrew brew bottling process http github.com homebrew brew blob doc bottles.md binary distribute table matching xcode version bottle build hosting macos version http github.com homebrew brew commit diff currently http github.com homebrew brew commits master library homebrew mac xcode.rb based requirement xcode bottle build xcode 9.2 9.4 travis.yml http github.com carthage carthage blob .travis.yml osx_image, , ,None
437,87880b47363460b5ec49acbef76cd515e94a44e0,False, use archive action instead, , ,None
438,49c7901f851384a358bac2e5d2333cabc4f91900,False, bump version 0.30.1, , ,None
439,7b8bc2f3a8287843070b98d41d7cab6cea929bbb,True, revert merge pull request 2496 mov1s issue 2493 url character derived data path reverts commit reversing change made,https://api.github.com/repos/Carthage/Carthage/issues/2496, ,None
440,9b2aabf9fad73f0b8e4e5a31a07a5111c1cfa9c5,False, bump version 0.30.0, , ,None
441,011d06b5a6147849bdbe668c0c6f4e8fb4c6a71c,True, merge pull request 2499 isaac weisberg static framework dox static framework support information readme,https://api.github.com/repos/Carthage/Carthage/issues/2499, ,None
442,0ec71e1c91948291536f53ec6b54f8ba7a3ea552,True, merge pull request 2502 blender fix issue 2500 use objdump determine whether binary blob compressed archive handled carthage,https://api.github.com/repos/Carthage/Carthage/issues/2502, ,None
443,98aee404af46fbdf26634fd879219d70d6cebd1c,False, check mach header info.plist, , ,None
444,e9a10eed87dae06a6a8c86ce8f33099e35d03a88,False, improve code formatting, , ,None
445,fdb61bdd1dd0f296281155e56819198f14c444cd,False, directory doe exist creating version file create first, , ,None
446,90c9718ea3919b8589ee8f23991a5c481c18bd4d,True, merge pull request 2504 blender fix stale bot 2503 add config stalebot http github.com apps stale,https://api.github.com/repos/Carthage/Carthage/issues/2504, ,None
447,8a17c36e181fd480dfeb6a2bb13f309f9d7f551c,False, add config stalebot http github.com apps stale, , ,None
448,c0086cfa67ecfa97d1597f59a1c7668aa45f385f,True, merge pull request 2412 carthage fix semver support semantic version support enhancement,https://api.github.com/repos/Carthage/Carthage/issues/2412, ,None
449,cf009b76ecbec519aa382641432a45afd2e6c481,True, merge pull request 2476 jdhealy unset setâ treat empty string consider alongside address xcode beta,https://api.github.com/repos/Carthage/Carthage/issues/2476, ,None
450,7405bbaaf3c0e022bb1deefa1a237fa007db41a6,False, add mach type build setting recomendations static framework, , ,None
451,4f91a8edb5b1d7d175f43e128bf7ef9a0b584152,False, add remark static framework unofficially supported since 0.30.0, , ,None
452,d484d396832da2773225d6bc11800d6cc4b07ff1,False, add remark static framework ever become supported swift, , ,None
453,79788f047be810bfaca45c3c94219bfb0689bfe8,False, add notice description static framework support introduced project feature, , ,None
454,e0d2498996042fd6caac4476876f4afbe8d11a02,True, merge pull request 2496 mov1s issue 2493 url character derived data path sanitizing dependency name,https://api.github.com/repos/Carthage/Carthage/issues/2496, ,None
455,0e56719209add1637997a0bd55b6d4abe57976e9,False, using tab instead space, , ,None
456,70a89b303924db0342de9d93244acbcb3d76334b,False, sanitizing dependency name, , ,None
457,5b8965ef3a38c6a1bfa663f75fe522bab553c51b,True, merge pull request 2495 carthage reduce test duration unify ci_build_ package swiftpm reduce test duration,https://api.github.com/repos/Carthage/Carthage/issues/2495, ,None
458,3de4ab8ea7e24a52f0e5e71dbc8311428fd9c899,False, unify ci_build_ package swiftpm reduce test duration, , ,None
459,ac74b5ea1180fd2b309c6eb597e63fdaacf198e8,True, merge pull request 2494 carthage update reactiveswift update reactiveswift 3.1.0,https://api.github.com/repos/Carthage/Carthage/issues/2494, ,None
460,3aac458a36b6d101c87651a3cd7fe55f1b19a011,False, update reactiveswift, , ,None
461,aabebf7002ec30689a9c9b5e33bacaffc5ce8b08,True, merge pull request 2492 carthage update quick nimble update quick nimble,https://api.github.com/repos/Carthage/Carthage/issues/2492, ,None
462,f26ee259b670649d9d1cb6990426040dff0765f1,False, update quick nimble, , ,None
463,f2765040d466240f0bef6a158dda2a4bd08f0238,True, merge pull request 2490 carthage update commandant update commandant,https://api.github.com/repos/Carthage/Carthage/issues/2490, ,None
464,a73411a9f2423f987b98526d6c528f4cd371bd2e,False, update commandant, , ,None
465,341a46d3c0f95741f97db8e09cf03b4fdac2c120,True, merge pull request 2486 blender fix bootstrap resolver flag make use new resolver flag bootstrap command,https://api.github.com/repos/Carthage/Carthage/issues/2486, ,None
466,b0eef3b58320be2e395394aa2c1415665cc6d29c,False, make use new resolver flag bootstrap command, , ,None
467,986e39569779b84b10a2bec72ee60520061257a7,False, treat unset set behavior empty string fix http github.com carthage carthage issue 2472 xcode beta release 10l176w potentially seem omit environment variable set empty string run script phase potentially place heuristic set signifying run script phase within xcode scenario ignore error returning nil done false credit thanks clayellis reporting behavior change iterating code change, , ,None
468,1c12ea651206bfcffdda1b146ec33d530ccd92c0,True, merge pull request 2475 patch fix build error xcode,https://api.github.com/repos/Carthage/Carthage/issues/2475, ,None
469,55b92e5d1c969b42fb07e6d30c9e70dee919ceda,False, fix build error xcode fix error raw type string must appear first enum inheritance clause, , ,None
470,96cfdfa28588005ac1505c013454535de8a4a96e,True, merge pull request 2474 patch truncate log file writing new one,https://api.github.com/repos/Carthage/Carthage/issues/2474, ,None
471,88eb32c711c096a43cbaa6931ba3f9a48a6be0fa,False, truncate log file writing new one, , ,None
472,69cc256111fa262915977611ff70bb78de44cd6b,True, merge pull request 2471 dimazen master add additional linker workarounds,https://api.github.com/repos/Carthage/Carthage/issues/2471, ,None
473,e32dd573e70c4f205d2dbb0f8bb8b1ea7728f2e4,False, add additional linker workarounds, , ,None
474,f0e4139a4cbaafe1f03a5c9c18b96d13ab14e7e7,True, merge pull request 2469 marcoconti83 fix semver strip comment cartfile problem detection cartfile comment inside version parser make parser unnecessarily tied cartfile syntax additionally since case would parse version speficier ignore comment either live parameter always set true entire codebase remove parameter make strong assumption version parsing used solution move comment filtering cartfile parsing code comment stripped line passing line version parser detection comment done following strategy character inside quote considered beginning comment purpose determining whether character inside quote code relies fact nested quote e.g quote like inside cartfile specification even necessary moment comment indicator single character implementation designed handle multi character comment indicator influenced choice using separatedby solution documented code comment includes test cover comment stripping,https://api.github.com/repos/Carthage/Carthage/issues/2469, ,None
475,a52766e03c08378092de8f035ebb41a04538c0a5,False, fix indentation comment, , ,None
476,03ebe26448349783edd72a206586e2c7a021c4c4,False, fix indentation comment grammar, , ,None
477,0c2bfb266b2dba2ef47c251a0343ce51d370527d,False, safer offset array cartfile parsing function, , ,None
478,1743d3602896c447b2a3f416e5fcc02c2e29936a,False, stop parsing cartfile remaining substring line requested comment stop parsing surface error return nil, , ,None
479,c75d2f03f2f47340db920cb16b68be0d699b2e60,False, merge branch fix semver support fix semver strip comment cartfile conflict source carthagekit version.swift, , ,None
480,42ceb5863bb573b2a8cbfc3a381dd8c05c7b5ef5,True, merge pull request 2465 jdhealy correct swift range utf16 offset fix errant utf offset use ranging converted nsrange,https://api.github.com/repos/Carthage/Carthage/issues/2465, ,None
481,ed080df8193499a93b3015556799a96514ab6903,False, refactor detection cartfile comment problem detection cartfile comment inside version parser make parser unnecessarily tied cartfile syntax additionally since case would parse version speficier ignore comment either live parameter always set true entire codebase remove parameter make strong assumption version parsing used solution move comment filtering cartfile parsing code comment stripped line passing line version parser detection comment done following strategy character inside quote considered beginning comment purpose determining whether character inside quote code relies fact nested quote e.g quote like inside cartfile specification even necessary moment comment indicator single character implementation designed handle multi character comment indicator influenced choice using separatedby solution documented code comment includes test cover comment stripping, , ,None
482,9af6e8d4a8d835105d987f6e9e3713d2edba2549,False, fix errant utf offset use ranging converted nsrange refactor prefix character refactor return optional see code comment http twitter.com uint_min status, , ,None
483,d2303fcab7658e1cc426125d9b3348a68d0dd102,True, merge pull request 2464 marcoconti83 fix semver numbersign tag add test non semver reference number sign,https://api.github.com/repos/Carthage/Carthage/issues/2464, ,None
484,a461c7a129883fd15f26f5267370fd9be492b474,False, add test non semver reference number sign, , ,None
485,8859d9e26030d784e2a009d3f4a47fbe5bd70a40,True, merge pull request 2463 walshie4 patch fix install instruction link,https://api.github.com/repos/Carthage/Carthage/issues/2463, ,None
486,37bdefec7dbba7a055337670d441db9ea30e6381,False, fix install instruction link, , ,None
487,f07cac9c2de2b1291bfc4ec5135bca1604318460,True, merge pull request 2450 jasonboyle cache shared scheme generate version file project shared scheme,https://api.github.com/repos/Carthage/Carthage/issues/2450, ,None
488,ca6fcac805ffdcaf9c1c98e178ef9a39fe28f54f,True, merge pull request 2448 bwhiteley zip extension allow binary asset .zip extension,https://api.github.com/repos/Carthage/Carthage/issues/2448, ,None
489,003191f36dd9ff22d48171985093366f5d18322e,True, merge pull request 2459 marcoconti83 fix semver comment parsing use token comment detection instead space parsing semver,https://api.github.com/repos/Carthage/Carthage/issues/2459, ,None
490,b3c5ffa0309c23256b88a740208fe13a312c96e7,True, merge pull request 2458 marcoconti83 fix semver version character set discard fullwidth digit semver parsing,https://api.github.com/repos/Carthage/Carthage/issues/2458, ,None
491,92efa51c77afce3097737b937e9fdaf64eab213c,False, reversed whitespace change fixed test comment, , ,None
492,3b4c9ff742311fdbb297a61e6161d9484cbcf209,False, use token comment detection instead space parsing semver previously code relying space version specified comment commit remove assumption, , ,None
493,e2de6f541d5669766ab8a9d7b6b88b7b73f1e9a0,False, replace usage semver parsing, , ,None
494,8d9b0489d8a3c2f2f05bc6be562c28d6969ca5ad,False, discard fullwidth digit semver parsing, , ,None
495,395a0fc929aa0f1d6be5aa1fa1a7f2ea7e5bad4f,False, add application octet stream supported mime type, , ,None
496,b91ac0f1e9cb2e833647823888d6d849cd7fea87,False, merge remote tracking branch origin master cache shared scheme, , ,None
497,4705ebd3421c2fdbef8e3c3650164e765f0f92b2,True, merge pull request 2453 marcoconti83 fix semver support build char stricter validation pre release build metadata according semver,https://api.github.com/repos/Carthage/Carthage/issues/2453, ,None
