url,state,title,label,comments_url,diff_url,patch_url
https://api.github.com/repos/bpmn-io/bpmn-js/issues/559,closed,BpmnUpdater not taking custom elements into account during canvas.updateRoot,bug,https://api.github.com/repos/bpmn-io/bpmn-js/issues/559/comments, , 
https://api.github.com/repos/bpmn-io/bpmn-js/issues/297,closed,drop pool on flow crashes demo app,bug,https://api.github.com/repos/bpmn-io/bpmn-js/issues/297/comments, , 
https://api.github.com/repos/bpmn-io/bpmn-js/issues/296,closed,Investigate: Add properties panel, ,https://api.github.com/repos/bpmn-io/bpmn-js/issues/296/comments, , 
https://api.github.com/repos/bpmn-io/bpmn-js/issues/280,closed,Roundtrip turns resourceRef for potentialOwner from element to attribute,bug,https://api.github.com/repos/bpmn-io/bpmn-js/issues/280/comments, , 
https://api.github.com/repos/bpmn-io/bpmn-js/issues/541,closed,Expose Viewer as part of Modeler bundle,infrastructure,https://api.github.com/repos/bpmn-io/bpmn-js/issues/541/comments, , 
https://api.github.com/repos/bpmn-io/bpmn-js/issues/506,closed,Always show full data association,bug,https://api.github.com/repos/bpmn-io/bpmn-js/issues/506/comments, , 
https://api.github.com/repos/bpmn-io/bpmn-js/issues/534,closed,Replacing end event will also replace incoming default sequence flows,bug,https://api.github.com/repos/bpmn-io/bpmn-js/issues/534/comments, , 
https://api.github.com/repos/bpmn-io/bpmn-js/issues/497,closed,Collect available translations into JSON file,documentation,https://api.github.com/repos/bpmn-io/bpmn-js/issues/497/comments, , 
https://api.github.com/repos/bpmn-io/bpmn-js/issues/532,closed,Cannot paste on lanes,bug,https://api.github.com/repos/bpmn-io/bpmn-js/issues/532/comments, , 
https://api.github.com/repos/bpmn-io/bpmn-js/issues/531,closed,Do not auto-resize on nested element paste,modeling,https://api.github.com/repos/bpmn-io/bpmn-js/issues/531/comments, , 
https://api.github.com/repos/bpmn-io/bpmn-js/issues/526,closed,Pasting a participant on a process shouldn't be allowed,bug,https://api.github.com/repos/bpmn-io/bpmn-js/issues/526/comments, , 
https://api.github.com/repos/bpmn-io/bpmn-js/issues/516,closed,Pasting on the Lane attaches element to the Lane instead of Participant,bug,https://api.github.com/repos/bpmn-io/bpmn-js/issues/516/comments, , 
https://api.github.com/repos/bpmn-io/bpmn-js/issues/472,closed,Automatically resize Text Annotation to fit contents,modeling,https://api.github.com/repos/bpmn-io/bpmn-js/issues/472/comments, , 
https://api.github.com/repos/bpmn-io/bpmn-js/issues/252,closed,Snap resize box to minimum bounds during resize,modeling,https://api.github.com/repos/bpmn-io/bpmn-js/issues/252/comments, , 
https://api.github.com/repos/bpmn-io/bpmn-js/issues/502,closed,Palette too large on small screen heights,modeling,https://api.github.com/repos/bpmn-io/bpmn-js/issues/502/comments, , 
https://api.github.com/repos/bpmn-io/bpmn-js/issues/521,closed,BPMN Search not properly minified,bug,https://api.github.com/repos/bpmn-io/bpmn-js/issues/521/comments, , 
https://api.github.com/repos/bpmn-io/bpmn-js/issues/480,closed,Sub Process expanded when moving out elements,bug,https://api.github.com/repos/bpmn-io/bpmn-js/issues/480/comments, , 
https://api.github.com/repos/bpmn-io/bpmn-js/issues/481,closed,Scroll when dragging to diagram borders,modeling,https://api.github.com/repos/bpmn-io/bpmn-js/issues/481/comments, , 
https://api.github.com/repos/bpmn-io/bpmn-js/issues/355,closed,Zooming while creating element should keep the element under the cursor,bug,https://api.github.com/repos/bpmn-io/bpmn-js/issues/355/comments, , 
https://api.github.com/repos/bpmn-io/bpmn-js/issues/519,closed,Indicate intermediate/boundary event in palette label,modeling,https://api.github.com/repos/bpmn-io/bpmn-js/issues/519/comments, , 
https://api.github.com/repos/bpmn-io/bpmn-js/issues/247,closed,Morph a Task into an expanded Sub-Process,modeling,https://api.github.com/repos/bpmn-io/bpmn-js/issues/247/comments, , 
https://api.github.com/repos/bpmn-io/bpmn-js/issues/391,closed,I can copy + paste on a diagram, ,https://api.github.com/repos/bpmn-io/bpmn-js/issues/391/comments, , 
https://api.github.com/repos/bpmn-io/bpmn-js/issues/509,closed,Collapsed Subprocess shows itself in the context pad,bug,https://api.github.com/repos/bpmn-io/bpmn-js/issues/509/comments, , 
https://api.github.com/repos/bpmn-io/bpmn-js/issues/97,closed,Remove outer-bound-marker from SVG export,bug,https://api.github.com/repos/bpmn-io/bpmn-js/issues/97/comments, , 
https://api.github.com/repos/bpmn-io/bpmn-js/issues/421,closed,ID is not released if element gets removed,bug,https://api.github.com/repos/bpmn-io/bpmn-js/issues/421/comments, , 
https://api.github.com/repos/bpmn-io/bpmn-js/issues/235,closed,External label position changes during element morph,bug,https://api.github.com/repos/bpmn-io/bpmn-js/issues/235/comments, , 
https://api.github.com/repos/bpmn-io/bpmn-js/issues/158,closed,bpmn diagrams do not open in bpmn.io but in the eclipse modeler,forgiveness,https://api.github.com/repos/bpmn-io/bpmn-js/issues/158/comments, , 
https://api.github.com/repos/bpmn-io/bpmn-js/issues/394,closed,Cannot create sequence / message flows in huge diagrams,modeling,https://api.github.com/repos/bpmn-io/bpmn-js/issues/394/comments, , 
https://api.github.com/repos/bpmn-io/bpmn-js/issues/433,closed,Combine incoming -> outgoing sequence flow when deleting element,modeling,https://api.github.com/repos/bpmn-io/bpmn-js/issues/433/comments, , 
https://api.github.com/repos/bpmn-io/bpmn-js/issues/500,closed,I can search a text / label inside a BPMN,enhancement,https://api.github.com/repos/bpmn-io/bpmn-js/issues/500/comments, , 
https://api.github.com/repos/bpmn-io/bpmn-js/issues/505,closed,gateway.default is not cleared when sequence flow is removed,bug,https://api.github.com/repos/bpmn-io/bpmn-js/issues/505/comments, , 
https://api.github.com/repos/bpmn-io/bpmn-js/issues/499,closed,Removing label does not allow to add it back,bug,https://api.github.com/repos/bpmn-io/bpmn-js/issues/499/comments, , 
https://api.github.com/repos/bpmn-io/bpmn-js/issues/237,closed,Rethink async way of API usage,toolkit,https://api.github.com/repos/bpmn-io/bpmn-js/issues/237/comments, , 
https://api.github.com/repos/bpmn-io/bpmn-js/issues/493,closed,Investigate form field id import issue,import,https://api.github.com/repos/bpmn-io/bpmn-js/issues/493/comments, , 
https://api.github.com/repos/bpmn-io/bpmn-js/issues/488,closed,Indicate elements hidden behind sub-processes / participants,modeling,https://api.github.com/repos/bpmn-io/bpmn-js/issues/488/comments, , 
https://api.github.com/repos/bpmn-io/bpmn-js/issues/365,closed,I can model collapsed pools,modeling,https://api.github.com/repos/bpmn-io/bpmn-js/issues/365/comments, , 
https://api.github.com/repos/bpmn-io/bpmn-js/issues/491,closed,Add i18n,enhancement,https://api.github.com/repos/bpmn-io/bpmn-js/issues/491/comments, , 
https://api.github.com/repos/bpmn-io/bpmn-js/issues/477,closed,Minimum size for direct editing text field,modeling,https://api.github.com/repos/bpmn-io/bpmn-js/issues/477/comments, , 
https://api.github.com/repos/bpmn-io/bpmn-js/issues/490,closed,Direct editing clears input unexpectedly,bug,https://api.github.com/repos/bpmn-io/bpmn-js/issues/490/comments, , 
https://api.github.com/repos/bpmn-io/bpmn-js/issues/402,closed,Reduce minimum height for text annotations to better match with one line text,good first issue,https://api.github.com/repos/bpmn-io/bpmn-js/issues/402/comments, , 
https://api.github.com/repos/bpmn-io/bpmn-js/issues/484,closed,UpdateLabelHandler does not return changed elements,bug,https://api.github.com/repos/bpmn-io/bpmn-js/issues/484/comments, , 
https://api.github.com/repos/bpmn-io/bpmn-js/issues/471,closed,fix(moddle): Add additional default moddle descriptor(s) to viewer, ,https://api.github.com/repos/bpmn-io/bpmn-js/issues/471/comments,https://github.com/bpmn-io/bpmn-js/pull/471.diff,https://github.com/bpmn-io/bpmn-js/pull/471.patch
https://api.github.com/repos/bpmn-io/bpmn-js/issues/139,closed,I can reconnect connections,modeling,https://api.github.com/repos/bpmn-io/bpmn-js/issues/139/comments, , 
https://api.github.com/repos/bpmn-io/bpmn-js/issues/458,closed,Collapsed sub-process must not contain visible children,bug,https://api.github.com/repos/bpmn-io/bpmn-js/issues/458/comments, , 
https://api.github.com/repos/bpmn-io/bpmn-js/issues/459,closed,Allow key bindings to toggle tools, ,https://api.github.com/repos/bpmn-io/bpmn-js/issues/459/comments, , 
https://api.github.com/repos/bpmn-io/bpmn-js/issues/345,closed,I can model data stores,modeling,https://api.github.com/repos/bpmn-io/bpmn-js/issues/345/comments, , 
https://api.github.com/repos/bpmn-io/bpmn-js/issues/291,closed,I can model compensations,modeling,https://api.github.com/repos/bpmn-io/bpmn-js/issues/291/comments, , 
https://api.github.com/repos/bpmn-io/bpmn-js/issues/461,closed,I can model a collapsed subprocess with compnesation marker,modeling,https://api.github.com/repos/bpmn-io/bpmn-js/issues/461/comments, , 
https://api.github.com/repos/bpmn-io/bpmn-js/issues/412,closed,Improve on canvas move for diagrams with large pools/lanes/subprocesses,modeling,https://api.github.com/repos/bpmn-io/bpmn-js/issues/412/comments, , 
https://api.github.com/repos/bpmn-io/bpmn-js/issues/455,closed,(Throw|Catch)Event dataAssociations not being drawn,bug,https://api.github.com/repos/bpmn-io/bpmn-js/issues/455/comments, , 
https://api.github.com/repos/bpmn-io/bpmn-js/issues/454,closed,Selection with DataAssociation cannot be moved,bug,https://api.github.com/repos/bpmn-io/bpmn-js/issues/454/comments, , 
https://api.github.com/repos/bpmn-io/bpmn-js/issues/451,closed,Morph SubProcess and Transaction into EventSubProcess,bug,https://api.github.com/repos/bpmn-io/bpmn-js/issues/451/comments, , 
https://api.github.com/repos/bpmn-io/bpmn-js/issues/446,closed,Create an icon for the hand tool, ,https://api.github.com/repos/bpmn-io/bpmn-js/issues/446/comments, , 
https://api.github.com/repos/bpmn-io/bpmn-js/issues/442,closed,Morph to conditional flow should remove condition, ,https://api.github.com/repos/bpmn-io/bpmn-js/issues/442/comments, , 
https://api.github.com/repos/bpmn-io/bpmn-js/issues/425,closed,Allow default flows going out of activities,bug,https://api.github.com/repos/bpmn-io/bpmn-js/issues/425/comments, , 
https://api.github.com/repos/bpmn-io/bpmn-js/issues/16,closed,BPMN Labels are rendered,rendering,https://api.github.com/repos/bpmn-io/bpmn-js/issues/16/comments, , 
https://api.github.com/repos/bpmn-io/bpmn-js/issues/414,closed,Morph menu is positioned outside of window,modeling,https://api.github.com/repos/bpmn-io/bpmn-js/issues/414/comments, , 
https://api.github.com/repos/bpmn-io/bpmn-js/issues/428,closed,Refactor BpmnReplace, ,https://api.github.com/repos/bpmn-io/bpmn-js/issues/428/comments, , 
https://api.github.com/repos/bpmn-io/bpmn-js/issues/426,closed,feat(BpmnReplace): Let rules disallow replacement operations, ,https://api.github.com/repos/bpmn-io/bpmn-js/issues/426/comments,https://github.com/bpmn-io/bpmn-js/pull/426.diff,https://github.com/bpmn-io/bpmn-js/pull/426.patch
https://api.github.com/repos/bpmn-io/bpmn-js/issues/431,closed,DataInputAssociation is missing targetRef,bug,https://api.github.com/repos/bpmn-io/bpmn-js/issues/431/comments, , 
https://api.github.com/repos/bpmn-io/bpmn-js/issues/437,closed,Boundary event drawing problems on imported Activities, ,https://api.github.com/repos/bpmn-io/bpmn-js/issues/437/comments, , 
https://api.github.com/repos/bpmn-io/bpmn-js/issues/401,closed,label text invisible after morph,bug,https://api.github.com/repos/bpmn-io/bpmn-js/issues/401/comments, , 
https://api.github.com/repos/bpmn-io/bpmn-js/issues/403,closed,"A call activity is always shown with a ""+"" sign",modeling,https://api.github.com/repos/bpmn-io/bpmn-js/issues/403/comments, , 
https://api.github.com/repos/bpmn-io/bpmn-js/issues/430,closed,Allow passing shapes to Modeling#updateProperties options,modeling,https://api.github.com/repos/bpmn-io/bpmn-js/issues/430/comments, , 
https://api.github.com/repos/bpmn-io/bpmn-js/issues/417,closed,Error if there is no diagram to display,import,https://api.github.com/repos/bpmn-io/bpmn-js/issues/417/comments, , 
https://api.github.com/repos/bpmn-io/bpmn-js/issues/422,closed,chore(test): Add .defined matcher, ,https://api.github.com/repos/bpmn-io/bpmn-js/issues/422/comments,https://github.com/bpmn-io/bpmn-js/pull/422.diff,https://github.com/bpmn-io/bpmn-js/pull/422.patch
https://api.github.com/repos/bpmn-io/bpmn-js/issues/131,closed,"Rendering of call activity broken, ""+"" is missing in bpmn.io",bug,https://api.github.com/repos/bpmn-io/bpmn-js/issues/131/comments, , 
https://api.github.com/repos/bpmn-io/bpmn-js/issues/420,closed,Modeler breaks updating ID to the same value,bug,https://api.github.com/repos/bpmn-io/bpmn-js/issues/420/comments, , 
https://api.github.com/repos/bpmn-io/bpmn-js/issues/82,closed,Connection marker broken after zoom/scroll on IE,bug,https://api.github.com/repos/bpmn-io/bpmn-js/issues/82/comments, , 
https://api.github.com/repos/bpmn-io/bpmn-js/issues/411,closed,unable to model throwing intermediate escalation event,bug,https://api.github.com/repos/bpmn-io/bpmn-js/issues/411/comments, , 
https://api.github.com/repos/bpmn-io/bpmn-js/issues/410,closed,Default sequence flow can be replaced with both 'sequence flow' and 'default sequence flow' for OR-gateways, ,https://api.github.com/repos/bpmn-io/bpmn-js/issues/410/comments, , 
https://api.github.com/repos/bpmn-io/bpmn-js/issues/397,closed,Auto expand containment in multi selection move, ,https://api.github.com/repos/bpmn-io/bpmn-js/issues/397/comments, , 
https://api.github.com/repos/bpmn-io/bpmn-js/issues/393,closed,Fix Viewer events,toolkit,https://api.github.com/repos/bpmn-io/bpmn-js/issues/393/comments, , 
https://api.github.com/repos/bpmn-io/bpmn-js/issues/384,closed,Add data associations for events,modeling,https://api.github.com/repos/bpmn-io/bpmn-js/issues/384/comments, , 
https://api.github.com/repos/bpmn-io/bpmn-js/issues/378,closed,Remove jsdoc from the build, ,https://api.github.com/repos/bpmn-io/bpmn-js/issues/378/comments, , 
https://api.github.com/repos/bpmn-io/bpmn-js/issues/370,closed,add default and conditional flows icons, ,https://api.github.com/repos/bpmn-io/bpmn-js/issues/370/comments, , 
https://api.github.com/repos/bpmn-io/bpmn-js/issues/385,closed,Update icons and font, ,https://api.github.com/repos/bpmn-io/bpmn-js/issues/385/comments, , 
https://api.github.com/repos/bpmn-io/bpmn-js/issues/392,closed,Reopen context pad after Lane split,bug,https://api.github.com/repos/bpmn-io/bpmn-js/issues/392/comments, , 
https://api.github.com/repos/bpmn-io/bpmn-js/issues/390,closed,Participant auto-resize not working for Lanes,modeling,https://api.github.com/repos/bpmn-io/bpmn-js/issues/390/comments, , 
https://api.github.com/repos/bpmn-io/bpmn-js/issues/387,closed,Update lane#flowNodeRefs,modeling,https://api.github.com/repos/bpmn-io/bpmn-js/issues/387/comments, , 
https://api.github.com/repos/bpmn-io/bpmn-js/issues/379,closed,Implement creating Lanes via context pad entries,modeling,https://api.github.com/repos/bpmn-io/bpmn-js/issues/379/comments, , 
https://api.github.com/repos/bpmn-io/bpmn-js/issues/338,closed,Automatically adjust lane width / height after participant resize, ,https://api.github.com/repos/bpmn-io/bpmn-js/issues/338/comments, , 
https://api.github.com/repos/bpmn-io/bpmn-js/issues/116,closed,"Dragging from Palette leads to diagram ""freeze""",bug,https://api.github.com/repos/bpmn-io/bpmn-js/issues/116/comments, , 
https://api.github.com/repos/bpmn-io/bpmn-js/issues/380,closed,Connection Layout lost for data associations and normal assiciations,bug,https://api.github.com/repos/bpmn-io/bpmn-js/issues/380/comments, , 
https://api.github.com/repos/bpmn-io/bpmn-js/issues/344,closed,I can model data objects,modeling,https://api.github.com/repos/bpmn-io/bpmn-js/issues/344/comments, , 
https://api.github.com/repos/bpmn-io/bpmn-js/issues/373,closed,Update bpmn properties on Default and Conditional Flows, ,https://api.github.com/repos/bpmn-io/bpmn-js/issues/373/comments, , 
https://api.github.com/repos/bpmn-io/bpmn-js/issues/372,closed,add hover titles to Activity markers, ,https://api.github.com/repos/bpmn-io/bpmn-js/issues/372/comments, , 
https://api.github.com/repos/bpmn-io/bpmn-js/issues/369,closed,I can model conditional flows,modeling,https://api.github.com/repos/bpmn-io/bpmn-js/issues/369/comments, , 
https://api.github.com/repos/bpmn-io/bpmn-js/issues/272,closed,I can model a default flow,modeling,https://api.github.com/repos/bpmn-io/bpmn-js/issues/272/comments, , 
https://api.github.com/repos/bpmn-io/bpmn-js/issues/337,closed,I can model cancel events,modeling,https://api.github.com/repos/bpmn-io/bpmn-js/issues/337/comments, , 
https://api.github.com/repos/bpmn-io/bpmn-js/issues/354,closed,Rework multi-selection move across parent borders,bug,https://api.github.com/repos/bpmn-io/bpmn-js/issues/354/comments, , 
https://api.github.com/repos/bpmn-io/bpmn-js/issues/368,closed,Dragger elements are not removed from context,bug,https://api.github.com/repos/bpmn-io/bpmn-js/issues/368/comments, , 
https://api.github.com/repos/bpmn-io/bpmn-js/issues/357,closed,auto-resize nested parent elements,modeling,https://api.github.com/repos/bpmn-io/bpmn-js/issues/357/comments, , 
https://api.github.com/repos/bpmn-io/bpmn-js/issues/356,closed,auto-resize sub processes and transactions,modeling,https://api.github.com/repos/bpmn-io/bpmn-js/issues/356/comments, , 
https://api.github.com/repos/bpmn-io/bpmn-js/issues/358,closed,Ordering of sub processes and transactions, ,https://api.github.com/repos/bpmn-io/bpmn-js/issues/358/comments, , 
https://api.github.com/repos/bpmn-io/bpmn-js/issues/352,closed,Add custom element example(test) to bpmn-js,test,https://api.github.com/repos/bpmn-io/bpmn-js/issues/352/comments, , 
https://api.github.com/repos/bpmn-io/bpmn-js/issues/353,closed,Auto-resize not working on multi-selection,modeling,https://api.github.com/repos/bpmn-io/bpmn-js/issues/353/comments, , 
https://api.github.com/repos/bpmn-io/bpmn-js/issues/348,closed,add infrastructure for custom elements, ,https://api.github.com/repos/bpmn-io/bpmn-js/issues/348/comments, , 
https://api.github.com/repos/bpmn-io/bpmn-js/issues/326,closed,Boundary Event label is not moved on selection move,bug,https://api.github.com/repos/bpmn-io/bpmn-js/issues/326/comments, , 
https://api.github.com/repos/bpmn-io/bpmn-js/issues/349,closed,Add bounds matcher,test,https://api.github.com/repos/bpmn-io/bpmn-js/issues/349/comments, , 
https://api.github.com/repos/bpmn-io/bpmn-js/issues/347,closed,Rethink vertical pool enlargement trigger,modeling,https://api.github.com/repos/bpmn-io/bpmn-js/issues/347/comments, , 
https://api.github.com/repos/bpmn-io/bpmn-js/issues/346,closed,Error in BpmnReplacePreview,bug,https://api.github.com/repos/bpmn-io/bpmn-js/issues/346/comments, , 
https://api.github.com/repos/bpmn-io/bpmn-js/issues/323,closed,Invalid boundary event connections are not deleted after moving host,bug,https://api.github.com/repos/bpmn-io/bpmn-js/issues/323/comments, , 
https://api.github.com/repos/bpmn-io/bpmn-js/issues/263,closed,Automatically adjust pool/participant size to fit its contents,modeling,https://api.github.com/repos/bpmn-io/bpmn-js/issues/263/comments, , 
https://api.github.com/repos/bpmn-io/bpmn-js/issues/341,closed,Correctly wire #flowNodeRefs when adding / removing elements from lanes,bug,https://api.github.com/repos/bpmn-io/bpmn-js/issues/341/comments, , 
https://api.github.com/repos/bpmn-io/bpmn-js/issues/340,closed,Child elements of lanes are not visible after saving and loading,bug,https://api.github.com/repos/bpmn-io/bpmn-js/issues/340/comments, , 
https://api.github.com/repos/bpmn-io/bpmn-js/issues/110,closed,Update package.json,ready,https://api.github.com/repos/bpmn-io/bpmn-js/issues/110/comments,https://github.com/bpmn-io/bpmn-js/pull/110.diff,https://github.com/bpmn-io/bpmn-js/pull/110.patch
https://api.github.com/repos/bpmn-io/bpmn-js/issues/316,closed,I can model lanes,modeling,https://api.github.com/repos/bpmn-io/bpmn-js/issues/316/comments, , 
https://api.github.com/repos/bpmn-io/bpmn-js/issues/335,closed,Start event replacements are not selected after dropping,bug,https://api.github.com/repos/bpmn-io/bpmn-js/issues/335/comments, , 
https://api.github.com/repos/bpmn-io/bpmn-js/issues/336,closed,Add BPMN specific ordering,modeling,https://api.github.com/repos/bpmn-io/bpmn-js/issues/336/comments, , 
https://api.github.com/repos/bpmn-io/bpmn-js/issues/266,closed,Connection attachment not updated after element resize,bug,https://api.github.com/repos/bpmn-io/bpmn-js/issues/266/comments, , 
https://api.github.com/repos/bpmn-io/bpmn-js/issues/325,closed,"Add visual feedback, whether dropping is allowed by replacing element",interaction,https://api.github.com/repos/bpmn-io/bpmn-js/issues/325/comments, , 
https://api.github.com/repos/bpmn-io/bpmn-js/issues/107,closed,Connect BPMN elements via context pad,modeling,https://api.github.com/repos/bpmn-io/bpmn-js/issues/107/comments, , 
https://api.github.com/repos/bpmn-io/bpmn-js/issues/302,closed,I can model expanded event subprocesses,modeling,https://api.github.com/repos/bpmn-io/bpmn-js/issues/302/comments, , 
https://api.github.com/repos/bpmn-io/bpmn-js/issues/320,closed,Instant feedback when moving / creating boundary events,modeling,https://api.github.com/repos/bpmn-io/bpmn-js/issues/320/comments, , 
https://api.github.com/repos/bpmn-io/bpmn-js/issues/321,closed,Add zoom keybindings,interaction,https://api.github.com/repos/bpmn-io/bpmn-js/issues/321/comments, , 
https://api.github.com/repos/bpmn-io/bpmn-js/issues/322,closed,The current event is visible in replace menu,bug,https://api.github.com/repos/bpmn-io/bpmn-js/issues/322/comments, , 
https://api.github.com/repos/bpmn-io/bpmn-js/issues/319,closed,Add connection rules for boundary events,bug,https://api.github.com/repos/bpmn-io/bpmn-js/issues/319/comments, , 
https://api.github.com/repos/bpmn-io/bpmn-js/issues/227,closed,Improve on auto layouting,modeling,https://api.github.com/repos/bpmn-io/bpmn-js/issues/227/comments, , 
https://api.github.com/repos/bpmn-io/bpmn-js/issues/293,closed,I can morph boundary events,modeling,https://api.github.com/repos/bpmn-io/bpmn-js/issues/293/comments, , 
https://api.github.com/repos/bpmn-io/bpmn-js/issues/184,closed,Add select all key binding,interaction,https://api.github.com/repos/bpmn-io/bpmn-js/issues/184/comments, , 
https://api.github.com/repos/bpmn-io/bpmn-js/issues/292,closed,I can model boundary events,modeling,https://api.github.com/repos/bpmn-io/bpmn-js/issues/292/comments, , 
https://api.github.com/repos/bpmn-io/bpmn-js/issues/6,closed,I can model a new task in a process, ,https://api.github.com/repos/bpmn-io/bpmn-js/issues/6/comments, , 
https://api.github.com/repos/bpmn-io/bpmn-js/issues/315,closed,Sequence flow can't be reconnected to participant,bug,https://api.github.com/repos/bpmn-io/bpmn-js/issues/315/comments, , 
https://api.github.com/repos/bpmn-io/bpmn-js/issues/267,closed,Message flow not updating correctly after changing source,bug,https://api.github.com/repos/bpmn-io/bpmn-js/issues/267/comments, , 
https://api.github.com/repos/bpmn-io/bpmn-js/issues/204,closed,Replace Jasmine with Mocha,integration-test,https://api.github.com/repos/bpmn-io/bpmn-js/issues/204/comments, , 
https://api.github.com/repos/bpmn-io/bpmn-js/issues/271,closed,I can model an Ad-hoc Sub Process,modeling,https://api.github.com/repos/bpmn-io/bpmn-js/issues/271/comments, , 
https://api.github.com/repos/bpmn-io/bpmn-js/issues/101,closed,Download buttons not working,ready,https://api.github.com/repos/bpmn-io/bpmn-js/issues/101/comments, , 
https://api.github.com/repos/bpmn-io/bpmn-js/issues/308,closed,Undo and redo toggling activity markers is reflected in the popup menu, ,https://api.github.com/repos/bpmn-io/bpmn-js/issues/308/comments, , 
https://api.github.com/repos/bpmn-io/bpmn-js/issues/303,closed,I can model a collapsed subprocess using the morph,modeling,https://api.github.com/repos/bpmn-io/bpmn-js/issues/303/comments, , 
https://api.github.com/repos/bpmn-io/bpmn-js/issues/223,closed,I can morph expanded sub processes (transaction),modeling,https://api.github.com/repos/bpmn-io/bpmn-js/issues/223/comments, , 
https://api.github.com/repos/bpmn-io/bpmn-js/issues/275,closed,I can model activity markers (loop and MI),modeling,https://api.github.com/repos/bpmn-io/bpmn-js/issues/275/comments, , 
https://api.github.com/repos/bpmn-io/bpmn-js/issues/304,closed,I can model a call activity using the morph menu,modeling,https://api.github.com/repos/bpmn-io/bpmn-js/issues/304/comments, , 
https://api.github.com/repos/bpmn-io/bpmn-js/issues/301,closed,modeling.updateProperties not working for custom attributes,bug,https://api.github.com/repos/bpmn-io/bpmn-js/issues/301/comments, , 
https://api.github.com/repos/bpmn-io/bpmn-js/issues/294,closed,Element properties can be changed via an attribute menu,modeling,https://api.github.com/repos/bpmn-io/bpmn-js/issues/294/comments, , 
https://api.github.com/repos/bpmn-io/bpmn-js/issues/299,closed,Pools can be shrinked beyond elements,bug,https://api.github.com/repos/bpmn-io/bpmn-js/issues/299/comments, , 
https://api.github.com/repos/bpmn-io/bpmn-js/issues/88,closed,I can model a new gateway in a process,modeling,https://api.github.com/repos/bpmn-io/bpmn-js/issues/88/comments, , 
https://api.github.com/repos/bpmn-io/bpmn-js/issues/290,closed,Participant label not taken into account during resize,bug,https://api.github.com/repos/bpmn-io/bpmn-js/issues/290/comments, , 
