url,state,title,label,comments_url,diff_url,patch_url
https://api.github.com/repos/bpmn-io/bpmn-js/issues/376,closed,I can move elements using the keyboard arrows,modeling,https://api.github.com/repos/bpmn-io/bpmn-js/issues/376/comments, , 
https://api.github.com/repos/bpmn-io/bpmn-js/issues/844,closed,Show group names,toolkit,https://api.github.com/repos/bpmn-io/bpmn-js/issues/844/comments, , 
https://api.github.com/repos/bpmn-io/bpmn-js/issues/870,closed,Replace BpmnGlobalConnect provider with rules,enhancement,https://api.github.com/repos/bpmn-io/bpmn-js/issues/870/comments, , 
https://api.github.com/repos/bpmn-io/bpmn-js/issues/855,closed,Error when moving Lane,bug,https://api.github.com/repos/bpmn-io/bpmn-js/issues/855/comments, , 
https://api.github.com/repos/bpmn-io/bpmn-js/issues/850,closed,Snap message flows to target center during connect,modeling,https://api.github.com/repos/bpmn-io/bpmn-js/issues/850/comments, , 
https://api.github.com/repos/bpmn-io/bpmn-js/issues/849,closed,Dragging message flow label over message flow causes an error,bug,https://api.github.com/repos/bpmn-io/bpmn-js/issues/849/comments, , 
https://api.github.com/repos/bpmn-io/bpmn-js/issues/774,closed,Drop on flow should remove redundant incoming and outgoing sequence flows.,modeling,https://api.github.com/repos/bpmn-io/bpmn-js/issues/774/comments, , 
https://api.github.com/repos/bpmn-io/bpmn-js/issues/836,closed,Layout manager problem on moving nodes appears on 2.4.1 version,bug,https://api.github.com/repos/bpmn-io/bpmn-js/issues/836/comments, , 
https://api.github.com/repos/bpmn-io/bpmn-js/issues/833,closed,HTML DOM insertBefore() Function has a unfriendly using bug,help wanted,https://api.github.com/repos/bpmn-io/bpmn-js/issues/833/comments, , 
https://api.github.com/repos/bpmn-io/bpmn-js/issues/824,closed,I can model Task -> Task loops,modeling,https://api.github.com/repos/bpmn-io/bpmn-js/issues/824/comments, , 
https://api.github.com/repos/bpmn-io/bpmn-js/issues/467,closed,Improve auto-layouting for circular Boundary -> Activity flows (loop),modeling,https://api.github.com/repos/bpmn-io/bpmn-js/issues/467/comments, , 
https://api.github.com/repos/bpmn-io/bpmn-js/issues/825,closed,Initial label placed above outgoing sequence flow,modeling,https://api.github.com/repos/bpmn-io/bpmn-js/issues/825/comments, , 
https://api.github.com/repos/bpmn-io/bpmn-js/issues/819,closed,Decide about whether to revert FONT related changes,bug,https://api.github.com/repos/bpmn-io/bpmn-js/issues/819/comments, , 
https://api.github.com/repos/bpmn-io/bpmn-js/issues/799,closed,Boundary TimerEventDefinitions config lost when switching between interrupting and non-interrupting, ,https://api.github.com/repos/bpmn-io/bpmn-js/issues/799/comments, , 
https://api.github.com/repos/bpmn-io/bpmn-js/issues/823,closed,如何点击保存时  取到对应的数据,help wanted,https://api.github.com/repos/bpmn-io/bpmn-js/issues/823/comments, , 
https://api.github.com/repos/bpmn-io/bpmn-js/issues/631,closed,SVG export not working,bug,https://api.github.com/repos/bpmn-io/bpmn-js/issues/631/comments, , 
https://api.github.com/repos/bpmn-io/bpmn-js/issues/811,closed,I can hook into saving XML,enhancement,https://api.github.com/repos/bpmn-io/bpmn-js/issues/811/comments, , 
https://api.github.com/repos/bpmn-io/bpmn-js/issues/803,closed,Font family and weight are applied in direct editing, ,https://api.github.com/repos/bpmn-io/bpmn-js/issues/803/comments, , 
https://api.github.com/repos/bpmn-io/bpmn-js/issues/243,closed,Rework key bindings, ,https://api.github.com/repos/bpmn-io/bpmn-js/issues/243/comments, , 
https://api.github.com/repos/bpmn-io/bpmn-js/issues/713,closed,Renderer should accept colors as parameters,toolkit,https://api.github.com/repos/bpmn-io/bpmn-js/issues/713/comments, , 
https://api.github.com/repos/bpmn-io/bpmn-js/issues/797,closed,Spike: Be able to configure default color for renderer,rendering,https://api.github.com/repos/bpmn-io/bpmn-js/issues/797/comments, , 
https://api.github.com/repos/bpmn-io/bpmn-js/issues/483,closed,Allow DataStore to be modeled in between Participants,forgiveness,https://api.github.com/repos/bpmn-io/bpmn-js/issues/483/comments, , 
https://api.github.com/repos/bpmn-io/bpmn-js/issues/794,closed,updateBound error with pizza-collaboration example,bug,https://api.github.com/repos/bpmn-io/bpmn-js/issues/794/comments, , 
https://api.github.com/repos/bpmn-io/bpmn-js/issues/788,closed,Infinite loop in Auto-place after a BoundaryEvent in a corner ,bug,https://api.github.com/repos/bpmn-io/bpmn-js/issues/788/comments, , 
https://api.github.com/repos/bpmn-io/bpmn-js/issues/1,closed,Import BPMN shapes, ,https://api.github.com/repos/bpmn-io/bpmn-js/issues/1/comments, , 
https://api.github.com/repos/bpmn-io/bpmn-js/issues/5,closed,1st Release, ,https://api.github.com/repos/bpmn-io/bpmn-js/issues/5/comments, , 
https://api.github.com/repos/bpmn-io/bpmn-js/issues/770,closed,Auto-scrolling makes use of element palette difficult, ,https://api.github.com/repos/bpmn-io/bpmn-js/issues/770/comments, , 
https://api.github.com/repos/bpmn-io/bpmn-js/issues/782,closed,No snapping to data object on initial connect,enhancement,https://api.github.com/repos/bpmn-io/bpmn-js/issues/782/comments, , 
https://api.github.com/repos/bpmn-io/bpmn-js/issues/764,closed,Task label text gets lost when using auto placement,bug,https://api.github.com/repos/bpmn-io/bpmn-js/issues/764/comments, , 
https://api.github.com/repos/bpmn-io/bpmn-js/issues/625,closed,Selecting an element via TOUCH does not work correctly,duplicate,https://api.github.com/repos/bpmn-io/bpmn-js/issues/625/comments, , 
https://api.github.com/repos/bpmn-io/bpmn-js/issues/771,closed,"As a user, I want the 'center' button to go to diagram center instead of modeling canvas origin", ,https://api.github.com/repos/bpmn-io/bpmn-js/issues/771/comments, , 
https://api.github.com/repos/bpmn-io/bpmn-js/issues/772,closed,Tooltips on palette for bpmn symbols not clear for the user,modeling,https://api.github.com/repos/bpmn-io/bpmn-js/issues/772/comments, , 
https://api.github.com/repos/bpmn-io/bpmn-js/issues/661,closed,startEvent/EndEvent losing position.,help wanted,https://api.github.com/repos/bpmn-io/bpmn-js/issues/661/comments, , 
https://api.github.com/repos/bpmn-io/bpmn-js/issues/727,closed,Render sequence flows behind other flow elements,needs discussion,https://api.github.com/repos/bpmn-io/bpmn-js/issues/727/comments, , 
https://api.github.com/repos/bpmn-io/bpmn-js/issues/739,closed,Reposition label to free space, ,https://api.github.com/repos/bpmn-io/bpmn-js/issues/739/comments,https://github.com/bpmn-io/bpmn-js/pull/739.diff,https://github.com/bpmn-io/bpmn-js/pull/739.patch
https://api.github.com/repos/bpmn-io/bpmn-js/issues/760,closed,Rework getting started using new pre-packaged distributions,documentation,https://api.github.com/repos/bpmn-io/bpmn-js/issues/760/comments, , 
https://api.github.com/repos/bpmn-io/bpmn-js/issues/725,closed,Publish library distribution via [unpkg],needs review,https://api.github.com/repos/bpmn-io/bpmn-js/issues/725/comments, , 
https://api.github.com/repos/bpmn-io/bpmn-js/issues/756,closed,"Coloring element create di=""[object Object]"" attrubute in source xml", ,https://api.github.com/repos/bpmn-io/bpmn-js/issues/756/comments, , 
https://api.github.com/repos/bpmn-io/bpmn-js/issues/750,closed,Fire an event when an element is clicked with the right mouse button, ,https://api.github.com/repos/bpmn-io/bpmn-js/issues/750/comments, , 
https://api.github.com/repos/bpmn-io/bpmn-js/issues/753,closed,Cannot change TextAnnotation label via Modeling#updateLabel,bug,https://api.github.com/repos/bpmn-io/bpmn-js/issues/753/comments, , 
https://api.github.com/repos/bpmn-io/bpmn-js/issues/751,closed,Cannot copy + paste business objects with type attribute,bug,https://api.github.com/repos/bpmn-io/bpmn-js/issues/751/comments, , 
https://api.github.com/repos/bpmn-io/bpmn-js/issues/747,closed,Create Conditional Event with condition,bug,https://api.github.com/repos/bpmn-io/bpmn-js/issues/747/comments, , 
https://api.github.com/repos/bpmn-io/bpmn-js/issues/119,closed,Retina-friendly logo in Viewer,good first issue,https://api.github.com/repos/bpmn-io/bpmn-js/issues/119/comments, , 
https://api.github.com/repos/bpmn-io/bpmn-js/issues/742,closed,Create Boundary Events from Context Pad,modeling,https://api.github.com/repos/bpmn-io/bpmn-js/issues/742/comments, , 
https://api.github.com/repos/bpmn-io/bpmn-js/issues/242,closed,Add participant snapping, ,https://api.github.com/repos/bpmn-io/bpmn-js/issues/242/comments,https://github.com/bpmn-io/bpmn-js/pull/242.diff,https://github.com/bpmn-io/bpmn-js/pull/242.patch
https://api.github.com/repos/bpmn-io/bpmn-js/issues/563,closed,Element layout assistance (equal distance),modeling,https://api.github.com/repos/bpmn-io/bpmn-js/issues/563/comments, , 
https://api.github.com/repos/bpmn-io/bpmn-js/issues/511,closed,Connection on boundary events changes/breaks on dragging,bug,https://api.github.com/repos/bpmn-io/bpmn-js/issues/511/comments, , 
https://api.github.com/repos/bpmn-io/bpmn-js/issues/684,closed,Investigate broke connection cropping,bug,https://api.github.com/repos/bpmn-io/bpmn-js/issues/684/comments, , 
https://api.github.com/repos/bpmn-io/bpmn-js/issues/738,closed,Reposition gateway labels to wherever free space is,modeling,https://api.github.com/repos/bpmn-io/bpmn-js/issues/738/comments, , 
https://api.github.com/repos/bpmn-io/bpmn-js/issues/693,closed,Property loses ID when copy-pasting a DataInputAssociation,bug,https://api.github.com/repos/bpmn-io/bpmn-js/issues/693/comments, , 
https://api.github.com/repos/bpmn-io/bpmn-js/issues/152,closed,Connection disappear,bug,https://api.github.com/repos/bpmn-io/bpmn-js/issues/152/comments, , 
https://api.github.com/repos/bpmn-io/bpmn-js/issues/731,closed,Contributing-Request / RendererUtil,refactoring,https://api.github.com/repos/bpmn-io/bpmn-js/issues/731/comments, , 
https://api.github.com/repos/bpmn-io/bpmn-js/issues/469,closed,Failed to save nested namespace document (Bizagi export),bug,https://api.github.com/repos/bpmn-io/bpmn-js/issues/469/comments, , 
https://api.github.com/repos/bpmn-io/bpmn-js/issues/735,closed,Emit an import warning on non UTF-8 encoded XML files,import,https://api.github.com/repos/bpmn-io/bpmn-js/issues/735/comments, , 
https://api.github.com/repos/bpmn-io/bpmn-js/issues/734,closed,bpmn-js crashes when dragging a connection endpoint over and existing toolbar, ,https://api.github.com/repos/bpmn-io/bpmn-js/issues/734/comments, , 
https://api.github.com/repos/bpmn-io/bpmn-js/issues/236,closed,Connection layout broken after resize,bug,https://api.github.com/repos/bpmn-io/bpmn-js/issues/236/comments, , 
https://api.github.com/repos/bpmn-io/bpmn-js/issues/722,closed,chore(renderer): Implemented oop paradigm for BpmnRenderer, ,https://api.github.com/repos/bpmn-io/bpmn-js/issues/722/comments,https://github.com/bpmn-io/bpmn-js/pull/722.diff,https://github.com/bpmn-io/bpmn-js/pull/722.patch
https://api.github.com/repos/bpmn-io/bpmn-js/issues/232,closed,I can drop new elements on flows,modeling,https://api.github.com/repos/bpmn-io/bpmn-js/issues/232/comments, , 
https://api.github.com/repos/bpmn-io/bpmn-js/issues/716,closed,BpmnRenderer: Make instance of ids global to avoid collisions, ,https://api.github.com/repos/bpmn-io/bpmn-js/issues/716/comments, , 
https://api.github.com/repos/bpmn-io/bpmn-js/issues/710,closed,Missing <defs> section in SVG generated by IE11,bug,https://api.github.com/repos/bpmn-io/bpmn-js/issues/710/comments, , 
https://api.github.com/repos/bpmn-io/bpmn-js/issues/698,closed,Update demo gif in readme using modeler with reworked text annotations, ,https://api.github.com/repos/bpmn-io/bpmn-js/issues/698/comments, , 
https://api.github.com/repos/bpmn-io/bpmn-js/issues/695,closed,I can snap existing elements on sequence flows, ,https://api.github.com/repos/bpmn-io/bpmn-js/issues/695/comments, , 
https://api.github.com/repos/bpmn-io/bpmn-js/issues/696,closed,"Waypoints are not cropped, when dropping shape on flow near bendpoint",bug,https://api.github.com/repos/bpmn-io/bpmn-js/issues/696/comments, , 
https://api.github.com/repos/bpmn-io/bpmn-js/issues/398,closed,Always snap elements when dropping on sequence flows,modeling,https://api.github.com/repos/bpmn-io/bpmn-js/issues/398/comments, , 
https://api.github.com/repos/bpmn-io/bpmn-js/issues/564,closed,I can add text annotations to data objects/stores,modeling,https://api.github.com/repos/bpmn-io/bpmn-js/issues/564/comments, , 
https://api.github.com/repos/bpmn-io/bpmn-js/issues/561,open,Show resize handles on hover,modeling,https://api.github.com/repos/bpmn-io/bpmn-js/issues/561/comments, , 
https://api.github.com/repos/bpmn-io/bpmn-js/issues/687,closed,Association missing between data object and text annotation,bug,https://api.github.com/repos/bpmn-io/bpmn-js/issues/687/comments, , 
https://api.github.com/repos/bpmn-io/bpmn-js/issues/669,closed,modeling can break completely during connection label auto-adjustment, ,https://api.github.com/repos/bpmn-io/bpmn-js/issues/669/comments, , 
https://api.github.com/repos/bpmn-io/bpmn-js/issues/677,closed,Modeler freezes when moving task with annotation outside of sub-process,bug,https://api.github.com/repos/bpmn-io/bpmn-js/issues/677/comments, , 
https://api.github.com/repos/bpmn-io/bpmn-js/issues/554,closed,Context pad disappears while morphing connected element,bug,https://api.github.com/repos/bpmn-io/bpmn-js/issues/554/comments, , 
https://api.github.com/repos/bpmn-io/bpmn-js/issues/672,closed,Patched code to enable rendering of data collection marker, ,https://api.github.com/repos/bpmn-io/bpmn-js/issues/672/comments,https://github.com/bpmn-io/bpmn-js/pull/672.diff,https://github.com/bpmn-io/bpmn-js/pull/672.patch
https://api.github.com/repos/bpmn-io/bpmn-js/issues/548,closed,Tooltip hides the text that is currently entered,interaction,https://api.github.com/repos/bpmn-io/bpmn-js/issues/548/comments, , 
https://api.github.com/repos/bpmn-io/bpmn-js/issues/535,closed,Add minimap,interaction,https://api.github.com/repos/bpmn-io/bpmn-js/issues/535/comments, , 
https://api.github.com/repos/bpmn-io/bpmn-js/issues/667,closed,Undo drop onto sequence flow during move results in 3 seperate undo operations, ,https://api.github.com/repos/bpmn-io/bpmn-js/issues/667/comments, , 
https://api.github.com/repos/bpmn-io/bpmn-js/issues/205,closed,Message flow message marker is always rendered,bug,https://api.github.com/repos/bpmn-io/bpmn-js/issues/205/comments, , 
https://api.github.com/repos/bpmn-io/bpmn-js/issues/664,closed,fix(release): Stronger check for jQuery before unwraping., ,https://api.github.com/repos/bpmn-io/bpmn-js/issues/664/comments,https://github.com/bpmn-io/bpmn-js/pull/664.diff,https://github.com/bpmn-io/bpmn-js/pull/664.patch
https://api.github.com/repos/bpmn-io/bpmn-js/issues/512,closed,Improve positioning of seuqnce flow labels,good first issue,https://api.github.com/repos/bpmn-io/bpmn-js/issues/512/comments, , 
https://api.github.com/repos/bpmn-io/bpmn-js/issues/640,closed,Element color lost on replace,modeling,https://api.github.com/repos/bpmn-io/bpmn-js/issues/640/comments, , 
https://api.github.com/repos/bpmn-io/bpmn-js/issues/517,closed,[space-tool] Remove space dragging to the left,modeling,https://api.github.com/repos/bpmn-io/bpmn-js/issues/517/comments, , 
https://api.github.com/repos/bpmn-io/bpmn-js/issues/513,closed,Keep same element ID when morphing,enhancement,https://api.github.com/repos/bpmn-io/bpmn-js/issues/513/comments, , 
https://api.github.com/repos/bpmn-io/bpmn-js/issues/35,closed,feat(bpmnrenderer): add events to renderer, ,https://api.github.com/repos/bpmn-io/bpmn-js/issues/35/comments,https://github.com/bpmn-io/bpmn-js/pull/35.diff,https://github.com/bpmn-io/bpmn-js/pull/35.patch
https://api.github.com/repos/bpmn-io/bpmn-js/issues/648,closed,I am able to copy an element with deeply nested properties,enhancement,https://api.github.com/repos/bpmn-io/bpmn-js/issues/648/comments, , 
https://api.github.com/repos/bpmn-io/bpmn-js/issues/647,closed,I am able to replace an element with deeply nested properties,enhancement,https://api.github.com/repos/bpmn-io/bpmn-js/issues/647/comments, , 
https://api.github.com/repos/bpmn-io/bpmn-js/issues/432,closed,Let the user mark arrows as event path, ,https://api.github.com/repos/bpmn-io/bpmn-js/issues/432/comments, , 
https://api.github.com/repos/bpmn-io/bpmn-js/issues/646,closed,Add infrastructure that allows the cloning of businessObjects,enhancement,https://api.github.com/repos/bpmn-io/bpmn-js/issues/646/comments, , 
https://api.github.com/repos/bpmn-io/bpmn-js/issues/444,closed,Cannot configure canvas (i.e. canvas.deferUpdate),bug,https://api.github.com/repos/bpmn-io/bpmn-js/issues/444/comments, , 
https://api.github.com/repos/bpmn-io/bpmn-js/issues/250,closed,feat(layout): add straight layouting for message flows, ,https://api.github.com/repos/bpmn-io/bpmn-js/issues/250/comments,https://github.com/bpmn-io/bpmn-js/pull/250.diff,https://github.com/bpmn-io/bpmn-js/pull/250.patch
https://api.github.com/repos/bpmn-io/bpmn-js/issues/638,closed,Cannot move Participant + Data Association,bug,https://api.github.com/repos/bpmn-io/bpmn-js/issues/638/comments, , 
https://api.github.com/repos/bpmn-io/bpmn-js/issues/445,closed,Open lightbox on project logo click, ,https://api.github.com/repos/bpmn-io/bpmn-js/issues/445/comments, , 
https://api.github.com/repos/bpmn-io/bpmn-js/issues/629,closed,Add bpmn-js support for rendering colored strokes and fills, ,https://api.github.com/repos/bpmn-io/bpmn-js/issues/629/comments, , 
https://api.github.com/repos/bpmn-io/bpmn-js/issues/636,closed,Attach outline broken,bug,https://api.github.com/repos/bpmn-io/bpmn-js/issues/636/comments, , 
https://api.github.com/repos/bpmn-io/bpmn-js/issues/635,closed,Revert broken automatic Text Annotation resizing,bug,https://api.github.com/repos/bpmn-io/bpmn-js/issues/635/comments, , 
https://api.github.com/repos/bpmn-io/bpmn-js/issues/583,closed,Replace events when moved outside event sub process,modeling,https://api.github.com/repos/bpmn-io/bpmn-js/issues/583/comments, , 
https://api.github.com/repos/bpmn-io/bpmn-js/issues/627,closed,Error when rendering instantiated receive tasks,bug,https://api.github.com/repos/bpmn-io/bpmn-js/issues/627/comments, , 
https://api.github.com/repos/bpmn-io/bpmn-js/issues/600,closed,Text annotation should automatically fit its content vertically,modeling,https://api.github.com/repos/bpmn-io/bpmn-js/issues/600/comments, , 
https://api.github.com/repos/bpmn-io/bpmn-js/issues/50,open,Render start event marker in collapsed event subprocesses,rendering,https://api.github.com/repos/bpmn-io/bpmn-js/issues/50/comments, , 
https://api.github.com/repos/bpmn-io/bpmn-js/issues/620,closed,Sequence flow DI does not get updated (Eclipse Modeler exports),bug,https://api.github.com/repos/bpmn-io/bpmn-js/issues/620/comments, , 
https://api.github.com/repos/bpmn-io/bpmn-js/issues/619,closed,Default flow is being lost when reconnecting other sequence flow,bug,https://api.github.com/repos/bpmn-io/bpmn-js/issues/619/comments, , 
https://api.github.com/repos/bpmn-io/bpmn-js/issues/613,closed,Label position changes when editing text externally,bug,https://api.github.com/repos/bpmn-io/bpmn-js/issues/613/comments, , 
https://api.github.com/repos/bpmn-io/bpmn-js/issues/524,closed,Impossible to move elements from different pools,bug,https://api.github.com/repos/bpmn-io/bpmn-js/issues/524/comments, , 
https://api.github.com/repos/bpmn-io/bpmn-js/issues/415,closed,Keep all applicable source properties during replace,modeling,https://api.github.com/repos/bpmn-io/bpmn-js/issues/415/comments, , 
https://api.github.com/repos/bpmn-io/bpmn-js/issues/610,closed,External label text boxes should have minimum dimensions,interaction,https://api.github.com/repos/bpmn-io/bpmn-js/issues/610/comments, , 
https://api.github.com/repos/bpmn-io/bpmn-js/issues/601,closed,External label size should fit text, ,https://api.github.com/repos/bpmn-io/bpmn-js/issues/601/comments, , 
https://api.github.com/repos/bpmn-io/bpmn-js/issues/327,closed,Boundary Event labels do not snap to siblings,bug,https://api.github.com/repos/bpmn-io/bpmn-js/issues/327/comments, , 
https://api.github.com/repos/bpmn-io/bpmn-js/issues/2,closed,I can drag and drop BPMN elements in a process, ,https://api.github.com/repos/bpmn-io/bpmn-js/issues/2/comments, , 
https://api.github.com/repos/bpmn-io/bpmn-js/issues/581,closed,Sequence Flow layout breaks after Gateway remove,bug,https://api.github.com/repos/bpmn-io/bpmn-js/issues/581/comments, , 
https://api.github.com/repos/bpmn-io/bpmn-js/issues/362,closed,Label stays hidden during Modeling#updateProperties,bug,https://api.github.com/repos/bpmn-io/bpmn-js/issues/362/comments, , 
https://api.github.com/repos/bpmn-io/bpmn-js/issues/603,closed,I can attach a Call Activity to a Compensation Boundary Event,enhancement,https://api.github.com/repos/bpmn-io/bpmn-js/issues/603/comments, , 
https://api.github.com/repos/bpmn-io/bpmn-js/issues/606,closed,Cannot move SequenceFlow label outside collaboration,bug,https://api.github.com/repos/bpmn-io/bpmn-js/issues/606/comments, , 
https://api.github.com/repos/bpmn-io/bpmn-js/issues/605,closed,Vertical distribution freeze model with boundary event,bug,https://api.github.com/repos/bpmn-io/bpmn-js/issues/605/comments, , 
https://api.github.com/repos/bpmn-io/bpmn-js/issues/602,closed,Error while trying to move shape selection,bug,https://api.github.com/repos/bpmn-io/bpmn-js/issues/602/comments, , 
https://api.github.com/repos/bpmn-io/bpmn-js/issues/510,closed,I can morph an expanded subprocess to a collapsed subprocess,modeling,https://api.github.com/repos/bpmn-io/bpmn-js/issues/510/comments, , 
https://api.github.com/repos/bpmn-io/bpmn-js/issues/571,closed,Cancel End Event looses definition when moving,bug,https://api.github.com/repos/bpmn-io/bpmn-js/issues/571/comments, , 
https://api.github.com/repos/bpmn-io/bpmn-js/issues/593,closed,Participant automatically expands on space tool use,bug,https://api.github.com/repos/bpmn-io/bpmn-js/issues/593/comments, , 
https://api.github.com/repos/bpmn-io/bpmn-js/issues/182,closed,Zoom Scroll is to fast using the track pad,interaction,https://api.github.com/repos/bpmn-io/bpmn-js/issues/182/comments, , 
https://api.github.com/repos/bpmn-io/bpmn-js/issues/588,closed,Snap during connect,modeling,https://api.github.com/repos/bpmn-io/bpmn-js/issues/588/comments, , 
https://api.github.com/repos/bpmn-io/bpmn-js/issues/592,closed,Simplify svg for escalation events, ,https://api.github.com/repos/bpmn-io/bpmn-js/issues/592/comments, , 
https://api.github.com/repos/bpmn-io/bpmn-js/issues/590,closed,bpmn-js crashes on space tool use, ,https://api.github.com/repos/bpmn-io/bpmn-js/issues/590/comments, , 
https://api.github.com/repos/bpmn-io/bpmn-js/issues/587,closed,Wrong label position after segment move,bug,https://api.github.com/repos/bpmn-io/bpmn-js/issues/587/comments, , 
https://api.github.com/repos/bpmn-io/bpmn-js/issues/331,closed,Update position of connection labels,interaction,https://api.github.com/repos/bpmn-io/bpmn-js/issues/331/comments, , 
https://api.github.com/repos/bpmn-io/bpmn-js/issues/579,closed,Outline has the old size when replacing element,bug,https://api.github.com/repos/bpmn-io/bpmn-js/issues/579/comments, , 
https://api.github.com/repos/bpmn-io/bpmn-js/issues/525,closed,Elements change parent after move when selected from different pools,bug,https://api.github.com/repos/bpmn-io/bpmn-js/issues/525/comments, , 
https://api.github.com/repos/bpmn-io/bpmn-js/issues/479,closed,Repair imported Connection dockings (SequenceFlow / MessageFlow),modeling,https://api.github.com/repos/bpmn-io/bpmn-js/issues/479/comments, , 
https://api.github.com/repos/bpmn-io/bpmn-js/issues/167,closed,Add property update mechanism,modeling,https://api.github.com/repos/bpmn-io/bpmn-js/issues/167/comments, , 
https://api.github.com/repos/bpmn-io/bpmn-js/issues/578,closed,Allow point to point connection via GlobalConnect,enhancement,https://api.github.com/repos/bpmn-io/bpmn-js/issues/578/comments, , 
https://api.github.com/repos/bpmn-io/bpmn-js/issues/574,closed,Fix message flow layout on participant resize,interaction,https://api.github.com/repos/bpmn-io/bpmn-js/issues/574/comments, , 
https://api.github.com/repos/bpmn-io/bpmn-js/issues/177,closed,Problem: overlapping connections make it very hard to work with bendpoints, ,https://api.github.com/repos/bpmn-io/bpmn-js/issues/177/comments, , 
https://api.github.com/repos/bpmn-io/bpmn-js/issues/318,closed,Simplify setup instructions,documentation,https://api.github.com/repos/bpmn-io/bpmn-js/issues/318/comments, , 
https://api.github.com/repos/bpmn-io/bpmn-js/issues/555,closed,Copy/paste does not work correctly for event sub-processes,bug,https://api.github.com/repos/bpmn-io/bpmn-js/issues/555/comments, , 
https://api.github.com/repos/bpmn-io/bpmn-js/issues/310,closed,add attachment when importing boundary events, ,https://api.github.com/repos/bpmn-io/bpmn-js/issues/310/comments, , 
https://api.github.com/repos/bpmn-io/bpmn-js/issues/569,closed,Use generic auto resize (add provider), ,https://api.github.com/repos/bpmn-io/bpmn-js/issues/569/comments, , 
https://api.github.com/repos/bpmn-io/bpmn-js/issues/172,closed,Automatically release tagged artifacts via travis,ci,https://api.github.com/repos/bpmn-io/bpmn-js/issues/172/comments, , 
https://api.github.com/repos/bpmn-io/bpmn-js/issues/231,closed,Sequence flows inside collapsed sub processes are being rendered,bug,https://api.github.com/repos/bpmn-io/bpmn-js/issues/231/comments, , 
https://api.github.com/repos/bpmn-io/bpmn-js/issues/568,closed,Migrate to eslint,infrastructure,https://api.github.com/repos/bpmn-io/bpmn-js/issues/568/comments, , 
