url,state,title,label,comments_url,diff_url,patch_url
https://api.github.com/repos/acornjs/acorn/issues/1048,closed,`ecmaVersion: 2022` allows top-level `await` in scripts and class field initializers, ,https://api.github.com/repos/acornjs/acorn/issues/1048/comments, , 
https://api.github.com/repos/acornjs/acorn/issues/1037,closed,Acorn misinterprets `functionð¬` as `function` keyword after `async`, ,https://api.github.com/repos/acornjs/acorn/issues/1037/comments, , 
https://api.github.com/repos/acornjs/acorn/issues/1036,closed,The BindingIdentifier of LexicalDeclaration should be allowed to start with Unicode escape, ,https://api.github.com/repos/acornjs/acorn/issues/1036/comments, , 
https://api.github.com/repos/acornjs/acorn/issues/1031,closed,`async of` should be allowed in LHS of for-await, ,https://api.github.com/repos/acornjs/acorn/issues/1031/comments, , 
https://api.github.com/repos/acornjs/acorn/issues/1032,closed,pp.fullCharCodeAtPos returns incorrect code point on lone surrogate, ,https://api.github.com/repos/acornjs/acorn/issues/1032/comments, , 
https://api.github.com/repos/acornjs/acorn/issues/1030,closed,broken parsing with class fields and async, ,https://api.github.com/repos/acornjs/acorn/issues/1030/comments, , 
https://api.github.com/repos/acornjs/acorn/issues/984,closed,await exponentiation incorrect parsing, ,https://api.github.com/repos/acornjs/acorn/issues/984/comments, , 
https://api.github.com/repos/acornjs/acorn/issues/1027,closed,"False SyntaxError for class methods with name ""delete"" and modifier ""async"" or ""static""", ,https://api.github.com/repos/acornjs/acorn/issues/1027/comments, , 
https://api.github.com/repos/acornjs/acorn/issues/1015,closed,"[[...[], 0].x] = [0] should not be a syntax error", ,https://api.github.com/repos/acornjs/acorn/issues/1015/comments, , 
https://api.github.com/repos/acornjs/acorn/issues/1007,closed,Error: MODULE_NOT_FOUND, ,https://api.github.com/repos/acornjs/acorn/issues/1007/comments, , 
https://api.github.com/repos/acornjs/acorn/issues/1008,closed,Potential bug in walk, ,https://api.github.com/repos/acornjs/acorn/issues/1008/comments, , 
https://api.github.com/repos/acornjs/acorn/issues/992,closed,Duplicate `__proto__` binding nested in lhs in arrow param is not thrown, ,https://api.github.com/repos/acornjs/acorn/issues/992/comments, , 
https://api.github.com/repos/acornjs/acorn/issues/988,closed,acorn-loose does not allow top-level async for-of, ,https://api.github.com/repos/acornjs/acorn/issues/988/comments, , 
https://api.github.com/repos/acornjs/acorn/issues/981,closed,Wrong ecmaVersion can lead to an infinite loop, ,https://api.github.com/repos/acornjs/acorn/issues/981/comments, , 
https://api.github.com/repos/acornjs/acorn/issues/982,closed,`Unterminated regular expression` error in ForStatement test/update with function/class expression, ,https://api.github.com/repos/acornjs/acorn/issues/982/comments, , 
https://api.github.com/repos/acornjs/acorn/issues/979,closed,Add new ecmaVersion values and 'latest' to types, ,https://api.github.com/repos/acornjs/acorn/issues/979/comments,https://github.com/acornjs/acorn/pull/979.diff,https://github.com/acornjs/acorn/pull/979.patch
https://api.github.com/repos/acornjs/acorn/issues/886,closed,(a = b) = c, ,https://api.github.com/repos/acornjs/acorn/issues/886/comments, , 
https://api.github.com/repos/acornjs/acorn/issues/928,closed,Reuse of Identifier when parsing ObjectPattern with AssignmentPattern, ,https://api.github.com/repos/acornjs/acorn/issues/928/comments, , 
https://api.github.com/repos/acornjs/acorn/issues/732,closed,js to mjs, ,https://api.github.com/repos/acornjs/acorn/issues/732/comments,https://github.com/acornjs/acorn/pull/732.diff,https://github.com/acornjs/acorn/pull/732.patch
https://api.github.com/repos/acornjs/acorn/issues/957,closed,Function with destructuring assignment breaks react dev build, ,https://api.github.com/repos/acornjs/acorn/issues/957/comments, , 
https://api.github.com/repos/acornjs/acorn/issues/938,closed,update for unicode 13.0.0, ,https://api.github.com/repos/acornjs/acorn/issues/938/comments, , 
https://api.github.com/repos/acornjs/acorn/issues/912,closed,First token after class should use previous strict-mode state, ,https://api.github.com/repos/acornjs/acorn/issues/912/comments, , 
https://api.github.com/repos/acornjs/acorn/issues/921,closed,Strict directive can be fooled, ,https://api.github.com/repos/acornjs/acorn/issues/921/comments, , 
https://api.github.com/repos/acornjs/acorn/issues/898,closed,Await expression should be allowed to mix with exponential, ,https://api.github.com/repos/acornjs/acorn/issues/898/comments, , 
https://api.github.com/repos/acornjs/acorn/issues/881,closed,Unicode escape in `break` as an objlit property name should not fail, ,https://api.github.com/repos/acornjs/acorn/issues/881/comments, , 
https://api.github.com/repos/acornjs/acorn/issues/880,closed,Tagged template with \8 should set value to null, ,https://api.github.com/repos/acornjs/acorn/issues/880/comments, , 
https://api.github.com/repos/acornjs/acorn/issues/866,closed,trailing comma in object should throw an error when parsing ecmaVersion 3, ,https://api.github.com/repos/acornjs/acorn/issues/866/comments, , 
https://api.github.com/repos/acornjs/acorn/issues/842,closed,update options.allowReserved in d.ts follow README, ,https://api.github.com/repos/acornjs/acorn/issues/842/comments,https://github.com/acornjs/acorn/pull/842.diff,https://github.com/acornjs/acorn/pull/842.patch
https://api.github.com/repos/acornjs/acorn/issues/827,closed,Feature Request: Show filename in output, ,https://api.github.com/repos/acornjs/acorn/issues/827/comments, , 
https://api.github.com/repos/acornjs/acorn/issues/803,closed,Duplicate top-level lexical bindings check is broken in module, ,https://api.github.com/repos/acornjs/acorn/issues/803/comments, , 
https://api.github.com/repos/acornjs/acorn/issues/797,closed,Bad links to LICENSE from READMEs, ,https://api.github.com/repos/acornjs/acorn/issues/797/comments, , 
https://api.github.com/repos/acornjs/acorn/issues/779,closed,Missing duplicated lexically defined names check, ,https://api.github.com/repos/acornjs/acorn/issues/779/comments, , 
https://api.github.com/repos/acornjs/acorn/issues/774,closed,Sloppy mode ASI with identifiers is incorrect sometimes, ,https://api.github.com/repos/acornjs/acorn/issues/774/comments, , 
https://api.github.com/repos/acornjs/acorn/issues/773,closed,Special line terminators in line continuations should be removed, ,https://api.github.com/repos/acornjs/acorn/issues/773/comments, , 
https://api.github.com/repos/acornjs/acorn/issues/775,closed,Directive Prologue cannot follow an empty statement, ,https://api.github.com/repos/acornjs/acorn/issues/775/comments, , 
https://api.github.com/repos/acornjs/acorn/issues/776,closed,Generator cannot be the sole body of if- or else-clauses, ,https://api.github.com/repos/acornjs/acorn/issues/776/comments, , 
https://api.github.com/repos/acornjs/acorn/issues/770,closed,Missing early error for LHS of ParenthesizedExpression -> ObjectLiteral/ArrayLiteral/etc, ,https://api.github.com/repos/acornjs/acorn/issues/770/comments, , 
https://api.github.com/repos/acornjs/acorn/issues/765,closed,ExpressionStatement is missing the lookahead for `let` on ASI, ,https://api.github.com/repos/acornjs/acorn/issues/765/comments, , 
https://api.github.com/repos/acornjs/acorn/issues/589,open,Consider whether parse-less tokenizing is viable in the long run, ,https://api.github.com/repos/acornjs/acorn/issues/589/comments, , 
https://api.github.com/repos/acornjs/acorn/issues/752,closed,for-of with const and destructuring not parsing, ,https://api.github.com/repos/acornjs/acorn/issues/752/comments, , 
https://api.github.com/repos/acornjs/acorn/issues/750,closed,Cannot parse regex on new line after function/class block, ,https://api.github.com/repos/acornjs/acorn/issues/750/comments, , 
https://api.github.com/repos/acornjs/acorn/issues/738,closed,Change example to reflect new package name, ,https://api.github.com/repos/acornjs/acorn/issues/738/comments,https://github.com/acornjs/acorn/pull/738.diff,https://github.com/acornjs/acorn/pull/738.patch
https://api.github.com/repos/acornjs/acorn/issues/735,closed,Destructuring assignment using default value + computed key + member expression as lvalue fails to parse, ,https://api.github.com/repos/acornjs/acorn/issues/735/comments, , 
https://api.github.com/repos/acornjs/acorn/issues/552,closed,yield in nested function should be parsed as identifier, ,https://api.github.com/repos/acornjs/acorn/issues/552/comments, , 
https://api.github.com/repos/acornjs/acorn/issues/656,closed,Breaking changes in 6.0, ,https://api.github.com/repos/acornjs/acorn/issues/656/comments, , 
https://api.github.com/repos/acornjs/acorn/issues/566,closed,parseImportSpecifiers vs. parseImportSpecifierList, ,https://api.github.com/repos/acornjs/acorn/issues/566/comments, , 
https://api.github.com/repos/acornjs/acorn/issues/570,closed,Change default to ES2017, ,https://api.github.com/repos/acornjs/acorn/issues/570/comments, , 
https://api.github.com/repos/acornjs/acorn/issues/395,closed,acorn_loose lp.parseStatement function creates useless node, ,https://api.github.com/repos/acornjs/acorn/issues/395/comments, , 
https://api.github.com/repos/acornjs/acorn/issues/647,closed,An ArrowFunction in global code may not contain `new.target`,bug,https://api.github.com/repos/acornjs/acorn/issues/647/comments, , 
https://api.github.com/repos/acornjs/acorn/issues/548,closed,Catch parameter conflicts with local declarations, ,https://api.github.com/repos/acornjs/acorn/issues/548/comments, , 
https://api.github.com/repos/acornjs/acorn/issues/693,closed,Patch from debian, ,https://api.github.com/repos/acornjs/acorn/issues/693/comments, , 
https://api.github.com/repos/acornjs/acorn/issues/707,closed,"code of ""`"" should throw unterminated template literal error", ,https://api.github.com/repos/acornjs/acorn/issues/707/comments, , 
https://api.github.com/repos/acornjs/acorn/issues/727,closed,`Unterminated regular expression` for valid code containing division,bug,https://api.github.com/repos/acornjs/acorn/issues/727/comments, , 
https://api.github.com/repos/acornjs/acorn/issues/716,closed,LabeledStatement should not be allowed to contain, ,https://api.github.com/repos/acornjs/acorn/issues/716/comments, , 
https://api.github.com/repos/acornjs/acorn/issues/714,closed,lexically-scoped function declarations in module goal, ,https://api.github.com/repos/acornjs/acorn/issues/714/comments, , 
https://api.github.com/repos/acornjs/acorn/issues/688,closed,Fix RestElement in function object parameters causing walk to fail, ,https://api.github.com/repos/acornjs/acorn/issues/688/comments,https://github.com/acornjs/acorn/pull/688.diff,https://github.com/acornjs/acorn/pull/688.patch
https://api.github.com/repos/acornjs/acorn/issues/687,closed,Invalid CJS use in ESM source of walk/index.js, ,https://api.github.com/repos/acornjs/acorn/issues/687/comments, , 
https://api.github.com/repos/acornjs/acorn/issues/635,closed,Regular expression literals may not contain flag twice,bug,https://api.github.com/repos/acornjs/acorn/issues/635/comments, , 
https://api.github.com/repos/acornjs/acorn/issues/630,closed,Don't accept escape sequences in from and as, ,https://api.github.com/repos/acornjs/acorn/issues/630/comments,https://github.com/acornjs/acorn/pull/630.diff,https://github.com/acornjs/acorn/pull/630.patch
https://api.github.com/repos/acornjs/acorn/issues/644,closed,Duplicate PropertyName of `__proto__` should be accepted in destructuring,bug,https://api.github.com/repos/acornjs/acorn/issues/644/comments, , 
https://api.github.com/repos/acornjs/acorn/issues/642,closed,ForOfStatement#right should disallow SequenceExpression, ,https://api.github.com/repos/acornjs/acorn/issues/642/comments, , 
https://api.github.com/repos/acornjs/acorn/issues/632,closed,Async functions can only be declared at the top level or inside a block, ,https://api.github.com/repos/acornjs/acorn/issues/632/comments, , 
https://api.github.com/repos/acornjs/acorn/issues/623,closed,Classes may not have static property named prototype, ,https://api.github.com/repos/acornjs/acorn/issues/623/comments, , 
https://api.github.com/repos/acornjs/acorn/issues/611,closed,Throws on valid redefinition of __proto__ in object pattern (AnnexB), ,https://api.github.com/repos/acornjs/acorn/issues/611/comments, , 
https://api.github.com/repos/acornjs/acorn/issues/609,closed,`09.5` seen as invalid number, ,https://api.github.com/repos/acornjs/acorn/issues/609/comments, , 
https://api.github.com/repos/acornjs/acorn/issues/607,closed,Possible breaking problem in acorn 5.2.0 discovered when (re)installing eslint and webpack, ,https://api.github.com/repos/acornjs/acorn/issues/607/comments, , 
https://api.github.com/repos/acornjs/acorn/issues/592,closed,The walker doesn't visit all the nodes, ,https://api.github.com/repos/acornjs/acorn/issues/592/comments, , 
https://api.github.com/repos/acornjs/acorn/issues/584,closed,Incorrect parse error for async methods with keywords as names, ,https://api.github.com/repos/acornjs/acorn/issues/584/comments, , 
https://api.github.com/repos/acornjs/acorn/issues/574,closed,literal regexp matching question., ,https://api.github.com/repos/acornjs/acorn/issues/574/comments, , 
https://api.github.com/repos/acornjs/acorn/issues/572,closed,`a <!-- b` in modules are actually equivalent to `a < !(--b)`, ,https://api.github.com/repos/acornjs/acorn/issues/572/comments, , 
https://api.github.com/repos/acornjs/acorn/issues/569,closed,Update supported ecmaVersion values in readme, ,https://api.github.com/repos/acornjs/acorn/issues/569/comments,https://github.com/acornjs/acorn/pull/569.diff,https://github.com/acornjs/acorn/pull/569.patch
https://api.github.com/repos/acornjs/acorn/issues/568,closed,v5.1.0 seems to have a breaking change, ,https://api.github.com/repos/acornjs/acorn/issues/568/comments, , 
https://api.github.com/repos/acornjs/acorn/issues/565,closed,acorn_loose.es.js requires acorn.js and not acorn.es.js, ,https://api.github.com/repos/acornjs/acorn/issues/565/comments, , 
https://api.github.com/repos/acornjs/acorn/issues/562,closed,Fix syntax error of async shorthand properties, ,https://api.github.com/repos/acornjs/acorn/issues/562/comments,https://github.com/acornjs/acorn/pull/562.diff,https://github.com/acornjs/acorn/pull/562.patch
https://api.github.com/repos/acornjs/acorn/issues/561,closed,Error: Class constructor DestructuringErrors cannot be invoked without 'new', ,https://api.github.com/repos/acornjs/acorn/issues/561/comments, , 
https://api.github.com/repos/acornjs/acorn/issues/551,closed,HTML closing comment at the beginning is not parsed, ,https://api.github.com/repos/acornjs/acorn/issues/551/comments, , 
https://api.github.com/repos/acornjs/acorn/issues/550,closed,RestElement should accept Array/ObjectPattern, ,https://api.github.com/repos/acornjs/acorn/issues/550/comments, , 
https://api.github.com/repos/acornjs/acorn/issues/549,closed,Incorrect yield-as-identifier error, ,https://api.github.com/repos/acornjs/acorn/issues/549/comments, , 
https://api.github.com/repos/acornjs/acorn/issues/542,closed,Potentially incorrect ASI behavior for yield, ,https://api.github.com/repos/acornjs/acorn/issues/542/comments, , 
https://api.github.com/repos/acornjs/acorn/issues/540,closed,Parse octal numbers with 8 or 9 as decimal if non-strict, ,https://api.github.com/repos/acornjs/acorn/issues/540/comments,https://github.com/acornjs/acorn/pull/540.diff,https://github.com/acornjs/acorn/pull/540.patch
https://api.github.com/repos/acornjs/acorn/issues/525,closed,Incorrect parse error for regular expression in for-of loop, ,https://api.github.com/repos/acornjs/acorn/issues/525/comments, , 
https://api.github.com/repos/acornjs/acorn/issues/534,closed,Parsing error for named function expressions in strict mode, ,https://api.github.com/repos/acornjs/acorn/issues/534/comments, , 
https://api.github.com/repos/acornjs/acorn/issues/529,closed,Incorrect parse error for parenthesized arrow functions, ,https://api.github.com/repos/acornjs/acorn/issues/529/comments, , 
https://api.github.com/repos/acornjs/acorn/issues/475,closed,Arrow function expressions followed by regular expressions are not parsed correctly, ,https://api.github.com/repos/acornjs/acorn/issues/475/comments, , 
https://api.github.com/repos/acornjs/acorn/issues/521,closed,Incorrectly rejects valid labeled statements, ,https://api.github.com/repos/acornjs/acorn/issues/521/comments, , 
https://api.github.com/repos/acornjs/acorn/issues/524,closed,Incorrect parse error for AssignmentExpression following SpreadElement in array,bug,https://api.github.com/repos/acornjs/acorn/issues/524/comments, , 
https://api.github.com/repos/acornjs/acorn/issues/512,closed,Breaking: parse `export default function () {}` as a FunctionDeclaration with null id, ,https://api.github.com/repos/acornjs/acorn/issues/512/comments, , 
https://api.github.com/repos/acornjs/acorn/issues/507,closed,[4.0.5-4.0.10] Static Semantics: IsValidSimpleAssignmentTarget for MemberExpression, ,https://api.github.com/repos/acornjs/acorn/issues/507/comments, , 
https://api.github.com/repos/acornjs/acorn/issues/506,closed,[4.0.5-4.0.9] Missing EmptyStatement after ExportDefaultDeclaration, ,https://api.github.com/repos/acornjs/acorn/issues/506/comments, , 
https://api.github.com/repos/acornjs/acorn/issues/505,closed,"[4.0.7, 4.0.8, 4.0.9] Missing ""Illegal 'use strict' directive"" error", ,https://api.github.com/repos/acornjs/acorn/issues/505/comments, , 
https://api.github.com/repos/acornjs/acorn/issues/503,closed,Late errors (refDestructuringErrors) approach doesn't work for parenthesized lists with assignments, ,https://api.github.com/repos/acornjs/acorn/issues/503/comments, , 
https://api.github.com/repos/acornjs/acorn/issues/502,closed,acorn@4.0.5 breaks webpack 2, ,https://api.github.com/repos/acornjs/acorn/issues/502/comments, , 
https://api.github.com/repos/acornjs/acorn/issues/500,closed,"Incorrect ""Parenthesized pattern"" error in 4.0.5", ,https://api.github.com/repos/acornjs/acorn/issues/500/comments, , 
https://api.github.com/repos/acornjs/acorn/issues/496,closed,acorn@4.0.5 breaks eslint, ,https://api.github.com/repos/acornjs/acorn/issues/496/comments, , 
https://api.github.com/repos/acornjs/acorn/issues/499,closed,webpack hangs with 4.0.5, ,https://api.github.com/repos/acornjs/acorn/issues/499/comments, , 
https://api.github.com/repos/acornjs/acorn/issues/255,closed,`(x=1)` is being treated as an AssignmentPattern.,bug,https://api.github.com/repos/acornjs/acorn/issues/255/comments, , 
https://api.github.com/repos/acornjs/acorn/issues/481,closed,Async arrow functions should not allow parentheses around parameters, ,https://api.github.com/repos/acornjs/acorn/issues/481/comments, , 
https://api.github.com/repos/acornjs/acorn/issues/449,closed,Wrong syntax errors about `super` inside of default parameters., ,https://api.github.com/repos/acornjs/acorn/issues/449/comments, , 
https://api.github.com/repos/acornjs/acorn/issues/393,closed,Incorrectly accepts invalid LabeledStatement  (ES2015),bug,https://api.github.com/repos/acornjs/acorn/issues/393/comments, , 
https://api.github.com/repos/acornjs/acorn/issues/492,closed,directive prologues are not handled the way they should, ,https://api.github.com/repos/acornjs/acorn/issues/492/comments, , 
https://api.github.com/repos/acornjs/acorn/issues/494,closed,Add exception for escaped keywords, ,https://api.github.com/repos/acornjs/acorn/issues/494/comments, , 
https://api.github.com/repos/acornjs/acorn/issues/493,closed,Syntax error on export + incrementation, ,https://api.github.com/repos/acornjs/acorn/issues/493/comments, , 
https://api.github.com/repos/acornjs/acorn/issues/491,closed,(async)(a) => 12, ,https://api.github.com/repos/acornjs/acorn/issues/491/comments, , 
https://api.github.com/repos/acornjs/acorn/issues/490,closed,Cannot re-export reserved words, ,https://api.github.com/repos/acornjs/acorn/issues/490/comments, , 
https://api.github.com/repos/acornjs/acorn/issues/488,closed,Require.js and acorn_loose.js, ,https://api.github.com/repos/acornjs/acorn/issues/488/comments, , 
https://api.github.com/repos/acornjs/acorn/issues/469,closed,Correctly initialise reserved words for ES2017., ,https://api.github.com/repos/acornjs/acorn/issues/469/comments,https://github.com/acornjs/acorn/pull/469.diff,https://github.com/acornjs/acorn/pull/469.patch
https://api.github.com/repos/acornjs/acorn/issues/466,closed,Incorrectly parsing property as in operator, ,https://api.github.com/repos/acornjs/acorn/issues/466/comments, , 
https://api.github.com/repos/acornjs/acorn/issues/463,closed,Incorrect errors on duplicate `export { x as y }`, ,https://api.github.com/repos/acornjs/acorn/issues/463/comments, , 
https://api.github.com/repos/acornjs/acorn/issues/456,closed,Failed to build on Webpack [fix provied], ,https://api.github.com/repos/acornjs/acorn/issues/456/comments, , 
https://api.github.com/repos/acornjs/acorn/issues/458,closed,typo ??, ,https://api.github.com/repos/acornjs/acorn/issues/458/comments, , 
https://api.github.com/repos/acornjs/acorn/issues/457,closed,Missing early errors of duplicated parameters., ,https://api.github.com/repos/acornjs/acorn/issues/457/comments, , 
https://api.github.com/repos/acornjs/acorn/issues/453,closed,parseExpressionAt produces wrong location properties, ,https://api.github.com/repos/acornjs/acorn/issues/453/comments, , 
https://api.github.com/repos/acornjs/acorn/issues/434,closed,Duplicate named exports should be a syntax error, ,https://api.github.com/repos/acornjs/acorn/issues/434/comments, , 
https://api.github.com/repos/acornjs/acorn/issues/447,closed,Conditional function declaration causes a syntax error, ,https://api.github.com/repos/acornjs/acorn/issues/447/comments, , 
https://api.github.com/repos/acornjs/acorn/issues/424,closed,"Implements ES2016 check for ""use strict""", ,https://api.github.com/repos/acornjs/acorn/issues/424/comments,https://github.com/acornjs/acorn/pull/424.diff,https://github.com/acornjs/acorn/pull/424.patch
https://api.github.com/repos/acornjs/acorn/issues/423,closed,Missing an early error of ES2016 (ES7), ,https://api.github.com/repos/acornjs/acorn/issues/423/comments, , 
https://api.github.com/repos/acornjs/acorn/issues/416,closed,The acorn's parse function fails on valid js code, ,https://api.github.com/repos/acornjs/acorn/issues/416/comments, , 
https://api.github.com/repos/acornjs/acorn/issues/772,closed,Sloppy mode ASI is incorrect sometimes, ,https://api.github.com/repos/acornjs/acorn/issues/772/comments, , 
https://api.github.com/repos/acornjs/acorn/issues/412,closed,parse_dammit's options argument is not optional, ,https://api.github.com/repos/acornjs/acorn/issues/412/comments, , 
https://api.github.com/repos/acornjs/acorn/issues/409,closed,in acorn_loose/statement.js recovered node for bogus import statements could be improved, ,https://api.github.com/repos/acornjs/acorn/issues/409/comments, , 
https://api.github.com/repos/acornjs/acorn/issues/407,closed,Keywords in ReferenceIdentifier should be syntax error., ,https://api.github.com/repos/acornjs/acorn/issues/407/comments, , 
https://api.github.com/repos/acornjs/acorn/issues/406,closed,node v6 test failures: /[\uD834\uDF06-\uD834\uDF08a-z]/u Error parsing regular expression: Invalid regular expression:, ,https://api.github.com/repos/acornjs/acorn/issues/406/comments, , 
https://api.github.com/repos/acornjs/acorn/issues/403,closed,Make visitors with Object.create, ,https://api.github.com/repos/acornjs/acorn/issues/403/comments,https://github.com/acornjs/acorn/pull/403.diff,https://github.com/acornjs/acorn/pull/403.patch
https://api.github.com/repos/acornjs/acorn/issues/399,closed,directSourceFile option description is ambiguous, ,https://api.github.com/repos/acornjs/acorn/issues/399/comments, , 
https://api.github.com/repos/acornjs/acorn/issues/396,closed,We don't handle function division,bug,https://api.github.com/repos/acornjs/acorn/issues/396/comments, , 
https://api.github.com/repos/acornjs/acorn/issues/394,closed,acorn_loose generates bad AST for incomplete TemplateElement, ,https://api.github.com/repos/acornjs/acorn/issues/394/comments, , 
https://api.github.com/repos/acornjs/acorn/issues/389,closed,es7 decorators parse fail, ,https://api.github.com/repos/acornjs/acorn/issues/389/comments, , 
https://api.github.com/repos/acornjs/acorn/issues/384,closed,Bug in exponential operator, ,https://api.github.com/repos/acornjs/acorn/issues/384/comments, , 
https://api.github.com/repos/acornjs/acorn/issues/383,closed,"SyntaxError if `undefined` work is used in the string that is parsed, using ecmaVersion: 7", ,https://api.github.com/repos/acornjs/acorn/issues/383/comments, , 
https://api.github.com/repos/acornjs/acorn/issues/382,closed,Add support for ** under ecmaVersion 7, ,https://api.github.com/repos/acornjs/acorn/issues/382/comments,https://github.com/acornjs/acorn/pull/382.diff,https://github.com/acornjs/acorn/pull/382.patch
https://api.github.com/repos/acornjs/acorn/issues/381,closed,Thoughts on ES7?, ,https://api.github.com/repos/acornjs/acorn/issues/381/comments, , 
https://api.github.com/repos/acornjs/acorn/issues/374,closed,Bump ecmaVersion option default in next major release, ,https://api.github.com/repos/acornjs/acorn/issues/374/comments, , 
https://api.github.com/repos/acornjs/acorn/issues/379,closed,Superfluous EmptyStatement created when parsing parenthized class or function expression in default export, ,https://api.github.com/repos/acornjs/acorn/issues/379/comments, , 
