id,sha,author,date,issue,message,file,content
450,3a0652fc7cf7403ad717f1380b91e9bb518af03a,am Kasravi <kam.d.kasravi@intel.com>, 2019-10-02 03:13:07 -0700, ,pipelinepipeline updateneeded resourcesnapshotsnapshotupdateupdateupdateupdateupdatenumbering updatenumbering updateupdateupdateupdatepipeline kubeflow tektoncdproof showing following valuesource change component developer forked kubeflowdeveloperchange developerpipeline trigger presubmit submitspipeline build updateworkspace mount pipeline starting build revision kubeflowgenerate kaniko build imagekubeflow build availabe resourceresource input manifest github update kubeflowrunning following manifest update rebuild kubeflowworkspace kubeflow directorybranch forkedforked githubsecret using githubfollowing forked operationupstream kubeflow remoteupstream master fetchupstream master checkoutimage written kustomize build workspace using digestgenerate manifestbuild commit successfulcreatespipeline composistionfollowing resource pipeline containing tektoncdpipeline pipelinerunpipelinebuildmanifest updateimagekubeflowpullresource kubeflowmanifestgeneral relationship resource shown tektoncdpipelinerunpipelineparticular following composition instance pipelinerunpipelinepipelinebuildmanifest updateresourceimagegitrepokubeflowmanifestpullrequestkubeflowresource pipeline provided shown within pipelinerunvalpha apiversionpipelinerunmetadatalabelkubeflow componentpipeline instancemanaged kfctlpipelinekubeflowversionscope kubeflowpipelinekubeflow namespacepipelinerefpipelinepodtemplatesecuritycontextrunasnonrootresourcekubeflowresourcerefkubeflowmanifestresourcerefmanifestresourcerefkubeflowresourcerefkubeflowpipeline serviceaccount account serviceprovided shown pipelinerunkubeflow inputmounted kubeflow workspace githubmanifest inputmounted manifest workspace githuboutputimage pushedkubeflowmounted kubeflow pullrequest workspacepipeline shownvalpha apiversionpipelinemetadatalabelscope kubeflowpipelinekubeflow namespaceparamsresourcekubeflowimagemanifestkubeflowpullrequestbuildparamscomponent value dockerfilepathtocontextcomponent valuedockertargetserve valueresourceinputkubeflowkubeflow resourceoutputkubeflowkubeflow resourceresourcetaskrefbuildmanifest updateparamscommon valuelatest worker kubeflow valueresourceinputbuildkubeflowkubeflow resourcemanifestmanifest resourcekubeflowkubeflow resourcebuildresourceoutputmanifestmanifest resourcerunafterbuildtaskrefmanifest updateconsume input provided shown produce output executedpipelinedifferent later following component parameter covered pipeline allows params parameterized pipelinerun using section listed changingpipelinerun parameterdescription valuepipeline kubeflow namespacegeneratename pipeline unique suffix addedpipeline pipelinerunkubeflow image publicworking developerkubeflowrevision manifest masterkkasravi manifest forkedkubeflow pullrequest resourcepullrequestkubeflow write sharedkubeflow projectpipeline parameterdescription valueimage resourcedockerfiles multi build docker servekubeflow componentcomponent dockerfilecommonworker image latest container kubeflowkubeflow pullrequest resourcepullrequest resourcepipeline generationapproach currentdifferent quite result kkasravi config packaging parameter kfctl pipeline manifest pipelineruns capability generated aspect kfdef overlay generic leveragingalternativepipeline supporting resourcesecretvolume persitentemailpipeline kubeflow tektoncdproof showing following valuesource change component developer forked kubeflowdeveloperchange developerpipeline trigger presubmit submitspipeline build updateworkspace mount pipeline starting build revision kubeflowgenerate kaniko build imagekubeflow build availabe resourceresource input manifest github update kubeflowrunning following manifest update rebuild kubeflowworkspace kubeflow directorybranch forkedforked githubsecret using githubfollowing forked operationupstream kubeflow remoteupstream master fetchupstream master checkoutimage written kustomize build workspace using digestgenerate manifestbuild commit successfulcreatespipeline composistionfollowing resource pipeline containing tektoncdpipeline pipelinerunpipelinebuildmanifest updateimagekubeflowpullresource kubeflowmanifestgeneral relationship resource shown tektoncdpipelinerunpipelineparticular following composition instance pipelinerunpipelinepipelinebuildmanifest updateresourceimagegitrepokubeflowmanifestpullrequestkubeflowresource pipeline provided shown within pipelinerunvalpha apiversionpipelinerunmetadatalabelkubeflow componentpipeline instancemanaged kfctlpipelinekubeflowversionscope kubeflowpipelinekubeflow namespacepipelinerefpipelinepodtemplatesecuritycontextrunasnonrootresourcekubeflowresourcerefkubeflowmanifestresourcerefmanifestresourcerefkubeflowresourcerefkubeflowpipeline serviceaccount account serviceprovided shown pipelinerunkubeflow inputmounted kubeflow workspace githubmanifest inputmounted manifest workspace githuboutputimage pushedkubeflowmounted kubeflow pullrequest workspacepipeline shownvalpha apiversionpipelinemetadatalabelscope kubeflowpipelinekubeflow namespaceparamsresourcekubeflowimagemanifestkubeflowpullrequestbuildparamscomponent value dockerfilepathtocontextcomponent valuedockertargetserve valueresourceinputkubeflowkubeflow resourceoutputkubeflowkubeflow resourceresourcetaskrefbuildmanifest updateparamscommon valuelatest worker kubeflow valueresourceinputbuildkubeflowkubeflow resourcemanifestmanifest resourcekubeflowkubeflow resourcebuildresourceoutputmanifestmanifest resourcerunafterbuildtaskrefmanifest updateconsume input provided shown produce output executedpipelinedifferent later following component parameter covered pipeline allows params parameterized pipelinerun using section listed changingpipelinerun parameterdescription valuepipeline kubeflow namespacegeneratename pipeline unique suffix addedpipeline pipelinerunkubeflow image publicworking developerkubeflowrevision manifest masterkkasravi manifest forkedkubeflow pullrequest resourcepullrequestkubeflow write sharedkubeflow projectpipeline parameterdescription valueimage resourcedockerfiles multi build docker servekubeflow componentcomponent dockerfilecommonworker image latest container kubeflowkubeflow pullrequest resourcepullrequest resourcepipeline generationapproach currentdifferent quite result kkasravi config parameter kfctl pipeline manifest pipelineruns includes generated capability kfdef aspect generic leveragingpipeline manifestpipelinepipeline manifest number includespipelineoverlaybuildcreate clusterdeploymanifest updateadding config kfctl pipeline build overlay addedkustomizeconfigoverlaybuildmanifest updateadding pipeline composed overlay addedpipelinepipeline manifest number includespipelineoverlayimage resourceresource kfctlkubeflow resourcemanifest resourcerequest resourcetesting resourcecommit include automounted parameter github overlay revision reposrequest image docker resourcecomposable requires image resource pipeline manifest build output overlay kubeflow addedkustomizeconfigoverlaykubeflow resourcemanifest resourceimage resourcerequest resourcealternativepipeline supporting resourcesecretvolume persitentplease doctoc start comment generated update allowinstead doctoc updatecontent doctoc generated table thlorenzpipeline kubeflow tektoncdpipeline composistionpipelinepipelinerun parameterpipeline parameterpipeline generationapproach currentpipeline manifest manifestscicialternativepipeline supporting resourcesecretvolume persitentplease doctoc comment generated update allowpipeline kubeflow tektoncdproof showing following valuesource change component developer forked kubeflowdeveloperchange developerpipeline trigger presubmit submitspipeline build updateworkspace mount pipeline starting build revision kubeflowgenerate kaniko build imagekubeflow build availabe resourceresource input manifest github update kubeflowrunning following manifest update rebuild kubeflowworkspace kubeflow directorybranch forkedforked githubsecret using githubfollowing forked operationupstream kubeflow remoteupstream master fetchupstream master checkoutimage written kustomize build workspace using digestgenerate manifestbuild commit successfulcreatespipeline composistionfollowing resource pipeline containing tektoncdpipeline pipelinerunpipelinebuildmanifest updateimagekubeflowpullresource kubeflowmanifestgeneral relationship resource shown tektoncdpipelinerunpipelineparticular following composition instance pipelinerunpipelinepipelinebuildmanifest updateresourceimagegitrepokubeflowmanifestpullrequestkubeflowresource pipeline provided shown within pipelinerunvalpha apiversionpipelinerunmetadatalabelkubeflow componentpipeline instancemanaged kfctlpipelinekubeflowversionscope kubeflowpipelinekubeflow namespacepipelinerefpipelinepodtemplatesecuritycontextrunasnonrootresourcekubeflowresourcerefkubeflowmanifestresourcerefmanifestresourcerefkubeflowresourcerefkubeflowpipeline serviceaccount account serviceprovided shown pipelinerunkubeflow inputmounted kubeflow workspace githubmanifest inputmounted manifest workspace githuboutputimage pushedkubeflowmounted kubeflow pullrequest workspacepipeline shownvalpha apiversionpipelinemetadatalabelscope kubeflowpipelinekubeflow namespaceparamsresourcekubeflowimagemanifestkubeflowpullrequestbuildparamscomponent value dockerfilepathtocontextcomponent valuedockertargetserve valueresourceinputkubeflowkubeflow resourceoutputkubeflowkubeflow resourceresourcetaskrefbuildmanifest updateparamscommon valuelatest worker kubeflow valueresourceinputbuildkubeflowkubeflow resourcemanifestmanifest resourcekubeflowkubeflow resourcebuildresourceoutputmanifestmanifest resourcerunafterbuildtaskrefmanifest updateconsume input provided shown produce output executedpipelinedifferent later following component parameter covered pipeline allows params parameterized pipelinerun using section listed changingpipelinerun parameterdescription valuepipeline kubeflow namespacegeneratename pipeline unique suffix addedpipeline pipelinerunkubeflow image publicworking developerkubeflowrevision manifest masterkkasravi manifest forkedkubeflow pullrequest resourcepullrequestkubeflow write sharedkubeflow projectpipeline parameterdescription valueimage resourcedockerfiles multi build docker servekubeflow componentcomponent dockerfilecommonworker image latest container kubeflowkubeflow pullrequest resourcepullrequest resourcepipeline generationapproach currentdifferent quite result kkasravi config parameter kfctl pipeline manifest pipelineruns includes generated capability kfdef aspect generic leveragingpipeline manifestpipelinepipeline manifest number includespipelineoverlaybuildcreate clusterdeploymanifest updateadding config kfctl pipeline build overlay addedkustomizeconfigoverlaybuildmanifest updateadding pipeline composed overlay addedpipelinepipeline manifest number includespipelineoverlayimage resourceresource kfctlkubeflow resourcemanifest resourcerequest resourcetesting resourcecommit include automounted parameter github overlay revision reposrequest image docker resourcecomposable requires image resource pipeline manifest build output overlay kubeflow addedkustomizeconfigoverlaykubeflow resourcemanifest resourceimage resourcerequest resourcealternativepipeline supporting resourcesecretvolume persitentplease doctoc start comment generated update allowinstead doctoc updatecontent doctoc generated table thlorenzpipeline kubeflow tektoncdpipeline compositionpipelinepipelinerun parameterpipeline parameterpipeline generationapproach currentpipeline manifest manifestscicialternativepipeline supporting resourcesecretvolume persitentplease doctoc comment generated update allowpipeline kubeflow tektoncdproof showing following valuesource change component developer forked kubeflowdeveloperchange developerpipeline trigger presubmit submitspipeline build updateworkspace mount pipeline starting build revision kubeflowgenerate kaniko build imagekubeflow build availabe resourceresource input manifest github update kubeflowrunning following manifest update rebuild kubeflowworkspace kubeflow directorybranch forkedforked githubsecret using githubfollowing forked operationupstream kubeflow remoteupstream master fetchupstream master checkoutimage written kustomize build workspace using digestgenerate manifestbuild commit successfulcreatespipeline compositionfollowing resource pipeline containing tektoncdpipeline pipelinerunpipelinebuildmanifest updateimagekubeflowpullresource kubeflowmanifestgeneral relationship resource shown tektoncdpipelinerunpipelineparticular following composition instance pipelinerunpipelinepipelinebuildmanifest updateresourceimagegitrepokubeflowmanifestpullrequestkubeflowresource pipeline provided shown within pipelinerunvalpha apiversionpipelinerunmetadatalabelkubeflow componentpipeline instancemanaged kfctlpipelinekubeflowversionscope kubeflowpipelinekubeflow namespacepipelinerefpipelinepodtemplatesecuritycontextrunasnonrootresourcekubeflowresourcerefkubeflowmanifestresourcerefmanifestresourcerefkubeflowresourcerefkubeflowpipeline serviceaccount account serviceprovided shown pipelinerunkubeflow inputmounted kubeflow workspace githubmanifest inputmounted manifest workspace githuboutputimage pushedkubeflowmounted kubeflow pullrequest workspacepipeline shownvalpha apiversionpipelinemetadatalabelscope kubeflowpipelinekubeflow namespaceparamsresourcekubeflowimagemanifestkubeflowpullrequestbuildparamscomponent value dockerfilepathtocontextcomponent valuedockertargetserve valueresourceinputkubeflowkubeflow resourceoutputkubeflowkubeflow resourceresourcetaskrefbuildmanifest updateparamscommon valuelatest worker kubeflow valueresourceinputbuildkubeflowkubeflow resourcemanifestmanifest resourcekubeflowkubeflow resourcebuildresourceoutputmanifestmanifest resourcerunafterbuildtaskrefmanifest updateconsume input provided shown produce output executedpipelinedifferent later following component parameter covered pipeline allows params parameterized pipelinerun using section listed changingpipelinerun parameterdescription valuepipeline kubeflow namespacegeneratename pipeline unique suffix addedpipeline pipelinerunkubeflow image publicworking developerkubeflowrevision manifest masterkkasravi manifest forkedkubeflow pullrequest resourcepullrequestkubeflow write sharedkubeflow projectpipeline parameterdescription valueimage resourcedockerfiles multi build docker servekubeflow componentcomponent dockerfilecommonworker image latest container kubeflowkubeflow pullrequest resourcepullrequest resourcepipeline generationapproach currentdifferent quite result kkasravi config parameter kfctl pipeline manifest pipelineruns includes generated capability kfdef aspect generic leveragingpipeline manifestpipelinepipeline manifest number includespipelineoverlaybuildcreate clusterdeploymanifest updateadding config kfctl pipeline build overlay addedkustomizeconfigoverlaybuildmanifest updateadding pipeline composed overlay addedpipelinepipeline manifest number includespipelineoverlayimage resourceresource kfctlkubeflow resourcemanifest resourcerequest resourcetesting resourcecommit include automounted parameter github overlay revision reposrequest image docker resourcecomposable requires image resource pipeline manifest build output overlay kubeflow addedkustomizeconfigoverlaykubeflow resourcemanifest resourceimage resourcerequest resourcealternativepipeline supporting resourcesecretvolume persitentupdateupdateupdatesecret still integrate addressneeded params updateupdate include kustomize suggestion readmefollowing assumes scriptmounted kubeflow pullrequest workspacemounted kubeflow workspacemounted manifest workspaceexpects following scriptscript commit extract forked workspace kubeflow branchextract kubeflow workspace githubimage extract created build workspace digestmanifest following script forkedimage component manifest edits workingdirgenerate manifestsuccessfulchange commitscreatesinvalidworkspaceworkspace pushdxargsxargsxargsxargs image updatexargs githubojson xargs kubectl token github export secretemail xargsconfig globalemail config globalojson xargs kubectl publickey github secretsecretchmodchmodkeyscankeyscanupstream kubeflow remoteupstream master fetchupstream master checkoutimage digest kustomize kubeflow publicworkspace manifestgeneratebranch image updated commitoriginmktemp tmpfileimage tmpfile update kubeflow digesttmpfiletmpfileimage tmpfile commit built branchrequest kubeflow master tmpfilegenerate failedrequest invalidworkspace existkustomize updatekustomize updateminor change removeupdatesimplify approachrebuild manifest updatesecets standardizerefactoredupdaterequestsmall refactoringupdatesmall correctionkubeflow infra namespacealpine chrome issue zenikabinding,,
451,db672b885a5c1cdfc4a1893c26f5c4e422dff5bd,ung-Ting Wen <gabrielwen@google.com>, 2019-10-01 09:09:32 +0800, ,kfconfig internal config structure holdingkfctlconfigfieldstatus cachegetpluginspecfuncs condition accesscondition helperfuncs access pluginwriter pluginkfdef vbeta remove functiosnkfloader removesourceversionapplicationsecretrepospluginsfield runtimestatustransformercommitupdateserialize pluginssecret serializerepos serializeserialize cacheinterfacefinish valphachange namingvbeta convertervalphaupdatefinishremovekfconfig converterappdirwriterenameremovefield unused removefieldfield valphafield vbeta,,
452,4a1c06b7f608b434c749c1bca51b7850de61cf27,eremy Lewi <jeremy+github@lewi.us>, 2019-09-28 20:45:38 -0400, ,postsubmits causingevent presubmitworkflowcomma trailingupdateexpected,,
453,ef4137233d82ad70d403391884124f03dc39d69a,man Tabrizian <tabrizian@outlook.com>, 2019-09-28 02:17:39 -0400, ,image notebook docker improve jupytertensorflow image jupyterconda removepython removepython install setuptoolspythonsymlinkinstall dockerfile,,
454,2d80547ae67efd630e8d25e5af1ef1abb52025d2,eremy Lewi <jeremy+github@lewi.us>, 2019-09-27 19:49:40 -0400,4195,apply reconcile revert strawmanreverts commitreconcile strawman deplyfailed resource though cluster creationimplementation reconcile error strawmanwhether determine retying deploymentupdating condition blocked thinkappropriate plugins various conditionsignal running function applyreport whetherrelated reconcile implement semanticsrelated failed though kfctl cluster creation going,,
455,63a5a3346b64f27e1459120939787c934f5059a5,lexey Volkov <avolkov@google.com>, 2019-09-27 15:27:39 -0700, ,proxy fixed deprecatedkubeflow issue,,
456,5ecfa5b2e48a89c6e0d6835cc93a47c04262af28,am Kasravi <kam.d.kasravi@intel.com>, 2019-09-27 12:45:37 -0700, ,breakage kfctlinitialprofile controller,,
457,4a3766b65f8ff104515f9cd5d9cdad56cea0847d,eremy Lewi <jeremy+github@lewi.us>, 2019-09-27 08:25:36 -0400,3035,define workflow pythondefine workflow pythonkubeflow write upgrade kfctlksonnet remove existingsimilar upgrade kfctlpython sense writing convertupgraderelated kubeflow ksonnet migrateprofile default setup return error secretalready calling multiple apply preventsissue related apply kfctl kubeflow rerun failsfixing working juptyer directoryupdatewhether determine using updatecommand kfdef ratheraddress,,
458,663e888ac506a1b35ba495b3fa67a8fbd7f5bd61,un-Kai Hsu <lunkai@google.com>, 2019-09-26 19:27:37 -0700, ,webapp notebook vbeta jupyter,,
459,e38c6f3234b301f33226706c285aafb9bd32d357,ung-Ting Wen <gabrielwen@google.com>, 2019-09-26 09:25:07 -0700, ,semantics operation condition kfdef reconcilepluginfinish conditioncommentstandard remove conditionconditioncompletely removecheckcondition check conflictinginstead pluginvbeta plugininsteadpluginplugin updatedefine condition formatter pluginhardcoded plugin remove conds,,
460,6a0fd60a8bfec01ebff6ff4d1a2760320b399374,ung-Ting Wen <gabrielwen@google.com>, 2019-09-25 10:34:00 -0700, ,release updaterelease updateupdatestale updateupdatemanifest imageconfig versionrelease updatedoctoc,,
461,1a08da099217967086fc3886865f6301786b47be,iaxin Shan <seedjeffwan@gmail.com>, 2019-09-25 08:24:01 -0700, ,manifest kubeflow deployment,,
462,7a74c87523151b4443a81a70d31b71581d3c7a0b,ung-Ting Wen <gabrielwen@google.com>, 2019-09-23 22:49:26 -0700, ,converter kfdefkfloadercheck apiversionloadingloaderapplicationrepos convertsecretplugin constpluginsimple plugincopierfield pluginupdatesetpluginspecfinish pluginupdatepluginupdateparameter overlayuseistio removenotice deprecationupdateupdateserverversion removeremoveupdate,,
463,c61d6bb0450fe96f7e02660387c6fa366eeb8ed6,unming Qu <37601826+kunmingg@users.noreply.github.com>, 2019-09-23 17:33:24 -0700, ,unify logic redirect,,
464,28611e17696844727ecf24f213c7dbae2513d6d9,eremy Lewi <jeremy+github@lewi.us>, 2019-09-23 17:09:25 -0700,4121,config delete manifest kubeflow existingrelated kubeflow manifest configshardcoding extra kfctl configs manifest updatedmanifest kubeflow pulleddelete configs ahead kubeflow avoid,,
465,3a613dabf83608e12fbf06b21962539d17fb6cbb,unming Qu <37601826+kunmingg@users.noreply.github.com>, 2019-09-23 15:33:24 -0700, ,basic estimate,,
466,90315b4c1ac2b35ad775d0e8cb4f2636681b5c30,ason Prodonovich <prodonjs@google.com>, 2019-09-23 16:35:24 -0400, ,falsy rather check value explicit loosen logicblock outside ensure sleep,,
467,f253a4e43ad0abb04fa158060bbb941f0569be58,ason Prodonovich <prodonjs@google.com>, 2019-09-23 15:53:24 -0400, ,improve operation status updateimprove operation status updatedeployment estimateinterval countdown check estimatedstatus instead check indefinitelycapture state change deployment avoid conflict,,
468,443eb16270cc375d59da7786bd1e09165150cfb0,hakradhar N R <38882990+nrchakradhar@users.noreply.github.com>, 2019-09-23 20:31:26 +0530, ,issue kfctl refactor kubeflow firstissue kfctl refactor kubeflow firstremoved method,,
469,de8be1d132da08c1dec84f5c17bbddc643ff77f3,eremy Lewi <jeremy+github@lewi.us>, 2019-09-23 06:17:23 -0700,353,plugins arrikto manifsts additional configuraiton kubeflowconfiguration additional manifest kubeflow movedmanifest kubeflowconfiguration additional pluginskubeflow ratherreason downloadingkubeflow single furthermoredependency vendored bunchcoding plugins currentlyupdatedefine better plugin directoinspecify plugins location kfdefkubeflowrelated kubeflow manifest,,
470,99c03aa4bf110e6cbe0381d46af82f25b5803ade,man Tabrizian <tabrizian@outlook.com>, 2019-09-23 06:25:25 -0400, ,dockerfile jupyter image improveimage notebook docker improve jupytertensorflow image jupyterconda removepython removeminor improvementcomment redundant removeredundant removeenvironment variable dockerfilerefactorpython install setuptoolsjovyanpythontensorflow remove build legacy versionjupyter image build updatepythontensorflow remove build legacy versionjupyter image build updateolder version supportsymlink,,
471,5d03cefe037f533e680c462af4a4750a827c0cad,erome Brette <jbrette@gmail.com>, 2019-09-20 23:21:25 -0500, ,kustomize migrateupdate kustomize phase migrateupdate kustomize phase migratematch package updatemodule updatekustomize phase review implement migraterevert deprecatedrevert deprecatedfield pretty turned deprecatedreruntransformer activate order kustomize phase legacy migrate,,
472,35ce702f2e977f1dfeef21eb0302595846247396,ung-Ting Wen <gabrielwen@google.com>, 2019-09-20 17:04:48 -0700,4165,mergemerge gabrielwen request patch kubeflowdeepcopy vbeta,,
473,9804feb9fc23fc30075632a857087f4b529294e2,ung-Ting Wen <gabrielwen@google.com>, 2019-09-20 15:49:08 -0700, ,deepcopy vbetacatch,,
474,5e0fe8c049f70000ee0b86815aa923a15ea2055a,eremy Lewi <jeremy+github@lewi.us>, 2019-09-20 11:13:25 -0700, ,disable blocking failing,,
475,2f15d8dbe85f0081652c1e5363f6a8c547a3e5fc,eremy Lewi <jeremy+github@lewi.us>, 2019-09-18 14:46:59 -0700, ,manifest kubeflow kfdef updatemanifest kubeflow kfdef updaterelated kubeflow manifest kfdefpulling support kfdef updatefetch kfdefremove configs manifest kubeflow sincelongerbootstrap delete obsolete update informationcommand alwaysclone otherwiseenough depthconfig prepend,,
476,9080d63efa45afa7661405d346d9d2b2b7100491,poorv Verma [AP] <avdaredevil@gmail.com>, 2019-09-18 12:01:31 -0700, ,frontadded manageerror stateadmin clusternormalcontribcontrib removeregistration addednormalpresentation check errorimproving coverage added significantlyremovedcomment prodonjs resolvedcomment prodonjs resolvedformatting fixed issue,,
477,a4286d524a18e86bda97b5fcf05fa4086063513a,poorv Verma [AP] <avdaredevil@gmail.com>, 2019-09-18 06:49:31 -0700, ,backend dashboard centralbackenddivided workgroupmodularized refactored sharedroute everywhere updated movedhandler moved outsidebasic unsecured detection addedchangerebased change mastercontrib added removefixed finalizedlinted prodonjs addressedadded contribs suggested remove seperatedinclude request delete header added,,
478,5dbaf1f7dd28d86a385247a1a3ff202f9cfebac2,ung-Ting Wen <gabrielwen@google.com>, 2019-09-18 05:43:29 -0700, ,kubeflow kfdefvbetachange makefile,,
479,64f4f79ef7d2f1eed1113dce6955437717b94e1b,unming Qu <37601826+kunmingg@users.noreply.github.com>, 2019-09-17 14:57:15 -0700, ,latest config remove unused logic version,,
480,0d52bb563d5f2f28da0def25f9b55fa99eefb740,eremy Lewi <jeremy+github@lewi.us>, 2019-09-16 22:52:24 -0700,4014,kfctlclient deadline respecthandle router inside kfctlcontext reasonable return determined functionwaiting stuck otherwisebackoff period increased minute retrymonitoringcreated deployment successfully kubeflow wouldreportresponse effect blocking requestfailinginstead think incrementing happen counter monitoringkfctlserverbackoff period however setting retryallows based appropriately contextshortmastertracking whether monitoring alerting,,
481,ae9b2c7513c62b497e06d09e1d1f334e7a3c6146,unming Qu <37601826+kunmingg@users.noreply.github.com>, 2019-09-16 14:10:40 -0700, ,config,,
