id,sha,author,date,issue,message,file,content
0,d0dd1f61b33d64e29d8bc1372a94ef6a2fee76a9,he Octocat <octocat@nowhere.com>, 2014-02-12 15:20:44 -0800, ,pointing guide forking,,
1,bb4cc8d3b2e14b3af5df699876dd4ff3acd00b7f,he Octocat <octocat@nowhere.com>, 2014-02-04 14:38:36 -0800, ,create updated readme,,
2,a30c19e3f13765a3b48829788bc1cb8b4e95cee4,he Octocat <octocat@nowhere.com>, 2014-02-04 14:38:24 -0800, ,,,
3,9d352d19a506ea0aa95b79f39e10030d3d4a0f5a,avid van der Spek <vanderspek.david@gmail.com>, 2021-07-21 11:35:50 +0200, ,angular updateangular common updateangular updateexperimental common updateangular material experimental updateentrycomponents replace common removemanuallyangular compatible commonmanuallyfontawesome common updateangular fontawesome fortawesomecommon project update kubeflow dependencyangular localize commonangular localizeangular update jupyterangular updateangular update jupyterangular updateexperimental update jupyterangular material experimental updateentrycomponents remove jupytermanuallyfontawesome update jupyterangular fontawesome fortawesomeangular localize jupyterangular localizeangular tensorboards updateangular updatetensorboards experimental updateangular material experimental updatetensorboards entrycomponents replace removemanuallyfontawesome tensorboards updateangular fontawesome fortawesomeangular tensorboards localizeangular localizetensorboards makefilemanuallyangular volume updateangular updatevolume experimental updateangular material experimental updatevolume entrycomponents replace testbe removemanuallyfontawesome volume updateangular fontawesome fortawesomeangular volume localizeangular localizeangular common updateangular force updateexperimental common updateangular material experimental updatecommon project update kubeflow dependencymanuallyfontawesome common updateangular fontawesome fortawesomecommon locationmanuallyangular fontawesome update jupyterangular fontawesome fortawesomeangular update jupyterangular updateexperimental update jupyterangular material experimental updateangular tensorboards fontawesome updateangular fontawesome fortawesomeangular tensorboards updateangular updatetensorboards experimental updateangular material experimental updateangular volume fontawesome updateangular fontawesome fortawesomeangular volume updateangular updatevolume experimental updateangular material experimental updateangular fontawesome common updateangular fontawesome fortawesomecodelyzer common updatecodelyzerangular devkit install commonangular devkit installangular common updateangular updateexperimental common updateangular material experimental updatecommon project update kubeflow dependencymanuallyangular fontawesome update jupyterangular fontawesome fortawesomecodelyzer update jupytercodelyzerangular update jupyterangular updateexperimental update jupyterangular material experimental updateangular tensorboards fontawesome updateangular fontawesome fortawesometensorboards codelyzer updatecodelyzerangular tensorboards updateangular updatetensorboards experimental updateangular material experimental updateangular volume fontawesome updateangular fontawesome fortawesomevolume codelyzer updatecodelyzerangular volume updateangular updatevolume experimental updateangular material experimental updatefailure commonformat write jupyterformat writevolume format writeformat writeprettier tensorboards manuallyprettier writemockcomponent common entrycomponentsmanuallyangular fontawesome common updateangular fontawesome fortawesomeangular common updateangular updateexperimental common updateangular material experimental updatecommon project update kubeflow dependencymanuallycommonexplicitlyangular fontawesome update jupyterangular fontawesome fortawesomecodelyzer update jupytercodelyzerangular update jupyterangular updateexperimental update jupyterangular material experimental updateangular tensorboards fontawesome updateangular fontawesome fortawesomeangular tensorboards updateangular updatetensorboards experimental updateangular material experimental updateangular volume fontawesome updateangular fontawesome fortawesomeangular volume updateangular updatevolume experimental updateangular material experimental updateaudit common package updatelodash audit material updateaudit update package jupyteraudit material updatetensorboards package audit updateaudit material updatevolume package audit updateaudit material updateformat write jupyterformat write,,
4,66bf469afdc1fc6bfc887c8c823234cc2b70a5d6,imonas Sotirchos <kimwnasptd@arrikto.com>, 2021-07-07 19:06:22 +0300, ,relative fetching translationrelative frontsotirchos kimwnasptd kimonas signedrelative frontsotirchos kimwnasptd kimonas signedrelative frontsotirchos kimwnasptd kimonas signed,,
5,1a2780c80d427cc432f8e3295c0ab4952905629b,tephen Hopper <50119450+hopper-signifyd@users.noreply.github.com>, 2021-07-05 11:22:51 -0500, ,webhook admission support,,
6,36e8528ebefd4ac7c1e37d9c1fbd36cf35db8943,avidSpek <vanderspek.david@gmail.com>, 2021-06-23 13:15:32 +0200, ,additional notebook rstudio server package validationrstudio change server validationkeyserver secondary,,
7,f7671f7d81edfde7c041ff06e6a5f134a9436731,avidSpek <vanderspek.david@gmail.com>, 2021-06-21 16:33:17 +0200, ,spawner source manifest,,
8,d23044d7efe603557cc72c81d2159262b6d3851f,imonas Sotirchos <kimwnasptd@arrikto.com>, 2021-06-21 17:32:17 +0300, ,deprecated removesotirchos kimwnasptd kimonas signed,,
9,7a674c12faaca8fc1e48b5d43a053c5996f2988f,endy Gaultier <wvgaultier@gmail.com>, 2021-06-21 10:26:17 -0400, ,module translation jupytertranslation jupytertranslation jupyterdefault translation jupyteraffinity toleration translation jupyterpolicy image translation jupyterimport translation remove jupyterfront common jupyterfrontend implement jupyterincluding needed component commontranslation refactorbackend front messagestatus tooltipsnackbar messagevolume front tensorboardsfeature projectvolume translationasset refactor jupyterasset folder updatetensorboardsasset updatetranslationdocumentation readmeprettier formattingformat pythoncomment removeauthored saffaalviauthored tongster matsuda,,
10,44eb4fe538b6f03847e8af7a5e604e58dd426672,avidSpek <vanderspek.david@gmail.com>, 2021-06-21 15:00:17 +0200, ,updateimage updatemanifest image update,,
11,6e4ad3b4bfdcecde047b34eb03bf5e0b00f5942f,avidSpek <vanderspek.david@gmail.com>, 2021-06-21 14:12:16 +0200, ,batch dockerfiles notebook server update,,
12,c7ed4a325bafb5d4da8fe94f5225b499a21b016b,ames Liu <37026441+zijianjoy@users.noreply.github.com>, 2021-06-18 15:25:14 -0700,5712,label namespace delete using allowlabel hardcoded profile applies controllerlabel configurableprofile controllergiven profile controller startlabel default namespacecontains profile controller namespacelabel profile valueprofile controller createslabel profile namespace given controller merges existinglabel exist given appliedlabel given value remove emptyalready namespaceinstead using plain configmaplabel profile change restarting withoutcloseyannis zarkadas yanniszark signedauthored jamxl jamesauthored zarkadas yanniszark yannis,,
13,f573b2264a0fe85bb83683e52bd803bcab75f3e0,avidSpek <vanderspek.david@gmail.com>, 2021-06-18 05:06:14 +0200, ,pytorch image building deadline extend,,
14,d67b39cf7de7a573187d111d9ec3ca0688ba2e4a,avidSpek <vanderspek.david@gmail.com>, 2021-06-17 15:44:28 +0200, ,create renovate config folder workflow owner,,
15,e9324d395895e370e1201ac7edb0cd2d99d8b741,avidSpek <vanderspek.david@gmail.com>, 2021-06-17 15:40:28 +0200, ,renovate dockerfiles compatible updaterenovate dockerfiles compatible updatepytorch memory tensorflow jupyterprotobuf updateconda remove expansion substring versionsqlalchemy updateupdate,,
16,977965bd33242eda575158bc741b03d4cc02a335,affa Alvi <alvi118@uwindsor.ca>, 2021-06-09 13:26:51 -0400, ,image hiding support registry jupyterimage hiding support registry jupytervscode image rstudio hiding support registry jupyterupstream rebasing masterprettier hideregistry default formattinghidetag hideregistrywhitespaceimage tooltipauthored jessicabarhoma jessicabarh,,
17,e5c3c57d18ea7eb04c7ddb6f2cf7d5b1c0af0032,urii Komar <Subreptivus@gmail.com>, 2021-06-09 17:50:17 +0300, ,profile controller probe knativeplane certain knative component control probeorder functionhealthzmetricreadydrainprofile istio apply controller extendallows trafficinstruction knativeallowing authorization access istio serving systemrequest cluster public internaltransformer predictor traffic supporteddiscussing kubeflow continuekubeflowkubeflow kfservingkomar yurii subreptivus signed,,
18,9b60b945396612000b5b1b7778ee9b2ea3bbd785,avidSpek <vanderspek.david@gmail.com>, 2021-06-03 18:24:37 +0200, ,connecting explanation notebook server kernel,,
19,d1d6d649ba07a62fc8747cf08438a9312bed2378,avidSpek <vanderspek.david@gmail.com>, 2021-06-03 18:10:37 +0200, ,backend jupyter remove string,,
20,e6af287cf2f1233fff36a30f14bd7e08ad93b3ba,aeyeon Kim <anencore94@gmail.com>, 2021-06-04 00:53:36 +0900, ,volume workspace mountpath parse jupytervolume workspace mountpath parse jupyterworkspace volume fixed jovyanconfig enable parse jupyterchange correctly parsing,,
21,189b89deba6e0e5b0a3ad6f4d00105ec1ad879dd,oshi_k <high_luin@yahoo.co.jp>, 2021-06-04 00:25:36 +0900, ,scrollable,,
22,434b10ab49bf95f91d24fa3fc87cb9ef34f71355,avidSpek <vanderspek.david@gmail.com>, 2021-06-03 17:13:37 +0200, ,image notebook iframe rstudio update allowrstudio notebook image updatesubstring remove removal,,
23,6c41e72b100cdb0fb450e7cf7a1447e1f89b097e,avidSpek <vanderspek.david@gmail.com>, 2021-06-03 15:38:36 +0200, ,renovate notebook compatibility updaterenovate notebook compatibility updatekubectl separate,,
24,054be479bb10eea118a88b249b467a8cb53d4757,affa Alvi <alvi118@uwindsor.ca>, 2021-06-02 13:44:35 -0400, ,asset service jupyterfront ignore assetasset service jupytercommonremovefront asset remove jupyterauthored gaultier wendy wvgaultier,,
25,ab0a20fe678577005c3c7bf598090e8d328b2f40,uliusvonkohout <45896133+juliusvonkohout@users.noreply.github.com>, 2021-06-02 19:28:35 +0200, ,openshift number kubernetes stringupdateupdateupdatewhitespace issue,,
26,5487b167738d5e11755b38c2f93dde78486fbf18,oshi_k <high_luin@yahoo.co.jp>, 2021-05-31 23:47:03 +0900, ,namespaced possiblenamespaced possiblenesting level reduce,,
27,e21819c36389bb5eccbf82ae0f6da0b4de72d8ca,imonas Sotirchos <kimwnasptd@arrikto.com>, 2021-05-31 11:36:03 +0300, ,override asset configmapstatic frontstatic source containdeveloping resultfound static commit configmapsotirchos kimwnasptd kimonas signedfront fetch changestatic change assetstatic assetsotirchos kimwnasptd kimonas signedmanifest override assetdirectory configmap mount asset staticoverride content entire assetsotirchos kimwnasptd kimonas signed,,
28,18264c8fcf00ceb225a0243377874a7df4301b98,avidSpek <vanderspek.david@gmail.com>, 2021-05-25 16:30:09 +0200, ,controller tensorboard issue binding,,
29,2d845ee97da9650171701126ad56b34fddd51a7c,imonas Sotirchos <kimwnasptd@arrikto.com>, 2021-05-17 18:25:31 +0300, ,volume format checkcheck front formatting scriptsotirchos kimwnasptd kimonas signedfront package updatebring install packagesotirchos kimwnasptd kimonas signedfront formattingsotirchos kimwnasptd kimonas signedformattingsotirchos kimwnasptd kimonas signeddockerignore unused docker removedockerignore created globalparentsotirchos kimwnasptd kimonas signeddocker dockerfilesotirchos kimwnasptd kimonas signeddockerignore includesotirchos kimwnasptd kimonas signedformat checksotirchos kimwnasptd kimonas signedbuild docker necessarysotirchos kimwnasptd kimonas signedreview instead docker contextdockerignore insteaddockerignore global docker contextsotirchos kimwnasptd kimonas signed,,
30,770435fe8e16d7c5a824a9ae2b6428a0a517b401,avidSpek <vanderspek.david@gmail.com>, 2021-05-16 09:53:29 +0200, ,kustomize build,,
31,6d6b78bcaa53480392c5acb71be578b9b9328e8d,ames Liu <37026441+zijianjoy@users.noreply.github.com>, 2021-05-06 04:39:05 -0700, ,reference comment rstudio chore,,
32,f757f4ee1ed1c55d4d8930a13c574bcb5872409c,avidSpek <vanderspek.david@gmail.com>, 2021-04-27 19:15:14 +0200, ,notebook extension server update jupyterlab,,
33,2ed54bcce7cbc38f0f63bfb32f7f5ef677a58765,avidSpek <vanderspek.david@gmail.com>, 2021-04-13 17:40:11 +0200, ,factor notebook configurable limit multiplicationfactor notebook configurable limit multiplicationconfigurable limit advanced sectionprettier format frontendbackend formatting roundingsmaller request return error limitdisabling limitfactor setting allowbackend remove python camelcase reviewmanifest directory updatebackend limit review settingbackend check remove review unnecessary,,
34,d73e468aba82bdcf04fc9b02fa6b73347fae9e81,avidSpek <vanderspek.david@gmail.com>, 2021-04-13 14:04:04 +0200, ,configurable trademark remove jupyterreference configmap trademark remove rebase configurablerebased change package removeimage suggested change readme review section group,,
35,8a1259928981ec70d050ba317a246e9d982ee2fb,annis Zarkadas <yanniszark@arrikto.com>, 2021-04-09 12:35:03 +0300, ,pruning profile controller issuefield unknown plugins marker preservingyannis zarkadas yanniszark signedmanifest regenerateyannis zarkadas yanniszark signed,,
36,52b724b3221685042415cb927d4c225b28657d17,lias Katsakioris <elikatsis@arrikto.com>, 2021-04-09 03:27:03 +0300, ,unbound controller tensorboard schedulingcheck attempt controller schedulepanic accessmodes controllerensure check commitkatsakioris elikatsis signed ilias,,
37,923a7c8c871b3c1c2307c9253bde74a8286f91f3,athew Wicks <thesuperzapper@users.noreply.github.com>, 2021-04-09 03:19:03 +1000, ,initial notebook image server,,
38,43e03d4ae176c735e53843f8f0b3f7d7ed79756b,imonas Sotirchos <kimwnasptd@arrikto.com>, 2021-04-08 13:51:02 +0300, ,format check jupyterfront format checkingsotirchos kimwnasptd kimonas signedformat check commonsotirchos kimwnasptd kimonas signedformat checksotirchos kimwnasptd kimonas signedformattingsotirchos kimwnasptd kimonas signedfront formattingfrontend format writesotirchos kimwnasptd kimonas signedprettier include frontsotirchos kimwnasptd kimonas signeddocker dockerfilesotirchos kimwnasptd kimonas signeddockerignore globalsotirchos kimwnasptd kimonas signeddockerignore unused removesotirchos kimwnasptd kimonas signeddockerignore include cleanupsotirchos kimwnasptd kimonas signed,,
39,e8250b9f85b724580ad88c9035eeae41dae12891,avidSpek <vanderspek.david@gmail.com>, 2021-04-08 12:50:02 +0200, ,pytorch tensorflow dockerfiles image python update package,,
40,3dbc352fc14dfd389638186d402583ceadc1f520,avidSpek <vanderspek.david@gmail.com>, 2021-04-08 11:11:02 +0200, ,image second layer python docker update,,
41,ebc0c4f073397537412694f9f255dbb3fbdf2043,avidSpek <vanderspek.david@gmail.com>, 2021-04-06 13:22:00 +0200, ,notebook image server update,,
42,98fc2dcb57fe0a5311abed28510a4df58a506971,eremy Lewi <jeremy+github@lewi.us>, 2021-03-26 15:52:47 -0700, ,jlewi approver removebetter assignment removing,,
43,096d31783c0924d0a1e8fd9606feaae203711b0f,avidSpek <vanderspek.david@gmail.com>, 2021-03-26 11:35:46 +0100, ,specify controller tensorboard commonlabels,,
44,9c63a3b713f6dbc5f72dab21ff7288ef63cbadc3,annis Zarkadas <yanniszark@arrikto.com>, 2021-03-26 03:37:46 +0200, ,owner release notebook releasingyannis zarkadas yanniszark signed,,
45,50902c6b58218e3f823e744c76585b4bc9077b2a,annis Zarkadas <yanniszark@arrikto.com>, 2021-03-25 00:52:45 +0200, ,establish release processchange versionyannis zarkadas yanniszark signedrelease image change build versionyannis zarkadas yanniszark signedreleasing helperyannis zarkadas yanniszark signedrelease image parameter pushing testing workflowyannis zarkadas yanniszark signed,,
46,3fccec822b3a485fed9c06e3023bac9dd253ec34,imonas Sotirchos <kimwnasptd@arrikto.com>, 2021-03-24 22:52:45 +0200, ,amend entry central automl dashboardexperiment katib automlpipeline rename experimentmodified sligthlysotirchos kimwnasptd kimonas signed,,
47,9f5998b7c1e7980c6be5e3ccd390a5958077a51c,avidSpek <vanderspek.david@gmail.com>, 2021-03-24 17:06:45 +0100, ,volume tensorboards dashboard central,,
48,d50fc030bd51e82f67423db457368c139df431db,uan (Bob) Gong <4957653+Bobgy@users.noreply.github.com>, 2021-03-24 23:38:45 +0800, ,label profile namespaces enabled controller,,
49,ec25760b2779c2427af147863664f613990f37ce,avidSpek <vanderspek.david@gmail.com>, 2021-03-24 16:04:45 +0100, ,break remove unused manifest kustomize params newer,,
50,2d0f0a3350385577b9358f5390d44a4a2fa29a55,avidSpek <vanderspek.david@gmail.com>, 2021-03-24 15:35:45 +0100, ,kustomization manifest fieldpath updatemanifest image latest updatevalue remove duplicate central dashboard,,
51,e6fdf515c09ba1f695d60a87c9c56ba5fb1718e8,imonas Sotirchos <kimwnasptd@arrikto.com>, 2021-03-24 14:16:45 +0200, ,introduceintroducewhether variable expose configurecooky secureadmins allow configureexposed kubeflow localhostsotirchos kimwnasptd kimonas signedswitch order checkbackend order following checkpresent check cookiepresent check headervalue check header cookiesotirchos kimwnasptd kimonas signedfalserunning makefilessince explicitlyservedsotirchos kimwnasptd kimonas signed,,
52,05ba7a65ad77cdea718275bdefead6c88cf50515,avidSpek <vanderspek.david@gmail.com>, 2021-03-23 21:05:44 +0100, ,statement trademark spawner notebook rstudiorstudio trademark statementbutton position tooltip right rstudiolabeltitle trademark tooltip remove rstudio index jupyter,,
53,db9bcf998dcdaa562540854abc103185698676e1,avidSpek <vanderspek.david@gmail.com>, 2021-03-23 20:30:44 +0100, ,image latest notebook manifest update,,
54,164fa2ea9a561d802d97ea9bef0a30c8f645e026,avidSpek <vanderspek.david@gmail.com>, 2021-03-23 18:28:44 +0100, ,notebook dockerfile rstudio server tidyversenotebook dockerfile rstudio server tidyverseimage notebook rstudio cleanup tidyverseauthored thesuperzapper mathew,,
55,15d229d414c4a60c7c42df931936e1b1d9ea15d5,athew Wicks <thesuperzapper@users.noreply.github.com>, 2021-03-24 03:53:44 +1100, ,rstudio notebook image,,
56,1cf3a4ac34ff03faf48631cc84fb2684cfc8698d,tefanoFioravanzo <stefano@arrikto.com>, 2021-03-23 17:15:44 +0100, ,force redirection iframe configmapstefano fioravanzo signed,,
57,1612ecb87cd4381e7c05292d88c957c4f0f2d852,imonas Sotirchos <kimwnasptd@arrikto.com>, 2021-03-23 17:50:44 +0200, ,manifest jupyter updatemanifest variable prefixsotirchos kimwnasptd kimonas signedmanifest variable removesotirchos kimwnasptd kimonas signedmanifest imagesotirchos kimwnasptd kimonas signedmanifest spawner updatesetting imagepullpolicyconfig jupytersotirchos kimwnasptd kimonas signedmanifest start permissionsotirchos kimwnasptd kimonas signedimage latest jupytersotirchos kimwnasptd kimonas signed,,
58,f779f93b27a18dc3552cffc4fc031a2cc0d20658,imonas Sotirchos <kimwnasptd@arrikto.com>, 2021-03-23 17:46:44 +0200, ,tensorboards specific manifest namespacesotirchos kimwnasptd kimonas signed,,
59,5cb03c8511dd99874668364e34819009bf500a93,avidSpek <vanderspek.david@gmail.com>, 2021-03-23 15:37:44 +0100, ,rstudio notebook server dockerfilestudio imageimage notebook rstudio server cleanup,,
60,1831e43632757a02187b511cfe257f8fcf910a11,avidSpek <vanderspek.david@gmail.com>, 2021-03-22 18:09:17 +0100, ,image activation conda jupyterlab cleanup,,
61,abf9ec48c1d1fb9e8e685f35632f6fd260306491,avidSpek <vanderspek.david@gmail.com>, 2021-03-22 16:45:17 +0100, ,jupyterlab activation conda cleanup,,
62,2dd0e3e49f14d52f6623137de67e033f88b6f170,avidSpek <vanderspek.david@gmail.com>, 2021-03-22 16:10:17 +0100, ,notebook dependency cleanup update,,
63,26ff6e698792e5f4ca6dad006627263083e44e7f,avidSpek <vanderspek.david@gmail.com>, 2021-03-22 15:48:18 +0100, ,activation notebook conda server jupyterlab,,
64,f753ef1aa60281ac4c57a7c3b84f7c0b2fe22aec,avidSpek <vanderspek.david@gmail.com>, 2021-03-22 13:09:18 +0100, ,selector server studioresource annotation setting abilityexist spanwer updatevscode image config rstudio annotation frontfront server togglebased notebook request annotation server frontindex front server columnformatting button improve review togglerstudio image tidyversebackend rewrite review headerreview environmentallowing review image customindex review server,,
65,c99f886bbb3cc66d374e698d2faedf20c1fd3553,avidSpek <vanderspek.david@gmail.com>, 2021-03-22 11:58:17 +0100, ,notebook codeserver dockerfile python servernotebook codeserver dockerfile python serverimage python codeserver cleanupauthored thesuperzapper mathew,,
66,7884084420dba80a457e069500836d60b8e30cb4,avidSpek <vanderspek.david@gmail.com>, 2021-03-22 08:32:17 +0100, ,notebook dockerfile scipy server jupyternotebook dockerfile scipy server jupyterscipy image cleanup jupyterauthored thesuperzapper mathew,,
67,a9821baa0d8f007ff70f6349c7af2e8086aa1130,avidSpek <vanderspek.david@gmail.com>, 2021-03-22 08:16:17 +0100, ,tensorflow dockerfiles notebook server jupyter,,
68,0cb715bec96528ff7af66fcd8b15d347e6eec077,imonas Sotirchos <kimwnasptd@arrikto.com>, 2021-03-21 23:28:17 +0200, ,manifest controller tensorboardsotirchos kimwnasptd kimonas signed,,
69,121d97f4a2cba6d8de3675203ca5996fea4b1c29,avidSpek <vanderspek.david@gmail.com>, 2021-03-21 21:48:17 +0100, ,listing clusterrole detection vendor,,
70,53099bbd5f38a65666762a9e60f657318275e3b8,avidSpek <vanderspek.david@gmail.com>, 2021-03-21 20:20:17 +0100, ,notebook codeserver server dockerfileserver imageimage notebook codeserver cleanupauthored thesuperzapper mathew,,
71,d609b9e19971980b312175899c225aeacb3feb1e,avidSpek <vanderspek.david@gmail.com>, 2021-03-21 19:48:17 +0100, ,tensorflow dockerfiles notebook servertensorflow imagetensorflow image notebook cleanup jupyterauthored thesuperzapper mathew,,
72,2e5b39c63535d2dba5324f0099801c7d134f38ea,annis Zarkadas <yanniszark@arrikto.com>, 2021-03-21 20:05:17 +0200, ,missing configmapyannis zarkadas yanniszark signed,,
73,de7c3f0091b0dd69a28da5ef14b9ec866c95ca78,avidSpek <vanderspek.david@gmail.com>, 2021-03-21 18:48:17 +0100, ,pytorch dockerfiles notebook server jupyter,,
74,8dea17079bab34eeeb5df92d5e5e3dbbb3f91731,avidSpek <vanderspek.david@gmail.com>, 2021-03-21 17:07:17 +0100, ,pytorch dockerfiles notebook server jupyterpytorch imagepytorch image notebook cleanup jupyterpytorch dockerfiles rename jupyterauthored thesuperzapper mathew,,
75,b3fe73b2c66776b802d5b279f46b235401780d50,avidSpek <vanderspek.david@gmail.com>, 2021-03-21 16:11:17 +0100, ,dockerfile notebook server jupyterjupyter image based dockerfilenotebook image cleanup jupyterauthored thesuperzapper mathew,,
76,4892c583e0270fa9b88686295c0faebf60328f3c,avidSpek <vanderspek.david@gmail.com>, 2021-03-21 12:50:17 +0100, ,notebook server dockerfileimage dockerfileimage removeoverlaychange namingbuildchange config character limit naming avoidownerfolder renamefolder renamelabel removefinal rename foldernotebook image cleanup dockerfileauthored thesuperzapper mathew,,
77,797020f5c53dbcb75fc509df39b738766ab6ba16,avidSpek <vanderspek.david@gmail.com>, 2021-03-21 10:44:17 +0100, ,image notebook configs server preparenotebook makefiles updateregistry notebook,,
78,7590abfc43f62dea2e07c933ff578de4ada58a60,iklas Hansson <niklas.sven.hansson@gmail.com>, 2021-03-21 04:56:17 +0100, ,broken,,
79,4c282f5b47c8052cf72c59b04b4b1e42535d4552,imonas Sotirchos <kimwnasptd@arrikto.com>, 2021-03-20 15:58:17 +0200, ,folder distinct deprecated jupytersotirchos kimwnasptd kimonas signed,,
80,c542fd8a2ae29f1bbe8b3a5229ee7ce1bcee3046,imonas Sotirchos <kimwnasptd@arrikto.com>, 2021-03-20 01:22:17 +0200, ,volume manifestsotirchos kimwnasptd kimonas signed,,
81,942326f510be2ba24502523c9839e629507cf2a0,imonas Sotirchos <kimwnasptd@arrikto.com>, 2021-03-20 01:21:17 +0200, ,manifest tensorboardssotirchos kimwnasptd kimonas signed,,
82,7f5190bc3cf857f6a2d96ffb5997660d6b909738,annis Zarkadas <yanniszark@arrikto.com>, 2021-03-20 01:09:17 +0200, ,manifest notebook controllernotebook manager remove controller gitignoreyannis zarkadas yanniszark signedmanifest notebook controller missingyannis zarkadas yanniszark signed,,
83,40fae6a36e029fdae1aa920ec10ec79f47a9a5cd,avidSpek <vanderspek.david@gmail.com>, 2021-03-19 19:15:17 +0100, ,authorization istio recreation authz policy supportauthorization policy instead istioistio change instead resourceistiodavidspek signedfixup commitdavidspek signedgofmtyannis zarkadas yanniszark signeddavidspek signedyannis zarkadas yanniszark signeddavidspek signederror rebasedavidspek signed,,
84,23a529d0736a6a511ac191168d49cd941864535b,annis Zarkadas <yanniszark@arrikto.com>, 2021-03-19 20:08:16 +0200, ,consolidate profile manifestmarker profile controller kubebuilderyannis zarkadas yanniszark signedgenerate manifest profile controlleryannis zarkadas yanniszark signedprofile controller apiversionyannis zarkadas yanniszark signedprofile kubebuilder match manifest controller existingyannis zarkadas yanniszark signedprofile unused delete controller manifestyannis zarkadas yanniszark signedprofile explain structure manifest controlleryannis zarkadas yanniszark signed,,
85,e046f908d9046e76d4cb9a61c889c31c454fcb30,annis Zarkadas <yanniszark@arrikto.com>, 2021-03-19 20:03:17 +0200, ,webhook manifest consolidate admissionwebhook manifest consolidate admissionyannis zarkadas yanniszark signednamed admission deployment webhook serviceyannis zarkadas yanniszark signed,,
86,e828a7ded9e460ae9553df157f4abaa5d6fb965f,annis Zarkadas <yanniszark@arrikto.com>, 2021-03-19 19:31:16 +0200, ,manifest consolidateyannis zarkadas yanniszark signed,,
