id,sha,author,date,issue,message,file,content
868,358379b8b42a0d7fb2ec890c0d6bc9a79daaea91,ung-Ting Wen <gabrielwen@google.com>, 2019-03-28 10:46:46 -0700, ,regex modification instead replacementsupport bindingwritekubeflow config clusterkubeflow storage supportcomment,,
869,c44e95b1e9749b75542d599a559b161fea5d4fd9,eremy Lewi <jeremy+github@lewi.us>, 2019-03-28 08:52:44 -0700,2610,kfctlkfctlrelatedbased uniquepulling revertrequestincrease,,
870,c5977793d5615e4ff867d5f0853e26a1201deb13,unming Qu <37601826+kunmingg@users.noreply.github.com>, 2019-03-27 18:32:43 -0700, ,openmpi registry remove,,
871,55ad7b16116dc85f01edeef5bc3b42da1ef36e9d,am Kasravi <kamkasravi@yahoo.com>, 2019-03-27 16:18:47 -0700, ,create apply resource kfctl deploy failscreate apply resource kfctl deploy failsapply remove kfctl,,
872,cb00ecf9a5a1eff69e5fd715ac97d31e534fe7ee,un-Kai Hsu <lunkai@google.com>, 2019-03-27 15:02:49 -0700, ,image update,,
873,ae10dc942712f0c7178f46e05f051660be994438,un-Kai Hsu <lunkai@google.com>, 2019-03-27 14:18:47 -0700, ,webhook admissionupdate,,
874,acb03c109a6a66ab7d8316df940f9770e32dd4f0,ung-Ting Wen <gabrielwen@google.com>, 2019-03-27 10:40:48 -0700, ,named kubeconfig contextaddnamedcontextnamespacewrite optionally kubeconfigupdaterevertstripaddnamedcontext apply,,
875,cee0f6e3f84e01009abef3b81db65c6e3f36d91a,uan (Terry) Tang <terrytangyuan@gmail.com>, 2019-03-27 09:34:47 -0400, ,resource update,,
876,e4665a08f45e245d95cf3da8025db1849b0fc2ea,am Kasravi <kamkasravi@yahoo.com>, 2019-03-27 06:00:49 -0700, ,appearing attribute kfctl deletestorage platform,,
877,0969d745b817bbee7a9dbc3e2a1a7cd72c0dc469,un-Kai Hsu <lunkai@google.com>, 2019-03-26 22:24:47 -0700, ,updateimage updatetfjob update,,
878,6eddd95e95ec74251828d567d239c8ce8f549cbe,eremy Lewi <jeremy+github@lewi.us>, 2019-03-26 21:28:47 -0700,2610,verify kubeflow kfctlextend kubeflow verify binaryrelatedcreate kubeflow verify deployedconfigured reusemodified couldopportunity convertconfigured component currentlydepend modify followenable passingaddressdisable flaky related katib stduy,,
879,9dcef605b8aae96d13d29a5175782240f9af5e87,un-Kai Hsu <lunkai@google.com>, 2019-03-26 17:08:47 -0700, ,status container notebookformat,,
880,4485a65079a1b445195cb7cc34035655919aaaea,eremy Lewi <jeremy+github@lewi.us>, 2019-03-25 20:19:16 -0700, ,guide developer updateerror instruction build kfctl,,
881,353834cfbecdcf95c2bbc5068fa0f9a6f92ab76b,ung-Ting Wen <gabrielwen@google.com>, 2019-03-25 17:51:17 -0700, ,check apply acutal,,
882,cefb791989bb97f38481cd0618468556331cd693,abbasi <z.abbasi@gmail.com>, 2019-03-25 16:52:16 -0700, ,image retag jupyterimage retag jupyterdefault updated image jupyter,,
883,80baee129657f7aa4e93e3adbb820e0629ddbbfd,un-Kai Hsu <lunkai@google.com>, 2019-03-25 14:02:22 -0700, ,image update,,
884,f32efbce050024c55d3e5060e58d4bf66def870e,eremy Lewi <jeremy+github@lewi.us>, 2019-03-25 12:26:18 -0700, ,jupyterhub setting config parameterjupyterhub installing component jupytertrying parameterlisting config ksonnet presubmitsbranch component configurerunning activate local support account service,,
885,809da2e8ecf241877d2ce3b04443a3e41951e7dd,uan (Terry) Tang <terrytangyuan@gmail.com>, 2019-03-25 11:49:11 -0400, ,operator alsologtostderr missing,,
886,3fa97bc61e7b4b1eeb0062a8cbc98920e9da43d5,abbasi <z.abbasi@gmail.com>, 2019-03-24 14:49:05 -0700, ,notebook controller deployment added jupyterdployment added jupytersmall formattingnotebook controller added jupyter,,
887,4addac44f235fa89145e586be5dcb7fbd94fe261,poorv Verma [AP] <avdaredevil@gmail.com>, 2019-03-24 00:29:05 -0700, ,privacy change implementedprivacy change implementedartifact removed unnecessary,,
888,75170fbe6a628359cae8ff116851c15f52563dc4,poorv Verma [AP] <avdaredevil@gmail.com>, 2019-03-24 00:17:04 -0700, ,selector namespace activity,,
889,da4d2382f69671a2015596cd4d4f767c741a59ec,ung-Ting Wen <gabrielwen@google.com>, 2019-03-23 17:57:05 -0700, ,component spartakusspartakususageid assigndisable option usage reportfilter spartakusdelete paramsmessage warningdisable spartakususageid component spartakus,,
890,20a80512693d33c1d6f348a0d5b028d9d28472a0,olden Karau <holden@pigscanfly.ca>, 2019-03-23 15:53:06 -0700, ,regex kubeflow distribution,,
891,59662417fe33291d75008e931091bc512cfb4d7c,bhilash Pallerlamudi <stp.abhi@gmail.com>, 2019-03-23 14:41:05 -0700, ,clusterrole operatorabhilash pallerlamudi signed,,
892,1ae2bd1d1146b282a59f173f8d92d9d4faadfd60,abbasi <z.abbasi@gmail.com>, 2019-03-23 11:57:05 -0700, ,image jupyterimage jupyterworkflow addedfixed,,
893,b0a5b9065f6000a49ff24c4e7d045a4f496b586e,unming Qu <37601826+kunmingg@users.noreply.github.com>, 2019-03-23 09:11:06 -0700, ,config updateconfig updatecomment machine exposelabel revert change ipname cluster application kubeflow,,
894,423c00bf3224a56b934225b8e27ceb644f4b0a6e,ason Prodonovich <prodonjs@gmail.com>, 2019-03-23 10:05:06 -0400, ,version obtain build,,
895,775e801fdbd3f068b523138e95e9f5af074c4cf5,ung-Ting Wen <gabrielwen@google.com>, 2019-03-22 19:43:06 -0700, ,kferror interfacekferrorskferror interfacestatus,,
896,9d68724a4985d9d184f4a3a17513daf7dc19ee73,un-Kai Hsu <lunkai@google.com>, 2019-03-22 16:46:07 -0700, ,image update,,
897,7a119cb8e50c8b834b32ec3a61752d1d596f3cba,ronPan <yangpa@google.com>, 2019-03-22 14:52:17 -0700, ,pipeline version updateassign neuromage,,
898,0163dc80abd201777cb189516e8421dc4fa5cf1b,unming Qu <37601826+kunmingg@users.noreply.github.com>, 2019-03-22 14:52:10 -0700, ,replace download manifest entry ksonnetreplace download manifest entry ksonnetistio resolve comment kustomize review ksonnet,,
899,b66cd6d54d1054079430c9fd0be9079f6c988746,unming Qu <37601826+kunmingg@users.noreply.github.com>, 2019-03-22 14:16:12 -0700, ,kubeflow ksonnet cachekubeflow ksonnet cachechange master since merged,,
900,58c4c612bee6998fb6fa43340e89b7b5891d4b2e,un-Kai Hsu <lunkai@google.com>, 2019-03-22 12:29:09 -0700, ,delete,,
901,3e36fed2309db2732153bfb79d7b1ad2c42890f6,ung-Ting Wen <gabrielwen@google.com>, 2019-03-22 10:54:49 -0700, ,delete kfctlgcputilsplatform gcputilsuncommentkubeconfig manualuncommentdelete deploymentwhole delete comment ksonnetdelete idempotentclean policyunused removeremovedbetter loggingdelete storageupdatelicenseupdateupdateupdatecheckclean bindingclean,,
902,1b4883f2e64b1d5403460b567d7b3b4e4423dba1,abbasi <z.abbasi@gmail.com>, 2019-03-21 21:46:18 -0700, ,notebook status controller readyreplicas addednotebook status controller readyreplicas addedissue fixed related notebook status updatingfixed problem notebook status updatingcomment appliedchange smallchange small formating,,
903,50d08f772558215045d8da63d520cafcc8825b76,am Kasravi <kamkasravi@yahoo.com>, 2019-03-21 20:26:20 -0700, ,platform written ipname specified,,
904,73a9fc8d88905723eb0b5a9fec1bccf5192370a8,am Kasravi <kamkasravi@yahoo.com>, 2019-03-21 16:00:21 -0700, ,optionserver kfctl platform provided incorrect ksonnet specifiedoptionserver kfctl platform provided incorrect ksonnet specifiedidempotent cache downloadestablished return server error version,,
905,8e01819deed0763b74e7a7c8a451a2b87883243b,anasi Vartak <45020474+mvartakAtVerta@users.noreply.github.com>, 2019-03-21 15:29:56 -0700, ,modeldb kubeflow supportupdateupdateupdate,,
906,8f61422fab038f9cd3f1d664723ba68daa62fc5a,un-Kai Hsu <lunkai@google.com>, 2019-03-21 15:29:48 -0700, ,webhook manifest admissionwebhook manifestreadme,,
907,2095c79fb541c08a4b5d1482961476f21a3577c7,un-Kai Hsu <lunkai@google.com>, 2019-03-21 14:33:37 -0700, ,istio install kfctlgenerateapplysecretreview,,
908,9a618cf36914581501ab7bea371823199cb5b3da,un-Kai Hsu <lunkai@google.com>, 2019-03-21 12:56:30 -0700, ,,,
909,759d71e8cc21a05f53660a7b3603d05f51780d49,am Kasravi <kamkasravi@yahoo.com>, 2019-03-21 10:53:39 -0700, ,swagger passing support kfctlswagger passing support kfctlswagger passing support kfctlconfig ksonnet passingusage kfctl updatesuggestion gabriel review update,,
910,0c304166b46f41f098b5233540709202e5879e90,am Kasravi <kamkasravi@yahoo.com>, 2019-03-20 18:41:36 -0700, ,creates binding kfctl policy invalid email,,
911,db69d52e831107580fd24556471c22d0fac7ef1f,unming Qu <37601826+kunmingg@users.noreply.github.com>, 2019-03-20 17:43:38 -0700, ,write modify following policy buildwrite modify following policy buildcomment address,,
912,b066e07d8f3d81b6487712168ceb045de987fd75,imonas Sotirchos <kimwnasptd@arrikto.com>, 2019-03-20 23:28:59 +0200, ,create storageclass defaultdefault storageclass checkdefault storageclasscreate workspace neithersotirchos kimwnasptd kimonas signedcreating clientclient instead using dictsclass kubernetessotirchos kimwnasptd kimonas signedsharp cornersotirchos kimwnasptd kimonas signedfunction helperfunctionsecret loadingparameterized value decodingvalue always currentlysotirchos kimwnasptd kimonas signedhandle tokensotirchos kimwnasptd kimonas signedrefactor cleanupsotirchos kimwnasptd kimonas signedstorage permission classsotirchos kimwnasptd kimonas signedloggingsotirchos kimwnasptd kimonas signedreorganizecreate baseui duplication reduce modulewebapps makefilesotirchos kimwnasptd kimonas signeddockerfile updatesotirchos kimwnasptd kimonas signedprodonjs avdaredevil reviewersotirchos kimwnasptd kimonas signedcommentcomment descriptivequote single double replacebaseui module readmesotirchos kimwnasptd kimonas signedownersotirchos kimwnasptd kimonas signed,,
913,6daec47952c97ad5a88a505bcbaba068885372b9,am Kasravi <kamkasravi@yahoo.com>, 2019-03-20 11:07:47 -0700,2691,clientspec kfctlvalpha bootstrap attribute kftypes common clientvalpha bootstrap attribute kftypes daedcf common clientvalpha bootstrap attribute kftypes adacf common clientvalpha bootstrap attribute kftypes common clientgenerate config ksonnet updatevalpha bootstrap attribute kftypes common clientunmarshalunmarshalconfig issue kfctldeepcopy kustomize updategenerate config ksonnet updategenerate config ksonnet updatepossible rename client kfdefrename kfapp clientchanged revert clientcltypes kfdefs updatechanged revert clientcltypes cbcba kfdefs updaterefactoring client kfdefupstream rebase master conflict resolvedsetting incorrectcomment newkfapp updatereturned downloadtocache documentation updateupstream master rebasegenerate username longer passwordgenerate username longer passwordgenerate idempotentminute retries retry,,
914,f83fd691d4b5da090473f88074ed970c3205d412,eadeyegoodwin <davidg@nvidia.com>, 2019-03-20 04:52:22 -0700, ,driver enabled launch compatibility trtserverensure container entrypoint driver compatibilitycommand enabled containerlaunch,,
915,5f66d6ef56802edd36c69d03e674f0e6ae9a8e07,ung-Ting Wen <gabrielwen@google.com>, 2019-03-19 19:32:23 -0700, ,basic password usernamedisable kustomizeparams username remove passwordclioption removecheckremovecomment revertgopathrebasepassword username updateupdateupdatenaming update,,
916,cc2e17ce362698116209c89b06596ac3545ca0c4,poorv Verma [AP] <avdaredevil@gmail.com>, 2019-03-19 18:24:22 -0700, ,polish changepolish changetoolbar visibleclearer namespace viewing adjusted selector coloreasier empty state messagecomment prodonjs addressedimage updated,,
917,52803238ee0af9ac9d51e007fba75d62728103ae,ung-Ting Wen <gabrielwen@google.com>, 2019-03-19 17:42:25 -0700, ,presubmitgopathstdoutkubeflowrevertrevertstderr stdoutrevertactivate account serviceadmin setupstderremail change,,
918,52cbb4c7a36f77dc395a25cb3cccba2f522e3fd7,abbasi <z.abbasi@gmail.com>, 2019-03-19 10:30:26 -0700, ,image added jupytertensoflow image added jupyterchange smallfixed,,
919,e8af8e5c15b4043ea218d40f53a4f6315d5a58cd,att Rickard <m@rickard.email>, 2019-03-18 15:04:22 -0700, ,fairing update,,
920,9963ce38f2cfcdf8b5072cae813972b3277b2ca7,ason Prodonovich <prodonjs@gmail.com>, 2019-03-18 16:46:22 -0400, ,namespaces activityhandling error service loggingstyle activity mirror seperate,,
921,28d9e09793bf52c9c396533ea226d97141effbf4,un-Kai Hsu <lunkai@google.com>, 2019-03-18 11:20:23 -0700, ,webhook inserting credential admissionwebhook,,
922,e78c2705683907a91abb2f731beac74b14cda33f,am Kasravi <kamkasravi@yahoo.com>, 2019-03-16 15:22:57 -0700, ,failure kfctl,,
923,b0c20bb6d2ab431ab8cb8fe080ee76c8a8c236c5,eremy Lewi <jeremy+github@lewi.us>, 2019-03-16 14:34:58 -0700,2706,deploy kubeflow basic kfctldelete attemptdelete fails kubeconfig kfctldelete marked expectedbinary kfctl logging improvestatus operationprint thing error quota creationcoordinator apply resource command delete generate invokeswitch calling statement alwaysrespecting apply parameter platform delete generateattemptcalling eliminate serveraddress hardcode serverhardcode versiontrying server coming communicationmaster versionspecifyfilename kfctlnumber errorgetconfig kubeconfigrunning apply kfctl generate seems retriesrandomly,,
924,0203b05ce180cd47e004317e402e3810a2572b42,am Kasravi <kamkasravi@yahoo.com>, 2019-03-16 06:58:55 -0700, ,fails generated validation kfctl,,
925,781cb5923ef4807da1bdfbb5e15998f6558df22a,henghui Wang <zhenghuiwang@users.noreply.github.com>, 2019-03-15 18:44:57 -0700, ,deployment project multiple clickcompleteproject number removeshell upate scriptloggingcommentcomment scriptdefault change versionprototypelogic waiting updateconfig prototypedelete parallel resourcechange uploadrenameunifydeployment upload always successful,,
926,e4a33e236a36a77aec34eefabff59fa1d11ab1db,un-Kai Hsu <lunkai@google.com>, 2019-03-15 16:36:58 -0700, ,libsonnet empty avoid object,,
927,ac45af55343e38f05db1a911657070c99dea25d8,ason Prodonovich <prodonjs@gmail.com>, 2019-03-15 17:28:57 -0400, ,updateimage point latest,,
928,c69a82ec8bb7d465315121a7cad255f719cb3954,poorv Verma [AP] <avdaredevil@gmail.com>, 2019-03-15 14:00:57 -0700, ,stylistic dynamic support refactor dashboard sidebarchangeseamed state based iframe float update sidebarbetter responsiveness support added sidebarremoved dashboardstyle activity updatedintroduced fixed animated layout activitypallette match adjusted color uniformselector activity removed namespacepolish addedshadow float sidebarseamed fullscreen responsivebetter matchedclose symantic fixed iframecomment addressedcustom based toolbat updated logiccomment prodonjs addressedchain promise addressed comment prodonjs,,
929,104805bc2594131af748f3bfad6762c42c896dd7,dhita Selvaraj <adhita94@gmail.com>, 2019-03-15 13:44:58 -0700, ,profile around golang manifest kustomize controller movedmanifest kustomize moved aroundprofilebuilder around suggested thing moved,,
930,4c45683cd6525d34684ef1252e138c383f094c87,un-Kai Hsu <lunkai@google.com>, 2019-03-15 12:32:58 -0700, ,,,
931,616b3efb864782361e8a8e74339fdb17e27e65d0,abbasi <z.abbasi@gmail.com>, 2019-03-15 10:26:58 -0700, ,added volumenameadded volumenamechange smallupdated,,
932,b42734af7845087b6bd42e36d01422cb34ec8aa0,eremy Lewi <jeremy+github@lewi.us>, 2019-03-14 22:00:57 -0700,2596,scaffolding kfctlscaffolding kfctlcreate workflowsimple python script buildeasier change function identifyrelated metadatafield container siblingpythonaddressretries,,
933,e3f316289869e590e9348648ba079801fb14404c,eremy Lewi <jeremy+github@lewi.us>, 2019-03-14 18:46:56 -0700, ,deploy operator attempt sparkoperator attempt sparkcalling apply spark kfctl operatorcreated environment ksonnetdisable deploy flakydisable timing presubmit minikuberelated,,
934,14437b8ac0f273a8cde8da547ff69773425899c7,ung-Ting Wen <gabrielwen@google.com>, 2019-03-14 17:24:57 -0700, ,create basic secret loginconfigoptionmethod separate createiapsecretfinishpasswordcreaterevertpassword encodechange removecommentpassword usernamebasicencrypt password usernameoption apply removegenerate basic secret using,,
935,e17cfee461a9463039a808d3fa425ab473420dc2,ung-Ting Wen <gabrielwen@google.com>, 2019-03-14 16:20:08 -0700, ,generate,,
936,f7a0bb4e651565654a64909187c2d70223e8f89f,ikramdeep Singh <bikramdeep.singh@suse.com>, 2019-03-14 14:34:59 -0700, ,system integratedsystem integratedchange implemented review suggestedunused variable removing,,
937,4e6c645eeee0915999c33bf6772d2a996cb55ee4,honghu Xu <xuzhonghu@huawei.com>, 2019-03-14 15:14:23 +0800, ,apiserver access pipeline controller viewer,,
938,711c7aa283e1cf8e35e21164318ed398fd9e8c0a,eremy Lewi <jeremy+github@lewi.us>, 2019-03-13 21:32:23 -0700, ,approaching roadmap detail update,,
939,cbbcb6a4535dff06795c2e887967ffcc87d7623a,akelkar <rakelkar@gmail.com>, 2019-03-13 21:12:22 -0700, ,setup azure cluster store secret,,
940,2f9c6f5dc03ef2d9594e4e4dd95319825caec910,unming Qu <37601826+kunmingg@users.noreply.github.com>, 2019-03-13 19:10:24 -0700, ,policypolicyfeedback comment address updateclear account service bindingcoverageformat update,,
941,49b07c32915cb0393227e68765e348b148cd4571,ason Prodonovich <prodonjs@gmail.com>, 2019-03-12 21:16:38 -0400, ,clusterrolenamespace event listing binding clusterrole allownamespace removenamespace clusterrole remove,,
942,7746aa912a75f99ba50d809612301edfbc74e7fb,ung-Ting Wen <gabrielwen@google.com>, 2019-03-12 17:40:38 -0700, ,basic using checkmkdirall already succeed silently existsdisable basic using checkchange revert,,
943,264ac4651415e3af735e366669bdd1426b8157e3,am Kasravi <kamkasravi@yahoo.com>, 2019-03-12 17:24:40 -0700, ,default profile install,,
944,699c87353825f7c807118804d45c45fade2ffce4,am Kasravi <kamkasravi@yahoo.com>, 2019-03-12 11:08:41 -0700, ,kustomize support kfctlkustomize kfctldefault provide kfctl option kustomize ksonnet staticallydefault provide kfctl option kustomize ksonnet staticallydefault provide kfctl option kustomize ksonnet staticallydocument versionstatic version cleanup,,
945,64a242e0f11c1ec2c49c1e26f317e83bf7ee7b0f,imonas Sotirchos <kimwnasptd@arrikto.com>, 2019-03-12 16:34:44 +0200, ,submit jupytersubmitsotirchos kimwnasptd kimonas signedlibsonnet updatedefault value parameter updateintuitivesotirchos kimwnasptd kimonas signedlibsonnet smallsotirchos kimwnasptd kimonas signedinclude scriptrunning error permission scriptsotirchos kimwnasptd kimonas signedinclude entire scriptsotirchos kimwnasptd kimonas signedcommand removesotirchos kimwnasptd kimonas signedchange workingdirsotirchos kimwnasptd kimonas signedimage permissionsotirchos kimwnasptd kimonas signedkubeflow project postsubmitsotirchos kimwnasptd kimonas signed,,
946,4dc46fba7e6ad72fe102f4789a8ebc4f68617df6,ohnu George <johnugeorge109@gmail.com>, 2019-03-12 10:04:37 +0530, ,pytorch vbeta servepytorch vbeta servemaking default vbeta,,
947,a25790d83c404bfcec840a6b600d1483e371671f,abbasi <z.abbasi@gmail.com>, 2019-03-11 13:50:40 -0700, ,image version updated jupyterimage version updated jupyterimage applied updateversion number fixed,,
948,06893f0f5dde3545426b0586a3a74b296503c388,eremie Vallee <jeremie.vallee@gmail.com>, 2019-03-11 18:38:11 +0000, ,enabling tensorboardenabling tensorboardcomment fixed,,
949,11ab94fcbf183503dde0c6859c9f136d95e9a397,imonas Sotirchos <kimwnasptd@arrikto.com>, 2019-03-09 11:19:28 +0200, ,script jupyterpresubmitsotirchos kimwnasptd kimonas signedsotirchos kimwnasptd kimonas signedsotirchos kimwnasptd kimonas signedresource allocated reducesotirchos kimwnasptd kimonas signedreducesotirchos kimwnasptd kimonas signedworker image updatesotirchos kimwnasptd kimonas signedremovesotirchos kimwnasptd kimonas signedscriptformat value dockerfilereference docker removesotirchos kimwnasptd kimonas signed,,
950,6fa88b7cf38430d17e35f968abbe0ea9d2272475,unming Qu <37601826+kunmingg@users.noreply.github.com>, 2019-03-08 16:22:55 -0800, ,format deploy followingformat deploy followingstartsplit based config deployment objectremovedefinition modify following comment description experimentalunify delete method responsecomment change followingquery resolve email feedback review,,
951,3f4f39f28630e79fc9683fad11e4bbc90eea1a06,ason Prodonovich <prodonjs@gmail.com>, 2019-03-08 16:12:56 -0500, ,separate activity component frontseparate activity component frontrouting front behavioriframed browser reflectlinkable internalseperates including frontactivitybehavior iframe cover voided spacelayoutactivity endpoint server expressactivity eventually replacedbuild webpack basedcomment addressmerge change,,
952,9a9cf864fa20e36c3581e35a415545db5bb7b149,am Kasravi <kamkasravi@yahoo.com>, 2019-03-08 11:28:56 -0800, ,parent child relationship golang kfctl platform simplifyversion prior revertdirectory rename golang kfctl ksonnet respectivelyregistry automatically fetch kfctlplugins docker refactor kfctlchange kubeflow point defaultdevrepoplugins docker refactor kfctlinstance plugins kfapp existinggolang version updatedesktop dockerdelete controller cluster bindingupdateunused debug removebootstrap remove pluginsdirectory rename golang kfctl ksonnet respectivelyplatform golang kfctlmerge conflictoption projectproject writeproject checkincludeapply createsecrets addedmacroupstream merge master changeremove updateapplycreate correct rightsnapshotadded updateadditional gcpinitprojectrequires gcpinitprojectinitialplatform dynamic described update staticmakefile added updategenerate minor change usagesnapshotadditional global resource identifieddelete scalingpoliciesdefault change ksonnet platformdefault master versionverbose apply spark remove operatorjeremy comment addressjeremy comment addressplatform refergeneral plugin capability kfctl makefilebootstrap config remove kftcl defaultplatform sincecreate directory change platform updated readmereference desktop docker removedebug remove updateparent child relationship golang kfctl platform simplifybackendconfigbackendconfiglatest commit likely change break order whcih operator checkout kubeflow enable verifiedbootstrap addedbootstrap addedwindow script central dashboard makefile added equivalentkatib component updatewebpack build refactor expresswebpack build refactor expresspublic front webpack processbackend server expressdockerfile server updateexternal issuefeedback based updatecomment review addressdirectorystyle enforce eslint google publicstyle enforce eslint google publicswitch spacerelated import python operator updating packageupdated import operatorfixedfixedprofileprofilecomment reviewretryjupyter image updatesotirchos kimwnasptd kimonas signedprofile controller golangcreatereview addressscope clusterturnoff image authentication jupyterimage notebook controller updated using jupyterimage conroller notebook updated using jupyteroption removed imageverified image latest updated point jupyterimage updated origin allow jupyterfield subresource prune removingfield adding metric collector backofflimitlabel rather listing resource remove looking globalcoordinator clientwebpack dashboard polymer fixedissue multiple tackledwindow fixed webpack component validcodebase spacing matched semicoloncross target platform support addedbabel polyfill missing addedreveal hover build kubeflow dashboard corrected versionsyntax fixed attribute match value emptywebpack updated readabilityrather babel polyfill runtime addedwindow dirty warning check coded build output failure colorreference dashboard updatedchange multiple fixedserver fixed needed deploymentrefactoredfinal image working statechangelatest match geecdf build updatedcorrect dependency location migratedcomment fixed uncommented prodonjsimage based commit result postsubmit updated kubeflow jupyteradding column additional status display printeradding column additional status display printerfixingbinary working kfctlprojectgcpinitprojecterror updatelogic creation deploymentgeneratedmdatadefault hostname config ipnamedeployment fingerprint updateoptional networktodospolicy handlerfinish policy patchaddingversionmysqlpd change nfspdremoveconfigbasicconfiggenerate basicbasic config determinegabrielwen changechange configchangecreate method genereaterequired packagenewgenerate implementdefault clean config configsconfig handlingparamcomponent applicationsimple factoryfixed backofmergenamespacedefault adminfinish createsecretssecret oauth writeuncomment applylogic apply ksutilsuncomment deploymentbuild remoteadmin impersonateconfig remote clientupdatecomplete logic applyretryignoremergecomment removebackoffupdating progress removebackoffbackoffdefaultconfigmakefile updatecomponent packagekubectl shell gcloudconfigs removegkeapiversion removenotebook controllerchangeupdatefield initrequiredksinitparams removemigratestatus notebookstatus condition check updateowner prodonjsjupyterhub notebook changed sidebarsetting image jupyterjupyterchange kubeflowmerge specified upstream resolve platform error master conflictdifferently store exist parameterrelease image pipeline update systemimage latest updated point jupyteraround retryaround retrycomment updatemerge errorcompleted getting startedcontent window started getting webpack build support addedimplemented getting fully startedspaced littlefixed issue webpack eslint working,,
953,74e4b6758dce3a978d54fae9607e83bcf1fda2d4,ita Zhang <rita.z.zhang@gmail.com>, 2019-03-08 10:40:51 -0800, ,azure supportazure supportupdate,,
954,3aafb191e9dbcdf7045de878d6d3eb709f1aafb6,poorv Verma [AP] <avdaredevil@gmail.com>, 2019-03-08 06:07:26 -0800, ,completed getting startedcontent window started getting webpack build support addedimplemented getting fully startedspaced littlefixed issue webpack eslint working,,
955,51b410ade94fdd42556ac2f2fc3d21bf5b649042,unming Qu <37601826+kunmingg@users.noreply.github.com>, 2019-03-07 11:58:05 -0800, ,around retryaround retrycomment update,,
956,300e0287ec30d093f8cb141d742bc6f8990f6878,abbasi <z.abbasi@gmail.com>, 2019-03-06 11:18:49 -0800, ,image latest updated point jupyter,,
957,5b8a92836c9236ce39dfa642639e1db06584d8d2,ing <gaoning777@gmail.com>, 2019-03-06 10:46:50 -0800, ,release image pipeline update system,,
958,5bf03055bbfc706dce642ea34b47a5e59df13a47,un-Kai Hsu <lunkai@google.com>, 2019-03-06 06:46:07 -0800, ,,,
959,fd50e8c24537b6605360fd42d1c726497ac68ce3,ronPan <yangpa@google.com>, 2019-03-05 23:16:01 -0800, ,differently store exist parameter,,
