id,sha,author,date,issue,message,file,content
1440,39a6e22f792dda175082da722d5a644139217e55,un-Kai Hsu <lunkai@google.com>, 2018-08-31 11:59:16 -0700, ,create manifest webappcreate manifest,,
1441,ffc4c6787b8f3dd5164ca7bf4d071e1292427fce,un-Kai Hsu <lunkai@google.com>, 2018-08-31 11:26:16 -0700, ,presubmitdummy,,
1442,9ce45532b4fe6be2f5dd4e209d95c49ccaf5447b,ohnu George <johnugeorge109@gmail.com>, 2018-08-30 05:44:33 +0530, ,pytorch valpha enable operatorpytorch adding installation operatorguide removingcontent already website guide portedduplicate removed kubeflow removepytorch valpha enable,,
1443,0f16d9a158086e878b8b70274a92dbde2d8c05b9,un-Kai Hsu <lunkai@google.com>, 2018-08-29 16:46:16 -0700, ,local readme,,
1444,b4c341c4f2d65d62e4e6c5018547bf9f6d309402,unming Qu <37601826+kunmingg@users.noreply.github.com>, 2018-08-29 16:14:01 -0700, ,backend frontend change kfctl agree updatebackend frontend integrate change updatehandle review feedbackbackend update frontend config manager deploymentdefault image value updateinstead component apply secuirty update ksonnetingresingres updateclean version dependency update,,
1445,822f29a39c4494f8164772eac4c4dde9ae5f6f5c,bhishek Gupta <abhi.gupta@gmail.com>, 2018-08-29 11:11:01 -0700, ,forwarded ensure kfctl,,
1446,08ab8c7ac50793ad662a463ee7912ebbccf576b6,eremy Lewi <jeremy+github@lewi.us>, 2018-08-28 17:44:24 -0700,1350,trigger presubmit minikubetrigger presubmit minikubedeleted stillminikubereverts commit partiallyrelatedtrigger presubmits minikubefnmatch specify individualexpressiontrigger presubmit minikubedeploying valpha operatorsimple tfjob usingdeploy properly script update,,
1447,1d73d8359a804db89eb3c08e4c3bc93b5a979bf4,bhishek Gupta <abhi.gupta@gmail.com>, 2018-08-28 17:07:54 -0700, ,,,
1448,094ce470e93e1ee4945fe0ab929f95e740f98fde,ay Smith <js@thejaysmith.com>, 2018-08-28 12:13:51 -0700, ,version weavefluxrebased fixedclusterip,,
1449,d40ea41f210ca506bbd03b9fcfddca562780d2df,eremy Lewi <jeremy+github@lewi.us>, 2018-08-27 15:56:51 -0700, ,simple tfjob prototypeproblemreporting result gubernator properly failureupdatedtestsuitejunitsimple prototyperunningchecking actual reliableunnoticed probably brokensurfaced properly resultsuspect broke improperly thingswitch valpha changed,,
1450,defc235463799d5600001ee0ed6ef68f7af24a17,nkush Agarwal <agwl@google.com>, 2018-08-27 14:48:23 -0700, ,instead default interface jupyterlab jupyterinstead default interface jupyterlab jupyterconfigurable ksonnet parameterupdate,,
1451,48239d58330d729f802752adc73bff1c0f9f413b,liveseldon <cc@seldon.io>, 2018-08-27 20:37:36 +0100, ,seldon imagepullsecret prototype,,
1452,1facb6ac1fc44a260981fb91ac44ca69c757c7c9,ichelle Casbon <texasmichelle@users.noreply.github.com>, 2018-08-25 14:25:31 -0700, ,owner texasmichelle,,
1453,106e2672f9ac584ddbc9d25b93f8dda30e46b68f,bhishek Gupta <abhi.gupta@gmail.com>, 2018-08-24 19:17:57 -0700, ,setup added minikubesetup added minikubeaccessible local notebook jupyterscript restructure kfctl pattern deployment minikubecleanupparams comparisonparam parsing jsonnet stringaddressing comment jlewisplit refactored setupunused removeupdatedregistry docker createenv,,
1454,a41ba7288c7a0de883642b37b9aef737fc5aa558,nkush Agarwal <agwl@google.com>, 2018-08-24 18:23:16 -0700, ,random uuidgen insteadinstalled uuidgen computer,,
1455,41368da0cdd22d60d31ffb4b3ad45c2b13de2df0,nkush Agarwal <agwl@google.com>, 2018-08-24 13:52:00 -0700, ,,,
1456,d63cc2b7859ee0746e1d182549e90820953435f0,ei Su <suleisl2000@hotmail.com>, 2018-08-24 20:40:36 +0800, ,issue community mxnet operator kubeflow,,
1457,0b5dba7428833aa934499429ef717524480e8e7f,nkush Agarwal <agwl@google.com>, 2018-08-23 22:58:54 -0700, ,script binding declaratively python patch managescript binding declaratively python patch managecomment review addresscomment review addresscloudservices account permission removeupdate,,
1458,70284dc94b10d668b7fd0b72088b49f3091e6dd1,am Kasravi <kamkasravi@yahoo.com>, 2018-08-23 20:58:45 -0700, ,method component allow modifiedinitial generalized editing component checkinremove added examplekubeflow component method updatetesting addedkubeflow errorretestretestretestretestretestretest,,
1459,a4e4a8e9caf7bfa40958d9b8c9094fd7f9c7534e,eremy Lewi <jeremy+github@lewi.us>, 2018-08-23 13:34:18 -0700, ,remove updatedeploy script longerrelated,,
1460,fce0f86150394654eb6995c6ff1a24a312afb931,ichard Liu <39319471+richardsliu@users.noreply.github.com>, 2018-08-22 18:42:40 -0700, ,ambassador annotationformat jsonnetcomment,,
1461,2e305f2f14e6f89013ebc1c0888b71b3db2196d8,nkush Agarwal <agwl@google.com>, 2018-08-22 14:45:42 -0700, ,component cluster support update private,,
1462,bc69265d2d07cc2eb10e1e217ecc1fb5d6d2da5f,nkush Agarwal <agwl@google.com>, 2018-08-22 14:15:01 -0700, ,prototype namespace deployment support operator update scopedprototype namespace support operator update deploy scoped,,
1463,f05f252530e51b2971c726e0de73c1e6eb1e112c,nkush Agarwal <agwl@google.com>, 2018-08-22 13:51:51 -0700, ,lowercase script clientid various update secret,,
1464,21c468824e813d689ed45f9845a37b7b4cd8f920,an Isla <dan.isla@gmail.com>, 2018-08-22 10:40:09 -0700, ,ingres backendconfig creation certificatebootstrap ingres backendconfig manager enabling migratebackend check enabler added timeoutversion cluster,,
1465,5e5e3ebcb9b0c5ad3f8a31012f9d16de8a33e2db,nkush Agarwal <agwl@google.com>, 2018-08-22 05:45:42 -0700, ,namespaces dashboarddashboard error,,
1466,df488f4ce961c5e840cd53b58fa645c5ebb389c5,heyang <cheyang@163.com>, 2018-08-22 12:48:41 +0800, ,document image customized support updatekubeform spawner updatecheyang signed,,
1467,7c5f05b358b657df663731d4fe8b7fad6c649704,lexey Volkov <leha_volkov@mail.ru>, 2018-08-20 14:26:34 -0700, ,ubuntu scriptkubeflow issue,,
1468,ef2b67b9306e2307592a0b4c629a7a65f9bdd149,dhita Selvaraj <adhita94@gmail.com>, 2018-08-20 12:31:54 -0700, ,ambassador centralambassadorimage centralui smaller,,
1469,6899f628dde0e461e32692a597216af3a304f2be,nki Hwang <hwang031451@gmail.com>, 2018-08-18 15:47:59 +0900, ,,,
1470,af0a2dc7a89f60dcfb80a8b807f02c7ea4fb71e0,anyam Kapoor <activatedgeek@users.noreply.github.com>, 2018-08-17 15:51:01 -0700, ,resource various group,,
1471,bcff20547fdbad99fe4fb0e3dfb198aeaa261bc9,am Shi <yixinshi@gmail.com>, 2018-08-17 16:23:38 -0500, ,limit restrictive remove,,
1472,24c275d16a85ed3a57bae8e97f8378d32122d3ea,un-Kai Hsu <lunkai@google.com>, 2018-08-17 10:48:06 -0700, ,serving imageserving imagecommand,,
1473,bdf93245bd12766feb8cef3553b7de7cf6a1fc4b,unming Qu <37601826+kunmingg@users.noreply.github.com>, 2018-08-16 22:45:09 -0700, ,glide handler apply resetglide handler apply resetcreate compatible cluster backward,,
1474,7a95e32677721de04bb16dde6e0ed9cdd2c5cab9,eremy Lewi <jeremy+github@lewi.us>, 2018-08-16 22:21:20 -0700, ,usage report ensure spartakusrelated kubeflow testingdisable print spartakus enabling notice,,
1475,90a9509b2290dfc145619773da869028617ae8a3,nkush Agarwal <agwl@google.com>, 2018-08-16 22:21:08 -0700, ,ambassador image managerambassador image managerimage available dockerhub using privatedockerhub image mirroredprototype image updated registry kubeflow publicdockerhub instead imageupdatecomment address reviewerupdatekatib supportambassador comment image updateimagetag remove,,
1476,a63c927a6d514ae1a12a03465517edddd8a391ce,am Shi <yixinshi@gmail.com>, 2018-08-16 21:53:08 -0700, ,create batch prototype predictadding batch predict prototypeversion prototype firstchange readmecleanadding batch jsonnet example predictionalmost working versionworking versionbatch kubeflow remove predictnested simplify removing unneeded jsonnet,,
1477,c18d4c753efdfee3be9acbae561afc95379ecc37,anyam Kapoor <activatedgeek@users.noreply.github.com>, 2018-08-16 14:29:10 -0700, ,common,,
1478,4884df01507a2d6cc162d08dfd4e90cfdb9b1e78,unming Qu <37601826+kunmingg@users.noreply.github.com>, 2018-08-16 11:09:51 -0700, ,request option optionshandler browser,,
1479,6d9862a1d9961c5237ff6d1e1a58c181ce8a2793,eremy Lewi <jeremy+github@lewi.us>, 2018-08-15 22:50:00 -0700, ,creatingcreatinginstruction removemoving kubeflow websitebackquotes remove indentissue,,
1480,ab6084349673e6405ae486eb3be2141e3550643c,eremy Lewi <jeremy+github@lewi.us>, 2018-08-14 21:18:19 -0700, ,tfjob latest operator update,,
1481,433f9881205ce22fa08d67672e8c8e838ffe5159,unming Qu <37601826+kunmingg@users.noreply.github.com>, 2018-08-14 16:52:38 -0700, ,version updateversion updatehandle review feedback,,
1482,bdb9775146aac9e4eea8c858c49e9b110871c148,hingo Omura <everpeace@gmail.com>, 2018-08-15 07:03:15 +0900, ,platform delete,,
1483,753506b93c6cdb9900fd2a0b5a7967490a1ef00b,yuan1316 <yuanfang@alauda.io>, 2018-08-14 21:49:52 +0800,1344,issue,,
1484,67489b58fa7234b32ce5646872c4be7d48563352,eremy Lewi <jeremy+github@lewi.us>, 2018-08-13 15:53:27 -0700, ,created subgraphcreated subgraphlimited kubeconfig updateactually thinkcreated wouldbetter actual controller deploymentcreate script baseddeployed check basic performs kubeflowstarted everything ensuringartifactcreate workflowpresubmitoption cluster delete usefulleaving debug,,
1485,f15fdd3f932a60bd3abd31a43c32dd5ec9696fc0,am Kasravi <kamkasravi@yahoo.com>, 2018-08-13 13:02:01 -0700, ,debug build improvement bootstrapperdifferent multistage pushed bootstrapper build allowincorporatingerror buildlocal latest remove taggingupdateminor change dockerfiledebuggerdebug script addedcorrectionbootstrapper build debuggerksonnet install removedebug instruction addedupdateupdateupdateupdatebetter debuglogic waitforeverwaitforeverforwardportforward namespaceportforwardcomment updatecomment address pending approvaldebug instruction target cleanupupgradedocument moved,,
1486,f4c4893767f2f40a5b5aeff10bf08b703c22db39,ichard Liu <39319471+richardsliu@users.noreply.github.com>, 2018-08-13 11:10:02 -0700, ,releasing website readmeautoscaling option enableconfiguration jinja autoscaleadding process release websiteformattingadding process release websiteformatting,,
1487,cbc1c06868a3fece33d551e7d6d88830bf05cd73,unming Qu <37601826+kunmingg@users.noreply.github.com>, 2018-08-10 13:49:16 -0700, ,bindrolehandler account servicebindrolehandler account servicehandler feedback handle review level,,
1488,eababf8f041be1d58f4297c608241229db7104fb,eremy Lewi <jeremy+github@lewi.us>, 2018-08-09 18:21:11 -0700,1325,tfjob start kfctl refactor workflowadding component start kfctlsimple tfjobacross define subgraphs start reuse nested refactoring support workflowsubgraphs related reusabilitybetter variableformat execute jsonnetrelative using sincesupported master version longer,,
1489,9eeb9e65565d44377b9a71b675d008cd4c36cdcb,liveseldon <cc@seldon.io>, 2018-08-08 23:45:36 +0100, ,seldon updatederived source initial commit central template chartfinish template designupdate remove example serving templatecreation readmeformatting jsonneteither seldon stream update appropriate version allowidentation jsonnetsimple prototype include resource update directly servechange image example policyoutlier including example seldon detector deploymentvalpha version examplenamespace optional remove param,,
1490,1e9aa9466e224d58b4e39c23ee0a6e76a92d9592,unming Qu <37601826+kunmingg@users.noreply.github.com>, 2018-08-08 14:49:25 -0700, ,health check handler deployer account servicehealth check handler account servicehandle review feedbackstruct update,,
1491,58b3b619ad687c866c2c811eada9e4456e8df25b,ay Smith <js@thejaysmith.com>, 2018-08-08 14:20:38 -0700, ,ksonnet package weavefluxrebaserebaseupdated commitrebasedrebaserebaserebaseupdated commitrebasedrebaseformat fixedautoformat,,
1492,e5cdc91fadf915108b52b511d9ad58371f8ca3b1,dhita Selvaraj <adhita94@gmail.com>, 2018-08-07 23:23:54 -0700, ,centralui,,
1493,239dcc2ebe524849eacec46e04c0649b3ab79ca4,unming Qu <37601826+kunmingg@users.noreply.github.com>, 2018-08-07 11:21:30 -0700, ,backend setup insert oauth deployer secret account serviceinsert account service clusterhandle review feedbackfield secret clientdeployment manager resource managerefactorcreate backend resourcerebaseconfigurable backend patch missing,,
1494,6598c809eacbf6eb9998840df00dc1be2b49f69b,eremy Lewi <jeremy+github@lewi.us>, 2018-08-07 10:14:27 -0700, ,create different reentrant usablefollowsplatform myappmyappgenerateapplyconfiguration inside persistedcomplicated becoming creating scriptwhether control thing environment variablecreating indirection layer environment variable unnecessaryprivate configure thingksonneteasier following supportcreate configs ksonnetconfigs manually editsdeploysenvironment variable anywhere persistedrepeatibility subsequent major invocationcopying directory kubeflow insteaddirectory configs containing ksonnet executeneeded copiedcreate configs creating networkeasier legacy create customizenetworkcreate network automatically apply deploymentpresent correspondingcreate script download kubeflow separate neededregistry ksonnet scriptthingplatform different reuse scriptduplicate downloadexecuted invokeversion ensures downloadedactuallycreate function ksonnet commonplatform different reuse ensuresacross experience commondifferent creating platform application ksonnet customizesemantics similar kubectl refactorcontaining directory everthing artifactdirectory needed createsdelete deployment script improvemanually delete policy abandon failsresourceexplicitly delete resource bindingpythoncreate workflowentry servicecheck deleting exist account serviceprint delete error confusing messagealready quite refactor large existingsubsequentcluster misleadingoverwrittencentralautoformatdirectory kubeconfig kfctl overlap unique,,
1495,2343a0cf38cc3f2716f753bc2c4840410d0133ed,nkush Agarwal <agwl@google.com>, 2018-08-07 06:33:08 -0700, ,ambassador update,,
1496,b82ae3f8a5944e13da24ab0d18e90560dc623074,mit Saha <amisaha@cisco.com>, 2018-08-07 13:15:57 +0530, ,point documentation,,
1497,145fac439d27600d4fc6e9f0facba8f1852982ff,un-Kai Hsu <lunkai@google.com>, 2018-08-05 14:17:44 -0700, ,haswell manager platform support deploymenthaswellspacecentralcentralrevertcommentspace,,
1498,8078114fc3344d3ef4cc4ccca180e63a1e4bb377,ia // Huai-Wen Chang <mia5419@gmail.com>, 2018-08-04 02:49:29 +0200, ,wordingalign comment,,
1499,ae83c64742ec09266c070ec939f34ee765652a19,un-Kai Hsu <lunkai@google.com>, 2018-08-03 14:26:18 -0700, ,revert,,
1500,4ec73180bec2340af37180fd4b9bed763637f208,icha Jastrzbski <michal.jastrzebski@intel.com>, 2018-08-02 11:38:28 -0700, ,default reasonable servingmight peopledefault,,
1501,ac649bff69dbce9c4169cff5ec09d7b8da017f1c,un-Kai Hsu <lunkai@google.com>, 2018-08-01 17:52:28 -0700, ,serving improvesquash,,
1502,a8c0dda2f2d90bae67497652211cc6224c8f73cd,mit Saha <amisaha@cisco.com>, 2018-08-01 23:54:40 +0530, ,fixed brokenfixing brokenspecific,,
1503,13390dc4822ffe8514e424dc1dcd153eb1dc10cb,ete MacKinnon <pmackinn@redhat.com>, 2018-07-31 21:32:39 +0200, ,updateissue,,
1504,bc13fb9ed0bd93c3bb0a489f35f416e64e00240c,un-Kai Hsu <lunkai@google.com>, 2018-07-31 12:00:38 -0700, ,default enable agentdefault enable agent,,
1505,e50226d7913a18e3efaf98ff0ffad7e417d5cb03,mit Saha <amisaha@cisco.com>, 2018-07-31 22:37:38 +0530, ,pointing kubeflow website katibissue pointed documentation katib readmekatib documentation pointed readme,,
1506,620009ce8414ba99ef5dfc746d508c8ddefa6b5b,eremy Lewi <jeremy+github@lewi.us>, 2018-07-31 06:47:38 -0700,1284,easier reruneasier rerunalready check resource exist secretrecreatesecret prevent checkingstore directorysecret storing removeallowexportdefault instead valueinterpretcreate related legacyrerunning related support,,
1507,db91925f93e956f2b3ce81dfe0bc1ccd465f95ba,ichard Liu <39319471+richardsliu@users.noreply.github.com>, 2018-07-30 17:39:37 -0700, ,autoscaling option enableconfiguration jinja autoscale,,
1508,19ca6d4db3e5b4d25cb2fc1ddd7a9ccf838edb2c,un-Kai Hsu <lunkai@google.com>, 2018-07-28 17:45:57 -0700, ,serving request support loggingserving request loggingfluentdcommentconfig prototypecomment address,,
1509,32b79ba9104592dcec2e478aaa6d3ed5b147e9ee,eremy Lewi <jeremy@lewi.us>, 2018-07-28 16:59:56 -0700, ,include tfjob image update,,
1510,645db22f8fa62ba339800c213c81b1179814e3d9,eremy Lewi <jeremy@lewi.us>, 2018-07-27 11:06:56 -0700, ,create describe deploymentproposal description current,,
1511,1628d96b4ac0706e9e98d2377f2cdc88177a580a,un-Kai Hsu <lunkai@google.com>, 2018-07-26 16:58:57 -0700, ,deploydeployscript another,,
1512,d80dd8c1a737729458d5ee109a8490d37e366f18,un-Kai Hsu <lunkai@google.com>, 2018-07-26 14:32:56 -0700, ,,,
1513,eb471a843dcfe17e06dac5aa7005e5bf6577f95a,un-Kai Hsu <lunkai@google.com>, 2018-07-26 11:22:58 -0700, ,serving componentserving component,,
1514,a4ce0636d1c7acf357e339ae40a9c24642e28c72,eremy Lewi <jeremy@lewi.us>, 2018-07-26 10:18:55 -0700,749,simple tfjob prototypesimple tfjob prototyperenamed kubeflow prototype operatorcomponent silently trying ksonnet exist fails failingvalpha updateinstalled valpha version removedefault valphamnist valpha imageksonnet,,
1515,177377f154475e797ebf2c9bb7d156862f8e1231,asser Elsayed <yebrahim@users.noreply.github.com>, 2018-07-24 15:59:55 -0700, ,placeholder removed,,
1516,0047a53df9e9756200221646e82bf264c248eb73,eremy Lewi <jeremy@lewi.us>, 2018-07-23 16:03:25 -0700, ,deploy clickcreate deploy ksonnetexternalcertmanagercommand build update,,
1517,fb9426598d46e6c4a2d2e75fb6faa9ea06393c15,eremy Lewi <jeremy@lewi.us>, 2018-07-23 14:49:03 -0700, ,frontkubeflow,,
1518,a9c348d466ddec04f95327810333d5c389054035,mit Saha <amisaha@cisco.com>, 2018-07-24 02:20:21 +0530,1237,modified issue point communitymodified pointminor changechange content rearrangedminorminorkubeflowcenteringcentering,,
1519,0186d73ab5badc6ea650558b21facfbf2a0e6ad1,achary Zhao <zacharyzhao@yahoo.com>, 2018-07-23 17:42:17 +0800, ,adjustment style scriptspace replaceredundant suffix space remove,,
1520,471de67fc4596fb6727f72332ab555ae10e307eb,am Kasravi <kamkasravi@yahoo.com>, 2018-07-20 10:50:58 -0700, ,volume length servername restriction change character userid avoid usernameshortenvolume length servername restriction change userid avoid usernamechange extraneous removelimitation length identifier escaped truncating removing prefix avoid charactercomment overriding method kubespawnererror,,
1521,4986c5533d868b80ca9d8f2a9b9064cf8e6c7acf,ichard Liu <39319471+richardsliu@users.noreply.github.com>, 2018-07-20 08:38:52 -0700, ,scope kubeflow modified,,
1522,3d099b9a573a534bf5a307e6ca0e0a8e64826471,dhita Selvaraj <adhita94@gmail.com>, 2018-07-19 15:35:53 -0700, ,deployed include centralui check katib,,
1523,18305be18541b6dcaed1098638e84d603a1b04eb,un-Kai Hsu <lunkai@google.com>, 2018-07-19 11:45:16 -0700, ,,,
1524,a036f405574db9088bd52cbb469e7fe2bb941515,rachi Jain <jainprachi.55@gmail.com>, 2018-07-18 22:57:42 -0700, ,jupyterhub issue spawner indentation update,,
1525,1d8f99c5ad3711d577da2a495dcffed588c2471d,asser Elsayed <yebrahim@users.noreply.github.com>, 2018-07-18 22:07:42 -0700, ,service deploying required enable,,
1526,7fc454512e834400cfae7d74920d8660c172b469,eremy Lewi <jeremy@lewi.us>, 2018-07-18 15:17:27 -0700, ,reviewer assignment automatic updatejimexist picking review wbuchwalterremovegoogle general richard,,
1527,7508e13f389e415f7982c7885573b3cdbf6803c8,eremy Lewi <jeremy@lewi.us>, 2018-07-18 11:34:19 -0700,962,server bootstrappercreate deploy client clickjavascriptsending deploying cluster bootstrapperbearer token containing using allowauthorization credentialelevatedksonnet substitution microservicehyperparamters tuning hyperparameterregistry handle consistentregistry specify appconfig consistingregistry anything supportdirectory prefetched local registry specifiedseparatelyregistry specify appconfig serverbased match known regstries registryneeding allows token github avoidusing prefetchedcreate delete namespacelocally legacy running bootstrapperdockercreate locally running invokedrunning would cluster processdeploy cluster bootstrapperalready process deploy presumably credentialkubeflow setuplocally running script namespacedeploy created scriptdeploy script likely bootstrapperreasondeploy clickbootstrapper webapp server ksonnet sinceotherwisecreate however resource webapp needed minimalnamespace bootstrappersending manually script requestgoimports gofmt scriptproblem version otherwise update,,
1528,f5801b1310eb06a4152e8a481e0895ad5c887bc8,un-Kai Hsu <lunkai@google.com>, 2018-07-17 20:36:18 -0700, ,servingservingcomment addressreview addresscomment,,
1529,de364503fab289e9d778c94b792843e2f1e35db8,unming Qu <37601826+kunmingg@users.noreply.github.com>, 2018-07-17 18:17:18 -0700, ,prometheus prototypeprometheus prototypemetric exporter integrate tfhub prometheus monitoringformat jsonnet,,
1530,b6a70416f9b49da751aa012f1e3257376fcd277e,eremy Lewi <jeremy@lewi.us>, 2018-07-17 17:01:19 -0700, ,direct instruction remove updatedirect instruction remove update,,
1531,c674d2bedd80547e75a7de186ea22d4c1ce8155b,nkush Agarwal <agwl@google.com>, 2018-07-17 10:31:39 -0700, ,ambassador refactorjupyterhub refactordashboard central refactortfjob refactorspartakusupdate,,
1532,6f246896425362756dc8f84c90ec060206566c06,asser Elsayed <yebrahim@users.noreply.github.com>, 2018-07-16 11:28:51 -0700, ,fetch splash deployer require screen,,
1533,253bcc3db7094cce76ff41c23be219b4a458fbc2,nkush Agarwal <agwl@google.com>, 2018-07-16 06:04:56 -0700, ,running script speed parallel creationassign jlewi,,
1534,0fb9cdaeef9f1c43533b30a25fe0df1ef47c22ef,nkush Agarwal <agwl@google.com>, 2018-07-15 05:40:56 -0700, ,jupyterhub interface improvefield align using tablefield advanced defaultdefault image field,,
1535,794eea62ec8b24c2789deb9ec78a85e424694570,heyang <cheyang@163.com>, 2018-07-15 12:56:55 +0800, ,dashboard fails,,
1536,3b832cb9547b9e16875fa62278f5a553ecd46e50,ete MacKinnon <pmackinn@redhat.com>, 2018-07-14 22:06:56 -0400, ,kaggle notebook dockerfile,,
1537,a9b4aa872dbb1e4fe08ad6df8ca1676541d0dec1,nkush Agarwal <agwl@google.com>, 2018-07-13 18:48:55 -0700, ,script ingres resource leaked kubeflow cleanupresource kubeflowci script cleanupcomment address,,
1538,8bda3cfd57d4ed4a26a6f631a3bde22d832c925d,nkush Agarwal <agwl@google.com>, 2018-07-13 14:55:28 -0700, ,delete script configslogic retry,,
1539,73c5f46935b6d80b29538d8d8cd814d753020dca,nkush Agarwal <agwl@google.com>, 2018-07-13 11:42:27 -0700, ,private cluster support,,
1540,40e21a707bde9576116dba90182d7ff1642b3f51,ietse Muizelaar <wmuizelaar@bol.com>, 2018-07-13 13:51:25 +0200, ,tensorflow image notebook extra package,,
1541,7ccca0abc4345ebda44adb5688c8ed65c2182623,nkush Agarwal <agwl@google.com>, 2018-07-12 21:43:46 -0700, ,moving unpackedmoving unpackedlevel stripping githubdirectory script brittle level assumingnamed certainrelatedsimple verify script created configsoption testing facilitate deploymentoption recreate configsalready command starting assume exist,,
1542,6140bdad9a9b9900a00921b6228cc22f8cd5e9b6,nkush Agarwal <agwl@google.com>, 2018-07-12 15:32:26 -0700, ,supportsupportupdateupdateupdatejupyterhub python refactor logic jsonnetremovechmodfield jupyterhub spawnernotebook jupyterupdateupdateupdatenamespace remove param,,
1543,692539bfac57b32734d138ecff96b75f8b3af0b5,nkush Agarwal <agwl@google.com>, 2018-07-11 18:55:25 -0700, ,grant kubeflow viewer account serviceviewing viewer required build,,
1544,02833f6275dcdaf2f826746a007cf44604344965,eremy Lewi <jeremy@lewi.us>, 2018-07-11 18:17:25 -0700, ,default jovyanbetter reliably default experience workingdisable storage default notebook class backed,,
1545,a730ddf04ee18c84d39e1aefa114e8ce9ab572b6,unming Qu <37601826+kunmingg@users.noreply.github.com>, 2018-07-11 15:49:26 -0700, ,event metric collector,,
1546,0c693725270033f80b0d606090eda3435ff9ff78,eremy Lewi <jeremy@lewi.us>, 2018-07-11 13:22:25 -0700, ,image central updaterelated,,
1547,67804a683e5e8763198f2d7572c20ca81c5b3890,nkush Agarwal <agwl@google.com>, 2018-07-11 12:42:25 -0700, ,,,
1548,cc3f573b94715ff19fa47dd3bc8e462db7096e94,eremy Lewi <jeremy@lewi.us>, 2018-07-11 10:53:25 -0700, ,deploy efficient scriptdeploy efficient scriptdownload tarballs avoids github token limitgithistory faster avoidsinstall packageusing startusage enable anonymous,,
1549,e7e16c4a6156bdcd7f33f2042e75e2c9fa577ce1,nkush Agarwal <agwl@google.com>, 2018-07-10 21:57:25 -0700, ,account servicecloud builder container allows build docker submit googlejlewi,,
1550,59f3af03360b844daffe5dc16d953519fba09e22,nkush Agarwal <agwl@google.com>, 2018-07-10 20:33:25 -0700, ,namespace delete cluster deleting kubeflownamespace delete cluster deleting kubeflowdeletes ingres namespaces deleting objectassociated instance resourceupdate,,
1551,4c0b6a5ac114925b6e75f7a6d414d4a627ff5dc5,eremy Lewi <jeremy@lewi.us>, 2018-07-10 20:01:25 -0700,1130,image latest jupyterincludes image jupyterrelated image upgraderelatedimage upgrade,,
1552,41ee6604ec8329e3a37e072432e78b558cf71b6c,eremy Lewi <jeremy@lewi.us>, 2018-07-10 17:34:25 -0700, ,project setupalready project enabled setupsetup,,
1553,a1ec7314e1af39fb68bb0272bc9a86d4bcaf7782,unming Qu <37601826+kunmingg@users.noreply.github.com>, 2018-07-10 16:43:25 -0700, ,access account service,,
1554,bf1c2f0a7f5fecd858474ab92aa9cd9f378ff7fa,eremy Lewi <jeremy@lewi.us>, 2018-07-09 18:17:04 -0700, ,create script latest update kubeflow ksonnet packagecreate script latest update kubeflow ksonnet packagescript named remove registry kubeflow package existinginstalled registryreadds supplied reinstalls kubeflow usingrelated kubeflow websitescript based ksonnetregistry delete entry correspondingregistry delete upgraded package,,
1555,c756addac2a57d518396fe574c77cdf200e4bdd1,eremy Lewi <jeremy@lewi.us>, 2018-07-09 15:21:17 -0700, ,image makefileproperly compute centralvalid existinglabel image docker containing version,,
1556,cce6091fffc1dc1e9c7cc1169959d62897bcaf99,shima <yuji.oshima0x3fd@gmail.com>, 2018-07-10 04:45:16 +0900, ,katib releaseryujioshima signed,,
