id,sha,author,date,issue,message,file,content
1066,0c9d84b68925fa4f517cdae009e412d0618da0c0,run Gupta <arun.gupta@gmail.com>, 2013-11-05 03:02:35 -0800, , changed bean name meaningful also added simple test still getting npe need investigation,,
1067,b18342a92022e51ef229e157b6482f791e0a344b,run Gupta <arun.gupta@gmail.com>, 2013-11-05 02:58:17 -0800, , removing try resource stream closed error handling reported correctly,,
1068,ad2fc34fa1f1eecd48e0da8a3c3bff17a60cd739,run Gupta <arun.gupta@gmail.com>, 2013-11-05 02:16:17 -0800, , adding new test,,
1069,6a6635035f44a4e4f98250872be8f999bd8e5c89,run Gupta <arun.gupta@gmail.com>, 2013-11-04 17:59:29 -0800, , adding better debug statement,,
1070,a67d44fa836195511f6f9e07c1cc12204e4dcb5e,run Gupta <arun.gupta@gmail.com>, 2013-11-04 17:54:26 -0800, , adding better debug statement,,
1071,6db3fcf5568fb7c4920e117962773a2549d57191,run Gupta <arun.gupta@gmail.com>, 2013-11-04 17:47:45 -0800, , adding better debug statement,,
1072,6a8bd7a9811414a88cf63da3a830341bb3202b74,irix <mpallas@gmail.com>, 2013-11-04 23:23:13 +0100, , adding new method test cover three test cases.i serious doubt though undertow implement jsr 356 full extend,,
1073,ed9365fd91ce8722f3f79a0f10ee96121a6153a3,run Gupta <arun.gupta@gmail.com>, 2013-11-04 13:49:00 -0800, , removing glassfish specific dependency,,
1074,65354bc25c4f6905ef3a80fb146357c2655633db,run Gupta <arun.gupta@gmail.com>, 2013-11-04 10:43:56 -0800, , started work simple test case,,
1075,7e2873ef763b420921ccbb00f658f7ea67a97c6f,run Gupta <arun.gupta@gmail.com>, 2013-11-04 10:34:22 -0800, , started work simple test case still throwing need investigation,,
1076,439841a8e82acd48940e3691141b0aca49a7ceeb,run Gupta <arun.gupta@gmail.com>, 2013-11-04 10:23:52 -0800, , removing glassfish specific class,,
1077,e4d7a16952b4ab55ac5c59702758b5205d993013,run Gupta <arun.gupta@gmail.com>, 2013-11-04 10:21:59 -0800, , removing try resource stream closed error handling reported correctly,,
1078,f8932f762ee4e72e3475fcf3a9d5e9ee6443d307,run Gupta <arun.gupta@gmail.com>, 2013-11-04 09:59:20 -0800, , fixed endpoint address,,
1079,a32e5ebdfc609eb57e97b9603179daf8139da780,run Gupta <arun.gupta@gmail.com>, 2013-11-04 09:59:03 -0800, , changing indentation space,,
1080,2bf8eb0ac3c1ee311e3b2f068e7ef74fdc12e8fb,run Gupta <arun.gupta@gmail.com>, 2013-11-04 09:39:02 -0800, , removing try resource stream closed error handling reported correctly,,
1081,95ba84f29d2563dd82b5bd22b0c6fdb9b12b0506,run Gupta <arun.gupta@gmail.com>, 2013-11-04 06:10:30 -0800, , changing indentation space,,
1082,a436d24b94c8286e7f34bbd81fa47de424f27bbf,run Gupta <arun.gupta@gmail.com>, 2013-11-04 04:03:55 -0800, , fixed formatting also changed wildfly.home property name,,
1083,14f3215eab0e7990e89e0635cab1f4c921951c5c,run Gupta <arun-gupta@users.noreply.github.com>, 2013-11-04 03:50:36 -0800,53, merge pull request cirix branch arquillian initial support arquilian nick,,
1084,3db2bb2b02d751bcc14d4670286bfd5874d235aa,irix <mpallas@gmail.com>, 2013-11-03 09:19:10 +0100, , changing name merging change,,
1085,422a726800b6e57d8bc12521ee47cecb48c73e98,irix <mpallas@gmail.com>, 2013-11-02 08:51:31 +0100, , merge remote tracking branch upstream master branch arquillian,,
1086,c0ac3a450ff9c619e19625d1797ab09f70cc7824,irix <mpallas@gmail.com>, 2013-11-02 00:31:35 +0100, , adding extra endpoint client necessary configuration test,,
1087,7a3db86416f1a3231416a36e4fe3a12fc048a9ff,irix <mpallas@gmail.com>, 2013-11-02 00:11:28 +0100, , adding support arquillian configuration arquillian container support order run test wildfly,,
1088,0e29e1b56f1fc440720ea1b12034410431e392d5,run Gupta <arun.gupta@gmail.com>, 2013-11-01 15:13:59 -0700, , refactoring sample byte bytebuffer inputstream tested,,
1089,fb56b3de410031bea0a45199ff026137f761b433,run Gupta <arun.gupta@gmail.com>, 2013-11-01 13:45:44 -0700, , fixing wildfly command user created,,
1090,4cedd2cf7e45db4bde4c1e3b3b9da548e9b77202,run Gupta <arun.gupta@gmail.com>, 2013-11-01 13:44:12 -0700, , removing try resource stream closed error handling reported correctly,,
1091,17f0cfd027fac82aed6b936053e68b3a8983348e,run Gupta <arun.gupta@gmail.com>, 2013-11-01 06:13:57 -0700, , removing weblistener,,
1092,36d4056132e25ad953d93329f6f7225c97bfe357,run Gupta <arun.gupta@gmail.com>, 2013-11-01 06:13:46 -0700, , adding descriptive output statement,,
1093,bffb8e63b36cf15ad3cb8c7a88d277212936d5bc,run Gupta <arun.gupta@gmail.com>, 2013-10-31 06:07:50 -0700, , fixing package name match project name,,
1094,e465fe32a14845fd2eca670cba8a4c0a385e1c54,run Gupta <arun.gupta@gmail.com>, 2013-10-31 06:06:37 -0700, , enabled test,,
1095,768235811bbe07cb3f8ec9b3764d51a8df569c9e,run Gupta <arun.gupta@gmail.com>, 2013-10-30 23:12:10 -0700, , disabling tight security otherwise index.jsp accessible wildfly,,
1096,765b734f1ffa700d6b7fdd5af1eb312e56ecf136,run Gupta <arun.gupta@gmail.com>, 2013-10-30 23:11:49 -0700, , adding basic instruction wildfly,,
1097,c7979eeaa104df707edbea2014a1e550d42a0aa2,run Gupta <arun.gupta@gmail.com>, 2013-10-30 22:29:50 -0700, , adding better debug statement,,
1098,dec18900740e2d2217990da720d6b44c2f3a6ff0,run Gupta <arun.gupta@gmail.com>, 2013-10-30 22:24:04 -0700, , adding debug statement,,
1099,d01599543993b5a5be8ca2d21ebe0839a2c98830,run Gupta <arun.gupta@gmail.com>, 2013-10-30 21:08:40 -0700, , adding better debug statement,,
1100,fe9e363ff326e8bfdc6861f96c138c3aee7c0e68,run Gupta <arun.gupta@gmail.com>, 2013-10-30 21:04:29 -0700, , removing redundant parenthesis,,
1101,758c9e9cc34fc4a5acb8f878bb1e9a7b114e6755,run Gupta <arun.gupta@gmail.com>, 2013-10-30 13:37:52 -0700, , using portable behavior lookup bean using well defined property name instead non portable mappedname sample work wildfly glassfish,,
1102,2d45453f30a0ccb7f339f3b55ebae3bbfceee11f,run Gupta <arun.gupta@gmail.com>, 2013-10-30 06:57:08 -0700, , adding descriptive output statement,,
1103,d7c66a2c5b2b521e79aca6b94ab20f1358dd7c61,run Gupta <arun.gupta@gmail.com>, 2013-10-30 06:56:59 -0700, , changing location match local machine,,
1104,3db6ea63cd511081a334d2aeca3a337d6076c2bd,run Gupta <arun.gupta@gmail.com>, 2013-10-30 06:41:35 -0700, , renaming schema gen schema gen metadata meaningful,,
1105,3c6cc3f3cf1737348748d818a68c904e18268de6,run Gupta <arun.gupta@gmail.com>, 2013-10-30 06:34:02 -0700, , adding descriptive output statement,,
1106,62fda26bf06ac253a03f2cb6dee58b53315a9490,run Gupta <arun.gupta@gmail.com>, 2013-10-30 06:33:54 -0700, , adding descriptive output statement,,
1107,d2d227729e75b8afd10500fec729d281d32ac33a,run Gupta <arun.gupta@gmail.com>, 2013-10-30 06:31:59 -0700, , fixed persistence.xml adding property,,
1108,460d922e5167bb02fa70e4f2b45b7c0921b6ab37,run Gupta <arun.gupta@gmail.com>, 2013-10-30 06:06:43 -0700, , removing load.sql data need persisted using instead insert allows version column updated optimistic locking work eclipselink lenient hibernate caught,,
1109,3bef075ce5e8919914d0137b97632e4a95885898,run Gupta <arun.gupta@gmail.com>, 2013-10-30 05:32:15 -0700, , fixing namespace version,,
1110,64c0129e404bd4c8cab895065498e6eb4735591c,run Gupta <arun.gupta@gmail.com>, 2013-10-30 05:23:46 -0700, , using typical employee class .sql script generate load database table entitymanager still getting resolved correctly need debugging,,
1111,b5beeee9238e50cf527654b345216c8e9426135a,run Gupta <arun.gupta@gmail.com>, 2013-10-30 03:41:23 -0700, , removing redundant import,,
1112,6d7619fdb3aa7b262bf111424991e1caf906a495,run Gupta <arun.gupta@gmail.com>, 2013-10-30 03:37:32 -0700, , making output message consistent,,
1113,20c062d53b2c41c915ea9805a757b7da27efc580,run Gupta <arun.gupta@gmail.com>, 2013-10-30 03:36:13 -0700, , sample work wildfly updating output message accordingly,,
1114,d897e7b302b42ad5e158f045b4ae54b3ee7806ee,run Gupta <arun.gupta@gmail.com>, 2013-10-30 03:27:03 -0700, , removing redundant application,,
1115,262eca1c5a5a4ac55f8f2cddd1e49082281ebbaa,run Gupta <arun.gupta@gmail.com>, 2013-10-27 14:59:17 -0700, , fixing typo,,
1116,d18fd2162637e036ad26d5b168deeec2f87383fd,run Gupta <arun.gupta@gmail.com>, 2013-10-27 07:01:34 -0700, , adding descriptive output statement,,
1117,96fa3d8ac9906baa8e0c40a975ffb9350b6d459c,run Gupta <arun.gupta@gmail.com>, 2013-10-27 06:59:59 -0700, , made bean serializable,,
1118,f81cb9b1abdd1102f26e4cb1e0cbdb74ff9f237c,run Gupta <arun.gupta@gmail.com>, 2013-10-27 06:56:32 -0700, , fixing next refresh action,,
1119,41a6e1b9d07e2d62a5a13eb79448a1f68dfe707d,run Gupta <arun.gupta@gmail.com>, 2013-10-27 06:53:44 -0700, , adding debugging statement,,
1120,74e0ab9b658edd11212c515183887da2abdfd95f,run Gupta <arun.gupta@gmail.com>, 2013-10-27 06:53:29 -0700, , changing glassfish wildfly,,
1121,0f41861bb15c46943b3a10b61ce3905485396b5f,run Gupta <arun.gupta@gmail.com>, 2013-10-27 06:42:37 -0700, , changed text glassfish wildfly,,
1122,e17c70d700f9b3d1f7a947d76476708ba2e3dbfb,run Gupta <arun.gupta@gmail.com>, 2013-10-27 06:40:06 -0700, , replacing glassfish logo wildfly,,
1123,ec7f95fc06e6154900984a47f6a09f9a558ec772,run Gupta <arun.gupta@gmail.com>, 2013-10-27 06:33:47 -0700, , adding descriptive output statement,,
1124,c96996b47d38adfc6635006d5898d9033749b58b,run Gupta <arun.gupta@gmail.com>, 2013-10-27 06:32:58 -0700, , adding descriptive output statement,,
1125,d08d2c73babe2227f6702de45c0061cf27399dc1,run Gupta <arun.gupta@gmail.com>, 2013-10-27 06:30:06 -0700, , adding descriptive output statement,,
1126,d35bede33a554cdce052d2aff92d51dbf1a8bd97,run Gupta <arun.gupta@gmail.com>, 2013-10-27 05:52:33 -0700, , added debugging statement,,
1127,63c5346fa0e99d008a2dafe615874f4c6376a0fc,run Gupta <arun.gupta@gmail.com>, 2013-10-27 05:48:41 -0700, , fixing action button,,
1128,ff2fef7c995c690fd2e769a7af549e312ca23f6c,run Gupta <arun.gupta@gmail.com>, 2013-10-27 05:42:56 -0700, , added better title,,
1129,9ad1621e84c4ff500f61da815e9936db6f5247ea,run Gupta <arun.gupta@gmail.com>, 2013-10-27 05:42:16 -0700, , fixed composite component parameter name,,
1130,751c6610e9bfc98f415851b18994fbc5b88ea7e3,run Gupta <arun.gupta@gmail.com>, 2013-10-27 05:38:10 -0700, , adding prompt need entered,,
1131,d7f8cafb58b6fb258533610aadb5444643cbee61,run Gupta <arun.gupta@gmail.com>, 2013-10-27 05:34:11 -0700, , adding prompt need entered,,
1132,5332522e582286d4821f396411f2396ac06dd3bc,run Gupta <arun.gupta@gmail.com>, 2013-10-27 05:16:18 -0700, , adding descriptive output statement,,
1133,f930061055e8cca18206da911a685d859be93dcb,run Gupta <arun.gupta@gmail.com>, 2013-10-27 05:14:15 -0700, , fixing typo better formatting,,
1134,5c30d317efb54e2e0b7dda17f846022bddfdac07,run Gupta <arun.gupta@gmail.com>, 2013-10-27 05:03:32 -0700, , adding descriptive output statement,,
1135,6609f0885ba31ee1adce65e309d0d28edc77ea40,run Gupta <arun.gupta@gmail.com>, 2013-10-27 04:59:08 -0700, , adding client negotiation module,,
1136,c019546fd2963ad9a8eeb18d6826fe3c2a3dffd1,run Gupta <arun.gupta@gmail.com>, 2013-10-27 04:54:36 -0700, , adding descriptive output statement,,
1137,2fabcc6a0898a69eb8feaf7b71fd744158703597,run Gupta <arun.gupta@gmail.com>, 2013-10-27 04:47:47 -0700, , removing redundant statement,,
1138,26c87b63a4c3d24c7de8f4cfd2c5ed9e741e139e,run Gupta <arun.gupta@gmail.com>, 2013-10-27 04:43:08 -0700, , adding descriptive output statement,,
1139,8a32abb4dd6945caaba84c01205ed13baf9bd307,run Gupta <arun.gupta@gmail.com>, 2013-10-27 04:41:55 -0700, , adding descriptive output statement,,
1140,094833c67c8bc86ff95ecc384288f6b5b4ea96d1,run Gupta <arun.gupta@gmail.com>, 2013-10-27 04:37:41 -0700, , adding descriptive output statement,,
1141,13cc0df1bc6c5e4b16009c85a2ca893632a94ae0,run Gupta <arun.gupta@gmail.com>, 2013-10-27 04:31:18 -0700, , fixing location glassfish 4.0 wildfly beta1,,
1142,a62316b6e191f0264a1ade7d3306827af2c563de,run Gupta <arun.gupta@gmail.com>, 2013-10-26 18:26:01 -0700, , removing redundant dependency,,
1143,5d45be77484d9642d3ccd1826300513f2e7d091e,run Gupta <arun.gupta@gmail.com>, 2013-10-26 18:24:37 -0700, , removing redundant dependency,,
1144,97a12765b9bab25dfee3bf7f5437e9c89831b411,run Gupta <arun.gupta@gmail.com>, 2013-10-26 18:23:18 -0700, , adding descriptive output statement,,
1145,5edf7ea2777187fde9258f0769de71bd4f621971,run Gupta <arun.gupta@gmail.com>, 2013-10-26 18:19:54 -0700, , adding configuration ignore list,,
1146,a4a16c3b4882aa598a1a71ee54116a54ea2fdb8f,run Gupta <arun.gupta@gmail.com>, 2013-10-26 18:18:21 -0700, , adding descriptive output statement,,
1147,6ed2469f9b1a0b5baac355e2a0f015e9458053d7,run Gupta <arun.gupta@gmail.com>, 2013-10-26 18:17:30 -0700, , making output statement consistent server filter,,
1148,9482570641356924253b1190d1703a7f0450ebf0,run Gupta <arun.gupta@gmail.com>, 2013-10-26 18:16:29 -0700, , removing redundant dependency,,
1149,8c403489ba72f6b19c69be9f1ee79b7b8849dbeb,run Gupta <arun.gupta@gmail.com>, 2013-10-26 18:14:30 -0700, , making output statement consistent server filter,,
1150,faf8abec63d072f3d4802abb2f520d9d39ed5c6b,run Gupta <arun.gupta@gmail.com>, 2013-10-26 18:13:55 -0700, , adding descriptive output statement,,
1151,21ad115e5a6029d11182ab6924e18d0f03ac8f1d,run Gupta <arun.gupta@gmail.com>, 2013-10-26 18:10:22 -0700, , removing redundant dependency,,
1152,2030b53dde8d36cbdb84affe1e1245ec65ecd0ad,run Gupta <arun.gupta@gmail.com>, 2013-10-26 18:09:17 -0700, , remoremoving redundant dependency,,
1153,0946d871ee9bab5f8d913f32fa2347fc08ce5034,run Gupta <arun.gupta@gmail.com>, 2013-10-26 18:08:17 -0700, , adding descriptive output statement,,
1154,a936ccd897754d46ba4577e7ca31567f94309068,run Gupta <arun.gupta@gmail.com>, 2013-10-26 17:59:22 -0700, , removing redundant dependency,,
1155,fd3e156087f4d55e648f00fb23e5dfce7b1d5273,run Gupta <arun.gupta@gmail.com>, 2013-10-26 17:58:13 -0700, , adding descriptive output statement,,
1156,c63186f0c0565e2d4699054bffd32d3ae10f4d96,run Gupta <arun.gupta@gmail.com>, 2013-10-26 17:52:32 -0700, , removing redundant dependency,,
1157,62a7b4194eebfc2206d79ae786f7c4d2f3b6cc62,run Gupta <arun.gupta@gmail.com>, 2013-10-26 17:46:16 -0700, , adding descriptive output statement,,
1158,0fc82e90d8181f64099b36effd47e547f0fb6c75,run Gupta <arun.gupta@gmail.com>, 2013-10-26 17:43:21 -0700, , adding descriptive output statement,,
1159,cab8f2e3d49ea609e453a974df07ab58cd7bde60,run Gupta <arun.gupta@gmail.com>, 2013-10-26 17:36:49 -0700, , adding descriptive output statement,,
1160,b0ecc848b3c0da4a2c17952aae46fa0dadfc48e7,run Gupta <arun.gupta@gmail.com>, 2013-10-26 17:31:10 -0700, , adding descriptive output statement,,
1161,8bb7f6c1800cffbc59b6aea4849342e685deb23e,run Gupta <arun.gupta@gmail.com>, 2013-10-26 17:30:45 -0700, , changing greeting part decorator bold,,
1162,05814243343162b119ffa8b0956fc466642c4521,run Gupta <arun.gupta@gmail.com>, 2013-10-24 18:07:52 -0400, , fixing cargo snapshot release,,
1163,19c7e040e1b31adf13625d685ab6a96aec3e6bbe,run Gupta <arun.gupta@gmail.com>, 2013-10-24 17:55:35 -0400, , fixing namespace,,
1164,18c179543d9b5d9d822b43fa3a77b1939bc11571,run Gupta <argupta@argupta.csb>, 2013-10-24 17:06:25 -0400, , fixing namespace,,
1165,3d8861881dce7923aee0ada4e201716f3907717b,run Gupta <arun.gupta@gmail.com>, 2013-10-23 11:33:50 -0700,51, merge pull request jeffzhang wf_compile make compiled glassfish wildfly beta1,,
1166,de3605859b7d633232c12be06555470de3c0dc3d,eff Zhang <jeff.zhang@jboss.org>, 2013-10-23 16:26:23 +0800, , make compiled glassfish wildfly beta1,,
1167,018e326ca86f4ca880f3a52f713c1bbd1c0a88bd,run Gupta <arun.p.gupta@oracle.com>, 2013-10-18 00:50:22 -0700, , improved output message,,
1168,273fc6262f008b16f8bee8607fb274d01264e5fd,run Gupta <arun.p.gupta@oracle.com>, 2013-10-18 00:22:38 -0700, , removing fancy qualifier fixing sample thanks helping debug,,
1169,fb1fe47328a2230845933762a7b1ce53e0d5f924,run Gupta <arun.p.gupta@oracle.com>, 2013-10-17 15:44:50 -0700,47, returning correct record fixing http github.com arun gupta javaee7 sample issue,,
1170,6e54801d3164ceb09e0a06cb4a6a43d7349e4b49,run Gupta <arun.p.gupta@oracle.com>, 2013-10-17 15:43:53 -0700,47, returning correct record fixing http github.com arun gupta javaee7 sample issue,,
1171,4a8fda7696e1304260cce770529374476e3899ca,run Gupta <arun.p.gupta@oracle.com>, 2013-10-10 15:41:18 -0700, , adding oracle module,,
1172,3214cca7f2c614e74dbe39c214fa63a730d8305b,run Gupta <arun.p.gupta@oracle.com>, 2013-10-10 15:41:05 -0700, , adding line break,,
1173,2d3edb86f95c0154885ac673e01e25f9c15c93ef,run Gupta <arun.p.gupta@oracle.com>, 2013-10-10 14:04:06 -0700, , adding new sample oracle nosql,,
1174,aa2b1a46d499fee4635f89c845329a367aed7b53,run Gupta <arun.p.gupta@oracle.com>, 2013-10-08 16:57:34 -0700, , adding riak module,,
1175,b327f697479562fa3572071b0ead1df7e5fefe8a,run Gupta <arun.p.gupta@oracle.com>, 2013-10-08 16:57:25 -0700, , adding riak module,,
1176,8be988cfce0bc882b0caaea6bc4b22b9c9025937,run Gupta <arun.p.gupta@oracle.com>, 2013-10-08 14:41:19 -0700, , adding alternative module,,
1177,3a36540c684f577daa89c3e32d798dcf0cb0f267,run Gupta <arun.p.gupta@oracle.com>, 2013-10-07 17:32:55 -0700, , starting work alternative sample,,
1178,7c1fd0c9b3c82f005e50e82124c234a85de7e696,run Gupta <arun.p.gupta@oracle.com>, 2013-10-07 16:31:18 -0700, , adding sample code voldemort module,,
1179,d7374cf198f77686de1fc9c179369fcac13fb433,run Gupta <arun.p.gupta@oracle.com>, 2013-10-07 16:22:43 -0700, , adding voldemort module,,
1180,9437dd61d6b34b20b7f9d547df93768453b92c81,run Gupta <arun.p.gupta@oracle.com>, 2013-10-07 14:10:58 -0700, , interim commit share source code,,
1181,9106ed32000b2313755baf8ab70e10d66f6eb1b3,run Gupta <arun.gupta@gmail.com>, 2013-10-07 11:10:37 -0700,45, merge pull request openwms master added maven enforcer plugin take care ...,,
1182,d85165f994535b37466b5521fc8c691ecc5523ab,eiko Scherrer <scherrer@openwms.org>, 2013-10-07 19:49:17 +0200, , added maven enforcer plugin take care maven version 3.x java 1.7 avoid clash developer environment,,
1183,54508836e6881d5729eb31ad68f58c4e7bb86062,run Gupta <arun.gupta@gmail.com>, 2013-10-07 10:24:50 -0700,44, merge pull request openwms master fixed javadocs source download,,
1184,7297ded73cd6bc92aac63035fc5a35f79f6ba055,eiko Scherrer <openwms@gmail.com>, 2013-10-07 00:21:32 -0700,1, merge pull request openwms fix javadocs download fixed javadocs source download,,
1185,743c01967074ad713a9b42d78bc4f304f5af471e,eiko Scherrer <scherrer@openwms.org>, 2013-10-07 09:15:39 +0200, , fixed javadocs source download,,
1186,21179a3dabb85695f95a7b17c3e923bf077f17b3,run Gupta <arun.p.gupta@oracle.com>, 2013-10-06 21:50:44 -0700, , starting work hbase sample,,
1187,5131a1d9c14398ed44e0d7615fe94a00832a7402,run Gupta <arun.p.gupta@oracle.com>, 2013-10-04 23:20:55 -0700, , adding break avoid redundant evaluation,,
1188,24b94b6bb1ff816ce6838928a3e8df896fe9875f,run Gupta <arun.p.gupta@oracle.com>, 2013-10-04 23:12:40 -0700, , adding neo4j sample,,
1189,cacbe635fdd3be2122e8123d5d9f402f3c86ed00,run Gupta <arun.p.gupta@oracle.com>, 2013-10-04 23:12:18 -0700, , marking transaction committing close,,
1190,fa5c17910442ae3f76f06e6bf39264ba15730a56,run Gupta <arun.p.gupta@oracle.com>, 2013-10-04 17:40:58 -0700, , starting work neo4j sample,,
1191,cbd39b89f4e1d9393ccf2fa8eec8f7116ddb42c7,run Gupta <arun.p.gupta@oracle.com>, 2013-10-03 22:30:19 -0700, , sample run using embedded glassfish using embedded glassfish profile,,
1192,a488d82c80b82f6ede0dab47b5636a1d328d6574,run Gupta <arun.p.gupta@oracle.com>, 2013-10-03 22:20:51 -0700, , removing redundant dependency,,
1193,e9714584600488f98bfa879b6f6b193b6da9e6dc,run Gupta <arun.p.gupta@oracle.com>, 2013-10-03 22:20:35 -0700, , removing usage embedded mongo asking user explicitly start mongo,,
1194,ee5b4c4dd3e37716732dd180cdc5ab0bd42bf70e,run Gupta <arun.p.gupta@oracle.com>, 2013-10-03 22:19:21 -0700, , adding instruction download configure start mongo,,
1195,bfc51422b58d5e3e87a14dd80236a676de39294b,run Gupta <arun.p.gupta@oracle.com>, 2013-10-03 22:19:04 -0700, , adding navigation previous page,,
1196,12cffb361b1bc3b62f964129632e8bb9b6af7fd0,run Gupta <arun.p.gupta@oracle.com>, 2013-10-03 22:06:07 -0700, , removing redundant code,,
1197,368b9561d773813900fe9705d17e9f4c7595825c,run Gupta <arun.gupta@gmail.com>, 2013-10-03 21:35:15 -0700,35, merge pull request mfiguiere master suggested improvement cassandra sample,,
1198,3ca5d0639a6f7d8c9e64da676e3622b3366c5b52,ichael Figuiere <mfiguiere@datastax.com>, 2013-10-03 19:01:53 -0700, , instead contatenated string replaces exists ddl statement added cassandra 2.0,,
1199,0689f22dd0a89c07d16796a8b1ebf95f6a64a2b5,run Gupta <arun.p.gupta@oracle.com>, 2013-10-03 17:32:29 -0700, , new sample show cassandra usage,,
1200,772dfcec54e52af97ed01ad9c00f372d3c3759f3,run Gupta <arun.p.gupta@oracle.com>, 2013-10-03 16:26:45 -0700, , added new profile download dependency source javadoc bundle maven repository,,
1201,40e21237069b2dc9e8a69ccad2a190ee227ce6ec,run Gupta <arun.p.gupta@oracle.com>, 2013-10-03 14:14:22 -0700, , fixing package name,,
1202,b6c5a686d6fef71458976769ef42abbafe49db5a,run Gupta <arun.p.gupta@oracle.com>, 2013-10-03 14:14:11 -0700, , fixing package name,,
1203,e7ad02df7d049c4ed90b854a67a412a7dff0e972,run Gupta <arun.p.gupta@oracle.com>, 2013-10-03 14:13:54 -0700, , fixing package name,,
1204,d87cc280026b5317a98610b86ae23baab567a5fe,run Gupta <arun.p.gupta@oracle.com>, 2013-10-03 14:11:11 -0700, , moving nosql sample separate module,,
1205,c73b40556a946fa05de3e887e9ae4262afde842d,run Gupta <arun.p.gupta@oracle.com>, 2013-10-03 14:05:45 -0700, , adding redis module,,
1206,12a236eb4147bc2d8dc5fe58a395e325707e811d,run Gupta <arun.p.gupta@oracle.com>, 2013-10-03 14:05:31 -0700, , new sample show redis java integration,,
1207,31392a6b136a2f2d23b47f835834b128d90081d2,run Gupta <arun.p.gupta@oracle.com>, 2013-10-03 09:51:16 -0700, , adding back button formatting,,
1208,6a0def18faa6a0581d645b040baeb977db7af82c,run Gupta <arun.p.gupta@oracle.com>, 2013-10-03 09:50:51 -0700, , persisting object instance instead proxy,,
1209,0ba5d04c7cdea62e726743122f572cbdfdc430ed,run Gupta <arun.p.gupta@oracle.com>, 2013-10-03 09:50:32 -0700, , making object serializable persisted couchbase,,
1210,52b4b7c4356c06f92178e6ccb4ed22ce58730f80,run Gupta <arun.p.gupta@oracle.com>, 2013-10-02 17:22:15 -0700, , adding couchbase module,,
1211,05e77c3e02d37f226414e74a72e30dd111635f00,run Gupta <arun.p.gupta@oracle.com>, 2013-10-02 17:22:05 -0700, , new couchbase sample getbulk doe seem returning correct value need investigation,,
1212,0d8444d4716e798cdf2f7d0c4c879fbed928c75d,run Gupta <arun.p.gupta@oracle.com>, 2013-10-02 16:31:14 -0700, , fixing variable name,,
1213,44ecab6db022e33d2e74183c434809c3d7b3bc19,run Gupta <arun.p.gupta@oracle.com>, 2013-10-02 15:00:43 -0700, , mvn embedded glassfish run run sample embedded glassfish tbd connect database,,
1214,e75eef0a7563f690bad2d09a2b8d0418ab5b5094,run Gupta <arun.p.gupta@oracle.com>, 2013-10-02 14:59:40 -0700, , explicitly specifying application medium type,,
1215,6d0a1b4a4f199503f953ea33cd038dd3c1a416f4,run Gupta <arun.p.gupta@oracle.com>, 2013-10-02 11:12:51 -0700, , removing redundant import,,
1216,77b6dc95ffc42c0be3c1b34bc92b074c43cff4e3,run Gupta <arun.p.gupta@oracle.com>, 2013-10-02 11:12:35 -0700, , adding better output message,,
1217,b90ae0b100d976798ce6b0b9646eb3a40e9fd156,run Gupta <arun.p.gupta@oracle.com>, 2013-10-02 11:11:40 -0700, , removing redundant parenthesis,,
1218,8575f61212509c301fda4345bfd56e638fd6a598,run Gupta <arun.p.gupta@oracle.com>, 2013-09-30 16:34:11 -0700, , adding mongo module,,
1219,800b82e65b4ece2711d31a8bc9b938cf2560f8bd,run Gupta <arun.p.gupta@oracle.com>, 2013-09-30 16:33:58 -0700, , new sample show basic usage mongo java application,,
1220,963f38f22311b9fa329215d7f673a0c10d167ddd,run Gupta <arun.p.gupta@oracle.com>, 2013-09-30 14:54:30 -0700, , added pre installed version glassfish wildfly also added weblogic profile although none sample would run right java compliant,,
1221,dbfcc73f045ce0cc323d51c0d0a6987e4b7bc0fb,run Gupta <arun.p.gupta@oracle.com>, 2013-09-30 13:09:16 -0700, , adding finalname build ensure clean archive name generated,,
1222,5159b1587703d559c341ce5890ea4e3917adcbd2,run Gupta <arun.p.gupta@oracle.com>, 2013-09-29 07:54:53 -0700, , cleaned ali tomken cargo compatible,,
1223,15abba871a5f9f6253e0dc7f8a1649dd6ee2cc4f,run Gupta <arun.p.gupta@oracle.com>, 2013-09-27 15:31:17 -0700, , adding snapshot repository cargo working,,
1224,4ba03ea997b1e7f49f7e26a2f79b4fb01eeaa586,run Gupta <arun.p.gupta@oracle.com>, 2013-09-27 14:52:58 -0700, , interim capability start database server well still working,,
1225,d31a0b11e0289b14f899944e0bc98c8c619cbe46,run Gupta <arun.p.gupta@oracle.com>, 2013-09-20 14:59:57 -0700, , better formatting output message,,
1226,da779601a9ab05152dc42066e6d8b46c711a8a29,run Gupta <arun.p.gupta@oracle.com>, 2013-09-20 14:58:45 -0700, , adding better output message,,
1227,679c6e8941ad43278d4df26d1d34f1c219895978,run Gupta <arun.p.gupta@oracle.com>, 2013-09-20 14:56:56 -0700, , removing redundant attribute webservlet,,
1228,bb3d42fedea03dadbac225ba14807563a4652d02,run Gupta <arun.p.gupta@oracle.com>, 2013-09-20 14:55:13 -0700, , adding final qualifier,,
1229,acd761a7314f10ca8f379a8e0aac67508cb60c80,run Gupta <arun.p.gupta@oracle.com>, 2013-09-20 09:59:22 -0700, , added new sample,,
1230,e17ac323d0bf2b3cc824dbed598d7553acb00433,run Gupta <arun.p.gupta@oracle.com>, 2013-09-20 09:58:53 -0700, , starting work new sample show cdi scope,,
1231,48c9a3caecbcaf758df9602326bcfd02cfc386be,run Gupta <arun.p.gupta@oracle.com>, 2013-09-20 09:12:51 -0700, , adding produce,,
1232,fcc596b2f03925751217595262e0bd17c680eccf,run Gupta <arun.p.gupta@oracle.com>, 2013-09-20 08:54:13 -0700, , removing redundant attribute webservlet,,
1233,9c3df5c04d979925e360c570b5c386f0757fe662,run Gupta <arun.p.gupta@oracle.com>, 2013-09-20 08:53:29 -0700, , removing redundant import,,
