id,sha,author,date,issue,message,file,content
0,4ff16a8dc4efe3338b4408ce6b89fe372ece966d,rjan Tijms <arjan.tijms@gmail.com>, 2020-09-14 20:37:54 +0200,465, merge pull request 465 javaee sample dependabot maven jaxrpc jaxrpc security org.apache.ant ant 1.9.15 bump ant 1.7.0 1.9.15 jaxrpc jaxrpc security,,
1,bf5f5df1033b6d25bf0e64857c1f2dfc0ac68912,ependabot[bot] <49699333+dependabot[bot]@users.noreply.github.com>, 2020-09-14 18:29:11 +0000, , bump ant 1.7.0 1.9.15 jaxrpc jaxrpc security bump ant 1.7.0 1.9.15 signed dependabot bot support github.com,,
2,c980615fb4204dfe19fec6a022219b3dfd214594,rjantijms <arjan.tijms@gmail.com>, 2020-06-05 19:49:35 +0200, , small cleaning removing deprecated line signed arjantijms arjan.tijms gmail.com,,
3,5f7e6b83dd6f0af5ef480f05824471e63ed929a7,rjantijms <arjan.tijms@gmail.com>, 2020-06-05 19:49:06 +0200, , updated several dependency version signed arjantijms arjan.tijms gmail.com,,
4,7e0d376da89648096990cfeb578e83524fe9b9f9,rjan Tijms <arjan.tijms@gmail.com>, 2020-06-05 19:39:19 +0200,462, merge pull request 462 javaee sample dependabot maven jaspic common htmlunit 2.37.0 bump htmlunit 2.31 2.37.0 jaspic common,,
5,77f02434964f780fe6576aff645c2ce3d5810a53,rjan Tijms <arjan.tijms@gmail.com>, 2020-06-05 19:39:05 +0200,463, merge pull request 463 javaee sample dependabot maven htmlunit 2.37.0 bump htmlunit 2.35.0 2.37.0,,
6,ba04eb37d08a4a04bee39269a156b702e645fab5,ependabot[bot] <49699333+dependabot[bot]@users.noreply.github.com>, 2020-06-05 17:38:47 +0000, , bump htmlunit 2.31 2.37.0 jaspic common bump htmlunit http github.com htmlunit htmlunit 2.31 2.37.0 release note http github.com htmlunit htmlunit release commits http github.com htmlunit htmlunit compare htmlunit 2.31 ... 2.37.0 signed dependabot bot support github.com,,
7,be7d1b2065f571e85d3fe95c8acd80ddeb888205,rjantijms <arjan.tijms@gmail.com>, 2020-06-05 19:37:55 +0200, , added sample show servlet present web inf lib jar signed arjantijms arjan.tijms gmail.com,,
8,07797bf5c66656f088facd6b1c0c619057f1716c,ependabot[bot] <49699333+dependabot[bot]@users.noreply.github.com>, 2020-05-21 21:14:46 +0000, , bump htmlunit 2.35.0 2.37.0 bump htmlunit http github.com htmlunit htmlunit 2.35.0 2.37.0 release note http github.com htmlunit htmlunit release commits http github.com htmlunit htmlunit compare 2.35.0 ... 2.37.0 signed dependabot bot support github.com,,
9,7471ec9b304897f68b8d7b1c09c307b1eb554f33,rjan Tijms <arjan.tijms@gmail.com>, 2020-05-07 11:00:31 +0200,461, merge pull request 461 ladicek protocol upgrade fix fix test http protocol upgrade,,
10,b0e8b576a48a2bae5e32e98c7a918867309b6869,adislav Thon <lthon@redhat.com>, 2020-05-07 10:35:25 +0200, , fix test http protocol upgrade http client want request protocol upgrade must send upgrade header also set connection header test conforming implementation could reject request.upgrade call fix simple add header client side i.e. test able set connection upgrade header restricted header must allowed setting special system property see also http doc web http servlet specification 4.0 section 2.3.3.5,,
11,278bf7607c523ab229ed3f2cd55c88175e32b0ec,rjantijms <arjan.tijms@gmail.com>, 2020-01-14 15:41:32 +0100, , updated piranha 20.1.2,,
12,092ffee9aebda8140d1b6e143e08a2a3e5d18170,rjantijms <arjan.tijms@gmail.com>, 2020-01-08 21:44:08 +0100, , add ejb switch explicitly define archive signed arjantijms arjan.tijms gmail.com,,
13,9a961270dfba450db095ac545c492c63db0f64db,rjantijms <arjan.tijms@gmail.com>, 2020-01-08 21:43:07 +0100, , update piranha profile signed arjantijms arjan.tijms gmail.com,,
14,346ec06e31dbbe734f64e55f3cfa060fa4bfe743,rjantijms <arjan.tijms@gmail.com>, 2020-01-02 00:18:14 +0100, , deploy test class signed arjantijms arjan.tijms gmail.com,,
15,dc48fdd78abfcc8d98c22fa6bfd179f7d1280114,rjantijms <arjan.tijms@gmail.com>, 2020-01-02 00:17:45 +0100, , remove redundant maven info signed arjantijms arjan.tijms gmail.com,,
16,13c622e7ff8287c5aa124d85e5ecbc20c9068e6c,rjantijms <arjan.tijms@gmail.com>, 2020-01-02 00:16:38 +0100, , removed parent prevent multiple arquillian inclusion signed arjantijms arjan.tijms gmail.com,,
17,0af93709d3ede6ed71823a6120ef1c7378c9343d,rjantijms <arjan.tijms@gmail.com>, 2019-12-16 23:00:37 +0100, , initial support piranha note connector need locally compiled first signed arjantijms arjan.tijms gmail.com,,
18,ff745e515e4d956260fe7d04ac8684f49c3fd245,rjantijms <arjan.tijms@gmail.com>, 2019-11-24 13:35:54 +0100, , making implicit assumption basic used explicit,,
19,391cc5c33c0da5b61ff0b6c36f45561eecef0e0c,rjantijms <arjan.tijms@gmail.com>, 2019-11-22 00:16:32 +0100, , cleaned programmatic login example signed arjantijms arjan.tijms gmail.com,,
20,2073b815b224aa70e0d7cc633565f2f61bb0e189,rjantijms <arjan.tijms@gmail.com>, 2019-11-20 21:39:26 +0100, , added sample test uncovered method accessible,,
21,207fe5b9c4db750a2bb1df1b2cc2d2810fc29916,rjantijms <arjan.tijms@gmail.com>, 2019-11-20 13:06:34 +0100, , clearer message denied test fails signed arjantijms arjan.tijms gmail.com,,
22,8bdef708141f50dc767ec301f02a35d377b46cba,rjantijms <arjan.tijms@gmail.com>, 2019-11-20 00:57:22 +0100, , form auth consistent basic test signed arjantijms arjan.tijms gmail.com,,
23,b70076f84e9ce8659a764cbdfcf9ac06da7cc8f5,rjantijms <arjan.tijms@gmail.com>, 2019-11-07 14:21:37 +0100, , small cleanup servlet programmatic sample signed arjantijms arjan.tijms gmail.com,,
24,de82de6403daea3f9e308ab70856771ee3b3168a,rjantijms <arjan.tijms@gmail.com>, 2019-11-07 14:15:24 +0100, , cleaned servlet protocol sample added test signed arjantijms arjan.tijms gmail.com,,
25,a013bfc4118654e92adf1a320f4cb090ae0e7bc5,rjantijms <arjan.tijms@gmail.com>, 2019-11-06 02:34:21 +0100, , cleaning servlet event sample plus added test signed arjantijms arjan.tijms gmail.com,,
26,857696766270e6dd237bf3303cbbf1cf1e135bc4,rjantijms <arjan.tijms@gmail.com>, 2019-11-05 21:08:23 +0100, , cleanup servlet error mapping adding test signed arjantijms arjan.tijms gmail.com,,
27,2c1ccfb970dbcd59590e0866b1ae1f8d18728f0c,rjantijms <arjan.tijms@gmail.com>, 2019-11-05 17:08:52 +0100, , cleanup servlet sample added test cookie sample signed arjantijms arjan.tijms gmail.com,,
28,e4737e68f295a265baa67a892fa3201f43fb6a7c,rjantijms <arjan.tijms@gmail.com>, 2019-10-15 20:03:36 +0200, , update travis file use openjdk signed arjantijms arjan.tijms gmail.com,,
29,e443e15b4c53175595fb69354c5e82345b7744d0,rjantijms <arjan.tijms@gmail.com>, 2019-06-14 00:42:26 +0200, , moved google doc javafx sample javaee extra project signed arjantijms arjan.tijms gmail.com,,
30,526118a5e2e0fcb6f5243cef51aeb4b711a5f01b,rjantijms <arjan.tijms@gmail.com>, 2019-05-16 23:26:43 +0200, , adjusted package name reference jax ejb sample signed arjantijms arjan.tijms gmail.com,,
31,bd91605542baef5c78c180110ffa0abd7e250e4b,rjantijms <arjan.tijms@gmail.com>, 2019-05-16 15:45:30 +0200, , clarified updated jax sample added ejb variant signed arjantijms arjan.tijms gmail.com,,
32,80ece35c2362eb681f2f069be2b94897a927664c,rjan Tijms <arjan.tijms@gmail.com>, 2019-05-04 20:06:21 +0200,452, merge pull request 452 alanroth master replace property payara.version,,
33,17484fe4b296ae589793c64c4968e892045a11b5,rjan <arjan@ubuntu>, 2019-05-03 22:31:07 +0200, , update comment running jdk,,
34,ad7dd9451cd5f028da6bb751944c7c02a5096203,rjantijms <arjan.tijms@gmail.com>, 2019-04-30 12:17:00 +0200, , suppport rfc 2253 1779 describe one,,
35,26f4a2585a5d78eb1120efb46918df8c50e186cb,lan <alan.roth@payara.fish>, 2019-04-29 11:54:31 +0100, , removed,,
36,ba56f5a9d6d96e9843145f7b86030754e85d7444,rjan Tijms <arjan.tijms@gmail.com>, 2019-04-26 18:07:03 +0200,451, merge pull request 451 juangon thorntail_jdk11 upgrade thorntail jdk support,,
37,24a20b6d12562b8a1b9fbcd8faa80c01632f3250,rjan Tijms <arjan.tijms@gmail.com>, 2019-04-25 14:03:59 +0200, , merge branch master thorntail_jdk11,,
38,8416acbe33b9b4a513a9e4f6ea2d0efd053b226b,rjan Tijms <arjan.tijms@gmail.com>, 2019-04-25 13:08:13 +0200,449, merge pull request 449 jgauravgupta payara 3484 payara 3484 testcase fix payara jdk11 branch,,
39,127aaba07606f11dcd2626b7a99e1041229973cc,uan Gonzalez <juagonza@redhat.com>, 2019-04-25 12:48:32 +0200, , upgrade thorntail jdk support,,
40,126e410d327c906788d7fc9f7467442b5b3fb655,aurav Gupta <gaurav.gupta.jc@gmail.com>, 2019-04-24 16:40:02 +0530, , payara 3484 fix failure,,
41,8c678511bf5496f7176258bb107188f888541c0f,aurav Gupta <gaurav.gupta.jc@gmail.com>, 2019-04-17 18:42:08 +0530, , payara 3484 jaxws client testcase fix,,
42,1855d37723759005dfbf390a831f32e30ecbeec1,aurav Gupta <gaurav.gupta.jc@gmail.com>, 2019-04-03 23:24:53 +0530, , merge branch master payara 3484,,
43,93b0e5ec29f6fce1fb194c81e81da381176ecfb3,rjan Tijms <arjan.tijms@gmail.com>, 2019-04-03 15:26:01 +0200,442, merge pull request 442 pandrex247 cleanup formatting cleanup formatting,,
44,a49bc3be11bc79d27230e95df28bc378cfb8e7b1,ndrew Pielage <pandrex247@hotmail.com>, 2019-04-03 09:18:52 +0100, , merge branch master cleanup formatting,,
45,ef22b2843e29437a66ba77fd9e61754b76e93caa,aurav Gupta <gaurav.gupta.jc@gmail.com>, 2019-04-01 23:00:31 +0530, , payara 3484 polish ejb remote vendor pom,,
46,05d4406548e2c1fca2e668b472abecdc6c8a4c74,aurav Gupta <gaurav.gupta.jc@gmail.com>, 2019-04-01 22:51:22 +0530, , payara 3484 add jax component,,
47,e30f35242114fb864197b4456e0070f2fac5801f,rjan Tijms <arjan.tijms@gmail.com>, 2019-03-28 10:38:58 +0100,447, merge pull request 447 pdudits converter bug add converter jpa listener injection break older versioâ,,
48,b938c99a3f512b25b0362d649dd81583e5c0c43a,atrik Dudits <patrik.dudits@payara.fish>, 2019-03-25 15:44:23 +0100, , add converter jpa listener injection break older version eclipselink,,
49,53e7772ef92f16c183450945ea7bef2b1987cd45,rjan <arjan@ubuntu>, 2019-03-04 01:02:47 -0800, , set v1.2 test added auto discovery domain payara glassfish,,
50,74f5146fec873331f079880261a4d4dacb495307,rjantijms <arjan.tijms@gmail.com>, 2019-03-01 15:08:30 +0100, , updated jax maven plug,,
51,75a1e5b419394c29f235dea01fe2defbf15a3815,rjantijms <arjan.tijms@gmail.com>, 2019-03-01 14:26:18 +0100, , set minimal java version vendor ejb plug,,
52,dd0471702d46344668acd01c0b3d2ac6949df458,rjan Tijms <arjan.tijms@gmail.com>, 2019-03-01 08:41:43 +0000,444, merge pull request 444 jgauravgupta 183 183 remove bouncycastle provider javaee7 sample security clientcert jce execution,,
53,66864e082763b6bb3bd5c31c4af8c447f598b719,rjan Tijms <arjan.tijms@gmail.com>, 2019-03-01 08:41:35 +0000, , merge branch master 183,,
54,446a893b5aa41c1b65d7a0f5e63021bd39c2dbc6,rjan Tijms <arjan.tijms@gmail.com>, 2019-03-01 08:39:07 +0000,445, merge pull request 445 jgauravgupta 187 187 upgrade java sample dependency,,
55,ba7f1ef8b0931478fafeea9cee3fbb1559b2644f,aurav Gupta <gaurav.gupta.jc@gmail.com>, 2019-02-28 12:29:44 +0530, , 187 upgrade java sample dependency,,
56,51f6f62a14991378d89e66e9115510a38d546e4e,aurav Gupta <gaurav.gupta.jc@gmail.com>, 2019-02-22 13:48:05 +0530, , 183 remove bouncycastle provider javaee7 sample security clientcert jce execution,,
57,29c1a533a47dd53a0f084b3b1647d37ca43d36f3,rjantijms <arjan.tijms@gmail.com>, 2018-12-18 20:41:50 +0100, , removed parent test utility lib set scope test fix inability resume run individual test folder,,
58,f9ed3f27a9fdc489076423c6bd1a22b47701460e,rjan Tijms <arjan.tijms@gmail.com>, 2018-12-14 12:30:38 +0100, , merge branch master cleanup formatting,,
59,a0f63284c3a172fe8c6ebe988128d574bf3167e8,rjan Tijms <arjan.tijms@gmail.com>, 2018-12-14 12:29:44 +0100,441, merge pull request 441 mattgill98 payara domain fix use maven specified payara domain,,
60,a6c24e9d583dc90c92825f454c90baae77b628d8,ndrew Pielage <andrew.pielage@payara.fish>, 2018-12-12 11:26:59 +0000, , add parent,,
61,6a994fe23490b69ac51dabd1fcf7dfa90cd3e0cc,ndrew Pielage <andrew.pielage@payara.fish>, 2018-12-12 09:55:09 +0000, , formatting cleanup,,
62,61883528fac68c8337c74792da508d56914410e2,ndrew Pielage <andrew.pielage@payara.fish>, 2018-12-12 09:59:16 +0000, , property already top level,,
63,072c2ee4aa28663bccedcced982cab6c8a56a502,att Gill <matthew.gill@live.co.uk>, 2018-12-11 12:14:45 +0000, , use maven specified payara domain,,
64,0dd07dd8b9fc992a81b9dfd95ca729a893f2ba5c,rjantijms <arjan.tijms@gmail.com>, 2018-11-29 16:10:43 +0100, , added sample client cert using jce,,
65,1d23c9c69d8e54580aa5f881082c409480242fcc,rjantijms <arjan.tijms@gmail.com>, 2018-11-19 17:08:36 +0100, , added trust store handling remote ejb ssl sample,,
66,3ec0551562e59fcbdb1eedf43247cb7afcd5df9b,rjantijms <arjan.tijms@gmail.com>, 2018-11-06 14:17:10 +0100, , application.xml remote ejb ssl test,,
67,3d1fc6d9126e4b75d4fc5897f66dccc3da0e09ca,rjantijms <arjan.tijms@gmail.com>, 2018-11-06 14:16:41 +0100, , using ear deploy ejb since arquillian deploy ejb jar,,
68,e768eff65355b6d08711af6fbdcc65d56a731846,rjantijms <arjan.tijms@gmail.com>, 2018-11-05 22:18:57 +0100, , initial commit remote ejb ssl test,,
69,d86c786caafb71deb38ed3fa39ca6789c1507d1e,rjantijms <arjan.tijms@gmail.com>, 2018-11-03 12:50:50 +0100, , added server side ssl debug client cert test,,
70,a8d68c3d11f550177517d92d4b7638d29840f76f,rjantijms <arjan.tijms@gmail.com>, 2018-11-03 01:22:18 +0100, , cleaned logging client cert test,,
71,c724aa4e674ad4568b9314b68e98a41391c55094,rjantijms <arjan.tijms@gmail.com>, 2018-11-01 12:15:25 +0100, , added option client cert use host obtained cert,,
72,b8cbb0c2fca35b8beefa961406d2cc1b413fb40f,rjantijms <arjan.tijms@gmail.com>, 2018-10-31 22:19:09 +0100, , added domain support payara remote connector,,
73,a2cd03701ddddb620b48c00525135235e0d27069,rjantijms <arjan.tijms@gmail.com>, 2018-10-30 14:07:49 +0100, , set timeout back reasonable value,,
74,240cdf3a63d4a37fab72ea3d06a66dd131dd890c,rjantijms <arjan.tijms@gmail.com>, 2018-10-30 13:57:48 +0100, , fixed wrong parent pom,,
75,60ca1e0ddb6d4b37049f09635b2a38417a9ca0aa,rjantijms <arjan.tijms@gmail.com>, 2018-10-25 22:51:36 +0200, , added test permissions.xml based quicklook test,,
76,390fd75e934b4e54da1bd12e78ae0acb97d27a6d,rjantijms <arjan.tijms@gmail.com>, 2018-10-23 13:54:15 +0200, , put handshake logging client cert behind switch signed arjantijms arjan.tijms gmail.com,,
77,98389106ed88230f8c08b5a5e3735c7dde29f096,rjantijms <arjan.tijms@gmail.com>, 2018-10-23 13:51:50 +0200, , glassfish client remote ejb setting signed arjantijms arjan.tijms gmail.com,,
78,daf9f8761b5d6d4a490e736e2bbe9c7bfb369033,rjantijms <arjan.tijms@gmail.com>, 2018-10-18 16:00:48 +0200, , principal name comply payara 5.184 string version x500 name,,
79,ab6caa0fe75493d00338f05bfe0bd7f181457271,rjantijms <arjan.tijms@gmail.com>, 2018-08-31 10:52:18 +0200, , merge branch master git github.com javaee sample javaee7 samples.git,,
80,5d2fbe1b99b11dff8a46d61696bbd4cbbce58365,rjantijms <arjan.tijms@gmail.com>, 2018-08-31 10:52:07 +0200, , revert jdk sample minimum,,
81,39b70518b57928c1f4333e4e7b0cdafc7aa241de,rjantijms <arjan.tijms@gmail.com>, 2018-08-27 00:20:05 +0200, , adjusted ejb remote maven sub module coordinate,,
82,383a070a5ad06c5bd6e55b3302c60f0961124e10,rjantijms <arjan.tijms@gmail.com>, 2018-08-26 20:35:10 +0200, , added remote ejb sample payara glassfish concrete impl,,
83,97e615ea296c1b7b5f70d80ca75c81f76cb7e872,rjantijms <arjan.tijms@gmail.com>, 2018-08-19 21:42:42 +0200, , moved class second util module first util module removed second util module reference,,
84,578560a74e7d2ed471cbe7a520e441d3c13bff3c,rjantijms <arjan.tijms@gmail.com>, 2018-08-18 22:25:31 +0200, , fixed ordering trust store creation added logging client cert,,
85,c47bf21551a174354a3cd7a0f9ff280e86d70620,rjantijms <arjan.tijms@gmail.com>, 2018-08-17 16:08:16 +0100, , fixed typo somewhat take payara domain account,,
86,24dd78da3297c829a82e4bd382d19d803aaf4cc9,rjantijms <arjan.tijms@gmail.com>, 2018-08-16 15:00:02 +0100, , used sql universal several dbsetup,,
87,a70e3ba2ea2974e62da4104ef38e1f01ad413451,rjantijms <arjan.tijms@gmail.com>, 2018-08-16 00:10:44 +0100, , restored default server profile,,
88,e6e86c9821699d19ff6440b6ada389c161cbf120,rjantijms <arjan.tijms@gmail.com>, 2018-08-15 23:01:57 +0100, , updated readme.md new sample,,
89,f1a8fb6f6dafcd05d44b240ed81968bd09a5f73e,rjantijms <arjan.tijms@gmail.com>, 2018-08-15 23:01:35 +0100, , added sample servlet digest authentication,,
90,b33396c30c5d6120f8b3e488d184aea39f233546,rjantijms <arjan.tijms@gmail.com>, 2018-08-09 21:58:36 +0200, , merge branch master git github.com javaee sample javaee7 samples.git,,
91,4ecf368549f23c98f0c636e77288f942f9312721,rjantijms <arjan.tijms@gmail.com>, 2018-08-09 21:58:20 +0200, , added simple example jax get request,,
92,531a6c3e9ed9daeba0249a1a8ad11f79b19deb2f,rjan Tijms <arjan.tijms@gmail.com>, 2018-08-02 15:45:30 +0200,436, merge pull request 436 juangon update new wildfly swarm name artifact,,
93,04783f8a63f10c83e4e793d6520d947ae90df346,uan Gonzalez <juagonza@redhat.com>, 2018-08-02 15:09:46 +0200, , update new wildfly swarm name artifact,,
94,c9027f8751a1ef5b8f053a2bd1c79f5e0a814fa4,rjantijms <arjan.tijms@gmail.com>, 2018-07-05 17:05:48 +0200, , merge branch master git github.com javaee sample javaee7 samples.git,,
95,9b8de71751b2db8bfe0de38ea3d924e27455ff46,rjantijms <arjan.tijms@gmail.com>, 2018-07-05 17:05:30 +0200, , added test cdi decorator,,
96,18700e8910fb83e4d100bb2d1f706d2340ea7b8e,rjantijms <arjan.tijms@gmail.com>, 2018-06-22 09:16:38 +0200, , removed usage closeallwindows method,,
97,c20bf7361ad4245621614c5a8d257b6aad0f2f80,rjantijms <arjan.tijms@gmail.com>, 2018-06-21 22:53:56 +0200, , added test servlet client cert authentication,,
98,cbd30dc2ee8bf9f1c576b95a1688144a31348f05,rjantijms <arjan.tijms@gmail.com>, 2018-05-29 11:42:22 +0200, , merge branch master git github.com javaee sample javaee7 samples.git,,
99,3d7073728ac480844e165062eef472d4eea181e4,rjantijms <arjan.tijms@gmail.com>, 2018-05-29 11:42:06 +0200, , cleanup,,
100,65fc6a734d7e7859003deac0824fa400483dad76,rjan Tijms <arjan.tijms@gmail.com>, 2018-05-29 01:12:35 +0200, , update readme.md fixed typo,,
101,7a3202bba0d0d0e34025d30991e3f99811a426a0,rjantijms <arjan.tijms@gmail.com>, 2018-05-29 01:11:40 +0200, , updated readme,,
102,a737e8596d964712db8b00a2c6cd589287cf5abd,rjantijms <arjan.tijms@gmail.com>, 2018-05-29 00:56:52 +0200, , added test jax rpc security end point secured requirement encrypted username password,,
103,fb0cc91e565ebe7e44036d2468faf4312da08097,rjantijms <arjan.tijms@gmail.com>, 2018-05-16 20:31:32 +0200, , survey ended,,
104,f11ff2de594b1630d1c5950eccd11a53586030da,rjantijms <arjan.tijms@gmail.com>, 2018-05-16 20:29:47 +0200, , added actual test method jax rpc,,
105,a291e9ffdcff264c53b6b625c6b7bbee0a72b151,rjantijms <arjan.tijms@gmail.com>, 2018-05-15 22:09:15 +0200, , resource ordering jax rpc test,,
106,16a738243fef6eb7416e12493e027c43d8f9ea23,rjantijms <arjan.tijms@gmail.com>, 2018-05-15 22:08:42 +0200, , created actual test archive test jax rpc,,
107,32f8b545202928c8baedd16a9a82cc9c9491e6d8,rjan Tijms <arjan.tijms@gmail.com>, 2018-05-15 17:08:50 +0200, , initial jax rpc sample historical purpose 434 initial jax rpc sample historical purpose,,
108,66eff5f4a37df1858db3e6acfcfb82887470b346,rjan Tijms <arjan.tijms@gmail.com>, 2018-04-10 14:23:51 +0100, , update readme.md added survey link,,
109,e200bd8653d021081d6243b5a58620950123b993,rjantijms <arjan.tijms@gmail.com>, 2018-02-27 16:46:49 +0100, , cleaning several test,,
110,dd55a70e320311d59563575ea9fccd92e63ca871,rjantijms <arjan.tijms@gmail.com>, 2018-02-26 20:22:27 +0100, , update arquillian connector payara,,
111,2b54f0feca1073dca60417dcb86472191ec6d62c,rjantijms <arjan.tijms@gmail.com>, 2018-02-26 17:59:44 +0100, , added file add security test user payara micro signed arjantijms arjan.tijms gmail.com,,
112,d5ba540d776963cb2ad581ec8f2d30da196135b9,rjantijms <arjan.tijms@gmail.com>, 2018-02-23 16:58:38 +0100, , skipping jax test micro updating version,,
113,70364e5b8cb2336e4aa0c18dd0e9d6e8071dc4f9,rjantijms <arjan.tijms@gmail.com>, 2018-02-09 18:00:52 +0100, , updated several version application server,,
114,26fa5212ddc9f67d8424b491f74634f8ca2ddc0d,rjan Tijms <arjan.tijms@gmail.com>, 2018-02-06 18:25:59 +0100, , fix tab space pom.xml resolve unnoticed merge conflict 432,,
115,5f6d6138d36b52dfeaa02f57624c63cefeab8377,rjan Tijms <arjan.tijms@gmail.com>, 2018-02-06 18:20:40 +0100,431, merge pull request 431 pandrex247 payara 2399 websockets ee7 sample add tyrus client dependency micro profile use runasclient,,
116,fcca5f3fa5750c90fdc292672db99df3c317d250,rjan Tijms <arjan.tijms@gmail.com>, 2018-02-06 18:18:21 +0100,430, merge pull request 430 pandrex247 payara 2399 jaxws payara micro managed disable jax,,
117,922abc251d886656514a26d07bd658443b5f8206,ndrew Pielage <pandrex247@hotmail.com>, 2018-02-01 14:13:34 +0000, , skip jaxws micro,,
118,1bd16d032a646a45b496861c45b2b128fac8ac37,ndrew Pielage <pandrex247@hotmail.com>, 2018-02-06 17:09:42 +0000, , change remote interface local,,
119,6ef3cb1bb5f005b472c5de875e14ab04bed2d73e,ndrew Pielage <pandrex247@hotmail.com>, 2018-02-06 17:08:05 +0000, , payara 2399 add tyrus client dependency micro profile use runasclient,,
120,82f56bda87d5595f1c22da0a355815ae356fd4f4,rjantijms <arjan.tijms@gmail.com>, 2018-02-03 22:18:47 +0100, , updated arquillian connector payara fixing classpath bug,,
121,bc3176d3c905cd8868a7449ddcb77879991589d3,rjan Tijms <arjan.tijms@gmail.com>, 2018-01-29 19:08:32 +0000,427, merge pull request 427 flowlogix jms fix fix race condition jms send receive,,
122,f61c3217e7a9bd5ce9349c1273098b0f83b1cbc9,primak <lenny@flowlogix.com>, 2018-01-27 21:53:49 -0600, , fixed race condition method invoked quickly never registered run thus making test wait forever,,
123,2257940f9a6c38ab6eb19cf097e09f4abdf1be66,att Gill <MattGill98@users.noreply.github.com>, 2018-01-17 10:00:08 +0000, , added payara micro container 425 added micro container added dskipjms flag default true payara micro profile false otherwise,,
124,e8c9ed77621cf6d88b8bb9d93ab34bda4f8264d3,rjan Tijms <arjan.tijms@gmail.com>, 2017-11-20 17:45:46 +0100,424, merge pull request 424 juangon swarm 1675_2 fix failure using wildfly swarm profile,,
125,361f55a456a425dbd7136fde67e346e55f2fae23,uan Gonzalez <juagonza@redhat.com>, 2017-11-17 16:27:53 +0100, , fix failure using wildfly swarm profile upgrading upgrading arquillian wildfly swarm version additionally cut dependency test utils parent avoid unwanted added dependency,,
126,7f87cb8315926084ce0f1770916f08e715156501,rjan Tijms <arjan.tijms@gmail.com>, 2017-11-11 11:55:25 +0000,422, merge pull request 422 juangon swarm 1658 partial revert,,
127,e163a60da1025802cafa877b91ad94d32ed8a605,uan Gonzalez <juagonza@redhat.com>, 2017-11-10 11:15:36 +0100, , partial revert setting version artifact needed already defined arquillian bom additionally cause test failing using wildfly swarm,,
128,39f0b461b62d459f42179156047ca1082bdb22a4,rjan Tijms <arjan.tijms@gmail.com>, 2017-11-08 14:10:59 +0000,419, merge pull request 419 gbuckholtz master fixed dependency problem,,
129,643d2101b2ba827631d67dd72d7a19a1b730b661,rjan Tijms <arjan.tijms@gmail.com>, 2017-11-08 14:09:46 +0000,414, merge pull request 414 juangon unify cdi jararchive webarchive,,
130,ad269e0c4f99391d464eb9cc71d93e13949e1e4c,rjan Tijms <arjan.tijms@gmail.com>, 2017-11-08 14:06:48 +0000,420, merge pull request 420 mattgill98 jms send receive time dependency fix jms send receive time dependency fix,,
131,2400065b2f0e7d54db9cdcf1c7cf5196955f3de7,rjan Tijms <arjan.tijms@gmail.com>, 2017-11-08 14:06:10 +0000,421, merge pull request 421 arjantijms master added sample adding dynamic interceptor via extension,,
132,182debd0b56d9c4c33be32bb6124916971544677,rjantijms <arjan.tijms@gmail.com>, 2017-11-08 15:02:10 +0100, , added sample adding dynamic interceptor via extension,,
133,d44e4dedefe96d722020f9c4e364e91ff46988e3,rjantijms <arjan.tijms@gmail.com>, 2017-11-07 22:23:37 +0100, , ignoring additional generated file folder,,
134,94d253e70027867b23095ddb336c9c3f57aa7ec3,rjantijms <arjan.tijms@gmail.com>, 2017-11-07 22:11:19 +0100, , remove generated file,,
135,865c9d4bb79e764277b2bb5059fd501b9ed1b38a,att Gill <matthew.gill@live.co.uk>, 2017-10-26 12:17:25 +0100, , removed netbeans specific file,,
136,d551d2dd61a496fb9a2c9f8e8d097e818fd9bf7e,att Gill <matthew.gill@live.co.uk>, 2017-10-26 12:11:58 +0100, , made resource application scoped correctly cleared undeploy,,
137,18c7efee43d26f4df29f8e706617b8604447e991,att Gill <matthew.gill@live.co.uk>, 2017-10-26 12:09:02 +0100, , made sure error correctly thrown receiver wait full duration sending fails,,
138,b635b7635e0378abc0631a0a06a0269320c6a57f,att Gill <matthew.gill@live.co.uk>, 2017-10-26 11:07:19 +0100, , updated jms message receive timeouts second,,
139,4b9738ddf81a9e2111c16da1e0efaf0aa63ade58,lenn Buckholtz <glenn.buckholtz@sympatico.ca>, 2017-10-13 16:39:36 -0400, , fixed dependency problem arquillian payara server managed seems moved ,,
140,50fe33af41682fc79658e93fa3d9487ed69522f8,rjan Tijms <arjan.tijms@gmail.com>, 2017-09-07 00:32:36 +0200,418, merge pull request 418 arjantijms master small amount formatting pom,,
141,8f207e2f50c28f209cd4b40c5c7e6a4132b00e16,rjantijms <arjan.tijms@gmail.com>, 2017-09-07 00:31:44 +0200, , small amount formatting pom,,
142,35e397f472a0c2b558c4aca373e41080b3f019b0,rjan Tijms <arjan.tijms@gmail.com>, 2017-08-14 16:44:42 +0100,417, merge pull request 417 juangon fix jsf bean validation test using non locale,,
143,6117c6ca2341e367658d35537e769e1c9fc192a1,uan Gonzalez <juagonza@redhat.com>, 2017-08-14 16:50:27 +0200, , fix jsf bean validation test using non locale using locale make test fail message localized,,
144,bb8ec7c5dd0180ba3429baec44f09569dab47919,rjan Tijms <arjan.tijms@gmail.com>, 2017-08-08 21:38:30 +0100,416, merge pull request 416 arjantijms master updated payara version,,
