id,sha,author,date,issue,message,file,content
937,f02eab0354f8b372d1e0226d6f1ae4040a94a681,eoff Harcourt <geoff.harcourt@gmail.com>, 2015-12-18 16:18:32 -0500, ,specific ftplugin filetype extract setupspecific based advises buffer documentation configurationftplugin performed filetypehtmldocchange markdown related commit messageftplugin setting editorftplugin using avoid setting rewriteexecute setlocal letting filetype autocmddetermined,,
938,2d9e8bf0e84a835f300bd519faef4b6bfe289a47,edro-nonfree <pedro-nonfree@users.noreply.github.com>, 2015-12-11 10:56:17 -0500, ,better script replace update portabilityreplace existing script implementationdifference linux change implementationreplacement reworks create process temporarychange applyimprove portability script,,
939,68b6446b9a8747cf3fd1f8b4475c4b750ba08713,ernerd Schaefer <bj.schaefer@gmail.com>, 2015-12-08 15:01:28 -0800, ,default space command using addinginsert cause nojoinspaces single setting,,
940,76aa931b77a2feb05d6eb612dd53ad86cd104b41,eoff Harcourt <geoff.harcourt@gmail.com>, 2015-11-29 08:45:46 -0500, ,leader ctags shortcutintroducedtemplate inspired scheme ctags automaticallycertain control asynchronously sourceleader reindex bypassedwithinleader change function vimscriptexecutes repository local exists identify ctagsfunctionality existing functionvimrc moving function firsttopic breaking toward configuration,,
941,8597a61f611866bbb5c299ff85df9307effc1eea,eoff Harcourt <geoff.harcourt@gmail.com>, 2015-11-29 08:38:30 -0500,17739,prepare alias migrateremoved prepare alias migratedeprecated running discouragedbroughtcomplaint database unable forcewithout database dropping recreatingmigration solely strategy migrate current usingchange migration bring rollback neverrolledprepare running migrate operationperformance smallsynchronization force reason checkdatabase knowing developmentevolution pointprepare existing runningaverage alias second added migrateapplication sized operation reasonablyindex aliasvisual aliasbundlealias migrate rollbackprepare alias migrate rollbackalias rspecprint pretty,,
942,bd3c5daf7fef67ca5aeb17e1a659cde4fc38f29b,obert Eshleman <c.robert.eshleman@gmail.com>, 2015-11-16 15:26:41 -0500, ,unused remove functionfunctionultimately change mergedfunctionunused remove commitissuecomment thoughtbot dotfiles,,
943,6cc0cb9302961c9c2a630a9090bbf8a92e822294,eoff Harcourt <geoff.harcourt@gmail.com>, 2015-11-14 10:15:24 -0500,356,delete local completion branchinfluenced solution contribution original keith heavilythink worked setuppersonal configurationadded solution functionresulted working completionloadingfirst function order loaded completionfunction completionallowing definedinvoking three commandclose,,
944,b3a3c2e67d6e732fe29c396403477474deef3fc4,eoff Harcourt <geoff.harcourt@gmail.com>, 2015-11-13 18:23:47 -0500, ,exportexported order variableprompt negative export contentshell launched prompt effect pollutingcause using exportshell resulted launching another becomecorruptedremoving allow shell exportwithout prompt launched inheriting,,
945,f074afeae3cd9075c0cca1078bc7dfdaa447bc9f,eoff Harcourt <geoff.harcourt@gmail.com>, 2015-11-13 18:19:25 -0500, ,deduplicate exportdeduplicate started fcfcbbaeebdcefusing prevent duplicate typesetenvironment launched entry inherited processexistingusing launch export deduplicated,,
946,f7c73f7c1bb9a902ee3752bd156c095e59469f46,avid Alexander <davidpaulalexander@gmail.com>, 2015-10-26 15:14:25 -0400, ,exporting deduplicateremovecontent typeset composed scalarensure unique first preservewould since searched first others occurrencedirectory command matching,,
947,d98d06a9057b051bd7fdf898727dc163d16cd057,eo Ljungberg <teo@teoljungberg.com>, 2015-06-05 13:22:29 +0200, ,support ctags definitionsupport change ctags,,
948,31b6ad4f3fd70732ae16b7093b4e4b8705b4a608,ike Burns <mike@mike-burns.com>, 2015-10-25 10:32:30 -0400, ,split configuration smallerthoughtbot allows dotfiles incorporate peoplegrained dotfilesthing handle eventually zshrcpreciselyinstead could replaced functionconfigs functioninstead could replacedconfigsrealisticallyadding configs peopleintroducespecific configs posix peopleconfiguration sharedchangeoccur loading alias setupenvironment alias variable dependsourced loading configsautocompletion function definitioncompletionhappens ensure configs setupmight alter configuration,,
949,4c68f6c819530e49435c2f8770fd7b884f6c2333,ean Doyle <sean.p.doyle24@gmail.com>, 2015-11-03 12:48:21 -0500, ,linter recognize configurationconvention linters javascriptconfigurationforcing spite configurationwould enable linting highlighting recognize syntaxinvalidly structured recognize syntastic plugins,,
950,219079887c00d4d745bdcb43dc372f21648dd9c6,eoff Harcourt <geoff.harcourt@gmail.com>, 2015-10-30 15:10:58 -0400, ,update bundler include newer completionsubcommands additional repository bundler completionfirst implemented couple since completionchange definition autocompletion update includevalue platform separating subcommands outdatedbundlebundle individual separating defining command candidatehitting allows subcommands completionsuggest bundle would installcomplete eitherchange importedcompletion afcaaaaecbedfcf,,
951,21830dd035e70543ed42ac18cdc16c1a2b5c0899,eoff Harcourt <geoff.harcourt@gmail.com>, 2015-10-30 12:50:02 -0400, ,shellcheck compliance shell bring syntaxshellcheck bring better compliance executablesshell evaluating testing linting optionshellcheck turned executablesacross could place consistent syntaxusing quoting always shebanglarger buildupdate function completion syntaxchange shellcheck found linting configsguide thoughtbot style backtickscapturing output commandlength argument arrayguide master thoughtbot practice,,
952,31a8dd34f0816b43f8fa93faab635e6dde099217,reg Lazarev <greg@thoughtbot.com>, 2015-10-23 17:28:11 -0400, ,example provide specifying dotfileslocal dotfiles confusion,,
953,901faec4643ff7deaf4f9255f68d8149f36d33fd,islav Marohnić <mislav.marohnic@gmail.com>, 2015-10-16 18:22:46 +0200, ,stderr warning colorize messageescape avoid outputting script,,
954,16219a31db5ca1f8c766d3c6066399950ff7f2c3,islav Marohnić <mislav.marohnic@gmail.com>, 2015-10-16 18:09:36 +0200, ,zshenv detection brokeninteractive start every,,
955,5d397e6fa5f6e67f24d0cb21762c3e44aff1e14b,islav Marohnić <mislav.marohnic@gmail.com>, 2015-10-05 02:19:40 +0200, ,detect zshenv suggest broken renamefound assume zshenvversion capitan suggest renamedsourced login shell zprofileorder invocation nested,,
956,ed8619e0abe7aa147828b3b7568b24a3070b9094,islav Marohnić <mislav.marohnic@gmail.com>, 2015-10-05 01:43:32 +0200, ,change instead suggest detectmight configuration similar peopleupgrade sincebetter phase backwardspersonal compatibility capitan configuration peopledistribution generic advisessourced unless invocationoption contain normally commandenvironment variable command search unless commoncustom program running reallyprogram source shellcustom environment overrideoutput produce contain commandattached assume shellmaster startupfiles zshenv,,
957,6c0a559afdb2b5e12f397708065a694505d98f32,islav Marohnić <mislav.marohnic@gmail.com>, 2015-10-05 00:24:19 +0200, ,suggesting avoid peopleexecutedinteractive furthermore executableszprofileconfigure additional placeimportant instance zshenvsmalladvanced generally usage consideredshell casual login config recommended peoplehistorical misuse documenting peoplereadme suggest peopleconfiguration,,
958,febd718efedd34111a0000fde54d842ee29b18d5,islav Marohnić <mislav.marohnic@gmail.com>, 2015-10-04 18:39:28 +0200, ,tweak editortweak making sense changing setting editorinteractive window terminalinteractive shellexecutable running startedinstead shebang value inheritstock since advised changingreoder zprofilebetter manipulation additional,,
959,f159f1a32615806d07f2212f7bee513906047a1d,islav Marohnić <mislav.marohnic@gmail.com>, 2015-10-04 17:24:38 +0200, ,instruction revert capitanzshenv mistakently invokedaffecting shell interactiveinstead zprofile scriptloginunexpectedly since would frustratedsystem putting first nested reorderdisabled invocationbelievedfixed renamed configuration zshenvzprofileshipped capitan rejoicedfixed configuration faulty finallychange zprofile deliberate correctly invokedapplesuggests project revert capitan oppositeunwise since zprofile zshenvplease teleports broken oldeninstruct breakreverts commit,,
960,3b4de90ab4f488d4698a211963dd9a813df86467,eoff Harcourt <geoff.harcourt@gmail.com>, 2015-10-18 10:58:50 -0500, ,minor error comment command spelling,,
961,7733711c3b82d2ead7680c20b42d89dfcb2230bf,ean Doyle <sean.p.doyle24@gmail.com>, 2015-10-16 09:00:44 -0400, ,aliasallows force lease without usingunintentionally someone overwritingstaterefuse update remoteancestor overwrite localvalue restriction override option currentexpected remote failsforce lease without specifying protectrequiring remote going updatedvalue branch current tracking remotecalleerlandssonguide thoughtbot,,
962,844145553858fb7c8853da12a95dc0109f69bee0,eoff Harcourt <geoff.harcourt@gmail.com>, 2015-10-16 09:12:40 -0400,405,keybinding removereported keybinding problematicactually enters string wheneverconsecutive containsusernames consecutive unusualreported contributor consecutiveforce jjlangholtz problem enough commonmappingkeybinding local configurationprovided binding already enterkeybinding change containsaddress commit,,
963,9aa2cd50260d0149da304c2c0197f1a9b293b1aa,alentino <thevalentino@gmail.com>, 2015-10-13 10:38:07 -0400, ,instead conditionals commandprogram script reason question exists check,,
964,24634ada70ebe1d26d72e008b66278b0fd2c64c1,ike Burns <mike@mike-burns.com>, 2015-10-09 13:17:54 +0200, ,unused remove easterclutter annoying subcommand ranchdotfiles people encouragescustomizability remove,,
965,dbb72cea5f3e857da519abf08aa62aaa61ccfd52,oël Quenneville <joelq@thoughtbot.com>, 2015-09-03 17:09:54 -0400, ,custom ranch commandsometimes leave branch typing leadingboring messageranchfunny custom command ranch friendlier,,
966,66d40a1969385a0da07316e7172f5a667dfc2f6c,ndy Waite <github.aw@andywaite.com>, 2015-09-13 10:47:39 +0100,375.,exuberant clarify ctags integrationremoved plugin readme updatedproject document indexing mapping,,
967,a67c2823b7b7c17a4c313c1fa939df7b6573fe39,eoff Harcourt <geoff.harcourt@gmail.com>, 2015-10-03 11:02:29 -0400, ,projectionistprovides alternate projectionist shortcutallows projection custom related providecustom alternate filetypes relateddeclared mappingchange project author providesnavigate alternate shortcut accessmapping automaticallyprojectionistclose,,
968,644c65df9547230b4da5ecd6441c017dbb022863,eoff Harcourt <geoff.harcourt@gmail.com>, 2015-10-03 10:33:17 -0400,424,mergecommand merge readme request zilloudirection readme syntax,,
969,a3337fe6a15201de4923f1de9b675cb1719095f6,errick Zhang <derrick.zhang@welab.co>, 2015-10-03 22:18:14 +0800, ,readme command,,
970,15de0bcfee0d7a6472da048029408c5faedbae4e,eoff Harcourt <geoff@woodstock.local>, 2015-10-02 14:37:47 -0400, ,instruction capitanchange invokedchange result zprofile zshenvinterferes change rearranginginstructs zprofile readme update renameloaded zshenvmaintaining desired precedenceoffering ventsislaf thanks investigating reshleman,,
971,9262c9aa485bb3e7ac3c1fe124e556b16d8719ef,an Croak <dan@thoughtbot.com>, 2015-09-30 16:33:18 -0700, ,screenshot readme prompt,,
972,f69c0e1986a70458619754019fadf901d3034c53,eoff Harcourt <geoff.harcourt@gmail.com>, 2015-08-25 16:21:37 -0400,408,readme update running advisereported master pulling error openingwithout documentation update changepulling command section running advisechangeremoved outdated referenceremovedremains reference added migrate,,
973,74fd8a362ea295ff4bba8479e09846e8abe5f939,imothy Fenney <kodekata@gmail.com>, 2015-07-28 21:20:01 -0400, ,replace variable quote,,
974,f908cc9b8f0dc22a0e12d14dd0fdf7e2883ae47b,laine Schmeisser <blainesch@gmail.com>, 2015-07-12 13:16:26 -0700, ,amend update current,,
975,9d75c207874cc9f5144e6d4a6885874aa496ae1d,eva Rybakov <coding.fu@gmail.com>, 2015-07-04 18:40:22 +0300, ,update,,
976,6a034a7d659ef332345d17d55aaf47994aa9f96b,erek Prior <derekprior@gmail.com>, 2015-06-15 10:39:42 -0400, ,context ignore variable uselessgenerates variable useless possibly followingcontext warning syntasticcommentmaking warning eliminatedbehavior defaultfound warning,,
977,4713baaeecee13837736986f56640ef14dd24ddc,reg Lazarev <greg@thoughtbot.com>, 2015-05-22 10:40:48 -0700, ,party function third fpathadded party completion thirdshare local functionshare contains standard fpath functionmissing localcompleted adding subcommands fpaththoughtbot related dotfiles,,
978,f6ce831b9d7fdfe1184ac6aa43d42a74788abb98,reg Lazarev <greg@thoughtbot.com>, 2015-05-08 14:59:42 -0700, ,alias remove uncommon,,
979,87e72a90989a5472c19daffa6055f2feb6acb909,ute Costa <tutecosta@gmail.com>, 2015-05-18 22:08:56 -0400, ,prefixtrigger allow prefix easilychange readline remaps beginning overridingwithout effectremovebehavior prefix underlyingchris quoting toomeydifferent might wondering approachbound comfortably default alreadyusing bound navigatorunprefixed,,
980,66491639e4e52538658d950e61bae85c7bd8c062,ean Tambling <dean@MacBook-Air.local>, 2015-04-21 12:53:45 -0700, ,xcode exclude addederror project xcode tracked creating throwwithout exclude correspond createdexisting gitignoreexclude,,
981,13b182f973512f47a7a70ee7ea8f4d2afe28dfe5,acopo Notarstefano <jacopo.notarstefano@gmail.com>, 2015-05-13 19:33:15 +0200, ,keybind,,
982,b0ab8136b6dd34e64475ecc541f43514d778c6dd,aniel Nolan <danielanolan@gmail.com>, 2015-05-11 11:13:17 -0400, ,macro source directoryplugin removingrequest thoughtbot dotfilesmacro brought directory attention pluginscompatibility backwards loaded automaticallymacro plugin entry source vimrcinstalledplugin vimrc sensiblemaster tpope plugin sensible,,
983,d68ba146697bb8653c822a11227ba09eadd2c305,rayson Wright <grayson@thoughtbot.com>, 2015-02-27 14:37:06 -0800, ,session script accept update optionalsessiongenerate current,,
984,0ee272928fad8a006497097e16714e8bb39eddd6,efferson Queiroz Venerando <jefferson@shamani.me>, 2015-05-12 11:19:11 -0300, ,readme update syntaxusing example syntax vundle,,
985,ae4fa0a19ac747d4ab7e2316d68c556276fb82a8,osh Leichtung <elultimo@gmail.com>, 2015-05-01 17:32:50 -0700, ,update migratebundle improve catch plugin commandusing vundle still older,,
986,7aba66a9d6f813644c2a87f4b59b1f739eacd9c6,reg Lazarev <greg@thoughtbot.com>, 2015-05-01 10:03:54 -0700, ,plugin removeplugin abandoned setup seems,,
987,734c1308223b0a0690867f6b1e91e9a750ff6c3b,erek Prior <derekprior@gmail.com>, 2015-03-13 14:58:06 -0400, ,subcommand search bundlesupport style script bundler addedstarting bundler executablestring search subcommanddefault optionally bundle specific amongpuzzling found source useful findingprovides finding various,,
988,58bb228f7531a69d4c656fd14ac3712250c5358a,aniel Nolan <danielanolan@gmail.com>, 2015-05-06 10:55:57 -0400, ,plugin removeplugin longer maintained includedscriptstandard since includedversion macro directoryversion macro included directoryversion added github,,
989,1fcbe111c699f5bef4c9b2dd5e586178521b3aff,ean Doyle <sean.p.doyle24@gmail.com>, 2015-04-10 09:11:24 -0400, ,excludevendor equivalent excluding assetdependency package especially extremely,,
990,ed6f00931a075a56305bdc391e483cb8f0b35ed3,eorge Brocklehurst <george@georgebrock.com>, 2015-05-02 22:27:09 -0400, ,feature enable autosquashquicker easier squash commits autosquash fixupinteractive using rebase enabledeasier autosquashhistoryonelinecommit firstcommit secondcommit thirdchange squashed already anothercommit secondcommit squashsquash commit second branchrebaseorigin rebase branchinteractive ready rebase squashcommit firstcommit secondcommit second squashcommit thirdunlikely writing begin commit since message anyonefixup squashreview still chance going happenalways turned,,
991,5724d124a523be0cde7253addebd4b62c7e92477,eoff Harcourt <geoff.harcourt@gmail.com>, 2015-02-18 21:29:50 -0500, ,vundlenumber junegunnvundle advantageparallel installs quickly update pluginsversion pluginsreload plugin break rollback update usefulstate snapshot currentlazily optionally command relevant invoked pluginsplugins update execute compiledvundle close simplestplugin continuevundle location usingplugin renamepluginstall,,
992,24b34d1becd573be8ad12d1f7a2e5182f8646ddc,an Croak <dan@thoughtbot.com>, 2015-04-11 18:57:50 -0700, ,alias subcommand scriptscript executablenamedavailablecouldtitleelsewhere available commandpowercommandsuperchargingstructure example dotfiles projectrobbyrussellextraholman dotfiles,,
993,266984354b978f3c89dabb522bc41519b866cb4c,reg Lazarev <greg@thoughtbot.com>, 2015-04-09 14:37:54 -0700, ,vendor ignore search,,
994,fc4f0118620162eba287fe5b435d858603af1920,ndy Waite <github.aw@andywaite.com>, 2015-03-18 10:24:55 +0000, ,dictionary enable autocompletedictionary enable autocompletespell check,,
995,b3cb23830dc5b0dec233d1ab5c5cfbff98110bf4,essie A. Young <jessie.a.young@gmail.com>, 2015-03-12 14:37:24 -0700, ,colorscheme remove githubupdate everysolarized preferred theme reconfiguremajority seems plurality using thoughbotterssingle colorschemecolorscheme easiest specifydefault dotfiles theme github,,
996,cf624303b54510e9127acd7d6fbb947e4cb7d7f7,erek Prior <derekprior@gmail.com>, 2015-03-12 09:56:34 -0400, ,leadingconstantly forgettingchange leadinggeneral discussion handle passinghidden allows leading commandincludes contentagignore overcome,,
997,2eb9145f6b80290852983ff79b9e56f12bcc0b14,oe Ferris <jferris@thoughtbot.com>, 2015-03-09 13:48:23 -0400, ,update creditthanks break credit sectionthoughtbot section,,
998,e088612438877d4584c25f14a65daefe62df20d6,osh Hartigan <joshhartigan99@gmail.com>, 2015-02-16 12:37:39 +0000, ,nocompatible removenocompatible htmldoc needed,,
999,44f678312da32795e5443c973a10de77acf57948,achary Jones <zjones@mdsol.com>, 2015-02-17 20:24:46 -0500, ,piping xargs nocolor,,
1000,55fca47954f7c3e72eddaea09b961fca6a9cf9c6,laine Schmeisser <blainesch@gmail.com>, 2015-02-23 13:38:15 -0600, ,amend committhing always allows going,,
1001,bca5bdfd9ed4b58b561430949d28cc127ffda706,an Zabel <ian@thoughtbot.com>, 2015-02-20 16:33:23 -0500, ,command branchremote branchcommit descendingaround branchcommit authorbranchorigin croakorigin master croakorigin month croak rbenvdoyle month originmultiple month costa cursor origindoyle month origin vundledisable month spring origin griffinmonth experimental origin,,
1002,326fae7de78673e6e11f42340f32de7e59f83398,an Croak <dan@thoughtbot.com>, 2015-02-14 18:44:54 -0800, ,switchofficial githubpowered programmingrelease githubbottledhomebrewusing laptopthoughtbot commit laptop,,
1003,38d11d3afbcdfd9e3fe7c4b5ac8ce96c2bd60932,unohodov <yanko.ivanov@onmoon.org>, 2015-02-12 15:20:25 +0100, ,prevent unreadable within repository promptstill annoying within command pretty result becoming autocompletebasicallybranch repository navigate indicates prompt directory current properlysuggestion prompt first branchgoogling stumbled several describing question problem prompt issue similar usefulculprit escaping confused variable everything seems cursor function result unescapingusing apple,,
1004,18a4c817bb237ce875ab92d7c9535b331e42e562,aniel Nolan <danielanolan@gmail.com>, 2015-02-04 14:47:42 -0500, ,excluding directorysilver filtering directory searcherdirectoryctrlp finder ignored therefor fuzzyremoving gitignorestill source prevents checkedfiltering control,,
1005,192729a5d6161c824ced107bba4ec860a03f02c7,obert Eshleman <c.robert.eshleman@gmail.com>, 2015-02-02 20:07:38 -0500, ,interpolate environment alias variableenvironment alias contain referencevalue defined caused interpolate double usingdefined instead alias variablechange editor visualsourced wouldreflectedalias single commit quote using definesenvironment alias evaluated variable,,
1006,b0fe7c01ff24b40fe64736c1d5b2ac9d0f33477c,an Croak <dan@thoughtbot.com>, 2015-01-25 16:48:36 -0800, ,branch alias renamebranch extract currentbranch current,,
1007,d874ae2cbcf4185b6b737717297e234c9a9de570,eoff Harcourt <geoff.harcourt@gmail.com>, 2015-01-13 13:53:39 -0500, ,outdated rnavcommand reference removeremoved rnavcommand commandusing version recentregain functionality,,
1008,bbf920942f36e23f9a84199ae2437d070d403096,erek Prior <derekprior@gmail.com>, 2014-12-19 10:51:02 -0500, ,printing alias prettyusing number issuereadable comparable,,
1009,c0ca64b48a911765e4454fcf69bf0d208bc8a9d8,aniel Nolan <danielanolan@gmail.com>, 2014-12-12 10:16:13 -0500, ,replace ctrlpvimcommitedactively switch since ctrlpvim,,
1010,fa18537afd16c7909bec039ccd17f1c11d46f758,hris Toomey <chris@ctoomey.com>, 2014-12-09 11:10:23 -0500, ,within update scriptdefault would within existing scriptbehavior session would cause update nesteddetects within handle current context properlydetached session creating switchingregardless behave correctlyworkflow update believe existingsupport remains workflowwithinremain within rather falling prefernavigating another creatingsplit session currentnavigate directorywithout attach leaving sessionbinding actuallybreaking session mappedcleanworkflow keeping wanting reason pretty strictfocused single session projectworkflow regularly another referencequickly projectdetached client sessionentry attached sessionterminal creates current essentially unlessattach preventing script currentusing switch clientbinding dotfiles christoomeyentry openbsd query current,,
1011,cfcb8497bfbdea72d0c27676f5847bde80b5ac91,randon Cordell <brandon@brandoncordell.com>, 2014-12-04 22:23:30 -0500, ,prepare commitoverridden commitprepare commitcommit wouldnothingwithout going would commanddffeeabdaefccb introducedreturn override,,
1012,d7f194f94ee1ab535da18e657f0c51479c0233b4,an Croak <dan@thoughtbot.com>, 2014-09-04 14:48:20 -0700, ,convention delegateprepare committhing interesting lintingmaster commit croaky dotfilesmaster dotfiles prepare croaky committhoughtbot rejected dotfiles related requestofficial enoughchange startthoughtbot dotfiles upstream point promoteofficial futurecommit linting believer eitherthing chance commit locallyteammate comment linting hound commitignore opportunityfound linting library tried addinglimited least editor checkingchecking syntaxdownside suite adding lintingviolation style logically functional failureslows suite addingcommit wholeprevent style violation productionprocess suite adding lintingparticularly continuous integrationparticularly appeal lintingthink greenfield totaluniversally project apply practice clientdifferent deploy existing prefer setupapproach middle hound pragmatic,,
1013,782bcf7ddb3178e9143d7f4292d0982137f66df6,an Croak <dan@thoughtbot.com>, 2014-12-02 21:01:54 -0800, ,mention brewfile removelonger,,
1014,fe180f78d5a9437770d76dddaa19e978ef7c5291,reg Lazarev <greg@thoughtbot.com>, 2014-11-14 13:08:16 -0800, ,zshenv,,
1015,be8e18a88016ffdfc755d4d287d37f7208a906e6,aniel Nolan <danielanolan@gmail.com>, 2014-10-21 16:55:12 -0400, ,zshenv revert local addingtwice cause correct right already yosemite local added order addingremove local export zshenv,,
1016,6fc348261081bc57b96a861c85c3f87135e740e9,hris Toomey <chris@ctoomey.com>, 2014-11-03 13:10:15 -0500, ,compliant command posixsystem error shell script ubuntu,,
1017,1eff8c03ec59681faa3eec76ebbb1fa7e76d961f,erek Prior <derekprior@gmail.com>, 2014-10-28 22:35:36 -0400, ,spell commits check,,
1018,f587e307e824f4affb1e6f10a484681a459b6a52,an Zabel <iwz@Ians-iMac-2.local>, 2014-11-02 11:35:59 -0500, ,revertreverts commit,,
1019,383612ac4cb05641fce1a9b1051afd238365f69e,an Zabel <contact@ezabel.com>, 2014-11-02 11:33:26 -0500, ,,,
1020,de8543e54fe7dba28b121e2e8b5150441226c8ee,erek Prior <derekprior@gmail.com>, 2014-10-24 16:30:59 -0400, ,localhomebrew binary rabbitmqformula homebrew library master,,
1021,a65b56ddcb7b5243a5163c90810f38ac6f954b57,obert Eshleman <c.robert.eshleman@gmail.com>, 2014-10-22 17:50:59 -0400, ,character commit messageconventionally commit message wrappedautomatically commit adjustscommit messagebetter useful commit messagecommit,,
1022,a99fbb0f575c671fb7f481961de05e604c0b1fde,ric Collins <eric@thoughtbot.com>, 2014-10-24 15:38:05 -0400, ,ignore named directory,,
1023,cf10a8358f5a0f91a47c52a09469e5d9c992b94c,ike Coutermarsh <coutermarsh.mike@gmail.com>, 2014-10-17 20:57:53 -0400, ,updating readme thoughtbot formulabundleremove needed longer,,
1024,2e3e64e9b9db19cdb72d303cf53adba97d84628c,lbert Arvidsson <albert.arvidsson@gmail.com>, 2014-10-10 14:58:09 +0200, ,prevent invisiblesneak since seeing brokesearchresults character search extension common people,,
1025,635992e1e958207b15bbbb507e728a3e8a53cc84,ake romer <jkrmr@users.noreply.github.com>, 2014-10-18 21:43:16 -0700, ,local gitconfig includeallows template customizing commit overriding message,,
1026,c51b1e8c1791fae3ade69b5d7468e8d7ad0d872d,ike Burns <mike@mike-burns.com>, 2014-10-03 10:28:08 -0700, ,configmodifying instead directorymatched missing,,
1027,b4b9168b19b1ae1d18b613786d975e4cfb2777df,erek Prior <derekprior@gmail.com>, 2014-09-12 11:19:14 -0400, ,unused plugins removeplugins remove running longerrecently eunuch replacedinstalls clean plugin plugins renamepluginclean addition withoutconfirmation,,
1028,03dc6172f73ff198e70edc994c7e119bebb54ca8,an Croak <dan@thoughtbot.com>, 2014-09-30 15:43:41 -0700, ,official fasterappears deprecated githubjingwenogithubdeprecated githubmatch thoughtbot laptopthoughtbot commit laptop,,
1029,90f3b577e8de4ce90b7f97787d540edacbd7013e,an Croak <dan@thoughtbot.com>, 2014-09-30 09:31:48 -0700, ,document mkdir readme,,
1030,85e9f22e48718b246235fd0b409be0e4d21eddbc,reg Lazarev <greg@thoughtbot.com>, 2014-09-12 11:49:58 -0700, ,remove directoryresolve,,
