id,sha,author,date,issue,message,file,content
0,a8291082b5fd23bb84541e7c4089feaa1e99e597,evin <devinvinson@gmail.com>, 2019-02-22 11:15:41 -0500,508,mergemerge request patch alertmybanjosupdate,,
1,d2f6b21b80e50ef8ead02d2076da8c9a583d91e2,evin <devinvinson@gmail.com>, 2019-02-22 11:15:26 -0500,507,mergemerge request patch alertmybanjosupdate,,
2,f142df8c45587bb7d11c271d53a2614a0e34dc5b,ason Tremblay <4190+alertmybanjos@users.noreply.github.com>, 2019-02-22 06:29:41 -0500, ,updatesensitive change initial string,,
3,611c80cce17007582b23dd8c72084c1a40be2f51,ason Tremblay <4190+alertmybanjos@users.noreply.github.com>, 2019-02-22 05:56:58 -0500, ,updatenamed renaming currently actual align clarify,,
4,60940a97614170845242849d0b78e6def0d06073,evin <devinvinson@gmail.com>, 2018-01-06 15:40:49 -0500,456,mergemerge request patch manzoorwanijkcorrection,,
5,b02101400ef6e1556e29495d846de679c4e70967,anzoor Wani <manzoorwani.jk@gmail.com>, 2017-12-07 14:29:48 +0530, ,correction,,
6,bc3e07be2a7d655c6427368b571b4687de64ba6e,evin <devinvinson@gmail.com>, 2017-11-27 17:34:45 -0500,453,mergemerge request ipstenuversion plugin update documentation thank ipstenu,,
7,95844fec48fe71bd350e342a04338caa81c82e11,pstenu (Mika Epstein) <Ipstenu@users.noreply.github.com>, 2017-11-27 14:09:08 -0800, ,inline,,
8,696db21ed7ddee332e7c64f6d453aad29c8fd32c,pstenu (Mika Epstein) <Ipstenu@users.noreply.github.com>, 2017-11-27 14:07:36 -0800, ,direction clarifying,,
9,7af6de6dd2347d3a7cbe53cd449ab5c723de0dd0,evin <devinvinson@gmail.com>, 2017-09-27 19:37:57 -0400,446,mergemerge request masterupdating,,
10,04f90ff5ff7ad957a10c39f7eb52dc097c9635c8,onathan Bossenger <jonathanbossenger@gmail.com>, 2017-09-27 16:13:29 +0200, ,updating plugin standard renaming follow,,
11,1f36abceddc17a2f9469f0c00903b9544e55b84a,evin <devinvinson@gmail.com>, 2017-09-12 08:53:40 -0400,443,mergemerge request tmeister mastersingle constant quote,,
12,65a87940e99eb29395e4adbae9eab269fb2f37c1,nrique Chavez <noone@tmeister.net>, 2017-09-11 11:33:00 -0500, ,single constant quotenotice output avoids,,
13,1f3c2acbe215834caf6415fcbd694fc583bcca65,evin <devinvinson@gmail.com>, 2017-08-30 09:13:14 -0400,417,mergemerge request patch davidshqgrammar change small spelling,,
14,77baf0b2f530cb90971976986dfeb83ab6036f2c,evin <devinvinson@gmail.com>, 2017-08-30 09:11:44 -0400,429,mergemerge request patch cliffordp,,
15,19809447ecdf1fc5058eec032258984ce24ea579,evin <devinvinson@gmail.com>, 2017-08-30 09:11:20 -0400,353,mergemerge request patch talatermistake fixed,,
16,872c67477a7ff26d11ef44e52bfaeba499f6e258,evin <devinvinson@gmail.com>, 2017-08-30 09:04:32 -0400,439,mergeconstant version feature merge requestversion adding constant,,
17,5af56b19a58070000e012a061a4bdc8557524179,onathan Bossenger <jonathanbossenger@gmail.com>, 2017-07-17 10:04:31 +0200, ,version adding constant,,
18,ded444099bc126c68e6e10a6260cd1037b520a09,lifford <tko@tourkick.com>, 2017-05-19 17:39:12 -0500, ,,,
19,c719bf9fc798b8d74999e6579134f074f9312ed8,ave Mackey <dave@davemackey.net>, 2017-01-19 21:41:23 -0500, ,grammar change small spellingcorrected throughout small grammar issue spelling,,
20,923fbaf0c8cb46294d19994808a2a98d30a29f25,evin Vinson <devin@ran.ge>, 2015-12-11 12:58:15 -0500, ,mergemerge translation remove branch,,
21,0c099e42085f7a3a14e22ae372a0e29754e49259,evin Vinson <devin@ran.ge>, 2015-12-05 20:46:30 -0500, ,passing plugin instead variable directlyusing variable incorrect patternusing plugin translatableusing plugin within string,,
22,579fb9823a55f49e1db562aee9565b4446dd1cdc,al Ater <tal@talater.com>, 2015-11-25 20:48:25 -0500, ,mistake fixed,,
23,39cb7ccfb31a496ae0355e83c86000a9256de46e,evin <DevinVinson@gmail.com>, 2015-11-20 11:42:26 -0500,350,mergemaster pillai merge hareesh requestdocumentation update standard,,
24,6f217e9efdf96de8f6d74237e71bb920030ba929,evin <DevinVinson@gmail.com>, 2015-11-20 11:42:00 -0500,349,mergemerge request patch pieroitplugin update,,
25,0ea2ae758e6f3c70074f33fbbad6ad95f6c15d83,areesh <hareesh.hsr289@gmail.com>, 2015-11-15 01:23:52 +0530, ,documentation update standard,,
26,fcd4669f3521fb8020429471f6b98397d62336af,iero Savastano <piero.savastano@gmail.com>, 2015-11-11 16:33:27 +0100, ,plugin updatecomment,,
27,2508a4567bd743c73c780dcee1b124764ae1d758,evin <DevinVinson@gmail.com>, 2015-11-03 08:25:04 -0500,340,mergemerge request patch leerobertsmeplugin update class correct,,
28,1b487de0dbb2857edb21a56cd0d0a6138a0a17aa,evin <DevinVinson@gmail.com>, 2015-11-03 08:24:26 -0500,342,mergemerge request patch leerobertsmeplugin update,,
29,84741e2c1bb6df3caea3a945111b8d8b8d19f58a,evin <DevinVinson@gmail.com>, 2015-11-03 08:24:03 -0500,343,mergemerge request patch leerobertsmeplugin update,,
30,4e84183fd4e5d02aaa46bb1602fd1c55b37e236f,evin <DevinVinson@gmail.com>, 2015-10-21 08:36:14 -0400,339,mergeloader merge request shelobcorrected loader class inline,,
31,360c8ea6e47062725d85fdeb5276b8e15d6f8d8a,eeRobertsMe <emailme@leeroberts.me>, 2015-10-08 13:35:24 +0100, ,plugin update,,
32,a11edd31383594677c855640750d9be77bf610ea,eeRobertsMe <emailme@leeroberts.me>, 2015-10-08 13:29:18 +0100, ,plugin update,,
33,1fe19e455f8c0467bfc6b233992a10ec1b0ea5b6,eeRobertsMe <emailme@leeroberts.me>, 2015-10-08 12:25:28 +0100, ,plugin update class,,
34,897fa95e238c327974e7a68a46ec37f9a95cf262,osh Pollock <jpollock412@gmail.com>, 2015-10-02 15:35:30 -0400, ,inline loader class,,
35,55f28eeb9fbb76c0e74b8f75e778b84a732de14e,evin <DevinVinson@gmail.com>, 2015-08-13 09:45:17 -0400,324,mergemerge request patchcorrect update changelog,,
36,ff46923e032478fd0708ef4a363fdd5c8706f897,avy- <javylopez8@gmail.com>, 2015-08-08 16:48:17 -0400, ,updatechange latest,,
37,5d51804dea8984ee25b99762a7aca2e191fcee5d,evin <DevinVinson@gmail.com>, 2015-08-01 01:01:05 -0400,323,merge faabfmerge request davidshq masterupdate,,
38,6f0aabf3be54258ee7048329d2c95f8e3ef42076,ave Mackey <dave@davemackey.net>, 2015-07-31 12:48:05 -0400, ,updatefeature changed,,
39,5391e0ca277c2fe88f8afe061a10cfd17da7566f,evin Vinson <devin@ran.ge>, 2015-07-03 23:33:03 -0400, ,structure parent folder removestructure flattening folder easier inclusionlocal projectplugin boilerplate issue wordpress devinvinson,,
40,3d3f181924c036ffbf9c7344e7cd7fb1b626eac4,evin <DevinVinson@gmail.com>, 2015-03-09 09:58:10 -0400,266,mergedashboard merge admin wording jancbeck requestchanged wording admin dashboard,,
41,a5e181192bbb4480612ba271145bb2d89385d963,evin Vinson <devin@ran.ge>, 2015-03-04 15:21:25 -0500, ,readme updatedproject inquires pointing added currentcontact,,
42,9c14d6e3ebc6399ca65998aa8db3731dcb55fb9f,an Beck <delite.jcb@googlemail.com>, 2015-02-13 14:31:40 -0400, ,changed dashboard adminspecific becomes dashboard admin,,
43,b469237bda7d0549cb318a6ac78f0ed28d474e55,om McFarlin <tom@tommcfarlin.com>, 2015-02-03 12:18:42 -0500,260,mergemerge request master slushmanfunction param,,
44,2683f494eae02f939b3a342ca53aef8fed42d96f,hris Wilcoxson <chrisw@dccmarketing.com>, 2015-02-03 11:15:28 -0600, ,function param,,
45,474e64911c3e0a0237485803f9774ad62f4bd8cd,om McFarlin <tom@tommcfarlin.com>, 2015-01-19 09:51:22 -0500,254,mergechange donnapep loader chore merge class requestincorrect class,,
46,582ccadde08c6c6bb071d8d1973f668629dacb65,onna Murphy <donna.peplinskie@risevision.com>, 2015-01-17 12:45:15 -0500, ,incorrect class,,
47,470d0ec13c14f56a2827ff8bee9ceddb9eabd9a6,om McFarlin <tom@tommcfarlin.com>, 2015-01-05 13:01:35 -0500,250,mergemerge request changelog swalkinshawfilename changelog,,
48,78624f6cdd5f34ecb6582862f7f4379fcd6d34fc,cott Walkinshaw <scott.walkinshaw@gmail.com>, 2015-01-05 11:39:36 -0500, ,filename changelog,,
49,629b1628ca784b6107062b62c6c54062d3e1d447,om McFarlin <tom@tommcfarlin.com>, 2014-12-01 14:52:30 -0500,243,mergemerge request patch tnorthcuttminor,,
50,411b1d19b9d3f67af5aba025a5272835307e836e,ravis Northcutt <travis@brightagency.net>, 2014-11-26 09:57:22 -0600, ,minor,,
51,72cda6eeaf2b34537232e66fcecf87d34f2b0fa8,om McFarlin <tom@tommcfarlin.com>, 2014-11-19 13:59:21 -0500,238,mergegosukiwi merge request patchincluded syntax,,
52,042c13b7b1e2943ba789e5255e8bd03b9fe2d35c,ederico Ramirez <fedekiller@gmail.com>, 2014-11-19 09:25:59 -0300, ,included syntaxbeeing issue activating,,
53,ec4c52c115fd58be4dcb43d87e2159a00d3df541,om McFarlin <tom@tommcfarlin.com>, 2014-11-17 12:32:39 -0500,237,mergemerge request feskehau masteractivation deactivation create function,,
54,e015b9cd7c402167aa526c20be9c53e2aa17845d,ony Hesjevik <tony@hesjevik.no>, 2014-11-17 23:33:00 +1100, ,activation deactivation create functiondeactivator plugin activator every moving include class activation deactivation,,
55,3c47bc0b5a5812ad5a38ed56fbb8912378f655bb,om McFarlin <tom@tommcfarlin.com>, 2014-11-10 14:15:37 -0500,235,mergemerge request patch barryceelencomment,,
56,f51ee23a1f984088700d7e599478a9752d3d83d8,arry Ceelen <barry@multipop.org>, 2014-11-10 16:57:08 +0100, ,comment,,
57,f11711f07eeac77f11bea8c011f290efbb9cfc6e,om McFarlin <tom@tommcfarlin.com>, 2014-11-05 12:08:34 -0500,231,mergemerge request patchfixing require,,
58,2960b6c1c875d52f625d862b6e1a28dd4e6f4110,ikhil Vimal <techvoltz@gmail.com>, 2014-11-04 16:47:16 -0600, ,fixing requireplugin tommcfarlin believe boilerplate favor issue correctly wordpress,,
59,025d61efee426aadda743d09fcbcaa9db83d76f4,om McFarlin <tom@tommcfarlin.com>, 2014-10-07 16:46:49 -0400,224,mergemerge request maadhattah variableconsistency change,,
60,dbf2c73757cb0d7c01eabf5e1dffb0322f1b56e5,AAdhaTTah <jamesorodig@gmail.com>, 2014-10-07 16:43:55 -0400, ,consistency change,,
61,f1128404266629e08c58843be533ef7b199f80c8,om McFarlin <tom@tommcfarlin.com>, 2014-10-07 16:34:23 -0400,220,mergemerge request mastercomment minor,,
62,7a12d6aa66cf6a7f0d17e75c2b576d73aa92ec10,mitry Mayorov <iamdmitrymayorov@gmail.com>, 2014-10-05 19:36:55 +0600, ,plugin update classpublic subpackage admin updated,,
63,163c2a86c1449377ab0f6b406ce8551a2728572e,mitry Mayorov <iamdmitrymayorov@gmail.com>, 2014-10-05 19:35:03 +0600, ,plugin update classadmin changed subpackage includes,,
64,b08802742d581bdb39b3fcfe6e9c99cc1934188a,om McFarlin <tom@tommcfarlin.com>, 2014-09-11 06:46:59 -0400,216,mergeshouting merge justinsainton please requestplease shouting parent,,
65,50bc54145543495f3ec44075742738aab55b5712,ustin Sainton <justinsainton@gmail.com>, 2014-09-10 21:19:37 -0700, ,please shouting parentshouting,,
66,f4bbb821c2034ec78ae5d642a880cfb7044424f5,om McFarlin <tom@tommcfarlin.com>, 2014-09-04 09:45:48 -0400, ,mergemaster plugin tommcfarlin branch boilerplate merge wordpress,,
67,16c93f8548873ea4f0186710f120281985866c7e,om McFarlin <tom@tommcfarlin.com>, 2014-09-04 09:44:54 -0400, ,instruction adding symlinks window,,
68,d5bb3c526f2e4af3f8772d5d98423e84d6812aa8,om McFarlin <tom@tommcfarlin.com>, 2014-09-03 10:57:25 -0400,214,mergemerge request jessertaylor masterdeactivation fixed,,
69,8f002bfc4d8b0db3bbff850aba733e450db9268a,essertaylor <jesse.taylor@digitaltactics.co.uk>, 2014-09-03 15:11:55 +0100, ,deactivation fixed,,
70,06605429d32a712c503bbd8848a946b79878467c,om McFarlin <tom@tommcfarlin.com>, 2014-09-03 09:26:49 -0400, ,describe installupdating readme describe install,,
71,c8bd2e38afcf32fb28bc5f6d3333c6d9c9e7464d,om McFarlin <tom@tommcfarlin.com>, 2014-09-02 13:55:18 -0400,211,mergemerge request patchplugin,,
72,50f2a612f80f8037abdf87c41f7c21d46b23f1aa,ob Gabaree <rob@rawb.net>, 2014-09-02 13:16:20 -0400, ,plugin,,
73,097afb19b751deaebdc7438271e5498f1a1b6d24,om McFarlin <tom@tommcfarlin.com>, 2014-09-02 12:27:35 -0400,210,mergemerge request patchincorrect,,
74,d2a71ed513bc881c15bae22aa87ad7ce437012e5,ob Gabaree <rob@rawb.net>, 2014-09-02 12:26:08 -0400, ,incorrect,,
75,cda33620e7839d2b37223b6c69c30449fec878c8,om McFarlin <tom@tommcfarlin.com>, 2014-09-01 20:42:08 -0400, ,mergemaster branch merge tracking remote origin developconflictplugin class adminpluginplugin public classplugin trunkplugin,,
76,c3c95e0a810c93eec3459cf3a299e4a2af07356c,om McFarlin <tom@tommcfarlin.com>, 2014-09-01 10:38:09 -0400, ,updating credit,,
77,e387eabfc19499ea33ae513dc3bd6ab2d3270876,om McFarlin <tom@tommcfarlin.com>, 2014-09-01 10:33:51 -0400, ,readme update,,
78,0d21f63eda068b02d67fe5987f7bf5b9a1efc209,om McFarlin <tom@tommcfarlin.com>, 2014-09-01 10:32:22 -0400, ,version initial readme adding,,
79,436ca4a72b2e39c8fdb816e516a8eff56f532d87,om McFarlin <tom@tommcfarlin.com>, 2014-09-01 10:30:10 -0400, ,changelog cleaning,,
80,39275f0cbfacbbfb25f42b8dd66e0045c1a9e608,om McFarlin <tom@tommcfarlin.com>, 2014-09-01 09:46:44 -0400, ,mergeplugin tommcfarlin branch boilerplate merge wordpress develop,,
81,15de548f39d55279bd12e4ffdac8829f2fd9035c,om McFarlin <tom@tommcfarlin.com>, 2014-09-01 09:45:57 -0400, ,plugin adding placeholder,,
82,0694bf9302d948b830072b36d608ac15d827b31a,om McFarlin <tom@tommcfarlin.com>, 2014-08-21 12:32:11 -0400,206,mergemichaelbeil merge request patchconsistency period added first,,
83,fc2a90f412fdd64289421fbcfeff3409b77bbfa4,ichael Beil <michaelbeil@me.com>, 2014-08-21 11:30:45 -0500, ,consistency period added first,,
84,f62930975fa4c1b1645ff97ccb539469d3616bae,om McFarlin <tom@tommcfarlin.com>, 2014-08-21 10:05:38 -0400,203,mergemichaelbeil merge request patch,,
85,4a092e1a7714026cd99cae0e7d03d64e86fedac3,ichael Beil <michaelbeil@me.com>, 2014-08-20 17:42:18 -0500, ,,,
86,56a494c94436c919ff81b2255dac5443a097bda2,om McFarlin <tom@tommcfarlin.com>, 2014-08-19 16:07:17 -0400,202,mergemerge request patch douglsmithplugin minor description,,
87,b8a357b3369b98d2aba9d76ea47a7eb06d067187,oug Smith <douglsmith@users.noreply.github.com>, 2014-08-19 15:06:09 -0500, ,plugin minor description,,
88,b421ddaaaa5f97db14b9f742fee9cd55f819cb71,om McFarlin <tom@tommcfarlin.com>, 2014-08-19 08:51:56 -0400, ,updating updated,,
89,ef28c5a35198071c729ddba9b3ca1099120bc50f,om McFarlin <tom@tommcfarlin.com>, 2014-08-18 17:08:36 -0400, ,updating docblock,,
90,4d6a0dfa3e970371bc8777864130f67b8bf9627d,om McFarlin <tom@tommcfarlin.com>, 2014-08-18 17:00:09 -0400, ,finalizingupdating docblocksfixingwhitespace adjusting,,
91,6782bb5ec301454ea8113bdc9bad4a3d83d36568,om McFarlin <tom@tommcfarlin.com>, 2014-08-16 16:30:16 -0400, ,comment updating,,
92,bcc1d91782c61dee4b507763bba9bac88dc18593,om McFarlin <tom@tommcfarlin.com>, 2014-08-05 16:43:31 -0400, ,update updated,,
93,2e9ae6ac99e3139e603d4c556714f79a4ef5d59b,om McFarlin <tom@tommcfarlin.com>, 2014-08-05 16:43:08 -0400, ,populating docblock,,
94,96f957d6e9b0f75c3855d77cfd50f1894dad2d29,om McFarlin <tom@tommcfarlin.com>, 2014-08-01 17:06:09 -0400, ,updating blockdifferent plugin class documentation includesexample changing,,
95,35650c1b7b72ee957e237dae6a4c4f3ff6bdd29b,om McFarlin <tom@tommcfarlin.com>, 2014-08-01 16:59:31 -0400, ,reference variable using setting proper,,
96,aea004af54c471a8bdcc45545a79530565b9ce3f,om McFarlin <tom@tommcfarlin.com>, 2014-08-01 16:59:19 -0400, ,chaing string,,
97,ef63ff4a913d2ff647af578585537f3d3fa25935,om McFarlin <tom@tommcfarlin.com>, 2014-08-01 16:56:38 -0400, ,merge bfbefplugin tommcfarlin branch boilerplate merge wordpress develop,,
98,f3133d8cb5baaa20ff9b6ebbf66b8b9641a07e16,om McFarlin <tom@tommcfarlin.com>, 2014-08-01 16:47:08 -0400, ,improving docblocksplugin documentingdocblock class changingrelated,,
99,6d6f6399f7ef14d606c1fbd0837b0629b379e0b4,om McFarlin <tom@tommcfarlin.com>, 2014-08-01 16:44:57 -0400, ,removing duplicaterelated,,
100,bfb7e6fb58849fcc08c610feec7a61f6cbea9267,om McFarlin <tom@tommcfarlin.com>, 2014-07-30 16:15:43 -0400,197,merge bafadheader plugin grappler merge requestlower domain,,
101,9b5afad1593c1b4242cb9ba2f8ec5fb611ea95ec,om McFarlin <tom@tommcfarlin.com>, 2014-07-30 16:14:59 -0400,198,mergeheader uninstall grappler merge requestheader consistency update uninstall,,
102,0eb25eefbac53af0f88f4e1312d1f4a276eedb4f,om McFarlin <tom@tommcfarlin.com>, 2014-07-30 16:14:36 -0400,200,mergemerge request duplicate grapplerduplicate documentation remove,,
103,3067be69b58d73e0df219b87e9406b6de7c41b74,lrich Pogson <grapplerulrich@gmail.com>, 2014-07-30 21:59:15 +0200, ,duplicate documentation remove,,
104,67dc6fb7a2fbeae2235048b74ebf55a144c8112f,lrich Pogson <grapplerulrich@gmail.com>, 2014-07-30 21:55:26 +0200, ,header consistency update uninstall,,
105,836d85d1c807196636d2b564b488beeb6ad42a86,lrich Pogson <grapplerulrich@gmail.com>, 2014-07-30 21:52:41 +0200, ,lower domain,,
106,efa4d08df35035076860409f591dc8a742e7a400,om McFarlin <tom@tommcfarlin.com>, 2014-07-30 15:23:18 -0400, ,comment updating require function,,
107,57205587af88208f472d299757184f8b8c066fd9,om McFarlin <tom@tommcfarlin.com>, 2014-07-30 15:16:32 -0400, ,making header conssitentimproving documentation,,
108,43ee54a0eee06182e6c10892a5304b7e41ac8d0c,om McFarlin <tom@tommcfarlin.com>, 2014-07-30 15:03:33 -0400, ,missing documentation adding function,,
109,918ee9e5f92cb66dee50d6162332bb91204de43d,om McFarlin <tom@tommcfarlin.com>, 2014-07-30 15:00:57 -0400, ,public removing accessblock phpdoc guide following formattingprivate function access,,
110,4d9f666e0ffcdc2f488f735f4102010b7fd5b23c,om McFarlin <tom@tommcfarlin.com>, 2014-07-30 14:57:11 -0400,196,mergegrappler space merge remove requestremove space,,
111,8ee0c49bd740c2f8880927e0519e3361dcfd81fa,om McFarlin <tom@tommcfarlin.com>, 2014-07-30 14:56:37 -0400, ,header updating plugin standard conforms docblock,,
112,ec29ebc95b6dbc9b86ab21b7213929bd46f53acc,om McFarlin <tom@tommcfarlin.com>, 2014-07-30 13:58:41 -0400, ,plugin renamingheader domain plugin match renaming,,
113,48e0a373dd3c5d120e936cf2a4387c2492ca769e,lrich Pogson <grapplerulrich@gmail.com>, 2014-07-30 16:04:18 +0200, ,remove space,,
114,81b3c8bd6d9dce2f7b1c39be7a73fd71badb6448,om McFarlin <tom@tommcfarlin.com>, 2014-07-29 17:10:31 -0400, ,updating class argument passed,,
115,0f4aaa969327b8f3b2c400ef1e47c25ccbbd0a17,om McFarlin <tom@tommcfarlin.com>, 2014-07-29 17:10:09 -0400, ,updating function docblocks,,
116,370c439bb251a1b8b2c48d910c54808868cd0a13,om McFarlin <tom@tommcfarlin.com>, 2014-07-29 17:09:55 -0400, ,plugin adding constructor,,
117,560e5959a531e73b910434e3d623e88eafb6a257,om McFarlin <tom@tommcfarlin.com>, 2014-07-29 16:56:18 -0400, ,documenting classspecific documenting implementation undocumented class leaving,,
118,f09ca373d8fa2cb04fc997d46e3520bc87cfb0d1,om McFarlin <tom@tommcfarlin.com>, 2014-07-29 16:55:10 -0400, ,removing trailingslash,,
119,b706dc329161b2b40d6cb64dbc51a5f5f376140f,om McFarlin <tom@tommcfarlin.com>, 2014-07-29 16:03:09 -0400, ,comment updatingmaking comment standard follow wordpress documentation strictly,,
120,2af01cf653e27509c8f02848118bc5a004899539,om McFarlin <tom@tommcfarlin.com>, 2014-07-29 15:56:12 -0400, ,comment updatingmaking comment standard follow wordpress documentation strictly,,
121,2a66ff4d50fad17aadce99a8410a298829606a0f,om McFarlin <tom@tommcfarlin.com>, 2014-07-29 15:48:33 -0400, ,finalizing docblocksmaking comment standard follow wordpress documentation strictly,,
122,3154e38822bec7a1363b14c4b9463aef24ec5fe0,om McFarlin <tom@tommcfarlin.com>, 2014-07-07 16:59:02 -0400, ,updating updated,,
123,3ae56a64608206334984c3833c21043ac3338ed6,om McFarlin <tom@tommcfarlin.com>, 2014-07-07 16:56:54 -0400, ,preventing comma problem syntax adding,,
124,a3cce1d9656d307972fa3e90c6279515bbbdf576,om McFarlin <tom@tommcfarlin.com>, 2014-06-26 16:46:14 -0400, ,updating updated,,
125,23235f94d775753b347699814293f2321630c22f,om McFarlin <tom@tommcfarlin.com>, 2014-06-26 16:19:57 -0400, ,initial documentation completing roundstandard method inline handbook class function documentation,,
126,9f5ffbf597ba07ceecf0c2420b562de5eb679677,om McFarlin <tom@tommcfarlin.com>, 2014-06-26 15:43:18 -0400, ,priority loader codex defaulting argument wordpress adding,,
127,547319a8b667925d498fd5c6e478670b5655127d,om McFarlin <tom@tommcfarlin.com>, 2014-06-10 10:48:59 -0400,187,mergemerge request defries mastergrunt plugin solution added,,
128,ddc916762b74e87624c3e0e7588c41b075019c9c,emkus de Vries <remkus@forsite.nu>, 2014-06-10 14:25:26 +0200, ,grunt plugin solution added,,
129,5efc89dc3b62035aed575f72ca61cb689107060e,om McFarlin <tom@tommcfarlin.com>, 2014-05-31 22:05:10 -0400,186,mergegrappler merge activate request deactivateposition correct,,
130,e75e6e2c572ff4f185ae45bc81b633a04713216e,lrich Pogson <grapplerulrich@gmail.com>, 2014-06-01 00:06:29 +0200, ,position correct,,
131,7d71114f81fee9b6ad20c59a47dcf46fad201dde,om McFarlin <tom@tommcfarlin.com>, 2014-05-09 09:36:06 -0400, ,latest updating reflect change,,
132,2c29f1ca041520e9ebfbeb36682884f4631c38f3,om McFarlin <tom@tommcfarlin.com>, 2014-05-09 09:35:11 -0400, ,conditional moving outside,,
133,b7caa3e958e4bf756b9118e97db29da977523566,om McFarlin <tom@tommcfarlin.com>, 2014-05-08 23:35:44 -0400, ,updating updated,,
134,f89752180f52b13255125155a08ef9a46124a200,om McFarlin <tom@tommcfarlin.com>, 2014-05-08 23:34:38 -0400, ,adding docblocks,,
135,bb3c56b0c28e103621dc20ca0f4d343faac2f8dd,om McFarlin <tom@tommcfarlin.com>, 2014-05-08 23:34:29 -0400, ,adding docblocks,,
136,f3321305690352954b78e8446eddbe26002040f7,om McFarlin <tom@tommcfarlin.com>, 2014-05-08 23:34:16 -0400, ,getters dependency bootstrap moving addinggiven loader plugin prepared handle setting,,
137,e29a775e76169ea19afdd561e473ede2da51e89c,om McFarlin <tom@tommcfarlin.com>, 2014-05-08 23:33:47 -0400, ,plugin refactoring completelyactivation leavingclass bootstrap moving plugingiven loader plugin prepared handle setting,,
138,9a23715ba7dbfb09dc9947deca529d6fc6c95873,om McFarlin <tom@tommcfarlin.com>, 2014-05-08 18:10:22 -0400, ,domain attribute setter defining provided subclassing class injection,,
139,0d63ec21e55fac0a3be5f4f795690e09bcefaea0,om McFarlin <tom@tommcfarlin.com>, 2014-05-08 18:10:04 -0400, ,adding property protected getters,,
140,0fdaeaa67cdb4cc3f37ae28b320c37706ccbc247,om McFarlin <tom@tommcfarlin.com>, 2014-05-08 18:09:50 -0400, ,small instantiated plugin fixing changing documentation,,
141,cc6df31722fbc3e930ac2f5d5835602645b01483,om McFarlin <tom@tommcfarlin.com>, 2014-05-08 18:09:10 -0400, ,version constructor subclassing adding setting,,
142,00c5f7d7338c95fcc6ab858252ac384546ff575a,om McFarlin <tom@tommcfarlin.com>, 2014-05-08 16:50:23 -0400, ,reference plugin getter public class external addingplugin tommcfarlin commitcomment boilerplate commit garyjoes wordpress bdfcccdca,,
143,71f40d5e7a317e0d48f2613c5c575c0f2ad5c1ab,om McFarlin <tom@tommcfarlin.com>, 2014-05-06 09:54:13 -0400, ,loader updating appropriately plugin,,
144,d5bb1de8fb3efb7d62a190588c5dacc855b6ed70,om McFarlin <tom@tommcfarlin.com>, 2014-05-06 09:53:16 -0400, ,distinguish collection filter added adding,,
145,7e64091fd485ab40b6042bb3dc9a25bc82d245ed,om McFarlin <tom@tommcfarlin.com>, 2014-05-05 00:28:02 -0400, ,foreach updating previous version,,
146,5265d1f0aed47103ef89f4b8e9ebb6e39fd4c6b0,om McFarlin <tom@tommcfarlin.com>, 2014-05-05 00:18:13 -0400, ,loader class introducing shared,,
147,b5549d5f9cc427c6406d52954c139419a5426495,om McFarlin <tom@tommcfarlin.com>, 2014-05-05 00:18:04 -0400, ,inherit component class definingconstant version plugin single property place defining entry point getting,,
148,d29ebf7dc84676838ff82b458061de5c57d821a5,om McFarlin <tom@tommcfarlin.com>, 2014-05-05 00:17:23 -0400, ,localization extending implementing plugin class,,
149,f6a587372a263a731122da007f044c751dd11929,om McFarlin <tom@tommcfarlin.com>, 2014-05-05 00:17:13 -0400, ,plugin class extending,,
150,e503be7e38d4d00374b162f28301f89aca2f4873,om McFarlin <tom@tommcfarlin.com>, 2014-05-05 00:16:52 -0400, ,conflict working plugin changing anotherplugin changing,,
151,6e46a1f4390923064740913bb4fd94a391731abf,om McFarlin <tom@tommcfarlin.com>, 2014-05-05 00:16:13 -0400, ,individual loader shared removing order consolidate,,
152,24c1cca4934ff39a48493f8fcb362d3051470890,om McFarlin <tom@tommcfarlin.com>, 2014-05-03 15:29:17 -0400, ,updating change plugin reflect latest,,
153,8c0b11ca1b280a1c1966cf9b1fbb633dc1a0761e,om McFarlin <tom@tommcfarlin.com>, 2014-05-03 15:28:23 -0400, ,localization adding class,,
154,c83aa5434da2c6024f6dcede37331580a281a5e1,om McFarlin <tom@tommcfarlin.com>, 2014-05-03 15:28:04 -0400, ,updating docblocks,,
155,ee79eb45828fc1530c2bcd1943a339abf362685b,om McFarlin <tom@tommcfarlin.com>, 2014-05-03 15:27:38 -0400, ,adding argument function hinting,,
156,0abff96cfcae10ab2bddff97b4f6d0d2ffaa8d42,om McFarlin <tom@tommcfarlin.com>, 2014-05-03 15:27:15 -0400, ,removing whitespace,,
157,8cfee0e67ae4e482c7ee3bcd62f82ee2bb4f03b3,om McFarlin <tom@tommcfarlin.com>, 2014-05-03 15:27:01 -0400, ,updating style script docblocks registering actually,,
158,b3451b717f0457248bf1befd7be1301f34900a27,om McFarlin <tom@tommcfarlin.com>, 2014-05-03 15:26:22 -0400, ,instantiating specific loading plugin dashboard public facingupdating docblocks function hooked explain,,
159,91273f37d41f738970b1fa3138538b4df1f0c0e7,om McFarlin <tom@tommcfarlin.com>, 2014-05-03 15:07:38 -0400, ,updating docblocks,,
160,135920036b73b46459c39b78f73e2646d13d8c98,om McFarlin <tom@tommcfarlin.com>, 2014-05-03 15:07:24 -0400, ,updating description clearer docblocks,,
161,4114ad703eb21f79bf562b92f2ee1fa6a0b24bb7,om McFarlin <tom@tommcfarlin.com>, 2014-05-03 15:07:05 -0400, ,updating docblocks,,
162,821e24a9ea1027da577b1fdc1f6797dc14e488ae,om McFarlin <tom@tommcfarlin.com>, 2014-05-03 15:06:57 -0400, ,updating docblocks,,
163,af315d71456480b3397a789e2edd3a1212600561,om McFarlin <tom@tommcfarlin.com>, 2014-05-03 15:06:50 -0400, ,instruction adding whitespace additional,,
164,c10b371d67ef2167d75ba5e13c085fdbf06a8a12,om McFarlin <tom@tommcfarlin.com>, 2014-05-03 15:06:38 -0400, ,updating adding whitespace docblocks,,
165,4f2719b2eb5c460c7e20bcab6490cddbb2197a84,om McFarlin <tom@tommcfarlin.com>, 2014-05-03 15:06:13 -0400, ,updating docblocks,,
