id,sha,author,date,issue,message,file,content
910,23e8c555bc88c423db65d6c8ecd33efc6688d722,aidou <weirongxu.raidou@gmail.com>, 2020-06-28 09:51:36 +0800, , fix fix inserttext empty 2116,,
911,42674d27e14b4c05e2a997d54086657ba497b1a8,uxing Li <jackie.space@gmail.com>, 2020-06-28 02:50:50 +0100,2118, fix 2118 2119 authored yuxing jackie jackie.li fuseim.com,,
912,84e3e4968a096c7ac3620f08f7172c94fe581e63,icchy326 <micchy326@gmail.com>, 2020-06-24 12:32:50 +0900, , add command 2101,,
913,551353208df1c1d62a476a8cd721dd35eb80f8c5,iming Zhao <chemzqm@gmail.com>, 2020-06-24 11:10:42 +0800, , fix list make sure scrolloff window specific,,
914,c896974d9f8df4dfec2e00c3f62a6c97bda70415,eyward Fann <fannheyward@users.noreply.github.com>, 2020-06-24 10:04:24 +0800, , feat stay current buffer cocupdate 2103,,
915,263ec93b2c32e9ba8912d7dedf5565b1d80e6ab7,iming Zhao <chemzqm@gmail.com>, 2020-06-23 17:45:35 +0800,2096, fix snippet fix nested plain snippet close 2096,,
916,5530c442b23e606e018fa9bc0ee962b8cadcf88a,iming Zhao <chemzqm@gmail.com>, 2020-06-23 17:00:05 +0800, , chore list improve setcursor,,
917,d26daf0a6db0b64a4b5c3be22f0bf704119459b5,iming Zhao <chemzqm@gmail.com>, 2020-06-23 14:32:56 +0800, , feat list cancel list session necessary,,
918,f2e0f3840c0d3d8f6ca389587026f348e5e5c4f9,iming Zhao <chemzqm@gmail.com>, 2020-06-23 14:17:52 +0800,2097, fix extension fix local extension stats close 2097,,
919,3e5a86c1f8ae5ecdd5507620428ab127d85979ac,iming Zhao <chemzqm@gmail.com>, 2020-06-22 18:28:07 +0800, , fix completion avoid complete undefined error,,
920,bcdcd543b9cf6a29bb1b327f007eee0b873089f7,iming Zhao <chemzqm@gmail.com>, 2020-06-20 16:51:53 +0800, , feat snippet improve final placeholder support multiple final placeholder value disable key mapping jump final placeholder,,
921,3f1216939b6c570f6dcfa901404524889053ad28,iming Zhao <chemzqm@gmail.com>, 2020-06-20 16:51:00 +0800, , fix test fix list test timeout,,
922,d351d5da8b003f7739e53adb28a8bb06300f0f1f,iming Zhao <chemzqm@gmail.com>, 2020-06-20 13:33:56 +0800,2089, feat language client support close 2089,,
923,75b31007770bb05a48d9c9a4773dbf4780fb0588,iming Zhao <chemzqm@gmail.com>, 2020-06-20 13:13:34 +0800, , feat list improvement list breaking change focus list window action without quit add resize option fix line change event fired insert mode fix auto preview work filter improve list doc,,
924,d6f7c8eee7a6881ef591d521403e016b76a581a0,iming Zhao <chemzqm@gmail.com>, 2020-06-20 13:13:15 +0800, , chore util change log format,,
925,475932ddf5058da5928eab4e45b7013fa4e33d25,iming Zhao <chemzqm@gmail.com>, 2020-06-19 15:07:02 +0800, , feat list support first option fix duplicate cancel list fix possible wrong cursor index,,
926,10afb3dcd6355563005eae807bfc6f931a0dfb62,iming Zhao <chemzqm@gmail.com>, 2020-06-19 11:12:17 +0800, , fix extension skipped loaded extension runtimepath,,
927,93207fc94e84cc5297847639400262225346a8ac,iming Zhao <chemzqm@gmail.com>, 2020-06-19 11:08:05 +0800, , style eslint check unused var use tsserver instead,,
928,d66d82e3358e3f1fcacb915fc8b382349bd628dd,heel Patel <hello@sheel.me>, 2020-06-18 21:34:49 -0600, , feat env allow nodejs path set environment 2079,,
929,f00e036800defc2d0a3fe35e63ae8dd38b2219fb,iming Zhao <chemzqm@gmail.com>, 2020-06-17 15:15:24 +0800, , fix handler format snippet session,,
930,240799339590e58586dd7b9f01b2175bfdc0e4ce,iming Zhao <chemzqm@gmail.com>, 2020-06-16 19:06:56 +0800, , chore language client show error message failed server,,
931,465b2b5e5c089797a9b1bb11fd011b78a89767e6,iming Zhao <chemzqm@gmail.com>, 2020-06-16 19:06:38 +0800, , fix plugin fix return value action,,
932,6302a0aa8de377df60dcf2008f1d09dc6f8339fe,iming Zhao <chemzqm@gmail.com>, 2020-06-16 15:37:43 +0800, , fix handler fix formatontype work,,
933,0b9dc0e11b7d4566ad1ba4254070b1001b05bc94,eyward Fann <fannheyward@gmail.com>, 2020-06-16 10:56:38 +0800, , chore improve requirement doc,,
934,3a5717dd9233b7b102aff463febe1a67e1161499,iming Zhao <chemzqm@gmail.com>, 2020-06-15 12:08:12 +0800, , fix installer fix remove exist file,,
935,a0412fde3c7e73d4f294e15d465779c67aaa0412,iming Zhao <chemzqm@gmail.com>, 2020-06-15 11:46:14 +0800,2070, fix plugin wait request close 2070,,
936,f1fb527a05cc31804a334133bdb8a0beca8183a2,iming Zhao <chemzqm@gmail.com>, 2020-06-15 11:01:33 +0800, , feat language check document,,
937,050e5592e3eb33883a190a20f6d3932aedf71c8f,en Van Treese <vantreeseba@gmail.com>, 2020-06-14 23:16:19 -0500, , add option list minimum height 2073 feat list add option list minimum height minheight fix list set default value code maxheight match schema.json chore list improve height calculation ensure minimum height chore list remove semicolon added function call,,
938,d59570a70da9fd69647f17a5312a01f29b884775,aidou <weirongxu.raidou@gmail.com>, 2020-06-14 13:14:32 +0800, , fix fix coc add_command 2075,,
939,34789625391b28d2cf18c3cb3ade6563ecb02155,iming Zhao <chemzqm@gmail.com>, 2020-06-13 18:04:43 +0800,2015, fix handler fix position applyedits close 2015,,
940,798a58695494110060cb2f2b16eff7db43fe1ac2,iming Zhao <chemzqm@gmail.com>, 2020-06-13 17:02:40 +0800, , chore language client remove unnecessary document sync,,
941,1505a5d25db3dffdf946095996a87458729b521c,iming Zhao <chemzqm@gmail.com>, 2020-06-13 17:02:22 +0800, , fix util use bufloaded coc util get_content,,
942,0e31874511b5204179514448c43346d4350764db,iming Zhao <chemzqm@gmail.com>, 2020-06-13 15:51:22 +0800, , feat list support quit,,
943,4f729a73eebea549646a6d0a80599299a60f5a46,eyward Fann <fannheyward@gmail.com>, 2020-06-12 14:28:11 +0800, , fix service ignore lint error,,
944,9248f43d6c6bf5a08123a776dd990d7e924b6580,iming Zhao <chemzqm@gmail.com>, 2020-06-12 12:33:23 +0800, , refactor plugin use action request notify breaking change cocaction work coc rpc request coc rpc notify,,
945,095f2677b47492c5f21590e3f61cc08ea79d023d,iming Zhao <chemzqm@gmail.com>, 2020-06-12 09:48:54 +0800, , chore doc format doc,,
946,347afb4eaf07cdce3d97623d7612b62005c89e46,iming Zhao <chemzqm@gmail.com>, 2020-06-11 22:27:58 +0800, , chore diagnostics improve range fix,,
947,c216d129dff539ea396f961e85a4662f3f684629,iming Zhao <chemzqm@gmail.com>, 2020-06-11 20:39:39 +0800, , chore readme better key mapping,,
948,5d219ebd25569c297c687a7625a0227363528f3c,iming Zhao <chemzqm@gmail.com>, 2020-06-11 20:18:06 +0800, , fix complete use empty word label undefined,,
949,151645d8de095b3328c0d91bd7456b3107ce2fd7,iming Zhao <chemzqm@gmail.com>, 2020-06-11 17:02:36 +0800, , fix snippet unset globals session start,,
950,9100af65e08f0291a2f9181013d7ae1b17176bae,iming Zhao <chemzqm@gmail.com>, 2020-06-11 16:48:50 +0800,2062, fix vim fix environment variable close 2062,,
951,e97c10a9ab378172a9aae6ae6f6a50dd05dc6a5a,iming Zhao <chemzqm@gmail.com>, 2020-06-11 15:21:58 +0800, , chore snippet remove remap buffer esc avoid conflict key mapping breaking change esc cancel snippet session,,
952,8b9b63623bb64b7906004798352339d0bc5e1831,iming Zhao <chemzqm@gmail.com>, 2020-06-11 13:29:04 +0800, , chore test use coc_node_env test mode,,
953,f0c4dead5b74de8c9b21c3571696cab2d8d18833,iming Zhao <chemzqm@gmail.com>, 2020-06-11 13:24:57 +0800, , chore test avoid test fail,,
954,6ebec1fae34f7cba36bbb6483439ac1790c65961,iming Zhao <chemzqm@gmail.com>, 2020-06-11 12:29:47 +0800, , feat float close float win insertenter,,
955,c83813f73007d00d5590495d8d6420ad3ded632d,iming Zhao <chemzqm@gmail.com>, 2020-06-10 19:50:29 +0800, , feat diagnostic use cocdiagnostics locationlist breaking change automatic change locationlist,,
956,2984f288554ce1713d63465da0201bc22436e9fd,iming Zhao <chemzqm@gmail.com>, 2020-06-10 12:38:20 +0800, , chore complete use complete_info coc _select_confirm,,
957,fac41c9043c95b53a261f4b08f1e580c3a0385e9,iming Zhao <chemzqm@gmail.com>, 2020-06-10 12:33:24 +0800,2055, chore doc add activeextension cocaction close 2055,,
958,267bb20ddce33d3c4d7ae9b7748743254bbb2950,iming Zhao <chemzqm@gmail.com>, 2020-06-10 11:52:18 +0800, , fix completion cancel completion unchanged pretext,,
959,d6ef4e6d9372b802bc629e88b8174d68d4c87d02,iming Zhao <chemzqm@gmail.com>, 2020-06-10 11:51:30 +0800, , chore test avoid fetch test fail,,
960,42d3ed509f696dc4867f0adf79c0536f56ad5079,iming Zhao <chemzqm@gmail.com>, 2020-06-10 11:43:02 +0800, , chore refactor use patch change refactor,,
961,d48afceae96412907ef89bc938d46017c9972e32,iming Zhao <chemzqm@gmail.com>, 2020-06-09 19:51:32 +0800, , fix snippet avoid clipboardy throw,,
962,8d6a49c9ae3ae423f7bb090ef80cb3f5364ee8af,iming Zhao <chemzqm@gmail.com>, 2020-06-09 19:41:18 +0800, , chore snippet use clipboardy clipboard text,,
963,18715d5c4c425b1fe92a52c5a898311ba7f30be4,iming Zhao <chemzqm@gmail.com>, 2020-06-09 19:33:04 +0800, , chore language avoid unnecessary redraw snippet,,
964,1aed7d565c5bfb9cc1bd5ed8a775e423dbf43bf4,iming Zhao <chemzqm@gmail.com>, 2020-06-09 19:12:53 +0800,2030, fix completion avoid unnecessary document synchronize close 2030,,
965,a480bf3dfc84765688dcc900010266d30c1db13a,iming Zhao <chemzqm@gmail.com>, 2020-06-09 15:31:30 +0800, , fix fix undefined error,,
966,b13c9b4698a2376b5681c67b1f60722414d8dfcd,iming Zhao <chemzqm@gmail.com>, 2020-06-09 14:31:44 +0800,2040, fix check size folder change close 2040,,
967,0bc350f771d2687c86cedb87b09472efd8c634d5,iming Zhao <chemzqm@gmail.com>, 2020-06-09 12:08:27 +0800,2025, fix installbuffer reset scrolloff close 2025,,
968,915ab487ae5f122b8bdd303d1a4bbcd1b3ea107a,iming Zhao <chemzqm@gmail.com>, 2020-06-09 12:05:48 +0800,2048, fix util avoid undefined close 2048,,
969,d8fe2c669467226e28602a48cd5e122f0d5e6731,akub Nowak <jakub.jakub.nowak@gmail.com>, 2020-06-09 03:26:31 +0200, , call expand node path 2045 fix 1685,,
970,2bf7615dfe6b6da43b1d5f09c6c07d5d29a80473,eyward Fann <fannheyward@gmail.com>, 2020-06-08 15:34:03 +0800,2046, fix plugin typo close 2046,,
971,e3c19bd4537fa6be132842348cf3041550c7a8c1,eyward Fann <fannheyward@gmail.com>, 2020-06-08 09:02:25 +0800, , fix test fix floatbuffer test,,
972,fa536851f83a0edd776ed3972509d1c66fa65e33,asuten <heliopause64@gmail.com>, 2020-06-08 09:57:18 +0900, , fix drawing horizontal line cjk 2044 reverts commit cjk environment u2500 may drawn two width char sometimes occurs good drawing ref pull req screenshots uax east asian width http www.unicode.org report tr11 tr11 38.html,,
973,d5471449bf58978d0ac77b2c7c756d062a5788e4,iming Zhao <chemzqm@gmail.com>, 2020-06-04 22:35:27 +0800,2001, fix plugin make extension initialize earlier close 2001 improve initialize extension module improve workspace module setup extension activated,,
974,a02c9ff266ec58284ef96b685f32c85a73eeb428,iming Zhao <chemzqm@gmail.com>, 2020-06-04 20:19:14 +0800, , feat plugin add coc util close_floats fix cocenable cocdisable work vim8,,
975,fd6f1a5ed479218a009301f84b13a764dd6541e4,iming Zhao <chemzqm@gmail.com>, 2020-06-04 19:37:16 +0800, , feat source support,,
976,59e8b16d859f5d3460f54b135ca1ed8aab04c685,iming Zhao <chemzqm@gmail.com>, 2020-06-04 17:18:59 +0800, , feat document add previewwindow winid property,,
977,b19060c1831dfc38ece7ea1cba976dbc5c56c8fc,iming Zhao <chemzqm@gmail.com>, 2020-06-03 18:31:38 +0800, , feat env set,,
978,4aaf5bf73c9c004af0ee7e7604ab8281b22f4229,iming Zhao <chemzqm@gmail.com>, 2020-06-03 18:13:06 +0800, , feat vim check bin server.js different git branch,,
979,7e51963a0c56a7edc23de54083eb50c6bbfc0a28,iming Zhao <chemzqm@gmail.com>, 2020-06-02 20:07:39 +0800, , feat installbuffer remap close window,,
980,4d98f9059cbb29544ad6857baf44c863ca66dd76,iming Zhao <chemzqm@gmail.com>, 2020-06-02 19:23:24 +0800,2004, fix float reset signcolumn vim8 avoid flicker issue 2004,,
981,63d20283203d2156140ceb8fe418728af1056431,iming Zhao <chemzqm@gmail.com>, 2020-06-02 19:04:36 +0800, , fix completion avoid trigger completion cursormovedi,,
982,42eddb439b3618be12a80e9c330b772beefa7565,iming Zhao <chemzqm@gmail.com>, 2020-06-02 18:58:49 +0800, , chore installbuffer avoid one window message,,
983,4c201f7a3adf3a953ba7219f681c1d8d93a093b4,edy Li <hedyhyry@gmail.com>, 2020-06-01 09:08:59 +0800, , fix grammar code snippet readme.md 2012 previously ... use yarn ... using yarn,,
984,9f95c95c01f39b7c6768392325752a701903990d,onathan Lehman <jonathan.lehman91@gmail.com>, 2020-05-31 02:05:36 -0700, , fix example language server config readme 2006 snippet doe work missing top level key language,,
985,95e7ca83242e38c162ac85fba875faee81f0b372,iming Zhao <chemzqm@gmail.com>, 2020-05-29 23:35:12 +0800,2003, refactor completion reduce communicate vim close 2003,,
986,30506eedef6690433cff3a2c1d35c2c5586b0745,iming Zhao <chemzqm@gmail.com>, 2020-05-29 17:42:11 +0800, , fix workspace add watch coc_enabled,,
987,86bf2525cf6c77d20bdf2d2026d90c273b164f58,iming Zhao <chemzqm@gmail.com>, 2020-05-29 17:23:46 +0800, , fix float fix text replace markdown text,,
988,49053aaaf93679049db4608760dab0632f9b739d,iming Zhao <chemzqm@gmail.com>, 2020-05-29 17:10:47 +0800, , chore workspace remove watch coc_enabled,,
989,40fe168b68d06d14c89e678948c4a4fb62963376,¹´ç³å°è±æ±¤ <iamcco@foxmail.com>, 2020-05-29 16:16:49 +0800, , fix extension return export active 2002,,
990,6fc0d73c13b2affbffa1eb3110c6b7f7390b880e,iming Zhao <chemzqm@gmail.com>, 2020-05-28 22:03:07 +0800, , feat handler improve offset signature float,,
991,2bb08e43f710d80972a0a98e6607c7301cedd77e,iming Zhao <chemzqm@gmail.com>, 2020-05-28 21:33:56 +0800, , fix document fix document synchronize vim8,,
992,a0d92710674dd626f21640cb97dafdb4faf945ac,iming Zhao <chemzqm@gmail.com>, 2020-05-28 16:17:29 +0800, , chore doc update doc,,
993,3c774fbfa5c36f505c7bfe3d00b3951fd3c25860,iming Zhao <chemzqm@gmail.com>, 2020-05-27 18:04:35 +0800, , test avoid fail,,
994,b0b705e15c0abb4502d565c7c827f850aa2c2581,iming Zhao <chemzqm@gmail.com>, 2020-05-27 18:02:12 +0800, , chore doc update readme,,
995,11bdb89a2339d8064198e774a982d3a951648f93,iming Zhao <chemzqm@gmail.com>, 2020-05-27 17:40:06 +0800, , chore doc update readme,,
996,58c4918ab6072826ea4a820606160be6ba52f78d,iming Zhao <chemzqm@gmail.com>, 2020-05-27 17:07:40 +0800, , chore doc update readme,,
997,4eafbabfb984224b6aabb9c1da8c6993f8f47b01,iming Zhao <chemzqm@gmail.com>, 2020-05-27 16:43:53 +0800, , feat extension auto update breaking change extension auto update disabled default,,
998,3bd00ae050ec3faee9dcc638696ea720b2753ec1,iming Zhao <chemzqm@gmail.com>, 2020-05-26 15:52:03 +0800, , fix extension fix single file extension loaded,,
999,11f2426eae25555ddf5c7fc1b62a9cb06ff20e29,achary Freed <theconfuzzleddude@gmail.com>, 2020-05-26 06:50:48 +0100, , return promise cocaction 1987 promise returned meant action like cocaction command returning result,,
1000,720b012f04622d9980fdeb66be5fe623db9e06cb,iming Zhao <chemzqm@gmail.com>, 2020-05-25 21:24:20 +0800,1986, fix diagnostic fix close 1986,,
1001,e0003fad47a74e52361c24fafe0faef979f657ab,iming Zhao <chemzqm@gmail.com>, 2020-05-25 21:09:24 +0800,1980, fix diagnostic fix refresh locationlist close 1980,,
1002,6158495a4968bbb8d87d4dc96b551bcfb4535833,iming Zhao <chemzqm@gmail.com>, 2020-05-25 20:49:04 +0800, , refactor plugin use map action,,
1003,7e8d6b6810a2629ed47f7191dc1e34ee9c3b132d,iming Zhao <chemzqm@gmail.com>, 2020-05-25 19:55:47 +0800, , doc doc remove action,,
1004,0c973a7a472567ee8b12085dffe5e74acc307f6b,iming Zhao <chemzqm@gmail.com>, 2020-05-22 22:15:46 +0800, , chore test avoid test fail,,
1005,e502d4a04ed8bd2a58a3eb08c646a3605177e994,iming Zhao <chemzqm@gmail.com>, 2020-05-22 22:09:26 +0800, , feat plugin add checkversion,,
1006,01bf78f338420d7f79fe60c3fa912417f3f9bc0d,iming Zhao <chemzqm@gmail.com>, 2020-05-22 21:28:31 +0800, , chore util check bufloaded coc util open_files,,
1007,5ccc91b3f492638c2502343bd3157abffbea1002,iming Zhao <chemzqm@gmail.com>, 2020-05-22 21:15:16 +0800, , chore util use setbufline coc util change_lines,,
1008,7d56ff249dfeb479ea8c5cb9944893872d43e711,iming Zhao <chemzqm@gmail.com>, 2020-05-22 20:41:28 +0800, , perf diagnostic increase delay refresh,,
1009,abebcec80e94dab16c4ddf88eba6595c4256ead1,iming Zhao <chemzqm@gmail.com>, 2020-05-22 20:41:12 +0800, , chore completion improve redraw vim,,
1010,70782b56ec66ec1572edc6010f611c46c7f31afa,eyward Fann <fannheyward@gmail.com>, 2020-05-22 16:35:02 +0800, , chore readme doc,,
1011,aa7e1ef29b1e8b6cd47d29ea1d58d0783fbebad7,eyward Fann <fannheyward@gmail.com>, 2020-05-22 16:33:23 +0800, , chore doc doc,,
1012,f552d4d75d3f22b3fd392652072b36b414652f5a,iming Zhao <chemzqm@gmail.com>, 2020-05-22 16:26:55 +0800, , fix extension avoid watchman spawn error,,
1013,2731c16d0055d41a16189a395467b511e94b4c8f,iming Zhao <chemzqm@gmail.com>, 2020-05-22 16:18:50 +0800, , feat plugin add directory cocinfo,,
1014,4f0b815b87c9d9a930c7ad506ee5f097fa2a7d36,iming Zhao <chemzqm@gmail.com>, 2020-05-22 16:09:11 +0800, , feat plugin prefer javascript lib folder use javascript file lib folder exists build folder compiled webpack fallback build folder preferred would cause issue switched master branch coc_force_debug would unnecessary since lib folder preferred use let want coc.nvim always use javasscript build folder,,
1015,8e80ed7a0f23ebb58c388dd37411ec1fe7eae94c,iming Zhao <chemzqm@gmail.com>, 2020-05-22 16:00:38 +0800, , feat plugin add warning node 10.13,,
1016,b3dcc2c494beabb2eeca996f522c55a47c7bb057,aehwang Jerry Jung <tomtomjhj@gmail.com>, 2020-05-22 15:14:14 +0900, , add 1972 configuration limit max height preview window used hover valid preview,,
1017,224c2abaa73d01a7a75f6af4b262cb9b79b7077b,iming Zhao <chemzqm@gmail.com>, 2020-05-22 14:13:14 +0800, , chore test avoid test fail,,
1018,0ace9755511c6eb497d96522a43361b0f931f454,iming Zhao <chemzqm@gmail.com>, 2020-05-22 14:08:42 +0800, , chore package add,,
1019,e627c36bcc139565e4b2484aa92f38a978618a36,iming Zhao <chemzqm@gmail.com>, 2020-05-22 14:03:55 +0800, , chore health check node 10.13.0,,
1020,20dad51612550c873ead34b63f8f8f34146c900a,iming Zhao <chemzqm@gmail.com>, 2020-05-22 13:58:37 +0800, , fix installbuffer add redraw vim8,,
1021,0a8d23392445186aef83ed7ede54eb24b1da2768,iming Zhao <chemzqm@gmail.com>, 2020-05-22 13:32:46 +0800, , fix util use promise.finally,,
1022,05f8f7bd71d256733baa9581ce2c4dbf02d366d9,iming Zhao <chemzqm@gmail.com>, 2020-05-21 20:40:31 +0800, , fix diagnostic make work echomessage,,
1023,04f94eba658058f93bf192a1bcf72b7d7ca95f04,iming Zhao <chemzqm@gmail.com>, 2020-05-21 20:27:57 +0800,1949, fix util fix float buffer issue old vim close 1949,,
1024,915af62ce70cef1dffe04dc63a44763d9706fec7,iming Zhao <chemzqm@gmail.com>, 2020-05-21 19:50:52 +0800, , feat floatbuffer use horizon line instead dash,,
1025,1272d820742c9b1a7d3fc983e6f9f0463c9cd1e8,athieu Le Tiec <mathieu.letiec+git@gmail.com>, 2020-05-21 13:22:53 +0200, , doc configuration fix obsolete default value 1971 documentation indicates default value true whereas code schema indicates false modifies value documentation order reflect code,,
1026,881f98ce99b5737b641690752feb11247e59da47,iming Zhao <chemzqm@gmail.com>, 2020-05-21 17:35:09 +0800, , fix floatbuffer try fix highlight bold text,,
1027,0c2ff5e505b9e72a97843eb5bb5d0a8fcecfb156,iming Zhao <chemzqm@gmail.com>, 2020-05-21 16:58:15 +0800, , fix floatbuffer fix bold highlight markdown,,
1028,d79251577df0bfb485ceb3f816f2eb2e8d58b9ad,iming Zhao <chemzqm@gmail.com>, 2020-05-21 16:17:53 +0800, , feat plugin add plug coc codeaction line,,
1029,52dd23aef119a9f7f74b3c2f26ae0d1fff50210a,enny Huynh <hkennyv@gmail.com>, 2020-05-21 01:47:15 -0700, , doc fix comment error example vim config 1970,,
1030,de7045710aa64c342e26dda8f71d697d6c9e2542,iming Zhao <chemzqm@gmail.com>, 2020-05-21 15:27:07 +0800, , feat plugin add fixall organizeimport cocaction breaking change plug coc codeaction use entire bufer range current line,,
1031,fa0d2675f2c6e05f11fa783abfe3be2fba3a7505,iming Zhao <chemzqm@gmail.com>, 2020-05-21 15:21:44 +0800,1962, feat extension split auto update close 1962,,
1032,547c44f4bc110e695bc222442d336768258020a8,iming Zhao <chemzqm@gmail.com>, 2020-05-21 15:20:46 +0800, , chore event show transport disconnected error,,
1033,366cf29c6b3bae52d67bb7348258ff418d24c42e,iming Zhao <chemzqm@gmail.com>, 2020-05-21 14:32:16 +0800, , fix fix filter codeactionkind,,
1034,84a4f234c81780f2ba48400c4c48b189f339a7f0,iming Zhao <chemzqm@gmail.com>, 2020-05-21 14:20:15 +0800, , feat workspace silent applyedits change current buffer,,
1035,d5fdd2438119f2a82f6bda681642f246af2f0361,dam Stankiewicz <sheerun@sher.pl>, 2020-05-21 05:51:35 +0200, , use set signcolumn number available 1964,,
1036,42353685a1117b234d54ba549c83051897a8cdda,iming Zhao <chemzqm@gmail.com>, 2020-05-20 21:14:23 +0800, , feat diagnostic support,,
1037,21dc875149362b331d811bc4b00167bc1c5bdd88,iming Zhao <chemzqm@gmail.com>, 2020-05-20 20:40:03 +0800,1961, feat handler support toggle codelens close 1961,,
1038,5ebea841e505b45222109169fa07ed844846ca40,iming Zhao <chemzqm@gmail.com>, 2020-05-20 12:35:58 +0800, , perf extension rework loadextension initialize,,
1039,28dac2cfee8d13675db2fede6c79bbdd978f0465,iming Zhao <chemzqm@gmail.com>, 2020-05-20 12:35:58 +0800, , perf extension rework loadextension initialize,,
1040,115152eea23e7fc93fe742b2dc58462c924baece,eyward Fann <fannheyward@gmail.com>, 2020-05-20 09:57:00 +0800, , fix extension disable check coc.nvim otherwise throw error required coc vscode found engine home .config nvim plugged coc.nvim,,
1041,4dbbd6da339a7e44367a563015c9faab4874061d,iming Zhao <chemzqm@gmail.com>, 2020-05-20 09:16:16 +0800, , test completion avoid test fail,,
1042,060d3fca9d264f92e208df0704c4c2ab396681ef,ing Tao <i@dingtao.org>, 2020-05-19 20:59:10 +0800, , doc fix simple typo file coc.cnx 1953 replace signed ding tao dingtao.org,,
1043,23d26d8e02299af35d77f945299f485285d21d46,iming Zhao <chemzqm@gmail.com>, 2020-05-19 20:48:20 +0800, , fix cursor avoid check could version change without content change,,
1044,c100fa6f88e4114fc8f97003cc88fc4bfe6233fb,iming Zhao <chemzqm@gmail.com>, 2020-05-19 20:47:34 +0800,1897, fix document fix range change event close 1897,,
1045,38be308ba948c7b6e13cca1346c5b6c88198f2b7,iming Zhao <chemzqm@gmail.com>, 2020-05-19 18:12:09 +0800,1950, fix document rework buffer event handing close 1950,,
1046,69b104e464adad91ebe9f830be9114d332a98e5b,iming Zhao <chemzqm@gmail.com>, 2020-05-19 17:14:13 +0800, , chore extension better error message,,
1047,a5404ef5cddb9bcb4ef902493b5e54ff23746e52,eyward Fann <fannheyward@gmail.com>, 2020-05-19 09:30:11 +0800, , test jest http_proxy test,,
1048,99f832cb0a4b22b31410d70a2a8bfc3a080b81b7,ä¸å· <dyzplus@gmail.com>, 2020-05-19 09:21:07 +0800, , fix extension fix load extension uri null 1948,,
1049,ada48266335c7a46284ab20905e756412fa5a3cb,iming Zhao <chemzqm@gmail.com>, 2020-05-18 22:03:54 +0800, , fix language fix undefined,,
1050,d7b30843755d6040f46d9d7d2fbc8f49fc366e1c,iming Zhao <chemzqm@gmail.com>, 2020-05-18 21:38:28 +0800, , fix extension fix uri package.json uri could .git master end early version coc.nvim,,
1051,040b17e39c53e8e3de9c2c2d837b688af270751a,iming Zhao <chemzqm@gmail.com>, 2020-05-18 21:21:18 +0800, , chore language fix lint fail,,
1052,d12ae8e0315e247016b9bba9fdb4d7f1e666b8d9,iming Zhao <chemzqm@gmail.com>, 2020-05-18 21:08:25 +0800,1944, feat language client add clientinfo close 1944,,
1053,9389cc5e30fc55f5fea5e7bb1bb79e71c6c03338,iming Zhao <chemzqm@gmail.com>, 2020-05-18 21:05:50 +0800,1899, fix document fix applyedits trigger change event change signature close 1899,,
1054,e374cfb7bb585f7334e4e9b444a451ce458297b9,iming Zhao <chemzqm@gmail.com>, 2020-05-18 19:09:57 +0800, , chore document remove paused attribute pause document change completion,,
1055,99f395914c6ea69079929bd3c2c747d5dde532bf,iming Zhao <chemzqm@gmail.com>, 2020-05-18 19:06:21 +0800,1941, fix extension avoid unnecessary error message close 1941,,
1056,3a8d2caab52fbb54797eef921d0ba08f240105da,iming Zhao <chemzqm@gmail.com>, 2020-05-18 18:58:19 +0800, , fix completion close float window completedone,,
1057,95130d001c0215914428c803219fe55b81a34eec,iming Zhao <chemzqm@gmail.com>, 2020-05-18 18:50:46 +0800, , fix completion close float window pumvisible,,
1058,88e68701529d5bd4432f394d930f426afb7a10f1,iming Zhao <chemzqm@gmail.com>, 2020-05-18 17:22:05 +0800,1941, fix extension silent load extension rtp close 1941,,
1059,538fd3fd48bead1c91268d81a2ebb0716e7298ae,iming Zhao <chemzqm@gmail.com>, 2020-05-18 16:49:03 +0800, , feat event handle cursormoved position,,
1060,b1f55f6ac5e2de4269afb699a54fa2b52f22f519,iming Zhao <chemzqm@gmail.com>, 2020-05-18 16:42:59 +0800, , fix util fix concurrent function add test,,
1061,337b46becb38ce257d77a73c2c76bad94052807b,iming Zhao <chemzqm@gmail.com>, 2020-05-18 16:42:37 +0800, , style eslint avoid arrow body style check,,
1062,9704f8d076426177dcbd92067dc76bafa266f852,iming Zhao <chemzqm@gmail.com>, 2020-05-16 21:23:46 +0800,1926, feat workspace load folder configuration startup close 1926,,
1063,8d107ddea4119e4d3c504be650983dc0470403d0,iming Zhao <chemzqm@gmail.com>, 2020-05-16 20:37:15 +0800,1923, fix handler trigger signature help command line close 1923,,
1064,14623e1ca36254fc9271c3bf20a60fe92aa2f0bd,iming Zhao <chemzqm@gmail.com>, 2020-05-16 20:28:02 +0800, , refactor extension rework extension breaking change fetch module download module,,
1065,1b58bd82e62a032779a12f8b1e2772eb35893182,iming Zhao <chemzqm@gmail.com>, 2020-05-16 16:09:42 +0800, , chore attach add log slow notification,,
1066,75fce47f2dc179537852caa76cbbbb5f5057a455,iming Zhao <chemzqm@gmail.com>, 2020-05-16 15:57:04 +0800, , chore plugin use system open cocopenlog use current vim would cause unnecessary message appended,,
1067,44f8790d2a88fe5a38e7993ba0c10e35cd2c6a6a,iming Zhao <chemzqm@gmail.com>, 2020-05-16 15:27:53 +0800, , refactor plugin improve request notification handling method must strict match log detail error request notification log error request take throw error,,
