id,sha,author,date,issue,message,file,content
0,5aa3197360a76200e8beb30c9957fac1205b7ad5,ehuohan <yehuohan@qq.com>, 2021-07-28 01:53:39 +0800, , fix disable fold preview,,
1,54e9b983d3c871c46d6bfaae4f7df126ae123fee,iming Zhao <chemzqm@gmail.com>, 2021-07-28 03:37:37 +0800, , chore handler test rename selectionrange,,
2,4e5af5e8b46a3795562e1c9d244200d98fbe0008,iming Zhao <chemzqm@gmail.com>, 2021-07-27 23:02:55 +0800, , chore package upgrade marked,,
3,1407e5962992e007a9feddc26cc0bd8b74377ed0,iming Zhao <chemzqm@gmail.com>, 2021-07-27 21:57:59 +0800, , refactor codelens rework codelens handler,,
4,c805bf0a63c67936cf9475cb47cd078280959071,iming Zhao <chemzqm@gmail.com>, 2021-07-27 12:17:54 +0800, , test outline add test outline,,
5,5369ee98776765053db964cfc65a77889516e028,iming Zhao <chemzqm@gmail.com>, 2021-07-27 09:58:46 +0800, , refactor src use buf.placesign buf.unplacesign,,
6,df903ebfcaec4bb6e6af209d3bbc656fc36cf85e,iming Zhao <chemzqm@gmail.com>, 2021-07-27 09:29:15 +0800, , chore yarn upgrade dependency,,
7,1cf7e9970b644a98039ff645477d94c71afc9e30,iming Zhao <chemzqm@gmail.com>, 2021-07-27 08:59:33 +0800, , chore typing add new apis node client,,
8,fa4a72a16b3b99735e21b68b3844700e533b00f0,iming Zhao <chemzqm@gmail.com>, 2021-07-27 08:59:22 +0800, , chore package upgrade chemzqm neovim,,
9,c210802553d151b4f654cf3c950c6d10a5da676e,iming Zhao <chemzqm@gmail.com>, 2021-07-27 07:32:27 +0800, , chore package upgrade chemzqm neovim,,
10,d59efb6e28f91bb26ba0ded88abd153aad00aafc,iming Zhao <chemzqm@gmail.com>, 2021-07-27 06:03:06 +0800, , test window fix failed test,,
11,865823cf99b1f19870ffa072bf3847be8c1e6b10,iming Zhao <chemzqm@gmail.com>, 2021-07-27 05:48:33 +0800, , fix treeview force rerender filter exit,,
12,349543db02caf7a192e7e6904837025aed3e5825,iming Zhao <chemzqm@gmail.com>, 2021-07-27 05:15:14 +0800, , feat tree highlight deprecated item,,
13,09c5a6cb8f617f97ce73e918a3eb5c0bd27d576e,iming Zhao <chemzqm@gmail.com>, 2021-07-27 05:14:53 +0800, , fix highlight remove unnecessary highlight nvim,,
14,ea7785be31c5f9e5fa9402274b6aaafcdbc2a610,iming Zhao <chemzqm@gmail.com>, 2021-07-27 05:12:16 +0800, , refactor treeview refetch treeitem provider remove unnecessary child,,
15,8aa388a3c3732fd665b2b1493fb5bbfa2ac9fc86,iming Zhao <chemzqm@gmail.com>, 2021-07-27 05:10:11 +0800, , fix treeview clear selection empty result,,
16,0ee4a0076d726cea2080131eda76121e6511279a,iming Zhao <chemzqm@gmail.com>, 2021-07-26 22:20:05 +0800, , test treeview test filter feature,,
17,4365f2fc055b628d0a74dc07c7ff165e86e95e67,iming Zhao <chemzqm@gmail.com>, 2021-07-26 21:55:28 +0800, , feat treeview reveal element command invoke,,
18,5e61b3f25c86fc94d89e8eaa032e8419373a23e9,iming Zhao <chemzqm@gmail.com>, 2021-07-26 20:06:09 +0800, , feat outline use botright 30vs split command,,
19,44b04be66c71e2c846834badd446ddc720a1cbd2,iming Zhao <chemzqm@gmail.com>, 2021-07-26 17:26:09 +0800, , chore doc add doc coc tree,,
20,3c02481d9689d4c94206dc437df5a393316beebb,iming Zhao <chemzqm@gmail.com>, 2021-07-26 16:43:42 +0800, , feat treeview support filter history,,
21,bb8bee9a731f7d2a0d68388ed6d948eb9c1da97c,iming Zhao <chemzqm@gmail.com>, 2021-07-26 08:54:08 +0800, , feat treeview add remove cursor highlight,,
22,4fd0d3f0780e995960ec27e868ee2a915de36bf6,iming Zhao <chemzqm@gmail.com>, 2021-07-26 08:36:13 +0800, , feat treeview show node empty filter,,
23,fe599916ec0c29238662b0c21e39e6c800f68b20,iming Zhao <chemzqm@gmail.com>, 2021-07-26 07:59:31 +0800, , fix floatfactory close window dispose,,
24,b955973ac56264fae6d392148a301a753f569b63,iming Zhao <chemzqm@gmail.com>, 2021-07-26 04:43:10 +0800, , fix tree fix sign possible referred,,
25,01525e90b2d517c070045fce9ae163850329c5b2,iming Zhao <chemzqm@gmail.com>, 2021-07-26 04:27:25 +0800, , fix outline reload empty symbol response,,
26,9693e8be13da0fd2d5d03b1a15a5aa2e0a41d96e,iming Zhao <chemzqm@gmail.com>, 2021-07-26 03:14:30 +0800, , feat outline support keep argument,,
27,14200b251f75c9209a759c61deb70864429242f1,iming Zhao <chemzqm@gmail.com>, 2021-07-26 02:16:55 +0800, , refactor autoload use coc window close coc window find,,
28,be38d3bd5a3ffca5f6471e3c6e3cb0d9e7c08d59,iming Zhao <chemzqm@gmail.com>, 2021-07-26 01:17:39 +0800, , refactor autoload check win_execute nvim,,
29,6d2e0404130a664d44156cbf325dfd1372ecb231,iming Zhao <chemzqm@gmail.com>, 2021-07-25 23:04:47 +0800, , fix outline keep window auto switch,,
30,37c52e43fa3048e2696f9a07e7955a1befe0358e,iming Zhao <chemzqm@gmail.com>, 2021-07-25 22:51:49 +0800, , feat treeview support filter,,
31,80287a44cc267be64180d32b514e2e48d7993e02,iming Zhao <chemzqm@gmail.com>, 2021-07-25 01:05:30 +0800, , chore doc doc outline,,
32,b30717f3d63998890a6780ec557021942ca45081,iming Zhao <chemzqm@gmail.com>, 2021-07-25 00:15:15 +0800, , feat outline support config,,
33,7ce6c8a1d98f7073ac0c969f0ed6c6d9b035f26a,iming Zhao <chemzqm@gmail.com>, 2021-07-24 23:36:35 +0800, , fix tree fix sign synchronized,,
34,219bbac71fc78ebc800328486727af2495f371b7,iming Zhao <chemzqm@gmail.com>, 2021-07-24 22:31:47 +0800, , fix tree check change head line use updateheadlines render head line use errwriteline error message,,
35,f8b70f46c239cb84e686623d7e62d87e52495e73,iming Zhao <chemzqm@gmail.com>, 2021-07-24 22:28:56 +0800, , fix api fix out_write err_write vim8 upgrade chemzqm neovim module,,
36,d5428ddda6ddf0fceafb948f4f0466bb5fdb5bc9,iming Zhao <chemzqm@gmail.com>, 2021-07-24 18:28:15 +0800, , chore window require basictreeview class,,
37,3ebf78ecf074e58657c83a2bee3646b2f5b1946c,iming Zhao <chemzqm@gmail.com>, 2021-07-24 18:24:13 +0800, , chore language avoid wait command finish,,
38,f8cd4ad7cd316508cf5f1d3f3666540f2fe1d780,iming Zhao <chemzqm@gmail.com>, 2021-07-24 03:58:04 +0800, , feat symbol add outline support,,
39,c0a628f8bcf7abafafb565f7234baa34ffb4475d,iming Zhao <chemzqm@gmail.com>, 2021-07-24 02:11:18 +0800, , feat window add,,
40,22522bf8b66281458883886abc09322a83ee20ec,iming Zhao <chemzqm@gmail.com>, 2021-07-24 01:32:07 +0800, , feat tree export class typing,,
41,e701c782f2a54e76cf66f569e8713bc3c85e11d4,iming Zhao <chemzqm@gmail.com>, 2021-07-24 01:31:03 +0800, , feat tree support resourceuri treeitem,,
42,378435311a6642c465e5dcc442b6bd90363f2f14,iming Zhao <chemzqm@gmail.com>, 2021-07-24 00:26:47 +0800, , refactor tree improve tree view use coctreeselected highlight group add doc highlight group enable select unselect single select mode,,
43,252b05b86e16caddbd73668943c92a6fc574bb53,iming Zhao <chemzqm@gmail.com>, 2021-07-23 23:24:07 +0800, , refactor highlight use defined highlight group instead user configuration,,
44,4a4a96d65bde50902624c070ac3e773fb0b5bc62,iming Zhao <chemzqm@gmail.com>, 2021-07-23 23:22:46 +0800, , refactor tree use generic type,,
45,d63ef000821b5897bc8db58320c2d49b46c51cbb,iming Zhao <chemzqm@gmail.com>, 2021-07-22 23:53:07 +0800, , refactor symbol split handler symbols.ts,,
46,c610d009641f2425317e8bb9dfd15f4f17344de6,iming Zhao <chemzqm@gmail.com>, 2021-07-22 23:49:04 +0800, , chore typing add definitionlink result provider,,
47,4c0d33b6e9fba52debcdfc79856165f20c6f7b80,iming Zhao <chemzqm@gmail.com>, 2021-07-09 13:58:37 +0800, , feat tree add treeview support,,
48,6383c62f39245e1e937c9c8919a1df0455dbcdf2,iming Zhao <chemzqm@gmail.com>, 2021-07-27 07:37:46 +0800, , chore plugin improve highlight,,
49,9fd90ad7615dbca865fd41dd78f9bcb2d6039c87,iming Zhao <chemzqm@gmail.com>, 2021-07-27 07:11:46 +0800, , fix diagnostic fix diagnostics referred vim,,
50,083f28e3d83cbf19d14fda3cf46c8308668facde,iming Zhao <chemzqm@gmail.com>, 2021-07-27 06:02:00 +0800, , chore workspace log bad workspaceedit,,
51,c49acf35d8c32c16e1f14ab056a15308e0751688,eyward Fann <fannheyward@users.noreply.github.com>, 2021-07-23 21:21:06 +0800, , feat typing make markdown optional 3232,,
52,73861dc2aefa8bf7c9e6daaf0c2f313abb41372d,iming Zhao <chemzqm@gmail.com>, 2021-07-22 18:07:41 +0800,3230, fix attach exclude action need plugin ready close 3230,,
53,3de26740c2d893191564dac4785002e3ebe01c3a,oah <noah.bogart@hey.com>, 2021-07-21 10:03:46 -0700, , allow whitespace trigger character 3227 allow whitespace trigger character update reducer update src provider,,
54,67396fb5a2d94d59bcc9c8f4ee9b2158ef95fe16,aidou <weirongxu.raidou@gmail.com>, 2021-07-20 22:19:40 +0800, , fix api vim call_atomic exception list 3225 fix api vim call_atomic exception list fix update exception type,,
55,2351fedfcc09a557c47f78058dcc648058ccf633,iming Zhao <chemzqm@gmail.com>, 2021-07-20 17:40:43 +0800,3206, fix completion avoid trigger character manual invoke revert a56c2e8 related 3206,,
56,cf9ef211e65295571271a5318673be8d108a5be6,iming Zhao <chemzqm@gmail.com>, 2021-07-20 17:14:46 +0800, , fix key mapping use cocaction instead coc rpc request rowork doc add missing key mapping,,
57,0381db7d45f0f17607aab843cba5cc6bc0ca925a,eyward Fann <fannheyward@users.noreply.github.com>, 2021-07-20 12:30:25 +0800, , fix handler missing logger 3222,,
58,be2df5ae5e3961686e533b2c07fe231a286f57ca,eyward Fann <fannheyward@users.noreply.github.com>, 2021-07-20 12:26:13 +0800, , fix handler lint 3224,,
59,6c68078e31c75237caa94d8f8fa8bff5188620b1,damansky Anton <adamansky@gmail.com>, 2021-07-20 11:06:06 +0700,3223, fix coc.nvim error rangeselect 3223 fix coc.nvim error rangeselect read property selectrange undefined 3223 used imported selectionrange,,
60,19ead882b9c02b42c5e00b14fa96a924b37d95f7,iming Zhao <chemzqm@gmail.com>, 2021-07-16 18:59:53 +0800, , fix extension fix invalid extension export,,
61,a87d1bf4c67ddcf07e738a96a9fd6facd1c350b5,iming Zhao <chemzqm@gmail.com>, 2021-07-15 23:41:21 +0800,3218, fix diagnostic sort diagnostics hlgroup close 3218,,
62,c02be2e34489b39aa2c3de25c3e08993f84526bd,iming Zhao <chemzqm@gmail.com>, 2021-07-15 20:22:55 +0800, , fix extension isactive true activate,,
63,76f407d45640aeadc97a555eac0939217d0dd662,iming Zhao <chemzqm@gmail.com>, 2021-07-15 19:48:27 +0800,3217, refactor plugin disable semantic highlight default close 3217,,
64,a56c2e80ea5b5fd839b7682d597596540540a209,iming Zhao <chemzqm@gmail.com>, 2021-07-13 21:16:19 +0800,3207, fix completion use manual invoke close 3207,,
65,fb123ed9892873e32ea5eaeb480e88821c98dadf,ulian Grinblat <julian@dotcore.co.il>, 2021-07-13 21:26:12 +0900, , fix command complete nargs 3211 fix command complete nargs fix final fix,,
66,aa2423206694abf99e5578fcfc3696170739b8e6,iming Zhao <chemzqm@gmail.com>, 2021-07-09 19:32:40 +0800, , refactor semantictokens rework semantictokens add command check clear semantictokens avoid request buffer visible remove check extension change use event language changed apis,,
67,28e3316ca806384981c13ed45a43f05a636423a6,iming Zhao <chemzqm@gmail.com>, 2021-07-09 16:47:54 +0800, , refactor smentictokens avoid frequently highlight refresh,,
68,2d813b6233f7cb313e5c9d54ae2834348d982366,iming Zhao <chemzqm@gmail.com>, 2021-07-09 16:13:51 +0800, , fix highlight fix list range,,
69,246ae1d2968b0c09c087dd39ff0d091c952053d9,iming Zhao <chemzqm@gmail.com>, 2021-07-09 16:11:40 +0800, , fix float avoid change terminal buffer start vim8.2.3081 change terminal buffer throw error,,
70,0ad03ca857ae9ea30e51d7d8317096e1d378aa41,iming Zhao <chemzqm@gmail.com>, 2021-07-09 15:38:18 +0800,3201, fix highlight fix list range error close 3201,,
71,7f90c8c7bf1191f84b10b7cf31eec23544203263,iming Zhao <chemzqm@gmail.com>, 2021-07-09 15:17:19 +0800, , fix semantictokens fix undefined var,,
72,43a26a18484c94e8e6f0568a95816f7623f1da57,iming Zhao <chemzqm@gmail.com>, 2021-07-09 15:02:45 +0800,3202, fix semantictokens check close 3202,,
73,16a70873f1ae0952431011f969e20d1056eda860,iming Zhao <chemzqm@gmail.com>, 2021-07-09 14:32:54 +0800, , chore highligher use highlightitem type,,
74,78c47320579fb6b77086571f71918e61fec32963,am McCall <sam.mccall@gmail.com>, 2021-07-09 08:53:42 +0200, , feat semantictokens provide basic default color 3186 feat semantictokens provide basic default color map standard cocsem_ highlight group semantically closest standard vim group e.g cocsem_enum type mean user coc.nvim colorscheme enabled get basic highlighting semantictokens enough distinguish everything least e.g type variable today get nothing default cocsem_ group undefined possible downside afaics coc.nvim apply highlight group exist defining group mean pay performance cost applying style even benefit small specifically defined lsp http language server protocol specification specification though language server support others add global var opt cocsem_ default doc cocsem_ group,,
75,37132cfc36ed6e9561b46547e75f418e57af3566,iming Zhao <chemzqm@gmail.com>, 2021-07-08 14:45:33 +0800, , feat client use env option jobstart nvim 0.5.0,,
76,4adbd3cae5dd58360dd7cfcb5d77b2fbbd4ec85c,iming Zhao <chemzqm@gmail.com>, 2021-07-08 14:44:45 +0800, , chore doc doc,,
77,05fb7ab948a890956dec2d836c7f5ce383d050ca,iming Zhao <chemzqm@gmail.com>, 2021-07-08 13:17:47 +0800, , chore client remove unused coc_no_warnings env,,
78,a4a7d536f0e345c95b3dca3dbf2cbb7bb6e8bf77,eyward Fann <fannheyward@users.noreply.github.com>, 2021-07-08 13:24:02 +0800, , feat handler use highlightitem 3197 feat handler use highlightitem fix test hlgroup,,
79,f05f0f1f08c4bf9a5b06af9496ce53903f8f082a,eyward Fann <fannheyward@users.noreply.github.com>, 2021-07-08 13:23:20 +0800, , fix provider check 3199,,
80,7089ffb068ecb1059d15b3766b24280b74dac970,iming Zhao <chemzqm@gmail.com>, 2021-07-07 21:33:07 +0800, , refactor semantictokens remove unnecessary lengend provider,,
81,c92cc7055836d31832d3cc055a54ab3082af1b72,iming Zhao <chemzqm@gmail.com>, 2021-07-07 21:25:45 +0800, , feat semantictokens hanlde semantictokens refresh request workspace semantictokens refresh request server,,
82,dad735ace48c2a033d7572e2d17cee0b495cb12e,iming Zhao <chemzqm@gmail.com>, 2021-07-07 20:43:53 +0800, , fix use resolved provider document resolve provider getlegend,,
83,c6cbcbb92c846a6fb6a70136751bc42e375f7856,iming Zhao <chemzqm@gmail.com>, 2021-07-07 18:59:48 +0800, , refactor highlight improve highlight method add add coc highlight get function make coc highlight support range line improve iteration performance update highlight,,
84,50b1f98a2c10b6da6e32ffa4398ca7d065e838ee,iming Zhao <chemzqm@gmail.com>, 2021-07-07 17:14:02 +0800, , chore api use getbufinfo linecount,,
85,f43bee3e4b6b705eab32417acdf39d857b2dce8e,iming Zhao <chemzqm@gmail.com>, 2021-07-07 16:02:55 +0800, , refactor plugin avoid wait extension activated initialize extension may take time get started would make coc.nvim unable response remove unnecessary variable,,
86,720a5a761e9ba27af5492b563f3e64ac636e0d42,iming Zhao <chemzqm@gmail.com>, 2021-07-07 15:26:39 +0800, , chore doc fix link readme,,
87,31084ee6c4465a8f5e0fb57c7bff33df22750255,iming Zhao <chemzqm@gmail.com>, 2021-07-06 22:49:44 +0800, , perf highlight check exists highlight possible avoid unnecessary vim blink clear highlight exists  add coc highlight highlight update add configuration,,
88,21f64bf9826328d8250cb7185d2a7c3cd70ce38b,iming Zhao <chemzqm@gmail.com>, 2021-07-06 21:43:53 +0800, , doc doc doc,,
89,1a7262c25a03f1b46e2f0a3af14e29819609da90,iming Zhao <chemzqm@gmail.com>, 2021-07-06 16:43:55 +0800, , fix test fix vim command test,,
90,7b57d478fd7cf55a5086bac2f089d56a8053f4d4,eyward Fann <fannheyward@users.noreply.github.com>, 2021-07-06 16:41:58 +0800, , fix handler make 3195,,
91,d5eb44e9bbca7a5541738202c130df9b7b64f3a0,iming Zhao <chemzqm@gmail.com>, 2021-07-06 15:42:40 +0800,3194, fix format avoid unexpected cancel format invoke format cursormovedi instead close 3194,,
92,3f8aa0805a41047d607b9671689001da2192ed7b,iming Zhao <chemzqm@gmail.com>, 2021-07-06 15:29:29 +0800, , fix handler fix rename undefined,,
93,c0cc51d8118e19a07446f62cbda6f8c5e35283f2,ehuohan <yehuohan@qq.com>, 2021-07-06 14:18:08 +0800, , fix source file add window driver path support 3189,,
94,70b445b4414b8f7d7ab9ab01ce945199d39d8c2d,iming Zhao <chemzqm@gmail.com>, 2021-07-05 23:06:37 +0800, , chore handler add test,,
95,e25d8fe77af973458bb30c916580cf8f2669773a,iming Zhao <chemzqm@gmail.com>, 2021-07-05 18:52:46 +0800, , chore diagnostic avoid unnecessary refresh,,
96,d62ad5b168b342ce0d88ff90e1e859679d83156a,iming Zhao <chemzqm@gmail.com>, 2021-07-05 18:44:43 +0800, , refactor handler split handler different module,,
97,0607abed222f294b05d394ce66bae99093e4a98e,iming Zhao <chemzqm@gmail.com>, 2021-07-05 18:42:37 +0800, , chore tsconfig set noemit true,,
98,adefcb3899a42196060e7904191a3135dc6b2e3c,iming Zhao <chemzqm@gmail.com>, 2021-07-05 18:25:41 +0800, , chore typing add missing method language,,
99,3cd702c511cf2eed0d547c0dbb5a7930858e6066,iming Zhao <chemzqm@gmail.com>, 2021-07-05 17:42:26 +0800, , feat highligher add method addtexts,,
100,60ddea049b590d62129e356e76c94fb9e4411576,iming Zhao <chemzqm@gmail.com>, 2021-07-05 16:45:57 +0800, , fix diagnostic avoid check equality diagnostics highlight possible get cleared document change get diagnostics received,,
101,894616ae8ba7fb8355add52e4d383107a355ff13,iming Zhao <chemzqm@gmail.com>, 2021-07-03 18:39:48 +0800, , doc doc doc,,
102,48173903435ce932d741609dcffc1cbc77b843cf,iming Zhao <chemzqm@gmail.com>, 2021-07-03 18:29:23 +0800, , chore package upgrade typescript,,
103,7c619682f998a09984d3e9fe13c1d4948660619a,eyward Fann <fannheyward@users.noreply.github.com>, 2021-07-05 18:01:41 +0800, , feat typing typing 3187 feat typing typing     requesttype fix add back fix review,,
104,705135211e84725766e434f59e63ae3592c609d9,iming Zhao <chemzqm@gmail.com>, 2021-07-03 18:20:23 +0800, , refactor type simplify type export avoid unnecessary export type index,,
105,1866fc9a4c3ee915b5bc721949992a692616125a,mytro Meleshko <dmytro.meleshko@gmail.com>, 2021-07-02 18:50:05 +0300, , fix diagnostic highlight hint deprecated unused text unique hlgroups 3188,,
106,0aa97ad1bbdcc2bb95cf7aabd7818643db1e269d,iming Zhao <chemzqm@gmail.com>, 2021-07-02 20:35:25 +0800, , refactor handler use location handler,,
107,0a602757cfb4cfd427edbd9e376fe3b9097ad5f7,iming Zhao <chemzqm@gmail.com>, 2021-07-02 16:54:13 +0800, , refactor handler use hover handler add test hover action,,
108,4e5a59ba2eff06837fcb95d7f9df14e10dd22653,iming Zhao <chemzqm@gmail.com>, 2021-07-01 20:40:48 +0800, , refactor handler use hover handler,,
109,6e7b73533f2ebf9b4153162cdba5125d782107d2,iming Zhao <chemzqm@gmail.com>, 2021-07-01 20:07:21 +0800, , refactor highlight avoid unnecessary try catch,,
110,66c6f9d11dd1242495bfab61d6f3ddb36b109849,iming Zhao <chemzqm@gmail.com>, 2021-07-01 19:53:47 +0800,210, fix document check latest insert change fix http github.com neoclide coc snippet issue 210,,
111,3874573dfb69ecc4fb4b92549d60adeb36819946,iming Zhao <chemzqm@gmail.com>, 2021-06-30 21:18:15 +0800, , chore handler add test search highlight,,
112,8d14a34a3009c0dd6c0b6b2ebd7380181276e963,iming Zhao <chemzqm@gmail.com>, 2021-06-30 20:53:42 +0800, , chore test improve signature test cover case,,
113,f2b0f5d237d7b731e99505422e7475c93c39c63f,iming Zhao <chemzqm@gmail.com>, 2021-06-30 20:39:29 +0800, , refactor handler improve handler avoid unnecessary event test,,
114,2ab39512ede9e5caffd7593dfa83642057afb6a6,iming Zhao <chemzqm@gmail.com>, 2021-06-30 19:59:39 +0800, , fix float disable fold float window,,
115,52140a79bf441b86e85e06406bd8fc24ad5010fe,iming Zhao <chemzqm@gmail.com>, 2021-06-30 18:59:01 +0800, , refactor codeactions improve test codeactions,,
116,2a53fce82d2ba28bf1e811b2720c4cac621c1c50,iming Zhao <chemzqm@gmail.com>, 2021-06-30 18:12:54 +0800, , fix signature use start position help fix signaturehelp work cursor trigger character also correct offset float window,,
117,6bc3ee0da40e4989c8a40dea47d4c1164762b110,eyward Fann <fannheyward@users.noreply.github.com>, 2021-06-30 18:16:55 +0800, , test handler add semantictokens test 3182,,
118,77ecd7f33b3d3f8ce312e145c569da9cf76c856c,eyward Fann <fannheyward@users.noreply.github.com>, 2021-06-30 17:01:41 +0800, , fix language client missed log 3183,,
119,d88f985a07283f4958280af9e83b8ba6ae57b2a8,iming Zhao <chemzqm@gmail.com>, 2021-06-29 19:54:39 +0800, , refactor handler move color related color module,,
120,c50a0308bb0fc0d76ac5d969691463125f167505,iming Zhao <chemzqm@gmail.com>, 2021-06-29 19:35:59 +0800, , chore codeactions add test,,
121,ace2582ff786077d28902d325f1e0e1133dcba69,iming Zhao <chemzqm@gmail.com>, 2021-06-29 19:21:55 +0800, , chore signature add test,,
122,131f6b267f2c458f9413b3568338482cad451635,iming Zhao <chemzqm@gmail.com>, 2021-06-29 18:13:42 +0800, , fix completion use hide completion avoid blocking neovim,,
123,86da3ff17dfc0e3e887e8e606d7e3150ba8a2596,iming Zhao <chemzqm@gmail.com>, 2021-06-29 17:01:38 +0800, , refactor completion check completeopt completion activated avoid unnecessary error message like coc.nvim completion disabled current buffer,,
124,03101eeec951bce4d7bea89709fb68bd373a7b03,iming Zhao <chemzqm@gmail.com>, 2021-06-29 16:54:49 +0800, , fix completion check changed could changed selected item bounding changed ignore event would cause bad position doc popup cancel resolve case,,
125,c79a11c354858da53a150a52c33ce9669f1bd0e2,iming Zhao <chemzqm@gmail.com>, 2021-06-29 15:39:23 +0800, , perf language avoid eval filetype vim,,
126,be56a565581dbe37db99f31aea2b6ce19498a598,iming Zhao <chemzqm@gmail.com>, 2021-06-29 14:57:29 +0800, , perf completion avoid unnecessary event avoid use cancel completion cause additional textchangedi cursormoved event,,
127,bffdac0347b035bd49b442868d7bc1a2989ac014,iming Zhao <chemzqm@gmail.com>, 2021-06-29 14:29:21 +0800, , fix completion clear debounce completedone,,
128,674b1e91f5e3ccac7e96b41b70b32853bd5a1316,iming Zhao <chemzqm@gmail.com>, 2021-06-28 21:37:54 +0800,3040, fix language avoid unnecessary completion resolve close 3040,,
129,c3c7cc04aa1fce50ff1593d62ed4cdddb18df06c,iming Zhao <chemzqm@gmail.com>, 2021-06-28 21:37:29 +0800, , chore test avoid fail picker test,,
130,40344e8e4d493a6a22313dbce04c656aaf22be65,iming Zhao <chemzqm@gmail.com>, 2021-06-28 19:54:08 +0800, , refactor outputchannel avoid unnecessary message send buffer message buffer outputchannel created,,
131,09cb4df8849b22934d85a83a8a1e41c62b9009e6,iming Zhao <chemzqm@gmail.com>, 2021-06-28 17:19:12 +0800, , refactor attach user logger.trace notification breaking change use trace notification log,,
132,02a697739786240b8ac508da23ee7743538c6442,iming Zhao <chemzqm@gmail.com>, 2021-06-28 16:49:14 +0800,2950, refactor event avoid event handler error vim close 2950 breaking change event handler error shown vim show error event handler log,,
133,6ca3dd6bb172bbfa124aef9456a6064f98e6c600,eyward Fann <fannheyward@users.noreply.github.com>, 2021-06-28 16:26:43 +0800,3175, feat plugin list token type supported 3177 3175,,
134,e1147e87457f0e5337c16fcb56d6ee4f74b9d43b,iming Zhao <chemzqm@gmail.com>, 2021-06-28 15:25:19 +0800,3171, fix float close popup work vim without popup_list close 3171,,
135,d5f9caf881453640564289500a4310d9f765c1ea,iming Zhao <chemzqm@gmail.com>, 2021-06-28 15:23:27 +0800, , feat factory use logger.info console.log extension breaking change console.log inside extension would redirect logger.info help extension author check log easier,,
136,024d6cb207db04ac510e85164b8956b00d5b90b4,iming Zhao <chemzqm@gmail.com>, 2021-06-27 17:56:34 +0800,3171, fix float fix popup closed old vim close 3171,,
137,a29c40ad68cfb2513932cf20e43d11ec65527b80,iming Zhao <chemzqm@gmail.com>, 2021-06-26 13:55:53 +0800, , chore doc doc,,
138,116c249b7ddbe30d681adb6f8eba05c0b84a987f,iming Zhao <chemzqm@gmail.com>, 2021-06-25 21:28:03 +0800, , test picker scroll test picker,,
139,5926dc2ce58d779db88ef7b8d72fcbf3bd040e77,iming Zhao <chemzqm@gmail.com>, 2021-06-25 21:02:57 +0800, , test handler add test symbol,,
140,a567119884bf60803694b3dead06e98f923de6e4,iming Zhao <chemzqm@gmail.com>, 2021-06-25 19:58:41 +0800, , test handler test format,,
141,11320ab36e15ac3eed14857d98ac464f8542fc24,iming Zhao <chemzqm@gmail.com>, 2021-06-25 19:09:19 +0800, , test handler test refactor,,
142,37efe7bd55924f77c230f4ddfe06ab3c2dfc70ad,iming Zhao <chemzqm@gmail.com>, 2021-06-25 19:08:54 +0800, , fix handler fix folder resolve search,,
143,0aa4ec332a1bf5d0cd85cb88671394e5be5a6d81,iming Zhao <chemzqm@gmail.com>, 2021-06-25 17:43:50 +0800, , fix typing add missed interface,,
144,24ded9882629ddda40f9640fa754b0613cdc5cde,iming Zhao <chemzqm@gmail.com>, 2021-06-25 16:45:56 +0800, , feat autoload add coc compat buf_del_var function breaking change variable would removed clear,,
145,3e5e1f92e5ef19998ba193f4f175cea88230d600,iming Zhao <chemzqm@gmail.com>, 2021-06-25 16:44:24 +0800, , doc doc improve configuration doc,,
146,50030e074d4b5fd1ecf2f5195f3b7d67deb1b609,eon Errelin <leon.errelin@outlook.com>, 2021-06-25 15:47:57 +0800, , first attempt refine doc master branch 3045 mod first attempt refine coc.nvim doc fix typo unwanted word fix typo,,
147,56b847bd185b3fecb576d81f6235693380b2f9e5,iming Zhao <chemzqm@gmail.com>, 2021-06-25 15:18:20 +0800,3168, feat diagnostic support configuration add action set false disable refresh diagnostics coc.nvim invoke action refresh diagnostics close 3168,,
148,8f18641de4cc5b176e800c321389502b89935298,iming Zhao <chemzqm@gmail.com>, 2021-06-25 14:57:17 +0800, , feat diagnostic reset null clear breaking change variable would null diagnostics clear,,
149,4e1abcd2cbd148c78747c60011c0d67b25b39a3a,eyward Fann <fannheyward@users.noreply.github.com>, 2021-06-25 12:28:30 +0800, , chore provider rename 3166,,
150,979904848633b20e08aa405a279b627621319c2b,iming Zhao <chemzqm@gmail.com>, 2021-06-24 19:31:31 +0800, , refactor handler attach handler module,,
151,90bfa6a4403b5cbe8fdc5ac88adae58ae9fadee7,iming Zhao <chemzqm@gmail.com>, 2021-06-24 18:59:13 +0800, , fix test refesh buffer check diagnostics,,
152,6620d5459e82905751a128b49f8fa0cb2f7aa83f,iming Zhao <chemzqm@gmail.com>, 2021-06-24 16:17:15 +0800,3157, fix float fix bad scrollbar position close 3157,,
