id,sha,author,date,issue,message,file,content
2901,537600f212462df8de8d62c7c8674696b9579e6d,hemzqm <chemzqm@gmail.com>, 2018-12-11 18:36:04 +0800, , fix test fix possible fail,,
2902,a31a814528cfcfcbc31f55d715066ffb146b59fd,hemzqm <chemzqm@gmail.com>, 2018-12-11 03:10:15 +0800,255, fix workspace fix uri found window fix 255 vscode uri give uri file server would give file,,
2903,053ccafb4e4b4c21435d7816c23c34b260375a58,hemzqm <chemzqm@gmail.com>, 2018-12-10 23:13:47 +0800, , feat completion fixinsertedword replace sub string,,
2904,805934db15c9d0c783f5cb500476cc9a81a97246,hemzqm <chemzqm@gmail.com>, 2018-12-10 22:30:38 +0800,253, fix service default never fix 253,,
2905,64b8a745eae185fe7a98412933d3498aa753df40,hemzqm <chemzqm@gmail.com>, 2018-12-10 20:17:20 +0800, , fix completion fix line used textedit,,
2906,462ce6c4a84de5a6ae610ec53251cdeda0b952aa,¹´ç³å°è±æ±¤ <iamcco@foxmail.com>, 2018-12-10 10:32:14 +0800, , fix typo,,
2907,14c5ce7f5aa52f9ccc24116f30a8ada30e50dcd8,hemzqm <chemzqm@gmail.com>, 2018-12-09 21:20:34 +0800, , chore doc readme,,
2908,e628ed629e670a99b599446b1f062c3ef99550f1,hemzqm <chemzqm@gmail.com>, 2018-12-09 21:13:02 +0800, , fix snippet fix cursor position plain snippet,,
2909,565f2a889823d22399a8c646067d85dcf5b8ed31,hemzqm <chemzqm@gmail.com>, 2018-12-09 18:46:21 +0800, , fix test fix fail,,
2910,5eb041a324916358599a7a2cb81511ec407a6bb8,hemzqm <chemzqm@gmail.com>, 2018-12-09 17:00:51 +0800, , fix snippet confirm completion pumvisible,,
2911,c4111687b788da23a117ca844f7d423753ec7f70,hemzqm <chemzqm@gmail.com>, 2018-12-08 23:20:10 +0800, , feat completion add match score complete item,,
2912,93c5a8d3a439f10916a0e94793637344624e6a84,hemzqm <chemzqm@gmail.com>, 2018-12-08 21:14:34 +0800, , chore configuration fix lint issue,,
2913,4a9ddf7818b7335397694123bf7e3c8520b6157b,hemzqm <chemzqm@gmail.com>, 2018-12-08 21:07:16 +0800, , release v0.0.38,,
2914,ac4f92eb805f2ee97397ae7975bff9f6457be3d1,hemzqm <chemzqm@gmail.com>, 2018-12-08 19:18:53 +0800, , chore test snippet test,,
2915,16c346346a5fc9609b74d42d3f44a7606f5c40ec,hemzqm <chemzqm@gmail.com>, 2018-12-08 17:54:06 +0800, , feat complete break undo apply,,
2916,3d89f0038f2fb3e046d36070db5d14888ba885f0,hemzqm <chemzqm@gmail.com>, 2018-12-08 16:21:52 +0800, , chore doc improve description schema.json,,
2917,968ea745990751463b333b5d99fff7d6b02aaed6,hemzqm <chemzqm@gmail.com>, 2018-12-08 02:59:01 +0800, , feat configuration show error schema.json found,,
2918,b4222e7103e9d1b387ddc5ee228a106ab36b1af9,hemzqm <chemzqm@gmail.com>, 2018-12-07 21:17:58 +0800,243, fix highlight fix highlight cleared fix 243,,
2919,b4f8857d5f8c6780182c9bd65ae065be19f9d0e0,hemzqm <chemzqm@gmail.com>, 2018-12-07 17:57:08 +0800, , feat highlight use namespace possible,,
2920,79c333679e0153b6137c1e10d63277f9e8470c20,hemzqm <chemzqm@gmail.com>, 2018-12-07 15:09:22 +0800, , feat setting disable codelens default,,
2921,5bbc0a78885785cca27cb78337b699b7733838f9,hemzqm <chemzqm@gmail.com>, 2018-12-07 12:38:13 +0800,236, feat diagnostic loop diagnostic next prev fix 236,,
2922,b9d1ca2a8d40ea22214712bd0b65731250f6fed7,hemzqm <chemzqm@gmail.com>, 2018-12-07 12:22:15 +0800, , fix test fix test,,
2923,6527dc9bbdab7f3d5157f060566ba2aa877d13c7,hemzqm <chemzqm@gmail.com>, 2018-12-07 12:11:46 +0800, , fix util fix resolveroot,,
2924,a761518c7f4c365ab6097281a1252737e263c2ec,hemzqm <chemzqm@gmail.com>, 2018-12-07 11:17:34 +0800, , fix workspace use root findup instead cwd,,
2925,d9c42e648bb388def6c8957583d53807fac1f541,hemzqm <chemzqm@gmail.com>, 2018-12-07 10:48:53 +0800,237, fix util fix resolved root could null fix 237 use cwd failed resolve,,
2926,2e828989eb59bf42cab69e5746b4070bbf00d198,hemzqm <chemzqm@gmail.com>, 2018-12-06 23:09:20 +0800, , fix util fix resolveroot checking cwd,,
2927,587433bd3dda13a976f9a02736c56ac11243c231,hemzqm <chemzqm@gmail.com>, 2018-12-06 22:46:04 +0800, , fix configuration fix retrive configuration,,
2928,7b3bd30d7e196a57d5a18120419c899617113e91,hemzqm <chemzqm@gmail.com>, 2018-12-06 21:58:51 +0800, , fix configuration fix parse configuration split dot top level,,
2929,073f9877017eb9103dbeae9cc8e4ec752375812b,hemzqm <chemzqm@gmail.com>, 2018-12-06 21:39:02 +0800,234, fix util fix resolveroot fix 234,,
2930,3777882c98e62ad73c1ccce008fa879dab2c5ea8,hemzqm <chemzqm@gmail.com>, 2018-12-06 20:40:25 +0800, , chore complete improve sort logic consider score strict match,,
2931,bfcd4c9cc1f2d829e020897ee9ace3807a358860,hemzqm <chemzqm@gmail.com>, 2018-12-06 20:18:55 +0800,233, fix complete fix possible wrong word fix 233 consider textedit position start col,,
2932,ba3b80e0999a9e30833bdf771a993d913393a398,hemzqm <chemzqm@gmail.com>, 2018-12-06 19:51:45 +0800, , chore package update dependency,,
2933,67589832df3723a8829500b5310bd3334df0688e,hemzqm <chemzqm@gmail.com>, 2018-12-06 18:08:59 +0800, , chore config remove unused config,,
2934,853325fc6deba3739768e412c0051189df40f2c5,hemzqm <chemzqm@gmail.com>, 2018-12-06 13:25:17 +0800, , release v0.0.37,,
2935,4bee5955daa8ea349a42f48b22deeb5d56aa3baf,hemzqm <chemzqm@gmail.com>, 2018-12-06 13:03:26 +0800, , feat diagnostic redefine sign configuration change,,
2936,d6f431a46b5e238d87d2e0aebfd6ab8752b8a74c,hemzqm <chemzqm@gmail.com>, 2018-12-06 12:01:40 +0800, , fix completion fix option could undefined,,
2937,1f1b0af56037aff2a94b4bb14ec7bdb6a1e00d7e,hemzqm <chemzqm@gmail.com>, 2018-12-06 11:48:41 +0800, , fix diagnostic fix displaybyale fix info type shown warning fix diagnostics cleared,,
2938,6011cbf82d191e1349931181c60c3535afeeb5b1,hemzqm <chemzqm@gmail.com>, 2018-12-05 22:26:36 +0800, , fix vim fix running check,,
2939,f5271b671469761dad37fb0377f8829e8819135d,hemzqm <chemzqm@gmail.com>, 2018-12-05 21:57:57 +0800,224, feat language client echo error output fix 224,,
2940,cf5636d893329f6c1947f55a0c5ff4c1e2b08f03,hemzqm <chemzqm@gmail.com>, 2018-12-05 21:10:15 +0800, , fix workspace remove check change workspaceedit,,
2941,6194295231075b3007a84c767e82a3665e182b17,hemzqm <chemzqm@gmail.com>, 2018-12-05 20:52:30 +0800,228, fix workspace applyedits ignored nonexistent file fix 228,,
2942,32cfd35d236895df0ab6bf37c34461499ff13b1f,hemzqm <chemzqm@gmail.com>, 2018-12-05 20:21:15 +0800,229, fix workspace merge fix 229,,
2943,a5af2bc1d429013b6c0944d67f533fbccf392aa6,hemzqm <chemzqm@gmail.com>, 2018-12-05 20:20:39 +0800, , fix watchman fix warning listener count,,
2944,550aae34c14ea66861ff90524b31b3d55c074b8b,hemzqm <chemzqm@gmail.com>, 2018-12-05 16:49:07 +0800, , fix handler fix require path,,
2945,793aefff4a0ad731518be52d05c5cf0b07f9bbe1,hemzqm <chemzqm@gmail.com>, 2018-12-05 16:16:19 +0800, , chore plugin better code orgnization,,
2946,97431c6a67f90c64302b8e76f39deac5e1e85e36,hemzqm <chemzqm@gmail.com>, 2018-12-05 15:45:27 +0800,225, fix workspace support document version fix 225,,
2947,8a5ee9a61fb97dfc56823951911ebb7156aa79fb,hemzqm <chemzqm@gmail.com>, 2018-12-05 15:24:02 +0800, , chore doc history.md,,
2948,1b6c2e9cc5985b5d202aaff4cd49967f2dda14c3,hemzqm <chemzqm@gmail.com>, 2018-12-05 15:03:14 +0800, , feat extension check update vim node rpc,,
2949,ea4e6d01289d61a97a3ba3de9f7f5862e337be5a,hemzqm <chemzqm@gmail.com>, 2018-12-05 13:47:52 +0800, , feat model add resolver module remove terminal module use resolver resolve global node package,,
2950,69ec5c97772537293328b85782aec659a66e1c40,hemzqm <chemzqm@gmail.com>, 2018-12-05 13:47:15 +0800, , fix test fix test,,
2951,48c131f11b8a79a717d24e0a8c61c1a3fd42052d,hemzqm <chemzqm@gmail.com>, 2018-12-05 13:25:46 +0800,227, fix configuration fix coc config work fix 227,,
2952,413e0c621109145abdec310815a45fc8ca5b7ab3,hemzqm <chemzqm@gmail.com>, 2018-12-04 23:06:04 +0800, , release v0.0.36,,
2953,32fff24c0eed22b2f1aa66e6def7b80534657829,hemzqm <chemzqm@gmail.com>, 2018-12-04 23:04:08 +0800,223, feat setting add fix 223,,
2954,c0902c4c33275bc0e8fed7042b86d0d047d22d56,hemzqm <chemzqm@gmail.com>, 2018-12-04 22:50:47 +0800,218, feat configuration add coc config fix 218,,
2955,3d794280b2dc743a77d9b1e3076648254607b5cb,hemzqm <chemzqm@gmail.com>, 2018-12-04 22:17:32 +0800, , feat workspace change workspace configuration bufenter,,
2956,588bef23e1dc3295bca8d0a594e154ffed77dbc7,hemzqm <chemzqm@gmail.com>, 2018-12-04 22:14:00 +0800, , chore test configuration test,,
2957,44b683e2153cb0cd5dc27f58ccd0fe55f1bbea7f,hemzqm <chemzqm@gmail.com>, 2018-12-04 22:10:05 +0800, , feat configuration rework configuration support change workspace configuration emit change error event configuration support resource uri,,
2958,3fe1df7383cf95a9f88b4419828d8cc3473366f1,hemzqm <chemzqm@gmail.com>, 2018-12-04 22:08:32 +0800, , chore plugin improve error message initialize,,
2959,74bb232c77d6cc25156a039bba918bc78ad25dfd,hemzqm <chemzqm@gmail.com>, 2018-12-04 22:05:56 +0800, , fix completion throw option found,,
2960,a809fdac5b04cef6eb46d4c8a0b08a5720fbd46c,hemzqm <chemzqm@gmail.com>, 2018-12-04 09:49:25 +0800, , fix codelens check changedtick codelens resolve,,
2961,61e3054fb4bbe82b5d1b916329a0a3bb4c11f897,hemzqm <chemzqm@gmail.com>, 2018-12-03 11:28:55 +0800, , feat setting add,,
2962,6bb542fde0ffc7ea8817f7613423670a7f9739fb,hemzqm <chemzqm@gmail.com>, 2018-12-03 10:18:42 +0800, , feat language client support rootpatterns configuration,,
2963,89f97a98e5cadc87958423989d93bd04476961b4,iming zhao <chemzqm@gmail.com>, 2018-12-04 10:58:43 +0800, , fix util fix is_win check,,
2964,145ad7cfabf1dca5b112faae3044bb17f615ef7c,hemzqm <chemzqm@gmail.com>, 2018-12-02 19:03:00 +0800, , fix plugin use cocactionasync keymaps,,
2965,d1a8ac092db8173bd6b164e7f84b460707931096,hemzqm <chemzqm@gmail.com>, 2018-12-02 18:53:54 +0800, , feat rpc kill process connection lost,,
2966,84990d5e3eaf743c56fdc1ec24e035f59c2f9305,hemzqm <chemzqm@gmail.com>, 2018-12-02 16:10:08 +0800, , fix util fix,,
2967,3112999fec7f7ce883eff43962b8bd1945e32229,hemzqm <chemzqm@gmail.com>, 2018-12-02 16:07:50 +0800, , fix vim improve message install,,
2968,94dda5f325d163c362d24f2734281289c42a3cdb,hemzqm <chemzqm@gmail.com>, 2018-12-02 15:52:38 +0800, , fix util fix prompt window vim,,
2969,11c82f150d0bf0cde01c28d789e16883f553f117,hemzqm <chemzqm@gmail.com>, 2018-12-02 15:47:17 +0800, , fix util fix prompt window vim,,
2970,26887fa0456a54fa10fa7e75581d912727da4f0d,hemzqm <chemzqm@gmail.com>, 2018-12-02 15:43:41 +0800, , fix util try fix bad propmt window vim,,
2971,677819b44f1d0616d0387eff95903db58ba7d43b,hemzqm <chemzqm@gmail.com>, 2018-12-02 15:17:30 +0800,219, fix vim fix vim node rpc start window vim fix 219,,
2972,a16a0625eac272adf6bcd7a0513aa7095c2f708c,hemzqm <chemzqm@gmail.com>, 2018-12-02 14:41:58 +0800,220, fix util fix open_terminal work window vim fix 220,,
2973,630637e0e6dc8ba4c4bd575c503d13c4438cf557,hemzqm <chemzqm@gmail.com>, 2018-12-02 13:30:00 +0800, , fix uril work old version yarn,,
2974,3252e69856efa14a02db5276089a345c9024fe0e,iu-Cheng Xu <xuliuchengxlc@gmail.com>, 2018-12-01 23:42:23 +0800, , ensure call dictwatcheradd neovim,,
2975,8c07f4be4b9c781a706c3e66de03a2d908ef30cf,hemzqm <chemzqm@gmail.com>, 2018-12-01 16:16:20 +0800, , fix test fix outputchannel,,
2976,3f19ca96ee9f447bc7bb58592b13b46d08244d17,hemzqm <chemzqm@gmail.com>, 2018-12-01 15:51:36 +0800, , fix document check document detached attach,,
2977,4a3c04a5e613cee50252c8d2f52f6570cf43d890,hemzqm <chemzqm@gmail.com>, 2018-12-01 14:21:17 +0800, , fix util disable close terminal window,,
2978,b6670d45f269925ff4d916fc1a6399fe179399f0,hemzqm <chemzqm@gmail.com>, 2018-12-01 14:06:09 +0800, , fix util fix unable update coc binary window stop service install window,,
2979,da753ca1ce4adf952daa753f89f34040984f9f77,hemzqm <chemzqm@gmail.com>, 2018-12-01 13:27:41 +0800,216, fix noselect working fix 216,,
2980,496679d362aa94e5c221ede09ec8f5fadb87f3b8,hemzqm <chemzqm@gmail.com>, 2018-12-01 12:40:06 +0800, , fix handler fix match active signature param,,
2981,e29abf7bde477793a96e4f23374e14f8f24edbb6,hemzqm <chemzqm@gmail.com>, 2018-12-01 12:26:43 +0800, , fix rpc improve check vim node rpc service,,
2982,bffebe220be1a88109c6ce32473e260fa931272c,hemzqm <chemzqm@gmail.com>, 2018-12-01 11:45:03 +0800,215, fix configuration parse invalid key fix 215,,
2983,e4fd3c94f120f9a5fa8ca3e5738e65e70e163715,hemzqm <chemzqm@gmail.com>, 2018-12-01 10:26:14 +0800, , fix rpc improve stdout stderr handler,,
2984,3d00de11b772296c4f7e9e9b4acf355dc2f06d77,hemzqm <chemzqm@gmail.com>, 2018-12-01 05:25:58 +0800, , fix handler fix highlight active param,,
2985,8d82e437a724b210b6c1645fbbdf21d96c1d945d,hemzqm <chemzqm@gmail.com>, 2018-12-01 04:48:28 +0800, , fix test fix color test,,
2986,93578a6ce666e6f793eeadaf3cd711c9946bd82e,hemzqm <chemzqm@gmail.com>, 2018-12-01 04:41:46 +0800, , feat color improve trigger request color,,
2987,b85e5fa46fa9804be0385df7814df35e14e34546,hemzqm <chemzqm@gmail.com>, 2018-11-30 13:56:45 +0800, , feat codelens rework codelens use virtual text feature,,
2988,98da1eb14c39bba57e1dfaafb8c8ab8e8bdcd3f7,hemzqm <chemzqm@gmail.com>, 2018-11-30 13:26:09 +0800, , fix test fix outputchannel test,,
2989,d5ac738210d801060e7a98c5f52b6c1c1fdbbb21,hemzqm <chemzqm@gmail.com>, 2018-11-30 12:25:22 +0800, , fix test use unique file name,,
2990,3ae815442bd5a492e693e859a570992b3f52778a,hemzqm <chemzqm@gmail.com>, 2018-11-30 12:01:25 +0800, , fix test fix snippetmanager test,,
2991,466d7f66b4180e777fb18c8c4ea2a7282108e708,eyward Fann <heyward.fan@kikatech.com>, 2018-11-30 09:57:08 +0800, , fix typo,,
2992,7fa8bb9830ddfeeecfc15d335c4be415fc3cd14c,hemzqm <chemzqm@gmail.com>, 2018-11-30 06:42:13 +0800, , fix workspace prefer shiftwidth tabsize,,
2993,5926fad872fa2e3de37569c316c70ac6530a35c3,hemzqm <chemzqm@gmail.com>, 2018-11-30 06:36:29 +0800, , fix workspace prefer softtabstop tabsize,,
2994,350e8bd264db1524c8449926cfd4a2ad80f6efb4,hemzqm <chemzqm@gmail.com>, 2018-11-30 05:31:53 +0800, , feat completion always enable preview json file,,
2995,b6ceaa52c86aedee699153faaeeb42d92f702739,hemzqm <chemzqm@gmail.com>, 2018-11-30 04:59:17 +0800, , feat handler support echo hover message add,,
2996,b6d9029bd28d1c1c3ef11458e419e487e66fb252,hemzqm <chemzqm@gmail.com>, 2018-11-30 03:48:14 +0800, , chore doc add coc yaml,,
2997,d96b56fcf0bd0878c7c0473de06e3bef7110e945,hemzqm <chemzqm@gmail.com>, 2018-11-30 02:42:44 +0800, , fix command use notification possible fix block issue,,
2998,ede5739565b13c59326450f2c4f611070a0b568c,hemzqm <chemzqm@gmail.com>, 2018-11-30 01:23:42 +0800, , fix util open terminal use cwd option,,
2999,7cc4474494619e11092fa90b4bfbc27b492d1b18,hemzqm <chemzqm@gmail.com>, 2018-11-29 14:03:40 +0800, , fix language check item completionlist exists,,
3000,aa6fb02cbf452ff59384fad409296d0aefb2dd1e,hemzqm <chemzqm@gmail.com>, 2018-11-29 13:39:25 +0800, , chore doc improve readme,,
3001,2dccde05b98b8e4f06789424e8684af2884cea98,hemzqm <chemzqm@gmail.com>, 2018-11-29 13:06:46 +0800, , chore package update dependency,,
3002,c75ce6dabb97f116ee0cd2f3e5b1a993cf790a96,hemzqm <chemzqm@gmail.com>, 2018-11-29 12:56:31 +0800, , fix test fix test timeout,,
3003,bf067cb961a6cf11b11ec7289986dfc7998aea8c,hemzqm <chemzqm@gmail.com>, 2018-11-29 12:22:05 +0800, , feat diagnostic rework diagnostics support clear diagnostic buffer emit event diagnostic collection add test,,
3004,1ab00abf9e5331c29a805661d4547188564fe0ef,hemzqm <chemzqm@gmail.com>, 2018-11-29 11:54:04 +0800, , fix workspace fix rootpath resolved initialize,,
3005,63d482e19101857454786aef54716d33ceb1d38b,hemzqm <chemzqm@gmail.com>, 2018-11-29 10:34:15 +0800, , fix completion throw document undefined error,,
3006,5d38571fcb45d7ac85d41f1acabd61371bf43a3e,hemzqm <chemzqm@gmail.com>, 2018-11-29 06:28:28 +0800, , fix watchman fix watching root multiple time,,
3007,9d1669dc103f3c36c1249d69767c73fac8632c21,hemzqm <chemzqm@gmail.com>, 2018-11-29 03:46:30 +0800, , chore test try fix snippetsession test,,
3008,21e86a62958b1a1ac2cb6f716bbfee13bf2e7274,hemzqm <chemzqm@gmail.com>, 2018-11-29 01:14:54 +0800,204, chore doc add completion experience fix 204,,
3009,475087e0efc37658fe0613a5e9dceb881e674871,aquexian <daquexian566@gmail.com>, 2018-11-28 15:05:07 +0800, , fix buflist clear_signs,,
3010,69ebe3444a99501767bd7a6cb6346413e7d5bb55,aquexian <daquexian566@gmail.com>, 2018-11-28 13:54:56 +0800, , clear diagnostic info restart,,
3011,32ed0aef4e2a4ac349136fb1a05bcdb80cb7cf33,rian Embry <brian.embry@gmail.com>, 2018-11-28 10:06:35 -0500, , fix many args rpc_installed,,
3012,84dcaaa60c79fbe3df73f45ccffbcd505b8a4051,hemzqm <chemzqm@gmail.com>, 2018-11-28 12:46:44 +0800,202, fix handler add timer fix 202,,
3013,57300cd2a7337ed268d959da1aafdb72167e1613,reenkeeper[bot] <greenkeeper[bot]@users.noreply.github.com>, 2018-11-28 02:27:01 +0000, , chore package update lockfile yarn.lock,,
3014,8603baf0a357526d1a04cf0e84ddbc6867d390be,reenkeeper[bot] <greenkeeper[bot]@users.noreply.github.com>, 2018-11-28 02:26:55 +0000, , fix package update chemzqm neovim version 4.3.27,,
3015,3958224b8c64620656c60831f5d9e24f9a81ebf4,eyward Fann <heyward.fan@kikatech.com>, 2018-11-28 10:51:15 +0800, , fix doc typo,,
3016,782877336ac0060e35a8abf505c5ec01f72c2156,hemzqm <chemzqm@gmail.com>, 2018-11-28 09:20:28 +0800,174, fix codelens fix codelens work fix 174,,
3017,0aacb3148d779558f13a2faa60c0cc32e9828e5a,hemzqm <chemzqm@gmail.com>, 2018-11-28 08:37:52 +0800, , feat snippet add autocmd,,
3018,8a2be1b005a4965bbddf215942a74e2cec371f46,hemzqm <chemzqm@gmail.com>, 2018-11-28 08:23:49 +0800, , fix handler fix signaturehelp param highlight,,
3019,822831326d13a35cfb8f3e39766878bb19ef9ba9,hemzqm <chemzqm@gmail.com>, 2018-11-28 07:25:05 +0800, , release v0.0.35,,
3020,258e821eccc63f4d37ea1c4d04ae132edd6e8fea,hemzqm <chemzqm@gmail.com>, 2018-11-28 07:24:36 +0800, , chore doc udpate bug_report.md,,
3021,a2cf294b6d3c874c9a971cd0a0c6b5d3fccb316f,hemzqm <chemzqm@gmail.com>, 2018-11-28 06:56:19 +0800,183, feat handler rework signaturehelp fix 183,,
3022,22fb68446a3f43fd6e85fc58510cd9a49e03a022,hemzqm <chemzqm@gmail.com>, 2018-11-28 05:39:14 +0800, , fix plugin fix request throw error vim,,
3023,b595760e9f2087b753d1de44f3acee8944e9c826,hemzqm <chemzqm@gmail.com>, 2018-11-28 04:02:02 +0800, , fix completion fix recentscore work,,
3024,402200797423411e1bd6aba18a3bed6906a0af3e,hemzqm <chemzqm@gmail.com>, 2018-11-28 03:30:43 +0800,189, fix completion change data completionitem fix 189,,
3025,d69e1e182860525162016ecc28ccf92ef1dcb30a,hemzqm <chemzqm@gmail.com>, 2018-11-28 03:13:07 +0800, , fix complete sort priority strictmatch,,
3026,614be7569aae37aaf915a850eb2c8383ae7f24cd,hemzqm <chemzqm@gmail.com>, 2018-11-28 02:56:08 +0800,195, fix completion check exsits item commit fix 195,,
3027,d3e22efa17b911a9ca6f665b2e5322860bfb5f7c,hemzqm <chemzqm@gmail.com>, 2018-11-28 02:34:26 +0800, , chore util change charcode module position,,
3028,887340f4c504f1a71ec94a417cd0e7b81f36a8f0,hemzqm <chemzqm@gmail.com>, 2018-11-28 01:13:49 +0800, , chore test remove unused file,,
3029,f6a55297415f5febc6df580c18c91c72bc342a83,hemzqm <chemzqm@gmail.com>, 2018-11-28 00:56:18 +0800, , chore complete improve sort item,,
3030,d5228622b54a6a1ed63423ca8ffd8d55db48cae3,hemzqm <chemzqm@gmail.com>, 2018-11-27 23:12:58 +0800, , feat snippet start snippet session insert mode,,
3031,db6d0f6d0fe4ff1f0897a54616c164b4886dbad2,hemzqm <chemzqm@gmail.com>, 2018-11-27 23:12:44 +0800, , fix status redraw status line,,
3032,2008abad30e122de0ea44e614efa8cb30d303802,hemzqm <chemzqm@gmail.com>, 2018-11-27 20:55:34 +0800, , fix completion complete select content change,,
3033,9531d45e79732c65f4ccf505573dca324f1401be,hemzqm <chemzqm@gmail.com>, 2018-11-27 20:52:51 +0800, , chore source remove shouldcomplete check,,
3034,cccf7d2ff970e252c90cd902850d03d32f99c13d,hemzqm <chemzqm@gmail.com>, 2018-11-27 05:54:30 +0800,191, feat completion item selected fix 191,,
3035,447d1c4ee322e6bf1c7d6bc1610f621b80adb11b,hemzqm <chemzqm@gmail.com>, 2018-11-27 05:42:20 +0800,192, feat complete add support localbonus fix 192,,
3036,1c35b56609639aed7d586f4a33da90277ebed47a,hemzqm <chemzqm@gmail.com>, 2018-11-27 04:29:08 +0800, , fix complete prefer detail signature,,
3037,31698284f462803594752abd1456744950f4a57c,hemzqm <chemzqm@gmail.com>, 2018-11-27 03:36:26 +0800,190, feat handler try send execute command request fix 190,,
3038,0137014c3ed94633b398089070cec7086c3d89c5,hemzqm <chemzqm@gmail.com>, 2018-11-27 02:30:24 +0800, , fix completion check option null,,
3039,8b09cbd44a9cdb625d8ae256fbf55f14131f91ce,hemzqm <chemzqm@gmail.com>, 2018-11-27 02:00:54 +0800,177, fix fix merge codeactions fix 177,,
3040,7a7ee4bb2036b183f3385bc23ed196b40d83ec28,hemzqm <chemzqm@gmail.com>, 2018-11-27 01:24:33 +0800,188, feat setting add fix 188,,
3041,707d63f31dd78d5b023eb6b4cbddaa334cf5d3bf,hemzqm <chemzqm@gmail.com>, 2018-11-27 00:56:11 +0800, , feat setting add,,
3042,64b8ec8ab4639684cb8d07279e9184b356e1d3e5,hemzqm <chemzqm@gmail.com>, 2018-11-27 00:54:22 +0800, , fix complete check range textedit null,,
3043,089898714490c627f029b458ca0306449665c226,hemzqm <chemzqm@gmail.com>, 2018-11-26 21:55:44 +0800, , feat denite add,,
3044,b2a0e08e7bdf3dc0f42095c9b0ebc9cf3b001e63,hemzqm <chemzqm@gmail.com>, 2018-11-26 09:21:32 +0800, , fix complete get word check textedit,,
3045,e0fbeac17cab4ffede533c35ca1fb7ea08c72b3f,hemzqm <chemzqm@gmail.com>, 2018-11-26 08:45:31 +0800,180, fix completion fix extract insert word fix 180,,
3046,a55f650557a1df45c8c5eceb2671edd4bbf4852c,hemzqm <chemzqm@gmail.com>, 2018-11-26 08:37:27 +0800, , fix outputchannel append clear method,,
3047,ff209ca0d209d94c859e83c047fa110772c2e542,hemzqm <chemzqm@gmail.com>, 2018-11-26 08:19:01 +0800, , feat plugin add cocinfo command,,
3048,dc370f7bfb9d492d1b3c1974a819476224e6fc43,hemzqm <chemzqm@gmail.com>, 2018-11-26 07:57:00 +0800, , fix outputchannel show content buffer expected,,
3049,6d98f88b60ddec6b3673d0b95c7610aa49f6f288,hemzqm <chemzqm@gmail.com>, 2018-11-26 05:45:15 +0800, , fix service improve timing service create init workspace init remove using lazyclient regist client init,,
3050,f43bc664ab6249376b164076bf5175ac8df49054,hemzqm <chemzqm@gmail.com>, 2018-11-26 05:32:42 +0800, , fix language client fix message type using number,,
3051,c5b685e7692185765ca8f5c749355709583fc336,hemzqm <chemzqm@gmail.com>, 2018-11-26 02:06:00 +0800, , feat handler support formatexpr,,
3052,b6b8b23a9db3a25328d8858f32533ed49378f9a6,hemzqm <chemzqm@gmail.com>, 2018-11-26 02:05:31 +0800, , fix watchman fix possible throw error,,
3053,082ba4494bfb11e66a82e92e9089a564df142372,hemzqm <chemzqm@gmail.com>, 2018-11-25 20:37:16 +0800,182, fix diagnostic fix fix 182,,
3054,472b5af53b94ac27b078f7f171d63a00ad57f84b,hemzqm <chemzqm@gmail.com>, 2018-11-25 09:59:44 +0800, , fix test increase timeout,,
3055,0501ba2187cbc65cc60a7ccad5a2fb3efa3354e6,hemzqm <chemzqm@gmail.com>, 2018-11-25 09:25:14 +0800, , fix handler trim params signature label,,
3056,e8a1b34c854b30fdc37802352d5541069002b1a4,hemzqm <chemzqm@gmail.com>, 2018-11-25 09:02:51 +0800, , feat language echo provider found message necessary,,
3057,7c36095b80d76f1d5084b589322b71cd1eeb38c1,hemzqm <chemzqm@gmail.com>, 2018-11-25 08:20:14 +0800, , fix command fix triggersuggest work,,
3058,ce10f85edaeecc70fdfeaf3c2ce7c5e0e94e0117,hemzqm <chemzqm@gmail.com>, 2018-11-25 07:02:54 +0800, , fix handler fix ontypeformat triggered,,
3059,e25e750ba4ae06ece54e4caf3ea38b445252eaba,hemzqm <chemzqm@gmail.com>, 2018-11-25 06:04:45 +0800, , fix readme fix typo,,
3060,60a614ebda2aa84de13ff79e6b09a69819759152,hemzqm <chemzqm@gmail.com>, 2018-11-25 01:41:21 +0800, , chore doc readme,,
3061,c472ca8ff723921b14283672211ac689d6a9c847,hemzqm <chemzqm@gmail.com>, 2018-11-25 01:21:53 +0800, , fix test increase timeout,,
3062,b4a2bb6779b490bdee8e9b88e874d8dabea22dfd,hemzqm <chemzqm@gmail.com>, 2018-11-25 00:58:10 +0800, , fix complete improve signature guess,,
3063,558c8f76a59bd7c38a32ed6e16ccc60e3084ca5e,hemzqm <chemzqm@gmail.com>, 2018-11-25 00:47:31 +0800, , fix plugin fix findlocations working,,
3064,13f9622580342844d1490c9f4289bbbc9f616c2d,hemzqm <chemzqm@gmail.com>, 2018-11-25 00:33:47 +0800, , fix test fix color test,,
3065,1456bd2f62379db9b8b44566e08d5b1b8546cac1,hemzqm <chemzqm@gmail.com>, 2018-11-25 00:03:03 +0800, , feat snippet fix indent next line necessary,,
3066,ec5f4232dc128380fea2913925f6cf21cf74f13e,hemzqm <chemzqm@gmail.com>, 2018-11-24 23:33:13 +0800, , feat setting add,,
3067,849aa4cd02b1972053b73f9c40b50a5a0d9ff7c0,hemzqm <chemzqm@gmail.com>, 2018-11-24 23:15:13 +0800, , fix test fix screenline match,,
3068,b663e65ea672dbb861ab1312e1ce22e07cbb0e45,hemzqm <chemzqm@gmail.com>, 2018-11-24 22:08:30 +0800, , fix workspace fix jump working,,
3069,392a7fae4f720ad624924e628d5f274372755e4c,hemzqm <chemzqm@gmail.com>, 2018-11-24 22:06:07 +0800, , feat plugin add coclocations function,,
3070,c28a30db82dcda87c2ff7bb6f3901dfe6c016f50,hemzqm <chemzqm@gmail.com>, 2018-11-24 21:42:08 +0800,175, feat plugin add opencommand jump action fix 175,,
3071,b2508eecbf639b967084be34cb0852e40b85dbcf,hemzqm <chemzqm@gmail.com>, 2018-11-24 21:12:12 +0800, , fix snippet fix insert position plain snippet,,
3072,02b60178d7c7be1a3b43d124e9cf21e4f6943ae7,hemzqm <chemzqm@gmail.com>, 2018-11-24 20:37:58 +0800, , feat language function expanded,,
3073,f5a0e864df9afd63d7144f02dc1cdf9fe8ee6d82,hemzqm <chemzqm@gmail.com>, 2018-11-24 20:27:46 +0800, , feat command register,,
3074,443359f9023ea5f5ed1f461c68a7cd4ec2fa62a2,hemzqm <chemzqm@gmail.com>, 2018-11-24 20:00:40 +0800,170, fix snippet fix fix 170,,
3075,a02616b6adaccc3197760b4e8949eb699a18ee9e,hemzqm <chemzqm@gmail.com>, 2018-11-24 03:03:49 +0800, , fix doc fix readme,,
3076,c4c1f19adfee46481c73ac1535671beb0bc97c40,hemzqm <chemzqm@gmail.com>, 2018-11-24 02:59:26 +0800, , chore doc history,,
3077,abc90a8546003f066a12506e6b845f29aade10aa,hemzqm <chemzqm@gmail.com>, 2018-11-24 02:48:33 +0800, , release v0.0.34,,
3078,da5aa1a2c5d87fc4224260e255d3620f8859e96b,hemzqm <chemzqm@gmail.com>, 2018-11-24 02:47:43 +0800, , fix doc fix readme,,
