id,sha,author,date,issue,message,file,content
1841,cdbcb2064e87910c7ac3e3f39437770e4c7a7f39,hemzqm <chemzqm@gmail.com>, 2019-06-15 17:34:53 +0800, , refactor install new publish logic,,
1842,3e0eec9c4f08003304ba4d50bb0866dbaf7cc707,hemzqm <chemzqm@gmail.com>, 2019-06-15 17:08:24 +0800, , refactor completion improve float support,,
1843,bfa68929448462b8c33da7795ec13dab81f99728,hemzqm <chemzqm@gmail.com>, 2019-06-15 16:35:03 +0800, , chore package update dependency,,
1844,9c20138f6722a99a61542f1d91528101f57191a4,hemzqm <chemzqm@gmail.com>, 2019-06-15 16:25:46 +0800, , chore plugin remove updatetime check,,
1845,68a249ead6ae6c4fd238b3e83df9f35f64599d69,c00ter <sc00ter@users.noreply.github.com>, 2019-06-15 15:16:15 +0800, , fix virtualtext invalid highlight tag 874,,
1846,7d9ff4fe982e43c78c2b3f4ae83dbbe9a8a2b328,hemzqm <chemzqm@gmail.com>, 2019-06-15 03:44:25 +0800, , chore doc add note,,
1847,d2787ef0df7088f86c56c9153c613187b9e7a84f,hemzqm <chemzqm@gmail.com>, 2019-06-15 03:37:48 +0800, , fix util fix check popup_clear,,
1848,d9e27a8dbf590f4a2a67b59ecbf7659eb60e82be,hemzqm <chemzqm@gmail.com>, 2019-06-15 03:32:35 +0800, , chore doc readme,,
1849,d5b076292b9821d98d381248dbfca02ce67993b2,hemzqm <chemzqm@gmail.com>, 2019-06-15 03:31:17 +0800, , fix util check patch 8.1.1522,,
1850,eea22af68e4a12373257de50eb4c0a1b3dd75d2d,hemzqm <chemzqm@gmail.com>, 2019-06-15 03:21:24 +0800, , chore update publish.sh,,
1851,8b97c5ffb2abab5789d5f1be81c7d2b8c8a581ce,hemzqm <chemzqm@gmail.com>, 2019-06-15 03:15:29 +0800, , chore doc bug_report.md,,
1852,f727d85aadae44385674a402170927485d1b2834,hemzqm <chemzqm@gmail.com>, 2019-06-15 02:59:23 +0800, , refactor floating remove unused code,,
1853,7e3f57e3ada36493daab15f76b1b98f23eb60669,hemzqm <chemzqm@gmail.com>, 2019-06-15 02:52:55 +0800,851, feat plugin add popup support vim close 851,,
1854,6c3f92a845dcd1e5f7859422a12942cade1cdc15,hemzqm <chemzqm@gmail.com>, 2019-06-14 20:13:44 +0800, , fix snippet fix plaintext check,,
1855,3cf91b06a76a790c3f81f65b60f5ee289ae96d18,hemzqm <chemzqm@gmail.com>, 2019-06-14 17:17:28 +0800, , refactor handler improve message fold method,,
1856,af77b9eab8e046f826d95b01f0c3fdfd3e5fb3f3,hemzqm <chemzqm@gmail.com>, 2019-06-13 22:16:30 +0800, , fix highlight catch error,,
1857,b65a0aff1c8dbab672fa599c6a6ec872fab1cf62,hemzqm <chemzqm@gmail.com>, 2019-06-13 21:36:37 +0800, , refactor workspace replace find find issue window,,
1858,24c5ac7805941f478aeaf48c45e6d088526be59a,hemzqm <chemzqm@gmail.com>, 2019-06-13 20:37:36 +0800,871, fix highlight use progpath fix 871,,
1859,417752999c3018267f66384477b0aad4971391a4,hemzqm <chemzqm@gmail.com>, 2019-06-13 13:51:07 +0800, , fix floatfactory escape feedkeys,,
1860,59a24c0dc37539f7d4ca80bc1bd31be25f730e47,hemzqm <chemzqm@gmail.com>, 2019-06-12 19:22:05 +0800, , fix handler fix work,,
1861,2673317ada881d42b996c9c55e1c649653b5e101,hemzqm <chemzqm@gmail.com>, 2019-06-12 18:05:24 +0800, , refactor handler return command result,,
1862,99537d3c524e567ec343a01ffd2bd0aaf9605a4b,hemzqm <chemzqm@gmail.com>, 2019-06-12 17:48:36 +0800, , release v0.0.70,,
1863,d1b7447328b8265af5d4a4a26dda0d1cefd2190c,hemzqm <chemzqm@gmail.com>, 2019-06-12 17:40:26 +0800, , feat document add getvar method support coc_enabled,,
1864,1c5eb9ef6afb950679bf810d0ec52d3f73d2c1a1,hemzqm <chemzqm@gmail.com>, 2019-06-12 16:25:43 +0800, , fix util break selection message,,
1865,ef60ed12f5d25c4ff67d214db6adf682edacaade,hemzqm <chemzqm@gmail.com>, 2019-06-12 16:21:31 +0800, , chore plugin remove unused,,
1866,6add8a1c87729d89e2e85fd2b5db07678264935f,epfu[bot] <depfu[bot]@users.noreply.github.com>, 2019-06-12 15:47:15 +0800, , update tslib version 1.10.0 868,,
1867,3975439fa25f4ecc89af66405cf807ec93d9a94d,epfu[bot] <depfu[bot]@users.noreply.github.com>, 2019-06-12 15:46:53 +0800, , update type node version 12.0.7 855,,
1868,313045f937702c4e019445fbc588f12bc7988ab8,eyward Fann <fannheyward@users.noreply.github.com>, 2019-06-12 13:11:13 +0800, , fix doc typo lsp 867,,
1869,f1ca182ebe0374123e8731bea19ba3f97c1f1500,hemzqm <chemzqm@gmail.com>, 2019-06-11 23:10:43 +0800, , fix workspace fix jumpto work vim8,,
1870,52efe0ae725a81d08943d5dd1c6dd8e75ea89cac,hemzqm <chemzqm@gmail.com>, 2019-06-11 21:46:58 +0800, , chore doc update backer,,
1871,c78a2807a74a6a7b005c4035a728c8be42a007fe,hemzqm <chemzqm@gmail.com>, 2019-06-11 21:22:16 +0800, , chore doc readme,,
1872,6336ab2f5708510a743906dcc23fa47650a598cf,hemzqm <chemzqm@gmail.com>, 2019-06-11 20:46:33 +0800, , fix completion trigger completion word character,,
1873,5915a9e5732f9f64320b53ce99851a2dd8c9c36d,hemzqm <chemzqm@gmail.com>, 2019-06-11 18:55:07 +0800,865, refactor handler return boolean result close 865,,
1874,4a506e3439a9abc0a6a3cab5a7d8a15698a58316,hemzqm <chemzqm@gmail.com>, 2019-06-11 17:47:19 +0800, , perf workspace improve jump performance,,
1875,b30c48dc309cd3ce30b8571281c20756de73cdee,old Notz <dyzplus@gmail.com>, 2019-06-11 13:15:22 +0800, , doc fix typo add completion source 864,,
1876,7d6bc38602ac0ce6afb7ebafba343a18d2ce3746,aruaway <naruaway@gmail.com>, 2019-06-11 03:17:01 +0900, , fix util escape filename jump 862,,
1877,910afc5579bd1342b37a5fcd536f3a32672c9fe8,hemzqm <chemzqm@gmail.com>, 2019-06-10 23:20:16 +0800, , refactor plugin show empty hover,,
1878,71f40dbacdb46c4aae9d37e050048f7161d25f8a,hemzqm <chemzqm@gmail.com>, 2019-06-10 15:26:14 +0800, , feat outline ignore callback function,,
1879,1c7e699f168a67626c90025b3adc29d47f370fa6,arasu <ketcoding@gmail.com>, 2019-06-10 17:04:34 +0900, , fix typo 859,,
1880,43bf9a0f766d66466050ecf97126730e8b67d458,hemzqm <chemzqm@gmail.com>, 2019-06-10 14:05:56 +0800, , feat workspace support list event registerautocmd,,
1881,256387d7a2b6d3c948f33dc8e3699b2e01af832a,hemzqm <chemzqm@gmail.com>, 2019-06-10 02:10:47 +0800, , chore util doc,,
1882,ec73f3f3f10067bf2f7f0ea735f04191fa14354f,hemzqm <chemzqm@gmail.com>, 2019-06-10 01:44:01 +0800, , fix workspace fix jump tab drop,,
1883,e3adf566d429495d899653cc8280603e39303c50,hemzqm <chemzqm@gmail.com>, 2019-06-09 21:43:44 +0800, , refactor language client change api selectionranges,,
1884,ea70c2a428d23922a75d59fa6ba1014cbc9b556e,hemzqm <chemzqm@gmail.com>, 2019-06-09 14:38:48 +0800, , release v0.0.69,,
1885,0b3b2801a5bffe4f71d6adcc91a720a420ff5414,hemzqm <chemzqm@gmail.com>, 2019-06-09 13:55:14 +0800,854, feat handler add codeactions action close 854,,
1886,9458540bdf08311bd777a448c91250a3cfee59d5,hemzqm <chemzqm@gmail.com>, 2019-06-08 19:42:35 +0800, , feat list support extended search mode,,
1887,7e54f40405cc0e6fb03f5b8192c765a0c971bc2f,hemzqm <chemzqm@gmail.com>, 2019-06-08 16:11:39 +0800, , chore test fix test fail,,
1888,a2098b819cdcd11e3b0ef4451cc56e403c4ce73e,hemzqm <chemzqm@gmail.com>, 2019-06-08 14:53:37 +0800, , refactor list fix issue window fix relative filepath support imselect option improve cursor gvim,,
1889,0b97d1b56aa60983c891ae9104d110d6a1b791fa,hemzqm <chemzqm@gmail.com>, 2019-06-07 19:09:08 +0800, , refactor list rework list,,
1890,754ec7fad3bf6244fbb4b304afc6ca2509102fac,hemzqm <chemzqm@gmail.com>, 2019-06-07 17:10:41 +0800, , refactor list rework list,,
1891,f219c5ad7bcaafa2102fde908d22de11bb5f4f14,hemzqm <chemzqm@gmail.com>, 2019-06-07 15:06:23 +0800, , chore package update dependency,,
1892,cbb5c031274f81a503ea0c0976252938de479980,hemzqm <chemzqm@gmail.com>, 2019-06-07 13:49:46 +0800, , doc add contributing.md,,
1893,6b99c0c90eb3014b82baa5cd8114ccfc5a15cdd1,hemzqm <chemzqm@gmail.com>, 2019-06-06 23:35:42 +0800, , fix util normalize uri window,,
1894,453734ae75f6c3f4cb1e615b02294bcf66f4d448,hemzqm <chemzqm@gmail.com>, 2019-06-06 21:43:16 +0800, , chore list delay prompt vim,,
1895,e28502ac07c7d9b96a1510a6b3f880d0a6355cbc,hemzqm <chemzqm@gmail.com>, 2019-06-06 21:08:57 +0800, , refactor list improve list vim,,
1896,1149de96b3927c8b0fd744fee6919b5efc1535a5,asse Peters <lasse.peters@tuhh.de>, 2019-06-06 13:59:31 +0200, , update readme.md 849,,
1897,33fdf740aa7f74f48f721eaa969d6aab346af31f,hemzqm <chemzqm@gmail.com>, 2019-06-06 18:29:34 +0800, , chore package update dependency,,
1898,3c512aa9bc02a6ad429743505a10e4071657df3c,hemzqm <chemzqm@gmail.com>, 2019-06-06 18:02:05 +0800,265, fix snippet fix invalid cursor position close 265,,
1899,44870f024c8f0eb212efe189ace2495411c3d1b4,hemzqm <chemzqm@gmail.com>, 2019-06-06 16:45:15 +0800, , fix float catch error floatwindow create,,
1900,85162d829e177d30b6291c41a1a7b5df53d23712,hemzqm <chemzqm@gmail.com>, 2019-06-06 16:06:00 +0800, , feat plugin add cocaction cocfix command,,
1901,dac38ed5b4b4844b6cb28ea3791f14e84491a3bb,hemzqm <chemzqm@gmail.com>, 2019-06-06 14:26:36 +0800, , fix handler fix typo organize,,
1902,8975d1697bfad2a0bac2400fc21d26ceb3773b72,hemzqm <chemzqm@gmail.com>, 2019-06-06 14:15:52 +0800, , feat command add command,,
1903,5c0407d542ae5e950087a8fea09cf5736ce92191,hemzqm <chemzqm@gmail.com>, 2019-06-06 13:52:51 +0800, , chore doc link readme,,
1904,de11e59de908a70b7e271ea9e7beae0fbb048f4c,eyward Fann <fannheyward@users.noreply.github.com>, 2019-06-06 14:07:36 +0800, , add coc marketplace readme 848 fix doc typo chore readme add coc marketplace readme,,
1905,e88b86eac1dcc1aab9464437d4d2fdeb6b604996,hemzqm <chemzqm@gmail.com>, 2019-06-06 12:29:42 +0800,817, feat handler support title codeaction close 817,,
1906,7d63e2885bc73fa4f63705204c2163c47fb56fb6,hemzqm <chemzqm@gmail.com>, 2019-06-06 11:43:05 +0800, , chore doc better cnx document,,
1907,cf4d9769cea9ef8b1d528949bee7f0620bd2ceb7,hemzqm <chemzqm@gmail.com>, 2019-06-06 09:54:13 +0800, , feat plugin support vim 8.0.1453,,
1908,eb507baaa314598ad9c08c9182e13b8ddee09b39,yantig <ryantig@users.noreply.github.com>, 2019-06-05 04:56:19 -0700, , update coc.txt 834 fix broken link http github.com neoclide coc.nvim wiki using configuration file,,
1909,8634e84cbda96d36d7e9de0956d26653bcc5c604,obert Liebowitz <rliebz@gmail.com>, 2019-06-05 07:55:54 -0400, , fix diagnostic correct ale end column 846,,
1910,ebae7b9b57185021edd53827804ad63b62a803a3,hemzqm <chemzqm@gmail.com>, 2019-06-05 19:01:39 +0800,765, feat diagnostic add highlight group virtualtext close 765,,
1911,32f5551c7ea6a46859edd24d0db99b159b3c2b56,hemzqm <chemzqm@gmail.com>, 2019-06-05 18:46:01 +0800,840, refactor list overwrite statusline option close 840,,
1912,cc0d9481c6a468b8999d6fdae5a3b120b119a8cd,hemzqm <chemzqm@gmail.com>, 2019-06-05 13:12:26 +0800, , feat completion add configuration,,
1913,132c099563fec9444809ada0cb5a0154f3890359,hemzqm <chemzqm@gmail.com>, 2019-06-05 10:42:49 +0800,842, feat client create folder log close 842,,
1914,ca2240848523c7ea06197e74bb338da9effefc5e,hemzqm <chemzqm@gmail.com>, 2019-06-05 10:39:02 +0800,841, feat completion support close 841,,
1915,edfa3ad1206b6dc225cd720949ca6e91aa1f3539,hemzqm <chemzqm@gmail.com>, 2019-06-05 09:52:54 +0800,838, fix completion fix previewwindow closed close 838,,
1916,992278a640d1c18020b5e149ad267038d7015b6e,hemzqm <chemzqm@gmail.com>, 2019-06-05 09:34:45 +0800,839, feat list add prompt.paste action close 839,,
1917,8318f816309cd1968f19d3d482750b915af4c1b5,hemzqm <chemzqm@gmail.com>, 2019-06-05 09:03:56 +0800,844, refactor source user touppercase source shortcut close 844,,
1918,afd143e9495e2500b51733d09242f160fd8ac217,hemzqm <chemzqm@gmail.com>, 2019-06-05 08:59:00 +0800, , feat plugin support lnum quickfixes argument,,
1919,2b723006c691f46a28c72728638d1ff6efafbc41,hemzqm <chemzqm@gmail.com>, 2019-06-04 17:19:12 +0800, , feat plugin get message cocinfo,,
1920,a1b455651d52e88bde3525657cb971011d5f5773,hemzqm <chemzqm@gmail.com>, 2019-06-04 16:21:43 +0800, , refactor completion improve sort item,,
1921,c6280f6aab30aa0b8bbb4abc1fd0c03bff754af0,hemzqm <chemzqm@gmail.com>, 2019-06-04 14:51:59 +0800, , fix float fix wrong height empty line,,
1922,f67d40be3ab75b3a74f655f37b7164eb2771cac7,hemzqm <chemzqm@gmail.com>, 2019-06-04 14:44:15 +0800, , feat handler support prefered codeaction,,
1923,bd61d67d63646e28431f449c685d03019515f2e2,hemzqm <chemzqm@gmail.com>, 2019-06-04 12:10:08 +0800, , refactor plugin remove prompt install coc json show warning instead,,
1924,449de40844f7df8eacf50fcf0f4b6ec514bef49f,hemzqm <chemzqm@gmail.com>, 2019-06-04 11:37:01 +0800, , refactor source improve configuration code,,
1925,c5c00b16ef92bcc8f9f89409685281dd1277fad3,hemzqm <chemzqm@gmail.com>, 2019-06-04 10:32:25 +0800, , chore readme add trouble shooting,,
1926,05bbbfba10f314779ee5663d21f1d6c1d89880c4,hemzqm <chemzqm@gmail.com>, 2019-06-04 10:10:48 +0800, , chore plugin use echom error message,,
1927,ca4fda99f501e412c5e4df622593b41bdac2853b,hemzqm <chemzqm@gmail.com>, 2019-06-04 10:10:11 +0800, , build install install nodejs yarn break change remove install nodejs yarn install.sh,,
1928,dbc2ad174c76a5c8e0088cbbf9b039b860dff0a7,hemzqm <chemzqm@gmail.com>, 2019-06-03 19:55:25 +0800,833, fix diagnostic use sync autocmd diagnostics fix 833,,
1929,fa924a3fbd8d27513643d625c067a3a781f78e07,hemzqm <chemzqm@gmail.com>, 2019-06-03 18:00:51 +0800, , fix completion fix completion shown empty line,,
1930,bd48a7b149a75ed6c59dd6f3621c8af6dbbabc39,hemzqm <chemzqm@gmail.com>, 2019-06-03 15:56:02 +0800, , feat workspace support repeat option registerkeymap break change keymap repeat default,,
1931,b8282d7dbe82c028bc8f7d2d117a119b1dd12647,astien Orivel <eijebong@bananium.fr>, 2019-06-03 10:07:36 +0200, , fix using configuration file link 832 old link lead non existent wiki page,,
1932,9d2bfe233652290da2307c43e92c3de00d8092d7,hemzqm <chemzqm@gmail.com>, 2019-06-03 12:01:19 +0800, , fix util fix isparentfolder folder,,
1933,98e2277d37124dd6ddf3d0fa2cc9134ee3554d6e,hemzqm <chemzqm@gmail.com>, 2019-06-03 11:25:40 +0800, , feat plugin support vim repeat command quickfix,,
1934,66d839ecf3cc0b1f4b8066819e934f549440799a,hemzqm <chemzqm@gmail.com>, 2019-06-03 09:25:11 +0800, , fix float fix unexpected close selection,,
1935,1933fb7d5187e744dfb94a68826e4eb9092261ed,hemzqm <chemzqm@gmail.com>, 2019-06-02 12:42:17 +0800, , chore handler improve code,,
1936,d797aba76834a53f42f6f0483ec790b389edf39a,hemzqm <chemzqm@gmail.com>, 2019-06-02 11:04:13 +0800, , feat schema add,,
1937,b3e774eef5f359309ed20ade0580fdf2f7d661db,hemzqm <chemzqm@gmail.com>, 2019-06-02 06:59:40 +0800,614, chore doc example close 614,,
1938,f18f890d3d0c0c029972b21411b5bfddac2b9879,hemzqm <chemzqm@gmail.com>, 2019-06-02 06:50:58 +0800, , fix handler fix float window position snippet activated,,
1939,7006c75f2b6641ebe1f34750523def6ecbc2ce95,hemzqm <chemzqm@gmail.com>, 2019-06-01 11:26:02 +0800, , feat language client add,,
1940,9eb1a9470adc04a28220b10a35d13374cbefe8ab,hemzqm <chemzqm@gmail.com>, 2019-06-01 11:05:04 +0800, , fix extension fix check,,
1941,6925a3b9b2c9ca4b439284bca48862d4bc401b5e,hemzqm <chemzqm@gmail.com>, 2019-06-01 10:00:24 +0800, , fix document fix word generated,,
1942,9ac212093b9f832721df87979234ab082a2802d0,hemzqm <chemzqm@gmail.com>, 2019-06-01 09:29:01 +0800, , fix snippet fix wrong nested snippet,,
1943,a359b05858472a2f80b50a52295043e2a0be5c09,evin Rambaud <kevin.rambaud@gmail.com>, 2019-05-31 18:53:53 -0400, , fix typo doc 830,,
1944,c6424ab05937a7e067b51258c34513019e5ff566,hemzqm <chemzqm@gmail.com>, 2019-06-01 06:36:52 +0800, , chore workspace resolve inner workspacefolder,,
1945,97d95c2f7900bb1ded103726d077ad99cf84790b,hemzqm <chemzqm@gmail.com>, 2019-06-01 05:28:21 +0800, , feat plugin link cursorcolumn,,
1946,4fee42c30c03d51b8cb213b9651ea996b4d842a9,hemzqm <chemzqm@gmail.com>, 2019-05-31 12:46:39 +0800, , feat plugin add coc add_command,,
1947,a8e44d8489bea12f7d4246f34b770769dafedb33,hemzqm <chemzqm@gmail.com>, 2019-05-31 12:17:55 +0800, , feat handler improve enter vim,,
1948,64beb5822ecbe7027d93f0bb7a9e1f2197251827,hemzqm <chemzqm@gmail.com>, 2019-05-31 10:43:44 +0800,825, feat list support pageup pagedown fix 825,,
1949,404358f5a7dc101ab92ba5d15f0a53a76c03fb2b,hemzqm <chemzqm@gmail.com>, 2019-05-31 09:27:38 +0800,824, chore package update node client fix 824,,
1950,cef467c6bc88d20281a326beb14b9863fccd42ab,hemzqm <chemzqm@gmail.com>, 2019-05-30 20:54:05 +0800, , chore ignore improve npmignore,,
1951,a0ab9a09d08e28169954be07327ab13907541d6f,hemzqm <chemzqm@gmail.com>, 2019-05-30 20:34:13 +0800, , release v0.0.68,,
1952,25c5fcd5cdea0b1c35244f7fbcadab08afb9f7b4,iovanni Giordano <giordano.giovanni1993@gmail.com>, 2019-05-30 13:10:18 +0200, , update readme.md 823 add elm language server readme.md,,
1953,18f0230ee96c8598f401b4a6ee170c043ae03274,hemzqm <chemzqm@gmail.com>, 2019-05-30 13:18:17 +0800, , chore plugin add check cocinfo,,
1954,8b8419e9620d4da3f711bbb25210ee61dd93e8fe,hemzqm <chemzqm@gmail.com>, 2019-05-30 12:42:32 +0800, , chore completion simplify floating,,
1955,12f11764ac28be9014fa985d7e115b3569af98ee,eng Guanwen <pg999w@gmail.com>, 2019-05-30 11:37:40 +0800, , remove redundant airline extension 821,,
1956,7785070b022bd95baa43fd87554ba15045f78ad7,hemzqm <chemzqm@gmail.com>, 2019-05-30 09:17:50 +0800, , chore completion improve trigger check completion,,
1957,3f2de09345d20712d7772a2f2bb88fe930410265,hemzqm <chemzqm@gmail.com>, 2019-05-30 09:00:17 +0800, , chore completion use buffer add highlight,,
1958,ff43cea60fb6cdb1cddca818685464ee29d7c64e,hemzqm <chemzqm@gmail.com>, 2019-05-30 08:44:45 +0800, , chore completion catch error floating shown,,
1959,bee563d81cb7869bfe16fea1442eee4e3d0680fe,hemzqm <chemzqm@gmail.com>, 2019-05-30 05:35:39 +0800, , chore package update dependency,,
1960,77cbc92ca5c38e1be91b053256f4907da76d969f,hemzqm <chemzqm@gmail.com>, 2019-05-30 05:32:30 +0800,611, chore float rework layout logic fix 611,,
1961,b03c2bbc7263a1fa89163c2594dce09389a61efe,hemzqm <chemzqm@gmail.com>, 2019-05-29 15:58:52 +0800, , fix client fix client undefined,,
1962,909710fddb04d383e5546b0f869c44f395a80d02,hemzqm <chemzqm@gmail.com>, 2019-05-29 08:27:23 +0800,672, fix language fix documentation nbsp fix 672,,
1963,5787dbedd5b21ae6a2a5eee60badfe8b7225d7ef,hemzqm <chemzqm@gmail.com>, 2019-05-29 07:54:48 +0800,811, chore float reuse floating window fix 811,,
1964,c9970cc81420c6f66c23b823921e848bf34a1248,hemzqm <chemzqm@gmail.com>, 2019-05-29 07:23:46 +0800, , chore document attach nofile default,,
1965,391ec815bd1671c0f17cd96c7b5fa056c16c27a2,hemzqm <chemzqm@gmail.com>, 2019-05-29 07:14:16 +0800, , chore completion rework floating,,
1966,4631f7423f7dae8bf6ee16b65f56a759b0c43f9d,iming zhao <chemzqm@gmail.com>, 2019-05-29 06:48:01 +0800, , create funding.yml,,
1967,49098ffea5857a465ecc49558da376af89d138c9,hemzqm <chemzqm@gmail.com>, 2019-05-29 02:55:35 +0800, , feat plugin support vim repeat plug keymaps,,
1968,98fd9d6cb33684e8de6962ce23d375026ac8d56e,hemzqm <chemzqm@gmail.com>, 2019-05-28 02:14:28 +0800,759, feat plugin add fix 759,,
1969,454e0dec07faaebf093181d06a8236f2bb07d8ae,hemzqm <chemzqm@gmail.com>, 2019-05-28 01:03:42 +0800,797, feat document attach nofile buffer fix 797,,
1970,f5b8dfd1ce65099f23c327bd4dad5feb6a455642,hemzqm <chemzqm@gmail.com>, 2019-05-28 00:53:41 +0800, , chore logger change logger file folder,,
1971,9399640bbf6ccd56668584b7d69248413e5df661,hemzqm <chemzqm@gmail.com>, 2019-05-27 23:50:44 +0800, , fix handler fix possible wrong signaturehelp,,
1972,d0c9eda683590e54aac932add1a8dd2972e450bd,hemzqm <chemzqm@gmail.com>, 2019-05-27 22:36:28 +0800,812, fix float fix position signaturehelp fix 812,,
1973,9f89ddb8528a3cdfd0c11349b6711ecddb4b25cb,hemzqm <chemzqm@gmail.com>, 2019-05-27 06:47:32 +0800,774, feat plugin improve rename action argument fix 774,,
1974,3ebf5fd8126c2640fcb1795458614d44f86676e7,hemzqm <chemzqm@gmail.com>, 2019-05-26 02:57:25 +0800, , fix diagnostic fix diagnosticinfo work insert mode,,
1975,d12f77bd3f0b283363ff5a3d8e13097129c5ad48,hemzqm <chemzqm@gmail.com>, 2019-05-26 02:01:43 +0800, , feat float open float window one call_atomic,,
1976,6758265487deb8de0746f87247edb45a9fddd7c3,hemzqm <chemzqm@gmail.com>, 2019-05-25 23:18:11 +0800,773, feat completion add fix 773,,
1977,ec1a72553913026a656e558d93371a586442b7ed,hemzqm <chemzqm@gmail.com>, 2019-05-25 22:54:04 +0800,805, fix diagnostic fix ale diagnostics fix 805,,
1978,94f7ae497d48a0c2236440d6e8483d91a854de5f,hemzqm <chemzqm@gmail.com>, 2019-05-25 22:04:30 +0800,807, fix float fix incorrect highlight fix 807,,
1979,b29d2f51b8aee94b578d5067bc1ab25d2175a48a,hemzqm <chemzqm@gmail.com>, 2019-05-25 20:57:05 +0800,809, feat rpc close floating window restart fix 809,,
1980,8b8eae9ec1edd7190c6e751e64a0e55be49f911c,hemzqm <chemzqm@gmail.com>, 2019-05-25 20:51:37 +0800, , feat float use matchaddpos highlight,,
1981,2b1656232c4c29478292975e147e4a0e86572108,hemzqm <chemzqm@gmail.com>, 2019-05-25 19:52:18 +0800, , fix float fix highlight flash,,
1982,c3c5b2a8c0f1c9410e8bd5eff6d9da3b9e5aedd6,hemzqm <chemzqm@gmail.com>, 2019-05-25 12:52:13 +0800, , fix float fix possible flash background color,,
1983,7d9618bc969a13b8b6d5a1ec173fc2a5addded19,atao Li <yatli@microsoft.com>, 2019-05-25 00:59:36 +0800, , feat workspace glob support root pattern 792 feat workspace globbing support root pattern use minimatch indirectory,,
1984,86f938db42dd071257a16c6f500c7d7a8dd8f34d,unzhi Duan <dyzplus@gmail.com>, 2019-05-23 22:43:31 +0800, , fix util preview failed show chunkinfo vim8 801,,
1985,ce102d528cf52023eae6cc5dfe3e2688875ce465,hemzqm <chemzqm@gmail.com>, 2019-05-23 02:42:29 +0800, , fix completion fix completion shown startcol change,,
1986,198ac1b5fbd92355bc60ba1488687d303fb30b44,hemzqm <chemzqm@gmail.com>, 2019-05-23 02:25:27 +0800, , fix source fix startcol file source,,
1987,c7189595cad721ed62266ecbeda633356ea2b5b3,hemzqm <chemzqm@gmail.com>, 2019-05-23 02:09:23 +0800, , fix source fix token undefined error,,
1988,2379b6f81f795853d7196f63afa6845ef5b6eaa5,hemzqm <chemzqm@gmail.com>, 2019-05-23 00:33:06 +0800, , feat list map esc close window,,
1989,24b0daf53f83890ab28b1a55f7904e4c94ec01d4,hemzqm <chemzqm@gmail.com>, 2019-05-22 23:56:20 +0800, , feat list show shortcut source list,,
1990,95a01d9b486ec397761a51abbf457c231b23f4d1,hemzqm <chemzqm@gmail.com>, 2019-05-22 23:16:06 +0800,791, fix workspace adjust cursor position textedits fix 791,,
1991,536565f52d93579ea68a65ee3b9d92fe0688c8cb,hemzqm <chemzqm@gmail.com>, 2019-05-22 22:03:29 +0800,793, fix diagnostics fix float window disappear fix 793,,
1992,4fdb65c7384d51de5bc2a655cdab6728f8156960,¹´ç³å°è±æ±¤ <iamcco@foxmail.com>, 2019-05-21 23:32:47 +0800, , update readme 796,,
1993,d68a33ee43ccdb91c3ed19d43333ea7d45ccb652,hemzqm <chemzqm@gmail.com>, 2019-05-21 00:13:54 +0800, , fix logger fix error unlinksync,,
1994,6c0b4a938950965da3d3e8d776d9525388635115,hemzqm <chemzqm@gmail.com>, 2019-05-20 23:38:49 +0800, , chore source allow none file buffer word completion,,
1995,727982667e568264b512b5dda080f0ce414ed1d3,hemzqm <chemzqm@gmail.com>, 2019-05-20 12:14:44 +0800, , fix client upgrade node client,,
1996,236add21a86e2d4b40823e717342f5df9762ab52,hemzqm <chemzqm@gmail.com>, 2019-05-20 11:22:51 +0800, , fix logger ignore error create symbol link,,
1997,aeda009c01605368f6fda037345d39c546f73a3c,avid Mejorado <david.mejorado@gmail.com>, 2019-05-19 18:21:56 -0700, , allow range coccommand 789 would allow command like git.browseropen open block code github,,
1998,97239363eb10ed6369d834489ab5ba113ea3fc85,hemzqm <chemzqm@gmail.com>, 2019-05-19 23:56:31 +0800, , fix util add redraw vim,,
1999,2243d93758318002e995a8c8bcffeea12355da40,hemzqm <chemzqm@gmail.com>, 2019-05-19 23:10:18 +0800, , feat completion filter complete itmes trigger,,
2000,dfc8dc22777e4109ce2f4830c1088aad40caa392,hemzqm <chemzqm@gmail.com>, 2019-05-18 23:37:47 +0800,785, fix logger fix unlink error fix 785,,
2001,fb5f17a9f68703f6378bf3cf35d65a14adfccba8,hemzqm <chemzqm@gmail.com>, 2019-05-18 20:54:59 +0800, , chore logger add pid log filename,,
2002,b7544bcde5baf007bac59f34eae0cdbd88904667,iyanokomiya <tomoya.hstexze24632@gmail.com>, 2019-05-18 19:21:35 +0900, , fix regex getting node version 783,,
2003,49bd8873ae6534dd5893dbacbe37dfbd2daaf8a7,hemzqm <chemzqm@gmail.com>, 2019-05-18 13:46:17 +0800,782, fix workspace ignore change documentchanges exists fix 782,,
2004,4bfc6e0087713a477e47a23e2a72d5f4cfc98804,ENG Rui <1203802652@qq.com>, 2019-05-15 19:31:03 +0800, , chore util add ignore script update command 776,,
2005,eeb306e8f4da02f55ee87372a263f5cd3a1e9776,hemzqm <chemzqm@gmail.com>, 2019-05-14 15:54:54 +0800, , fix workspace reuse buffer name,,
2006,cb567b1d593c84f764501f50fb3974cad8d88785,hemzqm <chemzqm@gmail.com>, 2019-05-13 21:52:23 +0800, , feat list add support,,
2007,bf6fad2b9425d47feb02586852a862c488d756ca,hemzqm <chemzqm@gmail.com>, 2019-05-13 01:37:03 +0800, , fix completion fix invalid regex,,
2008,29731bc1e32fdf58609b2247f747298101b9cb67,hemzqm <chemzqm@gmail.com>, 2019-05-11 18:55:46 +0800, , chore test fix test fail,,
2009,74402c4633b8734e1cd024764b0d2cb2cfb314a1,hemzqm <chemzqm@gmail.com>, 2019-05-11 15:56:40 +0800, , chore doc readme,,
2010,f1ddcad98706a0391cfb56a5d9b245807791cf4f,hemzqm <chemzqm@gmail.com>, 2019-05-11 15:54:38 +0800, , chore list highlight one line,,
2011,5c44b7e6b19a886a1caaeeac9e3ba44f88f2fb38,hemzqm <chemzqm@gmail.com>, 2019-05-10 18:41:21 +0800, , chore github update bug_report,,
2012,daeba088c307a1f7bf7585882b1ebb3a4f1ef161,atao Li <yatli@microsoft.com>, 2019-05-10 17:17:06 +0800, , cleanup readme.md 771,,
2013,699adebd0039f5e815c9744127260d6e85319eca,hemzqm <chemzqm@gmail.com>, 2019-05-09 22:48:52 +0800, , chore health fix check javascript bundle,,
2014,61f14d6fd3baa90a674a024784c9316df3ed0b54,hemzqm <chemzqm@gmail.com>, 2019-05-09 21:30:44 +0800,770, feat extension exclude global extension path fix 770,,
2015,b0d60d83944d20d960a13c8e8cc46f727d2d8fa3,hemzqm <chemzqm@gmail.com>, 2019-05-09 18:14:22 +0800, , feat completion support triggeronly source,,
2016,8668f301e439dd6349a18d83b6b6cd95687317aa,hemzqm <chemzqm@gmail.com>, 2019-05-09 17:50:14 +0800, , fix completion fix check trigger source,,
