id,sha,author,date,issue,message,file,content
304,8f9f923ff6e078564b79a6475eca08a4d76395ec,errit Birkeland <gerrit@gerritbirkeland.com>, 2020-11-01 15:12:31 -0700, , chore remove postbuild step,,
305,807bfcd65dc0b1489b74e02cc0be8465151550ce,errit Birkeland <gerrit@gerritbirkeland.com>, 2020-11-01 09:36:45 -0700, , chore bump version 0.20.0 beta.7,,
306,a92a1bd133e8f8fb35e73f19e9edf3f5e0c6f1e2,errit Birkeland <gerrit@gerritbirkeland.com>, 2020-11-01 09:33:48 -0700, , chore update readme.md better usage instruction,,
307,c892c0019a94bdb527eeaa1cf8c08e713ece0f3c,errit Birkeland <gerrit@gerritbirkeland.com>, 2020-11-01 09:03:34 -0700, , fix array type converted incorrectly,,
308,05091b642b8981c887ebe3c9606e9afa2c5af216,errit Birkeland <gerrit@gerritbirkeland.com>, 2020-11-01 08:51:04 -0700, , chore remove travis github action run faster,,
309,152a70b1cd910864188f8f8e69a48342e86cd472,errit Birkeland <gerrit@gerritbirkeland.com>, 2020-11-01 08:26:44 -0700, , chore bump version 0.20.0 beta.6,,
310,671e6d3ece5efa4b3296aec8a7140f1872034154,errit Birkeland <gerrit@gerritbirkeland.com>, 2020-11-01 08:22:22 -0700, , fix change target back es2018,,
311,879be3479fd5367bfe55705481503b29ff596e95,errit Birkeland <gerrit@gerritbirkeland.com>, 2020-10-31 20:43:08 -0600, , chore bump version 0.20.0 beta.5,,
312,695f5c75ca1511aba04de6eb483b5f54a647503a,errit Birkeland <gerrit@gerritbirkeland.com>, 2020-10-31 20:42:26 -0600, , feat support remaining literal type ... least think got,,
313,017fad18c32c71d0abf77c884c7870ea502b85c7,errit Birkeland <gerrit@gerritbirkeland.com>, 2020-10-31 16:40:17 -0600, , fix missing default export dislike default export grown even ... also make sidebar navigation show export single module,,
314,3f6395671f07d70c2e508d2b1b34d626d86bfea1,oc Sieng <socsieng@google.com>, 2020-10-27 16:35:05 -0700,1383, fix fix bug referencetype equality check fix 1383,,
315,82042e440317cc03471d044ce4c731d12be92cde,errit Birkeland <gerrit@gerritbirkeland.com>, 2020-10-25 16:55:42 -0600, , chore bump version 0.20.0 beta.4,,
316,5b78e70566a10580a30a7ffb67be5933eaac3945,errit Birkeland <gerrit@gerritbirkeland.com>, 2020-10-25 16:53:03 -0600, , chore upgrade dependency,,
317,103606903a2c94e58de5874fbf918b9c2ba0ffd7,errit Birkeland <gerrit@gerritbirkeland.com>, 2020-10-25 16:21:15 -0600, , feat support mapped type,,
318,d52017abc141765df3b32f156f04553fa91af90a,errit Birkeland <gerrit@gerritbirkeland.com>, 2020-10-25 10:24:57 -0600, , chore bump version 0.20.0 beta.3,,
319,50c2fe0fd72055c58a132d22e5a9846d3850a06f,errit Birkeland <gerrit@gerritbirkeland.com>, 2020-10-25 10:22:09 -0600, , chore remove option,,
320,8f1cc83e5e8032cd4cee6b2808be9abe4c263c4c,errit Birkeland <gerrit@gerritbirkeland.com>, 2020-10-25 09:46:05 -0600, , chore bump version 0.20.0 beta.2,,
321,1d6120f7d1453de16b61ffca7afa76a4ff719a34,errit Birkeland <gerrit@gerritbirkeland.com>, 2020-10-25 09:45:32 -0600, , fix reference type always given resolved symbol,,
322,cc9dc344abb706cacfaedf727549ab2643c3bb24,errit Birkeland <gerrit@gerritbirkeland.com>, 2020-10-23 17:41:18 -0600, , chore bump version 0.20.0 beta.1,,
323,008b0d0b41d2f486d69a2573339c048b0b8e3762,errit Birkeland <gerrit@gerritbirkeland.com>, 2020-10-23 17:40:40 -0600, , chore fix prettier,,
324,fcccc1be7c6a1a80c46af9397580e57f57259a01,errit Birkeland <gerrit@gerritbirkeland.com>, 2020-10-23 17:38:30 -0600, , chore bump version 0.20.0 beta.0,,
325,26b50ff9d789c352fe8b6e73f0c7d692d54b86ed,errit Birkeland <gerrit@gerritbirkeland.com>, 2020-10-23 17:25:18 -0600, , chore set auto publish,,
326,022e531e2ce4161c6e8f5b6469556482a9acca30,errit Birkeland <gerrit@gerritbirkeland.com>, 2020-10-23 16:43:40 -0600, , chore rebuild spec,,
327,bcbd401be32c287fd6c4ae3d465d5c26c6bc4db2,errit Birkeland <gerrit@gerritbirkeland.com>, 2020-10-23 16:37:52 -0600, , feat mostly working library mode,,
328,ada7d042c35f5784c4dbda6b763aa92f292c4229,errit Birkeland <gerrit@gerritbirkeland.com>, 2020-10-23 12:46:42 -0600, , chore rebuild converter spec fixed bug breaking reference,,
329,17bf655677a51470052f4130fe35b4c48ef0cff5,errit Birkeland <gerrit@gerritbirkeland.com>, 2020-10-23 12:41:16 -0600, , fix rendering work,,
330,66a20d2c975c37a5370d089c4f4e219cd1e0bffd,errit Birkeland <gerrit@gerritbirkeland.com>, 2020-10-18 17:03:52 -0600, , refactor finish ripping,,
331,6ff7fcd1d2cc14eeae1f16399e15d8cb7d7f2346,errit Birkeland <gerrit@gerritbirkeland.com>, 2020-10-18 16:18:49 -0600, , fix issue type converter,,
332,2058981a62d4d4b33e8b3eb5666d983498a1cfdc,errit Birkeland <gerrit@gerritbirkeland.com>, 2020-10-17 14:30:14 -0600, , chore remove exported flag make sense document non exported member ...,,
333,4f7080e7c3f792723bc5dfe9e00a335e4d9bb849,errit Birkeland <gerrit@gerritbirkeland.com>, 2020-10-09 21:57:01 -0600, , chore fix test everything need tsconfig file,,
334,31d811fa529456363dae00ce03813deeef33b733,errit Birkeland <gerrit@gerritbirkeland.com>, 2020-10-09 19:48:22 -0600,1189, chore turn noimplicitany close 1189,,
335,62f5f443f47f54dc624cfef1ebaf6677d9e933f2,errit Birkeland <gerrit@gerritbirkeland.com>, 2020-10-09 19:20:27 -0600, , chore turn strict option,,
336,14701cf48ad224ffe99e58b975ef5302682de9f9,errit Birkeland <gerrit@gerritbirkeland.com>, 2020-10-09 18:59:45 -0600, , breaking change typedoc longer accepts option make considerably likely work project complicated config setup somewhat inconvenient simple use every serious project ought tsconfig.json anyways ...,,
337,1d5512e278c71a9a899122974025eb69fd2fab2d,errit Birkeland <gerrit@gerritbirkeland.com>, 2020-10-09 16:08:58 -0600, , breaking change remove mode option library mode mode file mode useful lie library mode module mode special case library mode,,
338,a9d9d0f2c20bd64b908bac6dfdd8ae1c03818a92,errit Birkeland <gerrit@gerritbirkeland.com>, 2020-10-09 16:08:06 -0600, , breaking change remove option horrible idea introduced compiler error compiler api may break unexpected way,,
339,fc4103ff9b79ac14fbcf3fd1bd4492984670c608,errit Birkeland <gerrit@gerritbirkeland.com>, 2020-09-20 20:50:18 -0600, , chore rebuild test,,
340,dc965b9be0bf17bbfe1a581b0e88eafd16ebd919,errit Birkeland <gerrit@gerritbirkeland.com>, 2020-09-20 20:36:31 -0600, , chore get rid tslint switched prettier eslint,,
341,714e0382ddaa98ff45d8657714a705dfd9a05e6d,errit Birkeland <gerrit@gerritbirkeland.com>, 2020-09-20 20:00:18 -0600, , chore bump version 0.19.2,,
342,f178fc4522dc32a5a9137485e35f58f2c55945a1,errit Birkeland <gerrit@gerritbirkeland.com>, 2020-09-20 19:59:08 -0600, , chore upgrade dependency,,
343,983c0e60fb7b58e89a0c62a0a65eb2ee2b6e04c6,errit Birkeland <gerrit@gerritbirkeland.com>, 2020-09-20 19:51:12 -0600,1366, fix export declaration within namespaces detected close 1366,,
344,6fb388e0f5e74c6f246206c284751c6d0de8f460,errit Birkeland <gerrit@gerritbirkeland.com>, 2020-09-04 20:27:40 -0600, , chore bump version 0.19.1,,
345,833ebb81127c240e09cbe6367ebaf335ce0a0ef4,errit Birkeland <gerrit@gerritbirkeland.com>, 2020-09-04 20:27:04 -0600, , feat introduce support 3.9 close 1362 authored constantine dergachev 13132449 dergash,,
346,36aeac61afd82f16203c484f0b6f3f0efb13a035,errit Birkeland <gerrit@gerritbirkeland.com>, 2020-08-28 11:57:26 -0600, , chore bump version 0.19.0,,
347,3caf7b7815180778e1c2cda6b3b9ea7e96f71727,errit Birkeland <gerrit@gerritbirkeland.com>, 2020-08-28 11:55:37 -0600, , chore fix lint,,
348,afb10a96a7a1b18174585612ee7fabcf668ac8ea,errit Birkeland <gerrit@gerritbirkeland.com>, 2020-08-28 11:54:39 -0600, , chore rebuild variable test changed symbol discovered get doc,,
349,3a8560c7ab5034dbd5ac516468f194768f9d34e7,errit Birkeland <gerrit@gerritbirkeland.com>, 2020-08-28 11:51:07 -0600,1357, feat support named tuples close 1357,,
350,e1364695db03f503ab38f2dd55ac6e1d77f2f60d,errit Birkeland <gerrit@gerritbirkeland.com>, 2020-08-28 11:40:52 -0600,1357, feat upgrade 4.0 partial fix 1357,,
351,71d838ad32c90831ee7ab32c6e9de74da0c2ebf0,errit Birkeland <gerrit@gerritbirkeland.com>, 2020-08-28 11:14:48 -0600,1329, fix check missing declaration close 1329,,
352,3ed4b79fa5270367f79e3281bc99614ca960301a,errit Birkeland <gerrit@gerritbirkeland.com>, 2020-08-28 11:13:46 -0600, , chore upgrade dependency,,
353,a6e5da9dc1d7d704e4d6f71fe3fc6cd64f465711,errit Birkeland <gerrit@gerritbirkeland.com>, 2020-08-28 10:04:16 -0600, , chore rebuild verify variable spec fix lint,,
354,b3c77314d1bc6abe3f807bc4ea1cd4f5d370cc85,errit Birkeland <gerrit@gerritbirkeland.com>, 2020-08-28 09:50:13 -0600,1346, fix add converter parenthesized type node close 1346,,
355,6e0661c3523e287c7251fb0ea1ae90156a53ff99,ric ZHANG <11440841+ericzhangjx@users.noreply.github.com>, 2020-08-26 00:56:18 +0800, , chore add rebuild test type operator,,
356,a1ac23c7897cb27e9f9e7f04727c870963eee870,ric ZHANG <11440841+ericzhangjx@users.noreply.github.com>, 2020-08-26 00:50:16 +0800, , fix support type operator readonly unique,,
357,f67f8dba4f4543e164521ef9e9a694eb99ff56ae,risztiÃ¡n Balla <k.balla@gmx.at>, 2020-08-23 22:55:47 +0200, , feat support defaulted type parameter reflect template parameter default value use type argument 1348,,
358,96ede6a43f95bf73e9b3786c7aa46846020850ee,athBunny <horatiulazu@gmail.com>, 2020-08-22 23:05:27 -0400, , fix address typo log statement,,
359,5b3e56b1c1c3382392e1b76aabf664b10bfbd462,errit Birkeland <gerrit@gerritbirkeland.com>, 2020-08-08 18:44:10 -0600, , chore bump version 0.18.0,,
360,14eb245e238f0ec466d25c8e1d2aa11927e0f4e8,errit Birkeland <gerrit@gerritbirkeland.com>, 2020-08-08 18:43:06 -0600,2648, chore upgrade dependency exception highlight.js blocked http github.com highlightjs highlight.js issue 2648,,
361,cce8bf620e3df50e90a05328c360bd2e905d746c,errit Birkeland <gerrit@gerritbirkeland.com>, 2020-08-08 18:16:18 -0600, , merge remote tracking branch origin fix 1263,,
362,2f8d295882c280186d7353406b62b5a0bc36511c,errit Birkeland <gerrit@gerritbirkeland.com>, 2020-08-08 18:03:59 -0600, , breaking change bump minimum node version,,
363,a0a8f1423f279ba0bff401953a11c6b16dd424b2,ependabot[bot] <49699333+dependabot[bot]@users.noreply.github.com>, 2020-07-16 00:21:38 +0000, , chore deps bump lodash 4.17.15 4.17.19 bump lodash http github.com lodash lodash 4.17.15 4.17.19 release note http github.com lodash lodash release commits http github.com lodash lodash compare 4.17.15 ... 4.17.19 signed dependabot bot support github.com,,
364,021261c8be707f4bba83f46950a74a7dda4d4c05,errit Birkeland <gerrit@gerritbirkeland.com>, 2020-07-17 10:24:14 -0600, , chore fix lint,,
365,23482c5a273f20e02697e6bb1beec9bd729d08e1,errit Birkeland <gerrit@gerritbirkeland.com>, 2020-07-04 11:49:26 -0600, , chore rebuild renderer test,,
366,7fc721cd2333d70677837e97ca9ef4a3c134ab0e,errit Birkeland <gerrit@gerritbirkeland.com>, 2020-07-04 10:08:45 -0600,1330, fix improve support type alias fix 1330,,
367,f582eb38a64ea2e728e1f13c7c7822a97b3aeea8,randon Istenes <brandonesbox@gmail.com>, 2020-06-29 20:12:11 -0700, , fix example run 1327,,
368,ea1cdcba26538295200c6b9d959c6aadd8b81102,errit Birkeland <gerrit@gerritbirkeland.com>, 2020-06-28 19:25:45 -0600, , chore fix invalid renderer test failure,,
369,82a7e76ece972fcdaf46c0e6d0b6df8e8c5656e5,errit Birkeland <gerrit@gerritbirkeland.com>, 2020-06-28 19:21:09 -0600, , chore update rendered spec,,
370,471d36eabebb4a406b77778e220d29d2c46f361a,errit Birkeland <gerrit@gerritbirkeland.com>, 2020-06-28 19:19:22 -0600, , chore bump version 0.17.8,,
371,7b542888f9c0c9a4ce0c7488b2e8f534b7448368,errit Birkeland <gerrit@gerritbirkeland.com>, 2020-06-28 19:06:39 -0600, , merge branch master http github.com typestrong typedoc,,
372,c7eabf7ae4169aefa2ee600895f35609d624bf7a,heBrokenRail <17478432+TheBrokenRail@users.noreply.github.com>, 2020-06-28 21:01:31 -0400,1294, fix use baseurl determine file path 1313 fix 1294 update update sourceplugin.ts,,
373,d704709054c3a93417a5d2c50b1d9da34cb094a4,errit Birkeland <gerrit@gerritbirkeland.com>, 2020-06-28 16:30:18 -0600, , fix support close 1323,,
374,e553af27f10bd381e9442a521708e8b680ea7e45,ickolay Platonov <nickolay8@gmail.com>, 2020-06-29 00:53:37 +0300, , fix ignore property object type literal 1308,,
375,30fab7a9f0c4403eecaad571d89f9f948beded12,hris Thielen <cthielen@netflix.com>, 2020-06-04 09:53:45 -0700, , fix githubplugin read correct remote multiple github repos exist,,
376,48090b7bed7399cedc3ff0cd210f3d027ae5493c,errit Birkeland <gerrit@gerritbirkeland.com>, 2020-05-17 12:14:46 -0600, , chore add note,,
377,9118a5ca611a040112554998b40976430396ae58,errit Birkeland <gerrit@gerritbirkeland.com>, 2020-05-16 21:49:12 -0600, , chore bump version 0.17.7,,
378,9b586db354e582d612b5ab6ee8151dbca494ccad,tephan Bijzitter <StephanBijzitter@gmail.com>, 2020-05-17 05:33:02 +0200,787, fix copy inherited parameter description 1303 original change kayahr http github.com typestrong typedoc pull 788 deleted pull request could merged fix 787,,
379,8edb17c5bf08f6306664ce16d3123605bef9c2b3,errit Birkeland <gerrit@gerritbirkeland.com>, 2020-05-16 20:30:23 -0600,1300, fix typedoc fails resolve type package outside cwd close 1300,,
380,935e10a469a54282ee79911f1a82eddccef7739a,errit Birkeland <gerrit@gerritbirkeland.com>, 2020-05-15 16:19:51 -0600,1302, fix trim whitespace parsing link close 1302,,
381,0708fb821751e18395db1a82a3f8f1ddbce357e7,artin <7252614+Lhoerion@users.noreply.github.com>, 2020-05-15 22:46:44 +0200, , chore fix minimatch pattern error test window 1304,,
382,4fed0bd3098794cf909766bb0b8f13f4cd9b711f,artin <7252614+Lhoerion@users.noreply.github.com>, 2020-05-15 19:18:04 +0200,1284, fix module declaration parsed namespace 1301 close 1284,,
383,f93c76bbfd72dfb5c542896c86d1cb1e4620d82b,risztiÃ¡n Balla <k.balla@gmx.at>, 2020-05-15 19:16:59 +0200,1291, feat allow every possible number defaultvalue number option 1296 close 1291,,
384,bc20444c6b92f6d5946875a066f277346a7e437b,errit Birkeland <gerrit@gerritbirkeland.com>, 2020-04-26 19:07:29 -0600, , chore bump version 0.17.6,,
385,3b081de4ef2ed96bcb6a3805ef6316389e837fcc,errit Birkeland <gerrit@gerritbirkeland.com>, 2020-04-26 19:07:01 -0600, , fix correct prepublish script,,
386,b2a5421757fde89c07499b73a86be0612d996e97,errit Birkeland <gerrit@gerritbirkeland.com>, 2020-04-26 10:39:36 -0600, , chore bump version 0.17.5,,
387,8fb125837506ac9b1bfa538bef44802e8e6ee719,risztiÃ¡n Balla <k.balla@gmx.at>, 2020-04-26 18:32:54 +0200, , chore fixed test map declaration type 1282 fixed test map declaration foreign default value,,
388,829f147334e5cf12fdddceb1111ccab5e151913a,errit Birkeland <gerrit@gerritbirkeland.com>, 2020-04-25 18:40:00 -0600, , chore fix lint,,
389,d222fb6ca8dff89e8433febee6d0d0210b4701db,errit Birkeland <gerrit@gerritbirkeland.com>, 2020-04-25 17:46:56 -0600, , chore upgrade dependency,,
390,8708143422f5efdb9a1aae6beb97fecfe15c9e1e,errit Birkeland <gerrit@gerritbirkeland.com>, 2020-04-25 17:24:01 -0600, , merge branch library mode,,
391,b03a13bb170c4a829735c3de48d4aa2a0f2f6beb,errit Birkeland <gerrit@gerritbirkeland.com>, 2020-04-25 17:10:38 -0600, , chore fix typo bound check,,
392,42de2af2c46e92e47d85115d597a60e91600bab9,risztiÃ¡n Balla <k.balla@gmx.at>, 2020-04-26 00:47:23 +0200, , feat number option may require min max value 1278,,
393,4067f2c838255c4d8cba13bb743172b9f4c2a978,ickolay Platonov <nickolay8@gmail.com>, 2020-04-25 21:10:29 +0300, , fix silently swallow missing include medium file error 1277,,
394,d5c2d4779356fc34b3af5257546e59ef20538c9d,illiam Johnes <57451877+WilliamJns@users.noreply.github.com>, 2020-04-25 22:20:21 +0430,1272, fix fix extends option tsconfig.json work 1273 clone typedoc option object loading file content close 1272,,
395,91644a9ac0c6b737d0e1e2ba64cc8650b967be4d,artin <7252614+Lhoerion@users.noreply.github.com>, 2020-04-21 01:31:59 +0200, , feat add detecting read property 1268,,
396,8c2b698d8639e9239da31fa7191d4e5138d30716,adics Laszlo <garaboncias@gmail.com>, 2020-04-21 01:30:48 +0200, , fix improve output object computed property name 1275 authored laszlo radics laszlo.radics labcup.net,,
397,262a89cd486dcb026e8972e7f77175a8730fc7b6,errit Birkeland <gerrit@gerritbirkeland.com>, 2020-04-12 11:35:33 -0600,1238, feat remove result object close 1238,,
398,b8709051e13ea5d1d40477fd5b1ff0fdd933bb9f,errit Birkeland <gerrit@gerritbirkeland.com>, 2020-03-22 13:16:33 -0600, , fix enable lax overload release,,
399,4decfbe209ccb4aeee6800b4bfb9bbbd51c3efcf,errit Birkeland <gerrit@gerritbirkeland.com>, 2020-04-11 20:39:27 -0600, , chore fix lint,,
400,5878278a2dcff02020fc646b1768b91459291224,errit Birkeland <gerrit@gerritbirkeland.com>, 2020-04-11 20:35:42 -0600,1263, fix set inputfiles tsconfig already set fix always false passed non literal close 1263,,
401,2f38fc52604e0f82c71fdc4ff5b686aa97262f45,errit Birkeland <gerrit@gerritbirkeland.com>, 2020-04-05 20:36:50 -0600, , chore bump version 0.17.4,,
402,532a621a1c09426d2a28fc531df9b653e555a2c2,errit Birkeland <gerrit@gerritbirkeland.com>, 2020-04-05 20:20:18 -0600,1236, chore update issue template close 1236,,
403,d3af643a62189bc7c6f3fe69d7ffd41666cd0f30,errit Birkeland <gerrit@gerritbirkeland.com>, 2020-04-05 19:15:35 -0600,1242, chore upgrade dependency close 1242,,
404,c73eaafbd6d07939a17f92b75519d362be1f3066,ergei Grishchenko <s.i.grishchenko@gmail.com>, 2020-04-05 23:03:59 +0300, , feat generate search index rendering theme 1252 generate json file index search serialize search index lunr authored sgrishchenko sgrishchenko spotware.com,,
405,c296503168f0be99def81eabdeb47d210b078304,risztiÃ¡n Balla <k.balla@gmx.at>, 2020-03-29 21:36:13 +0200, , fix option map type option default value validated 1250 need convert defaultvalue option type map added test map declaration option foreign default value,,
406,2e63096dd34be61bfbd2062a0ac75796e55a037d,errit Birkeland <gerrit@gerritbirkeland.com>, 2020-03-21 22:41:07 -0600, , chore bump version 0.17.3,,
407,f629446c389dab713483f80c1dabf80528119678,errit Birkeland <gerrit@gerritbirkeland.com>, 2020-03-21 22:21:43 -0600, , chore rebuild spec,,
408,96ba7f95cdca3a13922dcbf7f99f3e96b91aca55,errit Birkeland <gerrit@gerritbirkeland.com>, 2020-03-21 22:13:23 -0600, , chore upgrade theme dependency,,
409,2983acfe5e5e1dab3b2462e745621436940ed57a,errit Birkeland <gerrit@gerritbirkeland.com>, 2020-03-21 21:10:44 -0600, , fix empty legend page,,
410,66eba4aceb9c36204a25355d454eb16b944dc74d,errit Birkeland <gerrit@gerritbirkeland.com>, 2020-03-21 16:32:02 -0600, , chore bump version 0.17.2,,
411,799445679d3232b907aa56104ac828ddc1575588,errit Birkeland <gerrit@gerritbirkeland.com>, 2020-03-21 16:28:51 -0600,1240, fix pin marked 0.8.0 tracking marked 1621 unpin close 1240,,
412,688d89dc06dbc494244d9cd1118169f7697f793e,errit Birkeland <gerrit@gerritbirkeland.com>, 2020-03-17 21:59:07 -0600, , chore upgrade deps bump version 0.17.1,,
413,a2e4db13b62c562b3b60b1c3bf8c7708a069b623,errit Birkeland <gerrit@gerritbirkeland.com>, 2020-03-17 21:48:25 -0600,1237, fix report error setting bad option cli close 1237,,
414,508f8bafb1ae6266f15869180f8e56317ebbeddc,errit Birkeland <gerrit@gerritbirkeland.com>, 2020-03-17 20:46:00 -0600, , chore add warning deprecated usage,,
415,19c65c34f4ca2be147d17e82ce96d7de20225809,errit Birkeland <gerrit@gerritbirkeland.com>, 2020-03-17 20:42:02 -0600, , chore remove deprecated option decorator,,
416,593316817460d5ef1132f551a1877308fe304fe8,errit Birkeland <gerrit@gerritbirkeland.com>, 2020-03-15 16:59:40 -0600, , chore bump version 0.17,,
417,29965344adf964944003e49fa2f2608bb88cf880,errit Birkeland <gerrit@gerritbirkeland.com>, 2020-03-15 16:57:12 -0600, , fix missed test configuration update,,
418,c015fd9eb956394aabb3009ce16671b7b7f11437,errit Birkeland <gerrit@gerritbirkeland.com>, 2020-03-15 16:42:16 -0600,860, feat support template close 860,,
419,0e6ff69135fd08526cd5309ce591a64060255ac5,errit Birkeland <gerrit@gerritbirkeland.com>, 2020-03-15 16:32:24 -0600,1183, chore disable source test partially resolve 1183,,
420,295ccdd892d344dc373bfe17f3948c5f16587a70,errit Birkeland <gerrit@gerritbirkeland.com>, 2020-03-15 16:23:00 -0600,109, fix rename external module module close 109 breaking change plugins referenced need updated reference respectively,,
421,5d41a2e03a4cefa29ae84e7f9ef409d976d4ac56,errit Birkeland <gerrit@gerritbirkeland.com>, 2020-03-15 16:06:23 -0600, , feat support private field,,
422,49b1c4fbfb81f8fdba7518520f28804f9d1e4655,errit Birkeland <gerrit@gerritbirkeland.com>, 2020-01-18 16:36:00 -0700,880, feat move typescript peer dependency close 880,,
423,3dadcde3a4f4caec01e2676cacfb3149efef5183,errit Birkeland <gerrit@gerritbirkeland.com>, 2020-01-19 16:59:15 -0700,808, feat support disabling source close 808,,
424,802c40841793f1d4090bf0916a21eb026a4231f9,errit Birkeland <gerrit@gerritbirkeland.com>, 2020-01-23 22:41:53 -0700, , fix check compiler error converting,,
425,5cbd44d300150c8f2d62f9a9e2b7c7688945a2f1,errit Birkeland <gerrit@gerritbirkeland.com>, 2020-01-19 17:53:59 -0700,1130, feat allow user set git remote fix 1130,,
426,c82831906cb5287f62316c75a0fee0737343d9dd,errit Birkeland <gerrit@gerritbirkeland.com>, 2020-03-15 13:41:30 -0600, , chore update theme rebuild spec,,
427,923c55dd9d44c14d019a5184edac3dcb440823cb,oc Sieng <socsieng@users.noreply.github.com>, 2020-03-15 11:25:22 -0700,1136, feat generate legend item displayed page 1187 close 1136,,
428,592e0b34e3758b00b6f846d05d479a52f8b6f4db,lexander Cerutti <alexandercerutti@users.noreply.github.com>, 2020-03-15 19:06:35 +0100, , fix moved type minimatch dependency devdepencencies 1206 breaking change createminimatch longer public function,,
429,13f4debd6395ff34025061abdb06f70bfd8aef84,oc Sieng <socsieng@users.noreply.github.com>, 2020-03-15 11:05:09 -0700,1188, fix plugin resolution relative path 1194 resolve plugin module relative current path instead internal path fix 1188,,
430,02e6a0eb0245b8065c827ef51a19f62e90e274a7,ickolay Platonov <nickolay8@gmail.com>, 2020-03-15 20:29:56 +0300, , chore update readme added 1228,,
431,c19b1d9d9abe3cf8d2cf3085923b54fb5cc72860,errit Birkeland <gerrit@gerritbirkeland.com>, 2020-02-27 21:38:57 -0700, , chore bump version 0.16.11,,
432,148bd1269a9b71f85176a00e1a312ca09ad16079,errit Birkeland <gerrit@gerritbirkeland.com>, 2020-02-27 21:18:59 -0700, , fix support code block four space close 1218,,
433,1ec2fb81036d799d512b21b347aba148a47daebd,mily Marigold Klassen <forivall@gmail.com>, 2020-02-27 20:07:08 -0800, , feat add support inside marked link bracket 1091,,
434,07fb1ce879bfcbea0c3d75e2b1a1dee8575c15ae,errit Birkeland <gerrit@gerritbirkeland.com>, 2020-02-27 20:40:56 -0700,1115, feat support extended config typedoc.json close 493 close 1115 authored richie bendall richiebendall gmail.com,,
435,20db9a5b7ce0170fb80a5183069bbceb7e348632,ickolay Platonov <nickolay8@gmail.com>, 2020-02-28 07:03:32 +0300,995, feat config option exclude explicitly documented symbol 996 close 995,,
436,541fbcf93fedc499fee9579ad044b2fc67e3cfac,dam Epling <adamepling@gmail.com>, 2020-02-27 20:38:06 -0600, , fix ensure child comment tag get set 1221 add comment array reflection object fixed issue commentplugin comment always entirely copied signature fixed commentplugin issue tag always copied child comment inside signature also updated test spec match expected output output see tag defined comment test fat arrow function,,
437,796349a442cf02a3d0b5a62a8ef646ce4f3e2663,háº£i <hvksmr1996@gmail.com>, 2020-02-23 09:47:22 +0700,1213, fix export typescript namespace 1217 close 1213,,
438,c4ce9a58aad070b9282f1e2c0a5796df38074cb7,obin Stevens <robin.stevens@scz.be>, 2020-02-22 21:27:17 +0100, , fix logger extension also count warning 1210 believe messed previous http github.com typestrong typedoc pull 1205 extension logger class count warning solved removing error counting code child class called super method instead ensures error count warning count increase,,
439,0399e752a332d58e687baa7f5d7c46abb31addf6,errit Birkeland <gerrit@gerritbirkeland.com>, 2020-02-15 21:58:43 -0700, , chore bump version 0.16.10 also cleaned package.json entry longer apply,,
440,bc02096982bc221cf7352db4e1fdc0bf20803c89,errit Birkeland <gerrit@gerritbirkeland.com>, 2020-02-15 21:30:16 -0700,815, feat allow excluding tag comment close 815,,
441,429b3a901ab5fbf35f199d234c40afeed7907956,errit Birkeland <gerrit@gerritbirkeland.com>, 2020-02-15 20:41:40 -0700,1198, fix remove tag containing redundant type info close 1198,,
442,eefdb2c588f378ebea2abc11903d66af3b24e908,errit Birkeland <gerrit@gerritbirkeland.com>, 2020-02-15 20:36:33 -0700,1001, fix remove brace containing tag close 1001 authored raynor chen capraynor,,
443,91cfa1ba99d942c8c7d8c8ae7e8440f753fbe15b,ack Slayton <zack.slayton@gmail.com>, 2020-02-15 18:52:35 -0500, , fix mixin symbol might declaration 1208 fix avoid iterating undefined array chore fix lint add note weirdness authored gerrit birkeland gerrit,,
444,c75df1c6a0d19aca71946a732ed834b43e69a761,obin Stevens <robin.stevens@scz.be>, 2020-02-15 21:22:30 +0100, , feat logger count warning 1205 want make build fail error message currently  const result project output_dir result console.log error logged generation documentation check log information process.exit   however warning message typically indicate problem well want make build fail well need custom logger keep track warning message make easier counting warning message similar fashion error message,,
445,61a454285c19016ff59e20376e9faad809f8a8c6,errit Birkeland <gerrit@gerritbirkeland.com>, 2020-01-25 15:04:51 -0700, , chore bump version 0.16.9,,
446,00a6816dabf370f5ce9556b426a9e59ab7132ea2,nton Golub <mailbox@antongolub.ru>, 2020-01-25 17:20:39 +0300, , fix use util.readfile everywhere handle bom issue,,
447,49035b8235675a259bc9831bc9255465638747bb,errit Birkeland <gerrit@gerritbirkeland.com>, 2020-01-21 10:46:46 -0700, , chore bump version 0.16.8,,
