id,sha,author,date,issue,message,file,content
0,8f6992a5e418654ae0353641e5024fa65385d6e5,acques Favreau <betaorbust@users.noreply.github.com>, 2021-07-16 06:23:38 -0700,1628, feat support node v12.10 1632 lower 12.10 would require refactoring src lib utils fs.ts use something fs.rmdir recursive true introduced 12.10 http nodejs.org doc latest v12.x api fs.html close 1628,,
1,8ff7d32dc31dccd26b42d96ba4bebb5b430867f4,errit Birkeland <gerrit@gerritbirkeland.com>, 2021-07-11 19:18:32 -0600, , chore bump version 0.21.4,,
2,5dfe9de5d3befeabec0e0d349f4325bb4bf09d81,errit Birkeland <gerrit@gerritbirkeland.com>, 2021-07-11 19:14:51 -0600,1626, fix constructor source information set resolve 1626,,
3,030cb1ee4d0169471cb350b1044c84356789db6f,errit Birkeland <gerrit@gerritbirkeland.com>, 2021-07-10 14:14:18 -0600, , chore fix changelog generation release,,
4,de32c1c3103c886c4ba41e4277a2a148c135b1a7,errit Birkeland <gerrit@gerritbirkeland.com>, 2021-07-10 13:43:59 -0600, , chore bump version 0.21.3,,
5,98331b5b1a0248753b98c895d1b2168c31e3cee7,errit Birkeland <gerrit@gerritbirkeland.com>, 2021-07-10 13:24:03 -0600,1624, fix improve detection property method convert method resolve 1624,,
6,5fd7f87383c9dd664fd5f77aff29fbf05330d555,errit Birkeland <gerrit@gerritbirkeland.com>, 2021-07-05 18:37:30 -0600, , refactor seal freeze,,
7,8e097efdea3cda1b1f27467199a5ea5d690943f4,errit Birkeland <gerrit@gerritbirkeland.com>, 2021-07-05 11:27:03 -0600, , refactor turn compiler option,,
8,f3294cdd2a024456ac41626616bfc6dc5f9e6b85,errit Birkeland <gerrit@gerritbirkeland.com>, 2021-07-05 11:10:28 -0600, , breaking change option may set conversion start enables small perf improvement,,
9,b04b3b0ac04c0caa717b390df94d69c8c4b7a5e1,errit Birkeland <gerrit@gerritbirkeland.com>, 2021-07-05 10:24:39 -0600, , chore remove lodash wanting ... finally got around,,
10,3c5ae51c2a6d8b165479762ba6a077ebb568d651,errit Birkeland <gerrit@gerritbirkeland.com>, 2021-07-04 08:18:32 -0600, , chore warn people away example folder,,
11,3f30c35f35ab04761a0ca444a1f3aa72842d4ce1,errit Birkeland <gerrit@gerritbirkeland.com>, 2021-07-04 08:13:21 -0600, , chore remove issue template open blank issue link make redundant,,
12,f292cd766334d97bfc3656cc248c3f5efac33723,errit Birkeland <gerrit@gerritbirkeland.com>, 2021-07-04 08:12:22 -0600, , chore fix typo,,
13,6fbd39add6d9f28053b8cad0f52d5c802b63ec5a,errit Birkeland <gerrit@gerritbirkeland.com>, 2021-07-04 08:11:49 -0600, , chore add question issue template,,
14,85c8b272a04fb4b526ea0515a5b1f81979d0df48,errit Birkeland <gerrit@gerritbirkeland.com>, 2021-06-27 12:30:04 -0600, , chore rebuild spec,,
15,f9092814e83e42ca674e48cb065ffa23fa10e7fe,errit Birkeland <gerrit@gerritbirkeland.com>, 2021-06-27 12:12:47 -0600,1585, fix two member differing case produced broken link resolve 1585 authored andrew bradley cspotcode gmail.com,,
16,9be9e36aa5e1bc122c72298e505e04f78ea2537a,errit Birkeland <gerrit@gerritbirkeland.com>, 2021-06-27 12:06:42 -0600, , fix resolve memory leak starting investigate 1599. appears almost completely fix issue outputting json believe handlebar cache blame majority remaining leak,,
17,bb44819de91b75263d38368ed9b02660460afe00,errit Birkeland <gerrit@gerritbirkeland.com>, 2021-06-26 20:37:41 -0600, , chore always run changelog script correct dir,,
18,bb0f8070433acafe08d2a586561a7609246bac9d,errit Birkeland <gerrit@gerritbirkeland.com>, 2021-06-26 20:33:36 -0600, , chore swap order args,,
19,3bb91c2589d4cd758f417be88f28636eab2a2412,errit Birkeland <gerrit@gerritbirkeland.com>, 2021-06-26 20:31:49 -0600, , chore bump version 0.21.2,,
20,4f82c832cb5f42bbdef75e0ee9abec72b6ad1570,errit Birkeland <gerrit@gerritbirkeland.com>, 2021-06-26 20:25:51 -0600, , chore refactor script,,
21,fc920bd22dc13282bf1b09cda2dd05e400d06e2e,errit Birkeland <gerrit@gerritbirkeland.com>, 2021-06-26 17:30:10 -0600,1580, fix postpone resolution inherited class parent resolved actually fix 1580 time,,
22,12236f3086ae2ea70f9e5c27a22b8724611b5566,errit Birkeland <gerrit@gerritbirkeland.com>, 2021-06-24 21:17:39 -0600, , chore rebuild spec,,
23,18a55576736cb5816763c5ba72dd021c9ee95780,errit Birkeland <gerrit@gerritbirkeland.com>, 2021-06-24 21:16:19 -0600, , chore bump version 0.21.1,,
24,8a5a933ecce8f79679415a11ddd66ae2c5d682c4,errit Birkeland <gerrit@gerritbirkeland.com>, 2021-06-24 21:06:47 -0600,1607, fix exclude empty module documentation close 1607,,
25,da27756d9c08b2353e375523a9cf93a5496c9fc7,errit Birkeland <gerrit@gerritbirkeland.com>, 2021-06-24 20:18:10 -0600,1608, fix readme could set none config file close 1608,,
26,bf79e32f32b107673b779fdc5257439dddeacfaf,errit Birkeland <gerrit@gerritbirkeland.com>, 2021-06-24 20:05:11 -0600,1610, fix correctly handle minimatch excludes window close 1610,,
27,bde0b6af7c7708c2cdb476981253ad3a14b815af,errit Birkeland <gerrit@gerritbirkeland.com>, 2021-06-17 20:41:57 -0600, , chore bump version 0.21.0,,
28,83a7eefa5830d5fb5687d6f5666f7f60bfae5ddb,errit Birkeland <gerrit@gerritbirkeland.com>, 2021-06-17 20:40:54 -0600, , chore sort thanks changelog,,
29,371e0356b7fc94336d733f420f31b520491f0d8c,errit Birkeland <gerrit@gerritbirkeland.com>, 2021-06-17 19:42:09 -0600, , chore upgrade dependency,,
30,a618f209f4b5b073d82e2daf42e06842a9bb1557,errit Birkeland <gerrit@gerritbirkeland.com>, 2021-06-17 19:40:11 -0600, , merge remote tracking branch origin master beta,,
31,6b69252e67f6087917b3cefab7127e469e35bc1c,errit Birkeland <gerrit@gerritbirkeland.com>, 2021-06-16 17:40:00 -0600, , chore bump version 0.20.37,,
32,0e8d4291f71b2a3ff423a73b2082ee18fb97ccaa,ick <handnf@gmail.com>, 2021-06-16 19:38:58 -0400,1601, fix pin marked dependency 2.0.x 1602 allows installation complete successfully node 10.8.0 fix 1601,,
33,90cd4a05af0c6e48d841f52f346c64e265b76b0a,errit Birkeland <gerrit@gerritbirkeland.com>, 2021-06-15 20:31:51 -0600, , chore bump version 0.21.0 beta.4,,
34,6789331de43f52cac561e68282b8b608828ab54c,errit Birkeland <gerrit@gerritbirkeland.com>, 2021-06-15 20:31:26 -0600, , chore remove outdated note readme,,
35,1b1cd140828be02cbcac6214ade7448beb1e0eee,errit Birkeland <gerrit@gerritbirkeland.com>, 2021-06-14 22:30:39 -0600, , fix correctly handle comment function type alias resolve 799,,
36,1dc56591b9b230c95c57b07c4679616299f2323e,errit Birkeland <gerrit@gerritbirkeland.com>, 2021-06-14 21:44:56 -0600,1215, fix setter always void return type close 1215,,
37,d9e66b29906680bbb6e1e6b361945b5aa84ceb44,errit Birkeland <gerrit@gerritbirkeland.com>, 2021-06-14 21:15:50 -0600, , chore bump version 0.21.0 beta.3,,
38,3f39508e681bbd887235ac4a942e83f441fc1bde,errit Birkeland <gerrit@gerritbirkeland.com>, 2021-06-14 21:13:38 -0600,1442, fix resolve path option file according config directory fix 1598 fix 1442,,
39,858b2313cd312d33f8e005d605fe33da426333ae,errit Birkeland <gerrit@gerritbirkeland.com>, 2021-06-13 10:49:42 -0600, , chore refactor test reduce runtime,,
40,ec18bb0ee3ab62a693707e9a6ec4cdbc0abd2cec,errit Birkeland <gerrit@gerritbirkeland.com>, 2021-06-13 10:33:14 -0600, , revert feat add disablealiases option 1576 reverts commit,,
41,6d215dffa42e23e4182945d938fd3be261351c61,artin <7252614+Lhoerion@users.noreply.github.com>, 2021-06-13 18:20:48 +0200, , feat improve monorepos adding support entry point 1596,,
42,f95e456e8fd6cc15815045640d08f48f43ea3c65,errit Birkeland <gerrit@gerritbirkeland.com>, 2021-06-06 11:36:41 -0600, , chore bump version 0.21.0 beta.2,,
43,e142f00d54b7018c5f5bed9f8520132d6908fbeb,errit Birkeland <gerrit@gerritbirkeland.com>, 2021-06-06 11:27:18 -0600, , chore fix lint,,
44,9f56423f740176bdb41a8e5f9731ae0a361757bc,errit Birkeland <gerrit@gerritbirkeland.com>, 2021-06-06 11:20:12 -0600, , chore fix lint,,
45,269cf081f9318acf437caf4489cf26f767de1ce0,errit Birkeland <gerrit@gerritbirkeland.com>, 2021-06-06 11:03:26 -0600, , chore move package test repo,,
46,15c05527805e12f8615811c81ddcc1a2ad81b58b,errit Birkeland <gerrit@gerritbirkeland.com>, 2021-06-05 10:35:24 -0600, , feat support monorepos based npm yarn workspace introducing package option authored efokschaner eddyaod gmail.com,,
47,2c2b91bb6e642c3e7d00c431394996af943d2d85,errit Birkeland <gerrit@gerritbirkeland.com>, 2021-06-05 10:14:27 -0600, , chore bump beta version,,
48,9e94e5cbbca546e96e7b25a9c0bdb9bb3e3ba210,errit Birkeland <gerrit@gerritbirkeland.com>, 2021-06-05 10:14:10 -0600, , chore fix test compiling strict false,,
49,b2165d3659e3dd63b89f9356b7e8b54c341a907b,errit Birkeland <gerrit@gerritbirkeland.com>, 2021-06-05 10:08:58 -0600, , chore upgrade beta version,,
50,5a6a125ad5e148e18930304de9faf1df1112a562,errit Birkeland <gerrit@gerritbirkeland.com>, 2021-06-05 10:06:08 -0600, , chore upgrade prettier,,
51,432008c8dbda7ea8c6b9115f0302843593f54911,errit Birkeland <gerrit@gerritbirkeland.com>, 2021-06-05 10:04:27 -0600, , feat support typescript 4.3,,
52,ec17e837b9decf7e754955f6975f0998e82bcb81,errit Birkeland <gerrit@gerritbirkeland.com>, 2021-06-02 21:02:59 -0600, , chore fix circular dependency,,
53,700d4130daabc127a72cf92f0f77a514e340290d,errit Birkeland <gerrit@gerritbirkeland.com>, 2021-05-31 21:00:09 -0600,1255, fix pick doc comment property declared within class constructor resolve 1255,,
54,e1254843bcd34202d7277ef0e311b56cf9db869d,errit Birkeland <gerrit@gerritbirkeland.com>, 2021-05-31 20:25:56 -0600,112, feat add support sorting reflection based user criterion resolve 112,,
55,d5bb930c880e5a6fa0e2903fc4dec6edfc865333,errit Birkeland <gerrit@gerritbirkeland.com>, 2021-05-14 21:52:05 -0600,1580, fix inherit comment parent method resolve 1580,,
56,e9d59599f2a5c4c06210a75c7063b95d4634d07d,errit Birkeland <gerrit@gerritbirkeland.com>, 2021-05-01 14:47:08 -0600, , chore fix beta publish script,,
57,5d581b0c2d6abdab3aede4c46e33da4f12c1e467,errit Birkeland <gerrit@gerritbirkeland.com>, 2021-05-01 14:45:32 -0600, , fix correct handling intentionally broken reference,,
58,ce6aac23bf1a6b935c688d76a76524e70e07d891,errit Birkeland <gerrit@gerritbirkeland.com>, 2021-05-01 14:36:51 -0600, , chore bump version 0.21.0 beta.1,,
59,4aad444e7995719f2988346e0e1bc6a836f48c20,errit Birkeland <gerrit@gerritbirkeland.com>, 2021-05-01 14:35:02 -0600, , fix inheritance multiple partial type incorrectly converted resolve 1579,,
60,58f1bac81b594123a3ed0fdb5d970f276d8ada9a,errit Birkeland <gerrit@gerritbirkeland.com>, 2021-05-01 11:44:49 -0600,1568, feat add option resolve 1568,,
61,bb5a5ae4c538f9359c7bf428d344b6769bf36641,errit Birkeland <gerrit@gerritbirkeland.com>, 2021-05-01 11:19:32 -0600, , feat exclude option remove symbol exported excluded file resolve 1578,,
62,dc8416a83f1dfbc35a1c26788b344c3876eb8196,errit Birkeland <gerrit@gerritbirkeland.com>, 2021-05-01 11:09:37 -0600, , breaking change drop support node v10 longer supported lts release finally,,
63,22df5746dc8bf7df0a26ff47e1f1d82737461f05,errit Birkeland <gerrit@gerritbirkeland.com>, 2021-05-01 11:00:25 -0600, , breaking change plugins passed application directly remove tech debt dropping one component decorator instance,,
64,4c3ba35601982f951f3867aefde3cda675029bde,errit Birkeland <gerrit@gerritbirkeland.com>, 2021-05-01 10:35:42 -0600, , chore add autopublish beta version,,
65,5d455396d764f3ff4066b8fbe0c9767e30e03b56,errit Birkeland <gerrit@gerritbirkeland.com>, 2021-05-01 10:34:31 -0600, , breaking change drop support typescript 3.9 typedoc support latest two minor release make development easier,,
66,e1b4834fee1d7aa90654b34b501405ec2855f544,errit Birkeland <gerrit@gerritbirkeland.com>, 2021-05-01 10:25:36 -0600, , refactor remove shelljs color,,
67,5ffe73d734a8d276ae87e3b071ece7c6cca4f7a5,errit Birkeland <gerrit@gerritbirkeland.com>, 2021-05-01 10:21:35 -0600, , refactor remove extra,,
68,a446431a5233139b8d4daee08ea57fd6cabb9965,artin <7252614+Lhoerion@users.noreply.github.com>, 2021-04-24 22:44:32 +0200,1571, feat add disablealiases option 1576 resolve 1571,,
69,8aad0d5215ba5afd2125f56416182d47315b4147,errit Birkeland <gerrit@gerritbirkeland.com>, 2021-04-22 20:43:34 -0600, , chore bump version 0.20.36,,
70,72246b87cde41b7131a7d0771ea9439f53bb9d0d,errit Birkeland <gerrit@gerritbirkeland.com>, 2021-04-22 20:43:10 -0600, , chore upgrade dependency,,
71,dcbda43104f1a4e51d477e6b2d5206ed1d1c6a40,errit Birkeland <gerrit@gerritbirkeland.com>, 2021-04-22 20:38:18 -0600,1566, fix always write stdout even redirected resolve 1566,,
72,4817db464156c020bfc0d72ab65e1ac62eba6cff,errit Birkeland <gerrit@gerritbirkeland.com>, 2021-04-22 20:25:13 -0600,1571, fix create directory writing json output discovered 1571,,
73,05243055f8cfe8359be50b8121bfdbb8d738a6c4,Attte <26514199+cAttte@users.noreply.github.com>, 2021-04-10 12:53:38 -0300, , refactor access pretty option directly generatejson,,
74,d5930e0a676128a5f8969bbb46983d12d0265980,Attte <26514199+cAttte@users.noreply.github.com>, 2021-04-07 00:03:03 -0300, , feat use pretty option generating json,,
75,b3c856eadd8dc112b8d29003a028b9749fa06646,Attte <26514199+cAttte@users.noreply.github.com>, 2021-04-06 23:54:32 -0300, , feat create pretty option,,
76,2103f347c9cba40fcaa1f67e36f7cea0bdea2f0f,errit Birkeland <gerrit@gerritbirkeland.com>, 2021-04-03 14:07:12 -0600, , chore bump version 0.20.35,,
77,a90deee663c3113e320e41781d8167200693e659,asato Makino <unagiinu.g@gmail.com>, 2021-04-04 05:05:31 +0900, , feat include debugging information highlighting error message 1561,,
78,bff58164d182312791c754a60dacd1c2159f2147,errit Birkeland <gerrit@gerritbirkeland.com>, 2021-04-03 13:54:29 -0600,1552, fix relax simple expression requirement default value resolve 1552,,
79,d1a9bca8ecd0fa50f3a7f946ed73f2160a8118fd,errit Birkeland <gerrit@gerritbirkeland.com>, 2021-04-03 13:48:35 -0600,1564, fix handle private getters method improves support 4.3. test yet since support beta version officially resolve 1564,,
80,87c1ced7d66bf1be363325daa1ab98f005025cbd,ependabot[bot] <49699333+dependabot[bot]@users.noreply.github.com>, 2021-03-30 14:55:14 +0000, , chore deps bump y18n 4.0.0 4.0.1 bump y18n http github.com yargs y18n 4.0.0 4.0.1 release note http github.com yargs y18n release changelog http github.com yargs y18n blob master changelog.md commits http github.com yargs y18n commits signed dependabot bot support github.com,,
81,315bd2501360c9e3738c512a850f37cf314b8627,errit Birkeland <gerrit@gerritbirkeland.com>, 2021-03-28 20:18:14 -0600, , chore update doc converter2,,
82,a11a9292a48ec8064df4b8df804fe863ba163905,errit Birkeland <gerrit@gerritbirkeland.com>, 2021-03-28 20:16:01 -0600, , chore add converter2 test,,
83,53126c65eb895adc2a129628633ce827d8c0f7c9,errit Birkeland <gerrit@gerritbirkeland.com>, 2021-03-24 21:30:46 -0600, , chore bump version 0.20.34,,
84,02fe2a73048687288cb33d837ff685a4c6c1e2b4,errit Birkeland <gerrit@gerritbirkeland.com>, 2021-03-24 21:26:12 -0600,1547, fix crash converting recursive type alias resolve 1547,,
85,ce218e9bda960539066140cc346851b7bd0fe4dd,errit Birkeland <gerrit@gerritbirkeland.com>, 2021-03-24 21:09:58 -0600,1549, fix discover module comment global file resolve 1549,,
86,f0b9192e0c46d8f8c37488124d43721387050679,errit Birkeland <gerrit@gerritbirkeland.com>, 2021-03-24 20:05:45 -0600,1551, fix detect reference export used resolve 1551,,
87,5071848a65325ba280df4419f9562e968a1b9c9f,errit Birkeland <gerrit@gerritbirkeland.com>, 2021-03-21 19:19:43 -0600, , chore bump version 0.20.33,,
88,f963e75b0230e1b6927e55d73a5cd0b785770d85,errit Birkeland <gerrit@gerritbirkeland.com>, 2021-03-21 19:16:59 -0600, , chore temporarily ignore test file prettier,,
89,fbc5966465441536ede196e6550a9c10fbfb9e68,errit Birkeland <gerrit@gerritbirkeland.com>, 2021-03-21 19:10:49 -0600,572, fix static property error class incorrectly converted close 1541 close 572,,
90,9a627d8999462ab225fab35c1bb458034b668478,errit Birkeland <gerrit@gerritbirkeland.com>, 2021-03-14 22:36:31 -0600,1535, chore automate release creation resolve 1535,,
91,876c0f9bebd2ef6f035e5e13118251a7668c8856,errit Birkeland <gerrit@gerritbirkeland.com>, 2021-03-14 13:57:52 -0600, , chore bump version 0.20.32,,
92,5d7856b7c4185559faeb40913eb07d178c5ff679,errit Birkeland <gerrit@gerritbirkeland.com>, 2021-03-14 13:42:21 -0600,1538, fix correct crash reflection type resolve 1538,,
93,49c77dac2d0d115f737a24fa7d7f10da1c4694ec,errit Birkeland <gerrit@gerritbirkeland.com>, 2021-03-13 20:47:31 -0700, , chore bump version 0.20.31,,
94,07e0e279f36d7083a220e3fb27b4f4cdac5cc3c9,errit Birkeland <gerrit@gerritbirkeland.com>, 2021-03-13 20:47:11 -0700, , chore upgrade dependency,,
95,99c6a13759fb947af1446cb8eb07cf189b1801aa,errit Birkeland <gerrit@gerritbirkeland.com>, 2021-03-13 20:20:33 -0700,1534, fix readonly tuples recognized array resolve 1534 authored vladimir ivakin 7985223 minhir,,
96,b908c097f87b7bb2e75e8a8011aa15c638206796,errit Birkeland <gerrit@gerritbirkeland.com>, 2021-03-13 16:42:04 -0700,1527, fix constructor improperly reported inherited horrible surely better way banging nearly whole day also make property get set broken reference earlier typedoc plugin inherit work close 1528 close 1527,,
97,49eb74efcabf81edaa5ff1a47d28073f22dc5e54,errit Birkeland <gerrit@gerritbirkeland.com>, 2021-03-06 09:19:04 -0700, , chore bump version 0.20.30,,
98,6949a1f6f45eff164a68e99fea99c50e4001adb0,errit Birkeland <gerrit@gerritbirkeland.com>, 2021-03-06 08:58:50 -0700, , fix category appear specified multiple time close 1522,,
99,34d05f271d79a706cede3b6667c75bee49912681,errit Birkeland <gerrit@gerritbirkeland.com>, 2021-03-06 08:47:14 -0700,1524, fix support resolve 1524,,
100,c9faa9b169379c5d3dd08e3920e24b9de7316429,errit Birkeland <gerrit@gerritbirkeland.com>, 2021-03-04 19:37:48 -0700,1525, fix remove undefined optional property type resolve 1525,,
101,6fb01a054fb543b2e2aabb7040f96d056e06ec59,errit Birkeland <gerrit@gerritbirkeland.com>, 2021-03-03 21:49:02 -0700, , chore upgrade deps,,
102,72ef92f0de8ca51459ea8537cd4710aeeb5f51e4,errit Birkeland <gerrit@gerritbirkeland.com>, 2021-03-03 21:46:27 -0700, , chore bump version 0.20.29,,
103,ee273624fafbcde016e57e5124d0f8535e5da27b,errit Birkeland <gerrit@gerritbirkeland.com>, 2021-03-03 21:39:41 -0700,1517, feat support typescript 4.2 resolve 1517,,
104,d486244634329e567a793ffc0f8e543db5163b10,errit Birkeland <gerrit@gerritbirkeland.com>, 2021-02-22 19:00:05 -0700, , chore bump version 0.20.28,,
105,42a3ebeaa5d0138c26bdd9115a2fa510dc4e300c,errit Birkeland <gerrit@gerritbirkeland.com>, 2021-02-22 18:59:34 -0700, , chore upgrade dependency,,
106,46be74ec8f6fbfc174a3d394a15b7fd1ba32abe2,errit Birkeland <gerrit@gerritbirkeland.com>, 2021-02-22 18:54:41 -0700,1516, fix detect visibility modifier accessors resolve 1516,,
107,adfa846ba17f3a90fe81515e160ba81e9ee7afe7,errit Birkeland <gerrit@gerritbirkeland.com>, 2021-02-22 18:40:59 -0700, , chore disable publishing sourcemaps unnecessarily inflating bundle size never debug published bundle first place useful,,
108,4fa3b064a6fd48b0e3af3c4ca7962176683b6b84,errit Birkeland <gerrit@gerritbirkeland.com>, 2021-02-20 16:56:07 -0700, , chore bump version 0.20.27,,
109,c8de53adf2c494289629578eaf71c3992b54e330,ichaelf <michael.froeschen@aixpertsoft.de>, 2021-02-18 14:38:56 +0100, , feat preserve space code block,,
110,441fea209e7a94a05a81c380e267d41e06812346,errit Birkeland <gerrit@gerritbirkeland.com>, 2021-02-20 16:52:52 -0700,1514, fix detect normalize unique symbol name resolve 1514,,
111,ebf322fde89c2666ec89983ec0f6f684a79fccc3,errit Birkeland <gerrit@gerritbirkeland.com>, 2021-02-19 20:17:00 -0700, , chore bump version 0.20.26,,
112,a2d9dd8bf0671abd2447f9d0476602b9974cea41,errit Birkeland <gerrit@gerritbirkeland.com>, 2021-02-19 20:14:11 -0700,1509, fix pick optional readonly mapped type resolve 1509,,
113,e3aa04f24253b60f77f5addab6ce364c379d4f20,errit Birkeland <gerrit@gerritbirkeland.com>, 2021-02-14 20:38:18 -0700, , chore bump version 0.20.25,,
114,7b7bf66f146d849e7bbe66e921f01e4e1f714993,errit Birkeland <gerrit@gerritbirkeland.com>, 2021-02-14 20:34:53 -0700, , feat support specifying comment export declaration also soft deprecates use mark comment module comment use module instead resolve 1504,,
115,1ff431be2dead3c2128fce86a77897b4ad13bf92,errit Birkeland <gerrit@gerritbirkeland.com>, 2021-02-10 20:31:55 -0700, , chore bump version 0.20.24,,
116,c0f5d9102a71cbe32d83136e2bc8f925b3dc91b7,UNER88 <TUNER88@users.noreply.github.com>, 2021-02-11 02:34:04 +0100, , feat add support non .com enterprise domain 1507 authored anton pauli apauli ebay.com,,
117,21fa828c7b62932a3666f67e961e569f1b6a1249,ependabot[bot] <49699333+dependabot[bot]@users.noreply.github.com>, 2021-02-08 21:26:12 +0000, , chore deps bump marked 1.2.9 2.0.0 bump marked http github.com markedjs marked 1.2.9 2.0.0 release note http github.com markedjs marked release changelog http github.com markedjs marked blob master commits http github.com markedjs marked compare v1.2.9 ... v2.0.0 signed dependabot bot support github.com,,
118,a78fcf6ecd4c9fa6aa5df4689956d84ec0b6e9c2,errit Birkeland <gerrit@gerritbirkeland.com>, 2021-02-06 15:49:58 -0700, , chore bump version 0.20.23,,
119,7dfadcf63fbae08c7f918dacff05771bcf7d7afe,errit Birkeland <gerrit@gerritbirkeland.com>, 2021-02-06 15:47:34 -0700,1499, fix missing namespace member created exporting entire module resolve 1499,,
120,ccd519a82d7a250c9547a49aa8f2357828d4c255,errit Birkeland <gerrit@gerritbirkeland.com>, 2021-02-06 14:54:29 -0700,1497, fix set inheritedfrom accessor signature resolve 1497 also copy comment inherited implemented member already comment resolve 1498,,
121,b4493451ad7e79494d372d0a1786af43549f6663,iddharth VP <siddharthvp@gmail.com>, 2021-02-06 23:46:23 +0530, , readme fix broken link contributing guide,,
122,1d5d1cb33d460d87fc09f0578ea9f51c60e44990,errit Birkeland <gerrit@gerritbirkeland.com>, 2021-02-06 09:21:31 -0700, , chore bump version 0.20.22,,
123,2bbe23b8fd47fe3afeaa529e01fd30d093008e54,errit Birkeland <gerrit@gerritbirkeland.com>, 2021-02-06 09:21:08 -0700, , chore upgrade dependency,,
124,1c37702f2c86e22bde76b1b31e0b0d387154ad09,errit Birkeland <gerrit@gerritbirkeland.com>, 2021-02-06 09:07:34 -0700,1496, fix import shiki rather shiki theme resolve 1496,,
125,4185854a26fa917a1fd137d78ecbdef288768a2e,errit Birkeland <gerrit@gerritbirkeland.com>, 2021-02-05 17:04:38 -0700, , chore move governance file .github,,
126,72176cb34c426b49875349a0bd4800a3b0564b6d,errit Birkeland <gerrit@gerritbirkeland.com>, 2021-02-05 11:01:05 -0700, , chore bump version 0.20.21,,
127,1423960dd64ec16197df925527ed4f3216b4184c,errit Birkeland <gerrit@gerritbirkeland.com>, 2021-02-05 10:05:30 -0700,1493, fix missing exported member file namespace reflection resolve 1493,,
128,855bf6f4c184a958662a414bc96d727a7272396d,errit Birkeland <gerrit@gerritbirkeland.com>, 2021-01-31 13:24:52 -0700, , chore bump version 0.20.20,,
129,7afa42ee354639fd9148ff1956b2aea305e5ffd6,errit Birkeland <gerrit@gerritbirkeland.com>, 2021-01-31 13:19:47 -0700, , chore rebuild spec,,
130,a1d709b7a07d2bc7a8dc4c035f0e3702dff04f9a,errit Birkeland <gerrit@gerritbirkeland.com>, 2021-01-31 13:16:02 -0700, , chore upgrade dependency,,
131,e4fb86651cc063b3e55f77a589aa0825fba2bd2b,errit Birkeland <gerrit@gerritbirkeland.com>, 2021-01-31 13:05:16 -0700,1490, fix missing comment optional method resolve 1490,,
132,fa95b07f34045990140617b596b492c213721876,errit Birkeland <gerrit@gerritbirkeland.com>, 2021-01-31 12:54:45 -0700,1489, fix avoid crash removed project reflection resolve 1489 said really ought ... somewhat meaningless,,
133,3097c5ac2e157e609254aafa0be8a11cdf57f22c,errit Birkeland <gerrit@gerritbirkeland.com>, 2021-01-29 17:45:13 -0700,1483, fix function namespaces converted incorrectly resolve 1483,,
134,7723ddf4f72abef30aa7dd95d08f8e52ae308fb1,atthias Law <matthias@refineddigital.co.nz>, 2021-01-28 09:46:05 +1300, , fix add validation highlighttheme option,,
135,4a6df9ad86da346ef8d66d1d5b2138158d9be12a,atthias Law <matthias@refineddigital.co.nz>, 2021-01-27 12:14:55 +1300, , feat add highlight theme option,,
136,73071b5eb3ff6aa2f74c5f84d92237cff52a9a3a,errit Birkeland <gerrit@gerritbirkeland.com>, 2021-01-25 07:46:33 -0700, , chore bump version 0.20.19,,
137,2188f86a9f63c4142a480554a703a7a6dee47ba0,errit Birkeland <gerrit@gerritbirkeland.com>, 2021-01-24 14:34:15 -0700, , feat support watch emit,,
138,c3a59be838b29013ce117f912abfdcb0963affac,errit Birkeland <gerrit@gerritbirkeland.com>, 2021-01-24 12:32:16 -0700, , chore bump version 0.20.18,,
139,687ae53578c7ecc9ce4b668a6087db7ad0ca3596,errit Birkeland <gerrit@gerritbirkeland.com>, 2021-01-24 12:30:43 -0700,1481, fix static method added class manually close 1481,,
140,b2a88ba47d2d24f1ca5b47d02883a3bf182af2c4,errit Birkeland <gerrit@gerritbirkeland.com>, 2021-01-23 13:15:44 -0700, , chore bump version 0.20.17,,
141,84db49abc0767ade1bf1284d11f8b333935e9f8b,ergash <dergachev@hotmail.com>, 2021-01-20 12:24:05 +0300, , feat inheritdoc add support copying itemâ documentation copying another api item,,
142,dd030369900118f61ca737b0f6c05b4c2a959f13,errit Birkeland <gerrit@gerritbirkeland.com>, 2021-01-23 13:07:07 -0700, , chore upgrade dependency,,
143,f546e938d7270f3c0cca69279427085cf6fbda1a,errit Birkeland <gerrit@gerritbirkeland.com>, 2021-01-23 13:05:35 -0700,1475, chore add test getters setter object literal resolve 1475,,
144,4a539ddb3b17b53642b3981864ab3cd5a498d6fe,errit Birkeland <gerrit@gerritbirkeland.com>, 2021-01-23 12:19:13 -0700,1476, fix commonjs export type export resolve 1476,,
145,46371bfb1d932d2ed7f49aea855b4b9870c144d6,errit Birkeland <gerrit@gerritbirkeland.com>, 2021-01-16 19:28:31 -0700, , chore bump version 0.20.16,,
146,685ca411f12d381951ff8470c961696fc83ec539,errit Birkeland <gerrit@gerritbirkeland.com>, 2021-01-16 19:23:17 -0700, , fix comment project broken,,
147,d746d857c65116b8d4b0e0b69277665a1748c556,errit Birkeland <gerrit@gerritbirkeland.com>, 2021-01-16 18:00:01 -0700, , fix constructor bit broken,,
