id,sha,author,date,issue,message,file,content
0,5fd9bec35498bf6c981c06f99005d48ff65c2539,lorian Zaruba <florian@openhwgroup.org>, 2021-07-20 14:36:09 +0200, ,license namer updatelicense namer updateupdate,,
1,caf18728375538fe7cf65d8146f5abd5a9c293a9,meric Poulin <46192993+E-Poulin@users.noreply.github.com>, 2021-06-26 00:22:44 +0200, ,configurable assoc cacheconfigurable assoc cacheemeric signed poulintravisemeric signed poulin,,
2,33b7b672ee343248cb26631a76d8d1ac37475d34,lorian Zaruba <florian@openhwgroup.org>, 2021-06-24 22:00:02 +0200, ,github switch workflowgithub switch workflowzaruba florian signedreadme change status buildrevert verilatorverilator unsafe threadverilatorverilator disable threading,,
3,420e4a930cb73caa83f33c14aceb045d5c38a64e,azczmh <49888860+sazczmh@users.noreply.github.com>, 2021-06-22 21:59:25 +0800, ,interface,,
4,678176316c03ae99715b5e8f0f03150d7ebcae06,ébastien jacq <57099003+sjthales@users.noreply.github.com>, 2021-06-18 14:28:31 +0200, ,instruction correctinginstruction correctingsjthales signedupdating correctionsjthales signed,,
5,ca52257717199fc2e867fdd260f93bc3dd137786,meric Poulin <46192993+E-Poulin@users.noreply.github.com>, 2021-06-11 10:54:51 +0200, ,version widthversion message warning usingemeric signed poulinmessage warningemeric signed poulin,,
6,f9b6f7fbc2f098b42e3eadde13d06081464bf0d1,ianrui-wei <tianrui-wei@outlook.com>, 2021-06-07 18:23:22 +0800, ,issue openpiton simulationtianrui signed,,
7,485662f0c9a315e084c5e18db49b4ea4a7503dfe,meric Poulin <46192993+E-Poulin@users.noreply.github.com>, 2021-05-26 16:59:42 +0200, ,adaptation assoc cache width indexemeric signed poulin,,
8,6963fe9667d68c06170940f01bcb0ed61e816074,ils Wistoff <nwistoff@iis.ee.ethz.ch>, 2021-05-12 19:39:47 +0200, ,icache reset flushicache current reset check implementationflush enabled rising initializesasserted assumesleaving cache hardwired necessarily possiblyreset flushnwistoff wistoff signed,,
9,4a8c277ba29701b136757f7369c858e9d852ed1a,lorian Zaruba <florian@openhwgroup.org>, 2021-05-07 15:58:59 +0200, ,unknown condition assertion,,
10,6000e32b4181304901adc4c8d72870ebc94473a5,lavien Solt <flavien.solt97@gmail.com>, 2021-04-14 12:44:27 +0200, ,change letter string verilator singleauthored flavien flsolt,,
11,05a13869609450d27ee5aeb5dad3f56c5f1996c4,lavien Solt <flavien.solt97@gmail.com>, 2021-04-13 11:15:07 +0200, ,prefix redundant removeauthored flavien flsolt,,
12,fbe1e01e2090b19bcf49d9d8c828cceeb7daab12,ils Wistoff <nwistoff@iis.ee.ethz.ch>, 2021-03-30 09:29:00 +0200, ,flushed request dcache pendinginstead waiting request dcache completereturn discard directlydcache pollution preventsready fasternwistoff wistoff signed,,
13,d24287e957981fb847fdbdaee9e318c2b502b412,ils Wistoff <nwistoff@iis.ee.ethz.ch>, 2021-03-18 19:14:00 +0100, ,makefile whitespacenwistoff wistoff signed,,
14,4abae602c57045a2c89147a2c9c2cc47eab8fc14,ils Wistoff <nwistoff@iis.ee.ethz.ch>, 2021-03-17 07:34:40 +0100, ,makefile questa target remove excessnwistoff wistoff signed,,
15,6265f1d7151ac2ae75441b943af602178a7cf054,lorian Zaruba <florian@openhwgroup.org>, 2021-03-05 14:11:04 +0100, ,compatibility improvementcausing generationneeded tracer information reallyscoreboard properzaruba florian signed,,
16,a5a71c1fc30ba2c9155213fb57ec68d34e739fce,ébastien jacq <57099003+sjthales@users.noreply.github.com>, 2021-03-04 11:28:28 +0100, ,supportsupport added instructionsjthales signedupdateauthored zarubaf florian zarubasjthales signedsupport updatingsjthales signedfrontend updateauthored zarubaf florian zarubasjthales signedupdateauthored zarubaf florian zarubasjthales signedfrontend updateauthored zarubaf florian zarubasjthales signedindentation added signalsjthales signedremovedsjthales signedauthored zarubaf florian zaruba,,
17,afea42d650c7275143b519dc9966e8bd0aa8ba15,avid Schrammel <51957010+davidschrammel@users.noreply.github.com>, 2021-03-04 09:48:04 +0100, ,instead actual partition hardcodeddavid schrammel signed,,
18,7760227f887c59a2ae1b89e70fb20582a2d5c5b3,ttG <35836648+OttG@users.noreply.github.com>, 2021-02-22 10:50:00 +0100, ,added compiling running xceliumgianmarco signed ottaviauthored gianmarco ottavi,,
19,6865f71d56cfbc0ed79a6c9256a8dfcd1be9a575,ils Wistoff <nwistoff@iis.ee.ethz.ch>, 2021-02-19 18:31:53 +0100, ,modelsimissue recent introduced modelsimtypecast explicitnwistoff wistoff signed,,
20,327d17f8c8a1801676e78cd519579743380a3b24,ils Wistoff <nwistoff@iis.ee.ethz.ch>, 2021-02-19 14:59:28 +0100, ,default unused interrupt peripheral assignregisternwistoff wistoff signed,,
21,cffd9debc3c1933d83d23449dae635bfa312fba0,ttG <35836648+OttG@users.noreply.github.com>, 2021-02-18 11:17:33 +0100, ,compatibility xceliumgianmarco signed ottaviauthored gianmarco ottavi,,
22,c2fd716c34619f4ec638fdc41f5a6aa07539ac12,ermanschmit <hermanschmit@users.noreply.github.com>, 2021-02-16 22:58:09 -0800, ,comparability verific,,
23,d88cfebed83a751933bf261c9889847d2270b95e,uca Zulberti <zulberti.luca@gmail.com>, 2021-02-16 12:07:20 +0100, ,dependency removeneededdepend related packagezulberti signed,,
24,27465f148992c1d98aa894cd732c16f027995ced,hengjie Xu <shengjie.xu@mail.utoronto.ca>, 2021-02-16 04:54:21 -0500, ,multithreading option fixed optimisation target verilatormultithreading makefile option fixed target optimization verilatorshengjie signedoption travis command verilator droppedshengjie signedverilator target optimization limitshengjie signedmoved verilator cflagsshengjie signed,,
25,491f46799e5152776f7720b453a8bd9065897ef8,erend Ozceri <berend@alumni.cmu.edu>, 2021-02-16 01:53:42 -0800, ,flush deasserted state resetberend signed ozceri,,
26,cb9ea121775d5d9a74ff27f0e7a8bf4830e67474,lorian Zaruba <florian@openhwgroup.org>, 2021-02-08 17:51:01 +0100, ,synthesis vivadozaruba florian signed,,
27,bb68496ce3b130657a8ef1ca7ec9e2f6a6d95db9,lorian Zaruba <florian@openhwgroup.org>, 2021-02-08 15:28:43 +0100, ,cachingzaruba florian signed,,
28,1a4f9ba7fd1a59cc6c78c41910d3597bdbf6ba33,uca Zulberti <zulberti.luca@gmail.com>, 2021-01-31 10:03:03 +0100, ,reference forward removezulberti signed,,
29,5086570c7d206e0775e3ccbb4b8a3946e78781b0,lorian Zaruba <florian@openhwgroup.org>, 2021-01-28 17:19:07 +0100, ,adjust testbenchzaruba florian signed,,
30,fba4ddeb6279d4549531f3a439cb0a43bb79dfe7,uca Zulberti <zulberti.luca@gmail.com>, 2021-01-28 08:23:07 +0100, ,burstburst fixedregular transaction stated specificationsectionzulberti signedwhitespaces trailing removezulberti signedimprove commentzulberti signedindentationzulberti signedindentationzulberti signed,,
31,25960542284c8310b6263b568a258ecb28d0069e,uca Zulberti <zulberti.luca@gmail.com>, 2021-01-25 10:30:42 +0100, ,latch inference preventzulberti signed,,
32,eaeef7da1ad5d19f0fa76fe3e09c968a15e5ed9e,lorian Zaruba <florian@openhwgroup.org>, 2021-01-18 14:08:06 +0100, ,reference issue verilator compilationzaruba florian signed,,
33,540632a77a970cb58c13eb5c27fd34522a627781,awelkudlakaldec <58807617+pawelkudlakaldec@users.noreply.github.com>, 2021-01-18 10:36:22 +0100, ,complianceaccording logic sequential procedureincluding content shall written variable assignment within calledinitial always changing driven proposal process,,
34,d4605e3b0c15463e4571e09be3d8e3a99b46aaa6,. Tarek Ibn Ziad <mtarek@cs.columbia.edu>, 2021-01-18 04:33:39 -0500,567,static verilator removestatic cause verilator compilation error,,
35,6fd1a734e0a79a28b3965cb02a4df5ea399b39ab,eanRochCoulon <jcoulon@gemalto.com>, 2020-12-16 19:52:24 +0100, ,synthesis warningcreate synthesis warning errorrename ppnwminjcoulon signed,,
36,163eb93947b818305f18951381a0645162f26067,ils Wistoff <nwistoff@iis.ee.ethz.ch>, 2020-11-03 20:57:06 +0100, ,documentationmemoryinterrupt sourcenwistoff wistoff signed,,
37,296ce392113003533af863518b29114b9953d836,ndré Sintzoff <andre.sintzoff@thalesgroup.com>, 2020-09-03 09:53:02 +0200, ,makefile located riscv directory support spike,,
38,87426e193ae29feadec17d1bc3d5dcfd6322a8d5,amywang <41533488+iamywang@users.noreply.github.com>, 2020-11-13 17:04:16 +0800, ,change,,
39,82e7adf960fa06c15520bdd28ac0ef974f862477,tefan <51908919+Steinegger@users.noreply.github.com>, 2020-12-01 14:59:58 +0100, ,generation,,
40,861aee01bec961b7fe920d67ee8bc27fae91710a,ils Wistoff <nwistoff@iis.ee.ethz.ch>, 2020-11-24 18:24:00 +0100, ,forwarding exceptionnwistoff wistoff signed,,
41,a7ad3ec195bdf2930504a70e11448b6bc36d731d,ils Wistoff <nwistoff@iis.ee.ethz.ch>, 2020-09-11 21:24:57 +0200, ,width mismatchnwistoff wistoff signed,,
42,364a11739ed2e5a6ba689315e17b67d837a631db,ils Wistoff <nwistoff@iis.ee.ethz.ch>, 2020-09-11 20:41:47 +0200, ,renamenwistoff wistoff signed,,
43,de5077332ea8cac751e85ee2e541d0f3c7651723,ils Wistoff <nwistoff@iis.ee.ethz.ch>, 2020-09-11 20:22:22 +0200, ,icaches mergewrapper module connectreplacerenamenwistoff wistoff signed,,
44,da363791d0a8b8ce20016a3bb468cbd02e9909ca,eanRochCoulon <56552370+JeanRochCoulon@users.noreply.github.com>, 2020-10-07 09:57:58 +0200, ,mismatchsignal errorwarningsignalwarningauthored jcoulon,,
45,7a1b214332de6ec51abbe91323c70d7e8b7f2e06,oritz Schneider <Moschn@users.noreply.github.com>, 2020-10-07 09:56:23 +0200, ,length wrongpmpcfg,,
46,0bbc3cb5cf43cd3bf77d3872e46dd0d6ededf28f,ils Wistoff <nwistoff@iis.ee.ethz.ch>, 2020-10-06 14:11:44 +0200, ,match width paddr extendnwistoff wistoff signed,,
47,9650890a84b60e162b2b3490d9cfe6bbccbc7378,lorian Zaruba <florian@openhwgroup.org>, 2020-10-02 17:56:48 +0200, ,address speculative accessmarcelo orenes movera signedauthored orenes movera marcelo,,
48,9de0800c0bd194217386e24d497178b692c5d9bc,ils Wistoff <nwistoff@iis.ee.ethz.ch>, 2020-09-28 15:40:44 +0200, ,previous leftover simplify removenwistoff wistoff signed,,
49,6f55fb0f53e112ecf3bf96d244f3bf06c51896fd,ils Wistoff <nwistoff@iis.ee.ethz.ch>, 2020-09-24 14:36:16 +0200, ,icache testbenchicache testbench functional minorlocal importadjust cachedaddrend overflow preventpadding testcases increasesignal updatenwistoff wistoff signed,,
50,a5c9931512d80fb5f9aea204bb099f62f16ca904,ils Wistoff <nwistoff@iis.ee.ethz.ch>, 2020-09-24 15:03:49 +0200, ,simplifyicache state redundant removereducedecrease penalty leastnwistoff wistoff signed,,
51,0249cfef00de2d6edb8e2dcb3b2fe84cab7a8ef3,ils Wistoff <nwistoff@iis.ee.ethz.ch>, 2020-09-11 17:03:09 +0200, ,change submodulenwistoff wistoff signed,,
52,3820b262e29ddebffa9653d9786dc7b7e1d44642,ils Wistoff <nwistoff@iis.ee.ethz.ch>, 2020-09-10 18:52:58 +0200, ,whitespaces headernwistoff wistoff signed,,
53,e82d389ea57f068ad899a0ac515e22273cc78da6,ils Wistoff <nwistoff@iis.ee.ethz.ch>, 2020-09-04 18:31:14 +0200, ,supress dependencynwistoff wistoff signed,,
54,a243d11a2623e8e36b5d733ca6ad7875136e7334,ils Wistoff <nwistoff@iis.ee.ethz.ch>, 2020-09-04 18:25:45 +0200, ,dependency updatenwistoff wistoff signed,,
55,cd27cc8766da7cd16c983f2861414b56c4a38097,ils Wistoff <nwistoff@iis.ee.ethz.ch>, 2020-09-04 18:24:28 +0200, ,local importnwistoff wistoff signed,,
56,d59b19c2c0887dd1a5bfaa308af204bee8ce6319,ils Wistoff <nwistoff@iis.ee.ethz.ch>, 2020-09-04 17:09:54 +0200, ,nwistoff wistoff signed,,
57,c6336384c4d3749b9318e12475fe93a0645a4b10,ils Wistoff <nwistoff@iis.ee.ethz.ch>, 2020-09-04 16:49:45 +0200, ,dependencynwistoff wistoff signed,,
58,0e066983c5c56a458eb3e38ad6c192b2bd095719,ils Wistoff <nwistoff@iis.ee.ethz.ch>, 2020-09-04 13:48:51 +0200, ,writeport constantnwistoff wistoff signed,,
59,2b760a2608f5b51af6a344e8738388f20ed426bc,ils Wistoff <nwistoff@iis.ee.ethz.ch>, 2020-09-03 16:02:37 +0200, ,writeport minornwistoff wistoff signed,,
60,adf9cfe03944c3011e43dd74a938d08098e328ef,ils Wistoff <nwistoff@iis.ee.ethz.ch>, 2020-09-03 15:46:35 +0200, ,shared common componentnwistoff wistoff signed,,
61,13c6ee751006693910c7d880a3dd9c997e21dae4,ils Wistoff <nwistoff@iis.ee.ethz.ch>, 2020-08-31 14:13:07 +0200, ,valid reportnwistoff wistoff signed,,
62,493add1f27911b9237a832dcaad3b8df359460d9,ils Wistoff <nwistoff@iis.ee.ethz.ch>, 2020-08-31 14:11:34 +0200, ,store validnwistoff wistoff signed,,
63,e9c1282cc135b7de6c79cdc31ed677f471d470fb,ils Wistoff <nwistoff@iis.ee.ethz.ch>, 2020-08-13 11:53:12 +0200, ,loose grantnwistoff wistoff signed,,
64,81b11bcfa52a156fc02d42fd6466e9f2eba21e15,ils Wistoff <nwistoff@iis.ee.ethz.ch>, 2020-08-13 11:50:28 +0200, ,saved indexnwistoff wistoff signed,,
65,e058b825dcfaa166a0e01d22ab615346bac4aa0a,ils Wistoff <nwistoff@iis.ee.ethz.ch>, 2020-08-13 11:46:41 +0200, ,current check state insteadnwistoff wistoff signed,,
66,191e06c942beee30b17798f2bac76c9510873c97,ils Wistoff <nwistoff@iis.ee.ethz.ch>, 2020-08-12 12:19:12 +0200, ,nwistoff wistoff signed,,
67,f5dc8cd63f723db95b0955ea3f04aead48209d74,ils Wistoff <nwistoff@iis.ee.ethz.ch>, 2020-08-12 12:12:12 +0200, ,request flight safelynwistoff wistoff signed,,
68,e2ff94d6ab8d24faba83ec37174cab3500950479,eanRochCoulon <56552370+JeanRochCoulon@users.noreply.github.com>, 2020-09-10 10:59:14 +0200, ,configurablepossibility commit configuresignificant saving versionimplement allow entire privileged hencelinux booting,,
69,3663eebd0a06001931cbdbdbd72d05f5cc1be0b9,uige Lee <295054118@qq.com>, 2020-09-08 23:00:03 +0800, ,signal modelruige signed,,
70,60945b2e25e76186da3f1db554cd1d8d82fc6ab0,ils Wistoff <git@wistoff.net>, 2020-09-04 18:40:27 +0200, ,small bugfixessignal updatelocal importresponse memory invalidate pending,,
71,5618dd827f3059b8cc07a1062102fb1bc2dfc443,ils Wistoff <git@wistoff.net>, 2020-09-04 18:49:10 +0200, ,interface import,,
72,1055ccda1702b208c61493d1396b0d9f67b2ec41,arcosabatano <59875904+marcosabatano@users.noreply.github.com>, 2020-09-02 11:21:55 +0200, ,asidsimplementationcorrected merge errorhensoldt marco sabatano signed,,
73,38c08c56ec61730127069bbaccc58946b951791e,arcelo Orenes <55038083+morenes@users.noreply.github.com>, 2020-08-28 12:32:11 +0200, ,separationmarcelo orenes movera signed,,
74,eef5ff6d3a8fe28213b283085740524b41b22002,lorian Zaruba <zarubaf@iis.ee.ethz.ch>, 2020-08-27 18:01:24 +0200, ,register revert version optimizedcommit broke reverts unfortunately cebadcdbdddeabd linux bootinggenesyszaruba zarubaf florian signed,,
75,6b4ddbf012b742b3be84c65a94815b9d41b0b947,hengjie Xu <shengjie.xu@mail.utoronto.ca>, 2020-08-26 10:36:02 -0400, ,instruction fault frontendsecond instruction across splitshengjie signed,,
76,7ba091c217168d4a9252d55ee91d5687140ed46d,uige Lee <295054118@qq.com>, 2020-08-26 18:40:06 +0800, ,global import removeglobal import removeimport rename commented remove statementruige signed,,
77,575cb445f8e31be4328557720c4c962740935686,lorian Zaruba <florian@openhwgroup.org>, 2020-08-26 10:29:18 +0200, ,readme pointer updatezaruba florian signed,,
78,8678fedda2d7f49784cc59eaccc3466776a98bdf,meric Poulin <46192993+epthales@users.noreply.github.com>, 2020-08-26 10:20:31 +0200, ,condition assertionemeric signed poulinauthored emeric poulin,,
79,8de6e35288274c9d8a67d6e3f1c3d63c05df8d66,lorian Zaruba <florian@openhwgroup.org>, 2020-08-25 11:33:44 +0200, ,consolidatepreviously smaller avoid spreadsetting preloading dominating memory overheadmergecurrently removezaruba florian signed,,
80,3a13ae033363bc2e0dc241db8a953122078614e8,lorian Zaruba <florian@openhwgroup.org>, 2020-08-24 10:16:28 +0200, ,memory verilator preloadingmemory verilator classedcommit debugger module preventstale updatezaruba florian signed,,
81,c04a73ec9d49e77c375c8a728f8cce621c764ed2,lorian Zaruba <florian@openhwgroup.org>, 2020-08-24 07:42:07 +0200, ,legacy spike remove fesvr updatecommit merged riscv remove fesvrinstall latest legacy riscv updatezaruba florian signed,,
82,a89032f96b457576217db780e9cb612f56ac665d,lorian Zaruba <florian@openhwgroup.org>, 2020-08-24 05:51:29 +0200, ,buildoverly build checkout timedcommit built downloads rectifies toolchains issueverilatorzaruba florian signed,,
83,f8b7bc0670255eb7c041089677f055a45afb6a15,oritz Schneider <scmoritz@larain6.ee.ethz.ch>, 2020-08-05 10:39:19 +0200, ,bender update,,
84,efed421eb27630b1636113b0b112799afbd1be87,oritz Schneider <scmoritz@larain6.ee.ethz.ch>, 2020-08-05 10:37:02 +0200, ,regfile parameter overflow,,
85,1560cdfc1a836c7a053ab315715f86d7eac295d8,oritz Schneider <scmoritz@larain6.ee.ethz.ch>, 2020-08-05 10:35:33 +0200, ,signal widthnrpmpentries support overflow certain synthesiscommit nrpmpentries entirenumber configuration entry maximum,,
86,c69ebadcd26233310b6781d3d3d5ea90bd148402,anoam <gnoam@live.com>, 2020-07-31 12:35:46 +0200, ,register version optimizedoptimized supporting register synthesis fpgasdistributedprincipleimplement register baseline implementation arrayimplement large write multiplexerimplementation efficientusing store memory distributed storagelayout depending memorydevice integrated address distributedregister block distributed featurewrite number implemented parametrizedarbitrated access async dependingblock purpose written additional arraywrite keeping register maintained tracksince multiplexer structure expensiveregister saving achievedregister purpose generalsaving xilinx xcktffg concrete kintexlutrambaselineoptimizedganoam gnoam signed,,
87,dcea6c97d43b4a03f703f515990b3eab9082e6c9,ils Wistoff <git@wistoff.net>, 2020-07-27 18:03:40 +0200, ,cause active exception,,
88,8f0528dea3313e42c1d225536874e1c416be9d41,ils Wistoff <git@wistoff.net>, 2020-07-27 18:47:03 +0200, ,change,,
89,4d4c3f025d4e9bbe725a95b702cbd12a94bac5b8,ils Wistoff <git@wistoff.net>, 2020-07-28 10:52:58 +0200, ,image update,,
90,f8481cb54e31a7671b42ed850c45db35e2019392,lorian Zaruba <zarubaf@iis.ee.ethz.ch>, 2020-07-26 13:38:15 +0200, ,,,
91,c57b275df595601cae85eed6b3b4d47639a6f510,asgia <massimiliano.giacometti@hensoldt-cyber.com>, 2020-07-16 10:53:10 +0200, ,frontend prediction prevent invalid entrygiacometti massimiliano hensoldt signedfrontend updateauthored zarubaf florian zarubagiacometti massimiliano hensoldt signedauthored zarubaf florian zaruba,,
92,1b65b8865a505722b8bbbdd1a0e6dc959b28e166,aichou <tommy0705c@gmail.com>, 2020-07-06 13:29:28 +0800, ,misleading instruction document build,,
93,c30e26183e445717d38d59cd14f7128343fc7725,ils Wistoff <git@wistoff.net>, 2020-07-09 14:51:59 +0200, ,simulation modelsim,,
94,a3051e8636804faf5aaeda7e9afd4da7067dcc38,oritz Schneider <scmoritz@student.ethz.ch>, 2020-06-16 18:15:23 +0200, ,documentation,,
95,8751bb8c7d4ee93132bc58692a131439145e0a4d,oritz Schneider <scmoritz@student.ethz.ch>, 2019-12-02 14:12:51 +0100, ,testbenches unused remove,,
96,49d2b3f80ebbbfecc7de81aa1da5e1bc60b928e9,oritz Schneider <scmoritz@student.ethz.ch>, 2019-12-02 14:12:20 +0100, ,whitespace,,
97,42aa77a9aebfde227d2b81b9752d0b1764a50e22,oritz Schneider <scmoritz@student.ethz.ch>, 2019-11-29 16:53:01 +0100, ,return address failed,,
98,77d2173f2c372eb15f934b3d4f7affc10cf8085e,oritz Schneider <scmoritz@student.ethz.ch>, 2019-11-29 16:52:06 +0100, ,checkperformed check tabletranslated previous accesscorrectly handle,,
99,edb40b5b3650ee864dea41b4cf523872b0655f0e,oritz Schneider <scmoritz@student.ethz.ch>, 2019-11-29 16:48:04 +0100, ,comment cleanup,,
100,fd740e601ab88289c53e8bd04736b77daffa3c15,oritz Schneider <scmoritz@student.ethz.ch>, 2019-10-28 15:45:58 +0100, ,return failure physical address,,
101,0734c9f12171ef2c8a9cf04c076faafabb351eae,oritz Schneider <scmoritz@student.ethz.ch>, 2019-10-28 15:41:17 +0100, ,overwrite misaligned exceptionthrow exception misaligned would instructionexception match misaligned would disallowingmodule exception misaligned trying cought kernelreplaced aligned trapped bootloadermatched sometimes access exceptionoverwritten,,
102,ca574e763169a199130c63e18f83088a41c8bd42,oritz Schneider <scmoritz@student.ethz.ch>, 2019-10-11 16:49:11 +0200, ,flattencommon napot,,
103,7ea5378ce11a5ca84f9a3dcea313c2b121b8da6d,oritz Schneider <scmoritz@student.ethz.ch>, 2019-10-11 13:52:04 +0200, ,lockedupdating restrict locked,,
104,d88d87763cd39aea1c4e86e3b5309ef118068aaf,oritz Schneider <scmoritz@student.ethz.ch>, 2019-10-09 17:10:19 +0200, ,logic replace,,
105,0620aef7e0c8412b31e38d08c19ca6faa1723913,oritz Schneider <scmoritz@student.ethz.ch>, 2019-10-09 17:10:04 +0200, ,undriven value,,
106,95f3b9a9ebebc4e30d3ac38f360e4f76c992bfb0,oritz Schneider <scmoritz@student.ethz.ch>, 2019-10-09 17:09:46 +0200, ,support granularitysimpler allow misaligned since implementationanyways,,
107,794ea7cdf304e15bc3d28ceae112e04158d893d8,oritz Schneider <scmoritz@student.ethz.ch>, 2019-10-08 14:54:39 +0200, ,frontendcause compare exception,,
108,8d0231ec2d4f9b702f53dd90e9bb15bca41f8da3,oritz Schneider <scmoritz@student.ethz.ch>, 2019-10-08 14:03:02 +0200, ,instantiation,,
109,09bb112f3f46408feec992bde968f6295a66d9ce,oritz Schneider <scmoritz@student.ethz.ch>, 2019-10-08 14:02:31 +0200, ,wiring regfile,,
110,5dba21080fcf80f723e78642a474daac50a86a8d,oritz Schneider <scmoritz@student.ethz.ch>, 2019-10-08 13:15:22 +0200, ,correct,,
111,1ff8cd605a3995e178a57cf284a2bb90e46cdf87,lorian Zaruba <zarubaf@iis.ee.ethz.ch>, 2019-10-04 17:10:02 +0200, ,number regfile configurable,,
112,2e55396e55e300ba148a04f6a73bfdf98693a4a1,lorian Zaruba <zarubaf@iis.ee.ethz.ch>, 2019-10-04 16:56:06 +0200, ,optional,,
113,e0cca2ab34c7d88f91948056877f72666a995ce9,lorian Zaruba <zarubaf@iis.ee.ethz.ch>, 2019-10-04 16:38:55 +0200,297,frontend fault instruction access remapping,,
114,b0998261b8f4a4d7373b958334e24d18cdc4ad0b,lorian Zaruba <zarubaf@iis.ee.ethz.ch>, 2019-10-04 16:19:21 +0200, ,check interface,,
115,5fb33e8d9f467c3c48990b78597746cba60d61f9,lorian Zaruba <zarubaf@iis.ee.ethz.ch>, 2019-10-04 15:50:52 +0200, ,check store,,
116,3ba489f4308cb61cf32446ca638de5606c18b9aa,lorian Zaruba <zarubaf@iis.ee.ethz.ch>, 2019-10-04 15:21:34 +0200, ,instantiate check instruction,,
117,934bfeaf13ac37e09f85fbdd7b88b9fdc255296b,lorian Zaruba <zarubaf@iis.ee.ethz.ch>, 2019-10-04 15:21:07 +0200, ,number,,
118,78361954dc552494a5f29becf02b23e921da7272,lorian Zaruba <zarubaf@iis.ee.ethz.ch>, 2019-10-04 15:19:31 +0200, ,riscv definitiondefinition flatten,,
119,d210a1430ba54f0dc4317ca031b24cd0fcac2d26,oritz Schneider <scmoritz@student.ethz.ch>, 2019-10-03 16:33:38 +0200, ,register,,
120,9cbc7da177b8808675fb4d43acb9e4eb0d5b370a,oritz Schneider <scmoritz@student.ethz.ch>, 2019-10-02 12:48:43 +0200, ,,,
121,465bb209a02721cbaa6fa82a87df2eb464a39e60,uige Lee <295054118@qq.com>, 2020-06-22 03:28:03 +0800, ,mistake spellingmisspelling commentauthored ruigeruige signedmistake commentauthored ruigeruige signed,,
122,2d814452094b3e20897e2362771d70024a610651,ursultan Kabylkas <kabylkas@gmail.com>, 2020-06-16 01:30:58 -0700, ,dromajo simulation verificationintegration initial dromajo summarymakefile verilate change enable dromajodisable ifdefs addingdromajo addingmaking dromajo submoduleupstream syncingcommit latest dromajo bumpingcosim function summary addingadded containsdromajomakefile edittedfixing issue summary buildfixing syntax errorconflict shared library renamingfixing dromajo makefile sharedchange latest dromajo bumpingcheckpoint bootrom summary loadingargument change simulator checkpoint verilatorchange dromajo corresponding checkpointcontains checkpoint bootcode dromajo seriesimmediate restore state architecturalgeneratedverilog bootrom plusargspointeddebug start running default dromajovalue changedupdating change latest dromajomemory dromajo summary arianechange memory checkpointcontains memory dumped dromajo checkpointedstore binary dromajo valueperformed dumping globallymodified parseargument memory pointed checkpointinstantiate change introduced remainingdromajocosimulation summary callinginterface change introduces functionupdating latest commit dromajodisabling preloading verbose output bootrom mainramlogic summary updatechange discussion florianimplement current logic updateconfusion updatecurrent privilege running level enteringdebug patch attached removewrong write update logic processdebug correctly handle entering updatedebug control status specificationversion latest dromajochange dromajo summarychangeebreaks commit ecalls ariane workaroundencorporatedproper cosimrunning summary binary support dromajochange command ability followingriscvcreation binary automates checkpoint dromajoariane dromajoariane dromajo buildconsistent changing existing recipe dromajocosim instruction dromajo addingreleaselicense added headerdetail added dromajo,,
123,cbbcf3565c3829b40288848e2a6a49be689e7922,tefan Mach <smach@iis.ee.ethz.ch>, 2020-06-02 15:33:00 +0200, ,releaseissue simulation among,,
124,7d9905b9eaaee8e8bb2ef7aa5ed854d5719a32ff,aphael Klink <raphael.klink@student.uni-luebeck.de>, 2020-05-31 18:26:54 +0200, ,extension,,
125,733a283798b07e7f97b483f1856b34d594e0f928,anielmlynek <danielm@aldec.com>, 2020-05-18 15:48:54 +0200, ,global import removeaccordingprecisely explicit import symbol allows control importedproper package different usage provides reference assurancemoved header module importauthored pawelku,,
126,104b9dec0bb2d4c7beb2a57f091f980b8d4b4266,anielmlynek <danielm@aldec.com>, 2020-05-18 15:47:53 +0200, ,global import removemodule package import header statementupdateauthored zarubaf florian zarubaauthored pawelkuauthoredauthored zarubaf florian zaruba,,
127,b83a04a1f0e3e2c279db156e0647ebd6e83fae40,anielmlynek <danielm@aldec.com>, 2020-05-15 17:47:20 +0200, ,localparamsalways local function variable initialized automatic valueready argument function parameterized better readabilityauthored pawelku,,
128,79d4be758cdd60f990244de9472e67a33e6d352f,ilson Snyder <wsnyder@wsnyder.org>, 2020-05-15 11:45:36 -0400, ,makefile verilator variablewilson snyder signed wsnyder,,
129,7c5ffad467d33b7adfd994e540fda344aec76f63,anielmlynek <danielm@aldec.com>, 2020-04-29 18:08:37 +0200, ,typecast addressauthored pawelku,,
130,ba164a7810fcecf4440d9a5846507ebefea5ca2e,anielmlynek <danielm@aldec.com>, 2020-04-28 11:25:36 +0200, ,typedef functionauthored pawelku,,
131,94345782e7946077a9886e0893a21fecddd91063,i1101 <59173643+Yi1101@users.noreply.github.com>, 2020-04-26 13:56:07 +0200, ,identifier inside remove,,
