id,sha,author,date,issue,message,file,content
3260,f681009bb8959328cc77f11ed35bbe2ebca09ea1,alvatore Ansani <salvatore@ansani.it>, 2012-01-27 20:06:48 +0100, , added support 304 http statuscode modified optimize feed new item last check,,
3261,9fc48a285cc462f2f40f299f27900b1c474b5d58,alvatore Ansani <salvatore@ansani.it>, 2012-01-27 19:30:56 +0100, , fixed bug prevent immediately refresh feed new google reader feed added,,
3262,85056d8dd76d93b355ecb69b5740ee4d2675c753,alvatore Ansani <salvatore@ansani.it>, 2012-01-27 19:07:24 +0100, , added support unsubscribing google reader feed directly vienna,,
3263,52e53775b69b45756d2341375b51c02403f0ca17,alvatore Ansani <salvatore@ansani.it>, 2012-01-27 18:44:08 +0100, , using oauth 2.0 url encoding function instead custom one,,
3264,091a5ae43252009a53be183631908c7a4f744228,alvatore Ansani <salvatore@ansani.it>, 2012-01-27 18:30:33 +0100, , fixed big issue oauth token available startup,,
3265,a56e367309d0ab7e3597708255a2b78e7e6d244e,alvatore Ansani <salvatore@ansani.it>, 2012-01-27 12:41:05 +0100, , merge branch master http github.com viennarss vienna,,
3266,80b5d29bc20e94ea464da08618b6cdf6561c06dd,alvatore Ansani <salvatore@ansani.it>, 2012-01-27 12:38:52 +0100, , fixed compilation warning,,
3267,f14708a4dec5b54095f236ab10840f848bf6b178,alvatore Ansani <salvatore@ansani.it>, 2012-01-27 12:36:03 +0100, , vienna user choice many concurrent download thread app use preference advanced,,
3268,58e46fd982af6cd4faa953a294b0eabb62ba0065,alvatore Ansani <salvatore@ansani.it>, 2012-01-27 12:33:15 +0100, , removed local asinetworkqueue always use one declared refreshmanager,,
3269,bd4923f8f389b9293ae45d28ffd7bbf6f1d3b2d1,alvatore Ansani <salvatore@ansani.it>, 2012-01-27 12:32:32 +0100, , removed multi language support viennabeta support english,,
3270,03fc38a1aee56599c76d396db21e675b8d5bd0ec,arijaona Ramaholimihaso <github.com@barijaona.com>, 2012-01-25 22:08:04 +0300, , modified project get universal build xcode 3.2.6,,
3271,b25db7047982d1d139b95fb944db2d0f1b9ca548,stroeck <michael@stroeck.com>, 2012-01-25 15:15:29 +0100, , please always use setting user visible string,,
3272,7c6e98b750dee762a4306d544f56a0d341f81158,stroeck <michael@stroeck.com>, 2012-01-24 15:13:00 +0100, , make url text field prettier,,
3273,d9eeb8aadef5133a1e58964c20ca11bb4de53b03,stroeck <michael@stroeck.com>, 2012-01-24 00:32:46 +0100, , remove unneccessary release message,,
3274,25894bf65127d3dd7c4a58d5b53dabda8b5f6de6,stroeck <michael@stroeck.com>, 2012-01-24 00:23:09 +0100, , fix issue brought clang static analyzer,,
3275,de4df4dcfb301fff434431e0bd07cb396cdd9aef,stroeck <michael@stroeck.com>, 2012-01-23 22:32:28 +0100, , big change update sqlite 3.7.10. nothing break better later beta cycle,,
3276,0f6e784fd490a0aa19d39f31fc507f5f364bb923,stroeck <michael@stroeck.com>, 2012-01-23 22:20:16 +0100, , fix two warning related wonky library search path project setting,,
3277,56bd40639acc9c1aa479ed2c9c03a1714c8d745f,stroeck <michael@stroeck.com>, 2012-01-23 22:09:54 +0100, , fix text encoding .strings file getting rid warning,,
3278,f3e33ee3aa43ce2fd204b814f52635b00a26678f,stroeck <michael@stroeck.com>, 2012-01-23 22:03:36 +0100, , fix several warning,,
3279,44604699035eadb1872fdd378da137735bae1499,alvatore Ansani <code@wabyte.com>, 2012-01-23 15:07:08 +0100, , added status bar notification refreshing feed google reader,,
3280,e7ba90369a0b85cbef4037b070497af3c3e4bcbc,alvatore Ansani <code@wabyte.com>, 2012-01-23 15:05:12 +0100, , merge branch master http github.com viennarss vienna conflict appcontroller.m browserview.h database.m  preferences.m,,
3281,fbe040c0e311bd3976b4f261b5a6808e74c5e9c1,alvatore Ansani <code@wabyte.com>, 2012-01-23 12:19:37 +0100, , fixed error warning deprecated function bit declaration,,
3282,02858ca04a40ba07bb046eafa9a25c805c98f5f6,stroeck <michael@stroeck.com>, 2012-01-22 23:47:12 +0100, , remove portable vienna,,
3283,d01a6f132a18cb3d41c980ec988c97d90a663537,stroeck <michael@stroeck.com>, 2012-01-22 23:19:02 +0100, , merge branch master,,
3284,a46f6cb0e5ab79948c32f04ad870cbab622a381e,stroeck <michael@stroeck.com>, 2012-01-22 21:41:18 +0100, , merge branch http github.com viennarss vienna,,
3285,44be906545147af60323393c595b9e94b393b838,arijaona Ramaholimihaso <github.com@barijaona.com>, 2012-01-22 22:48:28 +0300, , merge remote branch ref remote viennarss,,
3286,2b0f9346a6d23f53e7feb3dfc96921d479b24ee4,stroeck <michael@stroeck.com>, 2011-12-19 16:02:05 +0100, , add buffer plugin,,
3287,f2b69e06b64fc5ce0053804a776672a1d1cd298c,stroeck <michael@stroeck.com>, 2012-01-22 17:46:27 +0100, , fix several compiler warning,,
3288,a1a6c309efc89586a729094c27e28e26d8f13dd5,stroeck <michael@stroeck.com>, 2012-01-22 17:37:13 +0100, , fix build warning related format string,,
3289,dd981183b843c11683d406c25469aa75b8d07829,stroeck <michael@stroeck.com>, 2012-01-22 16:55:57 +0100, , resolve warning japanese version,,
3290,ea58193b9e5a62ba5b49cfa552de00a5e23bafc4,stroeck <michael@stroeck.com>, 2012-01-22 16:53:07 +0100, , remove unnecessary file,,
3291,6a294285ab9fc99181933acd72e7ab8db59cf0c3,arijaona Ramholimihaso <github.com@barijaona.com>, 2012-01-21 11:48:21 +0300, , fix currently encountered date format,,
3292,600434caf9bfffb0fdad657137af7e3f5abc654e,arijaona Ramholimihaso <github.com@barijaona.com>, 2012-01-21 11:24:08 +0300, , fix warning bit,,
3293,e051dbd8f130381f5d224b54c85ea84fa980e224,arijaona Ramholimihaso <github.com@barijaona.com>, 2012-01-21 04:31:16 +0300, , replaced pmtabbarcontrol framework universal powerpc bit intel build compiled http github.com nanoant,,
3294,90a18a624edd5fd3a7c45b8ac720057684a31806,arijaona Ramholimihaso <github.com@barijaona.com>, 2012-01-19 04:39:30 +0300, , added user data .gitignore,,
3295,3db9d77a70613f4a34ce21c86916d26c57313613,arijaona Ramholimihaso <github.com@barijaona.com>, 2012-01-19 04:28:44 +0300, , removed project reference replaced reference libz.dylib make project build snow leopard,,
3296,74386a09eb19198ad95bd747aef596f2994b3637,arijaona Ramholimihaso <github.com@barijaona.com>, 2012-01-18 22:21:25 +0300, , temporary snow leopard build remove unsupported delegate,,
3297,578b2f6e3e9b8277b6c047c71d24615848148c60,arijaona Ramholimihaso <github.com@barijaona.com>, 2012-01-18 22:18:31 +0300, , temporary remove fullscreen support building 10.6,,
3298,3794e495b3c93792fff6f329f3d239e020dfd394,arijaona Ramholimihaso <github.com@barijaona.com>, 2012-01-09 04:16:51 +0300, , avoid app freeze issue seen replacing sel_getuid call implementation may changed time sel_getuid might return selector already selector table always return valid selector using latter safe road apparently solved freeze encountered displaying feed,,
3299,7dc0d9298879d80759e018b1250345ebba730d71,alvatore Ansani <code@wabyte.com>, 2012-01-18 10:50:11 +0100, , 2800.3 release,,
3300,0a22401f8324f82778f8f3438f062224794fedb1,alvatore Ansani <code@wabyte.com>, 2012-01-18 10:27:49 +0100, , added support zulu date 2011 06t07 00z,,
3301,142382f01ab56f7d40617e531f661e7088343cbe,alvatore Ansani <code@wabyte.com>, 2012-01-18 08:47:54 +0100, , support xhtml title atom feed github issue,,
3302,acd15c43cde3e1c20a8de95430352d25453fae6f,nsani <salvatore@ansani.it>, 2012-01-17 23:48:08 +0100, , release 2800.2,,
3303,5f39923ea1bf2103482c3717bf621f1cfc966f3f,nsani <salvatore@ansani.it>, 2012-01-17 23:27:14 +0100, , fixed json issue 10.6.x google reader sync back work,,
3304,62bf21767bb00d4213817a11bae3998626e5138a,nsani <salvatore@ansani.it>, 2012-01-17 22:23:20 +0100, , added pst pdt date support modified function nscalendardate nsstring datestring include support date like wed jan 2012 pst wed nov 2011 pdt,,
3305,059e0fa670d2e935c0f3a2a7073b6d8bb9dee08b,alvatore Ansani <code@wabyte.com>, 2012-01-17 18:44:06 +0100, , fix xcode warning,,
3306,afd22e9bf80c6878e60213f6b4156521fe36f058,alvatore Ansani <code@wabyte.com>, 2012-01-17 18:17:52 +0100, , removed support libcurl run safely 10.6.x,,
3307,9e3136fc2ee3b83357b4f007737cee5f0707f968,alvatore Ansani <code@wabyte.com>, 2012-01-17 11:48:13 +0100, , merge branch viennarss conflict .gitignore,,
3308,97e81db000f7660865907922bc611468cc544007,alvatore Ansani <code@wabyte.com>, 2012-01-17 09:49:13 +0100, , added betarelease schema,,
3309,9912aff8b72106dd0b4088c719021c209867b3cc,alvatore Ansani <code@wabyte.com>, 2012-01-17 09:48:30 +0100, , updated .gitignore,,
3310,5bf717759b887c57f2de38b1f1b0751f7ea63e58,alvatore Ansani <code@wabyte.com>, 2012-01-17 09:43:37 +0100, , updated build description,,
3311,f821fda74d54dd67cab0dbd7ffd8e7bc2dc75a38,alvatore Ansani <code@wabyte.com>, 2012-01-17 09:42:32 +0100, , added sparkle support beta release,,
3312,9d25a33cea87e38fce4e2f26637e4f08691b3412,alvatore Ansani <code@wabyte.com>, 2012-01-11 15:21:58 +0100, , full support google reader sync asihttp class,,
3313,d2d4ed04a076e5781c9eb59c2002d6ff22c7561f,alvatore Ansani <code@wabyte.com>, 2012-01-09 10:20:50 +0100, , full support google reader sync,,
3314,6edb9fa6d54379aebacb5f35c07ac9b3a83b61ff,stroeck <michael@stroeck.com>, 2011-12-24 02:20:39 +0100, , update contributor list acknowledgement include curtis faith adam hartford salvatore ansani,,
3315,7a5519b4e6e05ce94ce9c193eb471a75b4752fca,stroeck <michael@stroeck.com>, 2011-12-24 02:00:33 +0100, , add .gitignore file,,
3316,d74d4c11d2d412061c0da1f751f93af3c11ae240,stroeck <michael@stroeck.com>, 2011-12-24 01:57:50 +0100, , use mit licence dual licensed,,
3317,779e9b8e8533a4281931b07fd5d51feaf993dd7d,stroeck <michael@stroeck.com>, 2011-12-19 16:28:18 +0100, , add xcode user data .gitignore,,
3318,f667c9d015b3348b53fd89a0b18eeca4df4cf6df,stroeck <michael@stroeck.com>, 2011-12-19 16:24:57 +0100, , .ds_store banished,,
3319,b2e9d7ed4949dab6f0e906d6bfc94fe9e5917edc,stroeck <michael@stroeck.com>, 2011-12-19 16:02:05 +0100, , add buffer plugin,,
3320,7211f4ddc39a286468482463a68667a883248dcb,stroeck <michael@stroeck.com>, 2011-12-19 15:58:39 +0100, , add developer specific file,,
3321,58287b9a83f3df908c756f9d2aab4271b0b69a45,stroeck <michael@stroeck.com>, 2011-12-19 14:31:47 +0100, , merge change salvatore ansani,,
3322,fe8ad845c42856d9b359c71f7c63f9e8eb6686dd,stroeck <michael@stroeck.com>, 2011-12-19 14:16:40 +0100, , add missing project file,,
3323,07ad33b827d360903b6d2532a1631516193b876f,stroeck <michael@stroeck.com>, 2011-12-19 13:35:19 +0100, , modernize xcode project setting increment build numner seting continued development,,
3324,205e1961f8ad7c43ab8c8d943ff88e4735055b95,osh Ringer <i.atent.dead@gmail.com>, 2011-10-04 14:55:58 +0100, , update growl.framework 1.2.2 growl 1.3 requires growl framework 1.2.1 order app support vienna currently really old dropping latest one continues support growl,,
3325,5831876de9031f198c91f44630988d7df27ee2fe,alvatore Ansani <code@wabyte.com>, 2011-12-07 10:30:26 +0100, , small 64bit fix,,
3326,87178c03ed8829ce8d446ebba567af7478f1eb3b,alvatore Ansani <code@wabyte.com>, 2011-12-06 12:55:33 +0100, , 64bit lion full screen support,,
3327,4d81ae84f1fa8e7afbef65574fd2e5a835df3cfb,ichael StrÃ¶ck <michael@stroeck.com>, 2011-10-05 15:41:15 -0700,2, merge pull request shoestring master continued growl support patch shoestring,,
3328,5aef8458cbe374ce8db66d6e7bb1b44656944202,osh Ringer <i.atent.dead@gmail.com>, 2011-10-04 14:55:58 +0100, , update growl.framework 1.2.2 growl 1.3 requires growl framework 1.2.1 order app support vienna currently really old dropping latest one continues support growl,,
3329,cd1091f7df8de91327c0926f52951d0bb425884c,ichael StrÃ¶ck <michael@stroeck.com>, 2011-08-29 00:45:39 -0700,1, merge pull request adamhartford master minor bug fix michael initial commit code adam hartford,,
3330,9ff5799fb932bfcb462e0477f202f5e15e329ef1,dam Hartford <adam.s.hartford@gmail.com>, 2011-08-28 22:05:37 -0400, , removed google toolbox,,
3331,1993d27d6d13ca45a89846f12352b7af1deaea89,dam Hartford <adam.s.hartford@gmail.com>, 2011-08-28 22:05:12 -0400, , reworked read flag syncing,,
3332,30d1d3572ead29f2e6b08f0f4c05a5ca83660e20,dam Hartford <adam.s.hartford@gmail.com>, 2011-08-28 22:03:54 -0400, , added url request log,,
3333,9e31fae895bb84d1d5342a6e16cdc4d1d6e32afb,dam Hartford <adam.s.hartford@gmail.com>, 2011-08-28 22:03:03 -0400, , refreshing google subscription push vienna,,
3334,30cd690530a124acc4ef5df81fa1ca14dc8845e6,dam Hartford <adam.s.hartford@gmail.com>, 2011-08-28 22:02:17 -0400, , sending notification article pulled google,,
3335,defb7e60e6573207c4ba6210067500dd11f2cc94,dam Hartford <adam.s.hartford@gmail.com>, 2011-08-28 21:58:03 -0400, , removed google toolbox import,,
3336,76d2a5b8480c8951974ecba5a891408b00763ff5,stroeck <michael@stroeck.com>, 2011-08-28 20:17:40 +0000, ,,,
3337,d5a3109829b38e13546187c34f7fdb09fce567a9,stroeck <michael@stroeck.com>, 2011-08-28 19:22:32 +0000, ,,,
3338,e4f107ed754289a1298942e2e1552c64b3401bf3,stroeck <michael@stroeck.com>, 2011-08-28 19:07:55 +0000, ,,,
3339,36a2cf7f716b62b4e5047a378e11c5d73cefec88,stroeck <michael@stroeck.com>, 2011-08-28 19:06:28 +0000, ,,,
3340,047a85532cd23b4287322fc2f3250fb9740ed9a3,stroeck <michael@stroeck.com>, 2011-08-28 19:04:46 +0000, ,,,
3341,6eafccb7a7a566c2bcd3a402482fc27a1aaf6234,stroeck <michael@stroeck.com>, 2011-08-28 18:54:02 +0000, ,,,
3342,c9e39d77ff41ef8500102f341f6f3bdefc0d0942,stroeck <michael@stroeck.com>, 2011-08-28 18:17:48 +0000, ,,,
3343,c3c6600eda9ffb29a2f5542d187536412a892db5,stroeck <michael@stroeck.com>, 2011-08-28 18:17:48 +0000, ,,,
3344,389d4290d4d10cf6f1e266f4bccc601dfb46dd0e,stroeck <michael@stroeck.com>, 2011-08-28 18:16:01 +0000, ,,,
3345,5f2c49e5fc2b7b5a98ca4d6a7d27507235856dc7,stroeck <michael@stroeck.com>, 2011-08-28 18:14:29 +0000, ,,,
3346,be076ec4330ebbb81df35a0ec68c1798c49c1cf7,stroeck <michael@stroeck.com>, 2011-08-28 18:13:41 +0000, ,,,
3347,66e048225dee302af05566f47d9e8c17c0a5e55c,stroeck <michael@stroeck.com>, 2011-08-28 18:12:51 +0000, ,,,
3348,0b85d00276a776a58688a44bb12c502de10bb136,stroeck <michael@stroeck.com>, 2011-08-28 18:11:58 +0000, ,,,
3349,39ed8a1ad9034faad649341037313b41055149bb,stroeck <michael@stroeck.com>, 2011-08-28 18:10:16 +0000, ,,,
3350,6a1fbb8119bd82c2d8bf6d3e3520c15b39d50bb5,tevewpalmer <USER@DOMAIN>, 2011-06-16 02:25:53 +0000, , update change note reflect recent change,,
3351,fba5e0fe1728b5e5f0fbe0bc83d699b9365cabcf,tevewpalmer <USER@DOMAIN>, 2011-06-16 02:25:53 +0000, , update change note reflect recent change,,
3352,4502f9473605fecd849a800e7979443be13c7796,tevewpalmer <USER@DOMAIN>, 2011-06-16 02:23:14 +0000, , mark article opened browser read,,
3353,ddbd1f4d5f0bf4791f921a3e5dc6178f55114b4e,tevewpalmer <USER@DOMAIN>, 2011-06-16 02:23:14 +0000, , mark article opened browser read,,
3354,ff5d68f0371aa5d7ec670db86e52e16bbbbd4971,tevewpalmer <USER@DOMAIN>, 2011-06-16 02:13:36 +0000, , support opening multiple article browser adding delay group link ensure success patch contributed jan,,
3355,c5d0dd41a245bd411756dbe6bd21aea414424055,tevewpalmer <USER@DOMAIN>, 2011-06-16 02:13:36 +0000, , support opening multiple article browser adding delay group link ensure success patch contributed jan,,
3356,16f0ace414b759f8d2483361c46f36ffea282666,tevewpalmer <USER@DOMAIN>, 2011-06-16 01:42:55 +0000, , support opening multiple article page contributed jan,,
3357,8b782798733a7131efef57bfcb78bb9c73ee42f0,tevewpalmer <USER@DOMAIN>, 2011-06-16 01:42:55 +0000, , support opening multiple article page contributed jan,,
3358,4489599d3d7fde0ba1d829976a45042a3bfe3090,tevewpalmer <USER@DOMAIN>, 2011-06-16 01:42:18 +0000, , update changelist 2.6.0,,
3359,b556b6d6d74cb6c5fd726adc424c51068ba35137,tevewpalmer <USER@DOMAIN>, 2011-06-16 01:42:18 +0000, , update changelist 2.6.0,,
3360,0b3de476d9af064c110a3f0adca5fd3df4228a6e,tevewpalmer <USER@DOMAIN>, 2011-06-11 03:05:42 +0000, , updating public key,,
3361,fdcbaaa1c220f735d4b3e5d19f2d7e5fc05d9e71,tevewpalmer <USER@DOMAIN>, 2011-06-11 01:55:58 +0000, , fix sparkle xml generation release file path spurious space also bump copyright year,,
3362,a97a160615ec554dcff98fe6cfc4be6f72f097c7,tevewpalmer <USER@DOMAIN>, 2011-06-11 01:16:05 +0000, , merge fix 2.5.1 2.6.0 trunk,,
3363,6cbe9a475efd8108d43e6888ed17faebb4fbe438,tevewpalmer <USER@DOMAIN>, 2011-06-11 01:16:05 +0000, , merge fix 2.5.1 2.6.0 trunk,,
3364,fdb61de45daee4b0a6712ee32e06312bb8c82f14,tevewpalmer <USER@DOMAIN>, 2011-06-11 01:01:04 +0000, , updated release instruction running,,
3365,ae204e7dcb63b1afa98349705c7295e0f54dfcc7,tevewpalmer <USER@DOMAIN>, 2011-06-10 04:16:48 +0000, , update note change release instruction minimum version 2.5.1,,
3366,92781ec5a799821571c2ca4fdeaa5c98143bfbdc,tevewpalmer <USER@DOMAIN>, 2011-06-10 03:59:56 +0000, , fix style rendering mac osx lion,,
3367,8936c8d975a848db73e3a96fd3b643f25e1c8b0e,tevewpalmer <USER@DOMAIN>, 2011-06-10 03:12:11 +0000, , fix twitter issue due change apis,,
3368,6bb28384369e80f324e1f80d1beac0092dbbe5e1,tevewpalmer <USER@DOMAIN>, 2011-05-11 03:56:16 +0000, , bump build number 2502 copyright year 2011 anticipation minor release,,
3369,53612e3c862a4d06977dbf1a2b2a74b13f112752,ohnson1234 <USER@DOMAIN>, 2010-09-03 22:01:07 +0000, , delete stray nslog call,,
3370,81a4606a2d97676aec9c6413cf6b3685cfb22897,ohnson1234 <USER@DOMAIN>, 2010-09-03 22:01:07 +0000, , delete stray nslog call,,
3371,7192de0769131fb65abcc60c52528395f5ecbe8c,urtis-faith <USER@DOMAIN>, 2010-04-03 07:25:33 +0000, , update true yes conform existing coding style,,
3372,70c2f7b78d0858a5f1d8dcc0971eef8db4a5f0d8,urtis-faith <USER@DOMAIN>, 2010-04-03 07:25:33 +0000, , update true yes conform existing coding style,,
3373,90cbbf847a15cc9b21a44b0419c710cebdd07dd0,urtis-faith <USER@DOMAIN>, 2010-04-02 11:12:34 +0000, , fixed bug change subscription infowindow saved window closed fixed bug edits subscription folder menu reflected open infowindows,,
3374,eb1dcf5791cbb075bb3efaff5406bb41df925acc,urtis-faith <USER@DOMAIN>, 2010-04-02 11:12:34 +0000, , fixed bug change subscription infowindow saved window closed fixed bug edits subscription folder menu reflected open infowindows,,
3375,d93339fa8461f4ba3bae61b73b82fff1e8a5df92,urtis-faith <USER@DOMAIN>, 2010-04-02 06:20:52 +0000, , updated activity window redirect logging include http code redirect,,
3376,9d72af01b9eb3822971bb1c8ac97898ef383999f,urtis-faith <USER@DOMAIN>, 2010-04-02 06:20:52 +0000, , updated activity window redirect logging include http code redirect,,
3377,d80ba6e742c363058b1f6d14abf0763b56ff55de,urtis-faith <USER@DOMAIN>, 2010-04-02 05:35:47 +0000, , fixed bug activity window detail text always listed spurious http redirect every single url,,
3378,5455834a62737a09bcdaf05ec787dc2010a90357,urtis-faith <USER@DOMAIN>, 2010-04-02 05:35:47 +0000, , fixed bug activity window detail text always listed spurious http redirect every single url,,
3379,03f9369a957db9dca1d64071219308219b226c86,urtis-faith <USER@DOMAIN>, 2010-04-01 22:48:16 +0000, , added new single key keyboard shortcut letter take beginning unread article,,
3380,1e286fd502d8ccd0917a136a6828a7d757a7ea0b,urtis-faith <USER@DOMAIN>, 2010-04-01 22:48:16 +0000, , added new single key keyboard shortcut letter take beginning unread article,,
3381,8a623332dad2e3ab421a3e22a3459cb69462c9aa,urtis-faith <USER@DOMAIN>, 2010-03-31 07:50:16 +0000, , added support open page safari preferred browser copy page link clipboard context menu item new web page based article,,
3382,fe07d04e7db4bb58fae7ea4121a88019a142ef93,urtis-faith <USER@DOMAIN>, 2010-03-31 07:50:16 +0000, , added support open page safari preferred browser copy page link clipboard context menu item new web page based article,,
3383,f45bace89c33ce521a5b747a380a1ce67033ef9a,urtis-faith <USER@DOMAIN>, 2010-03-31 06:16:51 +0000, , removed reload context menu item normal style based article since associated url give error,,
3384,510ae18c768150e28d4f9a58af50c8d31c337517,urtis-faith <USER@DOMAIN>, 2010-03-31 06:16:51 +0000, , removed reload context menu item normal style based article since associated url give error,,
3385,57b0055895ee22596a80d38e9672cac05cb7fb17,urtis-faith <USER@DOMAIN>, 2010-03-30 23:40:24 +0000, , added support context menu article web view selection link handle case style based web page based web view html,,
3386,8642591a953ee666aff2d9ec3b343cfd916712a5,urtis-faith <USER@DOMAIN>, 2010-03-30 23:40:24 +0000, , added support context menu article web view selection link handle case style based web page based web view html,,
3387,e3cade7a653c243406c1a5632175df0ab80dacc3,stroeck <michael@stroeck.com>, 2010-03-30 20:10:42 +0000, , localize folder menu change german,,
3388,bc893cfa2ff90bf169a9dac2ed23f2dc02d0d009,stroeck <michael@stroeck.com>, 2010-03-30 20:10:42 +0000, , localize folder menu change german,,
3389,4988dcde709a1b890e5abeb5f9b6adf27d68fc8e,urtis-faith <USER@DOMAIN>, 2010-03-30 09:46:25 +0000, , fixed bug folder infowindow updating changed flag via menu item via unsubscribe use web page article menu item,,
3390,b2da1b3680ce3164a96ccc3251e3758b8ebfc87b,urtis-faith <USER@DOMAIN>, 2010-03-30 09:46:25 +0000, , fixed bug folder infowindow updating changed flag via menu item via unsubscribe use web page article menu item,,
3391,7b8155824f5f695ada850a923efcc7e1dc68923b,urtis-faith <USER@DOMAIN>, 2010-03-30 09:09:16 +0000, , add use web page html item infowindow spanish italian japanese korean dutch brazilian portuguese swedish chinese taiwan china,,
3392,981454f5a6a7d3ab6aa1b2252ac2904526479fa4,urtis-faith <USER@DOMAIN>, 2010-03-30 09:09:16 +0000, , add use web page html item infowindow spanish italian japanese korean dutch brazilian portuguese swedish chinese taiwan china,,
3393,14ba22d8821259e332a46088c7b8f6d9b58dff32,urtis-faith <USER@DOMAIN>, 2010-03-30 07:06:35 +0000, , added menu item use current style article use web page article make new web page article feature discoverable moved folder specific get info ... unsubscribe feed menu item folder menu folder specific item,,
3394,20fd465fbd5d07f8b9d6daad79f91fc1ed073aa6,urtis-faith <USER@DOMAIN>, 2010-03-30 07:06:35 +0000, , added menu item use current style article use web page article make new web page article feature discoverable moved folder specific get info ... unsubscribe feed menu item folder menu folder specific item,,
3395,fe084cfbcb1ec2c9b3d3a7dd3889f3114f44c6be,urtis-faith <USER@DOMAIN>, 2010-03-30 07:05:06 +0000, , added menu item use current style article use web page article make new web page article feature discoverable moved folder specific get info ... unsubscribe feed menu item folder menu folder specific item,,
3396,4e95afcc1c68b0044e86b13144c1b0709a3fc970,urtis-faith <USER@DOMAIN>, 2010-03-30 07:05:06 +0000, , added menu item use current style article use web page article make new web page article feature discoverable moved folder specific get info ... unsubscribe feed menu item folder menu folder specific item,,
3397,c5a554cee33e2d53bac7d6e28d2f597c2398ffa7,urtis-faith <USER@DOMAIN>, 2010-03-30 04:44:10 +0000, , updated infowindow conform user interface guideline add load web page article checkbox updated nib format,,
3398,4d3608fbdd8d275624c56d7e75d1031592644284,urtis-faith <USER@DOMAIN>, 2010-03-30 04:44:10 +0000, , updated infowindow conform user interface guideline add load web page article checkbox updated nib format,,
3399,01fd3ccb5538bbc05e3be773c381f62559bf423e,urtis-faith <USER@DOMAIN>, 2010-03-30 01:44:53 +0000, , update keyboard shortcut help reflect addition synonym synonym,,
3400,1ee049ee191f328c5d42a6cbb08493faa58b2298,urtis-faith <USER@DOMAIN>, 2010-03-30 01:44:53 +0000, , update keyboard shortcut help reflect addition synonym synonym,,
3401,af3e4098791fab8e861942a3ab22b879cb9abe8e,stroeck <michael@stroeck.com>, 2010-03-28 22:00:12 +0000, , delete todo file completely dated set wrong expectation,,
3402,f630a869c2ed71ea5feaadf248b0a459581758bf,stroeck <michael@stroeck.com>, 2010-03-28 22:00:12 +0000, , delete todo file completely dated set wrong expectation,,
3403,8027686dd5e012763e375ccf61ce4ee5e7b989be,stroeck <michael@stroeck.com>, 2010-03-28 21:26:15 +0000, , update localization file 2.6 localize change german,,
3404,d0de8402b1a96d40463643dad739ecfd1664de24,stroeck <michael@stroeck.com>, 2010-03-28 21:26:15 +0000, , update localization file 2.6 localize change german,,
3405,daa47068f1c758f685b3be28c135fd74afeedec5,stroeck <michael@stroeck.com>, 2010-03-28 20:56:19 +0000, , checking back,,
3406,22526a23e7872afbd886a444cbeeab9b13226dca,stroeck <michael@stroeck.com>, 2010-03-28 20:56:19 +0000, , checking back,,
3407,04ba4e3f49b66eaf17f898de5c3dc1935b0f19dc,stroeck <michael@stroeck.com>, 2010-03-28 20:53:12 +0000, , wth,,
3408,b3252e70c3e3751a88bb23533c0ef663568ebecd,stroeck <michael@stroeck.com>, 2010-03-28 20:53:12 +0000, , wth,,
3409,fa8ed46202a86b7ef3edd15804ef425bb6bee325,stroeck <michael@stroeck.com>, 2010-03-28 20:50:38 +0000, , checking back,,
3410,a08af7309a9a4940c0c359b2a537d7b568b75a2e,stroeck <michael@stroeck.com>, 2010-03-28 20:50:38 +0000, , checking back,,
3411,051b6ed39c866f49dde6640ce1a4900fcfd6e745,stroeck <michael@stroeck.com>, 2010-03-28 20:46:49 +0000, , weird trouble file versioning deleting uploading fresh copy yes checking non functional revision ... sorry,,
3412,0704eeff07e6eb56f3b4f91bdd24a005fbb2328a,stroeck <michael@stroeck.com>, 2010-03-28 20:46:49 +0000, , weird trouble file versioning deleting uploading fresh copy yes checking non functional revision ... sorry,,
3413,da99b5b0b89afdb432c27fdea9ced92590d2b304,urtis-faith <USER@DOMAIN>, 2010-03-28 18:55:14 +0000, , added feature load web page corresponding feed article instead text feed added checkbox infowindow feed turn feature added new class draw progress indicator web page loading since longer instantaneous,,
