id,sha,author,date,issue,message,file,content
0,1526d7f6418d4b876f11d728144e8c91b84cf481,arijaona Ramaholimihaso <github.com@barijaona.com>, 2021-07-28 23:24:26 +0300,1466, merge pull request 1466 barijaona update_tests update github action use default xcode,,
1,ac5478cc607270daf14ef57015fe167608900efe,arijaona Ramaholimihaso <github.com@barijaona.com>, 2021-07-28 14:27:07 +0000, , update github action use default xcode currently macos default xcode 12.5,,
2,773c240b675287d352b09eebf07eb21c4353fb32,arijaona Ramaholimihaso <github.com@barijaona.com>, 2021-07-19 10:19:49 +0300,1387, merge pull request 1387 nielspl teststoswift rewrite test swift,,
3,a5421786093c7a91d857f6d6b9292fdefafc322d,arijaona Ramaholimihaso <github.com@barijaona.com>, 2021-06-27 16:32:24 +0300, , fix keyboard shortcut focus article view 1463 fix keyboard shortcut focus article view selecting link article view focus remained article view could use keyboard shortcut like mark folder read improve onkeydown remove unnecessary test command back forward authored tassilo karge tassilo.karge web.de,,
4,9e85db3db7a1e583e6d6193d6c88a58eb0d52193,itot <Eitot@users.noreply.github.com>, 2021-05-08 17:47:50 +0200,1436, merge pull request 1436 eitot localization update localization,,
5,3d8b2f611aa9318a13b6da9d54fa8f33f57500a7,itot <Eitot@users.noreply.github.com>, 2021-02-20 05:02:02 +0100, , update localized string,,
6,ce2e8969575c54fa7a404eabc0bf832c805edcbe,itot <Eitot@users.noreply.github.com>, 2021-02-07 15:42:41 +0100, , replace localized key unread localized key shown window title bar capitalized even though doe existing key reused purpose addition existing key support plural localization also replaces appname property appcontroller property provide functionality,,
7,6afc050aa6d896fde00be17a7b7b802476456ec0,itot <Eitot@users.noreply.github.com>, 2021-02-07 16:38:13 +0100, , add description info.plist localizable key,,
8,bc7aa91691ac6fb5f94eaba92b45276d0ab1e6d2,itot <Eitot@users.noreply.github.com>, 2021-02-07 16:38:05 +0100, , update several info.plist key update year copyright notice shortens icon label vienna plug style,,
9,1ff24bb5235d609f1cd2ed86e0f23327b9c3a48f,itot <Eitot@users.noreply.github.com>, 2021-05-02 18:04:26 +0200,1456, merge pull request 1456 eitot bintray swap bintray url github url,,
10,4d1088b915dc5a2dca1adf1a114e24d725261456,arijaona Ramaholimihaso <github.com@barijaona.com>, 2021-05-02 18:32:17 +0300, , complete instruction clarify github reference depository sourceforge cloning state dsym.tar.gz file also uploaded,,
11,634d057324b858c955be8f4f77f5d2030a2a9006,itot <Eitot@users.noreply.github.com>, 2021-05-01 13:05:37 +0200, , swap bintray url github url bintray discontinued may 2021,,
12,a1c6624765b2c392d603e365fdbbd5ad8f513a6b,itot <Eitot@users.noreply.github.com>, 2021-03-19 16:09:39 +0100,1446, merge pull request 1446 eitot sparkle update sparkle version 1.26,,
13,6206972da3fcfac1e65038c5d12995028a1fc3e8,arijaona Ramaholimihaso <github.com@barijaona.com>, 2021-03-01 08:06:01 +0300,1435, merge pull request 1435 takeanice webkit browser development continuation,,
14,dc5d08401309a23745c1bf299c4d2ed49c7bfbc5,arijaona Ramaholimihaso <github.com@barijaona.com>, 2021-02-19 10:06:33 +0000, , fix occasional crash,,
15,34cfc92cc15da2d52267c8dde3a9ff0f40150fba,itot <Eitot@users.noreply.github.com>, 2021-02-28 13:40:55 +0100, , update sparkle version 1.26,,
16,c6a219a9283dd57bbcfdce07149644ce503441a7,arijaona Ramaholimihaso <github.com@barijaona.com>, 2021-02-18 02:21:59 +0000, , make article view transition subtler,,
17,84bcbbe188e774cebfc69f45aa5ef9a8916c67ef,assilo Karge <tassilo.karge@web.de>, 2021-02-09 08:58:29 +0100, , indicate transition article improve loading indicator animation,,
18,f6c196650012c91132af99523c5a3b4bbc3998bb,assilo Karge <tassilo.karge@web.de>, 2021-02-06 17:24:44 +0100, , improve coherence title address bar reloading cancelling load,,
19,fa82a650a6e0a77539575043f847e0bf41309df5,assilo Karge <tassilo.karge@web.de>, 2021-02-06 17:37:36 +0100, , avoid force casting app delegate type,,
20,53e80d70e1651cbe43818f29ce7b6f8353a06594,assilo Karge <tassilo.karge@web.de>, 2021-02-06 17:00:42 +0100, , make blank url constant url extension,,
21,33c9fa3e20e580cb0a6762e9ce9a3a5f9f125a0c,assilo Karge <tassilo.karge@web.de>, 2021-02-06 16:16:42 +0100, , make cancel navigation invoke navigation end callback,,
22,520411bf5488039565d48513b00223b24aa2f349,assilo Karge <tassilo.karge@web.de>, 2021-02-06 16:10:40 +0100, , webview inset behind address bar address bar visual effect view,,
23,e11146b57b83970902a62ebe894ebc3416cf551e,assilo Karge <tassilo.karge@web.de>, 2021-01-31 15:39:52 +0100, , rename move address bar related function,,
24,155b1db28c7af263bbd18c6ea212761fc4b6f7c2,assilo Karge <tassilo.karge@web.de>, 2021-01-31 15:10:43 +0100, , simplify progress setting code,,
25,472fbe514c4dcc1837957290d8cc6ae7580f051c,ielspl <ezzora>, 2020-12-04 09:58:49 +0100, , move objective includes test bridging header,,
26,47d0c5c45fb2309ffe59f1c0cdcc1a84bde85a26,ielspl <ezzora>, 2020-12-04 10:16:59 +0100, , rewrite criteriatests swift,,
27,1a4d0a632c402d5503ec943407157ec9770f7a57,ielspl <ezzora>, 2020-12-04 10:12:22 +0100, , rewrite exporttests swift,,
28,6b10511fb6117bcea53a5482fdbb61ba7059490e,ielspl <ezzora>, 2020-12-04 10:05:07 +0100, , rewrite swift rewrite nsurl uriequivalence url uriequivalence swift,,
29,0da8319d8668fe675dff17a5fcf926a12b87f2da,arijaona Ramaholimihaso <github.com@barijaona.com>, 2021-02-06 20:26:53 +0300,1407, merge pull request 1407 barijaona webkit_browser2 webkit browser,,
30,83eb18a4ae9cfbd68b2a24be971afbc7e707538f,arijaona Ramaholimihaso <github.com@barijaona.com>, 2021-02-06 20:26:10 +0300,1432, merge pull request 1432 barijaona max width fix image overflow certain feed,,
31,f5189515ea3b789f5fda57447c052aae2e8854a3,arijaona Ramaholimihaso <github.com@barijaona.com>, 2021-01-31 17:09:56 +0300,1428, fix image overflow certain feed image illustration feed respect max width property set vienna style http feed github issue 1428,,
32,9f396e939b8451408bc7e2a4c4cf8b9223369781,itot <Eitot@users.noreply.github.com>, 2021-01-31 12:01:51 +0100, , rearrange file xcode project,,
33,0e7f7fc0fff23a71d4995205877eefea0c2474a2,itot <Eitot@users.noreply.github.com>, 2021-01-31 12:01:34 +0100, , tweak loading bar design user preferred accent color instead gray improves animation behavior,,
34,9bdbfb5e739e7ee7db17bcb7323f79358796c471,itot <Eitot@users.noreply.github.com>, 2021-01-24 18:13:00 +0100, , fix protocol conformance browserpane,,
35,211b07b02ce51ee98e36c3d851e3d1fcc5149c7b,itot <Eitot@users.noreply.github.com>, 2021-01-24 18:12:40 +0100, , expose webkit developer mode developer build also remove have_usleep preprocessor definition appears function,,
36,66763deb074320ec0ade5a524a9aaafa311144ca,assilo Karge <tassilo.karge@web.de>, 2021-01-24 17:32:36 +0100, , evaluate text selection upfront context menu,,
37,a33925e3345b0445a773da0fcfc575043c1cb242,assilo Karge <tassilo.karge@web.de>, 2021-01-24 13:07:16 +0100, , keep context menu opening link new tab,,
38,cfb5f1f1c5ff09b6feaf29a48e9d2e0cbac9c0bf,itot <Eitot@users.noreply.github.com>, 2021-01-24 08:04:15 +0100, , remove public access modifier needed since internal access default,,
39,8e598e450d95b09915b20c4e0056dc8a9c5bf04f,itot <Eitot@users.noreply.github.com>, 2021-01-24 07:36:52 +0100, , fix several warning remove semicolon swift code remove unneeded method declaration remove return value searchfor action method remove unneeded nullability annotation address needle warning update protocol conformance add objective signature address swiftlint style warning,,
40,bc58049df2d80bfbf403730f2e7a922dc6c2ffcd,assilo Karge <tassilo.karge@web.de>, 2021-01-23 19:52:28 +0100, , add preference checkbox browser choice,,
41,45544c7567cf90cc469f14cf2648ae1206c144c8,assilo Karge <tassilo.karge@web.de>, 2021-01-23 19:04:44 +0100, , fix old browser,,
42,0d41bc7b803e3aa9612e55047d3b31eed1575869,assilo Karge <tassilo.karge@web.de>, 2021-01-22 22:41:28 +0100, , prepare browser switch,,
43,0fddfb458e203d8bc792a50c00ba24d7c03e6eca,assilo Karge <tassilo.karge@web.de>, 2021-01-20 00:23:50 +0100, , handle context menu customization navigation article tab,,
44,8278341eee1e89408845b2cfd7f569151182a778,assilo Karge <tassilo.karge@web.de>, 2021-01-04 17:34:11 +0000, , hide address bar main tab yet working capitan macos 10.11 app hanging authored tassilo karge tassilo.karge web.de authored barijaona ramaholimihaso github.com barijaona.com,,
45,0658e31dc2110fe56ba87d38948bb168abc872f0,assilo Karge <tassilo.karge@web.de>, 2021-01-09 19:44:59 +0100, , allow web view content fullscreen,,
46,1c004f4f4c9fa51e8d67af2ac809358f3abe6954,arijaona Ramaholimihaso <github.com@barijaona.com>, 2021-01-01 22:12:07 +0000, , replace tab indentation space swift file involved current pull request,,
47,75dfe2a611d8a7f7c5b8f61beb062494ce192c43,ielspl <ezzora>, 2021-01-09 12:21:54 +0000, , add swift version articletests one,,
48,03d222dbcc94d21a3ba9b1f71ca6dceade6e21df,arijaona Ramaholimihaso <github.com@barijaona.com>, 2020-12-29 02:19:15 +0300, , fix articletests using,,
49,085797f101a20f292aaf394e5222b84be459251e,itot <Eitot@users.noreply.github.com>, 2020-12-28 11:22:26 +0000, , address linting warning rename three swift file,,
50,1c0e53f6f8137558ceda91205c731a70fbe2fe99,itot <Eitot@users.noreply.github.com>, 2020-12-28 00:43:29 +0100, , add additional wkmenuitem identifier use strict typing,,
51,a8b0aafe7dfbe976afbc437626ae60c84d2a5103,assilo Karge <tassilo.karge@web.de>, 2020-12-13 22:31:37 +0100, , fix http content type meta tag article,,
52,9e157112addedbe80b8e7fbebd33528b7925bf27,assilo Karge <tassilo.karge@web.de>, 2020-12-13 16:13:10 +0100, , improve style reloading emptying cache style change,,
53,38cad3aee8ce95c542ddc1011ffb50a5f832aade,assilo Karge <tassilo.karge@web.de>, 2020-12-13 14:28:52 +0100, , fix linter warning,,
54,c3b9605db8bd6f4f83ebe84ab7ff4f25d6e982ef,assilo Karge <tassilo.karge@web.de>, 2020-12-12 19:22:28 +0100, , continue new article converter,,
55,bdafb44718a1d24807d077cbd9662bd58d8958b2,assilo Karge <tassilo.karge@web.de>, 2020-12-06 15:13:34 +0100, , prepare new approach article loading,,
56,49acc1f73d00472cf20d9c0e9cb67f43cb2955a9,assilo Karge <tassilo.karge@web.de>, 2020-12-06 15:12:24 +0100, , make wkwebviews debuggable safari,,
57,7a871e7b498e879b7ce06f1916076f0de134f644,assilo Karge <tassilo.karge@web.de>, 2020-11-29 12:51:46 +0100, , layout change articleview articlelist,,
58,a0b1e449a833faa94603fb405230ba74eea60d4c,assilo Karge <tassilo.karge@web.de>, 2020-12-24 07:49:56 +0000, , fix style warning remove superfluous extension,,
59,90eec06ad9e02be4d01a055b678ef7bffd26ee07,osh <799345+josh64x2@users.noreply.github.com>, 2020-11-15 16:30:20 +1100, , remove availability check macos 10.10 minimum deployment target 10.11 need check 10.10,,
60,83e692dfe460c372ac4720f42cf7774202a2f490,assilo Karge <tassilo.karge@web.de>, 2020-11-15 20:00:18 +0100, , replace article view webkit version first attempt,,
61,a3411a3311b6cd6dc5e5b37fdd1fc52cc509d3d2,assilo Karge <tassilo.karge@web.de>, 2020-11-08 22:21:53 +0100, , restore correct style displaying,,
62,2c99c32114cdc746538e87b5c7d98575e911b195,assilo Karge <tassilo.karge@web.de>, 2020-10-26 21:33:15 +0100, , improve article view decoupling,,
63,b8dddd93d8df9c82bb04eca2d748965654316988,assilo Karge <tassilo.karge@web.de>, 2021-01-01 21:38:31 +0000, , refactor articleview articlelistview part make replacement wkwebview possible,,
64,3d7475c2606b6a2fed194fff16df2bf74aad24ab,arijaona Ramaholimihaso <github.com@barijaona.com>, 2020-10-24 14:43:24 +0300, , change tab loading indicator color,,
65,38106a780f14d1eec10c3add3a17067b9b8e9f91,assilo Karge <tassilo.karge@web.de>, 2020-10-18 12:17:58 +0200, , break retain cycle kvo strong self reference retaining customwkwebview,,
66,e6dba7b2559748b03b9a4d138f74bf3b3a2976ee,assilo Karge <tassilo.karge@web.de>, 2020-10-17 16:24:49 +0200, , fix problem contextual menu fix swap condition new tab background link opening nil image url context menu opened,,
67,326501f1e76df9ba380e927cdbb0ca3714d9b196,assilo Karge <tassilo.karge@web.de>, 2020-10-17 16:03:21 +0200, , correct add german localization browser related text,,
68,474c2ade1d6ddae38df5249ebeb1bd4a39982186,assilo Karge <tassilo.karge@web.de>, 2021-01-01 21:33:23 +0000, , refine context menu presentation functionality,,
69,48d6869b4424163709fa446cb853db1f3fdecc03,assilo Karge <tassilo.karge@web.de>, 2020-10-17 15:50:07 +0200, , pas triggering gui element subscriber,,
70,945d224710ddfb78b1f1d835ff563c96457b077c,assilo Karge <tassilo.karge@web.de>, 2020-10-17 13:13:26 +0200, , allow multiple url detection subscribing,,
71,0bfee9b39e69b1ed44ac5048205fe0d6f6d09809,assilo Karge <tassilo.karge@web.de>, 2020-10-17 11:53:32 +0200, , change indentation space move xib file interface,,
72,8253dbd7f72ad8b3244a5af19872ad5eb75f1413,assilo Karge <tassilo.karge@web.de>, 2020-12-23 05:43:09 +0000, , open tab right closing currently selected one,,
73,b860ac67ce9f8d23e843e6f5bbba522a137f6dee,assilo Karge <tassilo.karge@web.de>, 2020-10-11 18:08:19 +0200, , finalize context menu context detection wkwebview,,
74,93a1c479c864dd15394c66aa86455d4cc438fbab,assilo Karge <tassilo.karge@web.de>, 2020-12-23 08:35:38 +0300, , improve javascript injection right clicked link detection,,
75,e9cc24da83f9734cbe6bd9b30829634532ca12d0,assilo Karge <tassilo.karge@web.de>, 2020-12-23 05:10:54 +0000, , add context menu functionality,,
76,4acc104173eda32083c2748bdc4ebec5f369c4bd,assilo Karge <tassilo.karge@web.de>, 2020-09-13 13:15:23 +0200, , implement open new tab context menu customization wip,,
77,aad081337ff832321eb5dab14918c58dd6a426f6,assilo Karge <tassilo.karge@web.de>, 2020-09-13 13:11:08 +0200, , silence various style warning,,
78,7184f6ef5c2b3499972d04ac07334766730256f9,assilo Karge <tassilo.karge@web.de>, 2020-09-13 11:05:10 +0200, , turn outlet optionals make access safe,,
79,b6aacd23f41d7d0fdadf3a0278d86821a24d6140,assilo Karge <tassilo.karge@web.de>, 2020-09-12 18:53:24 +0200, , enable subscribing feed new browser set delegate browser,,
80,ad21f8783176984d02ca5cada4e7d96c987a8043,arijaona Ramaholimihaso <github.com@barijaona.com>, 2020-09-12 05:56:02 +0000, , make useragent similar safari twitter complaining browser supported anymore sic,,
81,6fdc507e4701d30139759b9e9195700fec8a8b1f,assilo Karge <tassilo.karge@web.de>, 2020-09-07 23:56:55 +0200, , add load indicator tab,,
82,aa1694deb380bf1f72aacabca335afa089d74a4f,assilo Karge <tassilo.karge@web.de>, 2021-01-01 21:27:29 +0000, , call tabbar delegate programmatic tab close,,
83,a42ca1586987a85fd8641b5e8f8ddcc9615121b0,assilo Karge <tassilo.karge@web.de>, 2020-08-23 23:03:43 +0200, , pas rsssubscriber property browser tab,,
84,dc262651975fc4d3aa55f0ca6fbeede1c93afb0e,assilo Karge <tassilo.karge@web.de>, 2020-12-26 11:59:17 +0000, , implement button new browser improve overall structure,,
85,99249f050695d09a4693c523246d9c29a2f1860c,assilo Karge <tassilo.karge@web.de>, 2020-08-23 13:27:20 +0200, , switch reload cancel better tab title refresh,,
86,60ad0c0b567a852d6d66f7979c9ee58e691daf01,assilo Karge <tassilo.karge@web.de>, 2020-08-22 12:03:56 +0200, , remove focus textfield change displayed url load,,
87,f7fd162e0c58746a25d43657abed3502617320aa,assilo Karge <tassilo.karge@web.de>, 2020-08-22 10:42:18 +0200, , solve nullability selectedarticle property,,
88,d41f431021f6c262e77700604c63c7a15c0a2d82,assilo Karge <tassilo.karge@web.de>, 2020-08-01 13:59:24 +0200, , stop playing sound tab close need find memory leak actually solve problem,,
89,5b7acbd6a43bb46a140437428a56972f0fa5bf45,assilo Karge <tassilo.karge@web.de>, 2020-07-29 08:42:37 +0200, , accept empty title tab title,,
90,e1f5a7e68bd426311dce38449f165ef5a3602cc0,assilo Karge <tassilo.karge@web.de>, 2020-12-23 02:57:23 +0000, , restore saving loading open tab load tab first opening,,
91,426d633db65375eb54f0afa0a82a1838a49090f8,assilo Karge <tassilo.karge@web.de>, 2020-07-29 08:41:37 +0200, , validate todos,,
92,d41df817acaa84c1be00e7627de963245b02a19c,assilo Karge <tassilo.karge@web.de>, 2020-08-10 17:11:21 +0200, , deploy browser tab xib new icon new osx version,,
93,02563275987a8e67de9b776c3269d1997a30e440,assilo Karge <tassilo.karge@web.de>, 2020-07-28 16:03:05 +0200, , use javascript add functionality missing webkitview,,
94,96d6500d34ecb997a22c41ea4190667fa27465d4,assilo Karge <tassilo.karge@web.de>, 2020-12-27 23:29:43 +0000, , update fix webkit based browser,,
95,bf4857077a4406d11ad8ce8fbe1723ae5152460e,assilo Karge <tassilo.karge@web.de>, 2019-04-27 17:08:18 +0200, , improve label webkit browser tab,,
96,8ed9a37e7826f90bc1eb819456f876a3998cc148,assilo Karge <tassilo.karge@web.de>, 2019-04-25 15:16:36 +0200, , add automatic switch webview webkit browser,,
97,bf2640876e10ff4eb89bf8bbe178c97441b1a92a,assilo Karge <tassilo.karge@web.de>, 2019-04-25 15:01:23 +0200, , rename tab protocol thing compatible wkwebview,,
98,63c39c03cfc30b37b68726f9b288ef2f8418226c,assilo Karge <tassilo.karge@web.de>, 2021-01-01 21:14:20 +0000, , start replacement webview articleview separate style loading article view,,
99,38ea8a5b8c291f6e72146bba7644cb2a8407ce7b,assilo Karge <tassilo.karge@web.de>, 2019-04-12 14:20:56 +0200, , add function evaluate whether scrolling possible idea brent simmons described http inessential.com 2017,,
100,2283706f7e0ba63bfc8d7d736b6801e28a4437e8,assilo Karge <tassilo.karge@web.de>, 2018-12-05 15:11:07 +0100, , partially implement tab title new browser fix swiftlint error,,
101,c55bbd3ba6b55c2c0422725372de48aada1b9902,assilo Karge <tassilo.karge@web.de>, 2018-11-19 19:27:49 +0100, , implement tab protocol old browser minor progress new browser,,
102,1e035dab5f7a669a39c2b7e2b33696b89bf078fb,assilo Karge <tassilo.karge@web.de>, 2018-11-12 19:16:35 +0100, , fix implementation activetab old browser,,
103,c75232ae2e566e242055d040068b1646378f0e6e,assilo Karge <tassilo.karge@web.de>, 2020-12-20 17:43:08 +0000, , restore old browser functionality,,
104,def26693ef57049a20c061f18051f82390e4837a,assilo Karge <tassilo.karge@web.de>, 2018-11-12 15:32:05 +0100, , restore closing new browser,,
105,cdc92f2b7b745289172146e822ccdbf0c1f7d691,assilo Karge <tassilo.karge@web.de>, 2020-12-19 17:37:14 +0000, , continue browser work old browser working yet new browser still lacking feature showing webpage least,,
106,5dd9fa2d7cf0a244416f606658cd08ae915c2a99,assilo Karge <tassilo.karge@web.de>, 2018-11-07 23:23:19 +0100, , add conformance tab browser protocol legacy browser,,
107,71a2ab04568ca7bbd1d4dd63d97122f9c03b3477,assilo Karge <tassilo.karge@web.de>, 2018-11-06 17:42:17 +0100, , remove browserview due nscoding issue macos 10.12,,
108,8a8af7a10e78584a42fb1c83555973cc5251d259,assilo Karge <tassilo.karge@web.de>, 2020-12-26 11:59:17 +0000, , refactor browser interface implementation new browser version non functional old browser need follow refactorings implement new protocol,,
109,6b792197b8990a0d8874d3f2cae684b030e1c443,assilo Karge <tassilo.karge@web.de>, 2018-10-31 19:02:34 +0100, , refactor articleview articlelistview make replacement wkwebview possible,,
110,a89959a2ec1dc011a5ff017cdef3ab5602b30418,assilo Karge <tassilo.karge@web.de>, 2018-10-27 21:47:12 +0200, , clean browser interface,,
111,9622b4317eb067eea099af06cf6343c7f183d521,assilo Karge <tassilo.karge@web.de>, 2020-10-26 21:35:42 +0100, , simplify url cleaning adapt test improve usage,,
112,d356d9263e85f058a6862b51d89352fbd981edee,arijaona Ramaholimihaso <github.com@barijaona.com>, 2021-01-09 11:09:34 +0000, , bump version number 3.7.1,,
113,689d8622b988fb842131b2ceb20d51875f4e1d75,arijaona Ramaholimihaso <github.com@barijaona.com>, 2021-01-09 13:50:11 +0300,1424, merge pull request 1424 eitot feed extractor replace xmltag richxmlparser parser libxml2 parser auto discovery feed url inside webpage,,
114,e47a0445627c3a6955586de4fb89055bd8fa7e0b,itot <Eitot@users.noreply.github.com>, 2021-01-05 22:20:35 +0100, , update swiftlint config,,
115,dd697fcc39f4f4ce2397c80240eb52ec6a5da385,itot <Eitot@users.noreply.github.com>, 2021-01-05 22:20:27 +0100, , add test case feed discovery,,
116,c2bc27bb63a400df8c54cc967f5ffa3bff6952d6,itot <Eitot@users.noreply.github.com>, 2021-01-05 22:20:12 +0100, , refactor richxmlparser feed discovery,,
117,403f9e2edbaaf9f3db0965c99b655136a9857dfb,itot <Eitot@users.noreply.github.com>, 2021-01-04 16:40:21 +0100, , add github issue template 1423 add github issue template,,
118,1aab78f10320350ae955b5b2fa14c7766755f28e,itot <Eitot@users.noreply.github.com>, 2021-01-02 21:10:29 +0100,1420, merge pull request 1420 eitot image fix swap wrong image enclosure article list,,
119,f20fae2d71cb69b70bf983143b64abd97e27b000,itot <Eitot@users.noreply.github.com>, 2021-01-02 14:39:59 +0100, , swap wrong image enclosure article list,,
120,5698f89d43784e13ad629554c8577478e5bf4d1e,arijaona Ramaholimihaso <github.com@barijaona.com>, 2020-12-31 13:39:54 +0300, , upgrade version number 3.7.0,,
121,1d6466fae9154bb4fab0098fe54e86231d4a395a,itot <Eitot@users.noreply.github.com>, 2020-12-31 03:40:18 +0100,1414, merge pull request 1414 eitot misc miscellaneous change,,
122,94fbecf1cc483b33035d4640c1e149c6bac332e5,itot <Eitot@users.noreply.github.com>, 2020-12-29 03:18:50 +0100, , update xcode project warning suppress warning,,
123,d526becff1c880f5b1d1f900d61c01537513bdeb,itot <Eitot@users.noreply.github.com>, 2020-12-29 03:15:37 +0100, , rename sparkle public key make connection clearer,,
124,1e1663e973d68cd28ab4d3c19f4c6eb044a05f73,itot <Eitot@users.noreply.github.com>, 2020-12-28 02:39:21 +0100, , merge colors.xcassets image.xcassets assets.xcassets,,
125,93e3948e870e1650d7243ca4b21cac9707d8ba7a,itot <Eitot@users.noreply.github.com>, 2020-12-28 02:00:54 +0100, , merge info.plist update url,,
126,0e49dce21ecf8cb6f3f626aa6cb358f65000e871,itot <Eitot@users.noreply.github.com>, 2020-12-25 12:44:40 +0100, , add missing function call,,
127,6967d8145a89867d3721118165fb170ba654814a,itot <Eitot@users.noreply.github.com>, 2020-12-24 15:59:10 +0100, , apply class property swift code,,
128,2cf0625e714bfed9c6dd6c43038ccdbdc0e48e75,itot <Eitot@users.noreply.github.com>, 2020-12-24 15:58:46 +0100, , use class property singleton shared instance functional impact purely syntactic sugar,,
129,93dd30a39f62c3cbf90327544a89c9499a22a3e2,osh <799345+josh64x2@users.noreply.github.com>, 2020-12-30 08:35:49 +1100,1413, merge pull request 1413 eitot database enable auto_vacuum sqlite migrate database,,
130,b2d06412eae6f8c4f91f57f5c5f1bb5ec4b039a8,arijaona Ramaholimihaso <github.com@barijaona.com>, 2020-12-29 09:18:50 +0300,1415, merge pull request 1415 eitot action update github action xcode 12.3,,
131,2ba69b0c533d009c52fbf1e85135a37cee41a923,itot <Eitot@users.noreply.github.com>, 2020-12-28 22:25:58 +0100, , update github action xcode 12.3 xcode 12.3 installed default additional change remove unneeded swiftlint installation step update checkout action version,,
132,93dd835fe1419b46cec2a246be700c4201bd16ca,itot <Eitot@users.noreply.github.com>, 2020-12-27 03:07:29 +0100, , enable auto vacuum mode database migrate version remove vacuum statement emptying trash likely longer need auto vacuum,,
133,1c705134497de9299e93701b68432de29445692d,itot <Eitot@users.noreply.github.com>, 2020-12-28 15:48:36 +0100, , reformat database migration category,,
134,187ed69d6ac84eb33c43b685b4c2be7d8ecee6b3,itot <Eitot@users.noreply.github.com>, 2020-12-28 18:00:30 +0100, , turn class database category,,
135,41624cc546ddf94485d5aa8ab93ce34592367cea,arijaona Ramaholimihaso <github.com@barijaona.com>, 2020-12-28 14:39:19 +0300,1410, merge pull request 1410 barijaona issue 1405 use main operation queue refresh nsurlsession,,
136,e5e7f7fe063b46c6ce77c041b36619039781b694,osh <799345+josh64x2@users.noreply.github.com>, 2020-12-28 08:48:37 +1100,1412, merge pull request 1412 eitot image update table icon symbol,,
137,cef78a7874fe52ed13090e17f325cc140a430ce4,osh <799345+josh64x2@users.noreply.github.com>, 2020-12-28 08:48:17 +1100,1403, merge pull request 1403 barijaona lenient lint run swiftlint lenient mode,,
138,02f7f87473ae877861846d02ca2cc8154b0443fd,itot <Eitot@users.noreply.github.com>, 2020-12-27 16:31:43 +0100, , fix corrupted image,,
139,358648b3acb78ca67f2f8dcce4f2926cc6e41444,itot <Eitot@users.noreply.github.com>, 2020-12-27 15:47:00 +0100, , turn several legacy table icon template image shift color light grey dark mode,,
140,50b5e08f913d68d4a2f074a1d153d20c67f5423f,itot <Eitot@users.noreply.github.com>, 2020-12-27 15:45:11 +0100, , use symbol table icon macos big sur,,
141,7a44329b8869b6723adc47e7128774abc3e308ad,arijaona Ramaholimihaso <github.com@barijaona.com>, 2020-12-25 04:31:58 +0300,1405, use main operation queue refresh nsurlsession fix refresh process stuck last remaining feed older system seen macos 10.11 reverts commit issue 1405,,
142,d7de37245e780e7bdfc7546047f781ad1156137a,arijaona Ramaholimihaso <github.com@barijaona.com>, 2020-12-24 23:12:51 +0300,1408, merge pull request 1408 eitot localization update localization,,
143,b519e90e5d36c6b75a0aaae0d7b92a0d80d18580,arijaona Ramaholimihaso <github.com@barijaona.com>, 2020-12-24 23:12:29 +0300,1409, merge pull request 1409 eitot availability fix remove availability workarounds macos 10.10 yosemite,,
144,bffb1e640d07298e667b1a1e5cb41aa74c354418,itot <Eitot@users.noreply.github.com>, 2020-12-24 13:42:20 +0100, , update localization also add non breaking space french string espace insã cable avoid dangling punctuation update dutch german string informal form address,,
145,4c235cf20131e02c9fa546309b268c8c6f029796,itot <Eitot@users.noreply.github.com>, 2020-12-24 14:32:59 +0100, , remove availability workarounds macos 10.10 yosemite,,
