id,sha,author,date,issue,message,file,content
3103,03d5e68698de0da77ee97775578822b55c6148ef,ohn Hodge <tpg@mutabah.net>, 2016-09-26 11:24:20 +0800, , macro_rules avoid cloning fragment going used,,
3104,24c06be95abd83e56f6b43d7a3ccfae833ebba73,ohn Hodge <tpg@mutabah.net>, 2016-09-26 09:47:23 +0800, , macro_rules clean expansion allow counting replacement,,
3105,dcdbc3801bd5c22f818ec60c65039d11fd46e78d,ohn Hodge <tpg@mutabah.net>, 2016-09-26 00:00:53 +0800, , macro_rules hackily work around quirk,,
3106,6c16703e6a3be274c4fe183ffde10fd7a20f8236,ohn Hodge <tpg@mutabah.net>, 2016-09-25 23:09:17 +0800, , ast convert use statement normal item,,
3107,72e2a322f52edd7bf3f37ad840f2d48be4192d62,ohn Hodge <tpg@mutabah.net>, 2016-09-25 22:18:33 +0800, , parse move pub parsing,,
3108,e7dfda0f39c3d89eaa17c5329a62d2faaa053cfa,ohn Hodge <tpg@mutabah.net>, 2016-09-25 22:04:38 +0800, , parse allow loading module macro invocation,,
3109,36e197f903ba19229b35cdd7c5bea045ca34dcdc,ohn Hodge <tpg@mutabah.net>, 2016-09-25 21:23:07 +0800, , parse ast support capturing item requires cloning ast item,,
3110,adc6e7e42f05724d031c50d6d0092753e87cc79d,ohn Hodge <tpg@mutabah.net>, 2016-09-25 18:01:01 +0800, , parse split module item parse form callable macro_rules,,
3111,07849e03b7d32ff28402ddd485326e00dbe2fedd,ohn Hodge <tpg@mutabah.net>, 2016-09-25 18:00:47 +0800, , macro_rules rough stubbed support item,,
3112,a2fc0567c434af1d5888db4f5c82df7f1e6b970f,ohn Hodge <tpg@mutabah.net>, 2016-09-25 16:13:14 +0800, , start liblibc add cfg_attr support loadcrates,,
3113,50b01c18df98c8502f823a4b9a9e347514870858,ohn Hodge <tpg@mutabah.net>, 2016-09-25 15:55:05 +0800, , mir gen fix bad monomorph call,,
3114,ec22e719937a46369fd18085d16185b1c411ad75,ohn Hodge <tpg@mutabah.net>, 2016-09-25 15:42:36 +0800, , mir gen match support floating point match,,
3115,3b01d3bba411a4eed45fde195abb2d39b4f6540a,ohn Hodge <tpg@mutabah.net>, 2016-09-25 14:57:07 +0800, , hir typecheck expr fix incorrect function pointer,,
3116,89b944a2b71f8937aa1dda81769eb3b852676d28,ohn Hodge <tpg@mutabah.net>, 2016-09-25 14:42:26 +0800, , hir hacky consteval fix,,
3117,a5be00d4761d314badc1dc4e9d0b63bb53eae07e,ohn Hodge <tpg@mutabah.net>, 2016-09-25 13:42:34 +0800, , hir support float pattern,,
3118,423327162381b78599ffee6d200198665deaff26,ohn Hodge <tpg@mutabah.net>, 2016-09-25 13:30:22 +0800, , resolve use visit code block trait default,,
3119,5722f6aa867e5d979e524abd9c685094b6d8e203,ohn Hodge <tpg@mutabah.net>, 2016-09-25 13:00:57 +0800, , parse expand support let expression macro,,
3120,be64c63a949929dc3d78d4fbeb125f290b1ba06b,ohn Hodge <tpg@mutabah.net>, 2016-09-25 12:42:24 +0800, , makefile clean libstd rule,,
3121,e5e35f133492a9a9e1bd5ad20a3cc4f363bd6c84,ohn Hodge <tpg@mutabah.net>, 2016-09-25 11:41:59 +0800, , mir minor commenting,,
3122,d8d68be7ebee43e47ce7be630f502895b3673010,ohn Hodge <tpg@mutabah.net>, 2016-09-25 11:41:46 +0800, , makefile add libstd make test,,
3123,6ca23cb77720210d98903c17fa8ad054edb9da85,ohn Hodge <tpg@mutabah.net>, 2016-09-25 11:41:18 +0800, , parse support method field qmark block statement,,
3124,fdb8db152bd911166ce3eed038b0997ba96025ca,ohn Hodge <tpg@mutabah.net>, 2016-09-24 23:04:47 +0800, , readme update progress,,
3125,7fa72647893f4661b701da4344e8b40645fbb0e6,ohn Hodge <tpg@mutabah.net>, 2016-09-24 22:58:28 +0800, , mir gen support zero arm match since never reached emit diverge,,
3126,8d8dcfa8484a134cace25983ae8682da464d3ca8,ohn Hodge <tpg@mutabah.net>, 2016-09-24 22:36:00 +0800, , mir gen match refactor decision tree code support sorted rulesets,,
3127,28228453f7f5c39f6fb262e0ebd63027db016192,ohn Hodge <tpg@mutabah.net>, 2016-09-24 18:22:53 +0800, , mir gen match tuple structs,,
3128,f84f2971e145b582425f2d74b4d99416fbe34f33,ohn Hodge <tpg@mutabah.net>, 2016-09-24 18:00:38 +0800, , mir gen match fix edge case dtn simplify work,,
3129,2f6b01e92050e9b0df1eb487b4d4f1644c8626a4,ohn Hodge <tpg@mutabah.net>, 2016-09-24 17:49:05 +0800, , hir typecheck expr hackily search method borrow search type,,
3130,24ee7b3a8b6fc2a52f6b3485ffe5087d144e4a28,ohn Hodge <tpg@mutabah.net>, 2016-09-24 17:01:06 +0800, , hir typecheck expr fix impl selection bug evil hack,,
3131,00fe2ba047251b0178681ce818a73003ab449785,ohn Hodge <tpg@mutabah.net>, 2016-09-24 16:11:45 +0800, , hir typecheck expr prevent ivar defaulting closure argument closure possibly unknown,,
3132,65ed9faae6cc318caf440ad5f04d63e09d83a1f5,ohn Hodge <tpg@mutabah.net>, 2016-09-24 15:55:52 +0800, , resolve work around edge case non canonical index path,,
3133,e47ffe1632f7eb03cfb5991b1528ed0e03b8f77e,ohn Hodge <tpg@mutabah.net>, 2016-09-24 13:56:21 +0800, , expand fix double insertion prelude,,
3134,71737150d4a6bd736257dda457398c77e10095bd,ohn Hodge <tpg@mutabah.net>, 2016-09-24 13:35:27 +0800, , resolve absolute emit ufcsunknown instead ufcsinherent splitting multi node ufcs,,
3135,5ab85713e1a2d49818717ce4a61beb80ba53ba0b,ohn Hodge <tpg@mutabah.net>, 2016-09-24 13:19:43 +0800, , hir typecheck expr monomorphise trait params associated type bound,,
3136,4032b1fb99fa78b27113c21b77eeaf0b5d8e36bf,ohn Hodge <tpg@mutabah.net>, 2016-09-24 12:35:23 +0800, , hir typecheck expr add todo associated type bound method requires,,
3137,1c29658a8c14df857858a5ab6f660047a0bee57e,ohn Hodge <tpg@mutabah.net>, 2016-09-24 12:08:25 +0800, , hir typecheck expr fix incorrect trait parameter comparison,,
3138,9f05fd7ffc8908ea5c266c40ec11a812fc6309d4,ohn Hodge <tpg@mutabah.net>, 2016-09-24 11:54:53 +0800, , hir typecheck expr provide list usable ivars find_method,,
3139,b236bbfb13db816666803778b79c22784088efb3,ohn Hodge <tpg@mutabah.net>, 2016-09-24 09:54:35 +0800, , hir typecheck expression add ivars method params,,
3140,e652bbb8630bc0c6708ca2a88d3d9938c8b9982a,ohn Hodge <tpg@mutabah.net>, 2016-09-23 10:18:26 +0800, , hir typecheck expr implement todo inserting associated type bound,,
3141,f8471947dfc2705a6bd4b74dd7f33125d67fc527,ohn Hodge <tpg@mutabah.net>, 2016-09-23 09:57:06 +0800, , resolve absolute preserve type argument import directly replaced e.g mem transmute intrinsics transmute,,
3142,7ce59f22a7f63cdd0a3e21c722e6b71eb31936ab,ohn Hodge <tpg@mutabah.net>, 2016-09-23 08:50:23 +0800, , hir typecheck expression clear flag disables ivar posibilities list empty,,
3143,2fa482cbc18890d9bbbae10c20e0cb1d964c0516,ohn Hodge <tpg@mutabah.net>, 2016-09-23 08:41:31 +0800, , hir typecheck expr _pathvalue ufcsinherent ivars,,
3144,79863239ffe60599f23657a92187922893caa855,ohn Hodge <tpg@mutabah.net>, 2016-09-23 07:28:57 +0800, , hir bind perform bind fixup _pathvalue,,
3145,8c65954ab3a8dd2728a091e20a97169556e8ac43,ohn Hodge <tpg@mutabah.net>, 2016-09-22 17:13:27 +0800, , hir typecheck expr inner coerce tuple literal,,
3146,bd3d33d1d570745231f428a01b0d88b1adca1c81,ohn Hodge <tpg@mutabah.net>, 2016-09-22 11:41:49 +0800, , hir typecheck expression use type bound _structliteral,,
3147,87f4af1ccabae6e64e3411eb60f6e4e8a51310b6,ohn Hodge <tpg@mutabah.net>, 2016-09-22 11:22:19 +0800, , main add hacky mrustc_debug environment variable enable debug pass,,
3148,099cc89cc8640121b7be1be4c8ba460e3ada7723,ohn Hodge <tpg@mutabah.net>, 2016-09-21 20:16:16 +0800, , hir typcheck expr equate self type method propagate ivars path,,
3149,a751bd155143c38a5ffd2b2499227a89c2628226,ohn Hodge <tpg@mutabah.net>, 2016-09-21 19:18:14 +0800, , hir typecheck expr allow coercing borrows lower pointer mut const,,
3150,540853263dee7b53d5950e7a5d3c3d58c2806f87,ohn Hodge <tpg@mutabah.net>, 2016-09-21 18:48:22 +0800, , hir typecheck expr refactor remove magic use,,
3151,a22527744c01ccf906e4a8cec88f94caccecbba1,ohn Hodge <tpg@mutabah.net>, 2016-09-21 11:41:40 +0800, , hir typecheck expr clean dead code,,
3152,043650929718d9a66fe598be7d475d213f69fdff,ohn Hodge <tpg@mutabah.net>, 2016-09-21 11:33:01 +0800, , hir typecheck expr defer method selection signature known,,
3153,a061ecdaa886886977939d844a70303dba81bc9c,ohn Hodge <tpg@mutabah.net>, 2016-09-21 11:01:16 +0800, , hir typecheck expr clean little detect multiple inherent method option,,
3154,9fded45253c1f4900f2b3076a201a8c1de74e1a0,ohn Hodge <tpg@mutabah.net>, 2016-09-20 17:17:33 +0800, , readme update short term goal,,
3155,917b4379ef224c68a084b17a10e6605be63db155,ohn Hodge <tpg@mutabah.net>, 2016-09-20 17:17:09 +0800, , expand format_args minor commenting todo actually emit fragment,,
3156,b589ef3e4437eb6eb5979240694499cec5a44f75,ohn Hodge <tpg@mutabah.net>, 2016-09-19 08:27:00 +0800, , hir expand closure fix bad type,,
3157,551baa8444eb73d9323609ae547bdf7d717417a0,ohn Hodge <tpg@mutabah.net>, 2016-09-18 17:12:07 +0800, , note extra box note updated todo,,
3158,a3fb9f77f7397cb906f526c2bf401c2dd8a7b0ce,ohn Hodge <tpg@mutabah.net>, 2016-09-18 16:56:56 +0800, , hir typecheck expr minor fix use free method argument count mismatch,,
3159,6b71fabd05aa1e3cbf5f18de988da18ee3d03c00,ohn Hodge <tpg@mutabah.net>, 2016-09-18 16:49:00 +0800, , hir typecheck expr unsizing pointer cast hacked,,
3160,c9ed676395ad319e29f6551411352b3506ab442b,ohn Hodge <tpg@mutabah.net>, 2016-09-18 16:40:54 +0800, , hir typecheck expr rough support cast trigger unsizing,,
3161,c947b1eab0e6ece06fb4524c1f197e6e8e66babd,ohn Hodge <tpg@mutabah.net>, 2016-09-18 16:08:18 +0800, , hir typecheck expr add bound fuzzy matched bound assoc rule work around check_coerce quirk,,
3162,9e4c0a06f57c5b5ba4e3f15ef67b5ee5695f2355,ohn Hodge <tpg@mutabah.net>, 2016-09-18 13:44:07 +0800, , hir typecheck expr fuzzy match support trait searching hacky type param ivar equiv coerceunsized,,
3163,95ea85ee5bf1403e3badcb9d890cf848c845ace0,ohn Hodge <tpg@mutabah.net>, 2016-09-18 09:52:28 +0800, , hir rework include node box better type inferrence,,
3164,b049dd7d36b991bb95f273d862f95f0865c929c2,ohn Hodge <tpg@mutabah.net>, 2016-09-17 10:25:12 +0800, , note expand box operator requirement,,
3165,f4c730973e17471b95cc385787647a7cec7d95a8,ohn Hodge <tpg@mutabah.net>, 2016-09-17 08:13:45 +0800, , hir typecheck expr minor commenting debug tracking box inferrence failure,,
3166,e503135eb7aa91bd28256b7f91b62ee265b47fdf,ohn Hodge <tpg@mutabah.net>, 2016-09-16 22:30:33 +0800, , note box operator quirk,,
3167,3bf66ae06912107e60b697358f9a17672a2db263,ohn Hodge <tpg@mutabah.net>, 2016-09-16 12:14:46 +0800, , hir minor comment format generic binding field,,
3168,0ce263d0111d4f875a45f12c7d6fe0f049a11cd9,ohn Hodge <tpg@mutabah.net>, 2016-09-16 12:11:38 +0800, , hir typecheck expr hackily assume placeholder type params impl trait,,
3169,7b5a16e7a6868d7fc2e973247885df1d3ab6d799,ohn Hodge <tpg@mutabah.net>, 2016-09-15 10:57:25 +0800, , todo remove implemented fix add new todo current blocker,,
3170,46f08d7173f621884c44003e5d730d7118fb0881,ohn Hodge <tpg@mutabah.net>, 2016-09-15 10:50:34 +0800, , typecheck expr fix comment,,
3171,2c1b3f5f1d83ba4e52922cfd666b251c2d3e2d5e,ohn Hodge <tpg@mutabah.net>, 2016-09-15 10:46:38 +0800, , typecheck expr handle diverging statement within block,,
3172,f3a065776fb6c584aae14dc9010e3e3edfbfd022,ohn Hodge <tpg@mutabah.net>, 2016-09-15 10:46:21 +0800, , main revert accidental commit debug enabled,,
3173,83512a2b797d69c536b5e8765cd98f0490d09c47,ohn Hodge <tpg@mutabah.net>, 2016-09-15 10:31:10 +0800, , parse typecheck validate remove implicit,,
3174,b150106b0fc68d52b492ffe485e3c9c3ddad1c22,ohn Hodge <tpg@mutabah.net>, 2016-09-15 10:28:04 +0800, , restructure insert automatic statement end block,,
3175,1b8a291c385ef116a30ff3f643eb82d0163549f6,ohn Hodge <tpg@mutabah.net>, 2016-09-15 10:26:36 +0800, , ast dump fix cofusing quirk output derive code,,
3176,4f67f872554b671340e4eb90d7712912563bb670,ohn Hodge <tpg@mutabah.net>, 2016-09-14 17:31:33 +0800, , todo bug typecheck requiring ast hir expression rejig,,
3177,43aa83c0ecf84445fc9f1159d1e0b8e8767d66a2,ohn Hodge <tpg@mutabah.net>, 2016-09-14 17:12:55 +0800, , hir typecheck expr fix possible bug closure trait selection,,
3178,d1382b793e98957e5d6664bea3b75af75d00f1ca,ohn Hodge <tpg@mutabah.net>, 2016-09-14 16:48:03 +0800, , hir type equate equal ivars,,
3179,66c7daa9edd6c60086f7b6f25040591d8974631e,ohn Hodge <tpg@mutabah.net>, 2016-09-14 16:47:32 +0800, , hir typecheck expr handle inferring type complex inherent impls,,
3180,905dd7912f926d412795b85c85f5e4d5bb270549,ohn Hodge <tpg@mutabah.net>, 2016-09-13 16:26:37 +0800, , hir typecheck expr minor cleanup planning fix,,
3181,28077c1de6433b8c8d7c5cf8b2af15818fa2772b,ohn Hodge <tpg@mutabah.net>, 2016-09-12 16:45:45 +0800, , hir implref clean code,,
3182,d3ec5f1180701cd96b6ff8b7aa762a1ec5313b1a,ohn Hodge <tpg@mutabah.net>, 2016-09-12 16:39:51 +0800, , resolve ufcs make missing method defintion error,,
3183,b254e34cc237eb331ed6b068ed57f1c89b28e347,ohn Hodge <tpg@mutabah.net>, 2016-09-12 16:39:18 +0800, , hir losen impl type matching little,,
3184,cf5d3d1349df9c5fe4b526476c4262abed8e5eef,ohn Hodge <tpg@mutabah.net>, 2016-09-12 11:24:52 +0800, , hir ast correct path range ops,,
3185,a4a4c80b9111e8442f8371bd6428d1295f1f48d3,ohn Hodge <tpg@mutabah.net>, 2016-09-12 11:01:03 +0800, , resolve ufcs hack let unknown ufcs path remain ufcsunknown resolved,,
3186,be5a94e5e1537e91e4ace4ed9694394dcef9f291,ohn Hodge <tpg@mutabah.net>, 2016-09-12 10:59:25 +0800, , hir fix edge case looking root module,,
3187,d711bdac7f85a10a346933b4ad4a87fc52c95504,ohn Hodge <tpg@mutabah.net>, 2016-09-12 10:52:40 +0800, , resolve ufcs minor debug message commenting,,
3188,6fe8cd798e8fca593c1b1d4048fee7a6607e8a98,ohn Hodge <tpg@mutabah.net>, 2016-09-12 10:41:36 +0800, , resolve absolute fix edge case index quite perfect,,
3189,7ab01ff3df9f14ca877633ab9f5aef4ed6c31f6b,ohn Hodge <tpg@mutabah.net>, 2016-09-12 09:39:44 +0800, , hir ast allow none item impl block,,
3190,d1b9ffeed07a3b8846b79a6ba6247b8c320efaf0,ohn Hodge <tpg@mutabah.net>, 2016-09-12 09:38:30 +0800, , resolve absolute split multi node ufcs,,
3191,058047f175ba166764a77956542bec786d59d21a,ohn Hodge <tpg@mutabah.net>, 2016-09-11 18:23:24 +0800, , resolve absolute support path splitting based hir trait,,
3192,a98cb27dedfe3b5005ac2d7b6d876ced4b4b6fc7,ohn Hodge <tpg@mutabah.net>, 2016-09-11 18:07:43 +0800, , resolve include binding struct constructor value,,
3193,d1edb6f8e5b9085ca3ad36d4c85d3bab810b19bc,ohn Hodge <tpg@mutabah.net>, 2016-09-11 18:07:29 +0800, , resolve absolute defensive asserts,,
3194,2cc7375dc027ed3d9ff72ad79d5c4a78acaf9abf,ohn Hodge <tpg@mutabah.net>, 2016-09-11 17:42:55 +0800, , resolve index replace imported item path destination,,
3195,18e863ba303abc9fcf5a3de3e0c94f662e13040e,ohn Hodge <tpg@mutabah.net>, 2016-09-11 16:58:28 +0800, , resolve index hir import support,,
3196,3052add7837b1a22ac3141a80bc367d08e1d3c19,ohn Hodge <tpg@mutabah.net>, 2016-09-11 16:46:50 +0800, , resolve use support hir valueitem import,,
3197,4027602be710a7fb321486c68d5722480976713a,ohn Hodge <tpg@mutabah.net>, 2016-09-11 16:45:06 +0800, , resolve use support direct lookup hir,,
3198,f9c52efa3d2226f752aee546aaf849fb4c6a7c85,ohn Hodge <tpg@mutabah.net>, 2016-09-11 16:42:05 +0800, , resolve use replace bug todo,,
3199,09b562021cd873625fd25b98b508e853ba47d879,ohn Hodge <tpg@mutabah.net>, 2016-09-11 16:14:16 +0800, , resolve use hir import searching wildcard import,,
3200,c06a0d7011130ffd63f81c604107db4e82323a5c,ohn Hodge <tpg@mutabah.net>, 2016-09-11 15:48:47 +0800, , main oops committed debug enabled,,
3201,08236689def47e7527c7dac84743a1b3308dcae0,ohn Hodge <tpg@mutabah.net>, 2016-09-11 15:48:17 +0800, , ast dump fix incorrect error,,
3202,9a27307479bc9685b19ab2dcaa3d734f3dc1ff29,ohn Hodge <tpg@mutabah.net>, 2016-09-11 15:45:31 +0800, , expand lang libcollections impl lang item,,
3203,ed7616f4ca8383e8b98aa65877e05c144dafc4de,ohn Hodge <tpg@mutabah.net>, 2016-09-11 15:42:08 +0800, , macro_rules rework handle vec edge case,,
3204,605f482f998628133703b4346e923bdab7ccd7f8,ohn Hodge <tpg@mutabah.net>, 2016-09-10 10:33:33 +0800, , note add rough compiler overview,,
3205,e6fb2d5ac1f761be46a4d9fb50261de6a96acd00,ohn Hodge <tpg@mutabah.net>, 2016-09-10 10:18:55 +0800, , note ponderings macro_rules,,
3206,7a484c58a6a1d2ab9600384c46a1100bab42161b,ohn Hodge <tpg@mutabah.net>, 2016-09-09 13:39:56 +0800, , expand move loading libstd libcore loadcrates cleaner debug,,
3207,f9518e5eab3797e88bb4ea7f13b5fa8ae929a783,ohn Hodge <tpg@mutabah.net>, 2016-09-09 13:16:45 +0800, , main suppress debug loadcrates phase,,
3208,5edfaaba2e48c04bc17185b1367ba60df3ed8677,ohn Hodge <tpg@mutabah.net>, 2016-09-09 13:14:31 +0800, , macro_rules fix printing better comment debug,,
3209,f4492fe0363ec0aee12391219559d616f75f662e,ohn Hodge <tpg@mutabah.net>, 2016-09-09 13:14:02 +0800, , note planning another rewrite macro_rules handling,,
3210,00662f7843b658eceb85b2fb182212cacc5615cc,ohn Hodge <tpg@mutabah.net>, 2016-09-08 09:57:23 +0800, , mir gen match support char range simple,,
3211,abc5759934306a55ba25016eeed9a522d81f20d3,ohn Hodge <tpg@mutabah.net>, 2016-09-07 12:42:35 +0800, , hir typecheck static magic impls function pointer,,
3212,9bd69a093dc619aa0cc587924c74d5355a539bc5,ohn Hodge <tpg@mutabah.net>, 2016-09-07 12:25:10 +0800, , hir typecheck expr trait impls closure come compiler,,
3213,a8fbfa06f2e8473e9190f5192b625a1d23b3c936,ohn Hodge <tpg@mutabah.net>, 2016-09-07 12:24:57 +0800, , resolve better impl previous hack,,
3214,e8cee52298043bad97b0e5482e4807bdbad825ca,ohn Hodge <tpg@mutabah.net>, 2016-09-07 11:57:25 +0800, , resolve absolute hack recurse maybebind return path,,
3215,0c7de5108939411a7bca6c1bbacacb226dd85039,ohn Hodge <tpg@mutabah.net>, 2016-09-07 11:41:22 +0800, , expand lang char lang item,,
3216,91dca07b665f05b4468378f922d630139b72f1fa,ohn Hodge <tpg@mutabah.net>, 2016-09-07 11:41:11 +0800, , makefile libcollections requires rustc_unicode,,
3217,9ddbbdc64821c64d0ec6a08160f81dd364911470,ohn Hodge <tpg@mutabah.net>, 2016-09-07 11:38:22 +0800, , makefile start libcollections,,
3218,57df16360d231f60d2030f490c1e73149b47857d,ohn Hodge <tpg@mutabah.net>, 2016-09-07 11:38:03 +0800, , loadcrates better error reporting,,
3219,93f6933b3b0493644e40be87de9b1955457c7da4,ohn Hodge <tpg@mutabah.net>, 2016-09-07 11:16:05 +0800, , parse fix slightly iffy float edge case,,
3220,883ab57da2b2b73208981854edc00a1bedefb5be,ohn Hodge <tpg@mutabah.net>, 2016-09-07 10:46:17 +0800, , readme update new progress,,
3221,d7d8e3e33d8950443eee0db30a983c9f45c65d30,ohn Hodge <tpg@mutabah.net>, 2016-09-07 10:41:30 +0800, , hir serialise support shallow mir drop,,
3222,2efc957fbdc7d09f0ee89df6b5a7032ded29cc00,ohn Hodge <tpg@mutabah.net>, 2016-09-07 10:37:36 +0800, , mir gen hacky shallow drop support support conditional,,
3223,d47803233fdc6a5576d5eb9f4495bce61f42ff7a,ohn Hodge <tpg@mutabah.net>, 2016-09-07 09:57:01 +0800, , mir gen cleaner box support start move structure,,
3224,84f82d42a8bd56f1f9dbd62d9d0255554002d315,ohn Hodge <tpg@mutabah.net>, 2016-09-06 18:36:56 +0800, , mir gen rough support box,,
3225,de087df3045bb802fe0de3cbb7859ca63d097d50,ohn Hodge <tpg@mutabah.net>, 2016-09-06 13:22:36 +0800, , hir typcheck expr check fix cast rule,,
3226,e3f224aa2bc05460faf68c8249c2d4c5ef93da61,ohn Hodge <tpg@mutabah.net>, 2016-09-06 13:18:38 +0800, , hir typecheck static support extraction associated type traitobject bound,,
3227,256e89db445be8567bea0bab33bdeade9e25c7a8,ohn Hodge <tpg@mutabah.net>, 2016-09-06 13:10:35 +0800, , hir expand ufcs hack desugar derefs box,,
3228,2988d96c4c985321650853b120dc2c973ed7ed78,ohn Hodge <tpg@mutabah.net>, 2016-09-05 11:46:30 +0800, , hir typecheck expr support extracting associated type trait object,,
3229,73f6bacc20dc8248654994d1d9a35e3aebcf7d0d,ohn Hodge <tpg@mutabah.net>, 2016-09-04 18:25:05 +0800, , hir typecheck expr hacky support box receiver,,
3230,9b3f03150b5a4b09f5d9bf6a95bf863ba2a8b0e1,ohn Hodge <tpg@mutabah.net>, 2016-09-04 17:22:06 +0800, , hir support fuzzy generic match traitobject,,
3231,1a6e144f8311faf6e6feaced2115ac00ae23d555,ohn Hodge <tpg@mutabah.net>, 2016-09-04 16:15:46 +0800, , hir typecheck expr magic unsize impl array slice,,
3232,2d58f74a1453646f330f4c83c1a421429bf6fc9e,ohn Hodge <tpg@mutabah.net>, 2016-09-04 15:18:47 +0800, , hir typecheck expr edge case coercion,,
3233,15281cae87f6715e452d683f6a4d0d8c3a63a62a,ohn Hodge <tpg@mutabah.net>, 2016-09-04 15:17:29 +0800, , hir typecheck fix trait search method,,
3234,c52f5f64bbc46b29aaa9d6e988b8e693a37266ca,ohn Hodge <tpg@mutabah.net>, 2016-09-04 14:41:44 +0800, , hir fix bad logic impl comparison,,
3235,889eddb04d3f1631d9361767886309dd2f9b989a,ohn Hodge <tpg@mutabah.net>, 2016-09-04 14:29:08 +0800, , hir fix sorting simplepath,,
3236,ca59f1e56b2fb221a86b53f75708b36524cc7274,ohn Hodge <tpg@mutabah.net>, 2016-09-04 12:23:10 +0800, , hir restructure _unsize handling operate pointer,,
3237,06f283b0a4c9b3e22bce6041d8345f1be53f13b0,ohn Hodge <tpg@mutabah.net>, 2016-09-04 09:11:01 +0800, , hir typecheck expr planning coerceunsized trait,,
3238,b8791fa5dab37a033c6578c60b3918d66cbbd295,ohn Hodge <tpg@mutabah.net>, 2016-09-03 17:17:23 +0800, , hir typecheck expr cast function pointer valid pointer unit,,
3239,487ef8ce6ba7a1e043fec039062b8099e5708060,ohn Hodge <tpg@mutabah.net>, 2016-09-03 16:31:49 +0800, , resolve split enum path pointing extern crate,,
3240,bc0f5eb833290bcb1eb6c0b71409029119cee9d2,ohn Hodge <tpg@mutabah.net>, 2016-09-03 16:20:09 +0800, , hir bind hack run extern crate,,
3241,dbf5ab5257fa4535585fb41794b6a86a5c74d637,ohn Hodge <tpg@mutabah.net>, 2016-09-03 14:59:48 +0800, , hir typecheck search type impls crate,,
3242,c9442608f88bb841660aa9358b42f3fc9729c72f,ohn Hodge <tpg@mutabah.net>, 2016-09-03 14:11:40 +0800, , resolve populated binding,,
3243,5b8ec18a7c2e85d4e0f8ebbbe24d816d0caa4a76,ohn Hodge <tpg@mutabah.net>, 2016-09-03 13:12:57 +0800, , hir ast add error message invalid value found earlier error bad binding,,
3244,4d009c4193449c61aaf8f863f27043f15f8212f4,ohn Hodge <tpg@mutabah.net>, 2016-09-03 13:07:03 +0800, , note update todo list completed item,,
3245,054889f94962caf08937831b1d083e921facd35d,ohn Hodge <tpg@mutabah.net>, 2016-09-03 12:58:24 +0800, , hir typecheck expr improve bug message,,
3246,d97e6ed14e09f3e37d84d5f19a9ae3658bce408b,ohn Hodge <tpg@mutabah.net>, 2016-09-03 12:58:14 +0800, , hir typecheck outer support exter crate,,
3247,1f2fc66be90767877c5a8618ab7609b3d8f6624c,ohn Hodge <tpg@mutabah.net>, 2016-09-03 12:54:01 +0800, , hir const eval minimal working mir consteval,,
3248,4e3402d25141e55faa2b6e733817b7c770c45e7d,ohn Hodge <tpg@mutabah.net>, 2016-09-03 12:44:10 +0800, , hir const eval structure mir execution support,,
3249,df7bfa80c3cc6f290297b084850c4c56a02a8393,ohn Hodge <tpg@mutabah.net>, 2016-09-03 12:35:38 +0800, , hir convert literal borrowof use full path,,
3250,aa33943f6fc268aefc3dd15a7f9bf2a9e36392e0,ohn Hodge <tpg@mutabah.net>, 2016-09-03 10:45:53 +0800, , hir const eval rough structure mir eval,,
3251,fa8e3d0b08443df9b5dc87184f30677b9f15236f,ohn Hodge <tpg@mutabah.net>, 2016-09-02 11:24:06 +0800, , hir const eval restructure allow mir execution,,
3252,445da8848d87f2becf454bc219b728516b9088d1,ohn Hodge <tpg@mutabah.net>, 2016-09-01 19:18:05 +0800, , hir const eval support pointer,,
3253,33d88d4c4605b6871d421c9ea618121c297e10d8,ohn Hodge <tpg@mutabah.net>, 2016-09-01 18:52:13 +0800, , hir const eval restructure item lookup make handling pointer easier,,
3254,c0c918cedadb414e7416023841b54f9984e19b90,ohn Hodge <tpg@mutabah.net>, 2016-09-01 17:42:32 +0800, , hir serialise save const literal,,
3255,2bd7558bb330433ee1b9db9e94231ddf53442bc6,ohn Hodge <tpg@mutabah.net>, 2016-09-01 17:17:21 +0800, , hir const eval extern crate support,,
3256,5acc77c720f46814a829e2f106db08ad51a820d2,ohn Hodge <tpg@mutabah.net>, 2016-09-01 16:54:23 +0800, , hir look impls extern crate,,
3257,bf2f4a5483c6e6c36718c287f21759a294682e60,ohn Hodge <tpg@mutabah.net>, 2016-09-01 16:19:53 +0800, , resolve import path,,
3258,ea65072638924847a61981f058d1f02af9fbe31d,ohn Hodge <tpg@mutabah.net>, 2016-09-01 14:41:52 +0800, , hir conv fix case crate name ignored,,
3259,7e0eb7625025bc88812ef04432290cd5599c9904,ohn Hodge <tpg@mutabah.net>, 2016-09-01 14:33:37 +0800, , hir fromast fix is_marker flag trait,,
3260,ab2fe156151026b05caee2f601e34fa37eb35df6,ohn Hodge <tpg@mutabah.net>, 2016-09-01 13:59:45 +0800, , resolve misc fix,,
3261,8b0de2417ccc96f10b97f6888c2ab3d72aa26858,ohn Hodge <tpg@mutabah.net>, 2016-09-01 13:42:53 +0800, , hir conv expand clean duplicated code,,
3262,86eb098313fbc292d411a39d1d3db04b0e58cc83,ohn Hodge <tpg@mutabah.net>, 2016-09-01 13:32:15 +0800, , hir support looking item using ext crate path,,
3263,8c8550756e4c1bcfef5195fce182f274a76e1e13,ohn Hodge <tpg@mutabah.net>, 2016-09-01 13:29:10 +0800, , resolve fix path ext crate,,
3264,0e84f7ae6f77001ddbb211f89e1f438b7fe96d6c,ohn Hodge <tpg@mutabah.net>, 2016-09-01 12:05:18 +0800, , resolve hir pointer enum variant,,
3265,def3719f94f1bed17b6018975b9919c46ca43f16,ohn Hodge <tpg@mutabah.net>, 2016-09-01 11:29:22 +0800, , expand support box operator untested,,
3266,09b5d7303ddc4638e2f2ba2a9037cb329784aacd,ohn Hodge <tpg@mutabah.net>, 2016-08-31 19:37:09 +0800, , hir ast trait binding,,
3267,443e92160885b4b7c3b0c0777b98566b70639861,ohn Hodge <tpg@mutabah.net>, 2016-08-31 19:28:22 +0800, , hir ast box receiver start fixing missing information,,
3268,891dffa57cdd2fd8b36d33c7588380355353f890,ohn Hodge <tpg@mutabah.net>, 2016-08-31 19:03:10 +0800, , hir support ext crate fromast,,
3269,375607009b31a21113616ead12716007789f9435,ohn Hodge <tpg@mutabah.net>, 2016-08-31 18:33:29 +0800, , resolve fix primitive hack,,
3270,4455197bebd63090768c9eee8f53cf225e44b64e,ohn Hodge <tpg@mutabah.net>, 2016-08-31 15:10:46 +0800, , resolve hack support multiple binding one use,,
3271,86bbb1aff4b4375e45b5fb04e586f81ff98edb95,ohn Hodge <tpg@mutabah.net>, 2016-08-30 22:00:26 +0800, , resolve minor debug,,
3272,737e1e2c4385852221968dee8fe21be09c342e24,ohn Hodge <tpg@mutabah.net>, 2016-08-30 22:00:02 +0800, , resolve use note handling mutiple binding,,
