id,sha,author,date,issue,message,file,content
0,b151c9aaafcf476b85af7d96b50e3e2ac0df646e,ohn Hodge <tpg@mutabah.net>, 2021-06-26 14:50:55 +0800, , rcstring fix potential read bound compare address 181,,
1,78742ef9de9e162373b46ac179bc2724d45a3cd7,ohn Hodge <tpg@mutabah.net>, 2021-06-13 13:31:16 +0800, , readme specific system tested close 180,,
2,b21d0bf9d2046595bc93da3b301610ac80745bbf,ohn Hodge <tpg@mutabah.net>, 2021-06-07 15:24:27 +0800, , warning cleanup,,
3,e60843d1c5e53f38acad33bafb1db168266263fc,ohn Hodge <tpg@mutabah.net>, 2021-06-05 10:33:28 +0800, , readme slight rewording switch irc server,,
4,ea9afabfc4b98d873c06adf52141898598cb5562,ohn Hodge <tpg@mutabah.net>, 2021-06-05 10:26:56 +0800, , note general idea edits,,
5,db6534178cf256d5928c525ddad168fa3d9df515,ohn Hodge <tpg@mutabah.net>, 2021-05-22 19:31:03 +0800, , standalone miri tweak improved overflow handling multiple version,,
6,f26c36d9db8058f8f159a0bd2e8da162ca0b1441,arc PoulhiÃ¨s <dkm@kataplop.net>, 2021-05-11 21:32:42 +0200, , change order gcc searched instead using triple triple gcc gcc use triple triple gcc gcc make easier override compiler every possible triple,,
7,3bfd3184289366ccb9e475b327df7bc25350e0ce,ustAnotherStrange <olinder1300@gmail.com>, 2021-05-19 20:17:29 -0400,177, fix 177,,
8,60d93085ff7e0f7f5224698374d60309cd35035b,arc PoulhiÃ¨s <dkm@kataplop.net>, 2021-05-10 14:22:07 +0200, , fix triple lookup valid char environment variable use instead instead invalid x86_64 linux gnu,,
9,73743c0e363f41866f1d1f6aef23c928980932b7,ohn Hodge <tpg@ucc.asn.au>, 2021-05-08 15:20:05 +0800, , loadcrates improve crate lookup remove need full path metadata,,
10,8f7baf68165571d381ddb47bef19eb4cd672924c,ndrius Å tikonas <andrius@stikonas.eu>, 2021-04-28 22:20:54 +0100, , minicargo.mk fix build dir path,,
11,0e2b4df2e9240e036adc7b65b21f95c417d3bf7f,ohn Hodge <tpg@mutabah.net>, 2021-04-28 22:01:12 +0800, , hir fix iterator invalidation expanding closure constant evaluation,,
12,7fbb1f2a67a1e4bb3b22c9c46a0e5e50baf2e618,ohn Hodge <tpg@mutabah.net>, 2021-04-26 13:08:15 +0800, , merge branch master http github.com thepowersgang mrustc,,
13,bca06c7402242d0110f8b75c5e52f0e0fb711163,ndrius Å tikonas <andrius@stikonas.eu>, 2021-04-25 17:11:19 +0100, , add gcc patch llvm upstream commmit http github.com rust lang llvm project commit,,
14,ed5413d1c1ec7a9e0ab2dc48d0b7394e58f51be2,ohn Hodge <tpg@ucc.asn.au>, 2021-04-25 22:06:55 +0800, , expand fix use free expanding exprnode_macro,,
15,025795969b1885e882bb5c3a3948450cf64ce58c,ohn Hodge <tpg@mutabah.net>, 2021-04-10 15:55:46 +0800, , codegen mmir remove magic generated drop glue generated earlier,,
16,db7fb0273dddd5efd5a6edbb7ea8f498b960e326,ohn Hodge <tpg@mutabah.net>, 2021-04-09 18:18:42 +0800, , hir cache eat result huge speed trans monomorph,,
17,a8e9b0366a6e9136920124e5e0f618ea535563e5,ohn Hodge <tpg@mutabah.net>, 2021-04-05 13:01:54 +0800, , hir constant evaluate fix little limitation bug window build,,
18,4b443e4a17b9986f9a91ecef695a3602fdf4e6a6,ohn Hodge <tpg@mutabah.net>, 2021-04-04 23:06:29 +0800, , misc fix compile runtime error msvc,,
19,21a9cb16d29974ae804f4f746e5a101dad0b947a,ohn Hodge <tpg@ucc.asn.au>, 2021-04-04 22:29:55 +0800, , add release note recent 1.39 push,,
20,75a0f59308bd6f903387774fbcb9ea9a65f89d0d,ohn Hodge <tpg@ucc.asn.au>, 2021-04-04 21:20:53 +0800, , readme document success 1.39.0 upgrade,,
21,5f489980f5914e7ad303db25cc68d2001e412b0b,ohn Hodge <tpg@ucc.asn.au>, 2021-04-04 21:18:37 +0800, , add support 1.39,,
22,52d1be089de3be222182404f162bea0e8136baf7,ohn Hodge <tpg@ucc.asn.au>, 2021-04-04 12:40:07 +0800, , minicargo.mk extended rustc environment variable,,
23,557e0bc23f83020e6f546940f278c788e6fe25a9,ohn Hodge <tpg@ucc.asn.au>, 2021-04-04 12:39:56 +0800, , codegen fix compile warning,,
24,a6401a7a2a78dd9e60a34d43508df0f9072dd021,ohn Hodge <tpg@ucc.asn.au>, 2021-04-04 12:16:05 +0800, , rustc 1.39 patch fix compile error,,
25,b9b23c5184940123087167960d7cb75a38760003,ohn Hodge <tpg@ucc.asn.au>, 2021-04-04 12:15:35 +0800, , run_rustc working rustc 1.39 bootstrap,,
26,ed5b8459aa87a0e822d0812c9b25ab924adf7d0e,ohn Hodge <tpg@ucc.asn.au>, 2021-04-03 11:34:24 +0800, , root add 1.39 build script,,
27,98098eda14cd5b0caac45242413bdb6a24b73320,ohn Hodge <tpg@ucc.asn.au>, 2021-04-03 11:33:50 +0800, , minicargo.mk minor add small header comment,,
28,2dfeaf9b5b415ae715f79162d248e0c8ffbb9da5,ohn Hodge <tpg@ucc.asn.au>, 2021-04-03 11:33:27 +0800, , run_rustc add intermediate hello_world test,,
29,e2680896141412f116c5b18b244a6315f7d466c1,ohn Hodge <tpg@ucc.asn.au>, 2021-04-03 11:32:41 +0800, , script override 1.39.0 linux include gcc_s unwind misread build script,,
30,4817e4f92cdbd9cb413a4e9e90b038d70cdb4e7a,ohn Hodge <tpg@ucc.asn.au>, 2021-04-03 11:30:58 +0800, , minicargo.mk copy output binary changed,,
31,3a092624687ce961ec5713eb6b5d672aa9cdb58f,ohn Hodge <tpg@ucc.asn.au>, 2021-04-03 11:30:25 +0800, , codegen return variant index,,
32,a762d02394b42c1c4a6bedfad5cd0f20da4e7eef,ohn Hodge <tpg@ucc.asn.au>, 2021-04-02 15:37:26 +0800, , minicargo support running rustc handle subtle difference command line args,,
33,4668be7705e77971eca7c46ac9d4360167e2ce27,ohn Hodge <tpg@ucc.asn.au>, 2021-04-02 15:37:01 +0800, , rustc 1.39 patch move static link llvm backend hack always applies,,
34,5d6ae845059dc6ce4f2fbf89ba6b959e7b1899df,ohn Hodge <tpg@ucc.asn.au>, 2021-04-02 08:53:49 +0800, , trans target added commented required sse2 x86_64,,
35,e8aec299adb17ab64656ac4e7558a116f3a7b338,ohn Hodge <tpg@ucc.asn.au>, 2021-04-02 08:53:17 +0800, , hir static borrow constant comment mut,,
36,46b6dafdb09b48dc7a4ede1889099c3af8055ae7,ohn Hodge <tpg@ucc.asn.au>, 2021-04-02 08:52:53 +0800, , rustc 1.39.0 patch disable simd,,
37,fc04978f34596fa703be3c46a71c2829ac648c9d,ohn Hodge <tpg@ucc.asn.au>, 2021-04-02 08:52:26 +0800, , tranc codegen fix alignment zero sized array,,
38,7768ce5b9b03684fd2c5e3684776979e68b8e60f,ohn Hodge <tpg@ucc.asn.au>, 2021-03-29 22:54:54 +0800, , rustc 1.39 patch fix name error slice length hack,,
39,d371fa722c1b12f652b591d026677c15032b07a1,ohn Hodge <tpg@ucc.asn.au>, 2021-03-29 22:54:29 +0800, , dump_hirfile support const,,
40,5ff3f6577e69e23843dcdbe6956946b484ac51b2,ohn Hodge <tpg@ucc.asn.au>, 2021-03-29 22:54:00 +0800, , libproc_macro fix one error serialisation v128,,
41,af76fa6dd95dbbdf05fcc73a1d0118375b33b909,ohn Hodge <tpg@ucc.asn.au>, 2021-03-29 21:24:25 +0800, , hir fix missing non indexed impls,,
42,b8606b96d0d9132b6a081133985052df0696150c,ohn Hodge <tpg@ucc.asn.au>, 2021-03-28 20:11:32 +0800, , hir optimise trait lookup merging list,,
43,cc5265c3200f346da0a91e3396a682ad9115b252,ohn Hodge <tpg@ucc.asn.au>, 2021-03-28 13:17:17 +0800, , misc building running rustc complete feature flag check failure disabled arch specific feature using mrustc specific source patch added stronger support simd probably needed anymore,,
44,27e10d71598ec49c9b46680a77d638f3204c80eb,ohn Hodge <tpg@ucc.asn.au>, 2021-03-23 00:13:20 +0800, , rewrite encoding evaluated constant encodedliteral instead literal,,
45,a00f21c87abc835067c0b63f8bfce33703002265,ohn Hodge <tpg@ucc.asn.au>, 2021-03-21 13:23:56 +0800, , mir optimise handle bit xor bools,,
46,e29c0660be7aade2d880bfbc3df12b5e91fbd0e0,ohn Hodge <tpg@ucc.asn.au>, 2021-03-20 14:09:57 +0800, , bnf experiment improvement,,
47,4536aa562b859c1400b7096a18ac3a052b36a2df,ohn Hodge <tpg@ucc.asn.au>, 2021-03-07 20:49:52 +0800, , support placeholder bit,,
48,0eaf40b1d305d69372a5047f6a9323c00978aa11,ohn Hodge <tpg@ucc.asn.au>, 2021-03-06 22:22:31 +0800, , readme fix spelling error tweak wording,,
49,8cbacadf25803ba2c0df00c1e0121db802e45d58,ohn Hodge <tpg@ucc.asn.au>, 2021-03-06 22:09:07 +0800, , makefiles tweak 1.39,,
50,ae0a35fdaad3156fe977c556da1add6db499cc8e,ohn Hodge <tpg@ucc.asn.au>, 2021-03-06 22:08:17 +0800, , patch rustc 1.39 patchset commented disable size check u128 disagreement,,
51,0affeda28676eba1356595c9a741a01576731f60,ohn Hodge <tpg@ucc.asn.au>, 2021-03-06 22:07:43 +0800, , codegen fix misaligned zst field calculation,,
52,8c870e6887c08e3f2ef3435903634c99e791b85f,ohn Hodge <tpg@ucc.asn.au>, 2021-03-06 21:36:59 +0800, , codegen fix size_of_val calculation bug,,
53,b5711e9b72dc4605c95d94f26838ed4ae783df21,ohn Hodge <tpg@ucc.asn.au>, 2021-03-06 18:51:23 +0800, , hir fix bug specialisation ordering,,
54,044820b104fc30588570c628dd3935875a22d397,ohn Hodge <tpg@ucc.asn.au>, 2021-03-06 18:50:50 +0800, , return impls still possibly specialisable,,
55,ac96868b47f584622dcccea91165e01e5430df2a,ohn Hodge <tpg@ucc.asn.au>, 2021-03-06 15:06:16 +0800, , minicargo tweak behaviour get_next_minor 1.39 dep,,
56,b0174c6e723a912454260ffe67e593f004e17cfd,ohn Hodge <tpg@ucc.asn.au>, 2021-03-06 15:04:58 +0800, , minicargo set edition test,,
57,31126d5f62845569cb0b900132fb904331156948,ohn Hodge <tpg@ucc.asn.au>, 2021-03-06 15:03:26 +0800, , misc warning cleanup,,
58,122fee3f90b9342202ddc27496092ce5abc6f37c,ohn Hodge <tpg@ucc.asn.au>, 2021-03-06 15:02:57 +0800, , target enable i128 emulation x86_64 match rustc abi,,
59,62116803cb58f2137cafeda1d581fe2dff7bb8aa,ohn Hodge <tpg@ucc.asn.au>, 2021-03-06 15:00:41 +0800, , trans fix return type erased type hack bunch sse intrinsics,,
60,16e1a9694c0d8f51f8416d97012cbccc64358594,ohn Hodge <tpg@ucc.asn.au>, 2021-03-06 15:00:02 +0800, , typecheck expression properly look trait bound looking method,,
61,5375d7a1aafa0fd51464c9075a31f372e2e8fa45,itan Mosenkis <eitan@mosenkis.net>, 2021-03-01 16:19:55 +0200, , fix typo readme.md 169 fix typo readme.md update readme.md authored david tolnay dtolnay gmail.com authored david tolnay dtolnay gmail.com,,
62,298fef8673ee80e594d86ab420e7e41c5cfdcf78,ohn Hodge <tpg@mutabah.net>, 2021-02-28 13:29:22 +0800, , mir tweak handling constant evaluation propagation 168,,
63,67e868b0df6a258b4939c2c725eb47207ed08d2e,ohn Hodge <tpg@mutabah.net>, 2021-02-28 12:56:20 +0800, , codegen handle alignment hack type array fix 167,,
64,68ac4670be70dd950f80a0f05b0401c985dc958d,ohn Hodge <tpg@mutabah.net>, 2021-02-28 09:55:44 +0800, , generator write basic test fix bug exposed,,
65,387ab29889a3ab611e654c60d22e5b0e89580283,ohn Hodge <tpg@mutabah.net>, 2021-02-27 17:33:30 +0800, , hir mir compiling sure running generator codegen,,
66,c4ffb4c942a4d6a9deb345c3174b1bb13dc893c6,ohn Hodge <tpg@ucc.asn.au>, 2021-02-22 08:10:52 +0800, , compile fix gcc,,
67,84aa98ba03913f043a453c6fb2566dc40b7eb041,ohn Hodge <tpg@mutabah.net>, 2021-02-21 21:11:28 +0800, , hir initial structure converting generator state machine ... creating structs leaving actual state machine mir,,
68,b1cb8907b69385e1321d1b18eb6b54542a78d4b7,ohn Hodge <tpg@mutabah.net>, 2021-02-21 11:53:58 +0800, , hir typecheck limit loop scope within closure reject invalid code,,
69,c4f09f854d8e2e6c5000d12bf557c9d04d4dae2d,ohn Hodge <tpg@mutabah.net>, 2021-02-21 11:35:46 +0800, , hir add new generator type class stub thing related generator type,,
70,8be1215b380769130fd69b86f3d8dbc6bf0c177f,ohn Hodge <tpg@ucc.asn.au>, 2021-02-21 07:36:29 +0800, , hir typecheck tweak allow travis compilation,,
71,ae1facf4cbff303e6dba2957e66e358c5d3689c3,ohn Hodge <tpg@mutabah.net>, 2021-02-20 20:48:55 +0800, , hir add _yield operator stubbed,,
72,cf596129f08e804f1b4b49825570b51d548af0a7,ohn Hodge <tpg@mutabah.net>, 2021-02-20 19:55:31 +0800, , vsproject set,,
73,b8f2ee580ac232b5219722477c82c36d562b61b2,ohn Hodge <tpg@mutabah.net>, 2021-02-20 19:55:04 +0800, , vsproject support empty rcstrings,,
74,23fa28c4f9a668e3737eb0b3b5422ae572d74548,ohn Hodge <tpg@mutabah.net>, 2021-02-20 19:54:48 +0800, , common change name macro improve ide usage,,
75,a711cc7eb8ad38dc797593be7cccff9cbe7b12ad,ohn Hodge <tpg@mutabah.net>, 2021-02-20 19:54:04 +0800, , expand improved logging,,
76,879d7fef92ac1af21cc276bf80f9cf0d0b9dc892,ohn Hodge <tpg@mutabah.net>, 2021-02-20 19:53:36 +0800, , ast fix missed data cloning type,,
77,586feee1874f2c423de7bf8436057427c30f3219,ohn Hodge <tpg@mutabah.net>, 2021-02-20 19:53:12 +0800, , ast parse rough support generator static yield,,
78,1a227534ed9739145769756f350588f210f69874,ohn Hodge <tpg@mutabah.net>, 2021-02-20 16:13:34 +0800, , mir lower remove unneeded asserts slightly better commenting,,
79,d7da3a2b31b6d008d6122e428edccffb0a4f5239,ohn Hodge <tpg@mutabah.net>, 2021-02-20 15:54:32 +0800, , note note todo.txt,,
80,f9acd760121503630e22943c8a12f67ea4a474ed,ohn Hodge <tpg@mutabah.net>, 2021-02-20 15:54:01 +0800, , vsproject increase stack size debug build,,
81,6f095ede73bb0df019f77e63a64877d1c37c199e,ohn Hodge <tpg@mutabah.net>, 2021-02-20 15:30:19 +0800, , mir lower fix use free loopcontrol,,
82,01410626649aaa4f8a03dc10e5f62474d7f6e0bb,ohn Hodge <tpg@mutabah.net>, 2021-02-20 10:51:01 +0800, , hir typecheck fix incorrect use fixing api fit expectation,,
83,57e2248db2a4e772d7c7c3136b506ceb4b6f4677,ohn Hodge <tpg@mutabah.net>, 2021-02-19 20:50:36 +0800, , hir resolve handle type alias enum variant used function,,
84,4751d7d94aded25c914285712c7c140990bc5603,ohn Hodge <tpg@mutabah.net>, 2021-02-19 20:21:15 +0800, , hir resolve update enum variant constructor value correct node type,,
85,51361ca19df75e35260fbffd6e0bc77115fa838e,ohn Hodge <tpg@mutabah.net>, 2021-02-19 19:27:43 +0800, , hir typecheck validate autoderef pattern,,
86,adcdcaadff56b81b6338b34e97165192c2f9bbde,ohn Hodge <tpg@mutabah.net>, 2021-02-19 07:31:32 +0800, , hir conv tweak resolution enum pattern,,
87,f8e39bc0d9b2853e4ae765d681f4baf37e752f67,ohn Hodge <tpg@mutabah.net>, 2021-02-17 21:51:08 +0800, , hir expand type alias handle enum variant,,
88,5638ab90efd47342fdb0f64c093c343d3fe63f57,ohn Hodge <tpg@mutabah.net>, 2021-02-17 20:13:05 +0800, , hir combine struct enum pattern defer resolution name type alias expanded,,
89,f907ccc2e3942eadcf9d508539bcd2d37d435243,ohn Hodge <tpg@mutabah.net>, 2021-02-14 17:19:37 +0800, , parse replace hacky braced macro logic flag exprnode_enum,,
90,48b0bab2a302a654d7b9d6b520d9983797f287ea,ohn Hodge <tpg@mutabah.net>, 2021-02-14 16:28:18 +0800, , mir optimise replace get_called_mir get_value,,
91,13a40cc3b4d2ad976316b0223137c595bab42b1a,ohn Hodge <tpg@mutabah.net>, 2021-02-14 16:26:58 +0800, , provide provided trait method body get_value unless sure applicable impl type non generic,,
92,494160dd536b6fa604aeb1f08286afed5b4f4dba,ohn Hodge <tpg@mutabah.net>, 2021-02-14 14:06:31 +0800, , hir traitimpl check trait args impl type match ordering rfc fix 1.39 incorrect resolution,,
93,652118bac5d799c2323fbd8ec41925e8cc78fb3d,ohn Hodge <tpg@mutabah.net>, 2021-02-14 12:37:47 +0800, , trans enumerate refactor use get_value,,
94,e62984e220cb28f947c8571d3e4f3d927b18bf24,ohn Hodge <tpg@mutabah.net>, 2021-02-14 09:20:12 +0800, , mir validate check function arg return type,,
95,de0feab79a1373747d8e3a14558f2e3b2885403f,ohn Hodge <tpg@mutabah.net>, 2021-02-13 17:51:37 +0800, , typecheck expression run eat detected type impls duplication work,,
96,ec37732b87dd3bb90a75d5577f0981b3ea1f4977,ohn Hodge <tpg@mutabah.net>, 2021-02-13 15:38:04 +0800, , minicargo framework supporting mmir build script,,
97,d73ec4cb89074e8032a6b3730a46bd2a0a7ff1a5,ohn Hodge <tpg@mutabah.net>, 2021-02-13 15:37:27 +0800, , vsproject enable multi processor compilation,,
98,402c865771276c5ced51404d8036757cdaeb71fb,ohn Hodge <tpg@mutabah.net>, 2021-02-13 15:37:03 +0800, , common minor renumber ordering enum make log message easier read,,
99,d804c703d0071e279f10593f11f8ca9d6b850983,ohn Hodge <tpg@mutabah.net>, 2021-02-13 15:27:54 +0800, , typecheck expression tweak cast logic provide information pas,,
100,98d0bd6830ac62a51470ee75ebe39ba319862575,ohn Hodge <tpg@mutabah.net>, 2021-02-12 20:50:39 +0800, , override add rustc proc_macro 1.39,,
101,0123bcf013ea2c161096c9c35b8d4ceff1730116,ohn Hodge <tpg@mutabah.net>, 2021-02-12 20:50:00 +0800, , hir expand reborrows support checking reborrows diverging block,,
102,fd7ceb447705d23e5d1633772d289564b179b17a,ohn Hodge <tpg@mutabah.net>, 2021-02-12 20:48:02 +0800, , typecheck expression handle post expansion closure type_is_clone,,
103,896692f8e6889fc6740bd4c96a724910bc88a033,ssam E. Maghni <issam.e.maghni@mailbox.org>, 2021-02-11 12:04:00 -0500, , make replace make make macro make defined posix make http onlinepubs 9699919799 utility make.html tag_20_76_13_09,,
104,9bf590ab160239a1ba1921fa7a2ba48e010f1edf,ohn Hodge <tpg@mutabah.net>, 2021-02-12 19:55:24 +0800, , mir optimise handle const param indexing,,
105,1d34889cd82a30b0a8da03f79dab990fbaa1d9f4,ohn Hodge <tpg@mutabah.net>, 2021-02-12 19:15:21 +0800, , mir gen match fix support splitslice trailing pattern clean tu_matcha tweak is_pattern_move logic handle multiple binding,,
106,deeb2df020a5bc1bf03bbfba8d35e0184256338c,ohn Hodge <tpg@mutabah.net>, 2021-02-10 21:15:09 +0800, , hir typecheck rework bound handling aty bound,,
107,8d9b895e90df531e59d5b16aa21b9674420f0ddd,ohn Hodge <tpg@mutabah.net>, 2021-02-09 21:12:01 +0800, , hir erased type include impl params erased type origin path use get_value instead custom code,,
108,22a375cffbefa5d4840e840f2d17ea98983ef52d,ohn Hodge <tpg@mutabah.net>, 2021-02-09 20:57:58 +0800, , hir expand closure handle splitslice binding,,
109,cabdb6b76b7b4822ee6d319476d5ff8cf0bf056e,ohn Hodge <tpg@mutabah.net>, 2021-02-09 20:05:34 +0800, , typecheck expression add bound aty bound,,
110,22986b916eab61efdcd5043a900aa38370326420,ohn Hodge <tpg@mutabah.net>, 2021-02-09 17:40:01 +0800, , typecheck expression proper support slice pattern extra bind,,
111,c89801dc8740461844d76e36549db92a393e522f,ohn Hodge <tpg@mutabah.net>, 2021-02-07 21:59:07 +0800, , hir typecheck expression handle _unsize used type ascription,,
112,31b1bba5ea10884371cbe851ce88b590a990ad95,ohn Hodge <tpg@mutabah.net>, 2021-02-07 21:58:27 +0800, , hir const eval improve masking casting integer really make full miri,,
113,439fa4411bb74f7ad2c5d5cdb0a962fe11b89dc0,ohn Hodge <tpg@mutabah.net>, 2021-02-07 20:50:53 +0800, , vsproject natvisfile add useful debugger hint,,
114,9da242973049b767538aebfe69d3a9a9b5ce8226,ohn Hodge <tpg@mutabah.net>, 2021-02-07 20:50:32 +0800, , hir bind support binding pattern enums yet bound,,
115,df42812e0d13030ea8d11066bd08907391a27c0e,ohn Hodge <tpg@mutabah.net>, 2021-02-07 20:50:02 +0800, , hir ast allow aty trait bound erasedtype,,
116,75520779c88102d5e3b981fa89cae001cdac758d,ohn Hodge <tpg@mutabah.net>, 2021-02-07 20:49:37 +0800, , hir better error message unexpected type,,
117,8bfe2e21aad6346fd8f89361211e03ab79e6afe4,ohn Hodge <tpg@mutabah.net>, 2021-02-07 19:13:13 +0800, , resolve use fix ordering glob explicit import,,
118,177e7852b3c218571ae195d68676b0b45d2f15be,ohn Hodge <tpg@mutabah.net>, 2021-02-07 17:29:02 +0800, , hir fix associated type source trait,,
119,1e15a59821c9bdad5e8f2672e8afe7539c2bcae3,ohn Hodge <tpg@mutabah.net>, 2021-02-07 13:44:31 +0800, , hir add associated type bound hir traitpath erasedtype use,,
120,4b71cb51c3450bbab43b7ed5d4652dd65c7d7e2f,ohn Hodge <tpg@mutabah.net>, 2021-02-06 11:49:15 +0800, , ast dump dump anon module,,
121,ae7ed0d55d7da3c1021a1147cbb6dfd80ce9a34f,ohn Hodge <tpg@mutabah.net>, 2021-02-06 11:49:04 +0800, , resolve visit type type annotation expr type,,
122,cd492b2c82b96a7f6c5f4db3947db0cd5a7af271,ohn Hodge <tpg@mutabah.net>, 2021-02-06 09:56:28 +0800, , ast dump fix printing pattern maybebind,,
123,0fcbf76332f36911df54f06ec554e5570f933373,ohn Hodge <tpg@mutabah.net>, 2021-02-06 09:56:05 +0800, , parse create new hygiene scope invoking macro_rules macro invocation,,
124,b0e693496e08df8d29e407e30346c80988bae1cd,ohn Hodge <tpg@mutabah.net>, 2021-02-04 22:39:23 +0800, , parse implement try ... using pre existing code,,
125,210158f9af04f586c9e584f662add957193c3ab2,ohn Hodge <tpg@mutabah.net>, 2021-02-04 22:31:26 +0800, , parse add 2018 edition keywords fix parsing foo,,
126,305b9371045f7a9daaf5c34b1576647a9e60b8ce,ohn Hodge <tpg@mutabah.net>, 2021-02-04 18:47:02 +0800, , tool backend_c fiddling separate backend,,
127,d961238666529e153bade9aebffa3f42bfac0468,ohn Hodge <tpg@mutabah.net>, 2021-02-04 18:44:11 +0800, , standalone_miri fix parsing variant,,
128,8bf7a6bb9f4bdddbd3d71efef5d1f68f2e7c624b,ohn Hodge <tpg@mutabah.net>, 2021-02-03 22:36:37 +0800, , typecheck expression add coercion,,
129,0795f055550ed3522e5e8b4eb8cd94e1885c813a,ohn Hodge <tpg@mutabah.net>, 2021-02-02 20:58:21 +0800, , natvisfile nicer simplepath printing,,
130,44cd6ca5fdeef27ddcbe56d9aa2fd13787890623,ohn Hodge <tpg@mutabah.net>, 2021-02-02 20:57:55 +0800, , libproc_macro tweaked test,,
131,ff60cd37e4658c7e9638087d0c09aa49f9dd54bc,ohn Hodge <tpg@mutabah.net>, 2021-02-02 20:57:37 +0800, , resolve use fix assertion anon module lookup,,
132,03feee41e6be2e9af167fb3afd8ae9b93a7a0c69,ohn Hodge <tpg@mutabah.net>, 2021-02-02 20:54:47 +0800, , mir optimise support associated constant,,
133,e1c6c50caedec4354f23a67c159abb55c30d0803,ohn Hodge <tpg@mutabah.net>, 2021-02-02 20:46:36 +0800, , hir const eval evaluate enum variant available layout generation,,
134,ee941ae5c8c38f2de9fb1b152ae40f6b377bff69,ohn Hodge <tpg@mutabah.net>, 2021-02-01 21:43:37 +0800, , expand erased type run eat result,,
135,7fdff1d87cf5ef0b917fc7a4a50c7162268151ba,ohn Hodge <tpg@mutabah.net>, 2021-01-31 18:48:22 +0800, , expand proc_macro fix decoding signed integer doe even exist,,
136,ca1e60bfc180623910473fd2f1b199e09588d3cb,ohn Hodge <tpg@mutabah.net>, 2021-01-31 17:00:56 +0800, , typecheck expression fix around type annotation erased type inherent method lookup,,
137,bde3506ebf8dacc176d9456d1bfe370ed25a5e88,ohn Hodge <tpg@mutabah.net>, 2021-01-31 14:14:10 +0800, , codegen support command file filename work around long command line,,
138,535cbb84629b4f66eb5736824d7f700f14343102,ohn Hodge <tpg@mutabah.net>, 2021-01-31 14:09:20 +0800, , parse lex fix msvc compile error think variable used uninitialised,,
139,fcfbf16ed7fd809438660c82d1f4da10613b169f,ohn Hodge <tpg@ucc.asn.au>, 2021-01-31 10:39:51 +0800, , codegen manual library lookup handle scoped search dirs,,
140,bdd1e8cc5b29ccf9805a865a16a0a04252c98bf4,ohn Hodge <tpg@ucc.asn.au>, 2021-01-31 10:31:33 +0800, , minicargo.mk pas manifest override,,
141,3a24911cc499501f4e5b9e97e08217b2268a9129,ohn Hodge <tpg@ucc.asn.au>, 2021-01-30 17:22:22 +0800, , minicargo simplify common environment variable,,
142,7804e7a96ff0f20c64c29f05b1257ede7cdf5468,ohn Hodge <tpg@ucc.asn.au>, 2021-01-30 16:13:29 +0800, , trans target allow atomic u16 x86_64,,
143,ea7a0ab884f4bcbc8089bdfc2613e087ef2cbbb0,ohn Hodge <tpg@ucc.asn.au>, 2021-01-30 10:52:08 +0800, , run_rustc minor comment runing rustc minicargo,,
144,01bdea55a2a09f774bf8777af41df2dcae503aca,ohn Hodge <tpg@ucc.asn.au>, 2021-01-30 10:45:04 +0800, , debug increase max recursion depth libtypenum,,
145,dd74fa1b28471fcc68b61ffda0e09b4642803b1b,ohn Hodge <tpg@ucc.asn.au>, 2021-01-30 10:44:36 +0800, , expand avoid assertion,,
146,38a2b13a65ebc850a243a96858f05156b6e24da2,ohn Hodge <tpg@ucc.asn.au>, 2021-01-30 10:43:38 +0800, , parse fix macro parsing expression wrong path class allow item exprs fix unused variable lex,,
147,064ca18484a691f5b469384d297b8ef3187e7b5b,ohn Hodge <tpg@ucc.asn.au>, 2021-01-30 10:43:14 +0800, , main correctly report target rustc version,,
148,2abdfba1da2a3f707d98896d3cf84af172fdf481,ohn Hodge <tpg@ucc.asn.au>, 2021-01-29 18:51:59 +0800, , test fix 1.39 test build,,
149,42cadbcb5ff631cee001ae249be393c3645dbb79,ohn Hodge <tpg@ucc.asn.au>, 2021-01-29 07:56:26 +0800, , script override corrected override 1.39 linux,,
150,089f654dd91abc30759f12f3f6da7faa301e70c7,ohn Hodge <tpg@ucc.asn.au>, 2021-01-29 07:56:03 +0800, , target add atomic gnu link opts,,
151,a80e16fe9c757e638e9d94be2b7a07e690bbb993,ohn Hodge <tpg@ucc.asn.au>, 2021-01-29 07:55:39 +0800, , codegen explicit code rotate left,,
152,b79dbbbb88722f85c5fdc3d453fcdbf23c077d03,ohn Hodge <tpg@ucc.asn.au>, 2021-01-29 07:54:57 +0800, , expand add concat_idents finally required 1.39 libc,,
153,13a03ea2013fa1fea41ea61476f5ff5c9108b431,ohn Hodge <tpg@ucc.asn.au>, 2021-01-28 23:17:59 +0800, , 1.39 linux fix reach libstd,,
154,785821fc357e68ce5c0bb26caa4443ced02660a8,ohn Hodge <tpg@ucc.asn.au>, 2021-01-28 22:39:09 +0800, , makefiles general tweak 1.39.0 linux build,,
155,bc2a7895e570fa1ecce6d89e57f696ceb3db1854,ohn Hodge <tpg@ucc.asn.au>, 2021-01-28 08:15:15 +0800, , target fix alignment repr enums,,
156,caee3058d8c02358381fcb8dc8f694fd59bc5992,ohn Hodge <tpg@ucc.asn.au>, 2021-01-27 20:22:15 +0800, , standalone miri misc fix recent refactor,,
157,6b728e021d6cd81811a3171257ab538e0b2f1659,ohn Hodge <tpg@mutabah.net>, 2021-01-26 21:14:23 +0800, , typedata variant recent debugging,,
158,a3b8b956a39203dc5e12c2552cd9b405b0afe8f3,ohn Hodge <tpg@mutabah.net>, 2021-01-26 21:11:08 +0800, , trans rework enum representation allowing better space optimisation repr u16 enum matching rustc,,
159,40800d3dc098ae4b604a5192f309ff0f5ecc600e,ohn Hodge <tpg@mutabah.net>, 2021-01-25 16:54:34 +0800, , mir replace rvalue variant rvalue enumvariant rvalue unionvariant preparation enum optimisation,,
160,08d3631e7fb4cd1ac786e2453dbb8183e4e6a348,ohn Hodge <tpg@mutabah.net>, 2021-01-25 10:26:41 +0800, , codegen handle extern type getting address unsized field,,
161,57420ca3d47ad69365e9ab7c4671da7ef1fce2d1,ohn Hodge <tpg@mutabah.net>, 2021-01-25 10:25:35 +0800, , expand procmacro use target current edition,,
162,eec848c895492cca4dd2a12626c2f5f5670067fe,ohn Hodge <tpg@mutabah.net>, 2021-01-24 21:01:31 +0800, , codegen fix handling borrow zst field,,
163,d8d17ca53080dd16cd9d659999e15d59c80c8ed2,ohn Hodge <tpg@mutabah.net>, 2021-01-24 19:28:06 +0800, , expand resolve crate macro path derive foo bar,,
164,fe67fc64510dd38d4f4a35639bb3474f80bba773,ohn Hodge <tpg@mutabah.net>, 2021-01-24 18:19:48 +0800, , lex tweak reserved word list allow use edition specific list,,
165,3681a6f8c291a1482e3f58208da006920a645276,ohn Hodge <tpg@mutabah.net>, 2021-01-24 17:23:10 +0800, , hir annotate usage fix handling pointer deref,,
