id,sha,author,date,issue,message,file,content
2048,b00e904995edd4415a2dbae0a5407269772e818a,ohn Hodge <tpg@ucc.asn.au>, 2017-03-04 14:29:51 +0800, , mir gen use mir param binops,,
2049,b3362d47a704f2d474f9a2f1e78ba9bd386e7c01,ohn Hodge <tpg@ucc.asn.au>, 2017-03-04 14:02:07 +0800, , mir check full state comparison printing state,,
2050,9cf7dc21aaf3ccd6967960f31443f6e6d594c362,ohn Hodge <tpg@ucc.asn.au>, 2017-03-04 13:36:42 +0800, , mir gen patch around edge case arm end drop flag incorrectly set,,
2051,40d192c4e2ee26add4439889461fa314a195e90a,ohn Hodge <tpg@ucc.asn.au>, 2017-03-04 13:36:34 +0800, , mir check full variant,,
2052,89100b4a1e73c7abfea228b8512bd0f79952f911,ohn Hodge <tpg@ucc.asn.au>, 2017-03-04 13:02:23 +0800, , mir check full handling shallow drop,,
2053,ab60a92b6e442406abf90d78b3d6c2a970f7e744,ohn Hodge <tpg@ucc.asn.au>, 2017-03-04 10:16:35 +0800, , mir add disabled full value state validator,,
2054,56ed7c849d74e2ad06522db5b96a2938b173a10c,ohn Hodge <tpg@ucc.asn.au>, 2017-03-03 21:37:35 +0800, , hir fix div mul mixup hir lower,,
2055,0b18b46009d68029a933de79914d93462f450342,ohn Hodge <tpg@ucc.asn.au>, 2017-03-03 21:16:00 +0800, , hir typecheck expr better bug message triggered bad code,,
2056,6dbd3cb0dad2bc180cfca152d14508526fdeb1ca,ohn Hodge <tpg@ucc.asn.au>, 2017-03-03 21:15:39 +0800, , format_args support complex formatting type,,
2057,0fadf8d1cebd6dfb1195245d46a0bde51bfbdb85,ohn Hodge <tpg@ucc.asn.au>, 2017-03-02 23:15:04 +0800, , mir gen reset drop flag default use,,
2058,e00565479fd031681f047225cac5a26cfa94ad5e,ohn Hodge <tpg@ucc.asn.au>, 2017-03-02 18:20:14 +0800, , mir gen param usage,,
2059,0c7faa5fd118366c4b272e036e95625ebccf67ea,ohn Hodge <tpg@ucc.asn.au>, 2017-02-26 18:15:35 +0800, , main add support option,,
2060,ee773edacfeba650931c604e266cf0862dbc2bfe,ohn Hodge <tpg@ucc.asn.au>, 2017-02-26 18:15:22 +0800, , expand stringify fix trailing space,,
2061,aa99de423034435cf765b9dc104f69fc20f84bd6,ohn Hodge <tpg@ucc.asn.au>, 2017-02-26 18:10:38 +0800, , expand derive debug enums,,
2062,177040dd129bccdc275831e3423af2efab6e948e,ohn Hodge <tpg@ucc.asn.au>, 2017-02-26 17:04:01 +0800, , codegen fix transmute constant,,
2063,03addc877bab648ccde022edec29f5b051ce7cb9,ohn Hodge (bugs) <tpg@mutabah.net>, 2017-02-25 22:24:40 +0800, , add visual studio project file little tweak codebase allow compiling visual studio complete,,
2064,12c012c69235fd90c855881f2c07c91dbb052635,ohn Hodge <tpg@ucc.asn.au>, 2017-02-25 17:47:38 +0800, , mir gen remove temporary match generation,,
2065,8068936c1900453fdcbb74c34ed228519ac4e06b,ohn Hodge <tpg@ucc.asn.au>, 2017-02-25 12:07:12 +0800, , mir gen use mir param associated change,,
2066,cb04e0ba3611deff03566eb035b2c35b4b8890f9,ohn Hodge <tpg@ucc.asn.au>, 2017-02-23 18:04:21 +0800, , makefile create output dir libflate build script running,,
2067,682cc6bb27543a00c9ede5800cdbf40a6f137057,ohn Hodge <tpg@ucc.asn.au>, 2017-02-23 18:03:41 +0800, , mir gen param,,
2068,1351536e7e55bacdfea765b6396ddbb90311f9f1,ohn Hodge <tpg@ucc.asn.au>, 2017-02-22 22:35:08 +0800, , mir gen replace temporary param,,
2069,0b94a427d2c4ad46cfbf20529067240b8a8b92e0,ohn Hodge <tpg@ucc.asn.au>, 2017-02-22 22:17:07 +0800, , mir restrict constant byte returning,,
2070,0b672c4325967ade9a8f9bd8a06071cca09c4276,ohn Hodge <tpg@ucc.asn.au>, 2017-02-22 20:45:43 +0800, , mir add type integer constant,,
2071,1e8376b6bc4289832112a70323f8c1f0f0722392,ohn Hodge <tpg@ucc.asn.au>, 2017-02-22 14:54:04 +0800, , mir make makedst ptr param,,
2072,e4d8415f346e7067c3f060649c577b947a249e51,ohn Hodge <tpg@ucc.asn.au>, 2017-02-22 13:27:28 +0800, , mir add param type place lvalue read,,
2073,a4ec506e3f3c23c7818c3ce2d020b25966c420d8,ohn Hodge (Mutabah) <acessdev@gmail.com>, 2017-02-21 08:49:09 +0800,18, merge pull request est31 master use make utilize make jobserver,,
2074,9a817a3bd03d2447118aa2a0d9a1a68fdaa20ef8,st31 <MTest31@outlook.com>, 2017-02-20 02:17:09 +0100,17, use make utilize make jobserver allows parallel build llvm fix,,
2075,e0b77c07a2b9f0da3a81b5afcbe5aa5b06a75612,st31 <MTest31@outlook.com>, 2017-02-20 02:16:53 +0100, , add crates.io subdir gitignore,,
2076,309a23d17998edd9f4b314570c7752b97d3cda72,ohn Hodge <tpg@ucc.asn.au>, 2017-02-19 23:32:51 +0800, , note todo add change mir,,
2077,432bbf0f4f10b0d1fbc07b5b33c9a4a72cd949b1,ohn Hodge <tpg@ucc.asn.au>, 2017-02-19 23:32:39 +0800, , readme progress update,,
2078,4242a60c7f5c6d425b1221b92cfc11d3d34dcdd7,ohn Hodge <tpg@ucc.asn.au>, 2017-02-19 22:34:28 +0800, , trans conditionally emit struct tuple constructor wrapper,,
2079,82cce9cf1984fcedbd17c45fea50122a3c1ad378,ohn Hodge <tpg@ucc.asn.au>, 2017-02-19 00:44:24 +0800, , makefile exclude test block infinitely,,
2080,2bbfe192497ba0c0f94e87a95a5462d3acf46650,ohn Hodge <tpg@ucc.asn.au>, 2017-02-18 14:42:27 +0800, , makefile tweak rustc option set default target,,
2081,03166784858197f88f64dbc6652ba15ab56ad84f,ohn Hodge <tpg@ucc.asn.au>, 2017-02-18 13:44:21 +0800, , makefile compilation tweak llvm,,
2082,e97cbf893790226fb535deb6a2ef7d9d53234a2b,ohn Hodge <tpg@ucc.asn.au>, 2017-02-13 11:08:18 +0800, , main support argument,,
2083,82989b54c57fb4a4a319fe1bc863c371a36a0b28,ohn Hodge <tpg@mutabah.net>, 2017-02-12 14:06:44 +0800, , travis download rustc src,,
2084,090f00656f30b53f47ed01dfbd01debdc4b3c6f7,ohn Hodge <tpg@ucc.asn.au>, 2017-02-12 13:48:50 +0800, , travis download source install phase,,
2085,eec2e7821ab5053ac3260345d204fe7c9c81904e,ohn Hodge <tpg@mutabah.net>, 2017-02-12 13:28:55 +0800, , makefile build libbacktrace rust source,,
2086,35d0568a52e0d4a245d6d8ff258e28fff49d4212,ohn Hodge <tpg@mutabah.net>, 2017-02-12 12:54:09 +0800, , makefile allow redirected curl gcc,,
2087,69ee1650192dfb687358aa72e55ac023eaad185f,ohn Hodge <tpg@mutabah.net>, 2017-02-12 12:14:22 +0800, , mir gen alter handling scope support diverging expression,,
2088,bd2d725b2bb013446ad7ed53e384cd1f38073be9,ohn Hodge <tpg@mutabah.net>, 2017-02-11 16:00:31 +0800, , makefile touch result untar,,
2089,e89774b17208deb028ee5f87a1fb16f11fd34ac4,ohn Hodge <tpg@mutabah.net>, 2017-02-11 15:12:16 +0800, , makefile libflate build script,,
2090,6fb523b6891ab9ce4fd660dfd2a6ca44d1ddbecc,ohn Hodge <tpg@mutabah.net>, 2017-02-11 14:39:25 +0800, , makefile generate link option rustc_llvm build script,,
2091,e493be82bb9824a9bd1332cb7aeee1f3cf9e57d3,ohn Hodge <tpg@mutabah.net>, 2017-02-11 14:39:12 +0800, , trans allow passing library directory command line,,
2092,e0d43fb38d1b13e8ed5ee3e2fd7ddd8023319cbb,ohn Hodge <tpg@mutabah.net>, 2017-02-11 12:12:00 +0800, , mir gen fix short circuiting,,
2093,2ea9e6368b092b0e969ea8d7882b5afbe84374fd,ohn Hodge <tpg@mutabah.net>, 2017-02-09 22:56:06 +0800, , codegen emit extern reference intrinsics,,
2094,4367f8416c5dc3f8da8f714cb29c0c926fd8dfe5,ohn Hodge <tpg@mutabah.net>, 2017-02-09 22:55:20 +0800, , makefile hack rustc library,,
2095,f69ca1634e19fa5a558d0848539e6313394d5a86,ohn Hodge <tpg@mutabah.net>, 2017-02-09 22:53:44 +0800, , mir optimise fix small incorrect comparison,,
2096,16f5d2d847f51b530d8bcbf96cb610f48d4132be,ohn Hodge <tpg@mutabah.net>, 2017-02-05 11:33:39 +0800, , mir optimise treat asm output assignment,,
2097,9700e50573fb44cf30fa6247ef6ff43e44bb9e1f,ohn Hodge <tpg@mutabah.net>, 2017-02-05 10:56:21 +0800, , hir expand alias replace self impl impls,,
2098,b82a927e857b91a420b6ee40408f11c10abb919d,ohn Hodge <tpg@mutabah.net>, 2017-02-05 09:55:51 +0800, , mir optimise variable,,
2099,7a9880338e142e0363988af4576b00238898e9a7,ohn Hodge <tpg@mutabah.net>, 2017-02-05 09:42:27 +0800, , mir optimise clear unused iteration,,
2100,7fe22497382cbccb034af8c2ed9e5a8935c20eb5,ohn Hodge <tpg@mutabah.net>, 2017-02-05 09:23:20 +0800, , mir validate minor remove useless debug,,
2101,d4d3c1a258615f874fc731f3e90a71d8195a8961,ohn Hodge <tpg@mutabah.net>, 2017-02-05 09:22:55 +0800, , mir optimise fix incorrect optimisation source moved,,
2102,bd0b693765c260c07976a04add4e482accb8dcf0,ohn Hodge <tpg@mutabah.net>, 2017-02-04 22:14:44 +0800, , mir optimise little optimisation intrinsic,,
2103,709fa081988f262cbca8c95b60553c37451d35dd,ohn Hodge <tpg@mutabah.net>, 2017-02-04 21:33:12 +0800, , codegen enable section binary,,
2104,b577379daf649d5e08d1198e756a141cac1524e9,ohn Hodge <tpg@mutabah.net>, 2017-02-04 21:32:52 +0800, , makefile minor disable deletion test intermediate target,,
2105,abeea0472605262dc35fe9e1bf295f5b0e058ad6,ohn Hodge <tpg@mutabah.net>, 2017-02-04 21:29:50 +0800, , mir optimise planning const propagation tweak assignment propagation,,
2106,a5035a65c2291560e32d5529dc06c90ae45e851f,ohn Hodge <tpg@mutabah.net>, 2017-02-04 11:55:51 +0800, , mir gen tweak handle foo break,,
2107,6198cd3a6cfff4df26740c6482745badaaf2cce7,ohn Hodge <tpg@mutabah.net>, 2017-02-04 11:33:12 +0800, , mir validate fix infinite looping value state,,
2108,c3c3c98e9346f500ec955a32200f27befd0fd6da,ohn Hodge <tpg@mutabah.net>, 2017-02-04 10:42:21 +0800, , mir validate slight refactor cleaner code,,
2109,c72c7c2024df0d1ef53249f756f63d07d82fa581,ohn Hodge <tpg@mutabah.net>, 2017-02-04 08:57:20 +0800, , makefile fix invocation librustc_llvm build script,,
2110,f304a077e086ea4bd3896d67287716d6cb1a70e3,ohn Hodge <tpg@mutabah.net>, 2017-02-03 23:31:57 +0800, , travis increase tail line track ice,,
2111,a24aed5ce2b738c7fe834570cd9432cf5af57d75,ohn Hodge <tpg@mutabah.net>, 2017-02-03 23:28:56 +0800, , makefile disable test due missing feature,,
2112,8ec1bb90011a28a37e4c7e50129e417733f97962,ohn Hodge <tpg@mutabah.net>, 2017-02-03 23:28:29 +0800, , codegen fix incorrect second argument slice_cmp,,
2113,9b8cdb083860f58bfd1cae6f05834bcc1b4f5ea5,ohn Hodge <tpg@mutabah.net>, 2017-02-03 21:10:09 +0800, , codegen fix ctz clz intrinsics,,
2114,dd91f16e461c04bd4528c79f2ab5d96f8ac759e1,ohn Hodge <tpg@mutabah.net>, 2017-02-02 22:34:02 +0800, , codegen fix incorrect impl pointer,,
2115,15790ac4aa2d99ebdc105bf3f7053d498f7541a5,ohn Hodge <tpg@mutabah.net>, 2017-02-01 20:35:23 +0800, , mir optimise fix edge case incorrect optimisation,,
2116,137ef62d7107437aa8d1fb860bf63a58dce634b8,ohn Hodge <tpg@mutabah.net>, 2017-01-31 22:18:41 +0800, , mir optimise handle empty loop,,
2117,85473b0da8f5e13c9601c9661ade61892d34ccd7,ohn Hodge <tpg@mutabah.net>, 2017-01-30 23:13:23 +0800, , mir optimise eliminate variable assignment,,
2118,ccf8f384c9489a83121971d453f00c5f68cb7784,ohn Hodge <tpg@mutabah.net>, 2017-01-30 22:58:27 +0800, , mir optimise drop flag,,
2119,c0b9e1bbb15d1c13f7d1a13f67c35dcf78e6d70e,ohn Hodge <tpg@mutabah.net>, 2017-01-30 21:08:06 +0800, , mir optimise dead assignment elimination minimal,,
2120,b67572ec36ff419a5761ecd9341bd0f1db80234b,ohn Hodge <tpg@mutabah.net>, 2017-01-30 20:47:41 +0800, , mir optimise support detecting borrows value usage count,,
2121,77a56cc58e84335b6a25ee3330ad3c2e06ab5942,ohn Hodge <tpg@mutabah.net>, 2017-01-30 20:26:31 +0800, , mir optimise remove known branch,,
2122,9d6e35aea551d291a3b687908de35045e572c0a1,ohn Hodge <tpg@mutabah.net>, 2017-01-30 20:26:06 +0800, , mir gen emit terminator known true false,,
2123,64dffed7a9142eb68fce878984f3572d1231d6f5,ohn Hodge <tpg@mutabah.net>, 2017-01-30 08:59:30 +1100, , todos,,
2124,4f776aa867451686e8dc347fa5599691b1cb6231,ohn Hodge <tpg@mutabah.net>, 2017-01-30 08:59:18 +1100, , readme update,,
2125,0350f44db22406dedf929d04bcd69de29ad27516,ohn Hodge <tpg@mutabah.net>, 2017-01-29 22:23:34 +1100, , trans enumerate handle erased type,,
2126,2aa3519cdabf82b1db7cc1f4e8298b09f46ef95f,ohn Hodge <tpg@mutabah.net>, 2017-01-29 21:54:31 +1100, , trans codegen fix emision enum literal,,
2127,b1af572476b452c35bb6dbe9ea0fccd526156f0a,ohn Hodge <tpg@mutabah.net>, 2017-01-29 17:48:32 +1100, , trans emit typeid needed,,
2128,9eaf0ad9a5c8e894e09e373838a196573932bf63,ohn Hodge <tpg@mutabah.net>, 2017-01-29 16:28:13 +1100, , codegen repr enums,,
2129,49760694011b60b007f19b704477a80ebe8e0b6b,ohn Hodge <tpg@mutabah.net>, 2017-01-29 15:40:48 +1100, , mir optimise fix tripping unconditional recursion,,
2130,238dc49ffbad7d153b81b54995fa642c155dc905,ohn Hodge <tpg@mutabah.net>, 2017-01-29 01:06:09 +1100, , mir optimise inline inherent,,
2131,c1ee5a0967fd3d79cd30765ff5a03592e544b537,ohn Hodge <tpg@mutabah.net>, 2017-01-28 15:36:58 +1100, , mir optimise run cleanup inlining trigger monomorph,,
2132,f6265741bc8f97c7b2a54de0ed366cd19c655481,ohn Hodge <tpg@mutabah.net>, 2017-01-28 15:21:57 +1100, , mir optimise inlining ufcsknown function,,
2133,3d6946f7a15231cbe8e1b4e7d7d3ce39b59a8a5b,ohn Hodge <tpg@mutabah.net>, 2017-01-28 15:19:25 +1100, , hir typecheck static asociated type bound bounded associated type,,
2134,0250ed0bec76c57d5bc44f94f18b40aa94ddb4d8,ohn Hodge <tpg@mutabah.net>, 2017-01-28 12:30:29 +1100, , mir optimise eat inlining,,
2135,fe2ab62c0aa7e417ed720364531a625fed92c86f,ohn Hodge <tpg@mutabah.net>, 2017-01-28 08:32:47 +1100, , mir optimise inlining implemented,,
2136,4de0619c19a49318b689fe8314095f85c6e0b2c1,ohn Hodge <tpg@mutabah.net>, 2017-01-26 23:11:56 +0800, , makefile tweak rust_os,,
2137,6cfc0268fd82bd6e4fd8a91ae02e35d6d6f414df,ohn Hodge <tpg@mutabah.net>, 2017-01-26 23:11:39 +0800, , mir optimise start inlining support,,
2138,9a0fe67b098639636c701599270416563e2af15d,ohn Hodge <tpg@mutabah.net>, 2017-01-26 19:31:45 +0800, , mir optimise fiddling,,
2139,5922055228afdd976a0f3ebd934cd70f6f3b6fee,ohn Hodge <tpg@mutabah.net>, 2017-01-26 17:00:43 +0800, , hir typecheck fix quirk rust_os,,
2140,e1ecb003fcc66eceb818c097c3b0e659d7067b0f,ohn Hodge <tpg@mutabah.net>, 2017-01-25 22:08:35 +0800, , travisci gdb needed anyway,,
2141,eeae19a128b93a41e33ca59f82808bc779f2666b,ohn Hodge <tpg@mutabah.net>, 2017-01-25 19:40:58 +0800, , hir typecheck box autoderef quirk fix,,
2142,4c7add8f0e160123cde2c454ad96ba7170a8af7c,ohn Hodge <tpg@mutabah.net>, 2017-01-24 17:29:09 +0800, , merge branch master http github.com thepowersgang mrustc,,
2143,2e2814adf94a22c3df386072b3bf7a19ff5c4344,ohn Hodge <tpg@ucc.asn.au>, 2017-01-23 22:59:39 +0800, , mir gen fix incorrect handling split scope loop,,
2144,68eca6e0308ff15d88698f441b2360468daa775d,ohn Hodge <tpg@ucc.asn.au>, 2017-01-23 22:59:20 +0800, , hir expand erased type fix segfault due uninitialised value,,
2145,aa485af2114eca4f87c0a2861e866a760729b7f4,ohn Hodge <tpg@mutabah.net>, 2017-01-22 16:39:56 +0800, , travis enabling debug take two,,
2146,e21239591fcffea17b0437889ba564f7b4f53419,ohn Hodge <tpg@mutabah.net>, 2017-01-22 16:16:13 +0800, , main move second mir validation saveback,,
2147,285a44058ed77624a808680ea435ca506d585de9,ohn Hodge <tpg@mutabah.net>, 2017-01-22 16:15:56 +0800, , mir optimise validate,,
2148,bce6d762ae4977d9b8ebfafa326a6e0c838e1914,ohn Hodge <tpg@mutabah.net>, 2017-01-22 16:03:39 +0800, , mir builder drop flag partial,,
2149,744493f71413dac43e91c46dc701c2d704e549a2,ohn Hodge <tpg@mutabah.net>, 2017-01-22 15:36:26 +0800, , mir hir fix non moved muts box handling,,
2150,8915d8666fc1a73391fc7cd69c9af66152217f42,ohn Hodge <tpg@mutabah.net>, 2017-01-22 15:29:33 +0800, , mir check call move value,,
2151,19ac6598a93236f2e288944cff319f75b6dc4f11,ohn Hodge <tpg@mutabah.net>, 2017-01-22 14:46:20 +0800, , mir check get dst type generic structs,,
2152,3ca55a9985ea9e5dcc98aa159c4dbed18991fd74,ohn Hodge <tpg@mutabah.net>, 2017-01-22 12:44:21 +0800, , makefile minor header print hello world test,,
2153,b6618ea642396810578579e24d500f2c2ef5de61,ohn Hodge <tpg@mutabah.net>, 2017-01-22 12:44:06 +0800, , main run validation optimisation,,
2154,3cf34c7f16601558c9b7e4bcc3319cca3cbc72a8,ohn Hodge <tpg@mutabah.net>, 2017-01-22 12:43:44 +0800, , mir check fix bug handling marker traitobject,,
2155,726e32afac634e89495baca4c8c0ad04e95cec68,ohn Hodge <tpg@mutabah.net>, 2017-01-22 12:14:01 +0800, , mir optimise fixed replacement unified temporary,,
2156,4776f2c628c7c421e71ff89e732ae8aa7dae321f,ohn Hodge <tpg@mutabah.net>, 2017-01-22 12:13:44 +0800, , trans start attribute,,
2157,5176f09f270c088fdf1bf6f0baea629bed21a4ba,ohn Hodge <tpg@mutabah.net>, 2017-01-22 09:52:21 +0800, , travis enable gdb help debug travis segfault,,
2158,26856ca19302b11f6624294f3c36456b04d11ea8,ohn Hodge <tpg@mutabah.net>, 2017-01-22 09:49:31 +0800, , mir optimise reverse propagation assignment,,
2159,a5779091e0ede8a160e401da015851da6db79562,ohn Hodge <tpg@mutabah.net>, 2017-01-22 00:21:30 +0800, , mir optimise untested temporary unification,,
2160,a45ad45f0d9b7e5a2f8c03b7beb3515f7251ee5e,ohn Hodge <tpg@mutabah.net>, 2017-01-21 23:23:06 +0800, , static typecheck remove debug,,
2161,e3d8b81e86a6d22f4768f2086a32d99bf34d3c52,ohn Hodge <tpg@mutabah.net>, 2017-01-21 23:22:55 +0800, , mir dump include static,,
2162,f3fc3bbcd5d184ce899fa2fba64f38cd6e4ba9b9,ohn Hodge <tpg@mutabah.net>, 2017-01-21 18:50:29 +0800, , typecheck static cache copy lookup,,
2163,c579e11b9cf7b715932ca944bf372b8c062ecf6c,ohn Hodge <tpg@mutabah.net>, 2017-01-21 18:50:15 +0800, , trans expand main attribute,,
2164,51ca5eb417bfc375c359a16c392d6cd18ed963c4,ohn Hodge <tpg@mutabah.net>, 2017-01-21 18:20:08 +0800, , makefile fix llvmdeps hack,,
2165,a3d4dd65e0029f42c8cbc1869bb4d4357852cd81,ohn Hodge <tpg@mutabah.net>, 2017-01-21 18:07:25 +0800, , mir gen fix drop generation,,
2166,41c852259d814cccb9d172d365c9cfddbc44bdfe,ohn Hodge <tpg@mutabah.net>, 2017-01-21 09:52:01 +0800, , mir gen partial value state,,
2167,ad4fb9a9cec423605264083415db74b97374436e,ohn Hodge <tpg@mutabah.net>, 2017-01-20 21:58:55 +0800, , mir gen invalid optional,,
2168,80fba399bb4a6f652a1a88e61522b73f96f1114b,ohn Hodge <tpg@mutabah.net>, 2017-01-20 21:50:28 +0800, , mir merging drop flag,,
2169,71d55f1e97d80b3f42610f7a8a22e57cafb46561,ohn Hodge <tpg@mutabah.net>, 2017-01-20 21:00:36 +0800, , hir serialise drop flag,,
2170,8149b1122f9dd62dd0b4968254ddfe4e36f0c918,ohn Hodge <tpg@mutabah.net>, 2017-01-20 20:55:43 +0800, , codegen drop flag,,
2171,5fe7fc58006f09fbc6fa5a39e9a5bea993ce94bd,ohn Hodge <tpg@mutabah.net>, 2017-01-20 20:36:42 +0800, , mir gen fix temporary drop split scope,,
2172,2beb017a0c550a0979129621b826ee3c85fa72a6,ohn Hodge <tpg@mutabah.net>, 2017-01-20 19:44:47 +0800, , mir drop flag incomplete pas validation,,
2173,f095478f874b2122a98d0acd7dd1a59293799a94,ohn Hodge <tpg@mutabah.net>, 2017-01-15 17:27:56 +0800, , makefile disable build script support work,,
2174,6013db4d24e59d4827bdc2188852d58867f1bed6,ohn Hodge <tpg@mutabah.net>, 2017-01-15 17:27:32 +0800, , expand include support absolute path,,
2175,c10e5de8a6134068b2e0cfd119a7b5ee980214c9,ohn Hodge <tpg@mutabah.net>, 2017-01-15 17:09:24 +0800, , codegen basic nonzero option optimisation borrows function pointer,,
2176,95fa6b120be99d679560dac3ffb998756ec6b342,ohn Hodge <tpg@mutabah.net>, 2017-01-15 13:21:28 +0800, , mir gen short circuiting ifs,,
2177,a81a116e57d46765b9ec36fc31376d5c4a91b04d,ohn Hodge <tpg@mutabah.net>, 2017-01-15 11:54:11 +0800, , mir hir fix bug handling single value range,,
2178,bc31b929427a28bddebffa2acdce474d38c66a82,ohn Hodge <tpg@mutabah.net>, 2017-01-15 11:41:00 +0800, , ast cleaner printing stringify,,
2179,a7c602469093f083a3d27e60d1b30766803891e6,ohn Hodge <tpg@mutabah.net>, 2017-01-15 11:00:43 +0800, , codegen enable debug info output,,
2180,0e53b656a6552c39b7dde6b624016fa4d3efb1d3,ohn Hodge <tpg@mutabah.net>, 2017-01-15 10:59:17 +0800, , makefile rustbuild hackery broken mrustc codegen broken,,
2181,a67b21cc097dc4ab7cd2a17646ccbd8e8dcb7c2f,ohn Hodge <tpg@mutabah.net>, 2017-01-15 10:48:21 +0800, , expand include expand argument string,,
2182,d523aaf365639c24c7082c1d7903043782e68a1c,ohn Hodge <tpg@mutabah.net>, 2017-01-15 10:47:19 +0800, , main support crate name argument,,
2183,db928a945a1139d15144b8293e7d24319033ab66,ohn Hodge <tpg@mutabah.net>, 2017-01-15 08:09:42 +0800, , makefile remove cfg cargobuild,,
2184,81e0a8ab53625e8138b274fc8c437bb11ad0c4c7,ohn Hodge <tpg@mutabah.net>, 2017-01-15 08:04:37 +0800, , trans use link name attribute,,
2185,363b8f329e306710d7b78376ab4774c9d3c232fa,ohn Hodge <tpg@mutabah.net>, 2017-01-14 18:42:59 +0800, , hir conv marking add supertraits extern crate,,
2186,d5abf6fae9633cffef1cab9a8f530c136f7806cb,ohn Hodge <tpg@mutabah.net>, 2017-01-14 18:16:11 +0800, , hir resolve ufcs fix broken logic parent trait refactor,,
2187,63fb307fb112dcf3abb73c1da0dfb5a27935f4eb,ohn Hodge <tpg@mutabah.net>, 2017-01-14 17:01:36 +0800, , hir build flattened list parent trait early save time later,,
2188,53983bf333143560ef4b161eaa2f46c55bcd517b,ohn Hodge <tpg@mutabah.net>, 2017-01-14 09:23:57 +0800, , hir bind remove manual path searching,,
2189,db01a8a8ae3dab9888d7a734dc07ca513b6f86bc,ohn Hodge <tpg@mutabah.net>, 2017-01-14 09:02:10 +0800, , hir clean manual item searching,,
2190,27be955d74e03e5db1c549367f3f784ec535f509,ohn Hodge <tpg@mutabah.net>, 2017-01-13 23:11:27 +0800, , makefile fix rule rustc,,
2191,cfe846360c614feadaf42a76705bf3e5d08d5a4f,ohn Hodge <tpg@mutabah.net>, 2017-01-13 23:11:15 +0800, , trans enumerate type used intrinsic,,
2192,5befb8d81db6a96d9c9abc3e20c50dcb294cb9a4,ohn Hodge <tpg@mutabah.net>, 2017-01-13 22:20:26 +0800, , mir cleanup unsized traitobject constant,,
2193,8dc924f542e3f21adf2f0df041d7e61acf06e961,ohn Hodge <tpg@mutabah.net>, 2017-01-13 20:04:32 +0800, , codegen use load path crate file source,,
2194,62009d81340a1616189d56bda20e79803309c0ad,ohn Hodge <tpg@mutabah.net>, 2017-01-13 19:53:46 +0800, , main invoke codegen dylibs,,
2195,6010662faa08057eb6ea1fab6dcf85c4d9604c3b,ohn Hodge <tpg@mutabah.net>, 2017-01-13 19:53:28 +0800, , makefile fix core dependency librustc_i128,,
2196,753913a01f6901e528d36c500fc3dcedca5c4e94,ohn Hodge <tpg@mutabah.net>, 2017-01-13 19:53:03 +0800, , hir ast populate crate name unless building binary,,
2197,8a438a5e66dc83b2fd89a5f61eec20c762cd874c,ohn Hodge <tpg@mutabah.net>, 2017-01-13 19:28:54 +0800, , makefile fix bad patsubst,,
2198,7dc7d1f36651204b77bd7dea96fecf6e76e2ee9c,ohn Hodge <tpg@mutabah.net>, 2017-01-13 19:28:38 +0800, , erased type hackily allow outside function,,
2199,722390aa6ba3b2d3aff62f91d5feaf4abf4afd34,ohn Hodge <tpg@mutabah.net>, 2017-01-12 23:04:29 +0800, , codegen try intrinsic,,
2200,2a38cca61982e1d3e44166d8da6c20a3191520a6,ohn Hodge <tpg@mutabah.net>, 2017-01-12 18:59:30 +0800, , trans enumerate eat vtable associted type parameter,,
2201,01cdd1d7bec0106a43f851d73a1faf7627652970,ohn Hodge <tpg@mutabah.net>, 2017-01-12 18:59:21 +0800, , hir serialise write const function mir,,
2202,d3c126974a5cc6c28d20f703e2cf9b52f0b0232d,ohn Hodge <tpg@mutabah.net>, 2017-01-11 22:16:29 +0800, , travis switch target_cc back,,
2203,1ad1cf8233c1432daf3202507d1a0552bd02ccab,ohn Hodge <tpg@mutabah.net>, 2017-01-11 22:15:40 +0800, , codegen emit forward decls tunit,,
2204,9b5309136a190ea74c3206eccc87eff4dc7ab1cc,ohn Hodge <tpg@mutabah.net>, 2017-01-11 21:55:27 +0800, , codegen enable optimisation use environmen variable falling back gcc,,
2205,9c7072029ddbd332ea8a27c27c4c2e28ca3845c5,ohn Hodge <tpg@mutabah.net>, 2017-01-11 21:53:31 +0800, , makefile fix output filename hello_world test,,
2206,9204a6b3958a56a6624b4752047ed941f54ab5cc,ohn Hodge <tpg@mutabah.net>, 2017-01-11 21:47:01 +0800, , hir static link_name partial support,,
2207,d8e1c31c2158f60ce19a09723904ab0b71f7c27a,ohn Hodge <tpg@mutabah.net>, 2017-01-11 21:37:00 +0800, , enable library codegen use crate name everywhere,,
2208,04b6360ff879a70a42fcd5f09cccc23cc2dd2d9f,ohn Hodge <tpg@mutabah.net>, 2017-01-11 18:38:16 +0800, , trans require type used type_id defined,,
2209,c8ce15fead40716f3cd904e2dd4c77d324931357,ohn Hodge <tpg@mutabah.net>, 2017-01-10 20:09:14 +0800, , codegen extra intrinsics bugfix,,
2210,54025e7d55fa2e0f330b82bd0d609ab81a442dbc,ohn Hodge <tpg@mutabah.net>, 2017-01-10 18:05:04 +0800, , codegen missing feaures exposed library codegen,,
2211,eccbff49c4e769710823b1bc2d3c85d4a161caff,ohn Hodge <tpg@mutabah.net>, 2017-01-09 23:10:22 +0800, , trans enumerate add inherent method libs,,
2212,e72371bc9780ff5fedd6ca3995e0016b7ee50858,ohn Hodge <tpg@mutabah.net>, 2017-01-09 23:10:08 +0800, , main disable library codegen push,,
2213,529ff2b340a38906d372efd895743e12ccc2de21,ohn Hodge <tpg@mutabah.net>, 2017-01-09 22:53:59 +0800, , trans enumerate check bound trait impls,,
2214,fc2be4dc1fa5ef0ca71ccecfefe8eea78f624272,ohn Hodge <tpg@mutabah.net>, 2017-01-08 21:25:00 +0800, , codegen fix size_of_val bare str,,
2215,4bb00a5159ba42ab4460bca40324c4519d00966c,ohn Hodge <tpg@mutabah.net>, 2017-01-08 21:19:08 +0800, , codegen missing float intrinsics,,
2216,24ba23f0a1a3bda18111e00ea49f1dd95a4556f0,ohn Hodge <tpg@mutabah.net>, 2017-01-08 21:12:32 +0800, , trans enable translation public item rlibs,,
2217,b048548fe8f7f26abf35d501a0d85bb33aa37550,ohn Hodge <tpg@mutabah.net>, 2017-01-08 19:08:57 +0800, , makefile remove renamed dependency,,
2218,326dba7558eab915cb201efc19506208a5843825,ohn Hodge <tpg@mutabah.net>, 2017-01-08 18:57:33 +0800, , hir typecheck fix rustc compiles,,
2219,0764a85f99e3c90516c4a3e994cf87875a494002,ohn Hodge <tpg@mutabah.net>, 2017-01-08 18:29:45 +0800, , hir const eval little fix,,
2220,c4d3a92a8f0a0f48470443b583d44f868c58c3b3,ohn Hodge <tpg@mutabah.net>, 2017-01-08 18:05:13 +0800, , hir typecheck expr tweak,,
2221,afd2e1f51aa63c33892a8532c04cc50c27c4ddb8,ohn Hodge <tpg@mutabah.net>, 2017-01-08 18:04:15 +0800, , makefile new dependency libserialize,,
2222,6f82579829f65e7921184d79158080e86f0b08e0,ohn Hodge <tpg@mutabah.net>, 2017-01-08 15:13:22 +0800, , expand associated type minor fix nested atys,,
2223,64f856a7bc35f5741f6b6387cb9d6b1b8891d313,ohn Hodge <tpg@mutabah.net>, 2017-01-08 15:10:56 +0800, , resolve index refactor wildcard use handling,,
2224,0fe154e3c10887209caabb6636d6910c2f826054,ohn Hodge <tpg@mutabah.net>, 2017-01-08 12:28:52 +0800, , hir const eval tweak i128 bug,,
2225,9511b2866bfa145f09edf8dd61fdf43e5a2986fe,ohn Hodge <tpg@mutabah.net>, 2017-01-08 10:14:20 +0800, , merge branch master http github.com thepowersgang mrustc,,
2226,d14787eb48b60a7e1149736f929be809af857e95,ohn Hodge <tpg@mutabah.net>, 2017-01-08 10:13:44 +0800, , parse hack pub restricted support,,
