id,sha,author,date,issue,message,file,content
1011,11a9f976f334534bdaf6e6f7dc4f74f08446c7ee,ohn Hodge <tpg@ucc.asn.au>, 2019-01-01 16:20:10 +0800, , draft support,,
1012,cfee4a1bc22a3bf4f9c2e8f2afd06fc84ddb8278,ohn Hodge <tpg@ucc.asn.au>, 2019-01-01 13:14:54 +0800, , parse path slight tweak 1.29,,
1013,95d725d80a76e74549329dfdb74f8147c1b075e7,ohn Hodge <tpg@ucc.asn.au>, 2019-01-01 13:06:13 +0800, , refactor use item fully group import single use,,
1014,47954747236802644fcfdbd378e320fbb69690bc,ohn Hodge <tpg@mutabah.net>, 2019-01-01 12:49:30 +0800, , parse tweak module loading rule work time,,
1015,2f0ddfaf240c0269087d307b6df6bc00817e6806,ohn Hodge <tpg@mutabah.net>, 2019-01-01 11:32:39 +0800, , parse module loading hopefully fix libcore without breaking crate,,
1016,be34ee650255d6bd5bb2b853c9dbdea5126672ab,ohn Hodge <tpg@ucc.asn.au>, 2018-12-30 17:45:45 +0800, , parse root support finding foo bar.rs foo.rs,,
1017,529c542631de917f45e25485be2dd778e34ba1ea,ohn Hodge <tpg@ucc.asn.au>, 2018-12-30 15:59:13 +0800, , parse handle crate path,,
1018,48ea151b6fed48d96af12cbcc9137db49fcd5996,ohn Hodge <tpg@ucc.asn.au>, 2018-12-30 15:58:13 +0800, , expand handle cfg enum variant,,
1019,44d040f6d4325f713b9fefeadb1ee533a0fd5294,ohn Hodge <tpg@ucc.asn.au>, 2018-12-30 15:08:38 +0800, , parse macro handle crate visibility specifier,,
1020,852050a97d8304d30d1ea51b7acacf1ece387973,ohn Hodge <tpg@ucc.asn.au>, 2018-12-30 14:51:21 +0800, , auto impls automatic delegating impl clone tuples,,
1021,823ad74acb87dced844acade9b7799e9793c59a4,ohn Hodge <tpg@ucc.asn.au>, 2018-12-30 14:14:08 +0800, , typecheck outer rough handling impl trait argument position,,
1022,2e9e8169126fbf9d14bed00bcb3185607f728767,ohn Hodge <tpg@ucc.asn.au>, 2018-12-30 13:18:42 +0800, , common toml allow eof right line,,
1023,bd64912c9847479800ba24c1e1fea7191197c591,ohn Hodge <tpg@ucc.asn.au>, 2018-12-30 13:18:07 +0800, , minicargo cleanup planning better cfg handing,,
1024,c2af54e57545b55be1a5c32cfe4ffbc4b6e114a4,ohn Hodge <tpg@mutabah.net>, 2018-12-30 10:35:38 +0800, , mir optimise constant evaluation addition,,
1025,c39ca5729eb2782e4286f3e582009e43482ebdc7,ohn Hodge <tpg@mutabah.net>, 2018-12-30 09:45:13 +0800, , codegen fix integer printing quirk,,
1026,8a1ed074f96357b32f8079aa30c5700bf4f51bd1,ohn Hodge <tpg@mutabah.net>, 2018-12-30 08:06:11 +0800, , test harness fix harness 1.29,,
1027,6fb11a5af19b91557dba1ca853599596622f56df,ohn Hodge <tpg@mutabah.net>, 2018-12-30 07:36:38 +0800, , codegen add hacky compiler provided glue,,
1028,e0353e87cda89f33c665e05963d6fd7893972063,ohn Hodge <tpg@mutabah.net>, 2018-12-30 07:34:53 +0800, , typecheck drop manuallydrop,,
1029,aa3e514294a257fb5821533dfbfd02467cf0c9d0,ohn Hodge <tpg@mutabah.net>, 2018-12-30 07:24:24 +0800, , expand assert fix logic error,,
1030,73261b9520fb7c3003b435fbc5f28613b4aff390,ohn Hodge <tpg@mutabah.net>, 2018-12-29 20:02:05 +0800, , misc fix script override std using window remove absent test helper,,
1031,4ed6aa06c15bf4d96f855c2508c0bed545b5b06b,ohn Hodge <tpg@mutabah.net>, 2018-12-29 20:01:46 +0800, , trans enumerate handle 1.29 generic lang_start,,
1032,3c81276f5f8e6ba385dbe01d7aee9405a2bac350,ohn Hodge <tpg@mutabah.net>, 2018-12-29 19:32:45 +0800, , typecheck trans handle magic clone impls 1.29,,
1033,7c5411ea0aedeabb879efe5654ed0e28039a4b78,ohn Hodge <tpg@mutabah.net>, 2018-12-29 18:28:51 +0800, , typecheck expression fallback mode inferrence stall match ergonomics,,
1034,cdedfd8738aa488f7b87fd65ac8ab160c0947b18,ohn Hodge <tpg@mutabah.net>, 2018-12-29 16:55:27 +0800, , resolve hir rough handling pub use macro_path,,
1035,be45bb67e1cbcb3c68cdf6f5c9353ce98c67ee2e,ohn Hodge <tpg@mutabah.net>, 2018-12-29 15:24:12 +0800, , hir deserialise handle macro fragment,,
1036,33e23617276a6fd91cba8f3e223cb9bdc8b023bd,ohn Hodge <tpg@mutabah.net>, 2018-12-29 15:19:01 +0800, , hir serialise make error reporting bad deserialisation consistent,,
1037,28a48cfe2fde578219de5e15268348897c73b0d7,ohn Hodge <tpg@mutabah.net>, 2018-12-29 15:00:52 +0800, , hir add new struct reprs mostly stubbed also cleared dead code target.cpp,,
1038,e8401bfcea28bef9151aea9a8bd9b1c2789b5f79,ohn Hodge <tpg@mutabah.net>, 2018-12-29 14:55:15 +0800, , codegen handle 1.29 box_free calling convention hack,,
1039,24086285e2b5035dd23a4e5088baeb27f7774fe9,ohn Hodge <tpg@mutabah.net>, 2018-12-29 13:32:51 +0800, , lower mir handing irrefutable enum match tweak,,
1040,0a47863a680677817631f507ea6f6565b537487e,ohn Hodge <tpg@mutabah.net>, 2018-12-29 11:44:53 +0800, , misc mir generation fix,,
1041,024c97cfe2639d10e3c24343750aac1e37797d54,ohn Hodge <tpg@mutabah.net>, 2018-12-29 11:15:43 +0800, , hir dump tweak output better readability,,
1042,5238ab2025b099f861bd2d071ed3521e7ee4e842,ohn Hodge <tpg@mutabah.net>, 2018-12-29 11:15:08 +0800, , typecheck expression fix incorrect anotation block traversed coercion,,
1043,174646946ada8348c4d1d153ce422eeae2937fd5,ohn Hodge <tpg@mutabah.net>, 2018-12-28 21:50:55 +0800, , typecheck expression match ergonomics,,
1044,4e69aee8c5f942ee25ea6583a156a7aa4bc41d5c,ohn Hodge <tpg@mutabah.net>, 2018-12-28 21:34:40 +0800, , lower hir rough roughshod handling repr align,,
1045,ea32668e6ca82962d720ad9d7751a8e4339b09aa,ohn Hodge <tpg@mutabah.net>, 2018-12-28 19:58:42 +0800, , trans target cfg atomic comare set tied atomic ptr,,
1046,b6fb5429b0983d5571c5ec01abbd502526ed9086,ohn Hodge <tpg@mutabah.net>, 2018-12-28 19:58:29 +0800, , resovle macro import partial bugfixes,,
1047,e16796df604ba1017a19917ea94840ee8c4b0336,ohn Hodge <tpg@mutabah.net>, 2018-12-28 16:58:52 +0800, , resolve clean ast path binding one binding per namespace prep work supporting use macro,,
1048,83f59c8887adcaa3486cb64c5a78a4660223e234,ohn Hodge <tpg@mutabah.net>, 2018-12-28 16:58:28 +0800, , main fix supurrious warning enabling debug multiple phase,,
1049,4b25ba4af9b3a3c62fd73d2c71e4761b021caec2,ohn Hodge <tpg@mutabah.net>, 2018-12-28 09:49:32 +0800, , misc expand tweak,,
1050,38575976d5835cb8cc9e7ae335969873d01e7d65,ohn Hodge <tpg@mutabah.net>, 2018-12-28 08:37:09 +0800, , macro_rules support fragment,,
1051,a0bdedaaed4393236877c45bb56692fe05732a56,ohn Hodge <tpg@mutabah.net>, 2018-12-27 18:35:54 +0800, , lower mir match ergonomics little bit cleanup fix liballoc building libstd,,
1052,0132d377f8a8e41bf6c92d8461855d7a8febcf10,ohn Hodge <tpg@mutabah.net>, 2018-12-27 16:58:27 +0800, , lower mir rough handling 1.29 box operator,,
1053,4630e1bc870361b666e6f38a2049a2552ca9d8b7,ohn Hodge <tpg@mutabah.net>, 2018-12-27 15:54:20 +0800, , typecheck expression minimal support match ergonomics typecheck,,
1054,2744a49ad3f3a8ff138ee0fd9b90244f3b5d7853,ohn Hodge <tpg@mutabah.net>, 2018-12-26 23:36:18 +0800, , typecheck expression handle change box operator 1.29 still need work later line box longer operator trait believe back 100 compiler magic,,
1055,7b0aaeff8331d9343a2d19a57e80b82f32f00b8a,ohn Hodge (Mutabah) <acessdev@gmail.com>, 2018-12-23 16:57:58 +0800,99, merge pull request glaubitz m68k trans fix alignment value m68k type use byte alignment,,
1056,17f910e871e70a5edbf32ea05ef8f68bc71003c9,ohn Paul Adrian Glaubitz <glaubitz@physik.fu-berlin.de>, 2018-12-22 15:49:16 +0100, , trans fix alignment value m68k,,
1057,e842fbbc375907b13b69d0f53de6dc3149804c13,ohn Hodge <tpg@mutabah.net>, 2018-12-22 21:07:47 +0800, , lang item 1.29 allocator trait removed need magic,,
1058,48c0451b76c6f91ee467d8cac0e0c7fd475c8b46,ohn Hodge <tpg@mutabah.net>, 2018-12-22 20:38:38 +0800, , resolve use support glob external module,,
1059,52cd5e2947f634df8bfa7da89ee33eee82134ff7,ohn Hodge <tpg@mutabah.net>, 2018-12-22 20:38:08 +0800, , tagged_union fix tu_arm using parens around value,,
1060,8e8e51ac1b04c7cc85a4a81d9c1906fb9f5a4d58,ohn Hodge <tpg@ucc.asn.au>, 2018-12-22 18:42:50 +0800, , codegen mmir forgot compile commit fix syntax error,,
1061,ad5d36e85a25d1addb4c854114102bef696d4472,ohn Hodge <tpg@ucc.asn.au>, 2018-12-22 18:41:23 +0800, , minor whitespace cleaup,,
1062,efc95784c83cc054ed5a0f2d71ff0c66e3dfb2cf,ohn Hodge <tpg@ucc.asn.au>, 2018-12-22 18:40:23 +0800, , codegen mmir remove place assert body need evaluated ref,,
1063,883cf34da3e273cd3878026d855b9579055c09c0,ohn Hodge <tpg@mutabah.net>, 2018-12-22 18:31:15 +0800, , constant evaluation evaluate missing associated constant trait impl version,,
1064,d0e127f48e35ec7ad95b1c595c259f91c20628b8,ohn Hodge <tpg@mutabah.net>, 2018-12-22 15:53:25 +0800, , mir cleanup misc commenting handling defer literal,,
1065,b8e2907cd4a5f9efa17718008ecdfb560ad61674,ohn Hodge <tpg@ucc.asn.au>, 2018-12-22 14:34:55 +0800, , appveyor twiddling,,
1066,b141095b38ac0ea5a7ed58aa405afd1c318aa442,ohn Hodge <tpg@mutabah.net>, 2018-12-22 14:19:37 +0800, , codegen fix incorrect memory ordering,,
1067,749ded0351148846af5b2f9e7475504831cbf34b,ohn Hodge <tpg@ucc.asn.au>, 2018-12-22 14:17:59 +0800, , add travis appveyor badge tweak appveyor config,,
1068,c31bc22c461e22ff1c26c7c32ccb26d8841dc566,ohn Hodge <tpg@ucc.asn.au>, 2018-12-22 14:05:22 +0800, , appveyor initial config file override setting,,
1069,c16b84b5784865bdb37bbb4b26dc22cec588ffd8,ohn Hodge <tpg@ucc.asn.au>, 2018-12-22 13:04:36 +0800,98, minicargo fix moving chdir spawn_process protect lock,,
1070,53e6ea256d88e5a0e457a294c3d85b1cbaea0386,ohn Hodge <tpg@mutabah.net>, 2018-12-22 12:40:44 +0800, , mir cleanup better error reporting bug around unevaluated literal defer,,
1071,f4c39e95caf3c9a8ccd302dbd9eca92b32564c27,ohn Hodge <tpg@mutabah.net>, 2018-12-16 16:53:46 +0800, , typecheck expression extended possibility checking fallback default hack,,
1072,f893005e2b0a207826d56782afcd456754adb643,ohn Hodge <tpg@mutabah.net>, 2018-12-15 15:40:54 +0800, , trans target fix msvc build,,
1073,f6209dce15ce863e15dc3063d78e43eeb0db25ee,ohn Hodge <tpg@ucc.asn.au>, 2018-12-15 14:47:08 +0800, , target add alignment target spec along saveback test,,
1074,937b161b40dd6dfdaa0a55c1399b3af2d23227d7,ohn Hodge <tpg@mutabah.net>, 2018-12-09 21:42:59 +0800, , hir typecheck expr handle duplicate bounded option type,,
1075,6e16b6d9df92e7ec3222984502f580e46dae09f6,ohn Hodge <tpg@mutabah.net>, 2018-12-09 21:42:34 +0800, , hir typecheck fix incorrect equality success marking,,
1076,998de6c1b99b44f6049f744c713657587f91e1ac,ohn Hodge <tpg@ucc.asn.au>, 2018-10-19 07:40:53 +0800, , codegen fix incorrect use zst enum constructor shim fix,,
1077,ae0027ac83893674397008a5153c6418f61ed28b,ohn Hodge <tpg@mutabah.net>, 2018-12-09 12:20:50 +0800, , minicargo.mk fix bad shell command,,
1078,c071e39c9d5b5d28863471e32607acf932cf3c10,ohn Hodge <tpg@mutabah.net>, 2018-12-09 09:06:06 +0800, , hir typecheck hack method resolution find bound available trait,,
1079,880d23e75d2408a1b8ce9bc545241c17a48e8f3c,ohn Hodge <tpg@mutabah.net>, 2018-12-09 08:35:10 +0800, , hir typecheck enumeration potential type value elimination using known bound potential type trait bound enumerated possible coercion unsizing searched single type meet known condition i.e trait bound ivar method existence,,
1080,2a2b29e747d5cf06f930c1b6c671628f1d9e5cb6,ohn Hodge <tpg@mutabah.net>, 2018-12-09 08:23:12 +0800, , hir type comment overly verbose log message,,
1081,2637ce90570d305eca74d2324793e730fb8a3452,ohn Hodge <tpg@mutabah.net>, 2018-12-09 00:38:10 +0800, , main set default target version 1.29 allow environment change,,
1082,412ab776b3e9bc6635d71cae1276a7d90600cf40,ohn Hodge <tpg@mutabah.net>, 2018-12-09 00:37:24 +0800, , makefile allow overriding rustc version,,
1083,3056e863b8b80732746bfde6cce7f8264055cd4e,ohn Hodge <tpg@mutabah.net>, 2018-12-09 00:34:24 +0800, , trans auto impls run 1.19 mode,,
1084,a74368d639cec8794a2bfd6d8cc08e8812ec0aa1,ohn Hodge <tpg@mutabah.net>, 2018-12-09 00:29:11 +0800, , hir yield impls unbounded ivar self,,
1085,e4f9ba0abf4646687e38d0eed15ebd19b514910b,ohn Hodge <tpg@mutabah.net>, 2018-12-08 17:14:04 +0800, , expand tweak select 1.19 1.29,,
1086,539ecb375c8b86bb0b3c2d64d73dfa6d5b56c2b9,ohn Hodge (Mutabah) <acessdev@gmail.com>, 2018-11-30 07:27:46 +0800,94, merge pull request arlied google fix mark destructors base class virtual,,
1087,c4939c4e12ac66aa3ac92470169abca16bb9ce5b,rlie Davis <arlied@google.com>, 2018-11-28 13:53:38 -0800, , mark destructors base class virtual required correctness using fsized deallocation previous code fails,,
1088,b71e1359a6a79caea35f3cda82d028aa5d2a7e65,eilra <arlied@google.com>, 2018-11-28 13:40:29 -0800,1, merge pull request thepowersgang master merge,,
1089,146483f00b7e8014b7abd2a382d993daabaf3359,ohn Hodge <tpg@mutabah.net>, 2018-11-24 14:50:12 +0800, , minicargo minor include,,
1090,c2f9278596a4f1eec3e611d3425edd10e0d15c83,ohn Hodge <tpg@mutabah.net>, 2018-11-24 14:48:58 +0800, , hir fix struct class mismatch,,
1091,3ed852f30e6b039050b44e2b89010215332b7bac,ohn Hodge <tpg@mutabah.net>, 2018-11-24 14:48:37 +0800, , standalone_miri fix msvc ice clean warning,,
1092,61d7669269529ea65a7dc797c0db2f84a05fc7b8,ohn Hodge (Mutabah) <acessdev@gmail.com>, 2018-11-18 14:34:24 +0800,92, merge pull request glaubitz m68k trans add initial support m68k,,
1093,a56ce2ac8c99f8622da26bf3677286400c4bbec4,ohn Hodge <tpg@ucc.asn.au>, 2018-11-18 11:34:52 +0800, , vsproject remove error c4061 error even default,,
1094,ad1cec3df31470a1b97f1c672a45ae57495945a5,ohn Paul Adrian Glaubitz <glaubitz@physik.fu-berlin.de>, 2018-11-14 12:33:24 +0100, , trans add initial support m68k,,
1095,16e05c582c39e0aa4f0ef6dd70756fded6516d25,ohn Hodge <tpg@ucc.asn.au>, 2018-11-04 22:09:28 +0800, , codegen fix minor oob string read,,
1096,1726886913173c2828e962d7c5d384e3915d0ae3,ohn Hodge <tpg@ucc.asn.au>, 2018-11-04 20:28:32 +0800, , cleaning memory leak,,
1097,17be046b4ea045118664d1420cf3263770921a4f,ohn Hodge <tpg@ucc.asn.au>, 2018-11-04 08:26:39 +0800, , standalone miri fix warning todos,,
1098,9afb96ccf062961c663e4c84f803e3a01054ea7a,ohn Hodge <tpg@ucc.asn.au>, 2018-11-04 08:24:41 +0800, , typecheck expression minor slight cleanup,,
1099,a51eea542ae086687ea2c4cb09321785f5cc6269,ohn Hodge <tpg@ucc.asn.au>, 2018-11-04 08:22:18 +0800,85, typecheck expression fix use free impact,,
1100,bd32801622229ba3ac02924852f2835bed9debc3,ohn Hodge <tpg@ucc.asn.au>, 2018-11-03 22:09:14 +0800, , hir typecheck fix mixup assignment shr shl operator trait,,
1101,76757341622b747074be74cc75aa5f4f51665f15,ohn Hodge <tpg@mutabah.net>, 2018-11-03 22:08:03 +0800, , hir typecheck fixing hole 1.29,,
1102,ba553fd63c3f88a0eb62dbebe010e50b72fbe8b5,ohn Hodge <tpg@mutabah.net>, 2018-10-21 12:55:58 +0800, , standalone miri compilation fix bit msvc,,
1103,4d6aa119e76862ba57acc7f99ebf68d1ee71adbd,ohn Hodge <tpg@mutabah.net>, 2018-10-21 12:55:31 +0800, , make target path consistent fix build error win32 target,,
1104,9dd5e5364bacf75e8b7f034e61a7f536d0a6344c,ohn Hodge <tpg@mutabah.net>, 2018-10-21 09:53:43 +0800, , window build fix,,
1105,96d23305473e71bc6fdfca0fca4d6a22983801be,ohn Hodge <tpg@ucc.asn.au>, 2018-10-19 17:19:29 +0800,77, add new test one eventually,,
1106,f5168113b6dcdfc8e9713dcf122b99ca6e26a4fc,ohn Hodge <tpg@ucc.asn.au>, 2018-10-19 07:40:53 +0800, , codegen fix incorrect use zst enum constructor shim fix,,
1107,f31020b3f3aeb299e68af9c4790bb591dcfc2aca,ohn Hodge <tpg@mutabah.net>, 2018-10-13 08:34:50 +0800, , span fix lack separator warning,,
1108,74dab6a2bc0a3f1cdeca32aedfec7c46c06d70e1,ohn Hodge <tpg@mutabah.net>, 2018-10-07 10:49:23 +0800, , typecheck fix couple small hole,,
1109,1382500b5fdba00568a86f0122bc2e78584dfb5d,ohn Hodge <tpg@ucc.asn.au>, 2018-10-06 18:14:13 +0800, , merge branch master http github.com thepowersgang mrustc,,
1110,54f252c5c165e3f520d627d5c644502b1ff15c41,ohn Hodge <tpg@mutabah.net>, 2018-10-06 08:39:10 +0800, , misc fix travis build least current state,,
1111,26d664141d451aff8eac5ee967008df04e614ff2,ohn Hodge <tpg@mutabah.net>, 2018-10-06 07:29:46 +0800, , const evaluate rough defer,,
1112,01b1a1382080aa1d9fc648d305a4a49a44781214,ohn Hodge <tpg@mutabah.net>, 2018-10-04 07:53:02 +0800, , const eval intrinsic support size_of slightly better error reporting,,
1113,8adb6f6acf4fd5d2ebf527d749cf77faaf889b65,ohn Hodge <tpg@mutabah.net>, 2018-10-03 21:03:27 +0800, , merge branch master nightly 1.29,,
1114,e42b7877ac1f7c173d42600b220b1f50a143b9b4,ohn Hodge <tpg@mutabah.net>, 2018-10-03 20:50:30 +0800, , fiddling rustc 1.29 update,,
1115,bd3d69813cc54439fdc0db33943fa1254db3df06,ohn Hodge (Mutabah) <acessdev@gmail.com>, 2018-09-30 21:35:32 +0800,84, merge pull request thepowersgang ondemand generation generate mir required constant evaluation,,
1116,fe8018c3b2e2be2c3153a5c1a1bb73cd9c6ca370,ohn Hodge <tpg@ucc.asn.au>, 2018-09-30 17:54:39 +0800, , codegen run destructors zsts enums,,
1117,ab375213d5ef8bb3b3b9cba42a8cc95c5acb6ee5,ohn Hodge <tpg@ucc.asn.au>, 2018-09-22 22:57:51 +0800, , testrunner remove debuginfo smaller output,,
1118,36ca39cec782580f8e56615cd90a9f0e4d2a9c3c,ohn Hodge <tpg@ucc.asn.au>, 2018-09-22 22:57:38 +0800, , misc fix failing test,,
1119,fea81c19efc4961ed43a7aac44fed1efd24f2b4d,ohn Hodge <tpg@ucc.asn.au>, 2018-09-22 20:43:43 +0800, , codegen fix incorrect destructor zst enum variant,,
1120,5c63b46f8dca1d65c1906c77169555229ab07412,ohn Hodge <tpg@ucc.asn.au>, 2018-09-22 16:25:01 +0800, , generate mir constant evaluation many const_cast call ugly also includes mir optimisation change reduce compile time hopefully removed duplicated mir consteval unused hir consteval,,
1121,4a8198baca2cfcee17f83978ab71422a04d53b1a,ohn Hodge <tpg@ucc.asn.au>, 2018-09-15 12:03:28 +0800, , minicargo.mk random test target,,
1122,d85ac84278fa0322f1df0b16a45a1cdde83cba57,ohn Hodge <tpg@mutabah.net>, 2018-09-09 22:19:40 +0800, , msvc compile fix,,
1123,dd4e3c887fa2eef2db6fa2795d4283636a1cc26e,ohn Hodge <tpg@ucc.asn.au>, 2018-08-21 20:22:34 +0800, , codegen fix literal omitted variant,,
1124,74c2ec9d3c7eb09540a2a5de3127390fa8252179,ohn Hodge <tpg@ucc.asn.au>, 2018-08-20 22:37:47 +0800, , trans fix size alignment mismatch x86,,
1125,346da1865a49d7fd354e7aa4e8b5712a2df35a22,ohn Hodge <tpg@ucc.asn.au>, 2018-08-19 15:34:25 +0800, , codegen fix bad prototype drop drop,,
1126,886ba4e2cc088cc7863ab70863553a42feb7e390,ohn Hodge <tpg@ucc.asn.au>, 2018-08-18 11:26:38 +0800, , codegen fix i128 overflow calculation,,
1127,72d50338f117080ace41e849d3a42ab468027cfe,ohn Hodge <tpg@ucc.asn.au>, 2018-08-17 19:22:35 +0800, , codegen fix emulated i128 multiply divide,,
1128,f4483c076291f6c13b44d67a7a8f824ea2fcc682,ohn Hodge <tpg@ucc.asn.au>, 2018-08-12 21:36:16 +0800, , makefile fiddling library test,,
1129,5eef1f0a4d3bcfe4c468b4f1187c5da3b127532d,ohn Hodge <tpg@ucc.asn.au>, 2018-08-12 21:03:46 +0800, , codegen basic panic handling unwind doe get caught,,
1130,6de0e63ac3fdf9f86b68f58dc5a20dec9880c55a,ohn Hodge <tpg@ucc.asn.au>, 2018-08-12 21:03:19 +0800, , mir hir fix incorrect type lowering,,
1131,72c163fbcddbfa1456c430bf31a514c7f99ea1e1,ohn Hodge <tpg@ucc.asn.au>, 2018-08-12 21:02:20 +0800, , hir ast set linkage locally defined function making test harness,,
1132,c8175361ebb5ae99c62d956c475d374a49f90402,ohn Hodge <tpg@ucc.asn.au>, 2018-08-12 21:01:34 +0800, , target set alignment u64 i64 bit platform fix,,
1133,ec907f56199c495db061f2712a5be3977bcb11e8,ohn Hodge <tpg@ucc.asn.au>, 2018-08-05 00:10:39 +0800, , add version number 0.8 altough stable work ...,,
1134,b5df909cdc61a10d750e2d9cb8ba11f4bdec6609,ohn Hodge <tpg@ucc.asn.au>, 2018-08-04 22:54:52 +0800, , proc_macro add hacky way dumping input child process debugging,,
1135,bbc7c0b43c74383dcbaa14bb6550e0efc2d96ae3,ohn Hodge <tpg@mutabah.net>, 2018-08-04 15:36:30 +0800, , minicargo always print called process,,
1136,9fe41ffb9bde218ad97c5430d6cc92051634357d,ohn Hodge <tpg@mutabah.net>, 2018-08-04 18:22:58 +0800, , codegen fix bug add new used intrinsics,,
1137,2d3ca13d000f392cca8bf17cf8969c96e80aa786,ohn Hodge <tpg@mutabah.net>, 2018-08-04 15:36:30 +0800, , minicargo always print called process,,
1138,cd56b774f425b0c842556c3ddeeba708b0fe309f,ohn Hodge <tpg@mutabah.net>, 2018-08-04 15:35:46 +0800, , trans add auto generated clone impls copy type currently,,
1139,5ad533aca561e3daaaf5c7e492ccc5b6a3c99d1b,ohn Hodge <tpg@mutabah.net>, 2018-08-03 23:25:55 +0800, , hir typecheck handle ufcsunknown fuzzy matching,,
1140,de045aa86e72c353c9caa1899b8ff5cc6e67ab8e,ohn Hodge <tpg@mutabah.net>, 2018-08-03 22:44:16 +0800, , hir typecheck support semi arbitary method receiver,,
1141,b2423dbde77141cced2a53c3a4f2e323ed8e4efa,ohn Hodge <tpg@mutabah.net>, 2018-08-02 21:26:58 +0800, , hir typecheck magic clone impls,,
1142,c3d14bb51bea1f2a6e917fb8359335772c52f6f4,ohn Hodge <tpg@mutabah.net>, 2018-08-01 20:12:17 +0800, , expand hacky try trait usage,,
1143,a88d64cbbaeaeb2725259f318f7758ae7a7a91b0,ohn Hodge <tpg@mutabah.net>, 2018-08-01 18:21:01 +0800, , hir conversion typecheck fix 1.29,,
1144,c971a6fa8375598ecf9c99ee6b086e8cf957f568,ohn Hodge <tpg@mutabah.net>, 2018-07-29 12:47:44 +0100, , initial work supporting 1.29 target version,,
1145,5d4bf9e96d795623f1b32b2f1f2e57c4f74419fe,ohn Hodge <tpg@ucc.asn.au>, 2018-07-08 11:58:39 +0800, , libproc_macro minor bugfix,,
1146,e5cf9471fdfa6806f2f6adb41c0e8bc740571c39,ohn Hodge <tpg@ucc.asn.au>, 2018-07-08 11:58:14 +0800, , codegen fix minor abi issue x86 fix emulated i128 bit,,
1147,3bb698c7375a4cbe3ce45c99caacb8dfbd20ab83,ohn Hodge <tpg@ucc.asn.au>, 2018-07-05 20:09:07 +0800, , codegen implement part i128 emulation,,
1148,35c11b8e48fc92ad4b0992cf0b73f3e570468874,ohn Hodge <tpg@ucc.asn.au>, 2018-07-04 21:00:12 +0800, , dump full content asm ast mir,,
1149,169fc6e5cc4482d509f2829ef302c135f983c1ea,ohn Hodge <tpg@ucc.asn.au>, 2018-07-04 20:59:55 +0800, , string_view fix buggy comparison,,
1150,2315092151c309f2d1a37b41d2ec2b6787dcc21c,ohn Hodge <tpg@ucc.asn.au>, 2018-07-04 20:59:27 +0800, , hir serialise fix ordering mir asm input output,,
1151,52f60fbcdfa344c50a7b21ab1bd48cc6d80de641,ohn Hodge (Mutabah) <acessdev@gmail.com>, 2018-07-03 20:08:29 +0800,80, merge pull request aclemons llvm_targets remove quote llvm_targets declaration minicargo.mk,,
1152,b917ce233c2486637cf9f793a5c45009d7e4e97b,ndrew Clemons <andrew.clemons@fluxfederation.com>, 2018-07-01 17:55:10 +1200, , remove quote llvm_targets declaration minicargo.mk wrapped becomes unquoted used llvm_cmake_opts breaking build ... rustc 1.19.0 src build cmake x86_64 x86_64 unknown linux gnu x86 arm aarch64  with_polly gcc relwithdebinfo src llvm cmake error source directory home aclemons workspace mrustc rustc 1.19.0 src build x86 doe exist specify help usage press help button cmake gui bin arm command found bin aarch64 command found minicargo.mk 110 recipe target rustc 1.19.0 src build makefile failed make rustc 1.19.0 src build makefile error 127,,
1153,c1d4b60b462814d064e36c2e8fe833ece823da75,ohn Hodge <tpg@ucc.asn.au>, 2018-07-01 12:51:22 +0800, , codegen replace tunit void fix ffi issue,,
1154,ebd09a2c391abc83969f00770343331ca27e90a9,ohn Hodge <tpg@ucc.asn.au>, 2018-07-01 11:48:48 +0800, , codegen avoid pattern reborrows,,
1155,5d16c2a8498d880f200f0602f63753b144b5cb6b,ohn Hodge <tpg@ucc.asn.au>, 2018-07-01 11:47:16 +0800, , hir mir truncate usize constant bit bit machine,,
1156,87ec3ea65bc42214c4e78c991ec2033fc103bf63,ohn Hodge <tpg@ucc.asn.au>, 2018-06-30 12:30:38 +0800, , hir expand vtable fix incorrect associated type lookup,,
1157,98c49f19838c1049be70cfe0a8bd7852b03ecafb,ohn Hodge <tpg@ucc.asn.au>, 2018-06-30 12:30:04 +0800,78, hir lower stub support repr simd fix,,
1158,e7fa373946f2da1a67a5f74d92191da1a13f7841,ohn Hodge (Mutabah) <acessdev@gmail.com>, 2018-06-30 09:22:50 +0800,79, merge pull request myfreeweb master add freebsd dragonfly support,,
1159,44262d8ce69f28c3b691131c4fb5e8824563053e,reg V <greg@unrelenting.technology>, 2018-06-27 18:12:00 +0300, , document bsd build command readme,,
1160,062cab58c19acb844375ea26fb3eb5841ad65545,reg V <greg@unrelenting.technology>, 2018-06-27 18:07:01 +0300, , consistent preprocessor indentation builder constructor one ifdef __linux__ sticking,,
1161,671d31dc2e3b3a2812d98acb8fc0e5a26ec5e3c0,reg V <greg@unrelenting.technology>, 2018-06-27 18:05:00 +0300, , add freebsd dragonfly target also adjust macos comment freebsd also clang lld current dev version even lld usr bin function section section well supported probably mach issue mac,,
1162,c2ca872f68fc94d6a87478364f2932426f7c747a,reg V <greg@unrelenting.technology>, 2018-06-27 18:02:37 +0300, , makefile improvement one make make customizable llvm target add arm aarch64 default cxx instead hardcoded gcc llvm build,,
1163,06322fd510f3899f7a6c743760528333d9f28506,reg V <greg@unrelenting.technology>, 2018-06-27 17:24:41 +0300, , move src include string_view.hpp namespace libc offer std string_view regardless std flag defining custom std string_view result conflict one actually precise clone real one two pointer instead pointer length,,
1164,b03d61ed130dad6fa88a3beb4c32e48f86fdf84e,ohn Hodge <tpg@mutabah.net>, 2018-06-24 19:39:58 +0800, , expand derive slight restructure allow copy clone magic,,
1165,ed5ab79df31720e8c9635f834ccd44bbef700266,ohn Hodge <tpg@mutabah.net>, 2018-06-24 12:14:45 +0800, , main emit warning unknown phase included mrustc_debug,,
1166,42bdc18d4ba8f9fd19109050eb83bb6615539a75,ohn Hodge <tpg@mutabah.net>, 2018-06-04 13:21:22 +0800, , ensure file header comment remove dead code,,
1167,8d99deade68a9c995101fd5944f9011fcf3dccc7,ohn Hodge <tpg@ucc.asn.au>, 2018-06-04 10:51:44 +0800, , travis silence failure osx build,,
1168,776fd7c37e679762cfa2870c1c1e1e9e76b8ecb6,ohn Hodge <tpg@ucc.asn.au>, 2018-06-04 10:49:58 +0800, , mir helper handle itemaddr enum struct constructor,,
1169,bf8f8b4b4a9fe273451be59f68acafbe61968b83,ohn Hodge <tpg@ucc.asn.au>, 2018-06-03 14:57:05 +0800, , merge branch master http github.com thepowersgang mrustc,,
1170,a7fb27789a2b34543851d207120e2c0001ee9c27,ohn Hodge <tpg@mutabah.net>, 2018-06-03 14:49:07 +0800, , toml slightly better commenting,,
