id,sha,author,date,issue,message,file,content
0,a6c2931fee6119ed356668f88a73fe6827184a93,man Mahajan <amahajan@stratag.com>, 2021-07-29 13:55:49 -0400, , grouping test 2539 add test grouping text toggle selection fix type update test authored nicolas stepien 567105 nstepien update test authored nicolas stepien 567105 nstepien update test authored nicolas stepien 567105 nstepien update test authored nicolas stepien 567105 nstepien update test authored nicolas stepien 567105 nstepien test header cell duplicate groupby key update test authored nicolas stepien 567105 nstepien authored nicolas stepien 567105 nstepien,,
1,8b63f63b49aaf7e58a8686f272cbdd3180453bc6,kke TÃµiv Uustalu <ekke@tdl.ee>, 2021-07-29 12:44:13 +0200, , inject style top head make override work 2541,,
2,fcd258cf08e6eb8ced4c0c91cfe93c509accadb9,man Mahajan <amahajan@stratag.com>, 2021-07-28 13:56:43 -0400, , move drag related function draghandle component 2538 move drag related function draghandle component tweak onfill check remove ref useeffect use previous value syntax set state update src draghandle.tsx authored nicolas stepien 567105 nstepien fix type remove check authored nicolas stepien 567105 nstepien,,
3,e4c1c3d1f9b55d98133cbfd20a0fea618b135451,man Mahajan <amahajan@stratag.com>, 2021-07-28 09:38:46 -0400, , use element prop setting editor drag handle 2537 use element prop setting editor drag handle tweak add group row check use colspan check update src datagrid.tsx authored nicolas stepien 567105 nstepien update src types.ts authored nicolas stepien 567105 nstepien update src types.ts authored nicolas stepien 567105 nstepien detructure fix type authored nicolas stepien 567105 nstepien,,
4,b2b2d6f4bab8d385bd4514d8efe47d5606342481,ependabot[bot] <49699333+dependabot[bot]@users.noreply.github.com>, 2021-07-26 10:34:50 +0100, , bump codecov codecov action 2.0.2 2534 bump codecov codecov action 2.0.2 bump codecov codecov action http github.com codecov codecov action 2.0.2 release note http github.com codecov codecov action release changelog http github.com codecov codecov action blob master changelog.md commits http github.com codecov codecov action compare ... v2.0.2  updated dependency dependency name codecov codecov action dependency type direct production update type version update semver major ... signed dependabot bot support github.com tweak version authored dependabot bot 49699333 dependabot bot authored nicolas stepien 567105 nstepien,,
5,bcf2857f9d3787bb7b3f1d504dbc6e6cf213669c,man Mahajan <amahajan@stratag.com>, 2021-07-22 09:34:56 -0500, , test colspan 2529,,
6,d002dedb2f19a2a81cfaf922a6dd33e0da92558f,icolas Stepien <stepien.nicolas@gmail.com>, 2021-07-22 14:04:19 +0100, , publish 7.0.0 beta.0,,
7,f2c9873e7ae73709afd76c6464b6fe00f94102de,icolas Stepien <567105+nstepien@users.noreply.github.com>, 2021-07-22 13:47:31 +0100, , remove rowidx prop cell component 2464 remove rowidx prop cell component remove rowidx param onrowclick cleanup select cell function fix context type authored aman mahajan amahajan stratag.com,,
8,636442b92edac93105b554a7c485e01e336f7e87,icolas Stepien <567105+nstepien@users.noreply.github.com>, 2021-07-22 13:14:07 +0100,2527, fix frozen column key incompatible var 2528 fix 2527,,
9,adc3efab61cee12b7cf5437b7425bc31f7276eb7,icolas Stepien <567105+nstepien@users.noreply.github.com>, 2021-07-22 13:11:00 +0100, , render cell formatter editcell editor portal 2440 render cell editcell position render formatter editor using portal tweak fix condition possible edit cell row group destructure column.idx authored aman mahajan amahajan stratag.com authored aman mahajan amahajan freewheel.com,,
10,50c5302754a60198894042369570813a0efdcf5c,ependabot[bot] <49699333+dependabot[bot]@users.noreply.github.com>, 2021-07-08 11:36:40 +0000, , update eslint plugin sonarjs requirement 0.8.0 125 0.9.1 2516 update requirement eslint plugin sonarjs http github.com sonarsource eslint plugin sonarjs permit latest version release note http github.com sonarsource eslint plugin sonarjs release commits http github.com sonarsource eslint plugin sonarjs compare 0.8.0 125 ... 0.9.1  updated dependency dependency name eslint plugin sonarjs dependency type direct development ... signed dependabot bot support github.com authored dependabot bot 49699333 dependabot bot,,
11,0bedc816a57771f0068732642f11d7e145d34c09,icolas Stepien <567105+nstepien@users.noreply.github.com>, 2021-07-08 12:26:08 +0100, , revert dependabot set versioning strategy increase 2479 2511 reverts commit,,
12,257fa64bb474e0b7fd3c5c5a4edfe8be9ff8bfb4,akazavva <nakazavva@gmail.com>, 2021-07-06 21:46:34 +0900, , support metakey multisort 2513,,
13,84023d00f4c7a655f2e502fcf45293900a26ac48,man Mahajan <amahajan@stratag.com>, 2021-07-01 07:39:48 -0500, , set field readonly 2505 tweak readonly field cleanup type mark childgroups readonly fix colspan calculation readonly column update src types.ts authored nicolas stepien 567105 nstepien update src hook authored nicolas stepien 567105 nstepien remove readonly value mutated update src hook authored nicolas stepien 567105 nstepien update src utils authored nicolas stepien 567105 nstepien simplify setcolspan set variable function directly update src utils authored nicolas stepien 567105 nstepien update src utils authored nicolas stepien 567105 nstepien remove posidx parameter authored nicolas stepien 567105 nstepien,,
14,cad2aaad1dd6030edf2c83f3a1e49f176f4f725b,man Mahajan <amahajan@stratag.com>, 2021-06-29 10:20:28 -0500, , add missing aria selected 2502,,
15,7eef4df2bd87c9085e2aa5192703d6d5877c69aa,icolas Stepien <567105+nstepien@users.noreply.github.com>, 2021-06-29 13:10:39 +0100, , show sort arrow svg 2501 show sort arrow svg add aria hidden,,
16,c7ac0de6b288d3376017e3da8046767a3ade8282,ependabot[bot] <49699333+dependabot[bot]@users.noreply.github.com>, 2021-06-28 13:36:44 +0000, , update storybook react requirement 6.2.9 6.3.1 2500 update requirement storybook react http github.com storybookjs storybook tree head app react permit latest version release note http github.com storybookjs storybook release changelog http github.com storybookjs storybook blob next changelog.v1 5.md commits http github.com storybookjs storybook commits v6.3.1 app react  updated dependency dependency name storybook react dependency type direct development ... signed dependabot bot support github.com authored dependabot bot 49699333 dependabot bot authored nicolas stepien 567105 nstepien,,
17,ed69d7cd785574a9475df97b196962449f4d1020,ependabot[bot] <49699333+dependabot[bot]@users.noreply.github.com>, 2021-06-28 10:48:20 +0100, , bump prettier 2.3.1 2.3.2 2499 bump prettier http github.com prettier prettier 2.3.1 2.3.2 release note http github.com prettier prettier release changelog http github.com prettier prettier blob main changelog.md commits http github.com prettier prettier compare 2.3.1 ... 2.3.2  updated dependency dependency name prettier dependency type direct development update type version update semver patch ... signed dependabot bot support github.com authored dependabot bot 49699333 dependabot bot,,
18,96df83656adc35a1786f3f2bf4344b4e550c22bd,ependabot[bot] <49699333+dependabot[bot]@users.noreply.github.com>, 2021-06-25 20:01:37 +0000, , update mini extract plugin requirement 1.6.0 1.6.1 2490 update requirement mini extract plugin http github.com webpack contrib mini extract plugin permit latest version release note http github.com webpack contrib mini extract plugin release changelog http github.com webpack contrib mini extract plugin blob master changelog.md commits http github.com webpack contrib mini extract plugin compare v1.6.0 ... v1.6.1  updated dependency dependency name mini extract plugin dependency type direct development ... signed dependabot bot support github.com authored dependabot bot 49699333 dependabot bot,,
19,ac0c1c8d8bc560e07b467ef016358ceef98483a5,ependabot[bot] <49699333+dependabot[bot]@users.noreply.github.com>, 2021-06-25 19:58:08 +0100, , update babel preset env requirement 7.14.5 7.14.7 2491 update requirement babel preset env http github.com babel babel tree head package babel preset env permit latest version release note http github.com babel babel release changelog http github.com babel babel blob main changelog.md commits http github.com babel babel commits v7.14.7 package babel preset env  updated dependency dependency name babel preset env dependency type direct development ... signed dependabot bot support github.com authored dependabot bot 49699333 dependabot bot,,
20,87091284ebc78fa0df17fe7f9d4419cb3dc7a304,ependabot[bot] <49699333+dependabot[bot]@users.noreply.github.com>, 2021-06-25 18:41:53 +0000, , update typescript requirement 4.3.2 4.3.4 2492 update requirement typescript http github.com microsoft typescript permit latest version release note http github.com microsoft typescript release commits http github.com microsoft typescript compare v4.3.2 ... v4.3.4  updated dependency dependency name typescript dependency type direct development ... signed dependabot bot support github.com authored dependabot bot 49699333 dependabot bot,,
21,ac68725a8d91cce996d9762bf3c10c220a8502f7,ependabot[bot] <49699333+dependabot[bot]@users.noreply.github.com>, 2021-06-25 18:37:53 +0000, , update core requirement 3.14.0 3.15.1 2498 update requirement core http github.com zloirock core tree head package core permit latest version release note http github.com zloirock core release changelog http github.com zloirock core blob master changelog.md commits http github.com zloirock core commits v3.15.1 package core  updated dependency dependency name core dependency type direct development ... signed dependabot bot support github.com authored dependabot bot 49699333 dependabot bot,,
22,34698bee055287c600f1e2170fb301488cc80801,ependabot[bot] <49699333+dependabot[bot]@users.noreply.github.com>, 2021-06-25 18:33:03 +0000, , update jest requirement 27.0.4 27.0.5 2497 update requirement jest http github.com facebook jest permit latest version release note http github.com facebook jest release changelog http github.com facebook jest blob master changelog.md commits http github.com facebook jest compare v27.0.4 ... v27.0.5  updated dependency dependency name jest dependency type direct development ... signed dependabot bot support github.com authored dependabot bot 49699333 dependabot bot,,
23,f9053fa45775f795560dba2b1633cacbd0374921,ependabot[bot] <49699333+dependabot[bot]@users.noreply.github.com>, 2021-06-25 18:24:08 +0000, , update linaria rollup requirement 3.0.0 beta.6 3.0.0 beta.7 2496 update requirement linaria rollup http github.com callstack linaria permit latest version release note http github.com callstack linaria release changelog http github.com callstack linaria blob master changelog.md commits http github.com callstack linaria compare v3.0.0 beta.6 ... v3.0.0 beta.7  updated dependency dependency name linaria rollup dependency type direct development ... signed dependabot bot support github.com authored dependabot bot 49699333 dependabot bot,,
24,9f0bb45218b853cb5b395dab7a085dea9034bed0,ependabot[bot] <49699333+dependabot[bot]@users.noreply.github.com>, 2021-06-25 18:16:34 +0000, , update babel runtime requirement 7.14.5 7.14.6 2495 update requirement babel runtime http github.com babel babel tree head package babel runtime permit latest version release note http github.com babel babel release changelog http github.com babel babel blob main changelog.md commits http github.com babel babel commits v7.14.6 package babel runtime  updated dependency dependency name babel runtime dependency type direct development ... signed dependabot bot support github.com authored dependabot bot 49699333 dependabot bot,,
25,1c423d3aa0e5e1845245b53db6f390d18f22ac9a,ependabot[bot] <49699333+dependabot[bot]@users.noreply.github.com>, 2021-06-25 19:05:44 +0100, , update linaria webpack loader requirement 2494 update requirement linaria webpack loader http github.com callstack linaria permit latest version release note http github.com callstack linaria release changelog http github.com callstack linaria blob master changelog.md commits http github.com callstack linaria compare v3.0.0 beta.6 ... v3.0.0 beta.7  updated dependency dependency name linaria webpack loader dependency type direct development ... signed dependabot bot support github.com authored dependabot bot 49699333 dependabot bot,,
26,0a939edce0af27efa4065f5f993871ba1d6b4774,ependabot[bot] <49699333+dependabot[bot]@users.noreply.github.com>, 2021-06-25 17:59:24 +0000, , update babel core requirement 7.14.5 7.14.6 2493 update requirement babel core http github.com babel babel tree head package babel core permit latest version release note http github.com babel babel release changelog http github.com babel babel blob main changelog.md commits http github.com babel babel commits v7.14.6 package babel core  updated dependency dependency name babel core dependency type direct development ... signed dependabot bot support github.com authored dependabot bot 49699333 dependabot bot,,
27,82bb622d6a96a24a23f8f45d373f025e59a0d88b,ependabot[bot] <49699333+dependabot[bot]@users.noreply.github.com>, 2021-06-25 17:43:05 +0000, , update testing library jest dom requirement 5.13.0 5.14.1 2487 update requirement testing library jest dom http github.com testing library jest dom permit latest version release note http github.com testing library jest dom release changelog http github.com testing library jest dom blob main changelog.md commits http github.com testing library jest dom compare v5.13.0 ... v5.14.1  updated dependency dependency name testing library jest dom dependency type direct development ... signed dependabot bot support github.com authored dependabot bot 49699333 dependabot bot,,
28,96cb0e89835e2c05fd8ecc7d2573ea3e7751e707,ependabot[bot] <49699333+dependabot[bot]@users.noreply.github.com>, 2021-06-25 17:33:47 +0000, , update linaria shaker requirement 3.0.0 beta.5 3.0.0 beta.7 2485 update requirement linaria shaker http github.com callstack linaria permit latest version release note http github.com callstack linaria release changelog http github.com callstack linaria blob master changelog.md commits http github.com callstack linaria compare v3.0.0 beta.5 ... v3.0.0 beta.7  updated dependency dependency name linaria shaker dependency type direct development ... signed dependabot bot support github.com authored dependabot bot 49699333 dependabot bot,,
29,70cb3976b575ed37e5c87ff0e277b21627af7710,ependabot[bot] <49699333+dependabot[bot]@users.noreply.github.com>, 2021-06-25 18:26:58 +0100, , update rollup requirement 2.51.2 2.52.3 2489 update requirement rollup http github.com rollup rollup permit latest version release note http github.com rollup rollup release changelog http github.com rollup rollup blob master changelog.md commits http github.com rollup rollup compare v2.51.2 ... v2.52.3  updated dependency dependency name rollup dependency type direct development ... signed dependabot bot support github.com authored dependabot bot 49699333 dependabot bot,,
30,96e1fffd477ecfca1502c134ef3e97a4a3787171,ependabot[bot] <49699333+dependabot[bot]@users.noreply.github.com>, 2021-06-25 18:23:09 +0100, , update typescript eslint eslint plugin requirement 2484 update requirement typescript eslint eslint plugin http github.com typescript eslint typescript eslint tree head package eslint plugin permit latest version release note http github.com typescript eslint typescript eslint release changelog http github.com typescript eslint typescript eslint blob master package eslint plugin changelog.md commits http github.com typescript eslint typescript eslint commits v4.28.0 package eslint plugin  updated dependency dependency name typescript eslint eslint plugin dependency type direct development ... signed dependabot bot support github.com authored dependabot bot 49699333 dependabot bot,,
31,e35d061e345b41e8a16611185f37174cbe40c266,ependabot[bot] <49699333+dependabot[bot]@users.noreply.github.com>, 2021-06-25 17:16:30 +0000, , update babel plugin optimize clsx requirement 2.6.1 2.6.2 2483 update requirement babel plugin optimize clsx http github.com merceyz babel plugin optimize clsx permit latest version release note http github.com merceyz babel plugin optimize clsx release changelog http github.com merceyz babel plugin optimize clsx blob master changelog.md commits http github.com merceyz babel plugin optimize clsx compare v2.6.1 ... v2.6.2  updated dependency dependency name babel plugin optimize clsx dependency type direct development ... signed dependabot bot support github.com authored dependabot bot 49699333 dependabot bot,,
32,cd74a28e81b79adce8a378cf82b09af30678dca5,ependabot[bot] <49699333+dependabot[bot]@users.noreply.github.com>, 2021-06-25 17:11:34 +0000, , update eslint requirement 7.28.0 7.29.0 2482 update requirement eslint http github.com eslint eslint permit latest version release note http github.com eslint eslint release changelog http github.com eslint eslint blob master changelog.md commits http github.com eslint eslint compare v7.28.0 ... v7.29.0  updated dependency dependency name eslint dependency type direct development ... signed dependabot bot support github.com authored dependabot bot 49699333 dependabot bot,,
33,a5b5772ddcb2ee3ea8e992c9057b2ec7da32856c,ependabot[bot] <49699333+dependabot[bot]@users.noreply.github.com>, 2021-06-25 17:06:23 +0000, , update type react dom requirement 17.0.7 17.0.8 2486 update requirement type react dom http github.com definitelytyped definitelytyped tree head type react dom permit latest version release note http github.com definitelytyped definitelytyped release commits http github.com definitelytyped definitelytyped commits head type react dom  updated dependency dependency name type react dom dependency type direct development ... signed dependabot bot support github.com authored dependabot bot 49699333 dependabot bot,,
34,0c251e8296b08d78098a5f59d0f17795be997565,ependabot[bot] <49699333+dependabot[bot]@users.noreply.github.com>, 2021-06-25 17:02:02 +0000, , update postcss requirement 8.3.2 8.3.5 2481 update requirement postcss http github.com postcss postcss permit latest version release note http github.com postcss postcss release changelog http github.com postcss postcss blob main changelog.md commits http github.com postcss postcss compare 8.3.2 ... 8.3.5  updated dependency dependency name postcss dependency type direct development ... signed dependabot bot support github.com authored dependabot bot 49699333 dependabot bot,,
35,1e239c73acff54d54400c94399dcfa9fde8fefdf,ependabot[bot] <49699333+dependabot[bot]@users.noreply.github.com>, 2021-06-25 17:57:58 +0100, , update typescript eslint parser requirement 4.26.1 4.28.0 2480 update requirement typescript eslint parser http github.com typescript eslint typescript eslint tree head package parser permit latest version release note http github.com typescript eslint typescript eslint release changelog http github.com typescript eslint typescript eslint blob master package parser changelog.md commits http github.com typescript eslint typescript eslint commits v4.28.0 package parser  updated dependency dependency name typescript eslint parser dependency type direct development ... signed dependabot bot support github.com authored dependabot bot 49699333 dependabot bot,,
36,ba6b22b3a51840207e9edb015e94055746c3a8f9,icolas Stepien <567105+nstepien@users.noreply.github.com>, 2021-06-25 17:47:18 +0100, , dependabot set versioning strategy increase 2479,,
37,8b92665bf0ed0026fb20a8d680be9376fa9d75be,ependabot[bot] <49699333+dependabot[bot]@users.noreply.github.com>, 2021-06-25 16:53:12 +0100, , bump testing library react 11.2.7 12.0.0 2478 bump testing library react http github.com testing library react testing library 11.2.7 12.0.0 release note http github.com testing library react testing library release changelog http github.com testing library react testing library blob main changelog.md commits http github.com testing library react testing library compare v11.2.7 ... v12.0.0  updated dependency dependency name testing library react dependency type direct development update type version update semver major ... signed dependabot bot support github.com authored dependabot bot 49699333 dependabot bot,,
38,cbc5d19889d4d06e35a331f7261aea89abdc2020,icolas Stepien <567105+nstepien@users.noreply.github.com>, 2021-06-25 16:44:29 +0100, , set dependabot 2475 set dependabot prettier,,
39,b653b2fc143dcfa1e41c20d9ab159d908a6ca61b,icolas Stepien <567105+nstepien@users.noreply.github.com>, 2021-06-25 16:39:16 +0100, , add color scheme 2476,,
40,db58d2722920b39452742c962bbd74e653c47701,icolas Stepien <567105+nstepien@users.noreply.github.com>, 2021-06-25 16:36:27 +0100, , add codeowners 2477,,
41,bfd8010ecb4a14cf8cdac7f78a107fb5fb3ae8b1,man Mahajan <amahajan@stratag.com>, 2021-06-18 11:17:22 -0500, , add prop 2468,,
42,d5bac46495d8aecc77bf67c84496260bd1d9a7af,man Mahajan <amahajan@stratag.com>, 2021-06-17 10:00:27 -0500, , add readonly type 2467,,
43,d68288aff11a22f246ce3a41b60708728b84e92f,icolas Stepien <567105+nstepien@users.noreply.github.com>, 2021-06-14 13:59:31 +0100, , remove row batching 2460 remove row batching update test expectation update comment,,
44,f866054729d4472c2973da6bc0bcea4cd94f204a,icolas Stepien <567105+nstepien@users.noreply.github.com>, 2021-06-11 18:09:16 +0100, , unpin linaria rollup 2457,,
45,cbd58f6162817acc3a72faa0f0eb314516ebec18,icolas Stepien <567105+nstepien@users.noreply.github.com>, 2021-06-10 17:04:05 +0100,2453, pin linaria rollup 2454 fix 2453,,
46,8f2e8edce257176a7fbd79861eedbc20c807ff3e,man Mahajan <amahajan@stratag.com>, 2021-06-09 16:57:10 -0500, , change wrapper suffix latest clarity 2452,,
47,281d8b49aef6394d0e0de43fbcd2c194ab80feb3,icolas Stepien <567105+nstepien@users.noreply.github.com>, 2021-06-09 16:14:11 +0100, , update deps 2451,,
48,2a19d6a09067ac77be372e3ab5ad37411c792818,icolas Stepien <567105+nstepien@users.noreply.github.com>, 2021-05-28 14:14:10 +0100, , replace react select 2441,,
49,5712ce2593b10faddbc8f384d70b049342894cb2,icolas Stepien <567105+nstepien@users.noreply.github.com>, 2021-05-27 18:49:01 +0100, , cell export 2435 cell export unused prop authored aman mahajan amahajan stratag.com,,
50,3d407a8684a6f342fb31e977da0c790b11ddd10b,icolas Stepien <567105+nstepien@users.noreply.github.com>, 2021-05-27 18:39:50 +0100, , fix selecting row non existent row key preserved 2436,,
51,f6ec4a84829aedefd89190d705e5ef4740393d90,icolas Stepien <567105+nstepien@users.noreply.github.com>, 2021-05-26 18:46:46 +0100, , typescript 4.3 2417 typescript 4.3 test type bundling fix build typescript 4.3.2,,
52,fd89e7debb4594d4fe58bcb3d3e57e96bd52340d,icolas Stepien <567105+nstepien@users.noreply.github.com>, 2021-05-26 17:10:37 +0100, , update branch reference 2432,,
53,a611a4e79b3557783eec0fd53cf4763db4c40bd3,icolas Stepien <stepien.nicolas@gmail.com>, 2021-05-26 15:55:29 +0100, , publish 7.0.0 canary.49,,
54,d66bf68ad62a8c84a63ad9a32cddc43c58afb88c,icolas Stepien <567105+nstepien@users.noreply.github.com>, 2021-05-26 15:53:57 +0100, , update dependency 2430,,
55,6c9c50858f33951e6e0663df626c5ccfff620bb5,mitchell1132 <82958106+jmitchell1132@users.noreply.github.com>, 2021-05-26 09:49:08 -0500, , multi column sorting 2365 added multi sort interface updated prop make use new interface ctrl click feature minor change added function modifying sort array priority numbering added function sorting row added export row small change prop update refactoring removed sortdirection prop sorting function refactor small change formatting fix format demo file update typecheck fix added unit test fixed eslint error typecheck minor change update code review update new testing util formatting eslint formatting review comment authored nicolas stepien 567105 nstepien remove optional authored nicolas stepien 567105 nstepien fixed eslint error updated minor change added index check fixed eslint error simplified sort text priority merge conflict code review update prettier removed none added functionality eslint error prettier refactor prettier formatting typecheck error prettier test refactor removed import removed unused utils eslint error typecheck error authored justine mitchell jmitch430 authored aman mahajan amahajan stratag.com authored nicolas stepien 567105 nstepien,,
56,76fb79feef5e99c44af60be28f7d0536c32e3825,icolas Stepien <567105+nstepien@users.noreply.github.com>, 2021-05-26 15:23:54 +0100, , replace selecteditor simple select 2431,,
57,f48a98c983cc17050976878518a08ae2965f6a13,icolas Stepien <567105+nstepien@users.noreply.github.com>, 2021-05-25 21:43:53 +0100, , inline 2428 inline rewrite comment comment,,
58,7fb594bd151965959e1cd83115c91e1b611d9e16,icolas Stepien <567105+nstepien@users.noreply.github.com>, 2021-05-25 18:34:43 +0100, , add outside click test 2427 add outside click test fix type update test column editor.test.tsx authored aman mahajan amahajan stratag.com replace queryselector authored aman mahajan amahajan stratag.com,,
59,d273e614bb186fbe9ad2c25b7f88dbb300830eb0,icolas Stepien <567105+nstepien@users.noreply.github.com>, 2021-05-25 15:42:10 +0100, , rename remaining master reference main 2426 rename remaining master reference main disable main deployment sort thing,,
60,2356a5ee3ff6c87c71e88d30f85dbad1f1af4c97,man Mahajan <amahajan@stratag.com>, 2021-05-25 07:41:42 -0500, , split export bundle 2425,,
61,bd9d6c4efecb5d12798ebe761f891d54ac1d4ea4,icolas Stepien <567105+nstepien@users.noreply.github.com>, 2021-05-25 13:21:58 +0100, , jest 2424,,
62,a429f20a65277dc5234bbbbeffa3f3a8a35e5712,man Mahajan <amahajan@stratag.com>, 2021-05-24 13:24:14 -0500, , add dialog editor 2423,,
