id,sha,author,date,issue,message,file,content
501,480bf61d2ae4f8a744a7f670d6c6598534063726,ws-sdk-cpp-automation <aws-sdk-cpp-automation@github.com>, 2020-03-06 20:16:58 +0000, , amazon guardduty finding include outpostarn finding generated aws outpost ec2 host app mesh support sharing mesh aws account customer use aws resource access manager share mesh account organization connection application within single service mesh see http app mesh latest userguide sharing.html detail added support streaming gui robot simulation application release provides customer self service option enable local zone release enables signing image format override request adding two enum field jsonembedded jsondetached release also extends length limit signingprofile name,,
502,4f52d5598d26f7aa747299d14dc249023caf0cbe,ilberto Lopez Zayas <vuner.lopez@gmail.com>, 2020-03-05 22:07:59 -0800, , manual libatomic check linux cmake,,
503,76c19cf7b08a5af79256f844df92c8a544dc02a5,ws-sdk-cpp-automation <aws-sdk-cpp-automation@github.com>, 2020-03-05 21:10:11 +0000, , amazon eks support adding key cluster envelope encryption kubernetes secret updated tag regex pattern align aws tagging apis create aws client vpn endpoint specified vpc security group additionally modify attribute modifying endpoint add new finding field ec2 finding indicating instance local address involved threat,,
504,81ab56f647a8d3f814aede00d23e283746dd233f,ushen Wang <wps132230@hotmail.com>, 2020-03-05 12:02:33 -0800, , avoid using namespace header file,,
505,5e0e48ae682d3fe104291198476ef6739f00d1f3,ws-sdk-cpp-automation <aws-sdk-cpp-automation@github.com>, 2020-03-04 20:14:10 +0000, , release amazon pinpoint api introduces support integrating recommender model email push notification message template use type template connect recommender model add personalized recommendation message send campaign journey,,
506,a996f51f86d98f908bc80b62a61947991a0d4c3c,ws-sdk-cpp-automation <aws-sdk-cpp-automation@github.com>, 2020-03-03 20:14:10 +0000, , amazon vpc flow log add support tag tagging resource creation,,
507,bf55bd2cc6fdc4464488aa1ac9920954a5a2f6f9,ws-sdk-cpp-automation <aws-sdk-cpp-automation@github.com>, 2020-03-02 20:34:24 +0000, , new time expression feature part api provide temporal relation existing nere entity medication test treatment procedure medical condition introducing amazon cloudwatch composite alarm,,
508,345d3a6f2de23e50744b08c85eae1d92645d86eb,ws-sdk-cpp-automation <aws-sdk-cpp-automation@github.com>, 2020-02-29 02:13:21 +0000, , correcting list supported resource type,,
509,ced3b8752d04f0a67b8370657d9b9695f6a0f6d4,ws-sdk-cpp-automation <aws-sdk-cpp-automation@github.com>, 2020-02-28 20:18:32 +0000, , release update amazon augmented listhumanloops api response starthumanloop response type name sdk field documentation update workdocs app mesh support transport layer security virtual node mesh customer use managed certificate aws certificate manager private certificate authority bring certificate local file system encrypt traffic workload see http app mesh latest userguide virtual node tls.html detail release includes improvement fix bug iam access analyzer feature documentation update amazon codeguru profiler added target group attribute support sticky session network load balancer added api allows listing dashboard specific user access aws glue add resource tagging support machine learning transforms add new api support tag filtering feature customer use tag aws glue organize control access machine learning transforms accepts structured query language sql select command aggregator name performs corresponding search resource aggregated aggregator return resource configuration matching property,,
510,a33092be1592864ed3561b7fa752f439d2ec028f,ws-sdk-cpp-automation <aws-sdk-cpp-automation@github.com>, 2020-02-27 21:49:32 +0000, , add support create notification contact amazon lightsail create instance database load balancer metric alarm notify based value metric relative threshold specify release add support adding tag accelerator bringing address aws global accelerator byoip,,
511,c9d2aeb1c59c4da6e03aa243bd96221ee0528899,ws-sdk-cpp-automation <aws-sdk-cpp-automation@github.com>, 2020-02-26 20:07:48 +0000, , release change runinstances cli sdk specify client token randomly generated token used request ensure idempotency security hub added api operation new response field called field list type action product performs relative security hub send finding security hub receive finding security hub sagemaker updateendpoint api support retained variant property e.g. instance count variant weight sagemaker listtrials api filter make name length limit consistent createtrial apis amazon transcribe automatic content redaction feature enables automatically redact sensitive personally identifiable information pii transcription result replaces instance identified pii utterance pii tag transcript,,
512,9f51113f231abe3f1f35c88a5a92cbbb497b65c8,ws-sdk-cpp-automation <aws-sdk-cpp-automation@github.com>, 2020-02-25 21:49:53 +0000, , release add deletesite deleteoutpost release increase maximum allowed size secretstring secretbinary 10kb 64kb createsecret updatesecret putsecretvalue getsecretvalue apis amazon msk added support broker log delivery cloudwatch firehose release add support cloudwatch log standard workflow,,
513,f71994d89d62a61d55ee995b17fe1e5059cfdcb1,ws-sdk-cpp-automation <aws-sdk-cpp-automation@github.com>, 2020-02-24 21:03:21 +0000, , release allows create manage tag event bus documentation update iotcolumbo announcing persistent file system amazon fsx lustre ideal longer term storage workload new generation scratch file system offer higher burst throughput spiky workload aws snowball add field entering gstin creating aws snowball job asia pacific mumbai region release allows create manage tag event bus documentation update docdb,,
514,ed3c50494772eca01003724d7ffe70a804ae9e2e,ws-sdk-cpp-automation <aws-sdk-cpp-automation@github.com>, 2020-02-21 21:23:56 +0000, , release ec2 image builder increase maximum policy document size image builder resource based policy apis documentation update aws waf wafv2 correct guidance associating web acl cloudfront distribution extend elastic resize support resizing cluster different instance type,,
515,096969d25f129f9da30ad7599d2de39d3474c3ca,ws-sdk-cpp-automation <aws-sdk-cpp-automation@github.com>, 2020-02-20 23:12:34 +0000, , added support aws lambda compute saving plan release add exponential growth type support deployment strategy release amazon pinpoint api title property optional object,,
516,07e0645759ce57b6247dd3729db34374f872bd61,ws-sdk-cpp-automation <aws-sdk-cpp-automation@github.com>, 2020-02-19 20:11:53 +0000, , doc update ec2 auto scaling add enabled parameter aws lambda support ruby 2.7 api new optional parameter provided portfolio portfolioid given shared organization organizational unit account organization sub tree parent inherit organizational portfolio share listed rather account external share accommodate long list returned new option api support pagination,,
517,87d7ce992f8f710253a4952a622479d9efd4f7c2,ws-sdk-cpp-automation <aws-sdk-cpp-automation@github.com>, 2020-02-18 20:40:08 +0000, , amazon ec2 auto scaling support ability enable disable target tracking step scaling simple scaling policy added support chime sdk client release support microsoft active directory authentication amazon aurora,,
518,315d4c38346b9f4539222dd7679f56c4deeedac3,ws-sdk-cpp-automation <aws-sdk-cpp-automation@github.com>, 2020-02-17 20:22:54 +0000, , amazon dynamodb enables restore dynamodb backup table data across aws region restored table created different aws region source table backup resides cross region restores aws commercial region aws china region aws govcloud region update add ability detect text video add filter image video text detection aws cloud9 support ability tag cloud9 development environment documentation update ec2,,
519,dfd0b02d959622209b4938c4db3e48569154a42d,ws-sdk-cpp-automation <aws-sdk-cpp-automation@github.com>, 2020-02-14 20:54:09 +0000, , security hub released new api action api action allows customer list standard available account standard list provides customer standard name description arn customer use arn input api action learn visit api documentation enable multi attach provisioned iop io1 volume create volume api aws elemental mediatailor sdk allows configuration personalization threshold dash stream release add support associating amazon route health check aws shield advanced protected resource,,
520,b6329409e51dc660b06f447af7b1ce4181e380d8,ws-sdk-cpp-automation <aws-sdk-cpp-automation@github.com>, 2020-02-13 20:51:02 +0000, , add support dash multiple medium presentation description period triggered presence scte marker manifest.also add optional configuration dash refer segment number duration number timeline time timeline compact manifest combining duplicate segmenttemplate tag,,
521,4695fd0e1a915e910bd359f94a445577b744951e,ws-sdk-cpp-automation <aws-sdk-cpp-automation@github.com>, 2020-02-12 20:13:05 +0000, , amazon elasticsearch service offer fine grained access control add multiple capability give tighter control data new feature include ability use role define granular permission index document field extend kibana read view secure multi tenant support release add support access control rule management amazon workmail release add output ease customer look certificate lifetime make timely decision renewing documentation update amazon chime release add support tagging public ipv4 pool launch enables neptune start cluster stop cluster stopping starting amazon neptune cluster help manage cost development test environment temporarily stop instance cluster instead setting tearing instance time use cluster adding ability add argument overridden aws glue job,,
522,c60299701915c781ebb57c3213b8bdad854a885f,ws-sdk-cpp-automation <aws-sdk-cpp-automation@github.com>, 2020-02-11 20:17:10 +0000, , feature release add new setting user pool allow customer want user signup signin case insensitive username current default setting case sensitive next release change case insensitive release aws cloudformation stacksets allows centrally manage deployment account organization specific organizational unit ous aws organization also able enable automatic deployment new account added organization ous permission needed deploy across account automatically taken care stacksets service amazon ec2 support tagging spot fleet,,
523,16a0c4b38144309546a44b9e9174f0775375030f,ws-sdk-cpp-automation <aws-sdk-cpp-automation@github.com>, 2020-02-10 20:24:27 +0000, , added clarifying information amazon documentdb share operational technology amazon rds amazon neptune api provides new error code customer better troubleshoot connect custom key store operation fails,,
524,ad6c51d8c9e52eb74418d40b0a78021e890ef27f,ws-sdk-cpp-automation <aws-sdk-cpp-automation@github.com>, 2020-02-07 20:14:50 +0000, , version sdk includes bug fix documentation update documentation update rds restoring cluster snapshot must create instance release add support simulation job batch,,
525,6771b61a0abe8a6c38e8443b685536bd4d7d2e18,ws-sdk-cpp-automation <aws-sdk-cpp-automation@github.com>, 2020-02-06 20:21:59 +0000, , aws codebuild add support amazon elastic file system aws appsync support ray release contains updated text api documentation update direct apis release add platform detail billing info describeimages api amazon lex support regular expression,,
526,399041a16bcdd848fa2bb3e005aef51504634a9c,ws-sdk-cpp-automation <aws-sdk-cpp-automation@github.com>, 2020-02-05 20:15:07 +0000, , add property datecreated lastupdated tag property getsatellite deprecated additional resource type supported aws security finding format asff following new resource type added accompanying resource detail object field security finding provider populate awswafwebacl following resource type added without accompanying detail object awsec2eip awsec2snapshot awsec2volume awss3object number allowed resource per finding increased 32. new field added compliance object learn visit documentation asff updated maximum number tag added snapshot using dlm release provides support tagging create vpc endpoint vpc endpoint service documentation update amazon forecast documentation update add service list supported service aws elemental mediaconvert sdk added support fine tuned qvbr quality level,,
527,0a0dddc261903b70354ac74372826b310e43111d,ws-sdk-cpp-automation <aws-sdk-cpp-automation@github.com>, 2020-02-04 20:14:09 +0000, , amazon vpc flow log add support minute aggregation interval feature ensures instance patched available patch particular date enabled selecting option auto approval rule creating patch baseline cutoff date auto approval released patch patch released date installed automatically release enables aws msk customer list apache kafka version supported aws msk cluster also includes change expose additional detail cluster state describecluster listclusters apis documentation update cloudfront release add support tagging amazon workmail organization adding kvm support hypervisor updated documentation report error code 400 429 reflect actual system behaviour,,
528,c10dfe22979aa7296fe0078457f9ebc77157c9e4,ushen Wang <wps132230@hotmail.com>, 2020-01-28 10:42:13 -0800, , make retry able whitelist throttled,,
529,d1c47d1847cc13cbe8e2606ca9b5c5404fc1a6f5,ilberto Lopez Zayas <vuner.lopez@gmail.com>, 2020-01-27 13:43:06 -0700, , httpclienttest changed test catch edge case 618 changed test catch edge case added issue number comment,,
530,ad600ae26aa9a9b3b9f66a6fbc8d55a11fa98864,ws-sdk-cpp-automation <aws-sdk-cpp-automation@github.com>, 2020-01-24 20:12:48 +0000, , adding new error code nodegroups eks aws opsworks chef automate support place upgrade chef automate eligible server updated management console cli apis aws datasync support fsx window file server location release provides support tagging amazon task set service using external deployment controller documentation update workspace,,
531,3bc8f9b43aa575d16634139f07941c0290d6b177,ws-sdk-cpp-automation <aws-sdk-cpp-automation@github.com>, 2020-01-23 20:21:29 +0000, , sdk release introduces apis automate export amazon rds snapshot data amazon new apis include startexporttask apis automate extraction data rds snapshot export amazon bucket data stored compressed consistent query able format data exported query directly using tool amazon athena redshift spectrum also consume data part data lake solution archive data infrequent access glacier reduce long term data storage cost applying data lifecycle policy release enables identity access management policy simulator simulate permission boundary policy,,
532,ce8d9b928ee3dffa8b2a2c6246a40e5cf760c670,ws-sdk-cpp-automation <aws-sdk-cpp-automation@github.com>, 2020-01-21 20:19:59 +0000, , documentation update iotcolumbo aws codepipeline enables ability stop pipeline execution remove deprecated data set change data set available date 2017 documentation update aws application discovery service add enum value result support cidrs publicly advertisable,,
533,c1981bd7bc21cdab124d072e9cdd08673b70d83f,ws-sdk-cpp-automation <aws-sdk-cpp-automation@github.com>, 2020-01-20 23:22:37 +0000, , add support createdtime response searchdevices api operation provides new error code user_logged_in user_not_found customer better troubleshoot connect custom key store operation fails password length validation also occurs client side release provides support preview bringing ipv6 address byoip ipv6 use aws updating api return anomalydetector status value response added reason code statereasoncode invalidsubnet invalidsubnet function connect vpc release add support list api retrieve configuration event logged periodic update application amazon cloudwatch application insight,,
534,24deb4bc44d05c890712f8cd2e5b24eb379f3ecd,ws-sdk-cpp-automation <aws-sdk-cpp-automation@github.com>, 2020-01-17 20:13:58 +0000, , release provides public preview specifying amazon efs file system volume amazon task definition release introduces resource level tag based access control aws cloudhsm resource tag cloudhsm backup tag cloudhsm cluster creation tag backup copy another region documentation update redshift release includes deletion protection amazon neptune database aws elemental mediaconvert sdk added support mp3 audio output release ensures inactive job definition permanently deleted 180 day,,
535,b7b820def7cf61041585326da3eb159fc1a25cd7,ws-sdk-cpp-automation <aws-sdk-cpp-automation@github.com>, 2020-01-16 22:16:01 +0000, , client vpn support port configuration vpn endpoint allowing usage either port 443 port 1194 reduce number error customer facing modified requirement input parameter two directory service apis release add two new apis updateworkforce sagemaker ground truth service workforce whitelisting,,
536,4a26796efc5a964fbfcc9e65dafe9d2c25d061ff,ndrew Tang <tangandr@amazon.com>, 2020-01-15 12:54:34 -0800, , fix object versioning permission object version head object return null versionid following object access request set null value versionid otherwise permission iam role user request result 403 access denied error,,
537,378825e3d99ae60bf90108264d7f13b06de375d4,ws-sdk-cpp-automation <aws-sdk-cpp-automation@github.com>, 2020-01-15 20:18:39 +0000, , general update ec2 doc sdks updated description policyid parameter add support new security hub api operation used track manage whether compliance standard control enabled document update patch manager noreboot feature,,
538,d5119f05c32f8c75b3afe1af3a5ffbab14f25692,ws-sdk-cpp-automation <aws-sdk-cpp-automation@github.com>, 2020-01-14 20:18:26 +0000, , release add support partition placement group instance metadata option launch template,,
539,469b69b351a6668b6901df9e488833f49fac4883,ws-sdk-cpp-automation <aws-sdk-cpp-automation@github.com>, 2020-01-13 20:13:38 +0000, , cross region backup new aws backup feature allows enterprise copy backup across multiple aws service different region documentation update stopinstances api stop start amazon backed spot instance instead relying stop interruption behavior stop spot instance interrupted release add support managing efs file system policy efs access point,,
540,fd7726615606977bff2107312c8e2ca469fb95bc,ws-sdk-cpp-automation <aws-sdk-cpp-automation@github.com>, 2020-01-10 21:27:29 +0000, , release introduces new endpoint type allows attach elastic address aws account server endpoint directly whitelist access server client internet address using vpc security group sagemaker api filter trialname experimentname add shared profile support new existing user release add operation enables user override system default ssl certificate new amazon rds instance temporarily remove customer override added migrate feature amazon workspace release introduces ability tag egress internet gateway local gateway local gateway route table local gateway virtual interface local gateway virtual interface group local gateway route table vpc association local gateway route table virtual interface group association use tag organize identify resource cost allocation,,
541,492c8b24f96c745547487e8fcfc1a354c630d2f3,ndrew Tang <tangandr@amazon.com>, 2020-01-10 12:17:15 -0800, , specify find correctly installed sdk type,,
542,0e824023a0ccff5b13a43655a83cc837930377a2,ndrew Tang <tangandr@amazon.com>, 2020-01-10 11:07:23 -0800, , add cloud watch log integration test,,
543,4e3611508e61c4a8572548c65f57be191df82cf3,ws-sdk-cpp-automation <aws-sdk-cpp-automation@github.com>, 2020-01-09 20:49:08 +0000, , documentation update sts documentation update log,,
544,0f5574b3d7b26d4a6e6490dc111c7f4afe77128a,ws-sdk-cpp-automation <aws-sdk-cpp-automation@github.com>, 2020-01-08 21:01:49 +0000, , release add new family apis asynchronous batch translation service provides option translate large collection text html document stored amazon folder service accepts batch size per api call document exceeding size number document exceeding million per batch see documentation information documentation update api aws firewall manager support tagging tag based access control policy,,
545,0c56c5fda74dcc58f3f07dd6212aa7e2965b29ed,ws-sdk-cpp-automation <aws-sdk-cpp-automation@github.com>, 2020-01-07 22:25:04 +0000, , add encryption key override startbuild api aws codebuild documentation update xray api provides list application migration state,,
546,86380e1179e5f483ae0c1d812891f19e6382e128,ndrew Tang <tangandr@amazon.com>, 2020-01-07 13:08:39 -0800, , added http client test infrastructure added python script used start simple http server binding specified port localhost changed http response never nullptr added detailed http request error response object moved resolved address assigning buildawserror,,
547,ab2edd026a39de86b740d11d6f94ca3c57815686,ushen Wang <wps132230@hotmail.com>, 2020-01-07 11:25:32 -0800, , update node.js runtime 12.x lambda integration test node.js 8.10 came end life,,
548,6c19b062e01c442fb50707503b622dfdd93b5810,ushen Wang <wps132230@hotmail.com>, 2020-01-06 15:59:28 -0800, , add support aws partition aws iso aws iso,,
549,961df8d1332dab1975e3e170fd70fc4c259f53c5,ws-sdk-cpp-automation <aws-sdk-cpp-automation@github.com>, 2020-01-06 20:21:36 +0000, , release support service provider configuring private dns name service aws service service available aws marketplace feature allows consumer access service using existing dns name without making change application restrict direct access aws elemental mediapackage securing request live content using cdn authorization cdn authorization content request require specific http header authorization code amazon comprehend support multilabel document classification,,
550,3c7b3d984409cf72cb129e02caac97c2e49b6c7e,ushen Wang <wangpush@amazon.com>, 2020-01-02 11:56:28 -0800, , fix conflict max min function defined standard library max min macro defined windows.h adding parenthesis around,,
551,56175e7d33daf895af3fba2e671354dd6b4d7a57,rateek270 <josephite.prateek@gmail.com>, 2019-12-02 17:05:31 +0530, , added parenthesis around m_expiration definition static constexpr _rep max function chrono surrounded parenthesis instead calling max function chrono replaces max preprocessor present winmindef.h,,
552,64ea36e19dd01de8889c5a4f2576f678b0aec395,ws-sdk-cpp-automation <aws-sdk-cpp-automation@github.com>, 2020-01-02 20:11:34 +0000, , documentation update cost explorer api documentation update amazon lex release add support certificate authority certificate identifier managed database amazon lightsail add waiter,,
553,a093aeeed9f13cdac3607fbc11fcdf4d4e14632e,ndrew Tang <tangandr@amazon.com>, 2019-12-23 15:45:46 -0800, ," reduce response time user complaint requesttimeout long exponential backoff retry time retry scale factor make worst response time 36s 1,2,4,8,16 plus timeout ec2 team suggest reduce requesttimeout total request time",,
554,f4f6077e6fbad91cee677ac2c521252be744dfd9,ws-sdk-cpp-automation <aws-sdk-cpp-automation@github.com>, 2019-12-23 22:21:46 +0000, , updated documentation amazon detective release centrally aggregate aws health event account aws organization visit aws health documentation learn enabling using feature http health latest organizational view health.html release add new family apis create data repository task describe data repository task cancel data repository task allow user perform operation file system linked data repository,,
555,969dbca602988ebc709530de4f632b436021c3b2,ws-sdk-cpp-automation <aws-sdk-cpp-automation@github.com>, 2019-12-20 20:24:13 +0000, , release update attachment support include source automation document release amazon pinpoint api introduces versioning support message template amazon eks support restricting access api server public endpoint applying cidr block documentation update amazon redshift ra3 node type aws transcribe support vocabulary filtering allows customer input word service want see output transcript introduced browser testing support aws device farm release add operation enables user specify whether database restarted ssl certificate rotated customer use ssl use operation release introduces ability tag key pair placement group export task import image task import snapshot task export image task use tag organize identify resource cost allocation additional resource type fully supported aws security finding format asff resource include awskmskey awsiamrole awssqsqueue awssnstopic resource type includes accompanying resource detail object field security finding provider populate update made awsiamaccesskey resource detail object include information principal name learn visit documentation asff,,
556,1a02642c0bbc5dcf4510e3108363fb61ae17bdae,ws-sdk-cpp-automation <aws-sdk-cpp-automation@github.com>, 2019-12-19 20:13:16 +0000, , amazon transcribe support job queuing api copy snapshot across region using data lifecycle manager dlm enable policy along create also copy snapshot one aws region copy scheduled three region single policy retention period set region separately public beta bitbucket cloud support aws codepipeline integration aws codestar connection amazon gamelift support arns key gamelift resource tagging gamelift resource authorization management updated documentation articulates gamelift resource authorization strategy amazon lex support conversation log slot obfuscation release allows customer add tag automation execution enabling sort filter execution different way resource purpose owner environment updating field api ensure actual value returned correcting previous error model add context map get recommendation get personalized ranking request object provide contextual metadata inference time,,
