id,sha,author,date,issue,message,file,content
0,4936528ffff39b7514a49fa443d5c28d90cac3e7,ws-sdk-cpp-automation <aws-sdk-cpp-automation@github.com>, 2021-07-30 19:44:19 +0000, , aws appsync support new authorization mode allowing define authorization logic using aws lambda function add support kmskeyids api response api change respect lambda step model building pipeline add several waiter async sagemaker image apis add instance type appinstancetype field client port preservation alb attribute launch,,
1,73842700df087083c1d044838b9b46651b60dcae,ws-sdk-cpp-automation <aws-sdk-cpp-automation@github.com>, 2021-07-29 19:18:26 +0000, , increase maximum credential duration role alias hour add support live transcription meeting amazon transcribe amazon transcribe medical new apis control generation user attributed transcription sent meeting client via amazon chime sdk data message added support aws iot sitewise edge create aws iot sitewise gateway run aws iot greengrass gateway collect local server equipment data process data export selected data edge aws cloud release add support g4ad xlarge 2xlarge instance powered amd radeon pro v520 gpus amd 2nd generation epyc processor documentation update valid saving plan offering pattern,,
2,604b63d35518da3eb1a8ed8a6bb606d8f5ad6ad7,ws-sdk-cpp-automation <aws-sdk-cpp-automation@github.com>, 2021-07-28 19:16:35 +0000, , sdk update support importing existing stack new existing self managed stackset stack import feature documentation update arn aws trebuchet service 03a2216d 1cda 4696 9ece 1387cb6f6952,,
3,4c2f99f24ae3f1e8918a5951edb0cc297167a1e3,ws-sdk-cpp-automation <aws-sdk-cpp-automation@github.com>, 2021-07-27 19:23:24 +0000, , add identifier allow customer query wirelessdevice response amazonid added case sidewalk device return add support listjob filter amazon route application recovery controller readiness check capability continually monitor resource quota capacity network routing policy ensure recovery environment scaled configured take needed add waiter automatically poll resource status asynchronous operation building bot added structure support new data api operation used execute multiple sql statement within single transaction amazon route application recovery controller routing control routing control configuration apis help create delete cluster control panel routing control safety rule state change routing control part configuration apis release add support health check type used conjunction route53 application recovery controller iot analytics support creating dataset resource iot sitewise data store enabling customer query industrial data within service release includes adding join functionality customer query multiple data source dataset amazon route application recovery controller routing control routing control data plane apis help update state routing control reroute traffic across application replica 100 available manner change name ddos response team drt shield response team srt add support use row level security tag embedding dashboard user provisioned quicksight,,
4,ca358f0fa1d498e46cfe1bf5a4e9790baf3c05cb,ilberto Lopez Zayas <vuner.lopez@gmail.com>, 2021-07-27 10:38:55 -0700, , grrt patch 807 core retry strategy fix bitshift overflow wrap around authored gerrit renker grenker aurora.tech,,
5,3240818f9d5b12c43e27692f42a2ed1e50ec6445,ws-sdk-cpp-automation <aws-sdk-cpp-automation@github.com>, 2021-07-26 19:23:22 +0000, , documentation update link sdk update support creation cross account metric alarm update api documentation access point alias used anywhere use bucket name access data add support analyzeexpense new api extract relevant data contact information item purchased vendor name almost invoice receipt without need template configuration cloudwatch synthetic support visual testing canary documentation update sso api ref,,
6,f27179d5c02b06567ee90558c40859db78947e9e,ushen Wang <wangpush@amazon.com>, 2021-07-15 22:20:02 +0000, , initialize union type class member aws utils event fix gcc warning,,
7,8d3d62bdf1d8954212c01195a432993f4090cdea,ushen Wang <wangpush@amazon.com>, 2021-07-15 22:17:22 +0000, , replace strncpy memcpy cjson fix gcc warning,,
8,1befb4fdfcc25bec5d4537bd8799bbcfc9b24c78,ws-sdk-cpp-automation <aws-sdk-cpp-automation@github.com>, 2021-07-23 19:28:27 +0000, , add premise access type support endpoint update documentation reapply missing change ssm uninstall switch default value improve description added product name company name region field security finding added detail object rds event subscription aws service added field detail aws elasticsearch domain,,
9,189b51701a18f42a1c1dac5eca4893fa0a14c813,ws-sdk-cpp-automation <aws-sdk-cpp-automation@github.com>, 2021-07-22 19:29:30 +0000, , sdk release add two new feature output native jdbc destination adding configuration profile job amazon qldb support ledger encrypted customer managed key change createledger updateledger describeledger apis support change release allows customer assign prefix elastic network interface reserve block subnet cidrs reserved block used assign prefix elastic network interface excluded auto assignment documentation update amazon control medialive support passing style data webvtt caption output add support enabling protocol version cipher suite header sent backend target application load balancer,,
10,b190e48247e1050fbd1259f1b3e677a46e93cf98,ws-sdk-cpp-automation <aws-sdk-cpp-automation@github.com>, 2021-07-21 19:16:45 +0000, , documentation update aws identity access management iam new error code operation emr support new apis provide amazon emr release label detail list available release application specific amazon emr release label aws codebuild allows set access permission build artifact project artifact log file uploaded amazon bucket owned another account documentation update aws proton amazon kendra provides data source connector amazon workdocs information see http kendra latest data source workdocs.html add support enabling protocol version cipher suite header sent backend target application load balancer aws service placeholder making optional parameter creating campaign provided default add field dbsnapshot response object field timestamps underlying data snapshot change snapshot copied,,
11,a88c6f78a6fd1d9621cb34a3c574a1cbb9dfdef2,ws-sdk-cpp-automation <aws-sdk-cpp-automation@github.com>, 2021-07-20 19:17:18 +0000, , added idempotency createvolume api using clienttoken request parameter documentation update compute optimizer,,
12,b0bfbc1ae729ffe6218aabd1a4b0506ca33dc0e8,en Hannel <ben@bensprojects.com>, 2021-03-30 12:20:16 -0700, , use new instance usage invocation uuid randomuuid use random number generator static storage duration http github.com aws aws sdk cpp blob aws cpp sdk core source utils crypto factory factories.cpp l88 however random number generator thread safe http github.com aws aws sdk cpp blob aws cpp sdk core include aws core utils crypto securerandom.h l15 l18 creates race condition,,
13,87796c7f58f0000c57ca728cc63fa1b77d7805af,ushen Wang <wps132230@hotmail.com>, 2021-07-19 15:36:31 -0700, , handle implicit event payload event streaming operation,,
14,81bc31b9997da389d90258210ce21324962be25d,ws-sdk-cpp-automation <aws-sdk-cpp-automation@github.com>, 2021-07-19 19:43:15 +0000, , documentation update directconnect add five new api operation updatemap updatetracker updated return failurereason statedetails api response documentation update reversal default value additional instance configuration ssm switch plus improved description semantic versioning health api maximum number entity eventfilter entityfilter data type changed 100 99. change related internal optimization aws health service release allows customer create new version worldtemplates support door,,
15,f86c882cbd57eb525fe4ab77aea80a870c0563e0,ws-sdk-cpp-automation <aws-sdk-cpp-automation@github.com>, 2021-07-16 19:13:33 +0000, , documentation update appintegrations service sdk release add account status one attribute account api response release relaxes url character restriction aws audit manager regex pattern updated following attribute s3relativepath destination s3resourcepath aws term also replaced entity align china rebrand documentation effort,,
16,125d652178717231c97757aecef6dbd50a47ccc3,ws-sdk-cpp-automation <aws-sdk-cpp-automation@github.com>, 2021-07-15 19:17:02 +0000, , documentation update support awsvpc mode window update default endpoint apis used manage asset model asset gateway tag account configuration firewall strict egress rule configure rule grant access api.iotsitewise region .amazonaws.com api.iotsitewise region documentation update cognito idp feature enables customer specify weekly recurring time window scheduled event reboot stop terminate ec2 instance lex support locale,,
17,664730fb5025e9632892436e3883c4a3c1bf3784,ws-sdk-cpp-automation <aws-sdk-cpp-automation@github.com>, 2021-07-14 19:17:06 +0000, , update provides support well architected api user mark answer choice applicable release add support amazon lightsail object storage service allows create bucket store object general availability amazon healthlake apis require aws parameter information see amazon healthlake documentation http healthlake index.html release feature needed eca endpoint setting allows customer delete field endpoint setting using exact setting flag modify endpoint api also display default value certain required field endpoint setting describe endpoint setting api added support rsa 3072 ssl certificate import add support event driven workflow,,
18,6af954a8dbcea742c87bf7cb96ce9b160626344b,ilberto Lopez Zayas <vuner.lopez@gmail.com>, 2021-07-13 13:58:51 -0700, , debian dock update 801 update opendjk default jdk debian authored alan yee alanyee,,
19,6e32f2da5b25a599da0d024b7939d559f757f50b,ws-sdk-cpp-automation <aws-sdk-cpp-automation@github.com>, 2021-07-13 19:16:02 +0000, , customer migrate bot built lex apis apis release add apis initiate manage migration bot change opscenter apis support new feature operational insight added sign apple oauth provider release add new filed named display aws direct connect endpoint terminates physical connection bgp session add paginator documentation update api.pricing release new apis support new redshift feature authentication profile,,
20,4a5f814e648262bb67e2fb8c30519101bc06ceae,ws-sdk-cpp-automation <aws-sdk-cpp-automation@github.com>, 2021-07-12 19:20:00 +0000, , amazon kendra support principal store documentation update wesley support parallel node upgrade feature,,
21,9f83105f7e07fe04380232981ab073c247d6fc85,ws-sdk-cpp-automation <aws-sdk-cpp-automation@github.com>, 2021-07-09 20:28:20 +0000, , release add support explainability display model variable importance value amazon fraud detector releasing new apis related tuning step model building pipeline mediaconvert support color style position information passthrough 608 teletext srt webvtt subtitle mediaconvert also support automatic qvbr quality level qvbr ratecontrolmode,,
22,742b371628f59eca3ace209098f43c75473c63f7,amian Vicino <vicinod@amazon.com>, 2021-06-15 16:19:46 -0400, , enabling override endpoint used connect ec2 metadata service,,
23,86829d6e19769732f6e0c336afd0b7829b57f0c7,amian Vicino <vicinod@amazon.com>, 2021-06-16 14:14:21 -0400, , removing curl error code check test curl test noproxy sensitive environment test run producing different error code still valid result test constraint test relaxed avoid false positive,,
24,47c8a261006bbfe30f65b814a38578e810eed927,ilberto Lopez Zayas <vuner.lopez@gmail.com>, 2021-07-08 14:26:42 -0700, , update,,
25,bbbb4fd446a69f2c74ff01178aaea1d750d16df7,ws-sdk-cpp-automation <aws-sdk-cpp-automation@github.com>, 2021-07-08 19:35:22 +0000, , add listalerts channel program source location vod source return alert resource added waiter eks fargateprofiles updated description contactid added property filter listoutposts aws firewall manager support route table monitoring provides remediation action recommendation security administrator aws network firewall policy misconfigured route add field include open close time anomaly,,
26,d43eee0fac977f36e9271f14dd99b8278e96e01c,ws-sdk-cpp-automation <aws-sdk-cpp-automation@github.com>, 2021-07-07 19:19:27 +0000, , release add resource tagging support vpc security group rule documentation update aws identity access management iam release add storage configuration apis aws iot sitewise releasing new apis aws chime adding support oplocks smb file share access point private link file share address support file system association documentation update aws security token service add support modifying maintenance window broker amazon cloudfront provides two new apis associatealias help locate move alternate domain name cnames encounter error code,,
27,c2b367ceddb52e31dcbc0c52486da55678dcbf4f,ws-sdk-cpp-automation <aws-sdk-cpp-automation@github.com>, 2021-07-06 19:19:12 +0000, , documentation update amazon bug fix remove supported encryption type none added support event source added support virtual_host stream event source mapping adding new error code addons eks sensitive data finding amazon macie include enhanced location data json json line file add support specifying parameter customize component recipe expands configuration amazon ec2 instance used building testing image including ability specify command run launch control installation removal ssm agent,,
28,6601814317fecfa588093a81866c4f52d16deb97,ws-sdk-cpp-automation <aws-sdk-cpp-automation@github.com>, 2021-07-02 19:16:46 +0000, , documentation update release remove network insight boundary,,
29,1c8489ec6f5aa3f39e5aa838bbb6a761cf494a07,ws-sdk-cpp-automation <aws-sdk-cpp-automation@github.com>, 2021-07-01 19:19:33 +0000, , documentation update amazon sqs adding new reserved field support future infrastructure improvement amazon ec2 fleet sagemaker model registry support container associated environment variable,,
30,78ef64daf78e1c6bc95b1545ee91fbf4659d6536,ws-sdk-cpp-automation <aws-sdk-cpp-automation@github.com>, 2021-06-30 19:18:17 +0000, ," add support output job result aws glue data catalog add support widevine drm cmaf packaging configuration widevine fairplay drms used simultaneously cbc encryption fix tag key length range 128 char tag value length 256 char add support utf char contact channel name allows user unset name updatecontact api add throttling exception stopengagement api validation exception apis untagresource amazon kendra enterprise edition offered smaller granular unit enable customer smaller workload virtual storage capacity unit offer scaling increment 100,000 document 30gb per unit virtual query unit offer scaling increment 8,000 query per day aws cloud map allows configuring ttl soa record hosted zone control negative caching new service amazon ec2 auto scaling infrastructure improvement optimization",,
31,6dd8d33150346caa458407fca9d67139e11db0f3,ushen Wang <wps132230@hotmail.com>, 2021-06-29 10:45:31 -0700, , handle trailing slash uri path,,
32,a835ea4e96cbee2d17a9033c7b24b353a3a58bb2,ushen Wang <wps132230@hotmail.com>, 2021-06-28 18:17:44 -0700, , update code generation undef symbol predefined window,,
33,0841e5dc141b44b72e8c502231cecec99aa4df10,ws-sdk-cpp-automation <aws-sdk-cpp-automation@github.com>, 2021-06-28 19:15:56 +0000, , added disablelogging api thrown calling api non available cluster mediaconvert add support hdr10 prores 4444 xavc output adm damf support dolby atmos ingest alternative audio webvtt caption ingest via input mediaconvert also support creating trickplay output roku device cmaf dash output group sagemaker neo support running compilation job using customer amazon vpc add json support glue schema registry,,
34,cb20d204a91b3b6c649c5e83a7e24d8aec99022d,ushen Wang <wangpush@amazon.com>, 2021-06-27 21:59:49 +0000, , update submodule upgrade cjson v1.7.7 v1.7.14 aws crt cpp,,
35,b7ad1b3e405ec730f1247f049bd700e7a3666622,ushen Wang <wangpush@amazon.com>, 2021-06-24 22:14:05 +0000, , add cjson customization back based v1.7.14 define based sdk configuration comment cjson boolean type definition add public function support bit integer replace strcpy strncpy,,
36,6d4d5cc4792f46cc69f32f24d02ed2a10cec131c,ushen Wang <wangpush@amazon.com>, 2021-06-24 20:27:57 +0000, , upgrade cjson v1.7.7 v1.7.14,,
37,3263bc5366591ebd2e4ccfcb6b9b3d1bffdf3660,ws-sdk-cpp-automation <aws-sdk-cpp-automation@github.com>, 2021-06-25 19:23:46 +0000, , aws snow family customer remotely monitor operate connected aws snowcone device aws snowball edge storage optimized customer import export data using nfs added waiter template registration service operation environment deployment import existing backend authentication resource,,
38,5ca9d126162d7563e168fd49c131a614438c3ebd,ws-sdk-cpp-automation <aws-sdk-cpp-automation@github.com>, 2021-06-24 19:28:50 +0000, , customer successfully use legacy client transfer family endpoint enabled ftp ftp behind router firewall load balancer providing custom address used data channel communication added support new text transformation amazon kendra support sharepoint 2013 sharepoint 2016 using sharepoint data source released amazon connect quick connects management api general availability information see http connect latest apireference welcome.html currently supported add field mediaplacement add support encryption transit dax cluster minor update aws cloud9 documentation allow correct parsing outputted text added new resource detail cluster task definition added additional information bucket elasticsearch domain api gateway stage,,
39,e78a5f730664abe728a5dbdded0efde42cf79726,ws-sdk-cpp-automation <aws-sdk-cpp-automation@github.com>, 2021-06-23 19:22:49 +0000, , update return information break add support based full repository analysis changed line scan added following parameter target propagatetags referenceid tag aws license manager allows license administrator end user communicate setting custom status reason updating status granted license release replaces previous generation cloudsearch instance equivalent new instance provide better stability price updated documentation explain amazon linux ami ended standard support december 2020 recommend choose amazon linux includes long term support 2023 new aws cloud9 environment documentdb documentation edits amazon cloudfront add support new security policy tlsv1.2_2021 releasing new apis aws quicksight folder added following parameter target propagatetags referenceid tag release add support provisioning byoip range multiple region feature limited preview release contact account manager interested feature,,
40,bf51a4b615b16867d9cb064f90a8d60333056251,ilberto Lopez Zayas <vuner.lopez@gmail.com>, 2021-06-21 17:10:34 -0700, , empty line end file compile without wnewline eof 793 authored vladimir chebotarev gmail.com,,
41,fd07e8787584400b66e5a9df4eed5d0181aaeadf,ws-sdk-cpp-automation <aws-sdk-cpp-automation@github.com>, 2021-06-21 19:58:21 +0000, , cloudformation registry service support 3rd party public type sharing,,
42,3e63d19b96da63ae0fe3abdff5292cd9e1c70a9b,ws-sdk-cpp-automation <aws-sdk-cpp-automation@github.com>, 2021-06-17 19:29:29 +0000, , release enables database activity stream rds oracle enable ml.g4dn instance type sagemaker batch transform sagemaker processing release add new api update progress call amazon kendra support indexing web document search web crawler,,
43,c65e5ee90d8478bbfbf0a7837552cf68da314704,ws-sdk-cpp-automation <aws-sdk-cpp-automation@github.com>, 2021-06-16 19:29:52 +0000, , release add support vlan tagged network traffic elastic network interface eni feature limited preview release contact account manager interested feature release enables fast cloning aurora serverless clone aurora serverless cluster aurora provisioned cluster add aws secret manager access token authentication source location add support multi region key,,
44,39100e5500c245ca876b0a38d7082b7c0d18ae54,ws-sdk-cpp-automation <aws-sdk-cpp-automation@github.com>, 2021-06-15 19:20:27 +0000, , ec2 m5n m5dn r5n r5dn metal instance 100 gbps network performance elastic fabric adapter efa ultra low latency release add new set apis associatebot disassociatebot listbots use add amazon lex bot amazon lex bot specified amazon connect instance release add support multi valued slot amazon lex apis model building redshift data api service support sql release add support multi valued slot amazon lex apis runtime,,
45,af3c485ec8ada8b1b2864820ffaf63f1a4a5120f,ws-sdk-cpp-automation <aws-sdk-cpp-automation@github.com>, 2021-06-14 19:21:30 +0000, , added learning status anomaly detector updated description offset parameter metricset apis add support data store partition verified apis released ready release,,
46,b733384b16945818fa5da5b73e410dea1e9ab9d0,ws-sdk-cpp-automation <aws-sdk-cpp-automation@github.com>, 2021-06-11 19:42:08 +0000, , enable source failover designate one two source primary source choose two failover mode prevent disruption video stream merge combine source single stream failover allows switching primary backup stream amazon ec2 add new ami property flag outdated amis aws medialive support ocr based conversion dvb sub scte image based source caption webvtt support ingest avail decoration input manifest,,
47,ff40a4dcd0c043898d48a075e834c47c03911b3c,ws-sdk-cpp-automation <aws-sdk-cpp-automation@github.com>, 2021-06-10 19:23:36 +0000, , amazon cognito support targeted sign refresh token revocation adding map_all task type support release batchgetrecord api aws sagemaker feature store runtime sdk release add support updateaccount api allow user update default license chime account added api thrown calling api non available cluster release support customer managed customer master key cmks member specific hyperledger fabric resource using sagemaker edge manager aws iot greengrass simplifies accessing maintaining deploying model device create deployable iot greengrass component edge packaging job choose create device fleet without creating aws iot role alias appmesh support additional routing capability match rewrite gateway route route additionally app mesh also support specifying dns response type virtual node aws resource access manager ram releasing new field listpermissions getpermission response adding permissionarn parameter request filter permission attached release add new optional parameter public private api private natgateway doe require customer attach internetgateway vpc used communication vpcs premise network,,
48,02fd28c93f4489d8d2aae9469eb4e9c250ff8213,ilberto Lopez Zayas <vuner.lopez@gmail.com>, 2021-06-09 13:08:22 -0700, , crosscompile compilable 737 force run test crosscompiling authored diego nieto diego.nieto.m outlook.com,,
49,c1cca58b60981c1d79f2260379d63c2964c6c7ee,ws-sdk-cpp-automation <aws-sdk-cpp-automation@github.com>, 2021-06-09 19:38:22 +0000, , support unstructured text input item dataset automatically extract key information product content description input creating solution version documentation update aws transfer family service initial sdk release aws proton aws kendra support checking document status,,
50,5d152c8b79c64f909099837a2b265560bcc20601,ushen Wang <wps132230@hotmail.com>, 2021-06-09 10:52:13 -0700, , add customization wellarchitected use content type application json instead content type application amz json 1.1 request header,,
51,c90c529d0aed7c2a37aaf8679cf1b11c93b1f71e,ws-sdk-cpp-automation <aws-sdk-cpp-automation@github.com>, 2021-06-08 19:43:50 +0000, , release amazon macie api introduces stricter validation object criterion classification job release add support auditing end user access file folder file share using window event log enabling customer meet security compliance need increase max pagesize list search apis documentation update cognito idp,,
52,de387275f5982501d6b578c7ddefed5d9131512c,ushen Wang <wps132230@hotmail.com>, 2021-06-08 10:52:23 -0700, , fix libcrypto found issue cmake 3.16 find_path would remove local variable etc. make cmake able find libcrypto see cmake policy cmp0102 detail fix set variable cache also add dockerfile ubuntu 20.04,,
53,54fb3b0cbc4eea8c0bafed2345beaa723d28fd44,amian Vicino <vicinod@amazon.com>, 2021-06-02 16:54:35 -0400, , adding script pull crt dependency curl crt defined source dependency sdk declaring submodule git user download code zip file github curl command line environment without git project build without manually downloading dependency crt added script root work downloading dependency using curl version downloaded currently hardcoded need add generate dependency manifest automate since github zipped downloads include .git knowledge version dependency download available,,
54,ae064b4c24fc3a8c930518f705f4a0745ea2faec,ilberto Lopez Zayas <vuner.lopez@gmail.com>, 2021-06-07 14:06:28 -0700, , docker fedora 739 fedora dockerfile,,
55,065ebee98ad5bd6bba49749368adc5fb27b6d5d7,ws-sdk-cpp-automation <aws-sdk-cpp-automation@github.com>, 2021-06-07 19:37:57 +0000, , update regex validation kmskeyarn path api parameter aws personalize apis added updateconfig option allows customer control upgrade velocity managed node group add samplesize variable s3target enable sampling feature api aws sagemaker releasing new apis related callback step model building pipeline add experiment integration model building pipeline,,
56,7f2e463f65fec21fee3da77c501b912adc77426a,ushen Wang <wangpush@amazon.com>, 2021-06-04 20:47:08 +0000, , turn use_openssl cmake default,,
57,1882b90714d8488a79107fc9816cfc26a21137d7,ushen Wang <wps132230@hotmail.com>, 2021-06-02 10:27:26 -0700, , crt client support getobject range,,
58,212bc2e2e789f8239bd3f81b0ba3ec73d0ad8593,ushen Wang <wangpush@amazon.com>, 2021-06-01 07:01:06 +0000, , aws integration use libcrypto libssl aws http github.com awslabs aws default except android add option use_openssl switch back openssl auto resolve crt dependency,,
