id,sha,author,date,issue,message,file,content
994,b730327ec3b2b1072ef13b1e0b76c2413959e407,ndrew Tang <tangliang551@gmail.com>, 2018-11-17 14:43:00 -0800, , add rds data code generator correctly generate source code,,
995,ae2c3d07501d2fe81b4c9bce3111d452c4c83cf3,ws-sdk-cpp-automation <aws-sdk-cpp-automation@github.com>, 2018-11-16 22:35:01 +0000, , amazon comprehend custom entity automatically train entity recognition model using entity noun based phrase release amazon elastic container service amazon introduces support additional docker flag task definition parameter customer configure task use pidmode pid ipcmode ipc docker flag release introduces new operation called getcostforecast operation allows access aws cost explorer forecasting engine generally available added new bring license byol automation apis new apis list available management cidr range dedicated tenancy enable account byol describe byol status account import byol image added new apis also describe delete workspace image aws system manager automation allows execute manage automation workflow across multiple account region,,
996,ffd81252bec92f3e0587e144b07c05f8aed28eb1,arco Magdy <mmagdy@gmail.com>, 2018-11-15 16:39:29 -0800, , add support select api release add support via select streaming api api implemented c99 via library developed aws well library downloaded built part cmake configure step disabled via new switch dbuild_deps switch set default,,
997,59337ec3dd6a998bddb41e4bad39e783cad34b6b,ws-sdk-cpp-automation <aws-sdk-cpp-automation@github.com>, 2018-11-16 00:03:36 +0000, , adding queue phase configurable queue timeout codebuild release enables directconnect customer logical redundancy virtual interface within supported directconnect location amazon pinpoint voice use text speech technology deliver personalized voice message customer amazon pinpoint voice way deliver transactional message one time password appointment confirmation customer release redshift providing api better snapshot management supporting user defined automated snapshot schedule retention period manual snapshot aggregate snapshot action including batch deleting user snapshot viewing account level snapshot storage metric better filtering sorting describe cluster snapshot api automated snapshot scheduled taken custom interval schedule created reused across cluster manual snapshot retention period set cluster snapshot cross region copy level retention period set manual snapshot indicates many day snapshot retained automatically deleted introduces instance automated backup mysql mariadb postgresql oracle microsoft sql server database engine retain amazon rds automated backup system snapshot transaction log delete database instance allows restore deleted database instance specified point time within backup retention period even deleted protecting accidental deletion data information see amazon rds documentation release amazon introduces multiple feature first support integration system manager parameter store injecting runtime secret second introduces support resource tagging finally introduces new arn format resource provides new apis opt new format add support new block public access bucket level apis new block public access setting allow bucket owner prevent public access data via bucket object acls bucket policy amazon comprehend custom classification automatically train classification model using text custom label add support new block public access account level apis block public access setting allow account owner prevent public access data via bucket object acls bucket policy setting structure added endpoint apis support kinesis elasticsearch target introducing ability configure custom dns name server replication instance beta feature release amazon transcribe publicly support transcription audio source british english australian english canadian french amazon transcribe also support following language private beta germany german brazil portuguese france french making easier manage aws identity access management iam resource enabling add tag iam principal user role adding tag iam principal enable write fewer policy permission management make policy easier comprehend additionally tag also make easier grant access aws resource initial release aws resource access manager ram provides ability share resource across aws account within aws organization create resource centrally use aws ram share resource account eliminating need provision manage resource every account share resource another account account granted access policy permission account apply shared resource first release amazon route resolver api customer ability create manage amazon route resolver endpoint amazon route resolver rule amazon pinpoint voice use text speech technology deliver personalized voice message customer amazon pinpoint voice great way deliver transactional message one time password identity confirmation customer adding support campaign event trigger campaign event trigger schedule campaign execute based incoming event data target source event,,
998,ff4ca8c86b83f521684eb3bf5b23781c223c1b25,ushen Wang <wangpush@amazon.com>, 2018-11-14 18:23:14 -0800, , add control customizaiton control apis append account endpoint making request service s3v4 uri double encoded,,
999,f42c6393d77a8d7ce98948112e8e341beae00d25,ws-sdk-cpp-automation <aws-sdk-cpp-automation@github.com>, 2018-11-15 00:19:24 +0000, , add support cloudformation stacksets service catalog aws resource group service added support aws cloudformation stack based group ec2 auto scaling allows user provision automatically scale instance across purchase option spot demand instance type single auto scaling group asg sagemaker make final set metric published training job available result automatic model tuning support warm start hyperparameter tuning job notebook instance support larger number instance type include instance ml.t3 ml.m5 ml.c4 ml.c5 family added optional request parameter named attribute amazon createtopic api action information see amazon api reference http latest api aws elemental mediatailor sdk return manifest endpoint prefix client initiate dash playback session amazon ec2 fleet support new request type instant use provision capacity synchronously across instance type purchase model createfleet return instance launched api response,,
1000,c210e2f6486d8b4306cd06abf3d9eea662bee94a,arco Magdy <mmagdy@gmail.com>, 2018-11-14 14:05:29 -0800, , ensure input isspace within right limit microsoft crt asserts value outside ascii character range,,
1001,ae61571628e4ddbad12cefb85e36afa055bb8e3d,ws-sdk-cpp-automation <aws-sdk-cpp-automation@github.com>, 2018-11-13 22:32:29 +0000, , release add support listusers api filter list email address doc update available monthly budget maximal history data point added amazon elasticsearch costfilters support amazon redshift provides option defer non mandatory maintenance update later date,,
1002,6cebbfaadbc404adc1ee3ee336f1d076bd3e0cd9,ws-sdk-cpp-automation <aws-sdk-cpp-automation@github.com>, 2018-11-12 23:46:35 +0000, , added budget performance history enabling see well budget matched actual cost usage added budget performance history notification state last updated time enabling see well budget matched actual cost usage often budget alert triggered budget last updated api update rds update enables custom endpoint new feature compatible aurora mysql aurora postgresql neptune allows user configure customizable endpoint provide access instance cluster adding ec2 launch template support aws batch compute environment amazon polly add new female voice italian bianca castilian spanish lucia new language mexican spanish new female voice mia drift detection feature enables customer detect whether stack actual configuration differs drifted expected configuration defined within aws cloudformation add support cross region pipeline accompanying definition needed aws codepipeline api guide release amazon kinesis data firehose allows enable disable server side encryption sse delivery stream ensuring encryption data rest technical documentation look http firehose latest dev encryption.html,,
1003,58ae61b268656507a74c4a99f56eaa9575e4d275,ws-sdk-cpp-automation <aws-sdk-cpp-automation@github.com>, 2018-11-09 22:36:34 +0000, , part speke drm encryption mediapackage support encrypted content key enable enhanced content protection originendpoint encryption setting enabled mediapackage indicates key server requires encrypted response use drm key provider must support content key encryption detail feature see aws mediapackage user guide http mediapackage latest is.html,,
1004,0f3619a9628613078653e2dcc4a753a5a6ed4f80,arco Magdy <magmarco@amazon.com>, 2018-11-08 23:15:30 +0000, , documentation update event amazon data lifecycle manager add support copying volume tag snapshot aws resource tag allow customer add metadata apply access policy amazon elastic block store amazon resource starting today customer use amazon data lifecycle manager dlm copy tag volume snapshot allows customer easily set snapshot metadata access policy match parent volume customer enable functionality new existing lifecycle policy also choose disable future date switch live channel preconfigured input mean assigned input running channel changed according defined schedule also use mp4 file input,,
1005,4dc43f9c3e931f3318835b36f0b0c3cb00f651e5,arco Magdy <mmagdy@gmail.com>, 2018-11-06 15:27:23 -0800, , use cryptobuffer generating code sensitive field,,
1006,09c22a57f0489c8b50ce0dd6937c5ce7f724a091,arco Magdy <magmarco@amazon.com>, 2018-11-07 22:08:27 +0000, , import export support generating encrypted snapshot well amis backed encrypted snapshot import process enable payer account view linked account recommendation payer account specify linked scope request response new filed called accountid indicating account recommendation detail belongs update waiter,,
1007,54e54a39b225ba0981447776d0f818456b2c0e55,arco Magdy <magmarco@amazon.com>, 2018-11-06 23:32:25 +0000, , documentation update codebuild launch new amazon ec2 memory optimized r5a general purpose m5a instance family feature amd epyc processor use aws waf configure protection amazon api gateway apis enable block count undesired traffic apis based different aws waf rule condition create information aws waf see aws waf developer guide update add ability send transactional email using sendmessage api transactional email email send directly specific email address unlike campaign based email send amazon pinpoint create segment campaign order send transactional email aws waf integration apigw change adding webaclarn part stage output user call get stage get stage webaclarn also returned part output first release amazon pinpoint email api use api configure send transactional email amazon pinpoint account specific email address unlike campaign based email send amazon pinpoint create segment campaign order send transactional email,,
1008,380c68eff3b35b7ea7aa236f6938ac5d16083c74,arco Magdy <mmagdy@gmail.com>, 2018-11-06 14:34:12 -0800, , add domain reserved keyword domain defined math.h break enums contain symbol domain therefore treat keyword though,,
1009,bf2f45b9174149ebe9c09487704bc377a689a8f4,ushen Wang <wangpush@amazon.com>, 2018-11-02 14:55:18 -0700, , wait identity pool active cognito identity integration test,,
1010,5eef9454a4048258b68de0402d6e02a20c91942f,arco Magdy <magmarco@amazon.com>, 2018-11-05 23:47:26 +0000, , new aws serverless application repository apis support creating reading broader set aws cloudformation template well enhancement existing apis add waiter clusteractive clusterdeleted,,
1011,0f563dee71bd5fdb52f153b0d0fc2096bc7d25d4,arco Magdy <magmarco@amazon.com>, 2018-11-02 21:11:30 +0000, , release update detectlabels operation bounding box returned certain object hierarchical taxonomy available label get version detection model used detection api support bool parameter set true return parentlinks list instead parent map batchread api support operation,,
1012,e47ee0410a3706c8abff767a7d8f78b155d9f9f0,arco Magdy <magmarco@amazon.com>, 2018-11-01 23:05:20 +0000, , service catalog integration aws organization enables customer easily create manage portfolio service across organization administrator take advantage aws account structure account grouping configured aws organization share service catalog portfolio increasing agility reducing risk integration admin user leverage trust relationship exists within account organization share portfolio entire organization specific organizational unit specific account,,
1013,ffa5dbabf60353643b676e20f253bc173dabd932,arco Magdy <magmarco@amazon.com>, 2018-10-31 22:11:28 +0000, , documentation update aws secret manager release aws config updated resourcetype value updated list includes aws system manager patchcompliance aws shield regional protection aws config aws codepipeline pipeline object size limit increased 10mb 25mb content type permissive greengrass apis support bulk deployment operation apis list definition version support pagination,,
1014,bf0993df1616ea131c5cd0fea7f7829c0d70d2fa,arco Magdy <magmarco@amazon.com>, 2018-10-30 21:29:31 +0000, , add waiter endpointdeleted release add listener connection endpoint sql server always list field returned performing describe instance operation initial release amazon chime aws sdk release amazon chime add support administrative action user account api documentation also updated http chime index.html,,
1015,da67201e5c6c35d13462ac5e6316e117ccd7104c,arco Magdy <magmarco@amazon.com>, 2018-10-26 20:44:32 +0000, , sagemaker notebook instance volume size configured compliance severity feature release state manager user ability select compliance severity association state manager console cli documentation update aws alexa business,,
1016,59cee69359470d77db39f6491a57459342862777,arco Magdy <magmarco@amazon.com>, 2018-10-25 19:12:35 +0000, , part release introducing ec2 demand capacity reservation demand capacity reservation customer reserve exact ec2 capacity need keep long need,,
1017,798c9fc01615357ca32e92c98eb2e7cdadfe7544,arco Magdy <magmarco@amazon.com>, 2018-10-24 19:57:22 +0000, , extended functionality alexa business sdk including additional support third party alexa built device managing private public skill conferencing setup release let create project source code toolchain definition provide,,
1018,e59beabe8bffd6f56cc8445b1c98c22efad36eee,ndrew Tang <tangliang551@gmail.com>, 2018-10-23 14:28:30 -0700, , fix serialized json http payload request structure member defined http payload area application protocol json 1.0 1.1 serialized http payload instead,,
1019,2ad0413fb4fe5a66a3924d4eac2682f6d716c2af,arco Magdy <magmarco@amazon.com>, 2018-10-23 21:12:26 +0000, , provides customer ability bring byoip prefix bring part public ipv4 address range premise network aws account continue address range aws advertises internet,,
1020,cfd986a232af349b28ed665201f4b7ba4a714e86,ushen Wang <wps132230@hotmail.com>, 2018-10-23 09:59:46 -0700, , fix bug resetting cipher resetting cipher internal context pointer e.g m_encryptor_ctx openssl set nullptr never initialized,,
1021,f008ccfc651859642e50897171e90d1415162705,arco Magdy <magmarco@amazon.com>, 2018-10-22 22:10:17 +0000, , finding decorated ec2 related metadata aws shield advanced api introduced new service specific thrown accessing individual attack information without sufficient permission,,
1022,e04d1aa6cf6ce047a82e48a40e071edfd4965f9f,arco Magdy <magmarco@amazon.com>, 2018-10-19 21:46:27 +0000, , rate control feature release state manager user ability apply rate control parameter similar run command association state manager console cli added support powerpro graphicspro workspace bundle,,
1023,3492d7dcce018a333281c0b0d2f19cea24a7e05c,arco Magdy <magmarco@amazon.com>, 2018-10-18 21:20:27 +0000, , release allows turn quality defined variable bitrate qvbr encoding aws elemental medialive channel deliver consistently high quality video viewing experience reducing overall distribution bitrates using quality defined variable bitrate qvbr encoding aws elemental medialive qvbr video compression technique automatically adjusts output bitrates complexity source content use bit required maintain defined level quality mean using qvbr encoding save distribution cost maintaining increasing video quality viewer change allows customer disable health check api update add support creating managing deleting user appstream 2.0 user pool,,
1024,d8da0e35476765ce390d2b4d168d64c5699f86b5,arco Magdy <magmarco@amazon.com>, 2018-10-17 21:20:22 +0000, , aws event aws organization support event bus policy release introduces new parameter putpermission api named condition using condition parameter customer allow one aws organization access cloudwatch event event bus resource documentation update api gateway,,
1025,10738922ba464ff49963f2f708376c703833b864,ushen Wang <wps132230@hotmail.com>, 2018-10-16 18:07:41 -0700, , enable tcp keep alive default,,
1026,a8a1b4bc00b3ece740231cecc62f7335ffe7b57c,arco Magdy <magmarco@amazon.com>, 2018-10-16 21:53:18 +0000, , aws resource group service added new feature filter resource group resource type using listgroups operation add support lightsail managed database new glue apis creating updating reading deleting data catalog resource based policy,,
1027,694999e9c1ddb061054a161c5685dcffca075f86,ndrew Tang <tangliang551@gmail.com>, 2018-10-15 15:33:08 -0700, , add entry monitoring metric,,
1028,7a724d910e7a5b19e1b3619b47f7bb815f8f07a6,arco Magdy <magmarco@amazon.com>, 2018-10-15 21:55:20 +0000, , documentation update lambda aws service catalog enables reduce administrative maintenance end user training adhering compliance security measure service action administrator enable end user perform operational task troubleshoot issue run approved command request permission within service catalog service action defined using aws system manager document access pre defined action implement aws best practice asec2 stop reboot well ability define custom action release add new parameter specify instance cluster parameter group restore snapshot restore point int time operation information see amazon rds documentation,,
1029,e225c582a3489d392b1bfd6fcfcbd65a8349ba0d,arco Magdy <magmarco@amazon.com>, 2018-10-15 09:30:50 -0700, , performance optimization reported clang tidy,,
1030,368686237d9a79a8b000a6548cff11afc27bc797,ndrew Tang <tangliang551@gmail.com>, 2018-10-15 10:52:52 -0700, , support presignedurls customized header,,
1031,92a8d7197dd4dc30ff29f6de753eb1ebdbd431eb,arco Magdy <magmarco@amazon.com>, 2018-10-12 22:23:28 +0000, , lookupevents api support two new attribute key readonly accesskeyid,,
1032,892e4ccf58fdc772e291b29dc07a48a1b02d2d86,ushen Wang <wps132230@hotmail.com>, 2018-10-12 12:32:07 -0700, , replace,,
1033,2a1ee30b27b2f0b4821e3e2de442fefa6f1da684,arco Magdy <magmarco@amazon.com>, 2018-10-11 23:28:24 +0000, , release add support jumbo frame aws direct connect set mtu value creating new virtual interface release also includes new api modify mtu value existing virtual interface api change return statementtype submitted athena query getqueryresults api change return number row added table ctas query executed added paginators mediaconvert list operation release amazon transcribe support transcription audio source british english australian english canadian french launch smaller sized instance called g3s.xlarge g3s.xlarge provides vcpu 30.5 ram nvidia tesla m60 gpu ideal remote workstation engineering architectural application visualization rendering visual effect,,
1034,055a68b53c5c4bbda4617e69acfdd84b0cc59a94,arco Magdy <magmarco@amazon.com>, 2018-10-08 16:11:08 -0700, , eliminate unnecessary string copy logging system,,
1035,da8c396fc400e2d0d0a0f81347e451fb33e29ce2,arco Magdy <magmarco@amazon.com>, 2018-10-10 22:58:24 +0000, , update amazon transcribe support deleting completed transcription job release add french italian german portuguese language support existing synchronous asynchronous apis amazon elasticsearch service support customer scheduled service software update new service software becomes available request update domain benefit new feature quickly take action update service software automatically certain time frame,,
1036,fd8919f8685b340f56052d20b2b9ddd79b4bb8d4,arco Magdy <magmarco@amazon.com>, 2018-10-09 21:13:22 +0000, , add startdate enddate add add apis,,
1037,2612d49dc31da2356361ccc4abe5bb7278250561,arco Magdy <magmarco@amazon.com>, 2018-10-08 20:43:25 +0000, , releasing job execution timeout functionality customer customer set job execution timeout job level creating job releasing job execution timeout functionality customer device set update job execution timeout,,
1038,03d17c3d8730764bd190ca9f0836c73604875fde,arco Magdy <magmarco@amazon.com>, 2018-10-05 21:43:18 +0000, , sdk change create new type trust active directory,,
1039,f395e590f85b269ee63ca042add8193b75998ce1,arco Magdy <magmarco@amazon.com>, 2018-10-04 12:53:06 -0700, , log string describing curl error code,,
1040,21620a853d7528710497caf408999c6c62f9c357,arco Magdy <magmarco@amazon.com>, 2018-10-04 23:02:28 +0000, , add baseline enable stricted validation rejected patch list add compliance reporting update neptune command support london region adding support multi value parameter add resolved source version field build output aws storage gateway enables specify folder subfolders update file gateway view object using refresh cache api,,
1041,46a99fcb3d387db60211f1216d7bc22e444a68d1,ndrew Tang <tangliang551@gmail.com>, 2018-10-03 12:48:58 -0700, , add region filed apicall event,,
1042,c2605ef381a3089d682804dcc822294b16173359,ndrew Tang <tangliang551@gmail.com>, 2018-10-03 12:48:24 -0700, , currently supported ndk version 12b,,
1043,6eca0e812354f623a691e3d6749585286c6e87a5,ndrew Tang <tangliang551@gmail.com>, 2018-10-03 11:24:26 -0700, , fix default monitoring test hanging issue,,
1044,c29219f0cd2248e033009dc1164f7fd9909a126c,arco Magdy <magmarco@amazon.com>, 2018-10-02 22:14:21 +0000, , waiter sagemaker batch transform job documentation update secretsmanager,,
1045,612333646910e327751bc148b25846ffa44b942d,arco Magdy <magmarco@amazon.com>, 2018-10-02 01:14:25 +0000, , documentation update amazon rekognition support optional parameter createdetector updatedetector operation clienttoken create operation,,
1046,a6df00c20cb8ce6565497310e368a5c8955f9c19,ndrew Tang <tangliang551@gmail.com>, 2018-10-01 16:10:07 -0700, , add missing ws3_32 library nuget static library,,
1047,7c22937026a3add3d7319e61acbc02121b2875a4,anilo Egea <danilo@FreeBSD.org>, 2018-09-13 14:17:40 -0300, , add missing virtual destructors,,
1048,1764afb1c51fa9aa9a464697ef2f5251d6d7e898,arco Magdy <magmarco@amazon.com>, 2018-09-28 19:25:24 +0000, , release enables tagging codestar project creation createproject api includes optional tag parameter use ec2 high memory instance tib memory 6tb1.metal tib memory 9tb1.metal tib memory 12tb1.metal ideal running large memory database including production deployment sap hana instance offer 448 logical processor logical processor hyperthread 224 core instance deliver high networking throughput lower latency gbps aggregate network bandwidth using elastic network adapter ena based enhanced networking instance optimized default support encrypted unencrypted volume instance available host tenancy need ec2 dedicated host instance type launch instance,,
1049,2083e95a91c4eceb5090deeb00f65e7b49146d72,arco Magdy <magmarco@amazon.com>, 2018-09-27 20:19:22 +0000, , release add api support getting content file getting content folder deleting file aws codecommit repository amazon support activemq 5.15.6 addition 5.15.0. automatic minor version upgrade toggled updated documentation sagemaker added support aws govcloud region adding support openapi 3.0 import export amazon gamelift amazon gamelift flexmatch available china north region,,
1050,ef2a6c146895b98991885ad3f3bf7fa505ef34d5,arco Magdy <magmarco@amazon.com>, 2018-09-26 21:51:21 +0000, , release introduces new api called opsworks use api call export engine specific attribute like userdata script used unattended bootstrapping new node connect server release includes deletion protection rds database documentation update amazon sqs aws glue support data encryption rest etl job development endpoint encryption enabled run etl job development endpoint glue use aws key write encrypted data rest also encrypt metadata stored glue data catalog using key manage aws additionally use aws key encrypt log generated crawler etl job well encrypt etl job bookmark encryption setting glue crawler etl job development endpoint configured using security configuration glue glue data catalog encryption enabled via setting glue data catalog,,
1051,f4b59a734eddd138af05078e68c2da5715e0fa43,arco Magdy <magmarco@amazon.com>, 2018-09-25 21:22:19 +0000, , api change related launch cross account directory service documentation update cloudfront add pagination support ec2.describe route table api,,
1052,840f379bfd7b5550fed62d9dc99c74576fa3f6ad,arco Magdy <magmarco@amazon.com>, 2018-09-24 22:08:26 +0000, , add engine version requirement option group option setting specifies option setting requires value update add amazon connect metric api let get current metric data historical metric data within hour queue amazon connect instance,,
1053,97dd77fbcdf3d1565a04bea7941421adaed5bfc9,arco Magdy <magmarco@amazon.com>, 2018-09-21 22:17:21 +0000, , offer lower price predictable non urgent workload propose concept reserved transcode pricing reserved transcode pricing reserved transcoding pricing would offer customer access fixed parallel processing capacity fixed monthly rate capacity would stated term number reserved transcode slot rtss one rts would able process one job time fixed monthly fee,,
