id,sha,author,date,issue,message,file,content
1625,1b2ef69e410c0edc2d35dcdcfecbdbec6c8dc11e,onathan M. Henson <henso@amazon.com>, 2017-07-06 23:13:49 +0000, , release aws key management service introduces ability determine whether key aws managed customer managed improve resilience performance microsoft directory deploying additional domain controller added api allows update number domain controller want directory api allows describe detailed information domain controller directory also added field api output microsoft encrypt data rest within amazon kinesis stream using server side encryption server side encryption via aws make easy customer meet strict data management requirement encrypting data rest within amazon kinesis stream fully managed real time data processing service amazon ec2 system manager expands patching support amazon linux red hat ubuntu addition already supported window server ecr available bjs,,
1626,643080894c3a67082d85c56bbc1ccd6b967e9c6c,onathan M. Henson <henso@amazon.com>, 2017-07-05 21:32:46 +0000, , merge branch master release candidate,,
1627,375f2b281be4814adaec3ac84be15b090e0e2f38,onathan M. Henson <henso@amazon.com>, 2017-07-05 21:32:46 +0000, , excited announce availability apis cloudformation support cloudwatch dashboard use new dashboard apis cloudformation template dynamically build maintain dashboard monitor infrastructure application four new dashboard apis putdashboard getdashboard listdashboards apis putdashboard used create new dashboard modify existing one whereas getdashboard api get detail specific dashboard listdashboards used get name delete multiple dashboard respectively getting started dashboard apis similar aws apis apis accessed aws sdk cli tool bug fix exception,,
1628,97f50615571e7b07fae59a41e239c34e81a08239,onathan M. Henson <henso@amazon.com>, 2017-07-05 20:56:50 +0000, , excited announce availability apis cloudformation support cloudwatch dashboard use new dashboard apis cloudformation template dynamically build maintain dashboard monitor infrastructure application four new dashboard apis putdashboard getdashboard listdashboards apis putdashboard used create new dashboard modify existing one whereas getdashboard api get detail specific dashboard listdashboards used get name delete multiple dashboard respectively getting started dashboard apis similar aws apis apis accessed aws sdk cli tool bug fix exception,,
1629,62c38f9d79f52017a1d5c6a70b8f2960cb6d2447,arco Magdy <magmarco@amazon.com>, 2017-07-03 14:08:06 -0700, , fix cmake build window using generator studio visual studio add configuration release debug subdirectory output binary patch fix assumption window cmake _always_ run studio generator example ninja build broken dlls copy test binary debug directory,,
1630,5ba3801c127f11181cf852c76d9743c7733d5653,onathan M. Henson <henso@amazon.com>, 2017-07-03 17:25:14 +0000, , merge branch release candidate,,
1631,be4f3fb154cd3920ee7ac04cc6a4f665c274cacd,onathan M. Henson <henso@amazon.com>, 2017-07-03 17:20:47 +0000, , auto commit,,
1632,5e87e937a4046df0e6718bd09162bed6bd069b72,ingku <tangliang551@gmail.com>, 2017-07-03 17:18:49 +0000, , merge branch patilarpith issue 599,,
1633,78a350fe1774a0bccd2f66f9f1a21104156b55f5,ingku <tangliang551@gmail.com>, 2017-07-03 17:17:09 +0000, , merge branch issue 599 http github.com patilarpith aws sdk cpp patilarpith issue 599,,
1634,b45a15546ad267a4d243943274b0812b7c610176,atilarpith <arpith.patil@gmail.com>, 2017-07-02 17:53:56 +0530,599, fix 599,,
1635,a689ef179bfc9a614765793b8386e676315781c0,arco Magdy <magmarco@amazon.com>, 2017-06-29 14:15:23 -0700, , split cmake greater_equal comparison greater_equal supported cmake version 3.7 since minimum required version set 2.8.x split comparison greater equal,,
1636,c795a53ea85946116079d232aee0e430f9fd3aec,onathan M. Henson <henso@amazon.com>, 2017-06-30 20:29:49 +0000, , documentation update aws marketplace commerce analytics api update adding object tagging header multipartupload initialization,,
1637,40249102aeea8386bcd2e437902e7aa294d30125,onathan M. Henson <henso@amazon.com>, 2017-06-29 18:20:52 +0000, , adding resource data sync support ssm inventory new apis creates new resource data sync configuration list existing resource data sync configuration deletes existing resource data sync configuration cloudwatch event allows different aws account share event new resource called event bus event bus accept event aws service aws account putevents api call currently aws account one default event bus send event another account customer simply write rule match event interest attach event bus receiving account target rule puttargets api updated allow adding cross account event bus target addition released two new apis putpermission enables customer add remove permission default event bus allow developer download gamelift fleet creation log assist debugging,,
1638,7c4b2d8cfb5adc841559b991642a246cef9deac2,onathan M. Henson <henso@amazon.com>, 2017-06-28 20:18:52 +0000, , auto commit,,
1639,1d83591ea8c4b0c74576e6325b4a6acc8df161f6,ingku <tangliang551@gmail.com>, 2017-06-28 18:28:48 +0000, , merge branch xkszltl evp,,
1640,d0ba58bb872ace27f29e4fc5da78715cf81b0967,arco Magdy <magmarco@amazon.com>, 2017-06-28 11:07:40 -0700, , skew detected compare system clock,,
1641,519a36c6516b84faacfcfd6f3bff91b4a0ad8dbc,onathan M. Henson <henso@amazon.com>, 2017-06-28 01:53:46 +0000, , auto commit,,
1642,31e26620e9844abbe160b7bbbd4cc7b5f65d4062,onathan M. Henson <henso@amazon.com>, 2017-06-28 00:18:19 +0000, , merge branch release candidate,,
1643,ab8a76ec000f4a378cd0db4857fe1f28702593c8,arco Magdy <magmarco@amazon.com>, 2017-06-22 18:46:12 -0700,574, ensure transfermanager life extends beyond transferhandle callback controlling way transfermanager created case heap using shared_ptr guarantee life least last callback finished executing regardless application destroys release copy.with mind patch introduces builder pattern control creation transfermanager fix http github.com aws aws sdk cpp issue 574,,
1644,e5f269eb71687f71fcee838c01038cf65c2b698c,onathan M. Henson <henso@amazon.com>, 2017-06-27 23:57:44 +0000, , proper tagging resource critical post launch operation billing cost allocation resource management using service catalog tagoption library administrator define library usable tagoptions conform company standard associate service catalog portfolio product learn move current tag new library create new tagoptions view associate library item portfolio product understand ensure right tag created product launched service catalog provide user defined selectable tag aws greengrass available new region,,
1645,c231bbf4b4ff97559eaa19851a1cbfb65978e27c,ingku <tangliang551@gmail.com>, 2017-06-27 23:40:41 +0000, , merge branch evp http github.com xkszltl aws sdk cpp xkszltl evp,,
1646,a670a3e3fc28d56faac2b5d8f9209ced9e0ed6ee,ingku <tangliang551@gmail.com>, 2017-06-27 22:57:49 +0000, , add bracket,,
1647,1a54acfcf0d28b1cfe1de2e16ae4a2c66117423d,arco Magdy <magmarco@amazon.com>, 2017-06-27 13:40:55 -0700, , reset client clock skew becomes sync client clock becomes synchronized server reset skew offset back zero happens example machine synchronizes ntp service,,
1648,72005ed8d3f973f4bc30f5dddc49b541aa0571c5,arco Magdy <magmarco@amazon.com>, 2017-06-26 17:38:58 -0700, , setup test infrastructure awsclient,,
1649,8f694ec93d1a65559bb53f2029b1b840f5794125,onathan M. Henson <henso@amazon.com>, 2017-06-27 19:17:51 +0000, , merge branch master release candidate,,
1650,fb3dcf870722f1dd073bbf9fc3d9010a33ebb6ee,onathan M. Henson <henso@amazon.com>, 2017-06-27 19:17:50 +0000, , auto commit,,
1651,c1f959b39c6c040b2472d3091e41c9870b03bd2a,onathan M. Henson <henso@amazon.com>, 2017-06-27 19:12:51 +0000, , auto commit,,
1652,23af47a45a8b36d6a1e6079e4628e48fdaf3f9a0,ndrew (Liang) Tang <tangliang551@gmail.com>, 2017-06-27 14:15:47 -0400, , get rid gcc complaint unused variable,,
1653,9417e544ac70fa5c362749b1c6cf2f0879d2c486,ndrew (Liang) Tang <tangliang551@gmail.com>, 2017-06-27 13:45:51 -0400, , remove gcc complaint cast void curl,,
1654,8a4ef2ad172d235264876eaa51d5d2b700dc7764,ndrew (Liang) Tang <tangliang551@gmail.com>, 2017-06-26 19:47:19 -0400, , fix waf code generator endpoint,,
1655,6bb9b59ed059947979ba7be2ebe2f0ea98fc323d,ndrew (Liang) Tang <tangliang551@gmail.com>, 2017-06-26 14:24:12 -0400, , customized auth signer support enable customized authsigner,,
1656,d892907ac5b13ebfeb187e7c8297535e80610c95,ongliang Liao <xkszltl@gmail.com>, 2017-06-22 18:22:27 -0700, , enable md5 non crypto purpose fips mode,,
1657,71ff04fb113c1e927e36ac57a9a52a896fb8e02e,ongliang Liao <xkszltl@gmail.com>, 2017-06-21 03:54:55 -0700, , replace deprecated low level openssl api evp,,
1658,6492559127a42529317ad987aaac86259f812e3a,onathan M. Henson <henso@amazon.com>, 2017-06-23 21:24:48 +0000, , lambda invoke api throw new exception status code 502 invokes deprecated runtimes,,
1659,af234f2c9883f1207b9a577a20f622e3d28fbf8b,onathan M. Henson <henso@amazon.com>, 2017-06-23 00:28:46 +0000, , new api enables retrieve summary information recent execution pipeline including pipeline execution status start time last updated time request information maximum 100 execution pipeline execution data available recent month activity lambda available canada central region add retry error state waiter release reintroduces exception added tagging certificate release add new nextpagetoken property result api developer get next set item list making subsequent call api token previous call release also deprecates nextpagecount property previously returned null use nextpagetoken property instead release also deprecates customimagename property class previously ignored api,,
1660,ac6cb31d848fcf96be9acec478d728ab4aef8491,onathan M. Henson <henso@amazon.com>, 2017-06-22 04:39:45 +0000, , auto commit,,
1661,09d3338e3ed96efcfabaa48ceb899d2b6c454565,ingku <tangliang551@gmail.com>, 2017-06-22 03:53:39 +0000, , quick fix,,
1662,41e897fb451960cc85c507155e8be25aebd4aef1,ndrew (Liang) Tang <tangliang551@gmail.com>, 2017-06-21 19:29:04 -0400, , change aws_log_ aws_logstream_,,
1663,c658f69e652aa5adddf0af1e64015ad9518afe1a,onathan M. Henson <henso@amazon.com>, 2017-06-21 21:14:48 +0000, , amazon route support multivalue answer response dns query let route traffic approximately randomly multiple resource web server create one multivalue answer record resource optionally associate amazon route health check record amazon route responds dns query eight healthy record amazon dynamodb accelerator dax fully managed highly available memory cache dynamodb delivers 10x performance improvement millisecond microsecond even million request per second dax doe heavy lifting required add memory acceleration dynamodb table without requiring developer manage cache invalidation data population cluster management adding hierarchy support ssm parameter store api added support tor tagging new apis getparameter retrieves one parameter deletes multiple parameter max number retrieves parameter located hierarchy updated apis putparameter added ability enforce parameter value applying regex allowedpattern modified support tag filtering create edit update delete new type waf rule rate tracking component,,
1664,d92499605e189f65c78c144470593af44c60bf60,arco Magdy <magmarco@amazon.com>, 2017-06-20 23:55:26 -0700, , add support digit year rfc822 date format two digit year calculated post y2k example 2080 1980. case since class used parse date sent aws service case work digit version used instead,,
1665,a10a40b80bbfa94ba945f9d475b7553f15f9db23,arco Magdy <magmarco@amazon.com>, 2017-06-20 17:49:27 -0700, , guard malformatted date sent server,,
1666,ff6163ff7762aae5ab588a51bd610621184b7006,arco Magdy <magmarco@amazon.com>, 2017-06-20 13:20:12 -0700, , add date parsing format auto detection compensates variance date format different service,,
1667,193810ad14b6297bf5f8f402d0feeca78ef52dc7,ndrew (Liang) Tang <tangliang551@gmail.com>, 2017-06-20 17:41:39 -0400, , added support sync high level sdks pkg update within nuget added high level service autopkg nuget added script preparing update high level sdks basically replace major minor version string,,
1668,f3ea9aa740f0b7c64b404edfa36bbe32d283fc56,onathan M. Henson <henso@amazon.com>, 2017-06-20 20:20:48 +0000, , release provides new api retrieve activity performed workdocs user,,
1669,5a8f3b912b9e96061cb158b8cd7619d2293c97dc,arco Magdy <magmarco@amazon.com>, 2017-06-19 12:14:03 -0700, , remove unnecessary header includes,,
1670,b4b0cf3e3a1d3972648ec98ce20cfab52f39374e,onathan M. Henson <henso@amazon.com>, 2017-06-19 18:52:48 +0000, , improvement exception modeling,,
1671,06d20b53df608eff4b486b629abb2f3ed97ceb87,onathan M. Henson <henso@amazon.com>, 2017-06-18 02:41:43 +0000, , auto commit,,
1672,179d7e1615bb6f26a16243549abcfe191c4cc361,eff Thompson <jefft@threeputt.org>, 2017-06-16 17:59:14 -0700,566, fix multipart upload progress issue 566,,
1673,e0fe881fa7a365c0c6941a9ee4ab65cc02515c11,onathan M. Henson <henso@amazon.com>, 2017-06-16 23:46:48 +0000, , auto commit,,
1674,fbc81cf772a54a88199dcc59b21cd2dd171f910b,onathan M. Henson <jonathan.michael.henson@gmail.com>, 2017-06-16 14:54:57 -0700,131, merge pull request 131 awslabs json location name fix added locationname support top level shape json protocol,,
1675,a1d64d3e9be791a677808e8d06b878d37b6a524b,onathan M. Henson <henso@amazon.com>, 2017-06-16 13:56:08 -0700, , added locationname support top level shape json protocol,,
1676,1739100166d12d2a9ef8bb46e474b73cab2eab99,onathan M. Henson <henso@amazon.com>, 2017-06-16 19:31:45 +0000, , add response time histogram service response getservicegraph api aws batch available northeast region,,
1677,252ce90378282e1575e01c61d510275e86b90ea4,onathan M. Henson <henso@amazon.com>, 2017-06-16 05:55:47 +0000, , auto commit,,
1678,777e71bc2cc620a65427e5d069b4ff9909171d1f,arco Magdy <magmarco@amazon.com>, 2017-06-15 22:02:35 -0700, , refactor error marshaling extract xml json parsing error class add fallback option rely http response code exception error successfully parsed refactored test suite reflect change,,
1679,86d1d8104a50adcddc25b3ed863e91617a4c9f33,onathan M. Henson <henso@amazon.com>, 2017-06-15 21:27:45 +0000, , added output show provisioning artifact belong product allow filtering sourceproductid aws marketplace product added verbose option display cloudformation template used create provisioning artifact.added api changed type status distinct record status new status available under_change tainted error changed record status set value created in_progress succeeded failed add api describe amazon fpga image afis available customer includes public afis private afis afis owned aws account load permission added support cpu memory memory reservation container override runtask starttask apis revert last release remove certificatepem api,,
1680,2e23d53f3b603a5f7b0219eda9f36957ecb56bb1,ndrew (Liang) Tang <tangliang551@gmail.com>, 2017-06-15 13:44:59 -0400, , replaced _msc_ver _win32,,
1681,e0cbe8994cfcbe76d4741c388cf118eddfe89f75,onathan M. Henson <henso@amazon.com>, 2017-06-15 04:40:48 +0000, , documentation update cloud directory application auto scaling support automatic scaling read write throughput capacity dynamodb table global secondary index,,
1682,9aaeb8e3f0313b09b59d1fc325605ad129aefcf9,ndrew (Liang) Tang <tangliang551@gmail.com>, 2017-06-14 20:05:59 -0400, , curl enabled ps4 signal.h removed,,
1683,4a57f45b2ecb76f95f77ad8c3231ec70a7a57859,arco Magdy <magmarco@amazon.com>, 2017-06-14 14:58:14 -0700, , cast size_t int avoid msvc warning,,
1684,8661aef2852d816c90efeb96e24bddbbff2b7b7d,ndrew (Liang) Tang <tangliang551@gmail.com>, 2017-06-14 17:42:33 -0400, , fixed mac compilation multiple audio driver text speech,,
1685,561eae2d179a5dea6a5495774890a477aa32da2a,arco Magdy <magmarco@amazon.com>, 2017-06-14 12:39:39 -0700, , fix string wstring conversion use win32 apis properly convert utf utf vice versa use hex notation represent utf8 utf16 string test code avoid editor encoding affecting test result,,
1686,04d56cad82f408510c933c274adc5d001ee7d582,onathan M. Henson <henso@amazon.com>, 2017-06-14 16:57:47 +0000, , auto commit,,
1687,f652c774e98b25f3877354129a794e5de0e51427,onathan M. Henson <henso@amazon.com>, 2017-06-13 22:00:38 -0700, , removed umask call certain platform build,,
1688,46ff9cb5c5101696f340a28f36b82edf93801c71,onathan M. Henson <henso@amazon.com>, 2017-06-13 15:04:45 -0700, , added east,,
1689,167bbc164448e3b82c766eba8a9f6e133a606cbe,onathan M. Henson <henso@amazon.com>, 2017-06-13 21:07:49 +0000, , release aws config support amazon cloudwatch alarm resource type,,
1690,71b9085df425bf37a25cbc4751eaf2e88d4e50b7,ndrew (Liang) Tang <tangliang551@gmail.com>, 2017-06-13 15:53:55 -0400, , added id2 requstid getobjectresult response header per customer http github.com aws aws sdk cpp pull 556 want add id2 requestid common header paramters response header getobjectoutput update api description json file load hacked code generator achieve,,
1691,b8763b75344b12fc4007863c9d19b7856570c8ec,onathan M. Henson <jonathan.michael.henson@gmail.com>, 2017-06-13 12:10:19 -0700,124, merge pull request 124 awslabs console fix moved signal include enable_curl build,,
1692,c9e19bc58f2343f8457d318845622ec36eee5392,onathan M. Henson <henso@amazon.com>, 2017-06-13 11:46:07 -0700, , moved signal include enable_curl build,,
1693,db1042c9f0f11cea3289f83f04f2ae4ed1f53ed7,onathan M. Henson <henso@amazon.com>, 2017-06-13 00:11:44 +0000, , api update rds update enables copy write new aurora mysql compatible edition feature allows user restore database support copy tde enabled snapshot cross region new region launch gov west amazon rekognition,,
1694,26de24e97f7e7dea001da63fa74f06df75c3d7f0,onathan M. Henson <jonathan.michael.henson@gmail.com>, 2017-06-12 16:19:54 -0700,122, merge pull request 122 awslabs api added support accept header api gateway client updated http,,
1695,9ab7d2209bb077ce39352745925090eb21e623cc,onathan M. Henson <henso@amazon.com>, 2017-06-12 16:17:03 -0700, , fix process c2j model empty,,
1696,de9b1805e1fcb2098798cf26c80a2c6846ba85fe,onathan M. Henson <henso@amazon.com>, 2017-06-12 14:12:09 -0700, , removed superfluous c_str,,
1697,95cc91f3418b635d8ac14fbc54c4aefb211dd429,onathan M. Henson <henso@amazon.com>, 2017-06-12 14:09:52 -0700, , added support accept header api gateway client updated http client use header properly curl client need update,,
1698,631cc4881b41d8d2b667b174d0188bb7d4f1ac20,arco Magdy <magmarco@amazon.com>, 2017-06-12 09:31:45 -0700, , use uint64_t instead size_t transfermanager 32bit portability,,
1699,673f25e0c1a6e06d588f899694bc85b3b20098a1,onathan M. Henson <henso@amazon.com>, 2017-06-09 23:59:46 +0000, , auto commit,,
1700,391b0dbbd808ccd80005b2b38142126638873d66,ingku <tangliang551@gmail.com>, 2017-06-09 23:07:38 +0000, , merge branch master github.com awslabs aws sdk cpp staging,,
1701,9e99bb74156aaf87ac318715646b94e9c62a6cfa,ingku <tangliang551@gmail.com>, 2017-06-09 23:07:24 +0000, , merge branch proydakov markdown,,
1702,5141f4a103925ac2cfe62d410a32ea9f3bd70a61,onathan M. Henson <henso@amazon.com>, 2017-06-09 18:43:38 +0000, , tagging support aws opsworks stack,,
1703,b9c44abcacdd76d7c40d5e11aafb94672ef86d11,vgeny Proydakov <e.proydakov@rambler-co.ru>, 2017-06-09 19:52:19 +0300, , fixed markdown youtube video link,,
1704,2da566a876cf79f091ed37e170de5f9a6be6a7b8,onathan M. Henson <henso@amazon.com>, 2017-06-08 21:00:41 +0000, , api update adding api addition using certificate aws iot customer obtain description certificate certificate pem starting today amazon pinpoint add text email messaging support addition mobile push notification providing developer product manager marketer multi channel messaging capability drive user engagement application pinpoint also enables backend service application message user directly provides advanced user app analytics understand user behavior messaging performance,,
1705,64c964675e0c2faec2ea64a586718654639de5f3,onathan M. Henson <henso@amazon.com>, 2017-06-08 19:35:39 +0000, , auto commit,,
1706,c2d7123deebeaeade0c5b3115babd95b9c445ef4,ndrew (Liang) Tang <tangliang551@gmail.com>, 2017-06-08 14:50:02 -0400, , add missing service build list support blob typed member add missing build service dynamodbstream codestart add processing blob typed member,,
1707,ce7acf3253ca9c60eb81edfabb2d096ce3b58786,onathan M. Henson <henso@amazon.com>, 2017-06-08 18:36:27 +0000, , auto commit,,
1708,eba98fba893849e3d334891b2ffe938516729c03,ingku <tangliang551@gmail.com>, 2017-06-08 17:44:55 +0000, , add pinpoint build list fix generated duplicate error enum element,,
1709,8b207d6e5f5ec31ce7c6ce2346e8d70f527905aa,ingku <tangliang551@gmail.com>, 2017-06-08 06:32:43 +0000, , added pinpoint sdk build list changed class error equal behavior member comparison name comparison fix duplicate error enum element problem,,
1710,96e572bf0bed06c1ef6899f575f285597ff18696,onathan M. Henson <henso@amazon.com>, 2017-06-07 21:29:34 +0000, , merge branch master release candidate,,
1711,6438da969de68a7ddba5ffcb4280eb1067b74596,onathan M. Henson <henso@amazon.com>, 2017-06-07 21:29:34 +0000, , auto commit,,
1712,667e65fc6e889b6275840ca4e2d8f56078babd6a,onathan M. Henson <henso@amazon.com>, 2017-06-07 21:18:25 +0000, , auto commit,,
1713,c3ae926b61909bfb849a65ccf1944e16c958bf92,ndrew (Liang) Tang <tangliang551@gmail.com>, 2017-06-07 16:24:38 -0400, , questionmark 118 adjust order concatenated parameter make generated code even neat,,
1714,3d43c1db758afafc41d219f885b0f26b9a086c2c,arco Magdy <magmarco@amazon.com>, 2017-06-06 11:46:47 -0700, , skip virtual addressing bucket name contains uppercase letter,,
1715,25c2ef6c16139456379d287470fc753b920348e0,arco Magdy <magmarco@amazon.com>, 2017-06-02 13:44:31 -0700, , get rid atmoic variable always protected mutex,,
1716,8d234ad0939fb79392ecf99eb318bd33c27f7ccd,onathan M. Henson <henso@amazon.com>, 2017-06-07 19:19:26 +0000, , aws greengrass software let run local compute messaging device state synchronization connected device secure way aws greengrass connected device run aws lambda function keep device data sync communicate device securely even connected internet using aws lambda greengrass ensures iot device respond quickly local event operate intermittent connection minimize cost transmitting iot data cloud add support apis privileged container change would allow performing privileged operation like starting docker daemon inside build possible custom docker image,,
1717,8a0bab5bba2f17834784ae1c67ec5e0246894425,onathan M. Henson <henso@amazon.com>, 2017-06-07 06:16:27 +0000, , update client side validation salesforce action doc update fix incorrect prefix s3originconfig documentation update aws certificate manager,,
1718,c8a5b819d177db8d72234ded061c0d99dd0a761b,ndrew (Liang) Tang <tangliang551@gmail.com>, 2017-06-07 01:35:03 -0400, , questionmark 117 fallback using stringstream concatenate data data integer instead string,,
1719,55e1a09518bb1e8704c7e9f6f3f078aa2ea4f004,ndrew (Liang) Tang <tangliang551@gmail.com>, 2017-06-06 19:12:17 -0400, , questionmark 116 made user passed parameter include uri component possible user passed parameter key contains treated uri querystring query string start based service mode passed parameter user passed parameter treated query string test var1 test1 var2 varparam var3 varparam2 var4 var1 var2 treated path uri var3 var4 treated part query string,,
1720,5bd584fdfa759d1b91ced9664a7fe2d579ad37f9,onathan M. Henson <henso@amazon.com>, 2017-06-05 21:29:24 +0000, , appstream 2.0 custom security group allows easily control network resource streaming instance image access assign security group per fleet control inbound outbound network access streaming instance specific range network protocol port autoscaling resource model update added salesforce action iot rule engine,,
1721,20a9798386aba0fa76c0f846cdd366df94d0adbf,ndrew (Liang) Tang <tangliang551@gmail.com>, 2017-06-05 16:30:42 -0400,232, fix 232 114 addressed review github add comment set umask dropped line inclde sys types.h value passed value instead enum types.h,,
1722,3d09e3a392cb34005f7f838fc005fd60856a0dcc,onathan M. Henson <henso@amazon.com>, 2017-06-02 20:27:28 +0000, , release includes new apis manage tag custom metadata resource also new apis add retrieve comment document level kinesis analytics publishes error message cloudwatch log case application,,
1723,792c8ffc10a048a358a8de65b82600e6a1099a7e,onathan M. Henson <henso@amazon.com>, 2017-06-01 21:49:26 +0000, , updated documentation added example amazon lex runtime service aws codedeploy improved manages connection github account repository create store connection github account order associate aws codedeploy application github repository connection support multiple repository create connection different github account create one connection single account command introduced retrieve name stored connection github account created name connection github used aws codedeploy application also included applicationinfo structure two new field added improve handling deployment group information aws codedeploy console information latest deployment also retrieved using group request also includes region update gov west update existing describerules api support pagination added support within amazon cognito user pool customizable hosted user sign sign integration external identity provider,,
1724,f48d787df63faa3baefbe256071af10da002f279,acha Delanoue <sdelanoue@novaquark.com>, 2017-06-01 17:15:37 +0200, , tell gcc fall switch wanted fix gcc7 compilation,,
1725,2ad44411a596f51fd73165b6b744cb664515b449,onathan M. Henson <henso@amazon.com>, 2017-05-31 22:00:25 +0000, , amazon rds customer easily quickly stop start instance,,
1726,fdc8b04c89cd48c17d02bb713de55f025289a88b,onathan M. Henson <henso@amazon.com>, 2017-05-31 01:02:24 +0000, , auto commit,,
