id,sha,author,date,issue,message,file,content
738,0ec38ad0f8f27df9a8ad5dcb404a4ef620b56e11,isa <infoteddyatgitgud@cock.li>, 2020-07-09 03:00:48 -0700, , get rid unnecessary roomname logic set map roomname roomname room completely redundant set roomname empty string check roomname room empty,,
739,2558cccd40f178cc78a8bf35d07cbc2ce62ef5e3,isa <infoteddyatgitgud@cock.li>, 2020-07-09 02:59:42 -0700, , fix break statement case inside brace look bad visually fixing,,
740,2646642664d94f48e1838f7d76c481100fad1aec,isa <infoteddyatgitgud@cock.li>, 2020-07-09 02:58:16 -0700, , add brace case custom level loading declare initialize variable case strictly necessary since cross initialization error since last case switch like future proof,,
741,71a989707eb353977b58deca6080c1a8837c204f,isa <infoteddyatgitgud@cock.li>, 2020-07-09 02:54:23 -0700, , duplicate add safety check ed.level reference instead repeating ed.level curlevel even worse type giant expression inside bracket instead reusing curlevel type room added bonus added bound check room always guaranteed point existing object level index ed.level bound like make behavior properly defined instead undefined one thing usually true bound room always tiles2.png mean edlevelclass tileset chance memory location exactly smaller nonzero bound room tileset,,
742,729f24d7322402bf89b80ddfd9adc8f545e14441,isa <infoteddyatgitgud@cock.li>, 2020-07-09 02:40:18 -0700, , duplicate reference edentity edentity edi bit long winded really want access attribute edentity ent,,
743,4b6406d08e03350e9327ea390cf8f54bcc071ba4,isa <infoteddyatgitgud@cock.li>, 2020-07-09 02:32:52 -0700, , unindent case label entity creation everyone know best practice put case label line switch statement ...,,
744,fd2ee96c49c53ce036f4b1207fec1542ac0d8c5c,isa <infoteddyatgitgud@cock.li>, 2020-07-09 02:32:00 -0700, , clean tsx tsy initialization used severely overcomplicated expression god know reason replaced simpler one also const indicate intent,,
745,d591c770887b59a62cf562ef1b670eff5c360c23,isa <infoteddyatgitgud@cock.li>, 2020-07-09 02:28:53 -0700, , duplicate expression actual coordinate edentities previously copy pasted god awful overcomplicated expression possibly cursed actionscript legacy reason everywhere instead putting variable even using simpler one like one replaced obj.createblock call much nicer,,
746,34b0e2c8121a8560015d3d8acd27df6f134d879a,isa <infoteddyatgitgud@cock.li>, 2020-07-09 02:12:31 -0700, , unindent ending loop brace rather unnecessary level ending brace case switch,,
747,8b8f9b3389bedaf53c8b59dbb5d26f1400302c91,isa <infoteddyatgitgud@cock.li>, 2020-07-09 02:11:56 -0700, , negate edentity room check use continue reduces brace level one meaning indentation level longer semi misleading,,
748,264279d17a31c6c8723e1b3982631714c380c53c,than Lee <flibitijibibo@gmail.com>, 2020-07-15 12:11:23 -0400, , warning fix uninitialized prefix,,
749,b302e4dbbbe9820f84ed667e3265b29a26542223,than Lee <flibitijibibo@gmail.com>, 2020-07-15 12:09:24 -0400, , valgrind warning fix,,
750,5ff5ae7294c1c118fe12c55b578a4fc22d553812,than Lee <flibitijibibo@gmail.com>, 2020-07-15 11:58:00 -0400, , mmmmmm initialized earlier init,,
751,f8190439a9947597958fb22dfa8b7244cce24a4a,isa <infoteddyatgitgud@cock.li>, 2020-07-11 00:39:09 -0700, , reset ed.roomnamehide exiting playtesting cursor bottom screen entered playtesting moved top playtesting exit roomname instantly disappear sheepishly rise back cursor bottom screen entered playtesting exited still way roomname rise back instantly disappear behavior make roomname movement much continuous previously feel smoother janky,,
752,def540d1845a966ab2ec234ac4427b1bb334902c,isa <infoteddyatgitgud@cock.li>, 2020-07-11 00:27:00 -0700, , reset ed.notedelay exiting playtesting useful show message relevant started playtesting,,
753,22d556f4be0e457057fe50ec45105a3cefe43e24,isa <infoteddyatgitgud@cock.li>, 2020-07-11 00:23:31 -0700, , disable game saved text box custommode also use inspecial instead writing part conditional separately basically add insecretlab conditional statement big deal,,
754,13e260bf50b3e76bc253412e157847f20bbce9ff,isa <infoteddyatgitgud@cock.li>, 2020-07-11 00:21:23 -0700, , fix pressing esc teleporter menu going quit screen added new pause menu forgot make pressing esc teleporter menu new pause menu instead fixed,,
755,5f131b426b15e6c4a17dbd97b50a20da1f1f9f9e,isa <infoteddyatgitgud@cock.li>, 2020-07-11 00:15:06 -0700, , allow pressing enter teleporters playtesting reason allowed press enter teleporters playtesting well except press esc teleporter menu order pause menu intended playtesting add check pressing esc close teleporter menu instead fine,,
756,846c6f61d489bf7371959ea5884cd193af1191b1,isa <infoteddyatgitgud@cock.li>, 2020-07-11 00:10:06 -0700, , use .clear removing text box reset function used instead even still process least one frame gamemode logic text box actually properly removed caused frame glitch exiting playtesting text box screen entering playtesting technically could fixed game returntoeditor wanted safe also fixed scriptclass hardreset,,
757,7fada0548b097a12b3ef4329eafa783f3c194586,isa <infoteddyatgitgud@cock.li>, 2020-07-11 00:09:02 -0700, , set ed.settingskey true returning editor fix bug setting menu would immediately brought used esc exit playtesting unless incredible ninja pressed exactly one frame,,
758,6c52b79ddf163a2c55a2a159a465191979aa97cf,isa <infoteddyatgitgud@cock.li>, 2020-07-11 00:04:54 -0700, , set ed.keydelay returning editor fix annoying bug use press action crewmates rescued dialogue whenever rescue last crewmate playtesting move room ed.keydelay set standard value get set whenever press key editor ,,
759,1caabe374b724a14f23e9051dc75835f06d5efd3,isa <infoteddyatgitgud@cock.li>, 2020-07-11 00:00:42 -0700, , fix return editor via crewmate rescue using variable supposed used fix warp background reset exit horizontally vertically warping room different background also properly reset variable good,,
760,2506127a1764fa75739e3219cd773c5788a97e05,isa <infoteddyatgitgud@cock.li>, 2020-07-09 23:20:03 -0700, , directly execute script script box non empty script field instead using gamestates directly use script attribute script box non empty accomplished return index block player collides caller inspect script attribute block logic accordingly,,
761,ca9e4c8f6e2455325db0d960fd16fbfa9c275b90,isa <infoteddyatgitgud@cock.li>, 2020-07-09 23:03:16 -0700, , set index inbounds unnecessary middleman kept around compatibility reason however still possible crash game adding bound check,,
762,8c42f823177e43360dd716657e439aebe168f287,isa <infoteddyatgitgud@cock.li>, 2020-07-09 23:01:13 -0700, , set script attribute custom level script box avoid going gamestates need carry name script script box need set script attribute script box translating edentities real entity custom level,,
763,5e94239967a4bb750b85c2ea977a2b2675a96c9f,isa <infoteddyatgitgud@cock.li>, 2020-07-13 21:17:20 -0700, , optimize mode fps loop use sdl_delay patch optimizes loop used limit framerate fps mode sdl_delay instead accumulator mean game take cpu power fps mode also mean game loop code simplified two loop two place game.over30mode checked thus leading easier understand logic using accumulator would essentially mean busywaiting millisecond timer following leo60228 told busywaiting bad inefficient operating system assumes busywaiting performing complex calculation handle process accordingly sleeping invented could busywait without taking unnecessary cpu time,,
764,11312976fcb1ef9fe7e91791ab509e67c2004124,than Lee <flibitijibibo@gmail.com>, 2020-07-13 16:09:44 -0400, , fall back default setting screenbuffer present,,
765,47eba09edbee673e4d08fe8a731118ae9757d218,isa <infoteddyatgitgud@cock.li>, 2020-07-11 14:12:17 -0700, , fix missing newline printf customsavequick failure missing newline printf annoying mean next line output concatenated previous one,,
766,582aaa587e5a6f425a6018f1bbfdad1bbec3bcec,isa <infoteddyatgitgud@cock.li>, 2020-07-11 12:21:24 -0700, , remove non player entity scriptclass hardreset moved duplicate player entity removal scriptclass hardreset also inadvertently made non player entity got removed well even though intent thus pressing enter restart time trial remove every entity except player since call time trial bad reason see 367 however still good idea reset needed ,,
767,199a8f45d6fe96cb6a43ad1452ef9457e87a237a,isa <infoteddyatgitgud@cock.li>, 2020-07-11 11:55:26 -0700, , fix playmusic command line option working bug playtesting ved properly play music level due fault ved music faded scriptclass startgamemode case main called music.play fix call music.play variable set game customloadquick,,
768,15319b9ed01134d053dede26b4e05607f6518675,isa <infoteddyatgitgud@cock.li>, 2020-07-10 16:30:28 -0700, , fix able circumvent flip mode detection get trophy achievement completing game flip mode begs question doe game know played game flip mode entire way switched point look like play normally way checkpoint turn flip mode game give trophy give well actually happens every time press enter teleporter game set flag true flip mode game complete run game check flag give achievement trophy accordingly however mean could save game pressing enter teleporter quit option turn flip mode use teleporter save game automatically saved since used teleporter quit option turn get flip mode trophy even though actually played entire game flip mode furthermore 2.3 bring pause menu toggle flip mode even quit circumvent detection fix exploit moved turning flag starting new game loading quicksave loading telesave case respectively scriptclass startgamemode also added flip mode check routine run whenever exit option menu back pause menu circumvent detection way either,,
769,90929d80ea910b413c6fe0fd47ea0493960e8615,isa <infoteddyatgitgud@cock.li>, 2020-07-10 16:55:56 -0700, , fix wrong tower music toggling flip mode game option music tower supposed ecrof evitisop flip mode positive force flip mode however option pause menu toggle flip mode music changed fixing pretty simple check current area custom level play correct track accordingly toggling flip mode game,,
770,b419601b41fe1f99a408a874d08e0450286e27d7,isa <infoteddyatgitgud@cock.li>, 2020-07-09 18:14:18 -0700, , duplicate gamestates 300 336 gamestates 300 336 used start script custom level however look like instead case common code individual case copy pasted numerous time pretty wasteful,,
771,82666a1875d3c2072e721a9aa08026ed83e28797,than Lee <flibitijibibo@gmail.com>, 2020-07-08 21:42:57 -0400, , set filter vsync hint override priority,,
772,3932c75acc53b8c63388d0c471cfbc44f0f7f42a,isa <infoteddyatgitgud@cock.li>, 2020-07-06 15:02:55 -0700, , remove unnecessary stub destructors bit misleading stub destructors anything special,,
773,307cdefb8e10930a5aa54b623da076c67694fc25,isa <infoteddyatgitgud@cock.li>, 2020-07-06 14:42:07 -0700, , remove duplicate advancetext initialization already initialized constructor idea ,,
774,6b0b86d4343aaafed14ea02b6a285da3e70a47a7,isa <infoteddyatgitgud@cock.li>, 2020-07-06 14:18:21 -0700, , remove unused attribute advanced_mode game attribute doe absolutely nothing fact doe much nothing safely remove reading writing,,
775,7128e9c3ac86cb9d6b3270de1f5e46793d343f23,isa <infoteddyatgitgud@cock.li>, 2020-07-06 13:11:05 -0700, , remove unnecessary string initialization constructor std string one special type constructor initializes blank state automatically mean std string default already need set fact cppcheck throw warning performance due initializing std string way,,
776,7703b2c1c253abd142ea92f2862e04cc5e79610c,isa <infoteddyatgitgud@cock.li>, 2020-07-06 13:04:34 -0700, , ensure member attribute initialized ran game cppcheck spat bunch member attribute initialized initialized previous version commit added constructor otherlevelclass labclass warpclass finalclass flibit say change code flow enough risky merge 2.4 got rid constructor,,
777,3b6867243b81b9ef68d11a3d76abac96a4e6e0cd,isa <infoteddyatgitgud@cock.li>, 2020-07-06 12:46:46 -0700, , remove useless attribute rcol finalclass rcol finalclass always reason attribute could change anything,,
778,876c120ed8b7998eaafacdb9bb81030904bcfbf2,isa <infoteddyatgitgud@cock.li>, 2020-07-06 12:44:29 -0700, , remove unused coin attribute finalclass warpclass look like coin basically scrapped mechanic although sure attribute guess counting number coin room make function count automatically whatever,,
779,63f6784cfeb2cfda60add85795db1cfd99697800,isa <infoteddyatgitgud@cock.li>, 2020-07-06 12:38:17 -0700, , remove unused vector include otherlevel.h forgot earlier previous pull request vectoring everything,,
780,420bc38dff3b53a3e0d702100a21c1d13b0a2b6d,isa <infoteddyatgitgud@cock.li>, 2020-07-06 12:37:04 -0700, , move roomtext struct map.h appropriate place never used otherlevel.cpp,,
781,5e8ca20d0228e37c61c36af494ead0829bd14828,isa <infoteddyatgitgud@cock.li>, 2020-07-06 12:36:09 -0700, , remove block type enum otherlevel.h idea already included entity.h anyway reason copy paste,,
782,ec960b0f956d8675eba0173a6040d417599b58aa,isa <infoteddyatgitgud@cock.li>, 2020-07-06 12:33:50 -0700, , remove roomtext otherlevelclass since unused better delete way test see buggy,,
783,a698d3a6f8c8211b85fb88d7284e4ab51b085034,isa <infoteddyatgitgud@cock.li>, 2020-07-06 12:16:05 -0700, , remove unused var relating esc keybuffer keypoll attribute keyentered keybufferlen know intended,,
784,5eab43a65529e9e103f308c520277761829a072b,isa <infoteddyatgitgud@cock.li>, 2020-07-06 11:13:30 -0700, , initialize savedir leveldir case value happen used without initialized anything vaguely recall someone reporting issue document folder window level folder ended garbage path good,,
785,2716296a10426f8eadfa9609748df49aa2f11db3,than Lee <flibitijibibo@gmail.com>, 2020-07-08 14:43:04 -0400, , haiku keep option visible note bug,,
786,86fde7bf9958e1b28062e026d9b2b08dbad5a953,than Lee <flibitijibibo@gmail.com>, 2020-07-08 14:38:55 -0400, , vsync haiku hackery,,
787,d3f9a369415c1cf4959bfb03ac89a1ed895407b7,than Lee <flibitijibibo@gmail.com>, 2020-07-08 14:30:57 -0400, , refactor startup load config calling screen init,,
788,f8bb8cde326141cb410a9a219002f026e3941896,than Lee <flibitijibibo@gmail.com>, 2020-07-08 14:06:45 -0400, , hack disable vsync option haiku,,
789,09e15db87875fde905d6f986269708a525d49ca8,isa <infoteddyatgitgud@cock.li>, 2020-07-08 03:16:05 -0700, ," fix vitellary looking left one frame stay close ... bug cutscene play companion vitellary room stay close ... relevant gamestate gamestate vitellary call script int1yellow_4 vitellary say text box big ... thing wonder doe terry intended vitellary change facing direction left see command changedir yellow,0 original scripting changedir change dir attribute entity dir mean face left dir mean face right vitellary say maybe take back ship study terry intended face rightwards indicated changedir yellow,1 command unfortunately happens instead vitellary say first text box big ... thing wonder doe turn left precisely one frame afterwards back facing right second text box come around already facing right come well problem vitellary follow viridian overriding dir attribute vitellary say get close viridian vitellary already close enough stay put however still turn face part fix need put mode specifically say face left command changeai yellow faceleft way longer mode following viridian actually look left intended duration instead looking left one frame another problem cutscene end vitellary longer follows viridian mean make sense placed face left mode follow viridian mode merely visual problem vitellary supercrewmate game let player walk screen vitellary offscreen yet fix issue need put vitellary back follow viridian mode turn changeai command intended scripting crewmates entity type supercrewmates entity type command assumes want state number apply entity type even though one applies entity type state every state number make entity move inch specifying faceleft faceright state number luckily still pas raw state number changeai use intended name changeai yellow,0 set vitellary state number back come time make face right bonus added comment changed line semi obtuse method scripting always good clarify",,
790,5ce2c04ea4dc9c319d83f4367d28f4cff3297893,att Penny <mwpenny@users.noreply.github.com>, 2020-07-06 21:10:28 -0400, , fix prize reckless spike switching game mode spike removed game death time trial mode however removal accomplished modifying static array player switch death time trial mode switch back regular play spike longer present game restarted simple fix writes spike back static array game death time trial mode another option maintain static array one spike one without needlessly wasteful prone mistake one array updated ,,
791,e6f3dab2e104d41a5b2d9cfda91dd3c02d8fbc14,isa <infoteddyatgitgud@cock.li>, 2020-07-04 16:01:35 -0700, , make std string using script funcs pas around const reference make whenever string passed function longer needlessly copied,,
792,d480c1011c44f9cc8c587f0b5d0367dba454b9ae,isa <infoteddyatgitgud@cock.li>, 2020-07-04 15:59:21 -0700, , make scriptclass load rely std string instead comparing std string heavily templated use good sdl_strcmp,,
793,9398e9f1f0e95233fc402d2fc0f62d7b51ad5097,isa <infoteddyatgitgud@cock.li>, 2020-07-04 15:18:29 -0700, , remove duplicate talkgreen_2 script alarmon alarmoff command reason exact duplicate talkgreen_2 script alarmon alarmoff command idea cppcheck identified,,
794,fd0dafc16c1a9d3907c4aac62dbb69e3879e8c15,isa <infoteddyatgitgud@cock.li>, 2020-07-04 14:53:05 -0700, , duplicate graphic drawmenu graphic drawlevelmenu graphic drawmenu longer copy pasted code individual case instead individual case adding common code far easier maintain also difference graphic drawlevelmenu doe positioning stuff reason make whole separate function duplicate everything consolidated graphic drawmenu well added boolean draw menu way level menu,,
795,fbfeeaccd16c71d2b35f4546ab20c4e2f0bfc208,isa <infoteddyatgitgud@cock.li>, 2020-07-03 21:48:07 -0700, , use sdl_tolower instead libc tolower compare_nocase avoid depend libc much possible,,
796,8366e08fbe4e60bd35ef999c24da319771a01c8d,isa <infoteddyatgitgud@cock.li>, 2020-07-03 21:30:31 -0700, , remove usage std string menuoption instead string menuoption buffer 161 char char 160 byte largest possible utf character size plus null terminator maximum length menu option fit screen without going past char,,
797,5fb0b4396a70746491c98b01c81f68511ea1fb66,isa <infoteddyatgitgud@cock.li>, 2020-07-03 14:54:23 -0700, , remove use std transform use sdl_toupper lower need use template manually call sdl_tolower sdl_toupper needed yeah use sdl_tolower sdl_toupper instead libc tolower toupper,,
798,36e38027d844d6e95d4677760526d2fd2ce2b452,isa <infoteddyatgitgud@cock.li>, 2020-07-03 03:23:54 -0700, , simplify m_headers init hardcode 128 know one realized loop poorly initialize m_headers basically unnecessary memset used instead well except also replaced sdl_memset besides point also decided hardcode 128 thing case people want fork source code make build changed,,
799,fc03fca8387c21ed1ae45f3ccac84cb68f8242e8,isa <infoteddyatgitgud@cock.li>, 2020-07-03 03:13:15 -0700, , turn super patron githubfriends array move new file originally wanted keep game turn initialize game.cpp compiler complain file know actually inside array initialize game.h want initialize game.h mean recompiling lot unnecessary file whenever someone get added credit moved patron superpatrons github contributor new file credits.h contains list credit max position calculation way whenever someone get added minimal amount file need recompiled,,
800,a80502bdc9360ce09c8926ef17bef4677469d53e,isa <infoteddyatgitgud@cock.li>, 2020-07-03 02:54:31 -0700, , turn ed.contents vmult array always size need vector also made number element ed.level kludgewarpdir controllable maxwidth maxheight removed editorclass saveconvertor want convert treat ed.contents like array unused way testing plus also unused matter might well get rid,,
801,067fbc75f0a8b79815013bb132cfacf1f04bc063,isa <infoteddyatgitgud@cock.li>, 2020-07-03 02:40:57 -0700, , turn fadebars array always need vector,,
802,78181bc6767d54fd5d1193bececc74a7aa72c495,isa <infoteddyatgitgud@cock.li>, 2020-07-03 02:37:53 -0700, , statically allocate string utilityclass number slightly bothered statically allocated ,,
803,5f91bdd073510c9882c6894eaeec4f5d2402cfc7,isa <infoteddyatgitgud@cock.li>, 2020-07-03 02:37:15 -0700, , turn splitseconds array always need vector,,
804,00cb0335942ac7258361eb50d542e3fcc813991f,isa <infoteddyatgitgud@cock.li>, 2020-07-03 02:33:33 -0700, , turn array instead vector easiest vectoring yet,,
805,450cf1a31e2fb60e1a81020ad4aa43df2e31c982,isa <infoteddyatgitgud@cock.li>, 2020-07-03 02:31:13 -0700, , turn star backbox vector array always star always backboxes reason vector,,
806,4c6ab6e6b7d65a5c8c5132166519bb9125cf9e9b,isa <infoteddyatgitgud@cock.li>, 2020-07-03 02:20:07 -0700, , remove unused var graphic unused var graphic bfontmask_rect graphic background graphic bfontmask im_bfontmask seems graphic background indexed graphic drawbackground reality never anything vector thus actually using would cause segfault,,
807,adca6a122a3c3c26cc136a8ca4bea824599c98d5,isa <infoteddyatgitgud@cock.li>, 2020-07-03 02:16:18 -0700, , turn tower vector plain array also array statically allocated forgot statically allocating thing earlier better late never,,
808,9dcda179785c5c7e382f3daa4555e4268db227ec,isa <infoteddyatgitgud@cock.li>, 2020-07-03 02:06:46 -0700, , turn map.contents plain array map.contents always 1200 tile reason vector big commit requires changing level class return pointer array instead returning vector took figure eventually tested make sure problem,,
809,a1d4523177742a3a81548c3293c3fbb263cd6bd3,isa <infoteddyatgitgud@cock.li>, 2020-07-02 21:13:23 -0700, , turn areamap plain array one make static data member initialize certain way map.cpp pretty cool able ,,
810,cb3afa295a997ebc4b1acaf2916335ad1346325d,isa <infoteddyatgitgud@cock.li>, 2020-07-02 21:01:09 -0700, , turn map.explored map.roomdeaths final plain array always fixed size anyways need vector also used new inbounds_arr macro map.explored bound check script.cpp made map.explored proper bool array instead int array,,
811,118008d824b00111234d9c2fdab0d25db88a057d,isa <infoteddyatgitgud@cock.li>, 2020-07-02 19:35:21 -0700, , move temp temp2 utilityclass remove globaltemp reason temp variable class,,
812,6b23244366a455e8bc10aa81ff4790b28049db60,isa <infoteddyatgitgud@cock.li>, 2020-07-02 19:28:35 -0700, , move temp variable editorclass basically reason exist class usage variable replaced temp2 instead temp already temp variable function used ,,
813,524a535c62383efb1b43d65d7ae4fc379ef905a5,isa <infoteddyatgitgud@cock.li>, 2020-07-02 19:20:22 -0700, , move temp temp2 mapclass reason temporary variable need exist class exist,,
814,0664eac7fc6b6d50b19f25a38ba3f69b5eeb579c,isa <infoteddyatgitgud@cock.li>, 2020-07-02 19:17:32 -0700, , turn obj.collect plain array since always fixed size need vector also added inbounds_arr macro bound check plain array,,
815,62203efb2c2c94329b8c642cbaa5ecbd028e1131,isa <infoteddyatgitgud@cock.li>, 2020-07-02 18:22:19 -0700, , turn obj.flags array instead vector since always fixed size reason vector,,
816,1258eb7bf4451c407631a6568889c8d8b42935a9,isa <infoteddyatgitgud@cock.li>, 2020-07-02 18:10:52 -0700, , turn crew rescued mood vector array since always fixed size need dynamically sized vector entityclass customcrewmoods proper bool instead int replaced hardcoded constant static const int game attribute make easier change,,
817,cd3869f974fab057db857e5bb318051ecfada306,isa <infoteddyatgitgud@cock.li>, 2020-07-02 17:09:30 -0700, , turn time trial stat vector plain array besttimes besttrinkets bestlives bestrank attribute game bestframes already plain array always fixed sized reason vector also put size static const int easy change many,,
818,56f06bd853b5614e9f8d7655a290be3f3aebb837,isa <infoteddyatgitgud@cock.li>, 2020-07-02 16:58:58 -0700, , duplicate use macro loading thing plain array since basically code time might well macro instead,,
819,3f448ce439fc5a3c445dea3833eeb3c130c951c6,isa <infoteddyatgitgud@cock.li>, 2020-07-02 16:45:22 -0700, , turn unlock unlocknotify plain array always fixed size need dynamic vector changed type bool need int also replaced hardcoded constant least name case people want change future,,
820,c3e7ddca9c5e77651234550fda140d26c4faee45,isa <infoteddyatgitgud@cock.li>, 2020-07-02 16:09:55 -0700, , add bound check scriptclass tokenize could index word array bound argument command like would ever happen still good sure,,
821,c7774a3eb9bd52d832678d2aae6625443273ff7b,isa <infoteddyatgitgud@cock.li>, 2020-07-02 16:07:35 -0700, , turn word array instead std vector never change size need dynamically sized vector,,
822,689af992201bd6a656ca09b4a5ac2c457bb0630c,isa <infoteddyatgitgud@cock.li>, 2020-07-02 16:04:51 -0700, , make currentletter char instead std string one character ... doe fully fledged std string,,
823,56b2f43ff866949cccb7f455484ac7dea95b6ce5,isa <infoteddyatgitgud@cock.li>, 2020-07-02 16:03:40 -0700, , move tempword currentletter scriptclass reason temporary variable permanent part class,,
824,f28fcd78e823470f592c081f0ad69edfb39d82bf,isa <infoteddyatgitgud@cock.li>, 2020-07-04 22:55:21 -0700, , fix softlock interrupted completestop summary got gamestate 1002 1012 without advancetext completestop basically softlocked add gamestates advance gamestate advancetext,,
825,d06fadadf291ec227d46a3f61d20ef46945c9828,isa <infoteddyatgitgud@cock.li>, 2020-07-04 22:23:13 -0700, , fix map.cpp relying editor.h include script.h would mean no_custom_level build compile,,
