id,sha,author,date,issue,message,file,content
0,3ca7b09012d10fd19393d237ff3d93e3abe9c22c,isa <infoteddy@infoteddy.info>, 2021-06-15 19:18:58 -0700, , fix regression quick stopping changing drawframe fix regression desyncs nova removing frame input delay quick stopping simply holding left right frame viridian decelerate let immediately stop place code call tapping quick stopping better name immediately counter strafe stop decelrating first place work code sequence event 2.2 previous look like gameinput quick stopping set gamerender change drawframe depending gamelogic use drawframe collision ignoring intermediate period whole loop order wrong sequence event 2.3 look like gamerenderfixed change drawframe depending gamerender gameinput quick stopping set gamelogic use drawframe collision mind become numb pain mean player movement stuff completely except drawframe going different unfortunately overlooked gameinput set animateentities gamerenderfixed check although fair pretty dumb decision make collision detection based actual sprite pixel instead hitbox first place expect end dumb parade maybe know solution done added duplicate framedelay drawframe walkingframe collision use get updated gamelogic gameinput could set kept original framedelay drawframe walkingframe around keep visuals closely possible however due removal input delay whenever quick stop sprite wrong frame let direction key game set logical drawframe update reflect previous frame know advance release key next frame visual drawframe assume keep holding key whereas 2.2 release direction key player position update reflect next frame current frame immediately recognize update drawframe instead retconning later basically visual drawframe assumes keep holding key take value collision drawframe anyway okay visual anyway collision drawframe next frame release key drawframe frame release key 2.2 really care try fix enable input delay minor complicated,,
1,f77723d12f81041d59d6c2bace9e806d6af9d37f,reacherousfiend <46549454+treacherousfiend@users.noreply.github.com>, 2021-07-25 18:33:41 +0000, , update project generation snippet project generation code snippet currently still reference sdl2 2.0.10 even though building requires 2.0.14 minor nitpick part,,
2,95ffc3a62bb91b6f6f86f69e129ce9e2b005acf4,isa <infoteddy@infoteddy.info>, 2021-06-26 12:56:35 -0700, , fix wrong bound check colliding activity zone stupid,,
3,88d31ab3b6dab54d4bc94ca035eaf6174b6fc673,isa <infoteddy@infoteddy.info>, 2021-06-19 10:19:07 -0700, , custom level count inbounds trinket crew past people reported glitched level get trinket star complete level number trinket crewmates one higher obtained level happen well turn place entity resize level smaller entity still exists inconsequential entity entity trinket crewmate entity still counted towards number trinket crewmates level one fix would remove entity whenever level downsized someone accidentally downsizes level want back entity gone plus would inconsistent tile tile get removed downsize level also fix existing level people managed place trinket crewmates bound instead ed.numtrinkets ed.numcrewmates simply ignore trinket crewmates outside playable area way level glitched trinket crewmates still completed still completed trinket star,,
4,571f6a70985e453785abc4235c8c6bab96d532e5,isa <infoteddy@infoteddy.info>, 2021-06-17 23:25:27 -0700, , add playtesting passthrough code block non separate interact fix regression unable activate activity zone editor playtesting interact button separate map button originally 743 option set bind non separate removed logic without adding check added option overlooked code regression happened whoop,,
5,43e8d31aa9be31957d502d30c9da4cf105b0982e,than Lee <flibitijibibo@gmail.com>, 2021-06-14 15:11:39 -0400,764, music enforce quick fade time soon know happening every music path trip quick_fade bool reset timer 500ms need soon asked fix fade quitting main menu fix 764,,
6,85205332969b03a0182c3f2aad2687195d18b840,than Lee <flibitijibibo@gmail.com>, 2021-06-14 15:09:23 -0400,764, music reset step_ms every fade call without end two problem fade start past fade time causing fade fade start middle fade time causing dramatic change volume unintentional fade system already preserve volume music playing previous fade always reset timer get good result part 764,,
7,a0c572428364b50084152c3af15762c5d1ecf552,isa <infoteddy@infoteddy.info>, 2021-06-14 11:44:00 -0700, , set visualonroof visualonground vertical platform fix one two desyncs nova problem adding two frame edge flipping vertically moving platform viridian framedelay updated one extra frame step vertically moving platform mess viridian drawframe rest die drawframe sensitive trick solution set visual onroof onground instead logical onroof onground still player still two frame edge flipping vertically moving platform really look like could easily tell anyway,,
8,67d1d6f01dc6c33c88dd7d8973e67c7e5d0455b2,erry Cavanagh <terrygcavanagh@gmail.com>, 2021-06-14 13:04:44 +1030,778, merge pull request 778 infoteddy general bug fix use hiddenname hardestroom roomname empty,,
9,9188bd23d3262fe6173f36aef74a130cd0aefa20,triker.sh <strikersh@disroot.org>, 2021-06-13 13:33:26 +0200, , support openbsd use fseeko ftello like freebsd tinyxml2 use current directory basepath null openbsd actually support feature disabled via patch port,,
10,c02bd9235fca8d3308346fc88b2be4c0e9a33139,isa <infoteddy@infoteddy.info>, 2021-06-12 15:19:15 -0700, , outline text outline text draw backing order help player spot difference outlined text non outlined text outline text outline text text outline enabled course drawing outline alone stand enough draw solid backing text well order properly show contrast,,
11,9c226ab5aad4008f213c16cdf2ddafdadab29d95,isa <infoteddy@infoteddy.info>, 2021-06-12 15:33:44 -0700, , play viridian squeak using return button audio option reason button missing viridian squeak,,
12,3b6c0befb181b783303dbf75363bf767072dee42,isa <infoteddy@infoteddy.info>, 2021-06-12 14:02:08 -0700, , fix able start flipped time trial fix regression able start flipped restarting holding action happens game reset variable turn hascontrol back hardreset however handled input function handled player input handled player able get frame able flip time trial reset happen 2.2 resetplayer 2.2 would set lifeseq player died however inconsistent loading game first time would result lifeseq 10. 2.2 restarting time trial would remove frame able flip lifeseq 2.3 set lifeseq player died could fixed setting lifeseq time trial restart code decided set hascontrol false instead fix 770,,
13,1d66cfccabb2c9e5ef4129451543d2cdd694676b,erry Cavanagh <terrygcavanagh@gmail.com>, 2021-06-12 22:35:31 +1030,777, merge pull request 777 infoteddy general improvement outline time trial countdown,,
14,2efe7724a71df962b426ebf1d0200f92e74f3f19,erry Cavanagh <terrygcavanagh@gmail.com>, 2021-06-12 22:35:07 +1030,775, merge pull request 775 infoteddy general bug fix interpolate gravitron square indicator,,
15,b07d92ac44afa54a596cc9f2f4f79c80a9151f2d,erry Cavanagh <terrygcavanagh@gmail.com>, 2021-06-12 22:33:37 +1030,776, merge pull request 776 infoteddy general bug fix explore room entering secret lab,,
16,b06b278bb07de6d0a6d5a6745a6ba08084b123b0,erry Cavanagh <terrygcavanagh@gmail.com>, 2021-06-12 22:33:17 +1030,774, merge pull request 774 infoteddy general bug fix prevent losing level data rollcredits,,
17,fa3021c7147348c41df515b5bb5980f722d3b942,erry Cavanagh <terrygcavanagh@gmail.com>, 2021-06-12 22:32:36 +1030,773, merge pull request 773 infoteddy general bug fix fix able see box corner map screen custom graphic,,
18,eb0b7c8e872de05f72fcc9140b930be32f57a51b,erry Cavanagh <terrygcavanagh@gmail.com>, 2021-06-12 22:31:50 +1030,772, merge pull request 772 infoteddy general bug fix fix inconsistency controller keybind option,,
19,da22d395bbf31255402703f1059974fb62b149fc,erry Cavanagh <terrygcavanagh@gmail.com>, 2021-06-12 22:31:26 +1030,771, merge pull request 771 infoteddy general bug fix play viridian squeak editing level desc field,,
20,d292b64c6dbe7778b5440d4d206d0f4b963ec1b1,isa <infoteddy@infoteddy.info>, 2021-06-11 23:58:18 -0700, , use hiddenname hardestroom roomname empty earlier 2.3 roomname empty dimension vvvvvv used instead however instead better use hiddenname instead hardcoded room hidden name dimension vvvvvv,,
21,f205147eaae16f2b946e71606fc664b587862412,isa <infoteddy@infoteddy.info>, 2021-06-11 23:56:33 -0700, , outline time trial countdown make text much readable certain background text outline enabled especially warp zone background start,,
22,6dd01495f3b965d299f403ff1c406fe82aeac340,isa <infoteddy@infoteddy.info>, 2021-06-11 22:31:40 -0700, , explore room entering secret lab enter secret lab title screen room explored however enter secret lab via secret lab entrance cutscene epilogue room explored inconsistent sdl_memset entersecretlab script command,,
23,d404986e6fe5cf484fedfae9428872b56b2cf325,isa <infoteddy@infoteddy.info>, 2021-06-11 22:28:34 -0700, , use memset give trinket explore room sdl_memset conveys intent better snappier using loop also using sdl_memset explore room future proof case size map.explored change future conducive optimization however variable explicitly set previously used much better explicitly set rather subtlely hidden inner loop initialization,,
24,37fd24bd85618938881eb7a2e6c4db39096d2d05,isa <infoteddy@infoteddy.info>, 2021-06-11 22:20:06 -0700, , interpolate gravitron square indicator future proofing anything else position indicator position gravitron square divided gravitron square always ever move pixel per frame distance indicator travel frame ever pixel case future gravitron square become faster pixel per frame indicator interpolated well,,
25,6767249558cb58ba1b82ac61714760220db0cbd2,isa <infoteddy@infoteddy.info>, 2021-06-11 15:30:29 -0700, , prevent losing level data rollcredits rollcredits ran editor playtesting unsaved data lost prevent return editor rollcredits ran note saying rolled credit,,
26,47460143e2b1e027853af74c228e00e75f326d65,isa <infoteddy@infoteddy.info>, 2021-06-11 15:07:08 -0700, , fix able see box corner map screen custom graphic text box drawn bottom map screen wide enough possible see corner right side text box custom graphic like solution increase width text box one tile,,
27,74bbf45fa73277d326012643954292c246517b8c,isa <infoteddy@infoteddy.info>, 2021-06-11 12:56:07 -0700, , play viridian squeak updating controller keybinds consistency viridian squeak played whenever user update controller keybinds,,
28,d25243943e27f07fafdb532f526c9c4d2e91c418,isa <infoteddy@infoteddy.info>, 2021-06-11 12:54:36 -0700, , save setting changing controller keybind game automatically writes setting disk setting changed whenever user change controller keybinds,,
29,1ccf85a26090005b2fa2c5af1bc8694607ba606e,isa <infoteddy@infoteddy.info>, 2021-06-11 12:52:28 -0700, , play viridian squeak editing level desc field consistency viridian squeak play whenever start editing level description field finish editing either pressing esc enter,,
30,96660cd235d24b2b2521e3ea1dfe0b2ba5c0d065,isa <infoteddy@infoteddy.info>, 2021-05-20 14:20:05 -0700, , add zip structure check user friendliness level zip named levelname.zip level file inside must also named else custom asset work mount zip file simply add level directory whenever load look filename remove extension look asset inside zip name levelname.zip result someone make level zip asset mismatch filename asset load furthermore someone add extra level zip asset load well could confusing make thing crystal clear user filter zip incorrect structure like print message terminal unfortunately nothing get shown non terminal user least filtering zip confusing letting issue mentioned,,
31,153a5c4c3a7fdb73c3672d67a3de083dc3946100,isa <infoteddy@infoteddy.info>, 2021-05-20 14:14:08 -0700, , factor calculation macro func big comment describing magic number needed grab filename string look like level filename.vvvvvv instead write comment every time similar happens written macro helper function instead doe thing clearly conveys intent mean look diff using vvv_between much better read comment corresponding sdl_strlcpy,,
32,29d2637abd7a4db2f3087457092ef6af03a1a1ae,isa <infoteddy@infoteddy.info>, 2021-05-20 14:12:51 -0700, , factor unused macro header file used file without copy paste define,,
33,3bcb6938f714494fd3affc8e47e3f06abba08a5e,isa <infoteddy@infoteddy.info>, 2021-05-20 14:10:45 -0700, , factor base generation separate function reused without copy paste generatebase36 guaranateed completely initialize null terminate buffer passed,,
34,766782da5dc00505da1e5f338d64d04188130033,erry Cavanagh <terrygcavanagh@gmail.com>, 2021-05-25 13:05:07 +1030,749, merge pull request 749 infoteddy general bug fix fix tower camera invincibility inconsistency,,
35,417b7d656dda79ae15cd52439e6512c75199d543,isa <infoteddy@infoteddy.info>, 2021-05-23 21:57:59 -0700, , set newxp newyp creating player fix bug player position would incorrect loaded save conveyor first time loading since game opened first load game creates new player entity subsequent load game player entity subsequent load use mapclass resetplayer already newxp newyp fix first time game doe set newxp newyp set newxp newyp like mapclass resetplayer,,
36,73c1c9a7980cd058de396e0425c866ede7874286,than Lee <flibitijibibo@gmail.com>, 2021-05-20 23:01:43 -0400, , revert change final stretch song piercing sky upon discussion decided keep soundtrack originally shipped instead changing fact reverts commit,,
37,8b3c805bc0a83c5551bd4d05595e516a19257af3,isa <infoteddy@infoteddy.info>, 2021-04-29 23:16:31 -0700, , fix super gravitron pattern oversight pattern super gravitron meant staircase similar gravitron intermission something like      unfortunately due oversight pattern ever produce square square look place gravitrons state machine course state super gravitron staircase pattern state spawn square left state spawn square right way state reached state way state reached state way state reached state state variable used keep track amount square spawned swnstate4 however state end using swnstate4 end state swnstate4 end state swnstate4 mean state coming state get square state coming state get square clearly filed failure reset appropriate state solution reset swnstate4 state square intended also fix bug state well affected manner,,
38,448e34e8787d3daeadab99d742e32c25366a7014,isa <infoteddy@infoteddy.info>, 2021-05-20 13:44:06 -0700, , save showtargets main game save file fix oversight could lead confusion player showtargets variable show unexplored teleporters map question mark player know head make progress however previously directly saved main game file instead would set true flag turned save file well doe flag correlate showtargets well script turn showtargets bigopenworld turn neither doe completing space station flag turned player activates violet activity zone first time therefore entirely possible new player could complete space station save game come back resume playing later come back question mark violet told show minimap confused may know  completely unintuitive know order get question mark show talk violet save game reload save especially since question mark show reload save talk violet flag proxy showtargets actual variable solution save showtargets save file directly,,
39,bc382a4985a97428c78807653b3c011670700a4c,isa <infoteddy@infoteddy.info>, 2021-03-28 12:53:08 -0700, , fix tower camera invincibility inconsistency invincibility enabled tower camera behavior inconsistent ascending tower push camera upwards however push downwards least stay still come stay still descending tower camera move quicker bottom screen slower falling speed quickly loses sight camera pushed upwards unfortunately also doe bumping motion standing still camera reach get real annoying particularly pleasant look two problem doe two fix pushing camera applies appropriate counter offset depending direction tower push camera downwards ascending tower fix bumping camera reach stand still pixel high gray area top bottom screen camera simply move camera offset instead simply canceling movement player offscreen bit ugly ... work,,
40,330162d1cbbcda2f1a86aeda3debbf624c161c67,erry Cavanagh <terrygcavanagh@gmail.com>, 2021-05-19 17:54:52 +1030,743, merge pull request 743 infoteddy general improvement separate pressing enter open map pressing enter interact,,
41,4fa435f78409ad46a89b672582ac64a0f1105ada,isa <infoteddy@infoteddy.info>, 2021-04-18 23:23:44 -0700, , separate pressing enter open map pressing enter interact lot copy pasted code little bit copy pasting never hurt anyone ... keybind interact activity zone teleporters separate keybind open map return editor editor playtesting restart time trial keybind default controller bind controller button prompt game controller button prompt anyways whatever people muscle memory going broken able spam map keybind anymore least help bit changing keybind keep spamming muscle memory going broken anyways option enabled going speedrunner menu option selecting interact button disabled default prompt text need string interpolated every time drawn possible people change interact button use middle gameplay via game option close 736,,
42,92416cd91081797b681698f405cdd3dca93428e5,isa <infoteddy@infoteddy.info>, 2021-03-23 14:29:32 -0700, , update crewmate color text box every deltaframe color fps mode updating every deltaframe mostly ensure determinism switching mode mode going overhaul rng 2.4 anyway right going fix missed rng special text box stored temporary variable text box updated color hence big statement lot code duplication acceptable ,,
43,d749e7e6e81da5605e9cae8520871a12c2a7f47a,erry Cavanagh <terrygcavanagh@gmail.com>, 2021-05-17 18:56:32 +1030,682, merge pull request 682 infoteddy general bug fix add finalmode check drawfinalmap call,,
44,569403b7e278ead583815c4845b8d7f430ee6b2e,erry Cavanagh <terrygcavanagh@gmail.com>, 2021-05-17 18:55:52 +1030,681, merge pull request 681 infoteddy general bug fix remove assignment entering minitowers,,
45,cf51379097d8b80f4550d6fdb345577b452f6740,isa <infoteddy@infoteddy.info>, 2021-05-16 22:57:36 -0700, , change final stretch song piercing sky dimension destabilizes song play positive force already played twice game point first tower gravitron since piercing sky unused play song player heard would also musically fitting scenario song get played two place one cutscenes enabled one need change  asked terry discord wanted change approved ,,
46,f31b57a6fc100f8ffd77f4cf4391825ac482ed0d,isa <infoteddy@infoteddy.info>, 2021-05-16 17:58:34 -0700, , fix deltaframe glitch spawning death mode trophy completed death mode entered master universe trophy room secret lab fps mode would appear start one position quickly zipping another deltaframes update position initial assignment lerpoldxp lerpoldyp entityclass createentity entity done copy paste lerpoldxp lerpoldyp update alongside update however instead single case patching deltaframe glitch opted fix case simply moving lerpoldxp lerpoldyp assignment end function guaranteeing entity update position initial assignment function deltaframe glitch course still duplicate lerpoldxp lerpoldyp update entityclass updateentities ... sure,,
47,85bd009dce56af129731e0bd8df65e46a16523d7,erry Cavanagh <terrygcavanagh@gmail.com>, 2021-05-15 08:08:54 +1030,758, merge pull request 758 infoteddy general bug fix allow using esc super gravitron quit menu,,
48,21dc90dd0ea3cf5eee728179c4c60bedcc5db67f,isa <infoteddy@infoteddy.info>, 2021-05-11 20:03:11 -0700, , fix frame glitch returning game option flip mode flip mode enabled exiting game option game would flash game option menu flipped frame returning pause menu fix defer flip mode variable assignment done end frame,,
49,884d562a63b3ab5f022ba0804edc398da463b494,isa <infoteddy@infoteddy.info>, 2021-05-06 11:58:38 -0700, , allow using esc super gravitron quit menu small quality life fix vein allowing player press esc teleporter menu able 2.2 either,,
50,3c5ee78e8aa0b14fe131da597852c73e21d4b899,isa <infoteddy@infoteddy.info>, 2021-03-25 17:40:50 -0700, , add finalmode check drawfinalmap call fix finalstretch tile shifting persisting return main dimension final_colormode reset properly possible main game using teleporter finalmode intermission companion active custom level level maker make setup automatically turn finalstretch finalmode return main dimension thing ... level maker tile shifting really seem useful one ever used setup really found documented year one exact shift randomized every time frandom call cycle color two away player save reloads level three animate like doe finalmode biggest reason imo nevertheless decided keep support custom level case someone future doe want use okay limitation,,
51,a714a01e3e235c0ff45af1fbcf5cd6f44475c104,isa <infoteddy@infoteddy.info>, 2021-03-25 14:59:49 -0700, , remove assignment entering minitowers bit inconsistency long color last final stretch initially color last frame enter either minitowers color switch lasting frame make frame make frame get set whenever enter minitower seems like oversight affect anything inside minitower get saved save file always get set save file finalstretch set true saving reloading set color back frame get set back leaving minitowers,,
52,673699cef5846b835528936f22b070f689af0c6b,isa <infoteddy@infoteddy.info>, 2021-05-03 19:12:30 -0700, , enable returning secret lab immediately super gravitron enter super gravitron wait super gravitron actually start able press enter return secret lab annoying want get back secret lab made press enter return functionality enabled moment super gravitron start,,
53,52dc914a312697ee09d2cf36d709a0ff9130fa75,isa <infoteddy@infoteddy.info>, 2021-05-03 19:30:28 -0700, , allow setting best game death custom level custom level touch main game save data best game death exception also added makeandplay ifdef safe,,
54,a52547b60dd15fc9d1cdbc1685b79d05bf1fbed1,isa <infoteddy@infoteddy.info>, 2021-05-03 19:19:22 -0700, , allow setting super gravitron record custom level custom level affect main game save data super gravitron record exception also added makeandplay ifdefs safe,,
55,4e0484553d3668c118746b684edf152449e370fe,isa <infoteddy@infoteddy.info>, 2021-05-03 18:57:13 -0700, , move secret lab nocompetitive check super gravitron turn despite game attempting prevent using invincibility slowdown super gravitron simply preventing entering secret lab menu still possible enter super gravitron anyways invincibility slowdown enabled enter game normally talk victoria trinket start epilogue cutscene yeah pretty big gaping hole right ... also possible trick speedrunners use called telejumping secret lab bypass invincibility slowdown check rather single case patch going fix generally possible moving invincibility slowdown check gamestate start super gravitron gamestate invincibility slowdown enabled immediately get sent back secret lab however check ignored custom level custom level may want use super gravitron let player invincibility slowdown fact custom level wild use super gravitron like one first thing done people discovered internal scripting message pop game sends back secret lab message popped secret lab menu option disabled previously first place made anything worse per nice effect invincibility slowdown enabled still able secret lab menu useful want check trophy leave without way disable invincibility slowdown inside,,
56,b3c2f56c79e1da6adf8ab7715a11f4b8a2957f77,isa <infoteddy@infoteddy.info>, 2021-05-03 18:29:23 -0700, , factor slowdown invincibility conds function factor slowdown invincibility conditionals function mean copy pasted code also conveys intent want allow competitive option either cheat enabled function implemented header would include map.h transitive includes evil although ought game instead mapclass due 2.2 previous argument passing bunch variable reshuffling done later,,
57,96488d27c8f1d2bbd021c683adb99fc5dd5c75e8,isa <infoteddy@infoteddy.info>, 2021-05-03 18:22:59 -0700, , factor secret lab time trial ndm conds function factored inline function named incompetitive usage changed without change individual one every place also clarifies intent using conditionals competitive mode,,
58,9f603ea3fec9ede2f778ab2687083f23b087ae5d,isa <infoteddy@infoteddy.info>, 2021-04-22 18:47:07 -0700, , consolidate tower bypos bscroll assignment tower background bypos bscroll bypos position background bscroll amount pixel scroll background frame used scroll redrawn linear interpolation tower background title background bypos map.ypos bscroll map.ypos map.oldypos however usually bscroll get assigned time bypos incremented decremented never see calculation explicitly except previous commit worked calculation change position known constant calculation every time introduces possibility error forget wrongly even worst could cause linear interpolation glitch decide overwrite bscroll without taking account map.oldypos map.ypos adding function automatically update tower background using value map.oldypos map.ypos used every time map.ypos assigned way write code sure place forget calculation least glaringly obvious wrongly play nicely linear interpolation also replaces every instance manual calculation done new function,,
59,5c3fbd0022164133c6486799348af519597472b4,isa <infoteddy@infoteddy.info>, 2021-03-28 12:53:08 -0700, , fix background smearing pushing tower camera invincibility invincibility enabled push camera background would smear game calculate proper bscroll bypos tower background also end redrawing thing fixed,,
60,7c55b449e00df0109d0940033f3667c9ab8e9b47,isa <infoteddy@infoteddy.info>, 2021-04-22 20:27:45 -0700, , fix two place map.oldypos assigned place assign map.oldypos assigned map.ypos could resulted visual glitch good consistent proactively fix,,
