id,sha,author,date,issue,message,file,content
1187,815a48c02501ef959c0dbe7924d94a1dd0b9467e,isa <infoteddyatgitgud@cock.li>, 2020-05-18 10:37:00 -0700, , refactor scripts.cpp longer hold string function args instead line held const char array like result work compiler especially optimization since every time compiler encounter constant argument function locate place put upfront say hey string ever need conveniently packaged one place much cooperative,,
1188,9205421090fa2686056f8b7b996c3a5553a8101e,isa <infoteddyatgitgud@cock.li>, 2020-05-18 10:14:12 -0700, , clean editorclass extern one location like previous commit put header file respective class instead mess everywhere,,
1189,3a5dd5a616e2924908fe991da014d46f695862c2,isa <infoteddyatgitgud@cock.li>, 2020-05-18 10:12:11 -0700, , clean scriptclass extern one location feeling none devs understood extern kind sprinkled everywhere thing started working like class one line class respective header file messy,,
1190,7afe206a0d35b67f2c4aa3c5bed4c13b2de9c32d,isa <infoteddyatgitgud@cock.li>, 2020-05-18 10:09:57 -0700, , fix indentation scriptclass loadcustom indented tab like rest file furthermore two indentation level knocked,,
1191,fcea247c439ea6efa7651a2f0dbe85f41af6575e,isa <infoteddyatgitgud@cock.li>, 2020-05-18 10:08:34 -0700, , move custom script parser function scriptclass load large enough function need trouble shoving custom script parser well,,
1192,4301a70f2d39146f620b8c66065eeaee3a4ce8ce,isa <infoteddyatgitgud@cock.li>, 2020-05-21 19:23:21 -0700, , remove unnecessary middleman ed.swapmap game load room custom level previously would load tilemap room ed.swapmap mapclass loadlevel would manually element ed.swapmap set tile content return vector editorclass loadlevel set directly ed.swapmap really unnecessary,,
1193,6913abb1713264bb2f4a338aad979744f881d4f2,isa <infoteddyatgitgud@cock.li>, 2020-05-20 23:30:52 -0700, , refactor superpatrons patron githubfriends push_back string bit bad compiler lot function call hardcoded string every time compiler encounter one way find dedicated storage location string really inefficient doe inefficient thing every single time much impact compiling list least want encourage sort code style instead push_back string style case ever need hardcoded array thing later,,
1194,b5a009f2e2e0fe865c939b297a36755a1fd570f7,isa <infoteddyatgitgud@cock.li>, 2020-05-19 21:32:53 -0700, , reset game.act_fade scriptclass hardreset resetting fix triggering undefined behavior quit menu standing inside activity zone entered game resetting game.act_fade also fix activity zone prompt fadeout happens segfault fixed worry activity zone like variable teleporter prompt trophy text already covered obj.trophytext reset scriptclass hardreset reset every time mapclass gotoroom called mapclass gotoroom called every time gamemode started,,
1195,a10265787df604e870c8b87748204470acc7cb18,erry Cavanagh <terrygcavanagh@gmail.com>, 2020-05-20 13:13:56 +1030,143, merge pull request 143 infoteddy general bug fix add draw one row room room name,,
1196,4d0e1549a54c5383acf095d04903ea7918ffab8d,isa <infoteddyatgitgud@cock.li>, 2020-05-19 18:18:01 -0700, , allow crewmate cyan initially placing reason way get cyan crewmate cycling already existing crewmate keeping left clicking cycle crewmate color allowed color place crewmate pick random color seems bit consistent placing cycling crewmate use color range,,
1197,99562075c53eb41cf0b575a63d75a5380d04bdb1,isa <infoteddyatgitgud@cock.li>, 2020-05-19 18:09:47 -0700, , draw game paused blackout mode blackout mode work properly game actually black screen merely stop drawing thing thing thing still drawn result freeze frame effect apparently fixed switch version custom level utilize freeze frame effect bit annoying game paused screen draw top make freeze frame freeze game paused blackout turned making game paused get drawn blackout mode however still graphics.render otherwise result black screen,,
1198,4034c228336d3d19c7ab58380bf10895092e4784,isa <infoteddyatgitgud@cock.li>, 2020-05-19 17:20:46 -0700, , add bound check roomdeaths roomdeathsfinal fix able trigger undefined behavior pressing bound outside dimension vvvvvv map usually falling upwards towards game complete also put bound check normal roomdeaths good measure never know need,,
1199,e795fbb511d9c16aa993de13016e6eb24f2e89eb,isa <infoteddyatgitgud@cock.li>, 2020-05-19 16:41:29 -0700, , simplify inits reset entityclass mapclass instead using somewhat obtuse loop initialize reset vector take line code clearer use std vector resize std vector clear instead,,
1200,291d358b7eeff208f6c5dcdad98f52443fd9c433,nfo Teddy <infoteddyatgitgud@cock.li>, 2020-02-03 13:24:30 -0800, , add draw one row room roomnames since translucent roomname background introduced terrycavanagh vvvvvv 122 expose one glaring flaw game kept hidden room room name game cheapens tile data 30th row room name would hide missing row result room room name row instead fill entire screen look really weird nothing empty space behind translucent room name background remedy added one row room room name level first filter room room name however actually contained otherlevel.cpp overworld contains 221 room secret lab ship 207 actual overworld right wrong overworld roomname room lab actually 205 overworld room remaining level data file contain room room name process easy noticed ago room contains tmap.push_back one row room row simply string containing tile row concatenated comma however decided actually check intuition grep level file counting number result example grep push_back labclass.cpp whatever number come divisible particular grep labclass.cpp return 1306 divided remainder doe mean doe mean room leftover row well exactly extra row come fact outer space row instead 29. outer space room come game find room non existent happen properly working game except outside dimension vvvvvv fact level file outer space every single outer space also room really mean room lab one outer space room well reality room lab use outside tileset room name stored otherlevel.cpp instead find result warp zone grep push_back warpclass.cpp return 697 remainder meaning room row room row corresponds room warp zone one outer space room however outside dimension vvvvvv tower hallway space station odd curiosity finalclass.cpp contains outside dimension vvvvvv intermission final level also tower hallway room i.e auxiliary tower room part main tower contains space station deceived name grep push_back finalclass.cpp return 1597 actually remainder ... two room row yes fact gravitron outer space contain row actually room stored finalclass.cpp including minitowers panic room final challenge room actual level data one outer space room breaking room even actually outside dimension vvvvvv tower hallway outside dimension vvvvvv room intermission intermission rest room final level including minitowers grep push_back return 2148 remainder two room row one counted 2148 row false positive else prize reckless replaces row spike row without spike time trial death mode room space station one outer space room mind decided duplicate current last row room 29th row add 30th row however going automatically neither going write kludge code parse nightmare level file duplicate row way enter vim macro well actually use neovim first push_back pressing would keep going next push_back file went 29th row first room file started macro macro went like 30nyp simply going 29th row next room duplicating however make sure cursor push_back line 29th row room skip room problem encountered pressing ctrl given invocation macro ctrl metaphor actually undo typing vim also make sure careful around extra line push_back prize reckless gravitron make sure run past end file loop back around thankfully outer space room end file first increase number row drawn graphics.cpp order compensate reading tile data map.cpp change fillcontent drawmap drawfinalmap drawtowermap funnily enough tower function already used row guess one due camera scrolling draw row went game make sure row behind room name looked fine checked every single room room name turned invincibility mode added temporary line hardreset always turned smoother playtesting experience make sure room entirely empty bottom row actually still row instead game assuming 30th row empty sound like could lead undefined behavior added temporary debugging line start mapclass fillcontent printf row game.roomx game.roomy int tmap.size everywhere checked made sure check room every room row row unfortunately room simply left alone 29th row duplicated manually edited 29th row would contain edge tile player would able walk somewhere 28th 27th 26th row duplicated said edge tile behind room name would look bad list room whose 30th row manually edit comms relay yes men stop reflect call flipper double slit experiment square root brought letter bernoulli principle purest unobtainium smell ozone conveying new idea upstream downstream give eeing dollar ign thing hard way good must everything stay close ... ... close ... try keep whee sport like actually strange case looked bad 29th row instead 30th row change 29th row instead 30th row fix maze entrance ascending descending mind gap strange case like 29th row change problem 30th 1950 silverstone grand villus people found panic room final challenge also looked strange behind roomname background much either tower tile data wrap around top bottom added another row either would visible room name considered updating development editor new level tile decided development editor already pretty outdated anyway,,
1201,de82918efdec77d7b51560753b21c5ad245bccf5,isa <infoteddyatgitgud@cock.li>, 2020-05-19 11:08:01 -0700, , fix extra zero 21st row philadelphia experiment cause issue old push_back string system cause huge alignment issue know zero fixing,,
1202,3178aec5d2ddc3028071dfbfc3f7e7a3aec53ad4,isa <infoteddyatgitgud@cock.li>, 2020-05-18 18:09:12 -0700, , flash shake screen enabling flip mode bit inconsistent every time toggle flip mode doe flashing shaking different sfx regardless whether turning consistent happens toggle screen effect turning flip mode flashing shaking game saved sound turning play viridian squeak,,
1203,7bd2f92f034123c781b489b45d468560f380806f,isa <infoteddyatgitgud@cock.li>, 2020-05-18 18:03:18 -0700, , make gamemode start play viridan squeak always personally irked time get viridian squeak pressing action start fading going game start playing custom level quicksave make thing consistent add polish game made sure music.playef every time game.mainmenu get set also made sure result double squeaking i.e music.playef called twice loud ear hurting,,
1204,14af88695f98723095001ca061f676f1609db4a8,isa <infoteddyatgitgud@cock.li>, 2020-05-18 17:49:35 -0700, , select continue returning new game save started new game save meaning selectedd new game position continue saved quit cursor end continue instead new game save cursor would bound end position anyway,,
1205,a33c460d406d9ee9b9983e045952f95dbd2fe8de,isa <infoteddyatgitgud@cock.li>, 2020-05-18 15:19:56 -0700, , create menu returntomenu given current menu fix bug play menu state first option new game kept playing quicksave telesave created quit menu menu update thanks kssbrawl reporting bug http attachment untitled.webm,,
1206,72ddd9bdb4a1b7126c4d772147e30dc90aadec06,isa <infoteddyatgitgud@cock.li>, 2020-05-18 14:16:23 -0700, , fix hardestroom atoi called loading quicksave reason probably copy paste error xml tag get atoi called assigned game hardestroom loading quicksave would result game hardestroom set empty string kept game complete would end rendering single null byte even font face said null byte sure error compiles first place whatever,,
1207,9b3853bf9420e2d0fd366f01e22d71e529280e3b,isa <infoteddyatgitgud@cock.li>, 2020-05-18 14:07:52 -0700, , fix indentation ifdefs nested ifdefs indented one space accordingly changed use tab instead space,,
1208,bf21c13f80c8199f079d227db05270e25077e557,isa <infoteddyatgitgud@cock.li>, 2020-05-18 14:03:14 -0700, , handle return value fread fwrite whenever compile gcc give warning return value fread ignored fair point mean proper error handling something wrong also going check return value fwrite good measure believe checking number equal length way catch error output error message accordingly use ferror feof mostly think take much code also error fwrite say warning think much fully write byte intended file,,
1209,664bf8ca6c995d5d0499283aaa5f7b031ce978d7,isa <infoteddyatgitgud@cock.li>, 2020-05-17 17:07:08 -0700, , remove unused function mapclass fillareamap longer needed since load areamap directly instead string unnecessary middleman tilemap,,
1210,e938bfdb57fd9ee2b672d7ee2b9762adfa9ee63f,isa <infoteddyatgitgud@cock.li>, 2020-05-17 17:05:07 -0700, , refactor areamap initialization use string instead data held const int array directly loaded areamap,,
1211,86516bb2840551554494c7a2ec21869b9bb4fa9d,isa <infoteddyatgitgud@cock.li>, 2020-05-17 17:02:01 -0700, , remove unused fillbackground fillcontents fillminitower tower unused longer parse 120 100 700 string order load tilemaps,,
1212,aae07336eb2ac5973b0dff4222ec94ed080bca4c,isa <infoteddyatgitgud@cock.li>, 2020-05-17 17:00:34 -0700, , refactor tower.cpp longer use string tilemaps instead held constant int array including menu background,,
1213,aed7b220c7ed8670fc0165025a74dab31ea28c2a,isa <infoteddyatgitgud@cock.li>, 2020-05-17 16:45:57 -0700, , remove unused function mapclass fillcontent previously used parse string whenever loading room longer used since assign tilemap vector directly,,
1214,ec72031cfd37742bfc456b4871329c5fbfe086ef,isa <infoteddyatgitgud@cock.li>, 2020-05-17 16:43:32 -0700, , refactor otherlevel.cpp use string tilemaps instead held constant int array instead,,
1215,8a573af273c9a04ced0ba3c0a88c5084258e1b30,isa <infoteddyatgitgud@cock.li>, 2020-05-17 15:55:20 -0700, , refactor use string tilemaps stored const int array instead except prize reckless room made sure spike removed death mode time trial,,
1216,781aa38e1fea5fdcd32a7561aae0011b3fba0170,isa <infoteddyatgitgud@cock.li>, 2020-05-17 14:42:38 -0700, , refactor finalclass.cpp use string tilemaps instead stored constant int array made sure gravitron still row like outer space though think matter,,
1217,5126c4dbc4d039b4acaac98af8dd086b7d8d6ab9,isa <infoteddyatgitgud@cock.li>, 2020-05-17 14:21:52 -0700, , refactor warpclass.cpp use string tilemaps use constant int array instead,,
1218,cc0d5d1d79e0ad59526003f4f8ae044c13f0bb2f,isa <infoteddyatgitgud@cock.li>, 2020-05-17 13:48:07 -0700, , refactor labclass.cpp use string tilemaps use const int array instead,,
1219,f617b6d695cd41d95a1a4f4048553d82223c5883,isa <infoteddyatgitgud@cock.li>, 2020-05-14 13:46:57 -0700, , fix command used haiku bsd previously linux xdg open everything else open  macos haiku open everything else xdg open according comment leo60228 203,,
1220,e69cc964ab6701a33e1953112fb2ab1093b98d38,isa <infoteddyatgitgud@cock.li>, 2020-05-14 12:39:29 -0700, , duplicate activity zone handling code playtesting change make editor playtesting code handle pressing enter activity zone code handle pressing enter activity zone remove need copy paste code adapt editor playtesting thus fix editor artifact press enter activity zone death animation even though playing custom level normally,,
1221,610768658ea82536bb7f86e2583d4e1e7ed2d637,isa <infoteddyatgitgud@cock.li>, 2020-05-14 11:03:04 -0700, , remove maprender since start maprender text box drawn function get hidden behind everything else drawn top thus result glitchy rendering text box top screen rendered roomname space map screen fix rendering glitch remove drawgui useless anyway since drawn behind everything else need ,,
1222,be2d2e1e2a6328900dee11527f8a54d05139485f,isa <infoteddyatgitgud@cock.li>, 2020-05-13 01:15:34 -0700, , fix 1x1 quicksand collision optimization working need replace best guess oversight happening weird ordering code originally temp first temp second instead way around weird ordering becomes natural insert instead swapped around ordering good measure also fixed mobile version,,
1223,2d07090a6b0bc434548f19cac53167a1647e46cb,isa <infoteddyatgitgud@cock.li>, 2020-05-09 12:52:58 -0700, , move returning editor end frame fix horizontal vertical warp background resetting also bunch frame glitch noticeably cutscene bar fadeout add new variable game signal whether return editor end frame,,
1224,51971fa84c10eb8e88f77e9b90f67c3a85c15ad0,isa <infoteddyatgitgud@cock.li>, 2020-05-09 12:35:17 -0700, , abstract returning editor code game returntoeditor way easily move around without moving around bunch line code,,
1225,915100b3701e4f62b73d18f879b58b26b9fbf389,isa <infoteddyatgitgud@cock.li>, 2020-05-09 12:04:07 -0700, , reset vvvvvvman size mapclass resetplayer bit annoying vvvvvvman status preserved game session thing reset color annoying mean close game reset vvvvvvman reset properly chose put reset code mapclass resetplayer instead scriptclass hardreset seemed like appropriate place property player reset,,
1226,269ad18b86dbe5bc70110873f30d2df46a9c19f8,isa <infoteddyatgitgud@cock.li>, 2020-05-09 11:53:41 -0700, , call game.savestats setting new super gravitron record extra safe ensure hard earned record lost 2.2 game save super gravitron record saved closed game quitting title screen pressing action quit game press alt press way otherwise record would lost 2.3 right game save unlock.vvv close game gracefully mean still mean otherwise close gracefully like say crash save record feel like rely catch saving save super gravitron record,,
1227,f585d53955527cb4a55f5269c69362f35b5680be,isa <infoteddyatgitgud@cock.li>, 2020-05-09 11:41:54 -0700, ," fix flag turning early flag seems general purpose game complete flag used replace crew option ship option pause screen unfortunately get turned early game complete right viridian start teleport bring pause screen select ship option teleport ship coordinate still keep finalmode since ship coordinate 102,111 finalmode around 46,54 still stuck outside dimension vvvvvv interrupted game complete gamestate switching teleporting gamestate checkpoint set even press since teleporter checkpoint setting check sentinel value result undefined behavior  result game softlock option quit game point fix issue move turning flag savetele ",,
1228,65341a8d1cf727b1c043a7953b6a334d97a1365c,isa <infoteddyatgitgud@cock.li>, 2020-05-07 16:00:13 -0700, , unindent block previously fademode check previous commit make diffs easier read unindent separate commit,,
1229,c61025c172e8a8daaf4acda2b9dc1e5164ef86b5,isa <infoteddyatgitgud@cock.li>, 2020-05-07 15:57:20 -0700, , remove fademode check quitting menu mean allowed quit menu even faded weird close menu able quit,,
1230,82d19145ae391fbd0272767ccf99b91b1dfaecb3,isa <infoteddyatgitgud@cock.li>, 2020-05-07 15:53:12 -0700, , draw fading fading animation mapmode make bring quit screen faded screen least see screen see black also fade fade animation still work quit screen importantly tested frame flicker anything,,
1231,3235b64d193040695f49cf0d943a8becdb83dba5,isa <infoteddyatgitgud@cock.li>, 2020-05-07 15:47:12 -0700, , remove reliance fademode return menu used old system also reliance terry state machine due fact relied fademode also meant bringing pause screen faded would result player getting sent back menu one accidental esc press cutscene could mean countless hour progress lost especially custom level,,
1232,656680b49c9c0b8b219894df73a46391098f05ca,isa <infoteddyatgitgud@cock.li>, 2020-05-07 15:40:17 -0700, , fix returning editor game faded would cause editor think middle fading menu fade menu thus losing unsaved work without warning,,
1233,b83cab85772f581cd5d2fd4bd8f0ad22a2da40c3,isa <infoteddyatgitgud@cock.li>, 2020-05-07 15:36:38 -0700, , directly returntolab code instead relying script rely script mean fade self contained mapmode could cause small issue could die return lab issue fixed need use script anyway endcutscene untilbars said script anything cutscene bar first place need worry,,
1234,fc2f269548371f86e8f2cf77aec657592793fcab,isa <infoteddyatgitgud@cock.li>, 2020-05-07 15:30:26 -0700, , move returning lab separate variable done removed reliance terry state machine return lab moved separate variable instead mean returning lab almost entirely self contained mapmode except quick jaunt gamemode run script run script gamemode,,
1235,17e7c6983b08b11fe583f974dc797747d12398f3,isa <infoteddyatgitgud@cock.li>, 2020-05-07 15:23:55 -0700, , move fading menu separate variable alright done made exiting menu entirely separate terry state machine thus take place entirely within mapmode instead back gamemode also faster frame since need wait map screen back,,
1236,69aeac24101c73d7d12f33ee4563b36dd25fac57,isa <infoteddyatgitgud@cock.li>, 2020-05-07 15:17:04 -0700, , move return lab code game returntolab keep gamestate compatibility reason ultimately using gamestates return lab,,
1237,b59e5a834621a86413cc7eb7546ff582998db230,isa <infoteddyatgitgud@cock.li>, 2020-05-07 14:54:39 -0700, , move quit menu clean whole lot kludge variable aggressive hardreset right action pressed anyone favor aggressive hardreset probably whole fact exiting menu terry state machine minimize chance interruption actually cause issue allows tower interrupt fadeout fix root cause usage state machine instead patching together kludge,,
1238,6ac41e112c64f744e20fd1e99a5f29d29828c527,isa <infoteddyatgitgud@cock.li>, 2020-05-07 14:38:19 -0700, , move quit menu game quittomenu want quit code state machine keep gamestate around compatibility reason custom level directly use gamestate quit menu,,
1239,0787475e6337d66113539e8cc800e4ee8e91d283,isa <infoteddyatgitgud@cock.li>, 2020-05-07 14:27:27 -0700, , remove unused variable pause game look like variable never used anywhere,,
1240,38a25b985ef3949c66bad25c144e3012ea9d1cfd,isa <infoteddyatgitgud@cock.li>, 2020-05-07 20:55:26 -0700, , fix copy paste error whoop,,
1241,29ff773cc4752b86c3ee4bad8dcc7c5d57cb63da,isa <infoteddyatgitgud@cock.li>, 2020-05-06 12:37:50 -0700, , rename start option new game popular request aizu said start look ugly since short compared rest menu option,,
1242,80db2f1d152944b1d63e5a0ffcb81fb0c7a59fa9,isa <infoteddyatgitgud@cock.li>, 2020-05-05 13:55:12 -0700, , add bound put due previous commit longer regularly taking bound entity index least putting print statement chance,,
1243,ce1e212317021696b4d19547e17c7dd3972e531b,isa <infoteddyatgitgud@cock.li>, 2020-05-05 13:49:12 -0700, , prevent updating entity updateentities removed otherwise would result game updating entity twice good noticeable gravitron many gravitron square created destroyed time especially noticeable part near end gravitron pattern two gravitron square one top bottom two gravitron square middle afterwards timing right top one two middle one would misaligned bottom one two gravitron square get outside screen changed entityclass updateentities bool made every single caller check return value needed one preceding wanted play safe defensive disappearing platform kludge well updateentities within updateentities function,,
1244,3c80d136e409ca743b947b8fe9c6e12da8177e60,isa <infoteddyatgitgud@cock.li>, 2020-05-05 11:26:26 -0700, ," add towermode check minitowermode screen transition apparently game leaf minitowermode cause issue horizontal warping room room type due frame ordering work would manifest wrong warp 20,20 game trying apply hardcoded minitower screen transition",,
1245,27a5d1fa4f72cc6cb3d0e311f9f4bc31aae8baaf,isa <infoteddyatgitgud@cock.li>, 2020-05-05 10:37:52 -0700, , add put function unlikely receive oob index every function entity.cpp except ,,
1246,8a7831899015de968610d26867976ac9eddab610,isa <infoteddyatgitgud@cock.li>, 2020-05-04 16:41:30 -0700, , add bound check function taking entity block linecross index main one beware entityclass updateentities entityclass entityclass would index bound thus commit undefined behavior entity removed entityclass updateentities would fine enough added bound check function however decided bit defensive play safe added bound check function taking entity indice also block linecrosskludge index,,
1247,c8d50d3067dbc139af6507cc2d754643e8cd10bb,isa <infoteddyatgitgud@cock.li>, 2020-05-04 18:44:06 -0700, , draw tower background dying death mode otherwise died entering room horizontal vertical warp background side warp background warp background would first thing see going game screen would start scrolling downwards proper tower background coming top oversight seems always game death mode actually tested like anyone ever play entire game without dying warp zone even completing warp zone like ever,,
1248,dc19a51d38fc95c07a94042f0c56015b0051522e,isa <infoteddyatgitgud@cock.li>, 2020-05-04 11:41:38 -0700, , fix copy paste bug command line playtesting code found compiled clang wself assign field enabled,,
1249,f78603ef87128c72d3ae433ce86c76b739096f00,isa <infoteddyatgitgud@cock.li>, 2020-05-02 20:38:06 -0700, , fix menu land complete game custom level complete game redirected play menu quicksave deleted back summary menu complete custom level back level list case started level quicksave,,
1250,85074c14024fce3bee0407c8ec96d6f9a9768644,isa <infoteddyatgitgud@cock.li>, 2020-04-29 23:16:35 -0700, , prevent spawning crewmates activity zone custommode look like custommode check spawning crewmates based crewmates rescued gone undiscovered long time mostly people use rescued internal command,,
