id,sha,author,date,issue,message,file,content
365,a113662050d29a01819a2f606c9bb1d55d941abb,isa <infoteddy@infoteddy.info>, 2021-02-12 16:35:22 -0800, , clean resetting editor content script content script reset editorclass reset reason reset right load xml file editorclass load additionally reset consistently use sdl_zeroa content scriptclass clearcustom script,,
366,fe77ada160a327265b035803b23185383c1ac406,isa <infoteddy@infoteddy.info>, 2021-02-12 16:29:08 -0800, , clean comment script xml parsing code partial slash asterisk style comment use also space start comment good also removed add script preceding header comment since inferred reading surrounding code,,
367,4f224e1657579d9806ad5034a8883c8535a4d5ec,isa <infoteddy@infoteddy.info>, 2021-02-12 16:25:32 -0800, , clean whitespace script xml parsing code space opening parenthesis also cleaned blank line spacing code look better,,
368,ca973a6547b138d3a696603c90ecc51d34cdc76c,isa <infoteddy@infoteddy.info>, 2021-02-12 13:53:01 -0800, , unindent collapsing empty ptext check always diff algorithm terribly unindentation actual unindenting commit,,
369,8d5829dd269b3d4407ddd1ae9010e86e2c23b1a8,isa <infoteddy@infoteddy.info>, 2021-02-12 13:45:32 -0800, , remove indentation level checking empty ptext instead checking length std string check ptext equal done anyway going get rid std string allocation noticed inefficiency indentation going remove actual unindent done next commit,,
370,968bb5f960811bbbc89c66dc2923f7e510d4420b,isa <infoteddy@infoteddy.info>, 2021-02-12 12:43:06 -0800, , duplicate loading use mean every xml array loading done common duplicated code exception special case majority case majority simple matter reading array integer putting another array seems like reason caught tag focused duplicating array load game loadstats forgetting game,,
371,6dc423e78ef7ebfc2030d3c352549891a2e5c293,isa <infoteddy@infoteddy.info>, 2021-02-12 12:13:54 -0800, , move load_array _rename macro order able use load_array macro game moved earlier file,,
372,3fcdc084d02a13194255d7aa5c88693a190e6727,isa <infoteddy@infoteddy.info>, 2021-02-11 17:02:32 -0800, , refactor editor gotoroom shortcut use split even split use stl using function bit unnecessary simple sdl_strchr suffices refactoring split use stl break caller anyway might well refactor use split first place refactor also properly check input valid integer since split longer used also reject input ending trailing comma invalid happen previously intentional used is_number instead is_positive_num thus accepting negative number future might possible negative room coordinate,,
373,fe8d1630418639e52e8fe94fee42e9dbe022c1f9,isa <infoteddy@infoteddy.info>, 2021-02-15 19:18:46 -0800, , fix reading uninitialized memory creating menu levellist valgrind reported error buffer guaranteed initialized including null terminator sdl_snprintf iterating entire allocated buffer bad feel bad girl wrote code read uninitialized memory pass sdl_tolower bonus iterator increment preincrement instead postincrement,,
374,3226d4f312b8470636e6a474dd9c6d54dc592d34,isa <infoteddy@infoteddy.info>, 2021-02-15 19:11:51 -0800, , free loaded file editorclass fix memory leaking every single time file get loaded list custom level get loaded valgrind report memory leak completely bad 2.2 properly free loaded file vce std unique_ptr decided ignore think would safe free umem get copied std string although future thinking refactoring function tag finder function use std string careful make sure memory management file correct,,
375,16fef54ae11e09a94ddef57ccd23e2865e82268b,isa <infoteddy@infoteddy.info>, 2021-02-15 19:09:51 -0800, , pas mix_loadmus_rw musictrack musictrack make freesrc argument mix_loadmus_rw instead argument nonzero passed sdl_rwops automatically freed m_music freed know setting fix memory leak valgrind report turn actual leak every time custom asset mounted unmounted,,
376,8052f61cef9a0d9ecdef9960beb1408679897403,isa <infoteddy@infoteddy.info>, 2021-02-15 19:07:32 -0800, , check file loaded soundtrack soundtrack add check pointer passed null return early function instead continuing later producing different slightly misleading error message,,
377,f401cc6230f32b4390cf6041be22869e21bea900,isa <infoteddy@infoteddy.info>, 2021-02-15 19:05:01 -0800, , unconditionally call soundtrack constructor previously guarded behind check length ... guess still perfectly fine behavior reason length check sdl_free doe check pointer passed non null pointer passed despite initialized upon declaration guaranteed initialized anyway,,
378,b19daebeef209b170267ca62ed48249dab387e2f,isa <infoteddy@infoteddy.info>, 2021-02-15 19:00:18 -0800, , bail sdl_malloc failure following ethan example bailing calling vvv_exit binaryblob unpackbinary allocate memory searched found every sdl_malloc made sure returned null caller would bail much memory probably error message printed process memory unpackbinary print error message memory probably added later also really logging system like something like added first adding message also account allocator used stl stuff working removing stl allocation failure result abort anyway really problem,,
379,8aa5bb8aab317a465722c1e24b5fa1b0dcde8e69,isa <infoteddy@infoteddy.info>, 2021-02-15 18:53:17 -0800, , clean program close path use vvv_exit wow lot exit path use vvv_exit instead attempt save unlock.vvv settings.vvv also free resource valgrind happy good thing previously unlock.vvv settings.vvv written decided bail given reason,,
380,de1e773b7f215d5d5128065eb134259ce77e1519,isa <infoteddy@infoteddy.info>, 2021-02-15 18:51:39 -0800, , remove string.h include main.cpp longer use libc string function instead preferring sdl unused include removed,,
381,d39fe96cf2b415bf8678c285e5d7bc52fb2705a4,isa <infoteddy@infoteddy.info>, 2021-02-15 18:49:24 -0800, , move script.cpp limits.h include proper place include corresponding header file source file script.h includes local header file file specific codebase convention includes source file follow however seems like misplaced fixing,,
382,4964cb7bc3a4dd8ea3ffc8a66f70085056ad795a,isa <infoteddy@infoteddy.info>, 2021-02-15 18:47:24 -0800, , add vvv_exit function call cleanup main.cpp well call exit would liked use sdl_exitprocess function ifdefs different runtime environment ala internal function exported well exit seems fine anyway,,
383,efbaeeffde86f96a9f5528b576b07afd18c784fb,isa <infoteddy@infoteddy.info>, 2021-02-15 18:43:35 -0800, , clean leftover resource cleanup resource otherwise need cleaned still alive upon program shutdown cleanup clean screen graphic buffer graphic tile musicclass audio upon program shutdown even technically need clean resource kernel going get rid anyway else security problem otherwise valgrind complain difficult see memory leak real well really leak freed thing process exited technically memory leak resource whose cleanup function safely called even initialized anything yet,,
384,39e316828e360d0ec95d5325807fee9801c393e3,isa <infoteddy@infoteddy.info>, 2021-02-15 18:38:42 -0800, , add null guard game savestats savesettings function safely called null,,
385,1f1b39a77acced33dcded436694e8d0862e9e558,isa <infoteddy@infoteddy.info>, 2021-02-15 18:07:33 -0800, , free base tilesheet image processing memory leak even valgrind complains get properly cleaned destroy still memory laying around used name deallocating thing soon longer need deallocate base tilesheet image split tile reduces memory cost tilesheet image half since essentially keeping around duplicate nothing really much impact conventional tilesheet size since usually small enough since 2.3 allowed tilesheet image size pretty big deal really big tilesheet image okay even though also get freed destroy sdl_freesurface doe null check pointer passed set pointer null freeing surface,,
386,6077015fdc7196015b19a404b0c8d624f70c3f6b,isa <infoteddy@infoteddy.info>, 2021-02-15 18:03:52 -0800, , guard physfs_deinit physfs_isinit quick glance physfs source code show physfs bail physfs_deinit called initialized bail mean setting error code returning early bad still principle thing want ensure safely called matter filesystem initialized yet error set physfs kind taint whole safety thing even doe nothing wrong  although speaking handling error physfs later ...,,
387,951e1653a61135bdebc07f1e9735aa74e3f2c2f2,isa <infoteddy@infoteddy.info>, 2021-02-15 17:52:41 -0800, , move cleanup code separate function need use code best copy pasted,,
388,de26596d549dfbda5775dfe0b80aa514422939e9,isa <infoteddy@infoteddy.info>, 2021-02-15 17:47:48 -0800, , fix fixme comment outdated referent screen.cpp fixme comment still correct code duplication incorrect exactly original code original code got moved around fixed refer correct location really get around duplicating code mentioned comment ...,,
389,a3ad7b73f32bba1720c356322e8b52df1354d9be,isa <infoteddy@infoteddy.info>, 2021-02-15 17:47:11 -0800, , add screen destroy order squeaky clean memory management need clean thing screen allocates function call ,,
390,7f3ebda8ea099dce146ff386dfa8a88ba983c110,isa <infoteddy@infoteddy.info>, 2021-02-15 17:44:19 -0800, , clear musicwriteblob writing binarymusic.vvv since musicwriteblob temporary object get destroyed end musicclass init order make sure leak memory lose pointer block allocated musicwriteblob need call clear method writing binarymusic.vvv,,
391,77748f29f93312582a71cf3e66e14c1f5511339d,isa <infoteddy@infoteddy.info>, 2021-02-15 16:42:58 -0800, , separate musicreadblob mmmmmm_blob pppppp_blob musicreadblob used mmmmmm pppppp soundtrack cause memory leak mmmmmm.vvv installed pointer holding allocated block mmmmmm would lost pppppp got loaded valgrind complains memory leak contrast 2.2 previous behavior musicreadblob temporary object instead held musicclass however really memory leak moreso something get cleaned closing game get turned leak per level asset mounting unmounting got introduced 2.3 loading level custom asset starting game mmmmmm.vvv exiting level mmmmmm.vvv would cause game leak memory leo recognized moved musicreadblob onto musicclass separate 2.3 either think happening closely use valgrind forgot memory leak caused using binaryblob pppppp mmmmmm instead use two different binaryblob object mmmmmm pppppp way memory leak happen,,
392,f39174b3e3fe635b0993eef1fd0252156e7d8a62,isa <infoteddy@infoteddy.info>, 2021-02-15 16:38:10 -0800, , refactor track_names take blob parameter going introduce another binaryblob object mix want able use existing foreach_track define without copy paste track_names take blob parameter passed temporary foreach_track define,,
393,0ea1a0e28ef89f04d9ee4c477b8507be64bdea0f,isa <infoteddy@infoteddy.info>, 2021-02-15 16:24:21 -0800, , move musicclass cleanup separate function musicclass destroy remove music cleanup code musicclass init requires also call destroy graphic reloadresources need use musicclass cleanup code elsewhere want copy paste cleanup code least game dev game devs copy paste friggin time,,
394,b3679ce1e557e282130fdf6a0161c5f1bded16f3,isa <infoteddy@infoteddy.info>, 2021-02-15 16:21:27 -0800, , fix brace style graphic font_idx really next line brace rest codebase,,
395,a5050597190a33c8947d94fcb183899f9ff824b6,isa <infoteddy@infoteddy.info>, 2021-02-15 16:18:45 -0800, , move graphic buffer creation new func create_buffers feel quite write leaving buffer creation code main even though perfectly okay result memory mismanagement valgrind report factoring separate function graphic create_buffers bonus longer keep qualifying graphic buffer creation code nice,,
396,5595bb096439b0696de80c328854c9d948f10490,isa <infoteddy@infoteddy.info>, 2021-02-15 16:16:52 -0800, , add graphic destroy_buffers destroy buffer created graphic class since buffer created time rest graphic due fact require knowing pixel format game screen destroyed rest graphic either,,
397,3fe1870b324d9a00819c08fd77505fbade769485,isa <infoteddy@infoteddy.info>, 2021-02-15 16:13:18 -0800, , move graphic cleanup new function graphic destroy make cleanup code used without copy pasting ,,
398,c955ce43804c04b392ea1888f827760f5776f644,isa <infoteddy@infoteddy.info>, 2021-02-15 15:58:06 -0800, , remove making new object reloadresources complicated way zeroing grphx instead using sdl_zero completely unnecessary grphx.init get called immediately afterwards anyway,,
399,1140f3cae38881d57158aa92f5fec60db28db0c3,isa <infoteddy@infoteddy.info>, 2021-02-15 15:38:41 -0800, , fix brace style graphic reloadresources next line brace line brace even codebase line brace everywhere still prefer next line brace inside function top level next regardless still next line brace like rest codebase,,
400,7ffafc8f4dc516b4557976950f483a2de74d51db,isa <infoteddy@infoteddy.info>, 2021-02-14 17:59:20 -0800, , remove grphx.init graphic init grphx.init going called grphx.destroy anyway reason,,
401,70b9ffe6a58b71122aa60280bae4194326d026a0,isa <infoteddy@infoteddy.info>, 2021-02-13 17:24:20 -0800, , tidy binaryblob initialization use sdl_zeroa simpler concise writing sdl_memset full mean likely screw line code,,
402,bd97378862c6b01d1de59f59a98a8a53a74fb696,isa <infoteddy@infoteddy.info>, 2021-02-13 17:20:48 -0800, , unconditionally free zero binaryblob clear function previously conditionally freed m_memblocks pointer corresponding m_headers valid make slightly worried possibility memory would allocated header would still marked invalid see could happen better safe sorry sdl_free doe guaranteed null pointer check like sdl function okay pas null pointer sure also zeroing m_memblocks m_headers freeing everything function,,
403,47df6c9d66c492318c8102bde50cd3530ffb22ce,than Lee <flibitijibibo@gmail.com>, 2021-02-14 22:51:07 -0500, , ignore resize event unfocused window,,
404,39abcfa8d9b72cb0c1c5728866c4325dceab78c6,isa <infoteddy@infoteddy.info>, 2021-02-14 12:53:47 -0800, , fix unreachable code warning msvc complains seem like gcc doe safely removed unreachable always follow case switch similar default case code duplicate anyway unless case better remove becausee otherwise look misleading confusing casual glance code,,
405,a2ba37a1a4f0aec39d2c7a85f1ea90a0efb9e9cf,isa <infoteddy@infoteddy.info>, 2021-02-11 16:07:25 -0800, , fix bound indexing malformed xml entity find_tag find_tag would commit bound indexing someone made level file malformed xml entity encoding metadata tag would happen end string followed immediately ampersand hash semicolon ending xml entity valgrind complains fixed,,
406,5de7c180ea822b6508ce9dcad7794a4423334157,isa <infoteddy@infoteddy.info>, 2021-02-07 21:17:57 -0800, , give static storage duration radix ss_toi since value const value read integer literal static read directly storage instead copying ,,
407,09841ef3a58111494981f581fce2756336dca7ef,isa <infoteddy@infoteddy.info>, 2021-02-07 21:13:40 -0800, , mutate decimal place ss_toi fix bug get properly evaluated 148 get evaluated 1408. place get multiplied radix retval get multipled 100 instead reason place variable removed entirely simplifies function little bit,,
408,adbae16666c1a7d8c2b9540e1b6f2a218cab7470,isa <infoteddy@infoteddy.info>, 2021-02-07 13:19:33 -0800, , clean script header check editorclass load previous person wrote girl named misa clearly understand reason compare line line.length directly string literal former char latter pointer char ints compiles fine want make latter char instead string literal well also clearly think earlier first place fixed,,
409,4728f64e3a88a82570562a37a9b5dc44f096f326,isa <infoteddy@infoteddy.info>, 2021-02-07 13:18:39 -0800, , remove commented version code editorclass load search result term code split function become annoying false positive better remove entirely,,
410,06cc5afe27df5a41efb8a06548d62cc8c4b5c280,isa <infoteddy@infoteddy.info>, 2021-02-07 13:17:22 -0800, , pas input utilityclass gcstring const reference avoids unnecessary copy input std vector since need modify anything cut unnecessary memory operation,,
411,46b0257cf1cd7acfbf22284786f5273301d2b6f7,isa <infoteddy@infoteddy.info>, 2021-02-07 13:09:47 -0800, , refactor ss_toi use stringstreams apart std string function longer stl ss_toi simple function convert input int taking many digit possible reach non digit character point stop trivial implement without stl could used int would required copying string temporary buffer insert null terminator use pointer length data type either string function operate like one disadvantage string instead decided implement conversion int think way human write arabic numeral going change anytime soon also std string input passed const reference instead making copy cutting unnecessary memory operation,,
412,e1ae25b29b0791b3a4d0cf0a3c48ab7832960033,isa <infoteddy@infoteddy.info>, 2021-02-07 13:05:24 -0800, , use case switch inside gcchar instead else tree case switch take line least next line brace style repeat button part,,
413,eea37046ef0a96fc19615bd26deef25ea7e01f52,isa <infoteddy@infoteddy.info>, 2021-02-07 13:03:33 -0800, , add constness gcchar input switch position asterisk personally like putting asterisk type despite language parsing asterisk part name pointer part clearly part return type function also put constness indicate input modified inside function,,
414,3cd18b337a5662faf9a699733f8a28efd04979e2,isa <infoteddy@infoteddy.info>, 2021-02-07 12:57:00 -0800, , remove comment gcchar comment indicates function used utilityclass gcstring unnecessary reader trivially search usage gcchar file static preceding function good enough hint reader know function unused whereas read comment would assumption used might also compiler warning unused would confusing comment still point comment get outdated removing comment make code self documenting,,
415,f9fa56a08a9a5042f271fd6408923ef191afe9a3,isa <infoteddy@infoteddy.info>, 2021-02-07 12:45:23 -0800, , remove unused cctype include header used needed isxdigit ever since switched using vvv_isxdigit need anymore,,
416,ef4418a7cbfb5cfb4f66d23d19a0d5b07af7c519,isa <infoteddy@infoteddy.info>, 2021-02-07 12:44:28 -0800, , remove commented code game gameclock code involves stringstreams cause false positive time ripgrep stringstream codebase,,
417,3bc3b59378255fabd1feff51714e45708c0b9d38,isa <infoteddy@infoteddy.info>, 2021-02-01 16:16:04 -0800, , fix glitchy position spawning onto conveyor 509 conservative fix reset player newxp newyp respawn checkpoint spawn map unlike previous patch player suddenly collide conveyor horizontally moving platform gameplay position would revert back intended next position previous frame behavior ever seen contrived situation come behavior probably preferable gameplay actually going conveyor fine also decided reset newxp newyp resetting newyp seems enough safer also reset newxp future reader question newyp reset newxp tested fix death loop issue earlier also still allowing trench warfare trick possible tested libtas movie mentioned 606 syncs fine known regression resulting fix hopefully,,
418,a406b99f4b068b1a470501a735a8a52eb29636e4,isa <infoteddy@infoteddy.info>, 2021-02-01 16:09:13 -0800, , revert fix glitchy position colliding conveyor reverts commit fix regression fix regression immediately flipping horizontally moving platform conveyor longer provide boost given certain vertical pixel alignment regression fix fixed fixed another way fix 606,,
419,b5ef10cae521234895c3bd42a6b8728195b835ea,eo60228 <leo@60228.dev>, 2020-12-31 21:12:30 -0500, , consistently use screen getwindowsize,,
420,46d8599f6272968761cc9e1ed6669df60888d902,eo60228 <leo@60228.dev>, 2020-12-31 21:00:20 -0500, , use instead always return actual size even obscure hidpi macos case,,
421,d9fff2a8c3e394617edd0c295e08ec87ee160b00,eo60228 <leo@60228.dev>, 2020-12-31 20:55:57 -0500, , set sdl window dpi aware work macos wayland esoteric platform x11 concept dpi awareness note flag guaranteed return actual window size,,
422,a32fc4a3079fc80dc25642cc2ea5553422c37ba9,isa <infoteddyatgitgud@cock.li>, 2021-01-11 17:19:20 -0800, , improve support retextured checkpoint terminal editor retextured checkpoint always game clicking editor would lead losing retextured ness checkpoint left alone either also show properly editor fixed retextured flipped terminal added 2.3 show properly game properly show editor either show editor additionally clicking flip terminal well like checkpoint ,,
423,afba3200835fe2ea08140911f1194f64ddd43ffe,isa <infoteddyatgitgud@cock.li>, 2021-01-13 22:35:41 -0800, , remove duplicate main call makebfont always existed ever since 2.3 per level custom asset added also call meaning call unnecessary calling twice result graphics.bfont twice number element custom asset get mounted unmounted technically,,
424,adbab6355b34c8fa5acdb72f8c6d7ff9f11a65e9,isa <infoteddyatgitgud@cock.li>, 2021-01-13 22:56:19 -0800, , free data upon failure loadimage otherwise returned null memory would leaked,,
425,626aac59fb162690f460d05c87893a1499583465,isa <infoteddyatgitgud@cock.li>, 2021-01-07 16:18:07 -0800, , fix death mode result reset shown doe thing last commit death mode instead time trial whenever die death mode complete relevant variable get copied variable prefixed ndmresult never get reset variable titlerender use instead live one,,
426,4d7baa9e9e6b0c0de6d72863ea0b755d203e9698,isa <infoteddyatgitgud@cock.li>, 2021-01-07 16:02:45 -0800, , fix time trial result reset shown make time trial get completed relevant variable get copied onto variable prefixed timetrialresult never get reset titlerender use variable accordingly,,
427,ee0ba8a7230969953d15db88b74bff8603ce698a,isa <infoteddyatgitgud@cock.li>, 2021-01-07 14:20:37 -0800, , clean exit path menu use common code multiple different exit path main menu 2.2 bunch copy pasted code 2.3 currently use game.quittomenu straggler still use hand copied code bit problem exit path consistently part 2.3 feature per level custom asset furthermore path call straggler could something persisting title screen like really long flash shake timer could persist exiting title screen path actually seems like good reason call namely dying completing death mode completing time trial present information onscreen would get reset fix later commit done commit found every exit path already use game.quittomenu made use game.quittomenu well special handling existed top already corresponding entry game.quittomenu path would take special handling never game.quittomenu removed special handling well e.g exiting custom level used returntomenu menu levellist quittomenu already returntomenu menu exiting level editor return handled game.quittomenu well map.custommode branch also check unfortunately seems like entering level editor properly initialize map.custommode entering level editor initializes map.custommode also taken music.play game.quittomenu exit path immediately play presenting vvvvvv exit path immediately play presenting vvvvvv music.play special cased fine enough list exit path menu exiting pause menu without glitchrunner mode exiting pause menu glitchrunner mode completing custom level completing time trial dying death mode completing death mode completing intermission replay exiting level editor completing main game,,
428,07cc5f68ac721852395c17224e5759af1793bebe,isa <infoteddyatgitgud@cock.li>, 2021-01-05 19:40:29 -0800, , remove commented code gamestates 3101 3500 comment general get verified compiler commented code even worse especially since look outdated code always need code look back git history,,
429,f06701ff907b98aea9720a0719d0e0eccaaeb3fc,isa <infoteddyatgitgud@cock.li>, 2021-01-16 10:09:16 -0800, , fix wrong function used musicclass play check whoop,,
430,74740c5a21c05116b92deba8e462f815232fd3bc,isa <infoteddyatgitgud@cock.li>, 2021-01-13 22:50:49 -0800, , remove fix segfault would pas compressed image data loadimage test previous whoop,,
431,9c9433d21a6b44a3255ebb2e3a422a50cbef4809,isa <infoteddyatgitgud@cock.li>, 2021-01-13 19:18:29 -0800, , disable msvc warning implicit conversion implicit conversion warning happen codebase reason warn adding cast everywhere annoying read patently unnecessary msvc compiler warning gcc even wall wextra warn implicit conversion disable msvc,,
432,fad3bab2d030681801a11b17d9ae4a5277bfe90c,isa <infoteddyatgitgud@cock.li>, 2021-01-13 19:39:50 -0800, , initialize bcol bcol2 graphic drawbackground compiling release mode gcc warns two potentially used uninitialized way could happen case switch match case would require game invalid state invalid value rcol spcol better safe sorry,,
433,2a781083e9d703ba36f734850176712d9a059f18,isa <infoteddyatgitgud@cock.li>, 2021-01-13 19:12:58 -0800, , disable unneeded lodepng feature thing need lodepng decode png already loaded memory handle filesystem part need lodepng filesystem function encode image use zlib function disable,,
