id,sha,author,date,issue,message,file,content
0,f935664a4d2933fc4fdc85e6a6e516f5aa44650d,emantic-release-bot <semantic-release-bot@martynus.net>, 2021-07-30 05:45:03 +0000, , github build __run_2 v6.62.0 skip,,
1,98ab1bbc6e4205822e5702dfa9337d2ec3475d34,omain Lenzotti <rom.lenzotti@gmail.com>, 2021-07-26 20:49:59 +0200,1471, feat core fix deepmerge function key contains dot close 1471,,
2,eb1d93ddea04c7daeeb394d2582a7b478fe130ef,emantic-release-bot <semantic-release-bot@martynus.net>, 2021-07-26 23:17:35 +0000, , github build __run_2 v6.61.1 skip,,
3,1f999d117cd7f13c045e6f1a889d03f50eab2dca,omain Lenzotti <rom.lenzotti@gmail.com>, 2021-07-27 00:58:22 +0200, , merge fix revert microbundle schema,,
4,1bec1086de8cabd7582f21e33057f900b3ebfeff,omain Lenzotti <rom.lenzotti@gmail.com>, 2021-07-27 00:53:24 +0200,1473, fix schema revert microbundle tsed schema close 1473,,
5,1c30484c2773897b5f878e412fecc099ccd01de2,emantic-release-bot <semantic-release-bot@martynus.net>, 2021-07-26 17:05:58 +0000, , github build __run_2 v6.61.0 skip,,
6,3b23d8cefb90c466436e1adebbc531413faaf559,omain Lenzotti <rom.lenzotti@gmail.com>, 2021-07-24 09:49:47 +0200, , feat schema formio add new package tsed formio schema convert ts.ed schema formio schema,,
7,6ed6fda52572ce2fe190177a02e92fa4424701b8,emantic-release-bot <semantic-release-bot@martynus.net>, 2021-07-24 09:41:58 +0000, , github build __run_2 v6.60.2 skip,,
8,48225acc800fbf4533b109cde3e9ffe6cb046128,omain Lenzotti <rom.lenzotti@gmail.com>, 2021-07-24 10:20:40 +0200,1469, fix schema fix cooky cookie close 1469,,
9,1786a051ea9e091e2c844c0ce3747c5b01e9aad2,omain Lenzotti <rom.lenzotti@gmail.com>, 2021-07-24 10:17:20 +0200, , fix objection fix model serialization,,
10,3a7dfcbf52226e44b518ac61d3f941ef232cfda0,omain Lenzotti <rom.lenzotti@gmail.com>, 2021-07-24 10:13:50 +0200, , chore update readme,,
11,1530886de5bba90b6f13bf627ae4392e50884298,tefan van Herwijnen <5968971+stefanvanherwijnen@users.noreply.github.com>, 2021-07-21 17:45:23 +0200, , chore small fix doc oidc 1468,,
12,5f3b1d3e4602e1c0c65d61644f88011d074c7a5c,emantic-release-bot <semantic-release-bot@martynus.net>, 2021-07-20 08:09:57 +0000, , github build __run_2 v6.60.1 skip,,
13,694e52b988d28289e3233b46a279ba0f4dd531c3,omain Lenzotti <rom.lenzotti@gmail.com>, 2021-07-20 09:20:43 +0200, , fix common fix log summary issue 1466,,
14,e977b4799273e0313f439fbd81f905da6fac2001,emantic-release-bot <semantic-release-bot@martynus.net>, 2021-07-19 18:42:58 +0000, , github build __run_2 v6.60.0 skip,,
15,92730e53eeeaff6cc2ef86001c91aa9b8426a314,teffen <3752127+klotztech@users.noreply.github.com>, 2021-07-19 20:22:12 +0200, , feat mongoose add decorator versionkey expose versioning capability 1465 authored klotztech klotztech,,
16,cc54aa0433d54e5a6ff67a1d76cb367648016e4a,emantic-release-bot <semantic-release-bot@martynus.net>, 2021-07-17 09:13:47 +0000, , github build __run_2 v6.59.9 skip,,
17,24e50a6ccd36494b38a9a860ed242b8c2c0ee20c,omain Lenzotti <rom.lenzotti@gmail.com>, 2021-07-17 10:54:41 +0200, , merge fix platform,,
18,9f737e635c61e81ad58ca1e40e238a41d6509ea5,omain Lenzotti <rom.lenzotti@gmail.com>, 2021-07-17 10:54:02 +0200, , fix common fix issue child controller building,,
19,e0617450e39f0c0c26bf1eee063562f83af47171,omain Lenzotti <rom.lenzotti@gmail.com>, 2021-07-16 19:26:54 +0200, , tech refactoring route loading,,
20,d4cb13f50cfb51dd261b9fc1ab1392a08736f88e,emantic-release-bot <semantic-release-bot@martynus.net>, 2021-07-17 07:33:51 +0000, , github build __run_2 v6.59.8 skip,,
21,a60e4a2f6dee91cb58c92d2d72e78d3c773a49c3,omain Lenzotti <rom.lenzotti@gmail.com>, 2021-07-17 08:49:27 +0200, , fix typegraphql update graphql dependency 15.5.1 fix typescript compilation issue apollo cache control,,
22,3e884cf52bf38696f0a884b8bba83f8a0c8b6b69,omain Lenzotti <rom.lenzotti@gmail.com>, 2021-07-16 18:25:03 +0200,1459, fix swagger use correct version configuration root.version given close 1459,,
23,39cc6be9155aea7f3c55ce73653ccc68255c50dd,omain Lenzotti <rom.lenzotti@gmail.com>, 2021-07-16 13:57:51 +0200, , tech common use store controller hierarchy,,
24,bb1b2bf5acd9eae45238fad5d84d184708c53481,emantic-release-bot <semantic-release-bot@martynus.net>, 2021-07-16 12:59:46 +0000, , github build __run_2 v6.59.7 skip,,
25,cce04e5dc3c561cf8827bfe02460a40ec3f5d182,omain Lenzotti <rom.lenzotti@gmail.com>, 2021-07-16 12:22:58 +0200, , fix apollo fix error latest apollo server version,,
26,a94068b0b010a95ebe5b69dd527b1034848e792e,emantic-release-bot <semantic-release-bot@martynus.net>, 2021-07-16 12:14:40 +0000, , github build __run_2 v6.59.6 skip,,
27,76b78db4b21895c72667d70cc635da80204b9b77,omain Lenzotti <rom.lenzotti@gmail.com>, 2021-07-16 10:49:35 +0200, , fix swagger use new deepmerge function mergespec,,
28,4bb47331975ef57da6fc4fb3e253105fbf332b70,omain Lenzotti <rom.lenzotti@gmail.com>, 2021-07-16 08:56:01 +0200, , merge chore add logo sponsor,,
29,27c2104eddb0f2db9f1af0a91e1d777facd79572,omain Lenzotti <rom.lenzotti@gmail.com>, 2021-07-16 08:55:44 +0200, , doc add weseek logo,,
30,5141eb1731620ebebc09fa1ab28970767fdb3021,emantic-release-bot <semantic-release-bot@martynus.net>, 2021-07-16 06:10:33 +0000, , github build __run_2 v6.59.5 skip,,
31,ed43f2cbbdc884f88c44c44dcf81a75b57c12848,lotztech <klotztech@users.noreply.github.com>, 2021-07-15 19:44:20 +0200, , fix common exceptionschema stack property type,,
32,e243ce32f36cbdd1085d4407e2289b1ac9d45320,emantic-release-bot <semantic-release-bot@martynus.net>, 2021-07-13 12:08:02 +0000, , github build __run_2 v6.59.4 skip,,
33,677b458106aa338309ba008519e71ed4006cc1e7,omain Lenzotti <rom.lenzotti@gmail.com>, 2021-07-12 18:55:01 +0200, , fix schema fix issue header declaration openspec,,
34,c207f93e3e59022b86b99a533a893afc1af6783b,emantic-release-bot <semantic-release-bot@martynus.net>, 2021-07-10 09:19:16 +0000, , github build __run_2 v6.59.3 skip,,
35,49c8f67895f673a784f039f19f9d635cc3c831d0,omain Lenzotti <rom.lenzotti@gmail.com>, 2021-07-10 09:13:07 +0200, , fix bump tsed logger 5.16.0,,
36,5fae48c791e8fcd0047d95aefba25d010589c62b,emantic-release-bot <semantic-release-bot@martynus.net>, 2021-07-05 07:46:12 +0000, , github build __run_2 v6.59.2 skip,,
37,603fb960286b88cf94de40ac6c85c1d4fbff025c,omain Lenzotti <rom.lenzotti@gmail.com>, 2021-07-05 08:58:38 +0200, , fix optimize bootstrap,,
38,8830bf54d9ff112eaf9087b7f1a236c49d139783,emantic-release-bot <semantic-release-bot@martynus.net>, 2021-07-04 12:22:27 +0000, , github build __run_2 v6.59.1 skip,,
39,2feb763b2c8fbd4076861cd30c6a05d62b300507,omain Lenzotti <rom.lenzotti@gmail.com>, 2021-07-04 13:15:08 +0200, , fix common update tsed engine dependency fix issue cli npm package manager used,,
40,fcb9441468fcaf447cccc27968ddd81237064588,heorghe <gheo@sweethuman.tech>, 2021-07-02 13:53:09 +0300, , remove save dev flag yarn install,,
41,34bb38c9416a992f7d7b7057538e8c1c3317061f,ependabot[bot] <49699333+dependabot[bot]@users.noreply.github.com>, 2021-07-01 04:03:14 +0000, , chore deps dev bump sqlite 4.0.17 4.0.23 bump sqlite http github.com kriasoft node sqlite 4.0.17 4.0.23 release note http github.com kriasoft node sqlite release changelog http github.com kriasoft node sqlite blob master changelog.md commits http github.com kriasoft node sqlite compare v4.0.17 ... v4.0.23  updated dependency dependency name sqlite dependency type direct development update type version update semver patch ... signed dependabot bot support github.com,,
42,2457b91b5a5578e4b6bfd34c230f4f2699b1e55b,ependabot[bot] <49699333+dependabot[bot]@users.noreply.github.com>, 2021-06-23 08:44:20 +0000, , chore deps bump ajv 8.3.0 8.6.0 bump ajv http github.com ajv validator ajv 8.3.0 8.6.0 release note http github.com ajv validator ajv release commits http github.com ajv validator ajv compare v8.3.0 ... v8.6.0  updated dependency dependency name ajv dependency type direct production update type version update semver minor ... signed dependabot bot support github.com,,
43,9e1400ee29ea049c86d82a8baa8e06c0c0a1a659,omain Lenzotti <rom.lenzotti@gmail.com>, 2021-06-27 09:45:30 +0200, , chore update dependency,,
44,8b82d78da717c0119868f1ab9dba165068a79fde,omain Lenzotti <rom.lenzotti@gmail.com>, 2021-06-23 08:37:35 +0200, , chore core use microbundle packaging tsed core package add support modern es6 import,,
45,b686a5f7fc3409246556e74857d00042ca204bdc,emantic-release-bot <semantic-release-bot@martynus.net>, 2021-06-23 06:56:27 +0000, , github build run2 v6.59.0 skip,,
46,4dad1cf89b64dbd85bcfbba0d7d37054d23be755,omain Lenzotti <rom.lenzotti@gmail.com>, 2021-06-13 12:23:05 +0200, , feat common allow custom view engine registration,,
47,755304204df8630c1c0257523867e0299f3a2369,emantic-release-bot <semantic-release-bot@martynus.net>, 2021-06-22 06:14:18 +0000, , github build run2 v6.58.2 skip,,
48,74717a700a6c99eba70c07a97b9197ea41d7da65,omain Lenzotti <rom.lenzotti@gmail.com>, 2021-06-21 17:46:10 +0200, , fix filter .d.ts imported file automatically prevent .d.ts import global pattern correctly configured,,
49,a4f41a4fcc3951fbb2ddbe80f52078bb9a0adb75,emantic-release-bot <semantic-release-bot@martynus.net>, 2021-06-20 12:55:49 +0000, , github build run2 v6.58.1 skip,,
50,7d10a3db700247b9faee54e7cfce834a3cb1d657,omain Lenzotti <rom.lenzotti@gmail.com>, 2021-06-19 16:43:17 +0200, , fix remove try catch importfiles,,
51,fb02dca873844be712d7cc49767fa4322f01019c,emantic-release-bot <semantic-release-bot@martynus.net>, 2021-06-17 09:21:08 +0000, , github build run2 v6.58.0 skip,,
52,c3049ef46afca25413dbb5f734562de48efa684c,omain Lenzotti <rom.lenzotti@gmail.com>, 2021-06-17 09:33:53 +0200, , chore remove unused method,,
53,fcc42f4233658d220e92b8e6eceec48963ee9bfb,omain Lenzotti <rom.lenzotti@gmail.com>, 2021-06-17 09:29:40 +0200, , fix core optimize store declaration,,
54,0ec7271271c0b8e484ef25312fb5a25eb1d0b639,omain Lenzotti <rom.lenzotti@gmail.com>, 2021-06-17 08:42:06 +0200, , feat schema add partial decorator,,
55,a8fbdfb85b8c76e971b1c1315609e8c62a05c7ba,emantic-release-bot <semantic-release-bot@martynus.net>, 2021-06-17 06:51:49 +0000, , github build run2 v6.57.0 skip,,
56,2eed32ae50816571a66f3894dc1c3fb859e98496,omain Lenzotti <rom.lenzotti@gmail.com>, 2021-06-17 08:03:25 +0200, , chore update stripe documentation,,
57,c36b30aa263045b5cc2a5e204b16fdcf1e9b50f5,omain Lenzotti <rom.lenzotti@gmail.com>, 2021-06-17 07:58:34 +0200, , chore update typescript eslint,,
58,d6a5b77310906595fe4eeca92cea5ffb7f830212,omain Lenzotti <rom.lenzotti@gmail.com>, 2021-06-17 07:51:08 +0200, , feat stripe add option webhookevent decorator allow configurable webhookevent per endpoint  webhookevent secret ..... ,,
59,f6e7a7c040a80ca369cf7c81d55012cfc5f3c379,emantic-release-bot <semantic-release-bot@martynus.net>, 2021-06-17 01:07:26 +0000, , github build run2 v6.56.2 skip,,
60,6e51f75d29ed3b1737d4163707514549d991a90d,omain Lenzotti <rom.lenzotti@gmail.com>, 2021-06-17 02:47:06 +0200, , fix stripe remove console.log,,
61,935fb7c3aaca597e592a61fae9da2ed45511eeed,emantic-release-bot <semantic-release-bot@martynus.net>, 2021-06-14 15:29:56 +0000, , github build run2 v6.56.1 skip,,
62,910a36661b252b63dfd55be9c9fb87684005f0ec,omain Lenzotti <rom.lenzotti@gmail.com>, 2021-06-14 17:13:12 +0200, , fix common ensure building async factory platformmodule 1435,,
63,9e15ac0c8c6576ec67a3fbdcde12b683b0880a51,emantic-release-bot <semantic-release-bot@martynus.net>, 2021-06-12 14:13:19 +0000, , github build run2 v6.56.0 skip,,
64,39cf16b299a9c9d70392ee49291fe924b3ee8541,chrstn <christen@app-logik.de>, 2021-06-12 15:55:42 +0200,809, feat mongoose add support discriminator 1430 close 809,,
65,39b8a09c62046223732536ca8a437b8dcf58d17b,emantic-release-bot <semantic-release-bot@martynus.net>, 2021-06-12 13:53:45 +0000, , github build run2 v6.55.4 skip,,
66,8da76b59f8e50ddd3c87e452321ee35eb1768375,omain Lenzotti <rom.lenzotti@gmail.com>, 2021-06-12 12:32:12 +0200, , fix schema allow genericof object usage,,
67,9a6c0a906e90e8b7d79cc66536981293a94f30ff,ependabot[bot] <49699333+dependabot[bot]@users.noreply.github.com>, 2021-06-01 05:14:15 +0000, , chore deps dev bump type mocha 8.0.3 8.2.2 bump type mocha http github.com definitelytyped definitelytyped tree head type mocha 8.0.3 8.2.2 release note http github.com definitelytyped definitelytyped release commits http github.com definitelytyped definitelytyped commits head type mocha signed dependabot bot support github.com,,
68,ee8a364b54c02823b530f3266837de23be865bc3,emantic-release-bot <semantic-release-bot@martynus.net>, 2021-06-12 12:50:45 +0000, , github build run2 v6.55.3 skip,,
69,f4099c6ee2bfff2cf496a613e34f4b06e058f520,omain Lenzotti <rom.lenzotti@gmail.com>, 2021-06-12 13:56:43 +0200, , fix update package,,
70,3097a855ace65010a0a85ae5e1e53570681c4f62,omain Lenzotti <rom.lenzotti@gmail.com>, 2021-06-12 13:10:15 +0200, , doc fix snippet,,
71,5075dea0213e1228970692c9ca3e856cec4eb966,omain Lenzotti <rom.lenzotti@gmail.com>, 2021-06-12 13:08:34 +0200, , fix update tslib lerna,,
72,fbfd39ab70ed9db224b895a7f76d65ae6d564893,emantic-release-bot <semantic-release-bot@martynus.net>, 2021-06-12 11:22:50 +0000, , github build run2 v6.55.2 skip,,
73,39e445f56774db58dc6ba6b5e2e6039e138299ed,omain Lenzotti <rom.lenzotti@gmail.com>, 2021-06-12 13:04:28 +0200, , fix common remove catcherror 1432,,
74,8cd1c26c891ab93052ecedeef4f1ede9c25be79b,emantic-release-bot <semantic-release-bot@martynus.net>, 2021-06-12 08:22:21 +0000, , github build run2 v6.55.1 skip,,
75,716a841ab7112ab30bcc57bef7ae8c52d0c89792,omain Lenzotti <rom.lenzotti@gmail.com>, 2021-06-12 10:05:50 +0200, , fix common catch correctly error 1429,,
76,087c2e6e73cacf4e73901fcf1c2f97f47f60fe80,omain Lenzotti <rom.lenzotti@gmail.com>, 2021-06-10 14:48:56 +0200, , doc fix typo,,
77,23edb0964cd9f3d55192177803909b551ee96734,omain Lenzotti <rom.lenzotti@gmail.com>, 2021-06-10 14:48:33 +0200, , doc update prisma information,,
78,0d66eb956714ba0b083cfd18c435a9feec4a2f83,emantic-release-bot <semantic-release-bot@martynus.net>, 2021-06-10 09:46:03 +0000, , github build run2 v6.55.0 skip,,
79,f083149074c177e369bcfd66c1cd889245dfd0de,omain Lenzotti <rom.lenzotti@gmail.com>, 2021-06-10 11:29:48 +0200,1397, feat socket add tsed socket testing test socketio server application 1427 close 1397,,
80,b9198b2b593bbc2d5c7a3356490bf0a19fd6034b,omain Lenzotti <rom.lenzotti@gmail.com>, 2021-06-07 19:03:31 +0200, , doc update website template,,
81,35638a143ec2543dcbf2bcf6c46bdf579758e54b,emantic-release-bot <semantic-release-bot@martynus.net>, 2021-06-05 17:15:46 +0000, , github build run2 v6.54.0 skip,,
82,b290ff159bc3664c1d0d124ca3b10c22af755b59,chrstn <christen@app-logik.de>, 2021-06-05 19:01:09 +0200, , feat event emitter add new package tsed event emitter emitting listening event 1425,,
83,babd3bdf04b70d3f937eef7b49f37f08dce7eb75,enjamin Daschel <coffeemaxed@gmail.com>, 2021-06-03 21:41:28 -0700, , doc fix link listr npm package 1424,,
84,653299d9cb40a8e702b7e520a453066db82225e7,omain Lenzotti <rom.lenzotti@gmail.com>, 2021-06-01 14:26:37 +0200, , doc update doc,,
85,264a0ff8e9520c15b0d7ba60b4752d91f59bd19a,omain Lenzotti <rom.lenzotti@gmail.com>, 2021-06-01 14:10:14 +0200, , doc update documentation example,,
86,e7d14e68f7e63f0759ed717d7d9047c742d1d7de,omain Lenzotti <rom.lenzotti@gmail.com>, 2021-05-30 14:12:23 +0200, , merge add unit test,,
87,289eac73a8dcc31d988bb27394837643e97b84a7,omain Lenzotti <rom.lenzotti@gmail.com>, 2021-05-30 14:11:34 +0200, , chore add unit test cover pathparams number,,
88,584b3d7f0edc87c9b3cb082aafb42c1aec13c0de,omain Lenzotti <rom.lenzotti@gmail.com>, 2021-05-30 10:51:12 +0200, , merge fix documentation,,
89,2ce242a80c42df397375a73cf1ce8c25ad473e7b,omain Lenzotti <rom.lenzotti@gmail.com>, 2021-05-30 10:50:15 +0200, , doc fix socket page,,
90,294e8ab0c387f39436a402510c909befc0c68e15,omain Lenzotti <rom.lenzotti@gmail.com>, 2021-05-30 10:49:59 +0200, , doc add agenda tuto page,,
91,3e33aa293259c7167653280474b6fa342bb3fa00,emantic-release-bot <semantic-release-bot@martynus.net>, 2021-05-28 12:49:34 +0000, , github build run2 v6.53.0 skip,,
92,b0060cebb04c9e6c100283735a95028776c6d71b,chrstn <christen@app-logik.de>, 2021-05-28 14:34:19 +0200, , feat agenda add new module job scheduling agenda 1407,,
93,fcbbdd0d17ae7ab587f563b76bef0c3bfbc32249,omain Lenzotti <rom.lenzotti@gmail.com>, 2021-05-28 08:04:17 +0200, , doc fix path issue documentation 1414,,
94,d3a2a6edf0018853438de1ae0fd95b7881b9eda7,emantic-release-bot <semantic-release-bot@martynus.net>, 2021-05-27 06:34:37 +0000, , github build run2 v6.52.0 skip,,
95,09c8bfa368acc3d8453023648dcf091b09c5d907,omain Lenzotti <rom.lenzotti@gmail.com>, 2021-05-27 08:18:59 +0200,1411, merge pull request 1411 tsedio chore refactoring graphql feat split package allow apollo server usage without typegraphql,,
96,2544e25a3e56edb9c3e5c21b3c2942df00852ae1,omain Lenzotti <rom.lenzotti@gmail.com>, 2021-05-27 07:43:48 +0200, , fix common fix build pipe koa platform,,
97,3e7a7bead593ac127c324be7560a61b2226925f0,omain Lenzotti <rom.lenzotti@gmail.com>, 2021-05-25 18:29:41 +0200, , feat split package allow apollo server usage without typegraphql add tsed apollo add tsed typegraphql deprecate tsed graphql,,
98,ce336eb98c4206542722153ea26deed5a5b348f1,uke Bond <luke@designlogica.co.uk>, 2021-05-26 16:31:42 +0100, , doc socket doc update 1412,,
99,955ac57d32ff1815738149ec514d6e491a7de0b7,emantic-release-bot <semantic-release-bot@martynus.net>, 2021-05-26 09:31:21 +0000, , github build run2 v6.51.0 skip,,
100,c3cf0a2f6ef066539df9b1158cd3107830492dcf,teffen <3752127+klotztech@users.noreply.github.com>, 2021-05-26 07:55:21 +0200, , feat mongoose add decorator numberdecimal support decimal128 value 1408 authored klotztech klotztech,,
101,0c6db44f583358581f7acc631f954ed835f2e307,omain Lenzotti <rom.lenzotti@gmail.com>, 2021-05-24 16:11:38 +0200, , doc update documentation,,
102,7127440ff70cfc5243cfd9cad04a793757aa307c,omain Lenzotti <rom.lenzotti@gmail.com>, 2021-05-23 15:51:14 +0200, , doc add repository example,,
103,2eb2f95ab8cf0a48f27a773fe2961ad69b3f93e6,omain Lenzotti <rom.lenzotti@gmail.com>, 2021-05-23 15:23:57 +0200, , doc fix typo authored loriane eymann 34451946 lorianee,,
104,25d51c9671de1eb905646948319292c31d8a83ad,omain Lenzotti <rom.lenzotti@gmail.com>, 2021-05-21 10:09:35 +0200, , doc add prisma documentation,,
105,9358d77c84386bab278461598380a8a650371b9a,emantic-release-bot <semantic-release-bot@martynus.net>, 2021-05-24 06:39:13 +0000, , github build run2 v6.50.0 skip,,
106,49a85e43c1b37b1e4442e37f496c5d5ddde2f171,AROMIR TRINTA <iarki90@gmail.com>, 2021-05-24 02:20:55 -0400, , feat mongoose adding mongooseindexes decorator 1406,,
107,7365f383f5da2ca44435c01d9b7ebd4cce945269,omain Lenzotti <rom.lenzotti@gmail.com>, 2021-05-22 10:18:39 +0200, , update readme.md,,
108,e75cd888e0fd6514d854d91c0d568dfe10d6be57,omain Lenzotti <rom.lenzotti@gmail.com>, 2021-05-22 10:10:57 +0200, , doc update readme,,
109,c0b31eca6459d5498318b4b80a15b732ef05892d,omain Lenzotti <rom.lenzotti@gmail.com>, 2021-05-22 09:35:25 +0200, , doc update readme repository,,
110,45c3748dc199f577cfac5553ad203806df47279a,emantic-release-bot <semantic-release-bot@martynus.net>, 2021-05-21 09:00:50 +0000, , github build run2 v6.49.3 skip,,
111,d750ce157385625685211145ae5404cb494f40be,omain Lenzotti <rom.lenzotti@gmail.com>, 2021-05-18 09:47:51 +0200, , fix refactoring interface code,,
112,84abddb25949bd26dd8ab96daec9047967ee9fb4,omain Lenzotti <rom.lenzotti@gmail.com>, 2021-05-18 08:32:26 +0200, , fix common remove deprecated signature,,
113,c31a55b33502a7b1448e16dbdd4990a1c05f098a,omain Lenzotti <rom.lenzotti@gmail.com>, 2021-05-15 22:27:19 +0200, , chore use weakmap store jsonmapper class,,
114,827462c5276eae508854fe9e4733d103799f30c9,omain Lenzotti <rom.lenzotti@gmail.com>, 2021-05-15 18:31:54 +0200, , chore remove deprecated decorator render tsed common,,
115,adef00c790531aad042b77931e8141a1b0ad3f43,omain Lenzotti <rom.lenzotti@gmail.com>, 2021-05-15 18:28:07 +0200, , chore remove deprecated decorator status returntype tsed common,,
116,2bf9773cdc323095954a90a8932e9805b60b70fd,omain Lenzotti <rom.lenzotti@gmail.com>, 2021-05-15 18:22:44 +0200, , chore remove deprecated decorator contenttype header tsed common,,
117,d3a161ab1f3a9ff202d41cd9aa547e760a0b9c8c,omain Lenzotti <rom.lenzotti@gmail.com>, 2021-05-15 18:15:07 +0200, , chore remove deprecated decorator jsonschema,,
118,d8e4b0e948a3dc39f02b3d8415e94ceed23695b7,emantic-release-bot <semantic-release-bot@martynus.net>, 2021-05-20 10:28:58 +0000, , github build run2 v6.49.2 skip,,
119,7b895d6ca9a114d89f7fc614071c93dcc8e33086,omain Lenzotti <rom.lenzotti@gmail.com>, 2021-05-20 12:00:19 +0200, , fix jwks update code sync,,
120,4c347197b8db795b3dafb445605a1338e6ce5989,emantic-release-bot <semantic-release-bot@martynus.net>, 2021-05-17 17:30:14 +0000, , github build run2 v6.49.1 skip,,
121,aaa3b687c098330877cfb1890f2d742e917b109b,omain Lenzotti <rom.lenzotti@gmail.com>, 2021-05-17 17:14:21 +0200, , fix jwks add missing dependency,,
122,b4bb3727c6bbee430fb5510ef92edf6f810acc19,emantic-release-bot <semantic-release-bot@martynus.net>, 2021-05-17 16:16:44 +0000, , github build run2 v6.49.0 skip,,
123,d52cbc986a6b9ef321e6c4cf91604268324712a6,omain Lenzotti <rom.lenzotti@gmail.com>, 2021-05-17 17:14:21 +0200, , feat oidc export jose utils tsed jwks,,
124,82bd69cb2b179efb56d3fc6f63f6f50e4a3ff495,omain Lenzotti <rom.lenzotti@gmail.com>, 2021-05-17 16:49:03 +0200, , feat oidc add new package tsed jwks generate jwks key pair,,
125,322149a0142f694b4e038419d086f749c8dfe2ca,omain Lenzotti <rom.lenzotti@gmail.com>, 2021-05-17 08:28:34 +0200, , merge chore optimize core,,
126,5326f2834a8a9059ae7d0c5281a182ec85c3b93b,omain Lenzotti <rom.lenzotti@gmail.com>, 2021-05-15 22:20:34 +0200, , chore remove registry class registry,,
127,c82f2f3b8e33965709be07aa85a915c0f23470b6,emantic-release-bot <semantic-release-bot@martynus.net>, 2021-05-16 21:11:55 +0000, , github build run2 v6.48.6 skip,,
128,c8c9f5f0f8abf47792da1d4977d1f7724149b4de,omain Lenzotti <rom.lenzotti@gmail.com>, 2021-05-16 11:56:18 +0200, , merge chore clean code,,
129,d70dc3bfa85aa7f8fab301e5233b3e01de37678e,omain Lenzotti <rom.lenzotti@gmail.com>, 2021-05-15 18:41:32 +0200, , chore replace hashof usage native record interface,,
130,858d3ecd286501b363005fb7d666c092dde19c34,omain Lenzotti <rom.lenzotti@gmail.com>, 2021-05-15 18:35:42 +0200, , chore remove deprecated,,
131,e4301440fa2e8b09daee4898c1d12b64d3ec2534,omain Lenzotti <rom.lenzotti@gmail.com>, 2021-05-15 18:33:57 +0200, , chore remove applybefore util,,
132,ae79fc575bbee5f0764620bc812b7a481493cc9f,omain Lenzotti <rom.lenzotti@gmail.com>, 2021-05-15 18:10:16 +0200, , chore remove unused deprecated applydecorators function,,
133,ca044a03576158beac753413fc80173c9e26ce9c,omain Lenzotti <rom.lenzotti@gmail.com>, 2021-05-16 11:44:57 +0200, , merge chore remove registry,,
134,a553356633bd83992cad66053c6840d02e8d922f,omain Lenzotti <rom.lenzotti@gmail.com>, 2021-05-15 18:07:36 +0200, , chore refactoring registry,,
135,f7e7440e76443e02f8789a140fbdb3bb596b648c,omain Lenzotti <rom.lenzotti@gmail.com>, 2021-05-15 18:07:23 +0200, , chore refactoring graphql registry,,
136,f029cdfbd650c65bdf7bbad9aecabdc232b8e5b6,omain Lenzotti <rom.lenzotti@gmail.com>, 2021-05-15 18:05:29 +0200, , chore refactoring mongoose model registry,,
137,49ae7b8b7bfaa06736158f2276ac07a9218bf7ab,omain Lenzotti <rom.lenzotti@gmail.com>, 2021-05-15 18:03:18 +0200, , chore refactoring protocol registry,,
138,e1f3897ac93c4cc964953813de64c8fedbfb1018,omain Lenzotti <rom.lenzotti@gmail.com>, 2021-05-15 18:02:27 +0200, , chore refactoring socket registry,,
139,460a0555bde2ffb288c249556779424fec8c1ef8,omain Lenzotti <rom.lenzotti@gmail.com>, 2021-05-15 17:19:14 +0200, , chore remove middleware registry,,
140,3fe0ed0e9f74c4a7a884bdc6417fb42445cb7164,omain Lenzotti <rom.lenzotti@gmail.com>, 2021-05-16 11:38:09 +0200, , merge chore coverall,,
141,3029a8931879b4d865c84e19d16901511e005a04,omain Lenzotti <rom.lenzotti@gmail.com>, 2021-05-16 11:37:13 +0200, , chore add benchmark tool,,
142,6a4bb7368a118813fbf0c32282c4ebff15e8e7da,omain Lenzotti <rom.lenzotti@gmail.com>, 2021-05-13 18:01:19 +0200, , chore update test add coverall action,,
143,46c36ac2f8e64cebf3654dcfe30ddd6929d5fd10,omain Lenzotti <rom.lenzotti@gmail.com>, 2021-05-16 11:31:18 +0200, , merge chore optimize handler,,
144,4efa36e544c8f9a7ca9dc7f1d9a6f62094778a6d,omain Lenzotti <rom.lenzotti@gmail.com>, 2021-05-16 11:12:41 +0200, , fix common optimize handler creation call,,
145,3d5edd6503648bcc7461a50d74ca4aa2e961fe36,omain Lenzotti <rom.lenzotti@gmail.com>, 2021-05-15 11:07:31 +0200, , chore replace ipipe pipemethods,,
146,653297b26681687b511f5b1caace2312e64a8779,omain Lenzotti <rom.lenzotti@gmail.com>, 2021-05-14 11:45:07 +0200, , fix update tsconfig option preserve native async await perf,,
147,baf52f19fb1115c8e040f8716c1751929f2dabd1,omain Lenzotti <rom.lenzotti@gmail.com>, 2021-05-16 10:52:26 +0200, , merge chore optimize context,,
148,76d77f7f92fabf7ce03dac1c3f28fc6dda2d7588,omain Lenzotti <rom.lenzotti@gmail.com>, 2021-05-15 14:58:54 +0200, , chore add default generic type local,,
149,a592e39cf7cb984b5f754bfde505141c59793e2b,omain Lenzotti <rom.lenzotti@gmail.com>, 2021-05-14 18:03:48 +0200, , fix common improve context creation performance,,
150,1f5d38653929ae6ee66f3dbce19b41da0df93799,omain Lenzotti <rom.lenzotti@gmail.com>, 2021-05-14 11:44:09 +0200, , fix improve performance localscontainer,,
151,6c60d86bf925f18e3c5cffd228efed5d8ec6e7b3,emantic-release-bot <semantic-release-bot@martynus.net>, 2021-05-13 08:25:47 +0000, , github build run2 v6.48.5 skip,,
152,e453b54b360314924cd523dc17f3cf0b35001bdc,omain Lenzotti <rom.lenzotti@gmail.com>, 2021-05-13 10:13:16 +0200, , fix migrate organization 1395,,
