id,sha,author,date,issue,message,file,content
655,9a9c82cd01b8973c0ff51a6d6663141fb9903aaa,ames Mead <james@floehopper.org>, 2015-03-21 12:57:19 +0000, , added section using mocha rspec rail fix 221,,
656,7fd79561c44381ea56d12243190d22d922d97bce,ames Mead <james@floehopper.org>, 2015-03-15 14:48:27 +0000, , remove test unit development dependency convinced dependency introduced actually necessary ,,
657,ff8ce3817ee1ee8181a586ac4c7f56a28b0e4c46,ames Adam <james@lazyatom.com>, 2015-03-04 14:43:22 -0600, , explicitly support matching hash parameter includes normal hash includes method synonym has_key would existing matcher behaviour prior change new behaviour matcher also given hash instance matched key hash string class ruby 1.8.7 responds yielding whole string actually want string instance use basic code path,,
658,2e5481f37ee06faf2cae4559a5eee5f9ac5a361b,ames Adam <james@lazyatom.com>, 2015-03-04 14:11:34 -0600, , add explicit test includes matcher string previously includes matcher would work object responds include included string instance previous change broke string respond,,
659,f166fa9e64fa04eb649e108615e7a34320247310,ames Adam <james@lazyatom.com>, 2015-03-02 17:44:12 -0600, , allow includes matcher take matcher argument able created matcher form object.expects foo .with includes has_entry key value successfully match method call like object.foo key value,,
660,6a928ac91f23f888cef2529506884f1b9d967aa0,ames Mead <james@floehopper.org>, 2015-03-15 14:13:34 +0000, , invert sense environment variable generating doc seeing error travis build ruby version earlier 1.9.2 error occurred installing redcarpet 3.2.2 bundler continue happening forgotten include mocha_no_docs environment variable specific build i.e matrix include .travis.yml instead adding environment variable build elected invert logic,,
661,2928a006c8e45b61ff7d386ae0d0c931981f263d,ames Mead <james@floehopper.org>, 2015-03-14 11:21:44 +0100, , deps test libs depend doc generation option,,
662,ce3a242216fcaa434380bb62603c7de96ccdee08,ames Mead <james@floehopper.org>, 2015-03-14 11:09:53 +0100, , add test unit development dependency seeing following exception travis build ruby 2.2 test test_helper.rb require load file test unit loaderror e.g http travis ci.org freerange mocha job 54347342 able reproduce problem locally hoping change fix,,
663,7c845abb7fbc9de5771a9055c812774be4724509,ames Mead <james@floehopper.org>, 2015-03-14 10:44:50 +0100, , apply env var travis build previously env var contributed matrix build intended,,
664,30c34847a5de1bf45013b1f7cc421c4d3cfbf036,ames Mead <james@floehopper.org>, 2015-03-14 10:41:43 +0100, , generate doc travis build prevents error installing redcarpet ruby 1.8.7 build matrix script necessary,,
665,6691669045fd17e503ef37db3ec895bdbb357da4,ames Mead <james@floehopper.org>, 2015-03-14 10:10:32 +0100, , remove version restriction redcarpet seeing following exception trying generate doc nomethoderror undefined method lax_spacing redcarpetcompat yard v0.7.4 longer need restriction version redcarpet introduced commit restriction seems causing exception mentioned possible could remove dependency redcarpet altogether think yard built markdown processor however managed convince removal break formatting somewhere seems like best option http github.com lsegal yard blob master changelog.md 074 december 2011 ,,
666,baad405fc46a198c550a810ca88975c31f62f0af,ames Mead <james@floehopper.org>, 2015-03-02 20:50:29 +0000, , run latest version ruby v2.1 v2.2 travis ruby supported semantic versioning since v2.1 mean safe run latest patch version given major minor version give earlier head incompatibility inadvertently introduced thanks sanemat suggestion 216,,
667,a468c53adef477c13bed29bd3ef07737f7bf773b,ames Mead <james@floehopper.org>, 2015-03-02 20:46:31 +0000, , remove minitest version constraint gem spec bodgy way make performance test work bit fashion minitest ideal longer global way set output reporter way disable minitest autorun mechanism see unhelpful output running test end however really keeping eye benchmark time currently part travis build seem hugely important seems important remove gem spec constraint travis build run latest version minitest,,
668,82a1a53a9a989985a70349b249da6fd82fba708f,ames Mead <james@floehopper.org>, 2015-03-02 19:52:32 +0000, , add ruby 2.2.0 travis build matrix,,
669,788055cf2e0a9266f29719060e9d2d1857d66c07,ames Mead <james@floehopper.org>, 2015-03-02 19:42:51 +0000, , constrain version minitest gem spec v4.x major change happened minitest seeing exception like one running performance test benchmarking 1000 iteration ... rake aborted nomethoderror undefined method output minitest unit class user jamesmead code freerange mocha rakefile user jamesmead code freerange mocha rakefile block level top required user jamesmead code freerange mocha rakefile user jamesmead code freerange mocha rakefile block level top required task top default test performance see full trace running task trace relying bit minitest longer exist form rather addressing problem adding constraint gem spec file effort get travis build passing ruby v2.2 soon possible possible run issue minitest specific gemfiles let see,,
670,a65ea1ed3dce43cbc2cc16b3660afd2cce3db33e,ames Mead <james@floehopper.org>, 2015-03-02 19:37:21 +0000, , ruby v2.2 nil frozen test irrelevant scenario latest version ruby mocha stubbingerror raised message stub method frozen object nil behaviour already tested generic safe ignore test relevant version ruby,,
671,516f17c6f570f1c1835ab411726b5c06354fb192,ames Mead <james@floehopper.org>, 2015-03-02 18:44:07 +0000, , ruby v2.2 test libs standard library test unit minitest removed standard library ruby v2.2 since mocha relies presence either test unit minitest run test commit make minitest explicit development dependency version ruby make available default http bugs.ruby lang.org issue 9711 note,,
672,6119460d9ad80a8b1996a7cb2067122db866de07,ared Beck <jared@jaredbeck.com>, 2014-12-08 11:32:52 -0500, , fix typo readme,,
673,f158adc4df9390cc47e8575bca8fb503a3aa37ec,hris Roos <chris@seagul.co.uk>, 2014-06-23 11:40:31 +0100, , allow gofreerange.com host changed rakefile make possible publish doc another host useful trying get another server configured,,
674,d02d2cc65c4429ba7c5c98d208e25b27d843380a,ames Mead <james@floehopper.org>, 2014-06-19 16:16:42 +0100, , need update rubygems travis before_install block added bug version rubygems provided travis default v2.2.0 need fix rubygems v2.2.1 default version provided travis v2.2.2 ,,
675,9edba0fee881c0d70f484e99a58d8b9d20743789,ames Mead <james@floehopper.org>, 2014-06-19 15:36:32 +0100, , allow stubbing method instance responds fix 200 previously calling object respond_to instance class using object allocate instantiate example instance class interrogate using object respond_to obviously perfect given method might defined time stubbing invocation mean mocha objectmethods method_exists mocha classmethods method_exists work similar way,,
676,94d4ea13b1578a0e7d8e44a0d400be404727e7b7,ames Mead <james@floehopper.org>, 2014-06-06 18:33:54 +0100, , add license gemspec requested coreyhaines fix 201,,
677,88b276de4d9434bb5c83cad69a680a8e4762de07,ames Mead <james@floehopper.org>, 2014-05-13 20:05:00 +0100, , update readme prepare release,,
678,8523bb26cbdb95061b0c461d93fc91dec71ca6aa,ames Mead <james@floehopper.org>, 2014-05-13 19:12:49 +0100, , set visibility instance stub method omission drawn attention mrsimo http github.com mrsimo mocha commit lib mocha p21,,
679,d9832811fd457754ade6683c9864a3a9048e4618,ames Mead <james@floehopper.org>, 2014-05-13 19:11:08 +0100, , add message method visibility assertion,,
680,d20094777a55569acb496e1163b2da503dac27f6,lbert Llop <mrsimo@gmail.com>, 2014-03-25 12:41:58 +0100, , stub method prepended method prepended method,,
681,b0becfddb11a8312ede9f4060a16f6133603304a,ames Mead <james@floehopper.org>, 2014-02-20 15:47:13 +0000, , improve doc mock responds_like fix 189 skip,,
682,7095aaad20d283ca4b710aa534a397c2136dfe12,ames Mead <james@floehopper.org>, 2014-02-13 12:01:25 +0000, , use github convention instruction contributing mocha,,
683,3a84e5b093280260809f1ab0b434fb7c47347bd3,avid Fernandez <dev@10io.net>, 2014-01-20 09:50:47 +0100, , fix typo skip,,
684,7c27e4f1a70c5ddea30a30e35c8595be2f2d0753,ames Mead <james@floehopper.org>, 2014-01-11 13:47:59 +0000, , update version v1.0.0 skip,,
685,1d6b08f0c802a64f20464a4f2fa2ef6861deb9c8,ames Mead <james@floehopper.org>, 2014-01-11 13:46:58 +0000, , update readme.md v1.0.0 skip,,
686,a3b725a1a154b356e90ca35cba38b077fe73d85d,ames Mead <james@floehopper.org>, 2014-01-11 13:08:51 +0000, , another tweak release.md skip,,
687,d68bfded1cb4c8d5d4795b027905030837c91997,ames Mead <james@floehopper.org>, 2014-01-11 13:06:14 +0000, , tweak release.md group internal external change skip,,
688,d16b088311f2e4a35888a2f9211a9b345f82f1b3,ames Mead <james@floehopper.org>, 2014-01-11 12:42:46 +0000, , merge branch stable,,
689,78b6170c61dcca17ad3cb05383aaf3c4dd60f748,osef imnek <retro@ballgag.cz>, 2014-01-06 13:56:33 +0100, , little love made readme.md close 180 skip,,
690,d155c5719946aa75f3816f294aaf4f5d89b95df5,osef imnek <retro@ballgag.cz>, 2014-01-06 13:56:33 +0100, , little love made readme.md skip,,
691,3128fb8475bf9af81532f7a71b0fe6ca376f8c6e,ames Mead <james@floehopper.org>, 2014-01-07 20:55:56 +0000, , update latest rubygems travis build order obtain fix rubygems rubygems 763 need least rubygems v2.2.1 however default version provided travis v2.2.0,,
692,66f76d3a37b1930c41b5586f67ac5fcfe4b35ca1,ames Mead <james@floehopper.org>, 2014-01-07 20:43:47 +0000,763, use standard version rubygems travis build rubygems rubygems 763 fixed able without before_install hook assuming travis build using latest rubygems i.e v2.2.1,,
693,4f2fb511ee07bdc1464acecd5e5a616765db800e,ames Mead <james@floehopper.org>, 2013-12-24 16:59:13 +0000, , update release note bump version 1.0.0.alpha,,
694,ae6f4939a7552ea358315f85c9f76ca176fd5af7,ames Mead <james@floehopper.org>, 2013-12-28 18:38:41 +0000, , assume mocha required requiring mocha setup need require mocha version file note mocha likely auto required using within bundler gemfile although careful remove require false option may gem declaration earlier version mocha,,
695,6a6c8ddc2336dad3df8e839c0cfc71c0208a6224,ames Mead <james@floehopper.org>, 2013-12-28 18:30:07 +0000, , provide shortcut integrating specific test library use require mocha test_unit  require mocha mini_test instead require mocha integration test_unit mocha integration  require mocha integration mini_test mocha integration note assume mocha required either explicitly require mocha  auto required via bundler,,
696,049080c673ee3f76e76adc1e1a6122c7869f1648,ames Mead <james@floehopper.org>, 2013-12-24 16:30:19 +0000, , automatically try integrate test library since automatic test library integration functionality requires test library loaded usually happen bundle loaded make thing simpler use require mocha setup explicitly setup mocha know test library loaded deprecated use require mocha v0.13.0 plan release change part major version bump i.e v1.0.0 ought safe remove deprecation lib mocha.rb,,
697,f33f506492f0536b232148fa059a41c95349d96a,ames Mead <james@floehopper.org>, 2013-12-30 12:36:05 +0000, , consider stub superclass none exist primary receiver note may break existing test rely old behaviour stubbing superclass method invoking method child class would previously cause unexpected invocation error superclass child class delegated different mock object i.e superclass mocha class instance variable different child class mocha class instance variable searching inheritance hierarchy delegate mock object provide intuitive behaviour instead unexpected invocation error see invoking method child class cause stubbed method superclass used class parent def original_value end end class child parent end parent.stubs my_class_method .returns stubbed_value old behaviour unexpected invocation error new behaviour stubbed_value consistency also implemented similar change corresponding any_instance scenario class parent def original_value end end class child parent end .returns stubbed_value old behaviour unexpected invocation error new behaviour stubbed_value change largely based change suggested ccutrer 145,,
698,208ba829462d9fe09c5a8a77c0b447ed80ae046a,ames Mead <james@floehopper.org>, 2013-12-30 17:54:16 +0000, , add ruby 2.1.0 build matrix,,
699,716fed51a241778f6999ce72ea9315de15064ef9,ames Mead <james@floehopper.org>, 2013-12-29 15:53:03 +0000, , avoid recursion constructing unexpected invocation message unexpected invocation occurs try construct detailed message exception construction message result another unexpected invocation attempt construct simpler version message original unexpected invocation fix 168,,
700,1aae332d296fabbefc2c2471ec072d85193221cf,ames Mead <james@floehopper.org>, 2013-12-28 17:57:58 +0000, , remove unnecessary code integration test test test_helper.rb already load minitest test unit need  also outer test case need type run mocha acceptance test i.e inner test case need either minitest unit testcase minitest test test unit testcase appropriate simplest thing make use mocha testcase already begin defined test test_helper.rb,,
701,7e93e92c8693081ace66dc2857186ffb874a71c7,ames Mead <james@floehopper.org>, 2013-12-28 16:33:37 +0000, , revert another attempt making bundler output verbose reverts commit came workaround fatal bundler error travis ruby 1.8.7 debug output longer needed ,,
702,fca85d1924d065325bfd663c168e3876974646b7,ames Mead <james@floehopper.org>, 2013-12-28 16:33:07 +0000, , revert yet another attempt making bundler output verbose reverts commit came workaround fatal bundler error travis ruby 1.8.7 debug output longer needed ,,
703,56efad387c6196017749f468140fdf50f97fa0cd,ames Mead <james@floehopper.org>, 2013-12-28 16:28:40 +0000, , revert make bundler output verbose debug issue travis reverts commit came workaround fatal bundler error travis ruby 1.8.7 debug output longer needed ,,
704,66bab2a8f4e7cd8734bf88e6f32157c0d5153125,ames Mead <james@floehopper.org>, 2013-12-28 16:22:26 +0000, , use earlier version rubygems avoid bundler fatal error,,
705,079c4f6fa2255f85cf9f1bdd69f7f34e485518a4,ames Mead <james@floehopper.org>, 2013-12-28 15:31:52 +0000, , meant use earlier version rubygems previous commit,,
706,d5833a13de2f22f8a591b62ea12d7b4551492b81,ames Mead <james@floehopper.org>, 2013-12-28 15:27:26 +0000,2784, use earlier version bundler avoid bug causing build fail see following detail http github.com travis travis issue 1793 http github.com bundler bundler issue 2784 http github.com rubygems rubygems commit,,
707,a6ca0930876e5999d8cd1dc31876f08284aa430c,ames Mead <james@floehopper.org>, 2013-12-28 14:23:09 +0000, , install latest bundler travis suggested roidrage http github.com travis travis issue 1793 issuecomment 31297362,,
708,7dfba664190ee92639eea05dc2c1bde273e74709,ames Mead <james@floehopper.org>, 2013-12-28 13:39:33 +0000, , revert revert move test unit detection method module reverts commit reverting fix travis build reverting back,,
709,9fd4100d491af6188bd9852cb6d653450a60f0ea,ames Mead <james@floehopper.org>, 2013-12-28 13:37:27 +0000, , revert move test unit detection method module reverts commit travis build commit resulted fatal bundler error,,
710,53c7cf91e0d6339fd8ed6a63412c0a9b7641aac8,ames Mead <james@floehopper.org>, 2013-12-28 13:19:50 +0000, , yet another attempt making bundler output verbose,,
711,1346c5b9f711db7e21dbe37a854d6d5c0067f3d0,ames Mead <james@floehopper.org>, 2013-12-28 12:23:10 +0000, , another attempt making bundler output verbose,,
712,c8bc6d20ddc0e894175632615a131b9d5077ec50,ames Mead <james@floehopper.org>, 2013-12-28 11:51:10 +0000, , make bundler output verbose debug issue travis,,
713,ac6a8422b021810e7899abf9910fa1a51f13a420,ames Mead <james@floehopper.org>, 2013-12-28 11:18:10 +0000, , move test unit detection method module make consistent minitest detection code,,
714,7647ac86aa4be7899e76b09d277929235445aed4,ames Mead <james@floehopper.org>, 2013-12-24 17:18:53 +0000, , include ruby 2.0.0 latest test unit build matrix,,
715,169b5a0ec5fc1290a20fa6c1e21cba0c7b935c74,ames Mead <james@floehopper.org>, 2013-12-27 17:46:42 +0000, , test unit available ruby v1.9.3 standard library came light fix ,,
716,cfd0262c21b29bbdc8fb240cfee2ab80dbc8fdf2,ames Mead <james@floehopper.org>, 2013-12-27 17:42:24 +0000, , fix indentation test test_runner.rb,,
717,7fc0145bcdc6e96d261abd787968940cf7f8d068,ames Mead <james@floehopper.org>, 2013-12-27 17:37:12 +0000, , force use test unit runner etc relevant integration test prior think really testing mocha integration test unit much although testunittest subclass test unit testcase important test case instance temporary one built testrunner run_as_test prior change would used test unit minitest available i.e early version ruby minitest gem loaded intentionally fixed indentation test test_runner.rb diff clearer intend fix indentation separate commit,,
718,14a84f0e651d9f24cc7fa59282c58ba0129ac2b8,ames Mead <james@floehopper.org>, 2013-12-27 17:34:28 +0000, , reset environment variable build seeing problem set one build set subsequent build value first build trumping lack one subsequent one might simpler prefix command environment variable avoid much global state,,
719,d01ed4e20c1de751e756abedba857098ba3c2a21,ames Mead <james@floehopper.org>, 2013-12-27 15:05:29 +0000, , activate integration relevant test library integration test,,
720,8cb17e153410dce6b52698339d1e25c311883b33,ames Mead <james@floehopper.org>, 2013-12-27 14:55:18 +0000, , use shared minitest detection logic,,
721,b20022b0d873a43516c33e748322fbebb8f40ad5,ames Mead <james@floehopper.org>, 2013-12-27 14:29:34 +0000, , add missing require statement,,
722,d65acde8a00815b343e748bb3ec1e6bb5512090d,ames Mead <james@floehopper.org>, 2013-12-27 14:23:09 +0000, , use shared minitest detection logic,,
723,e8d036d7a9440e3d78b9b9d60124812113dff8bb,ames Mead <james@floehopper.org>, 2013-12-27 14:22:26 +0000, , use shared minitest detection logic,,
724,646b0ef3cfb9e1cfc27e80461f4767fe8464540e,ames Mead <james@floehopper.org>, 2013-12-27 14:17:59 +0000, , reduce duplication minitest version detection,,
725,5cc4f7b4cef51f23c54ac5d19d178be587e3d007,ames Mead <james@floehopper.org>, 2013-12-27 14:01:45 +0000, , move minitest detection method module want use logic elsewhere,,
726,662cb86ee4b80e6c1bd89ab1a1ca725c525fdb45,ames Mead <james@floehopper.org>, 2013-12-27 13:27:39 +0000, , include standard build combination travis config broke build missing,,
727,6a3550a9f1bb3337e1ba6b99730727e2cba4871d,ames Mead <james@floehopper.org>, 2013-12-27 13:25:41 +0000, , fix broken build,,
728,d8b6d23022528365b4d28f0629b6d9f71e6907c2,ames Mead <james@floehopper.org>, 2013-12-27 12:27:18 +0000, , extract minitest detection logic couple method also make bit rigorous similar logic used elsewhere plan move method new shared module,,
729,32cd483d095b460f725faab149cc98e9934d5ea2,ames Mead <james@floehopper.org>, 2013-12-27 12:06:39 +0000, , fix mocha integration return value look like got muddle level indentation change .activate return true integration module already applied change logic think make sense i.e return value indicates whether mocha integrated minitest,,
730,bfac1e5db3a49d2d7781a44ef2003541ffa3ab48,ames Mead <james@floehopper.org>, 2013-12-27 11:40:43 +0000, , remove unnecessary rescue block loaderror unlikely impossible require statement within block suspect one point presumably rescue block removed require statement removed,,
731,37b92be0bbd334fa2f1a38a108b9499e138d014d,ames Mead <james@floehopper.org>, 2013-12-24 15:48:26 +0000, , remove unnecessary require statement,,
732,09b69fa59dede154bc725e60d3d798e62023787f,ames Mead <james@floehopper.org>, 2013-12-24 15:03:23 +0000, , add explanation method dispatch heavily based relevant jmock documentation fix 172 http jmock.org jmock1 dispatch.html,,
733,8aebf3c618aad886921d9acfb9cfa546e7c7eff5,rthur Neves <arthurnn@gmail.com>, 2013-12-05 13:10:58 -0500, , make class_eval line number accurate set line number line number def statement,,
734,3c3ce76219379a71afa9481afdedaa038b6376f6,ames Mead <james@floehopper.org>, 2013-10-20 12:34:21 +0100, , update google analytics,,
735,0f6b65fc172874f1a199777d67f6597a437f023f,ames Mead <james@floehopper.org>, 2013-10-12 11:49:00 -0700,166, merge pull request 166 freerange nested responds matcher allows nesting responds_with parameter matcher,,
736,4e0f5c7e0224d62b8198a029af74d993fb37066e,ames Mead <james@floehopper.org>, 2013-10-12 19:24:29 +0100, , allows nesting responds_with parameter matcher,,
737,d228ebfed74f8f094ccd0b264d212f6e46033d40,ames Mead <james@floehopper.org>, 2013-07-28 12:05:42 +0100, , define mocha module referenced test helper defines class testcase within mocha module running test inside bundle mocha module happens defined point however running test outside bundle defined exception raised uninitialized constant mocha nameerror commit fix problem hopefully fix 163,,
738,084e5015116d24ba3e1d7f185ea91a70879aaf17,ames Mead <james@floehopper.org>, 2013-05-31 16:07:07 +0100, , document lack thread safety fix 154,,
739,8ad13a0bc325df5416887c31db121773cd06d17a,ames Mead <james@floehopper.org>, 2013-05-31 15:57:19 +0100, , document use build matrix script fix 160,,
740,919def64edbd611a41c057081fa1b0474960620a,ames Mead <james@floehopper.org>, 2013-05-21 09:04:06 +0100, , stubbing non public method use visibility fix 150 probably break existing test somehow relying stubbed method public original method protected private,,
741,5c0c5c635063461b8d27b7ba0cde650b5ff84a68,ames Mead <james@floehopper.org>, 2013-05-15 08:50:41 +0100, , remove ruby version map build matrix script using rbenv alias plugin alias minor version relevant patch version,,
742,7a6987b0743ab1351bd441cdb8dd7c4e49ef389b,ames Mead <james@floehopper.org>, 2013-05-14 23:49:52 +0100, , fix build matrix.rb script fix 157 also use .travis.yml decide combination run mean simulate travis build locally avoid duplication,,
743,7e91df956675103203d4192b3c291bb2f5bf2c7d,ames Mead <james@floehopper.org>, 2013-05-14 22:31:55 +0100, , update release note bump version 0.14.0,,
744,908c28f1090a575f7a913b25c8aafc03b887067b,ames Mead <james@floehopper.org>, 2013-05-14 10:19:21 +0100, , yay test passing minitest change leave code bit mess since test code happy clear later,,
745,91288948057473d58377a9ab642031fd6eddc9c7,ames Mead <james@floehopper.org>, 2013-05-14 10:01:37 +0100, , introduce common testcase class mocha test longer possible use test unit testcase presence minitest introducing mocha testcase class make test agnostic test library used,,
746,2b1b09d4bdaa305ea34f7eb1ebfe55d895e65593,ames Mead <james@floehopper.org>, 2013-05-13 08:21:32 +0100, , ruby style change prefer use ternary operator parenthesis case,,
747,ea2ec82a66e8da8deaf9bda918f8558a6e22be69,ames Mead <james@floehopper.org>, 2013-05-08 21:53:48 +0100, , update release note bump version 0.14.0.alpha,,
748,1bcf2978d9de9eb95578c594333fd39064958070,ames Mead <james@floehopper.org>, 2013-05-08 09:04:13 +0100, , revert attempt test edge minitest reverts commit,,
749,fdd64db1ae49a8d295ed837c961502983f49aae4,ames Mead <james@floehopper.org>, 2013-05-08 08:58:18 +0100, , attempt test edge minitest,,
750,6a21548c21cf42801a00c405484ffc4e222e5259,ames Mead <james@floehopper.org>, 2013-05-08 00:48:46 -0700,156, merge pull request 156 zenspider minitest5 added minitest support,,
751,e4994cc81f25a1feb0a88d1228e6ada326d1d28e,yan Davis <ryand-ruby@zenspider.com>, 2013-05-07 15:42:29 -0700, , added minitest5 support,,
752,6cf1fe02768d437988c99d5e73adb9103fb76a1a,ames Mead <james@floehopper.org>, 2013-04-02 12:23:22 +0100, , note another rail compatibility problem readme,,
753,50b7af130c6d5f3848078fd3037eeca02204b778,ames Mead <james@floehopper.org>, 2013-04-02 09:30:32 +0100, , update readme reflect fix released rail documentation caused confusion e.g 147,,
754,22830c07aa3f3e88c9198b348ded2dbe3705cf4a,ames Mead <james@floehopper.org>, 2013-04-02 09:23:04 +0100, , update readme match latest version mocha,,
755,9bed441912750d50fbff2a2883d24861ffee1f43,ames Mead <james@floehopper.org>, 2013-03-19 16:26:44 +0000, , revert consider stub superclass none exist receiver fix 145 reverts commit pointed ccutrer solution work case method stubbed child class another method stubbed parent class soon mocha instance variable set child class never try use mocha instance variable parent class time rethink another look 145,,
756,611f5d293f307f7ea355c526ef9e4d01462d75f2,ames Mead <james@floehopper.org>, 2013-03-19 12:27:40 +0000, , update readme reflect recent release rail 3.2.13 latest release rail incorporates pull request avoids mocha deprecation warning,,
