id,sha,author,date,issue,message,file,content
0,191823e8696881ab8c72948165834eca18315cb3,ames Mead <james@floehopper.org>, 2021-06-25 14:50:55 +0100, , skip update documentation v1.13.0 release,,
1,f59385efeea471302c11bbf9ffb70fae51d93a6e,ames Mead <james@floehopper.org>, 2021-06-25 14:48:19 +0100, , bump version 1.13.0 prepare release made minor version bump since includes new functionality,,
2,b30d9a9ae407319837a446634c1f9a0e425c1e50,ames Mead <james@floehopper.org>, 2021-06-25 14:23:17 +0100, , check documentation generated part circleci build yardoc rake task non zero exit code error warning occur thus build would fail,,
3,53a6ee393371cea814fc4709c8d49e5f5967d583,ames Mead <james@floehopper.org>, 2021-06-25 14:22:04 +0100, , add fail warning option yard rake task see 422,,
4,fd2a4c6f21fbf547b7aeaafff49237697a3e548c,ames Mead <james@floehopper.org>, 2021-06-25 12:33:17 +0100, , add weekly scheduled build circleci build run every sunday,,
5,818ca037ff2f352950d6f24fd95efd041ad4ae53,ames Mead <james@floehopper.org>, 2021-06-25 12:25:59 +0100, , add ruby v1.8 circleci build matrix thanks mudge docker image,,
6,607c5aab541e58d668a8b674cf5f3a1b08bfa379,ames Mead <james@floehopper.org>, 2021-06-25 12:20:16 +0100, , add api token fix circleci badge readme apparently need even public project despite circleci doc say http build status badge showing github 35803 http circleci.com doc 2.0 status badge generating status badge,,
7,18d81047fde4800d907382d2ddd2f3fb52671fc9,ollin Styles <collingstyles@gmail.com>, 2021-06-12 12:29:21 -0700, , add has_keys c.f has_entries,,
8,d8f44bcadabb67c47dc33eed8ca1e7010e083485,ames Mead <james@floehopper.org>, 2021-06-20 14:45:32 +0100, , provide wrapped option mocha_inspect hash array,,
9,9c4ef13197300d6edd1990dabd3df00385e40d98,ollin Styles <collingstyles@gmail.com>, 2021-06-12 13:13:40 -0700,513, fix misleading exception message has_entry 513 previously has_entry called without argument raised following exception argumenterror many argument use either single argument must hash two argument key value,,
10,c98c6ec572efc823acf0d5ed0e0882192246088a,ames Mead <james@floehopper.org>, 2021-06-18 16:56:45 +0100,514, use circleci instead travisci automated build 514,,
11,08fca3774ae3dcb3c02e9348441e9df8190a00d6,ames Mead <james@floehopper.org>, 2021-06-18 16:41:51 +0100, , remove travisci config associated file,,
12,c0719fdedeb081756344627079207efa6cecc933,ames Mead <james@floehopper.org>, 2021-06-18 16:41:19 +0100, , update documentation replace ref travisci ref circleci,,
13,f2f879fdec05b0c230675d5a4b1a08f5577b3712,ames Mead <james@floehopper.org>, 2021-06-13 11:34:45 +0100, , add dependency rubocop actually going use attempt run rubocop ruby v2.0.0 onwards point including earlier version,,
14,7ce5f2912e38fbebce274bda7e7ac3618afe12ba,ames Mead <james@floehopper.org>, 2021-06-13 11:09:58 +0100, , fix rake dependency constraint older ruby version,,
15,670da6d08dc9ada921f1bbaa4681e4f74c914120,ames Mead <james@floehopper.org>, 2021-06-13 11:04:24 +0100, , configure circleci build,,
16,c78f75cacf348386524d170300936eec4c1625ba,ames Mead <james@floehopper.org>, 2021-06-10 15:49:39 +0100, , switch newer default travis build env think move trusty container based environment current travis default xenial lxd container based environment,,
17,9e0043ac663f6de42da5d117f2ff7d86ae0c23ee,ames Mead <james@floehopper.org>, 2021-06-10 15:26:18 +0100, , use latest ruby version travis build,,
18,8c99a1bb99f08ed1c9bc758990639cd485a2ff52,ames Mead <james@floehopper.org>, 2021-06-10 15:21:08 +0100, , use latest jruby v9.2.18 travis build,,
19,0f849aa8318a6ec884579c4b3ad8ef1645c0ec0c,ames Mead <james@floehopper.org>, 2021-06-10 15:12:12 +0100, , use consistent jruby version travis build included commit ,,
20,58653dbd5eee6921b176e27311936c3dc936dbff,ames Mead <james@floehopper.org>, 2020-12-23 21:07:02 +0000, , use recent version jruby travis build matrix,,
21,56c167e873e1d31704df17636a39103c962fd18d,ames Mead <james@floehopper.org>, 2020-12-23 15:12:39 +0000, , skip update documentation v1.12.0 release,,
22,eebc6ce93cd5b306b3a470f18848d6da81415f41,ames Mead <james@floehopper.org>, 2020-12-23 15:08:58 +0000, , bump version 1.12.0 prepare release release includes documentation change refactorings bug fix regression introduced v1.10.0 entirely sure semantic versioning version bump erring side caution making minor version bump,,
23,4e927435165a6e0ea025655d360a8b70b96f63be,ames Mead <james@floehopper.org>, 2020-12-23 12:38:33 +0000, , update doc point travis ci.com instead travis ci.org,,
24,a84ab9da9d0977d29e6dc56bf7522386eb68394e,abe Martin-Dempesy <gabetax@gmail.com>, 2020-12-22 09:43:13 -0800, , remove doc test gem reduce size looking http rubygems.org gem mocha version noticed .gem file size increased 94kb v1.7.0 219kb v1.8.0 increase 125kb culprit seems addition generated doc repo think reasonable value including generated doc compiled .gem especially byte size increase gem user still locally still produce documentation rdoc also removed test directory since useful gem user using syntax gemspec used bundle gem http github.com rubygems bundler blob v2.1.4 lib bundler template newgem l23 l27,,
25,e5b9feef3d1d68a774df0e729386748f4d11cf50,ames Mead <james@floehopper.org>, 2020-12-23 10:56:06 +0000, , temporarily ignore ruby v1.8.7 build failure seems kind ssl certificate error installing bundler gem issue look describes seeing obvious going fixed travis time soon given thinking dropping support ruby v1.8.7 moving build somewhere else decided ignore failure http travis ci.org github freerange mocha build 750442638 http travis ci.community ruby ree build broken ssl certificate failure 10866,,
26,1b6571c6c025d938fb92f16df997c8156f0739eb,ndy Waite <andyw8@users.noreply.github.com>, 2020-10-29 13:01:51 -0400, , improvement doc expectation yield multiple_yields particular focus clarifying behaviour expectation yield argument close 495,,
27,1b76e4d5c7665301fa2441e234733a520393eee5,ames Mead <james@floehopper.org>, 2020-09-25 20:31:43 +0100, , patch app.js work jquery v1.9.0 ideally would fixed yard opened fix yet response hence patching note checkout app.js jquery.js doc generated order override version file generated yard http github.com lsegal yard pull 1351,,
28,dd5eeedbe417ea5c851d3d6bdc35d57064b0648c,ames Mead <james@floehopper.org>, 2020-09-25 19:50:16 +0100, , downgrade jquery v1.9.0 v1.8.3 fix problem toggle source link problem seems introduced jquery v1.9.0 also present v1.9.1 unfortunately mean yet addressed cve 2017 16011 intended commit fix 492 http github.com advisory ghsa 2pqj h3vj pqgw ,,
29,2015655500b5db3e2880272c67272274ec8efb64,ames Mead <james@floehopper.org>, 2020-09-25 13:53:44 +0100, , remove reference non existent jquery source map hopefully fix error seeing chrome developer tool,,
30,211098a5dc181c9535cce1e633dd9b4d7ba42525,ames Mead <james@floehopper.org>, 2020-09-24 09:56:56 +0100, , manually upgrade jquery doc v1.7.1 v1.9.0 per commit yet unmerged fix cve 2017 16011 security vulnerability also added new rake task generate_docs prerequisite revert jquery.js file generated yard one git repo yard merged released jquery.js file would overwritten v1.7.1 version every time doc generated http github.com freerange yard commit http github.com lsegal yard pull 1351 http github.com advisory ghsa 2pqj h3vj pqgw,,
31,c619afac24b4bc30f15c630c100facef61ea5916,ames Mead <james@floehopper.org>, 2020-09-24 09:53:44 +0100, , generate doc using newer version yard v0.9.25,,
32,bd8028f88cfa980a0976ddc8d7ed7b5edc8dbfa0,ames Mead <james@floehopper.org>, 2020-07-24 17:42:37 +0100, , update travis badge point main master branch,,
33,186f93f2122a2dea14e84d63b2bbb29f9586632e,itish Rathi <nitishrathi@gmail.com>, 2020-03-16 22:41:53 +0000, , hide respond_to yard documentation,,
34,b4f59daa69a29b2ef1f9dae4160c4aa26898e4e4,lle Jonsson <olle.jonsson@gmail.com>, 2020-03-15 22:09:52 +0100, , use code block doc expectation state_predicate param,,
35,729d43de83a69b0b1178268991bf14452c674c71,ames Mead <james@floehopper.org>, 2020-03-09 20:25:21 +0000,474, merge pull request 474 nitishr remember invocation fix 473 earlier whenever qualified expectation cardinality new cardinality instance would replace old one commit moved invocation recording cardinality meant invocation recorded prior updating cardinality would get discarded along cardinality instance effectively forgotten update quantifier cardinality instance expectation order persist recording invocation across update cardinality http github.com freerange mocha commit,,
36,5c876f4429ff673caa3c61dc8df43082b93a93b2,itish Rathi <nitishrathi@gmail.com>, 2020-03-06 12:14:32 +0000, , refactor remove unnecessary return self at_ least _once method simply delegate at_least at_least return self ending call at_least mean need end self order return self,,
37,f7d901ccf5e467d5ad143d1e4ae3e532eb3006c0,itish Rathi <nitishrathi@gmail.com>, 2020-03-06 11:46:28 +0000, , persist cardinality instance across update fix 473. earlier whenever qualified expectation cardinality new cardinality instance would replace old one moving invocation recording cardinality 59454a8 meant invocation recorded prior updating cardinality would get discarded along cardinality instance effectively forgotten update quantifier cardinality instance expectation order persist recording invocation across update cardinality,,
38,9d0d37a0a9b73d1c15d63a2896d19787b894a2a9,itish Rathi <nitishrathi@gmail.com>, 2020-03-06 11:18:03 +0000, , refactor prep turn class method instance ... order make single cardinality instance persist across update expectation cardinality include time method make space existing protected time method renamed count,,
39,cc91b875f8d351512ca499272df60fa3025c06a2,ames Mead <james@floehopper.org>, 2020-02-10 20:08:21 +0000, , simplify mockery close 449,,
40,c7db3f67e556f6784ae72fbd154edbc71e94d9a0,itish Rathi <nitishrathi@gmail.com>, 2019-12-25 23:54:48 +0000, , remove redundant conditional statement redundant mockery check method already return early doe nothing action allowed,,
41,0532ada9d9b8246ad223c540626b46b16283deb4,itish Rathi <nitishrathi@gmail.com>, 2019-12-25 23:51:41 +0000, , inline method called one place,,
42,365ce92f1da61be24457b08304602c0fdffc08e8,itish Rathi <nitishrathi@gmail.com>, 2019-12-25 23:35:08 +0000, , replace unless empty simpler,,
43,adf704cffe4fddc5f10b38568f35467a07bc8d69,itish Rathi <nitishrathi@gmail.com>, 2019-12-25 22:48:12 +0000, , consistently terminate mockery mocha_inspect newline previously message ended newline state machine defined,,
44,99d79acdc8a63ddc14238161b4356da6c2a06691,itish Rathi <nitishrathi@gmail.com>, 2019-12-25 22:46:04 +0000, , add test coverage displaying state error message asserts state included error message exception satisfied,,
45,db61649a8536fe178a014c7fc19a07ddb5b333f5,itish Rathi <nitishrathi@gmail.com>, 2019-12-25 16:51:17 +0000, , replace conditional next inside block call enumerable reject,,
46,f2d53bcf2eb603d398d512e7e5d8a5bd75e0cc56,itish Rathi <nitishrathi@gmail.com>, 2019-12-25 16:49:40 +0000, , move check outside loop need expectation since configuration change middle call mocha api method,,
47,b615a4d0a640b0cbf24924fe6469fa1d27c71d69,itish Rathi <nitishrathi@gmail.com>, 2019-12-25 16:24:37 +0000, , consistently use instance instance variable mockery previously using mixture instance variable method initialize instance instance variable empty array first call setup since first place reference instance variable,,
48,5412d0a53f351c1a1731bb63643aba4ec010602e,itish Rathi <nitishrathi@gmail.com>, 2019-12-25 16:20:25 +0000, , remove redundant assignment instance mockery.setup instance method already initializes empty nil,,
49,fc5ea2f2b9f83b89f531aff765bd1f097d17c01f,im Meusel <tim@bastelfreak.de>, 2020-01-21 22:43:58 +0100, , add ruby 2.7 travis matrix ruby 2.7 got released time ago linux distribution start ship think make sense test version well,,
50,8e4f1a7c052dc027d44ce7ecd031565ae42cef6c,itish Rathi <nitishrathi@gmail.com>, 2020-01-03 11:24:05 +0000, , remove redundant test close 454 believe test intended refer exception raised mockery verify i.e using test unit minitest assertion using minitest unexpected invocation received mock object raise type exception see mock thus scenario unexpected invocation earlier test case give related coverage believe reason want exception class rescued standard rescue code test could legitimately include rescue block mocha generated exception rescued code test test failure might swallowed confusing error message might displayed much legitimate code test rescue exception preferable mocha generated exception direct subclass exception standarderror said test question really testing anything useful tested elsewhere http github.com freerange mocha blob lib mocha mockery.rb l93 http github.com freerange mocha blob lib mocha http github.com freerange mocha blob lib mocha integration mini_test adapter.rb l26 http github.com freerange mocha blob lib mocha mock.rb l380,,
51,8751dcbda08650a339932d86c9f24d076c167300,ames Mead <james@floehopper.org>, 2020-01-20 15:34:03 +0000, , refactor statemachine related class improve related documentation close 427 close 425 100 convinced making statepredicate superclass state think overall effect improvement authored nitish rathi nitishrathi gmail.com,,
52,4d70b7e80906ef30451e65628aae37ec1c754334,itish Rathi <nitishrathi@gmail.com>, 2019-11-25 23:22:07 +0000, , dry statemachine mocha_inspect,,
53,c2c0877c8f17072a6b460401601b1df648670100,ames Mead <james@floehopper.org>, 2019-12-22 20:09:45 +0000, , improvement doc statemachine is_not although strictly speaking statemachine really overloaded used yard overload tag make clearer method used two different context i.e result passed expectation used instance statepredicate passed expectation used instance state,,
54,cebed27b9bcef0dd1c90a9df5c81ae3ab047c43c,itish Rathi <nitishrathi@gmail.com>, 2019-11-25 21:15:30 +0000, , make signature expectation explicit simplify impl,,
55,6ba9020cb5733d4c70839a24ad8a6742f91c4a82,itish Rathi <nitishrathi@gmail.com>, 2019-11-25 21:10:35 +0000, , update documentation referring state expectation,,
56,ca83014bedf05b80aea6e3ce44ae4caa54ce7ad0,itish Rathi <nitishrathi@gmail.com>, 2019-11-25 18:05:02 +0000, , dry subclassing state statepredicate,,
57,e3be26cb1c009758fbfd32e666fb7c7a444fa831,ames Mead <james@floehopper.org>, 2019-12-22 19:35:22 +0000, , move statepredicate definition state definition change state class inherit statepredicate class make change clearer,,
58,e09deddd9b69349f038f924641de9f7099c032f9,itish Rathi <nitishrathi@gmail.com>, 2019-11-25 18:02:36 +0000, , prepare make statepredicate superclass passing active_check,,
59,90b0e61fb9f9ebc79fee7d910f242e6551ae2e73,itish Rathi <nitishrathi@gmail.com>, 2019-11-25 17:57:56 +0000, , prepare make statepredicate superclass passing description,,
60,fed0eee65a3f8e4dff32d22df017ccd614839403,ames Mead <james@floehopper.org>, 2020-01-20 14:28:08 +0000,207, various improvement readme inspired 207 390. still perfect think definitely improvement thanks nitishr work 390,,
61,d07d41301de9bcce709d5a007ae4254a84abeedc,ames Mead <james@floehopper.org>, 2020-01-20 14:26:13 +0000, , consistently use single quote readme,,
62,7b1857ebf8e45b1a5f26161d1083655002f68727,ames Mead <james@floehopper.org>, 2020-01-20 14:24:51 +0000, , add sub section rail section readme test framework,,
63,75ffc2d648c2f507cec2384a14d5eed6c85145c5,ames Mead <james@floehopper.org>, 2020-01-20 14:17:48 +0000, , move rspec cucumber sub section bundler section readme section rail specific think order make sense,,
64,5c4d12b02ef8dcc5fadbbc3d1136a850ff4d19d4,ames Mead <james@floehopper.org>, 2020-01-20 14:16:39 +0000, , add note readme rail test using minitest default,,
65,b65b070fc64683d602a1fd7c1c777e29ee2f2a7d,ames Mead <james@floehopper.org>, 2020-01-20 14:05:18 +0000, , remove duplicate minitest sub section rail section readme,,
66,3fc8e307b148cea504dad04fc6aef15da9adbcb5,ames Mead <james@floehopper.org>, 2020-01-04 17:36:54 +0000, , skip update documentation v1.11.2 release,,
67,0f9042678c593fd03266f3a0c354ee8f9d737e92,ames Mead <james@floehopper.org>, 2020-01-04 17:33:05 +0000, , bump version 1.11.2 prepare release,,
68,368abd98e6eb6e3dd9b0a4d28e3d8ad927cb7eba,ames Mead <james@floehopper.org>, 2020-01-04 13:12:11 +0000,457, inspect object necessary regression introduced v1.10.0 commit causing test failure described comment prior commit mentioned method signature generated point needed i.e guard condition mockery check since commit method signature always generated see 457 detail entirely happy solution i.e passing proc mockery check  http github.com theforeman hammer cli foreman pull 460 issuecomment 561686926,,
69,314ea92207e8fffec930e1810aac59c37de9537d,itish Rathi <nitishrathi@gmail.com>, 2019-12-26 18:50:29 +0000, , delete unused class logic class moved parameter class commit renamed methodsignature commit turn split methodmatcher commit class removed first commits   ,,
70,4881cc58f667e2df4e590a92889830b98a675a7f,itish Rathi <nitishrathi@gmail.com>, 2019-12-27 23:26:23 +0000, , set moch stubb aexampletest acceptance test,,
71,d917f3322b7dc15e0dc50f3e4f95fec56740451f,itish Rathi <nitishrathi@gmail.com>, 2019-12-26 20:09:36 +0000, , replace original_ method visibility attrs ivars ... since attrs used internally giving rise warning private attribute,,
72,d8019eed369bff98b76ab05d7abe6fdc1ad71f86,ames Mead <james@floehopper.org>, 2019-12-22 19:15:39 +0000, , avoid rubocop comment appearing yard generated doc using single line version note comment still show source code documentation since hidden default think issue attention drawn nitishr commit 427,,
73,6296fd5975f1eb9c8986e8f481f5eefc3a3a4bb6,ames Mead <james@floehopper.org>, 2019-12-22 18:55:53 +0000,442, warn mock object receives invocation another test 442 deprecation warning displayed mock object instantiated one test receives invocation within another test lead unintended interaction test hence unexpected test failure plan raise mocha stubbingerror scenario future authored nitish rathi nitishrathi gmail.com,,
74,2389ff35f4d377d4334802b4ffc3d92c42d5cf8e,itish Rathi <nitishrathi@gmail.com>, 2019-12-17 22:46:03 +0000, , extract mock method reduce complexity mock method_missing method mean longer need disable number rubocop rule,,
75,d53327a3d4f93867708984d22f763384d5f68d25,itish Rathi <nitishrathi@gmail.com>, 2019-12-17 22:44:09 +0000, , extract mock method reduce complexity mock method_missing,,
76,d66c2b501685fe827a2c5e2236475e78d8082c11,itish Rathi <nitishrathi@gmail.com>, 2019-12-14 08:19:36 +0000, , warn mock object receives invocation another test c.f rspec double reused another example scenario http relishapp.com rspec rspec mock doc basic scope double reused another example,,
77,6672b624e319bd6e4dbff9c32a98eddf26a03bd2,ames Mead <james@floehopper.org>, 2019-12-17 12:50:00 +0000, , skip update documentation v1.11.1 release,,
78,109829ace0ba6b48896018b93bad7a77e3510e70,ames Mead <james@floehopper.org>, 2019-12-17 12:49:07 +0000, , bump version 1.11.1 prepare release,,
79,b91b1c9e3640744d63e9f7cd1945b2dd9b3dcb4d,ames Mead <james@floehopper.org>, 2019-12-17 12:42:15 +0000, , enable config option default meant released v1.11.0 project build started failing v1.10.0 would start passing deprecation warning would displayed explaining fix issue however planning release new patch release v1.11.1,,
80,54b1b60e0ef2f078c5d6239a86c577d186b135fc,ames Mead <james@floehopper.org>, 2019-12-16 18:49:56 +0000, , skip update documentation v1.11.0 release,,
81,cbb01cbe7854e97196b734e0dad53ebeb15c9ab0,ames Mead <james@floehopper.org>, 2019-12-16 18:46:00 +0000, , bump version 1.11.0 prepare release,,
82,2ddbdfd2c240eed79311afb1a984cd454fbbc4d9,ames Mead <james@floehopper.org>, 2019-12-16 18:40:10 +0000,441, add expectation 441,,
83,cf4c1e433cf2a0445c4641de5c57c13f9add7abb,ames Mead <james@floehopper.org>, 2019-12-13 15:10:28 +0000, , expand deprecation warning invocation call expectation exists make useful suggestion avoid using deprecated functionality,,
84,7ba3d685852805af0bcac0e351adcdcc2477338e,ames Mead <james@floehopper.org>, 2019-12-13 15:06:24 +0000, , include representation supplied block invocation description think useful consistent include something invocation description indicate supplied block 100 convinced specific representation i.e ... however think,,
85,454652a4114f19aad47cddfb4d7e49694a7956fa,ames Mead <james@floehopper.org>, 2019-12-13 15:04:47 +0000, , add expectation allows expectation match invocation supply block default behaviour unchanged i.e invocation match whether supply block,,
86,215f8e1301fb8ea7544f0937a0cc7878e033a621,ames Mead <james@floehopper.org>, 2019-12-16 13:20:47 +0000,121, improve handling non array argument expectation multiple_yields highlighted investigating issue turned project calling expectation multiple_yields non array argument mostly string see 443 detail documentation said argument array turned case functionality still worked non array argument suspect accident rather design one exception argument hash ended passed block array two element array code used optionally display invocation assuming yield_args always array true similarly code used display deprecation warning also assuming yield_args always array latter causing nomethoderror apiology quality project hopefully fixed underlying problem wrapping non array argument array note using kernel array option give correct behaviour hash argument argument say undocumented behaviour think seems unnecessarily strict case http github.com apiology quality issue 121 http github.com freerange mocha blob lib mocha invocation.rb l24 http github.com freerange mocha blob lib mocha invocation.rb l29 http circleci.com apiology quality 351,,
87,c2cac911cf0be9a4482ddb6a5b8d9228ff3fa5fc,ames Mead <james@floehopper.org>, 2019-12-16 12:44:24 +0000, , add baseline acceptance test yielding behaviour,,
88,1070fc02015a8ea36ad50782f80b557813595c02,ames Mead <james@floehopper.org>, 2019-12-16 12:04:45 +0000, , add missing require statement,,
89,7f2767f5b02e22e457348345a2063948c8930f56,ames Mead <james@floehopper.org>, 2019-12-13 22:42:06 +0000,439, simplify implementation yielding functionality 439 authored nitish rathi nitishrathi gmail.com,,
90,e19b2b1b4e492c227f6fa41f67adbaeca34ad369,itish Rathi <nitishrathi@gmail.com>, 2019-12-13 20:59:29 +0000, , rename yieldparameters multiple_add add longer yieldparameters add method yieldparameters multiple_add method make sense method named add,,
91,cd640dcd67717689c4bb846136bb0c8437932aa0,itish Rathi <nitishrathi@gmail.com>, 2019-12-11 21:40:20 +0000, , convert multipleyields class simple array mean instance variable yieldparameters class array array,,
92,c002e857e42fccf398be424d22a4ae548eb399cb,itish Rathi <nitishrathi@gmail.com>, 2019-12-11 20:58:52 +0000, , inline multipleyields,,
93,ddd47dc34ffa3936106eda982c70517ca0076c0c,itish Rathi <nitishrathi@gmail.com>, 2019-12-11 20:52:47 +0000, , simplify inlining local variable deleting unnecessary call yieldparameters next_invocation,,
94,087aca9bea914e79c3c661dba54a1d0ea5cbbd80,itish Rathi <nitishrathi@gmail.com>, 2019-12-11 20:51:02 +0000, , extract assertion method dry,,
95,4f8c4dcebbdfd3507ea3356edd7926bcd8084271,itish Rathi <nitishrathi@gmail.com>, 2019-12-11 17:14:37 +0000, , remove redundant behaviour multipleyields fully covered,,
96,670dd0f951749115293c35d28719939f26b397d5,itish Rathi <nitishrathi@gmail.com>, 2019-12-11 17:11:24 +0000, , remove assertion yieldparameters next_invocation return value ever instance multipleyields longer much point asserting everywhere,,
97,2ddb7a50f29f8177cdeb4526144e1f3db0ee4214,itish Rathi <nitishrathi@gmail.com>, 2019-12-11 09:07:01 +0000, , remove unused noyields class using multipleyields implement functionality class,,
98,41731a4fdfaecc2d46c94f2be7a6baabd58a5ab5,itish Rathi <nitishrathi@gmail.com>, 2019-12-11 08:54:51 +0000, , use multipleyields instead noyields default expectation hence yieldparameters meant attempt yield matching invocation noyields functionality special case multipleyields functionality i.e one parameter group,,
99,0bacc0183365fc0838a88e2b6c9ec4774b3ca2a4,itish Rathi <nitishrathi@gmail.com>, 2019-12-11 08:52:32 +0000, , remove unused singleyield class using multipleyields implement functionality class,,
100,2ce6c93caaf5549724e3bd05c70c2d10f4ef526c,itish Rathi <nitishrathi@gmail.com>, 2019-12-11 08:36:17 +0000, , inline yieldparameters add,,
101,f70389dac2d80bd6519bb017ab48ebaf05f4c296,itish Rathi <nitishrathi@gmail.com>, 2019-12-11 08:33:50 +0000, , dry yieldparameters add calling multiple_add former special case latter,,
102,eb76a82578b87d12ea5c04ed6e95044232dc3ade,itish Rathi <nitishrathi@gmail.com>, 2019-12-11 08:29:08 +0000, , dry expectation yield calling multiple_yields former special case latter,,
103,bd9f971dfcd9a229f5b28b81f39071d4e77380dd,itish Rathi <nitishrathi@gmail.com>, 2019-11-26 22:06:26 +0000, , move static yard option rake task .yardopts allows doc generated without using rake using almost option rake except dynamic option requiring ruby code point title includes mocha version,,
104,9fc5911bb7d77cc4c10b2875508a6be332bf6592,ames Mead <james@floehopper.org>, 2019-12-13 16:06:33 +0000, , display sponsor button github repo page,,
105,932d1166a36b3601002cdcd95e8160e5a05df829,ames Mead <james@floehopper.org>, 2019-12-13 14:57:31 +0000, , use new behaviour invocation call done commit ,,
106,bca55ae65b7c2faf62ebd18d0fc0421f2a612055,ames Mead <james@floehopper.org>, 2019-12-12 10:58:45 +0000, , skip update documentation v1.10.2 release,,
107,f8bc4943dbd5e9921ff86e6ccd76ed3c78a5d403,ames Mead <james@floehopper.org>, 2019-12-12 10:56:00 +0000, , bump version 1.10.2 prepare release,,
