id,sha,author,date,issue,message,file,content
332,08dc507cee41c7e9e5a44e91ada5bf6f048efcdf,hris Roos <chris@seagul.co.uk>, 2016-11-09 16:17:02 +0000, , remove implementation parent classmethod,,
333,0ff0fe849bb54f0b0d456b5b5b0ac10df5b79435,hris Roos <chris@seagul.co.uk>, 2016-11-09 16:15:32 +0000, , remove implementation parent classmethod,,
334,8530f2961155c8cb53168020208d7e2cc9bd0e16,hris Roos <chris@seagul.co.uk>, 2016-09-28 16:46:25 +0100, , reduce scope rescue classmethod temporarily removed rescue statement see trying catch nameerror raised try store original method test ensure catching exception test acceptance figure probably safest retain behaviour classmethod method used ruby 1.8.x 1.9.x using prepended module therefore overwriting original method later version change commit easier see understand use ignore space option,,
335,5a935ef078e4f25c1f91955d4a996df675f301b0,hris Roos <chris@seagul.co.uk>, 2016-09-28 12:08:55 +0100, , extract classmethod explain interested ruby version think make code easier understand,,
336,189c6157bed9017071b6ec07faddfb31e700d742,hris Roos <chris@seagul.co.uk>, 2016-09-28 12:01:42 +0100, , encapsulate access original_method note use classmethod use original_method within define_method available time block passed define_method evaluated,,
337,0e58584a9b7b05f14a7a2e7c6928e893c0171968,hris Roos <chris@seagul.co.uk>, 2016-09-28 11:54:56 +0100, , avoid passing method_name classmethod original_method equivalent method original_method instance classmethod access method_name need pas explicitly,,
338,5ccdf3b351c225799d61b1970bc234eca1e9050b,hris Roos <chris@seagul.co.uk>, 2016-09-28 11:52:03 +0100, , dry classmethod overridden implementation reusing ,,
339,4b8075c479dc67f1697d807ad6d2a86df4f0111b,hris Roos <chris@seagul.co.uk>, 2016-09-28 11:40:42 +0100, , rename classmethod prepend_module try better describe purpose,,
340,ebb046182ee1547b1ac731afc1f363c594e48934,hris Roos <chris@seagul.co.uk>, 2016-09-28 11:37:33 +0100, , remove prepend_module implementation parent,,
341,ff1560b28f63f3e2120fe2ab493acc19b02928ab,hris Roos <chris@seagul.co.uk>, 2016-09-28 11:36:04 +0100, , rename classmethod think new name better describes purpose,,
342,7f9d8f8ddfd092778997fae989ad358cbabd6f8e,hris Roos <chris@seagul.co.uk>, 2016-09-28 11:34:20 +0100, , rename classmethod think new name better describes purpose,,
343,be0cc3c1cbf9f495c89fda3c29db5917b2134e16,hris Roos <chris@seagul.co.uk>, 2016-09-27 18:45:52 +0100, , remove identical method parent classmethod,,
344,e5521209a5abb308d025b740c5e9d2d5e0a9ccff,hris Roos <chris@seagul.co.uk>, 2016-09-27 18:45:00 +0100, , use dry code,,
345,6a29f9e83b0b621a7997562dbb06f5f24015a193,hris Roos <chris@seagul.co.uk>, 2016-09-27 18:42:21 +0100, , extract classmethod override implementation  want make implementation classmethod identical eventually remove,,
346,065134915f7544aef49a954efaf3b077ba8e5a8f,hris Roos <chris@seagul.co.uk>, 2016-09-27 18:20:41 +0100, , rename classmethod method method_name well method parameter named method make clearer string symbol instance method,,
347,56005bf5b4ddc131f0352e78d3e011bf2557e5f2,hris Roos <chris@seagul.co.uk>, 2016-09-27 18:09:11 +0100, , remove identical method parent classmethod,,
348,721a910b8cb0879265aff5f930a171d0189a22db,hris Roos <chris@seagul.co.uk>, 2016-09-27 18:04:56 +0100, , extract classmethod override implementation  want make implementation classmethod identical eventually remove note returning method definition filename line number exception backtraces continue report correct line raised error updated two test accordingly,,
349,2451506c4142e3f2c2aa50caacec40b6481dae98,hris Roos <chris@seagul.co.uk>, 2016-09-27 17:59:56 +0100, , remove identical method parent classmethod,,
350,c40d96e45f3c0cbad8a2408469857290ed85b0ac,hris Roos <chris@seagul.co.uk>, 2016-09-27 17:58:59 +0100, , extract classmethod override implementation  want make implementation classmethod identical eventually remove,,
351,bf23d4443dc2aaf65c6e56b5bedc2effdde951a6,hris Roos <chris@seagul.co.uk>, 2016-09-27 17:55:47 +0100, , extract classmethod override implementation  want make implementation classmethod identical eventually remove,,
352,3623ab1f52191d360ac0ed4ee5698af1353c66f0,hris Roos <chris@seagul.co.uk>, 2016-09-27 17:53:15 +0100, , extract classmethod prepend_module override implementation prepend_module want make implementation classmethod identical eventually remove,,
353,86e203c8cb4573a76c384e88898d5e70daeac6d7,hris Roos <chris@seagul.co.uk>, 2016-09-27 17:47:12 +0100, , extract classmethod original_method override implementation original_method want make implementation classmethod identical eventually remove,,
354,c602eeacdc303df764bb350bf945a92c5f431734,hris Roos <chris@seagul.co.uk>, 2016-09-27 18:10:36 +0100, , remove given identical method parent classmethod,,
355,e6db194a3b3e7f2b4bfffcbaa2c4a8bd3cb88958,hris Roos <chris@seagul.co.uk>, 2017-01-25 12:41:35 +0000, , add test reporting filename line number use class_eval classmethod case pas __file__ __line__ class_eval backtrace contains filename line number line raised exception commit add couple test ensure accidentally break behaviour super happy test least brittle want place making planned change implementation,,
356,172380e373de0d759be2058f0b4322d78857c2d3,ames Mead <james@floehopper.org>, 2019-06-08 15:14:56 +0100,357, merge pull request 357 freerange thread safety explanation expand explanation thread safety concern,,
357,ad4cbd27e2881712a808cec963e8f3262c3a3a6e,en Griffiths <bengriffiths@gmail.com>, 2019-06-06 12:42:29 +0100, , expand explanation thread safety concern,,
358,ded1fa45929ef9761921e778a13b7a69db968a9b,ames Mead <james@floehopper.org>, 2019-05-21 20:16:44 +0100, , explicitly set travis ubuntu trusty 14.04 travis started switching default linux xenial 16.04 apr 2019 look took effect mocha repo week apr may point weekly scheduled build failed appears build failure relate ruby v1.8.7 v1.9.3 available xenial distribution hoping explicitly setting distribution back trusty fix problem http blog.travis ci.com 2019 xenial default build environment http travis ci.org freerange mocha build 527865861 http rubies.travis ci.org,,
359,d986fd2de2f2b896d876e1a4108694d628aa6895,ames Mead <3169+floehopper@users.noreply.github.com>, 2019-03-20 17:02:20 +0000,354, merge pull request 354 deepj truffleruby run test truffleruby travis,,
360,d5c958e845c771e4b317c1585ec8cd2838a946b0,eepj <deepjungle.maca@gmail.com>, 2019-03-18 08:45:19 +0100, , allow fail test truffleruby,,
361,1a2df014ec5073a4fc121f2fa5eb9c842ce91ae2,eepj <deepjungle.maca@gmail.com>, 2019-03-18 08:31:57 +0100, , run test truffleruby travis,,
362,4164e54b237175513bf756bf6b384b6902833077,ames Mead <3169+floehopper@users.noreply.github.com>, 2019-01-15 17:09:37 +0000, , update documentation v1.8.0 release note includes effect change commits   ,,
363,72e682d815392071872e17721f1b776a03e784f6,ames Mead <3169+floehopper@users.noreply.github.com>, 2019-01-15 17:11:48 +0000, , correction release process readme,,
364,6e39c693cfc58a8f17839dc015113bedd197db32,ames Mead <3169+floehopper@users.noreply.github.com>, 2019-01-15 17:04:39 +0000, , bump version update release note,,
365,a17fdea6a0780c5f9f63ea0b89985dd51a3c3f07,ames Mead <3169+floehopper@users.noreply.github.com>, 2019-01-15 16:34:20 +0000, , fix documentation link readme fixed,,
366,5aac8b9e4dc8335e30de426ca103678fddcd90dc,ames Mead <3169+floehopper@users.noreply.github.com>, 2019-01-15 16:32:30 +0000, , create cname,,
367,6647e55ec1c08205ddebbac5b89f625e721abaac,ames Mead <3169+floehopper@users.noreply.github.com>, 2019-01-15 16:19:38 +0000, , switch google analytics tag manager use new property advantage removing reference gofreerange.com,,
368,d1c8f65cd3658fea7dca6ecc833ba8c090bfd9cd,ames Mead <3169+floehopper@users.noreply.github.com>, 2019-01-15 16:05:56 +0000, , remove redundant broken script tag custom yard template must needed older version yard app.js file life directory javascripts directory case included within head element layout,,
369,256a14efceaaa44c1d69d011972d0c66fdb3901c,ames Mead <3169+floehopper@users.noreply.github.com>, 2019-01-15 15:36:46 +0000, , change documentation domain,,
370,542d535c2b23bc574749b90102c2f8b58942489c,ames Mead <3169+floehopper@users.noreply.github.com>, 2019-01-15 15:25:20 +0000, , create cname,,
371,e8d4b22ad083732b98d052c44562feee91d7327b,ames Mead <3169+floehopper@users.noreply.github.com>, 2019-01-15 15:25:03 +0000, , delete cname,,
372,ec89193fa13032477b905005410fc614ed2ba0d8,ames Mead <3169+floehopper@users.noreply.github.com>, 2019-01-15 15:21:30 +0000, , create cname,,
373,585ff2d5b6a0f652f7176245938a7d19f0e8eec2,ames Mead <3169+floehopper@users.noreply.github.com>, 2019-01-15 15:09:23 +0000, , update readme reflect new release process,,
374,afbd64bdc9c3ffb7af684b34adfa10b55b14d9ce,ames Mead <3169+floehopper@users.noreply.github.com>, 2019-01-15 15:00:14 +0000, , move doc doc host documentation github page,,
375,1343b9f0a3a7c8b641ad325e474993348ec168f4,ames Mead <3169+floehopper@users.noreply.github.com>, 2019-01-15 14:46:35 +0000, , remove publish_docs rake task plan doc published automatically github page longer necessary,,
376,4a85555831c55961a5100be18b0fe0b555b51945,ames Mead <3169+floehopper@users.noreply.github.com>, 2019-01-15 14:40:39 +0000, , add documentation repo doc generated latest release tag i.e v1.7.0 idea serve github page regenerate commit release used following command true bundle install true 45002715 rake generate_docs,,
377,683ded9b59b6ce7a5e5fa488b08d97200e1f7f4c,ames Mead <3169+floehopper@users.noreply.github.com>, 2019-01-14 15:51:11 +0000, , use new bundler build requires ruby v2.3 higher mean bunch build fail ideally use bundler recent version ruby ,,
378,ef428ea285e5c417d8e79c2854150947575373ef,ames Mead <3169+floehopper@users.noreply.github.com>, 2018-10-24 10:28:30 +0100, , removed link documentation translation control documentation easily verify accuracy ensure kept date,,
379,4976e0bc97b5a1f414c3981953231445b9eeab25,ames Mead <3169+floehopper@users.noreply.github.com>, 2018-10-07 22:37:52 +0100, , avoid deprecation warning gemspec seeing deprecation warning like one note gem specification has_rdoc deprecated replacement removed 2018 obvious has_rdoc attribute used rubygems anything useful happy remove reduce noise build output,,
380,89fe4dbc9a97a548c94b9400b71881607f7f3ee6,ames Mead <3169+floehopper@users.noreply.github.com>, 2018-10-07 15:26:54 +0100,346, merge pull request 346 freerange fix build matrix script fix build matrix script,,
381,9624f5013f14cd5bb07d083437ba202d4395d255,ames Mead <3169+floehopper@users.noreply.github.com>, 2018-10-07 14:43:46 +0100, , update latest bundler build matrix build equivalent before_install script .travis.yml,,
382,330e3f5798a428f0c100b4d7d4cec2b1545b17ea,ames Mead <3169+floehopper@users.noreply.github.com>, 2018-10-07 14:42:44 +0100, , skip build matrix ruby version installed,,
383,45e9afa9a18c8c19ca4eb8d5cfdb41d381fa93ab,ames Mead <3169+floehopper@users.noreply.github.com>, 2018-10-07 14:41:00 +0100, , improve output build matrix script,,
384,ab7108cbb7fad4b81bb443858cd8e0088d25e4a5,ames Mead <3169+floehopper@users.noreply.github.com>, 2018-10-07 14:36:53 +0100, , add require statement allow use child_status version ruby need required see 2nd error mentioned comment http github.com freerange mocha pull 343 issuecomment 427592944,,
385,cbbb8edf8ac828b77eed0c77c359c8fa3b89a9d0,ames Mead <3169+floehopper@users.noreply.github.com>, 2018-10-07 14:36:22 +0100, , tweak wording contributing,,
386,5223926d8158e761dde3568791273b57a53fe984,ames Mead <3169+floehopper@users.noreply.github.com>, 2018-10-07 14:35:33 +0100, , remove req run build matrix locally contributing script broken time test ensure keep working script rbenv specific feel unfair force contributor install specific ruby version manager build matrix automatically run travis pull request anyway,,
387,7306d03a35928837f275f936714dff69d706c8ed,ames Mead <3169+floehopper@users.noreply.github.com>, 2018-10-07 13:02:48 +0100,345, merge pull request 345 freerange avoid calling kernel format object method mocha inspect avoid calling kernel format objectmethods mocha_inspect,,
388,c2c3e714bda430f59142b1d092e1cfde3029e595,offmanilya <ilya@synapseautomation.com>, 2018-10-06 10:09:34 -0700, , avoid calling kernel format objectmethods mocha_inspect previously setting expectation instance class defined custom format method resulted incorrect information displayed argumenterror arity format method different kernel format calling kernel.format directly avoid problem fix 342,,
389,0914c875f0da93cb9e8eb6017e8c4b42f2ab5b5a,ames Mead <3169+floehopper@users.noreply.github.com>, 2018-10-06 19:18:24 +0100, , constrain rubocop version constraint avoid breaking travis build previous commit started seeing different type build failure bundler could find compatible version gem ruby gemfile ruby mocha resolved 1.7.0 depends ruby 1.8.7 rubocop 0.58.0 resolved 0.58.2 depends ruby 2.2.0 hoping allowing earlier version rubocop avoid type failure based fact build constraint introduced resolved gem dependency installing v0.41.2 rubocop http github.com freerange mocha commit http travis ci.org freerange mocha job 438063452 http travis ci.org freerange mocha job 414602820 l687,,
390,05e507f53c1e2713d8ebc4b5a0bb4f074822131d,ames Mead <3169+floehopper@users.noreply.github.com>, 2018-10-06 18:43:06 +0100, , constrain rubocop version avoid breaking travis build newer version rubocop must introduced new rule mocha codebase doe comply thus build initiated weekly cron job started failing picking latest version rubocop http travis ci.org freerange mocha build 437719358,,
391,7f11afe247cda43b80afb3ff924ce913c244a5ed,ames Mead <3169+floehopper@users.noreply.github.com>, 2018-08-09 18:10:39 +0100, , prepare release v1.7.0,,
392,d336f49f13a13fdb039fc18497004d2f13c0e72a,ames Mead <3169+floehopper@users.noreply.github.com>, 2018-07-26 14:55:54 +0100,341, merge pull request 341 freerange add rubocop add rubocop run part build,,
393,f6900a027b42cb6cf216280322f5eba4862b4c85,ames Mead <3169+floehopper@users.noreply.github.com>, 2018-07-26 13:18:23 +0100, , run rubocop ruby v2.2.0 ruby v2.2 rubocop,,
394,afdcf41d846185f7c3ede5cb80eb1e9554e556f6,ames Mead <3169+floehopper@users.noreply.github.com>, 2018-07-26 13:12:00 +0100, , run rubocop part rake test task rubocop available available early version ruby,,
395,875a4ff2e3fb5529730dd58ca26920177bd47cc2,ames Mead <3169+floehopper@users.noreply.github.com>, 2018-07-26 12:50:17 +0100, , fix style violation manually set v2.2 style cop expects use numeric zero around since ruby v1.8.6 numeric positive numeric negative around since ruby v2.3 fix violation enable cop,,
396,79dc3de00a2c8a610e8e09b094efd5821c355c59,ames Mead <3169+floehopper@users.noreply.github.com>, 2018-07-26 12:42:50 +0100, , set rubocop earlist possible v2.2 ideally set match gemspec i.e v1.8.7 however might well set earliest possible version order avoid triggering cop intended operate recent version ruby mean safe longer disable couple cop .rubocop.yml confirmed regenerating todo list making change seeing change todo list,,
397,933724b192ee2599b3246c664ed4c3c602524a55,ames Mead <3169+floehopper@users.noreply.github.com>, 2018-07-26 12:36:01 +0100, , disable gemspec file possible set ruby v2.2 gemspec set 1.8.7,,
398,d098b42a45fa6c91c55ca825445a46d0a16ff55d,ames Mead <3169+floehopper@users.noreply.github.com>, 2018-07-26 12:26:00 +0100, , allow long comment line regenerate rubocop todo list many longest line comment line yard documentation think splitting line might change formatting documentation happy allow setting ignoredpatterns option metric linelength cop note reduces offense count 735 501 maximum line length needed 545 180. latter still big definite improvement,,
399,34ff8127844a47c839968647388ee43f6c82044d,ames Mead <3169+floehopper@users.noreply.github.com>, 2018-07-26 12:16:35 +0100, , generate rubocop todo list using following command rubocop auto gen config,,
400,f21f0c3bf3e364eb1a8284f9a9277284e7ed0d86,ames Mead <3169+floehopper@users.noreply.github.com>, 2018-07-26 12:14:27 +0100, , disable layout file enabling cop result infinite loop detected exception see related rubocop bug probably investigate bit raise rubocop issue,,
401,ff80e55c1038ee0a8884900f192db5c75cec17f5,ames Mead <3169+floehopper@users.noreply.github.com>, 2018-07-26 12:08:35 +0100,5201, disable lint specific line think violation acceptance test legitimate look like might related rubocop bug http github.com rubocop rubocop issue 5201,,
402,d5dd9ab1bde1811a33b288d843d5555498f55952,ames Mead <3169+floehopper@users.noreply.github.com>, 2018-07-26 11:55:35 +0100,5953, disable style file cop introduced relatively recently seems stirred controversy triggered many acceptance test anonymous class defined within test method visibility specified inline http github.com rubocop rubocop issue 5953,,
403,6fa1c0cdfccdabcdcfbeb3659daadf88932842f5,ames Mead <3169+floehopper@users.noreply.github.com>, 2018-07-26 11:40:30 +0100, , disable style file magic comment supported since ruby v2.3 want jeopardise support earlier version ruby,,
404,2cc5a5228153f7ffd35b04c0a9b453ffc14912a8,ames Mead <3169+floehopper@users.noreply.github.com>, 2018-07-26 11:27:13 +0100, , fix style semicolon violation using auto correct also disable cop around test using executionpoint test rely instantiation executionpoint line following statement,,
405,b0ac517b966d2ab719af9033926b9753c72c947a,ames Mead <3169+floehopper@users.noreply.github.com>, 2018-07-26 01:59:47 +0100, , fix style guardclause violation manually disabled cop around one block code think changed,,
406,a90b8a071f3d7ebd723c7611eb0d51ab4de9ca77,ames Mead <3169+floehopper@users.noreply.github.com>, 2018-07-26 01:44:30 +0100, , fix style violation using mixture auto correct manual edits auto correct work well test construct anonymous class,,
407,cd466358de3ab6c0def88902daa51505673b9b35,ames Mead <3169+floehopper@users.noreply.github.com>, 2018-07-26 01:35:36 +0100, , fix style violation using auto correct,,
408,ac288dec8dbd2adcd56d0a70b02e3d33134735e3,ames Mead <3169+floehopper@users.noreply.github.com>, 2018-07-26 01:29:53 +0100, , fix style stringliterals violation using auto correct,,
409,86c5cff1d12eeca670a8c93acf4c0f0f6a116593,ames Mead <3169+floehopper@users.noreply.github.com>, 2018-07-26 01:28:03 +0100, , fix style symbolproc violation using auto correct,,
410,25cc68944b13c2615564a0a40d9915d3dec76140,ames Mead <3169+floehopper@users.noreply.github.com>, 2018-07-26 01:25:17 +0100, , fix style violation using auto correct,,
411,4486ee38b3f44634ba4b7716b339e605f1191313,ames Mead <3169+floehopper@users.noreply.github.com>, 2018-07-26 01:23:53 +0100, , fix style wordarray violation using auto correct,,
412,f2ac20ba6887ab7933c5162ab5e0610d2d27f184,ames Mead <3169+floehopper@users.noreply.github.com>, 2018-07-26 01:22:28 +0100, , disable style file keen cop easy miss,,
413,f59612ba55c4b6df6dd82b18755801ab6bd7f7dd,ames Mead <3169+floehopper@users.noreply.github.com>, 2018-07-26 01:18:50 +0100, , fix style whileuntildo violation using auto correct,,
414,3f3dd413705f04c7265fecc229c0ff14114ca2f5,ames Mead <3169+floehopper@users.noreply.github.com>, 2018-07-26 01:17:48 +0100, , fix style violation using auto correct,,
415,b650801e309e816e41c27a060bfe1ac33770631c,ames Mead <3169+floehopper@users.noreply.github.com>, 2018-07-26 01:16:36 +0100, , fix style violation using auto correct,,
416,e8f5a2d5896835a9403129122bca6018a8c99916,ames Mead <3169+floehopper@users.noreply.github.com>, 2018-07-26 01:15:00 +0100, , fix style violation using auto correct,,
417,3f58dff3050922e4a49205fbef7e8be0b3124393,ames Mead <3169+floehopper@users.noreply.github.com>, 2018-07-26 01:12:54 +0100, , fix style violation using auto correct,,
418,bd0342f5f8420bb97a6cfc1a6fd10781f7add700,ames Mead <3169+floehopper@users.noreply.github.com>, 2018-07-26 01:11:02 +0100, , disable style symbolarray cop file symbol array literal syntax supported since ruby v2.0 want jeopardise support earlier version ruby,,
419,cd0228ae27919349a391162a7c91348ccd86277e,ames Mead <3169+floehopper@users.noreply.github.com>, 2018-07-26 01:09:21 +0100, , fix style violation using auto correct,,
420,196970ac6c972bae612fb17f8afdee443d700c01,ames Mead <3169+floehopper@users.noreply.github.com>, 2018-07-26 01:07:03 +0100, , fix style stderrputs violation using auto correct,,
421,dec1813528e6c5547977fba90be8ebf69742835a,ames Mead <3169+floehopper@users.noreply.github.com>, 2018-07-25 23:32:28 +0100, , disable style safenavigation file safe navigation operator supported since ruby v2.3 want jeopardise support older version ruby,,
422,241c272f9638802403a91caedf23c5a2689d64a4,ames Mead <3169+floehopper@users.noreply.github.com>, 2018-07-25 23:26:03 +0100, , fix style violation using auto correct,,
423,d6680a98fb1670b57b4f506d53c970cd619229a4,ames Mead <3169+floehopper@users.noreply.github.com>, 2018-07-25 23:25:17 +0100, , fix style violation using auto correct,,
424,ef35b6657a0cfd2a296acc4c21ccda4eb4bd2dce,ames Mead <3169+floehopper@users.noreply.github.com>, 2018-07-25 23:16:20 +0100, , fix style regexpliteral violation using auto correct manually fixed one violation fixed auto correct fixed lint violation introduced auto correct style regexpliteral,,
425,5ffbfaf687d5caa7b4859e4af8307cab406c5699,ames Mead <3169+floehopper@users.noreply.github.com>, 2018-07-25 23:15:11 +0100, , fix style redundantself violation using auto correct,,
426,a671a612fdc08fdc847446b7cb1ebb0c18c89936,ames Mead <3169+floehopper@users.noreply.github.com>, 2018-07-25 23:11:38 +0100, , disable rubocop cop monkey patching code whole point monkey patching code copy pasted original source code,,
427,5d4612705db6d770e12d90531410945f9ffd39b6,ames Mead <3169+floehopper@users.noreply.github.com>, 2018-07-25 23:07:06 +0100, , fix style redundantreturn violation using auto correct,,
428,a5208035c16d03a6f09a24c6e6454e88909c302c,ames Mead <3169+floehopper@users.noreply.github.com>, 2018-07-25 23:05:54 +0100, , fix style raiseargs violation using auto correct,,
429,e52163580f12603c22abb81c549bf91ff56a3560,ames Mead <3169+floehopper@users.noreply.github.com>, 2018-07-25 23:04:30 +0100, , fix style violation using auto correct disabled cop around monkey patching code whole point copy pasted original source code,,
430,87dad53c31af31df5c7b4c1e2c937aacaa3a07c6,ames Mead <3169+floehopper@users.noreply.github.com>, 2018-07-25 22:47:54 +0100, , fix style violation using auto correct,,
431,ede277b5a66dc1ae6607ce5a3f77d4d04ceeb909,ames Mead <3169+floehopper@users.noreply.github.com>, 2018-07-25 22:47:04 +0100, , fix style violation using auto correct,,
432,acf8f7398c2b2c968b6d79558c7405b9e8cb8f41,ames Mead <3169+floehopper@users.noreply.github.com>, 2018-07-25 22:43:37 +0100, , require comparison style cop numeric zero supported since ruby v1.8.6 numeric negative numeric positive supported since ruby v2.3,,
433,a38b7347838f202608a9367c3c9cdeb76e1b82be,ames Mead <3169+floehopper@users.noreply.github.com>, 2018-07-25 22:37:57 +0100, , fix style next violation using auto correct,,
434,a06e647157170964e74b8168c2d618271c263187,ames Mead <3169+floehopper@users.noreply.github.com>, 2018-07-25 22:36:48 +0100, , fix style mutableconstant violation using auto correct,,
435,ab3e1ebc3aea48df52ba58b8967fc977406089b9,ames Mead <3169+floehopper@users.noreply.github.com>, 2018-07-25 22:35:13 +0100, , fix style multilineifthen violation using auto correct,,
436,a405d20f30c06ee6693aaddd4fa6c19c6804687d,ames Mead <3169+floehopper@users.noreply.github.com>, 2018-07-25 22:33:29 +0100, , disable style specific line disabled cop around monkey patching code whole point copy pasted original source code,,
437,b99374182e2195c6f21bc08d879763ec5d70b2e1,ames Mead <3169+floehopper@users.noreply.github.com>, 2018-07-25 22:28:47 +0100, , disable style specific line mock object legitimate exception rule,,
438,a18fd0051fceab4317d0d045e9c508b9299fdd9e,ames Mead <3169+floehopper@users.noreply.github.com>, 2018-07-25 22:18:18 +0100, , disable style specific line disabled cop around monkey patching code whole point copy pasted original source code,,
439,c3777c967147d4418f2c632b61d626add35c45a6,ames Mead <3169+floehopper@users.noreply.github.com>, 2018-07-25 22:15:46 +0100, , fix style violation using auto correct,,
440,6ca8c8fcf15b95ce8c17698a8a29c4acca557236,ames Mead <3169+floehopper@users.noreply.github.com>, 2018-07-25 21:45:17 +0100, , include rubocop dev dependency ruby v1.9.2 one dependency latest version rubocop rainbow compatible earlier version ruby,,
441,de70e02b687151ac31d676fa2dfca3b18001b755,ames Mead <3169+floehopper@users.noreply.github.com>, 2018-07-25 21:25:26 +0100, , require non literal lambda style lambda cop lambda literal syntax supported since ruby v2.0,,
442,c7c8297d68fa74191da1fc0030e883e2f1c96c91,ames Mead <3169+floehopper@users.noreply.github.com>, 2018-07-25 21:20:31 +0100, , disable style file want jeopardise support older version ruby,,
443,8b101f2e068c4be67d2691bbed692fc260b64e72,ames Mead <3169+floehopper@users.noreply.github.com>, 2018-07-25 20:55:22 +0100, , fix style inversemethods violation using auto correct,,
444,adac420fa06022ade40d431b009e36d5312af511,ames Mead <3169+floehopper@users.noreply.github.com>, 2018-07-25 20:51:48 +0100, , disable style file keen cop easy miss trailing conditional think result particularly unhelpful metric linelength set large value currently,,
445,7ff79ffcd72297fc3cb8136d1ffba45296271cdc,ames Mead <3169+floehopper@users.noreply.github.com>, 2018-07-25 20:42:06 +0100, , disable style hashsyntax file want jeopardise support older version ruby,,
