id,sha,author,date,issue,message,file,content
1124,31182ea8b38b79aa50702aa839f6a29ebcf7d684,ames Mead <james@floehopper.org>, 2010-11-25 15:58:56 +0000, , bumped version 0.9.10 updated release note gemspec preparation release,,
1125,8462164183b820aae9a0c3a09fb216e6fb87e28c,ames Mead <james@floehopper.org>, 2010-11-12 14:45:20 +0000, , updated gemspec,,
1126,187eddfe487e52d12aa65dc419bce8e23b7cf201,ames Mead <james@floehopper.org>, 2010-11-12 13:16:09 +0000, , added mocha objectmethods unstub following link relevant http github.com floehopper mocha issue issue http project 22289 ticket allow unstubbing method http group mocha developer browse_thread thread http github.com alexheaton mocha commit,,
1127,e2c5f3e06e459356a36e04a2e9959ca0f467125b,ames Mead <james@floehopper.org>, 2010-11-12 11:23:37 +0000, , added test change fdcb1503 mocha became exception standarderror see following detail http github.com floehopper mocha issue issue http project 22289 ticket exception,,
1128,fdcb1503906293745444d8bf49ee624fa7839f75,ames Sanders <jsanders@comverge.com>, 2010-11-10 01:28:10 +0800, , make inherit exception rather standarderror,,
1129,625df7e68fbe900f1fe64a98df4fafea19c08db2,lt <brian@troutwine.us>, 2010-11-08 10:56:34 +0800, , fixed inappropriately scoped rescue instance teardown function may also throw exception meant passed along user however inappropriate scoping caused particular recognized uninitialized constant resulting helpful nameerror,,
1130,89a334f490fc8e01d02e4a7c4ff0afbb323f0ef9,ames Mead <james@floehopper.org>, 2010-11-01 11:06:01 +0000, , hard coding example url point rubyforge documentation site fix broken link github readme page ideal solution mean building documentation locally link point live version example rather local version whole thing bit mess anyway readme originally designed used rubyforge site github,,
1131,48ab59a6fb78edafea7f1f4b0fdeadf4cda305fc,ames Mead <james@floehopper.org>, 2010-10-22 15:10:32 +0100, , add commit sha1 0.9.9 release note,,
1132,ee3a79db4d52c3339e8acf07505e01236a2b4810,ames Mead <james@floehopper.org>, 2010-10-22 13:37:14 +0100, , bumped version 0.9.9 generated gemspec preparation release,,
1133,c0cf25b333c5accef258a87f96173e9486f8b6b4,ames Mead <james@floehopper.org>, 2010-10-22 13:35:39 +0100, , added release note v0.9.9,,
1134,2e0b80af86baf1e92c62dee0123b73335085d454,ames Mead <james@floehopper.org>, 2010-10-22 13:34:30 +0100, , using .puts instead kernel warn seems appropriate,,
1135,e0a00a7b2adf8f11d3679879df9a5c47a5c36189,ames Mead <james@floehopper.org>, 2010-08-19 09:07:26 +0100, , fixed gemspec,,
1136,d843a1a4233073aff51c6c9f3128df71e7e28538,ames Mead <james@floehopper.org>, 2010-08-18 22:03:55 +0100, , updated gemspec requested shwoodard,,
1137,d1715ffe4c85a672383088e48c2e013417bde463,ames Mead <james@floehopper.org>, 2010-06-21 17:25:20 +0100, , undo last commit solve problem,,
1138,fc4fc75ef34d98eaec052f5d029a1d283c2f2b15,ames Mead <james@floehopper.org>, 2010-06-21 17:20:56 +0100, , add one heading level case github allow,,
1139,5fd8b204c92a66355ea96303cf089ff556ea50ca,ames Mead <james@floehopper.org>, 2010-06-21 15:16:37 +0100, , added brace rdoc link see make work github,,
1140,6778ec18da47ef17a76144083b702f170b496c52,ames Mead <james@floehopper.org>, 2010-06-21 13:55:51 +0100, , use rdoc extension encourage github use correct formatting thanks suggestion rohit arondekar rohit,,
1141,befde5c359286d110799ff1b925bc0834bcfa5b9,eddavis <reddavis@gmail.com>, 2010-06-11 04:50:39 +0800, , example shouldnt show method called would make expectation fail,,
1142,cdfe7db1eeda40fc537418aabf70fc8c2662e251,ames Mead <james@floehopper.org>, 2010-06-05 17:37:11 +0100, , warn new debug mocha_option supplied added various debug warning statement recent commits enabled default also need deal multiple mocha_options supplied comma delimited list,,
1143,02e37c9c91222ffa296a01f20e551bc47bb201bf,ames Mead <james@floehopper.org>, 2010-06-05 17:31:54 +0100, , fix exception running rake without test unit gem test unit gem v2.0.0 installed mocha_option specified comparison fixnum hash failed exception raised running performance test bit test unit gem loaded accidentally hash incorrectly supplied testrunner.run method,,
1144,22599b8bbc99f72b8c33f76df479591a129b3798,ames Mead <james@floehopper.org>, 2010-06-05 17:21:38 +0100, , mocha load bit test unit gem accident attempt fix problem james adam reported using load instead require detect version test unit seems like avoid rubygems trying load bit test unit gem wanted http project 22289 mocha ticket ticket,,
1145,ff109bb2849cb49a92620e766bdfa4e49ed6c2be,ames Mead <james@floehopper.org>, 2010-06-04 17:52:04 +0100, , handle new version test unit gem v2.0.8 v2.0.9,,
1146,668b358db281ac10362a4c04506fae716e53e687,ames Mead <james@floehopper.org>, 2010-05-15 12:16:28 +0100, , fix test incorrectly failing rubinius 1.0 test imposed many constraint appears object inspect legitimately call object object_id rubinius interested method mocha objectmethods mocha_inspect call stubbing object inspect relax constraint imposed test,,
1147,eed5ff3a4bf673236080e5610ea24ec91b198797,ames Mead <james@floehopper.org>, 2010-05-13 18:16:56 +0100, , improve documentation expectation raise number people suggesting extension api cope custom exception extra constructor parameter however since mocha pass argument kernel raise possible pas instance exception thus change api required doe seem worthwhile pointing doc,,
1148,c5736db505cab18dc646d40a670213f7d3be5fbe,ames Mead <james@floehopper.org>, 2010-05-11 23:18:04 +0100, , fix ruby 1.9.2 appears longer possible subvert protection method calling via send ruby 1.9.2,,
1149,5e962089dbed419eaf0bff9fc643217e2cb00658,ames Mead <james@floehopper.org>, 2010-05-11 23:15:15 +0100, , fix test performance rake task ruby 1.9.2,,
1150,9a2ca1e5cc27d9e6a1d016592f62931e12f3913c,loy Duran <eloy.de.enige@gmail.com>, 2009-10-11 17:14:21 +0200, , hacked james minitest testresult code make acceptance test run 1.9 head still failure reason backtrace line number one minitest_test test case doe run whole suite ran minitest still need look,,
1151,b7ef80234de9a2242c11634618f24470a833b906,loy Duran <eloy.de.enige@gmail.com>, 2009-10-06 22:16:43 +0200, , made unit test run 1.9.2dev r25249,,
1152,565947a4f27b9b91c016306e300773dbd5d3a613,ames Mead <james@floehopper.org>, 2010-05-12 17:48:32 +0100, , explicitly require rubygems running test via rake using test unit gem,,
1153,71bdef5ec46b16eafdc21ed2e502aaef8e56b36c,ames Mead <james@floehopper.org>, 2010-05-12 17:45:59 +0100, , add warning unverified version minitest used,,
1154,267651aa8a7decf5dd716ab182d503a880577a8f,ames Mead <james@floehopper.org>, 2010-05-12 17:42:45 +0100, , add patch different version test unit mocha effectively replaces test unit testcase run method need ensure change test unit version method reflected mocha patch neglected since version 2.0.2 also added warning aid debugging currently use kernel warn therefore stderr may need change make easier disable e.g using existing mocha logger also add warning unverified version test unit used warning suitable patch identified,,
1155,b5983808ccd63cc94858ddf87278685866dee923,ames Mead <james@floehopper.org>, 2010-05-12 11:35:24 +0100, , added logging test unit monkey patching minitest,,
1156,264e193fc190616615f245aeed0d3feb99837f5a,ames Mead <james@floehopper.org>, 2010-05-12 11:30:30 +0100, , add patch different version minitest gem mocha effectively replaces minitest unit testcase run method need ensure change minitest version method reflected mocha patch neglected since version 1.3.1 also added warning aid debugging currently use kernel warn therefore stderr may need change make easier disable e.g using existing mocha logger,,
1157,55f431a7dc0797b54ee5dbd3256ee59cbb175499,uke Redpath <luke@lukeredpath.co.uk>, 2010-02-18 23:16:46 +0800, , added note using explicit equal matcher shorthand,,
1158,26cbd02108173a71c2cc4bcb4f7a36d90fef6a2b,uke Redpath <luke@lukeredpath.co.uk>, 2010-02-18 23:14:03 +0800, , added documentation new shorthand method,,
1159,eef5f79b2e9c6cdcf5404e7ff5895198f0fcc278,uke Redpath <luke@lukeredpath.co.uk>, 2010-02-18 23:02:19 +0800, , allow creation composite matcher using semantics provides alternative syntax expecting matcher pas e.g foo.expects bar .with equal equal,,
1160,fc3b9ba798d7fb1a1f0d16e018487fb3eed8cb74,ames Mead <james@floehopper.org>, 2009-09-18 12:03:47 +0100, , add commit sha1 0.9.8 release note,,
1161,645024765b2d92018efc511652e1174163844e39,ames Mead <james@floehopper.org>, 2009-09-18 11:57:57 +0100, , fixed rail plugin stopped working 0.9.6. updated documentation reflect fix updated release note bumped version preparation release 0.9.8,,
1162,52735d0e3954c47791f7f858988e5960160bbbd6,ames Mead <james@floehopper.org>, 2009-09-15 16:02:05 +0100, , fix ruby 1.9 build broken accepting commit directly github forkqueue,,
1163,3799298af3f002513ea1a0a812eb450c2257aca3,ander Hartlage <sander@outside.in>, 2009-07-09 00:03:01 +0800, , regexp_matches matcher match raise error empty argument argument respond signed james mead james floehopper.org,,
1164,e5f7311d8ba2150a200c5cdf5db4d6d9cde21778,ander Hartlage <sander@outside.in>, 2009-07-09 00:02:12 +0800, , includes matcher match raise error empty argument argument respond include signed james mead james floehopper.org,,
1165,9e8c94903a29dbe30f010010d5de83d158fe45ef,ander Hartlage <sander@outside.in>, 2009-07-09 00:01:18 +0800, , has_value matcher match raise error empty argument argument respond value signed james mead james floehopper.org,,
1166,396a533a74a5391b2032123f72cc885b9101d686,ander Hartlage <sander@outside.in>, 2009-07-09 00:00:04 +0800, , has_key matcher raise error empty argument argument respond key match signed james mead james floehopper.org,,
1167,519eb52dac207a5f7fc4f601363b2eb504a6855a,an Manges <daniel.manges@gmail.com>, 2009-07-29 04:06:46 +0800, , allow passing block mocha configuration method change config duration block signed james mead james floehopper.org,,
1168,af68bf115322cab981c9523ebf6077c2e3cbae17,ames Mead <james@floehopper.org>, 2009-09-15 15:26:39 +0100, , remove rdoc template incorporating google analytics source control file need exist locally ignored source control stop warning showing e.g runcoderun build result,,
1169,ae8678ef95408c9fb4701667e1268097e0808774,ames Mead <james@floehopper.org>, 2009-07-24 15:30:37 +0100, , rdoc template incorporating google analytics distributed gem used publishing rdoc rubyforge ensure rdoc rake task still work custom template available see http project 22289 ticket,,
1170,b0dc908a71f2e07aa8a9fb4b5447dcde06bb969f,ames Mead <james@floehopper.org>, 2009-07-01 12:45:07 +0100, , updated release note 0.9.7,,
1171,80d816f250dc13aaf856f3f9cbd97ebe9c371839,ames Mead <james@floehopper.org>, 2009-07-01 12:44:32 +0100, , prepare 0.9.7 release,,
1172,c37e64f89974b53a5c234409566533a7e5a59c51,ames Mead <james@floehopper.org>, 2009-07-01 11:16:56 +0100, , although provided deprecation warning people using mocha standalone assumed people explicitly loading mocha standalone.rb file turn assumption incorrect least case rspec bumping gemspec timestamp candidate gem github play,,
1173,6f5890aac364e90904a7e2236446ba692e727546,ames Mead <james@floehopper.org>, 2009-06-29 16:53:50 +0100, , update gemspec release note reflect 0.9.6 release,,
1174,57f8f77d715b7f1d9efee2e1a9438f7905c0006b,ames Mead <james@floehopper.org>, 2009-06-29 16:51:02 +0100, , prepare 0.9.6 release,,
1175,52de7942ded7a246de55b8d9c163cbb22ecd30eb,enis Defreyne <denis.defreyne@stoneship.org>, 2009-06-18 17:58:54 +0800, , made mocha compatible minitest 1.4.0 signed james mead james floehopper.org,,
1176,8478cc03e52ce666c9d368c327b0e552329f0c74,ames Mead <james@floehopper.org>, 2009-06-29 16:00:26 +0100, , merge branch master git github.com floehopper mocha,,
1177,2d4750072f5721d4704898e38564f77127eccd3f,ames Mead <james@floehopper.org>, 2009-06-29 16:00:12 +0100, , using different delimiter expand method definition onto multiple line make readable,,
1178,213ce2187a84c25eeb7040238a8ce703c843f015,ames Mead <james@floehopper.org>, 2009-05-18 16:09:55 +0100, , chad humphries pointed ruby 1.9.1 using test unit minitest mocha attempt load monkey patch test unit mocha monkey patch test unit minitest already loaded minitest test run ruby 1.8.6 minitest gem ruby 1.9.1 minitest std lib see ligthouse ticket http project 22289 ticket,,
1179,da24f9e93640381973b1604b8a1ff3214b0831c9,ames Mead <james@floehopper.org>, 2009-05-18 14:59:15 +0100, , removed bacon integration deciding maintain integration test unit minitest ruby standard library see mailing list detail,,
1180,82ea1493fe818132689583dc44ec554e7440e14d,ames Mead <james@floehopper.org>, 2009-03-05 16:05:50 +0000, , fixed bug bacon test failing ruby 1.9.1. http project 22289 mocha ticket,,
1181,ad6ed8e7f1180bcc803e7bff2f28a0f81ad3b928,ames Mead <james@floehopper.org>, 2009-03-05 15:03:08 +0000, , fixed bug minitest integration counting error failure http project 22289 mocha ticket,,
1182,c98aad3e766664e97705447ace14623b5cddc619,ames Mead <james@floehopper.org>, 2009-03-05 13:00:38 +0000, , private method previously extracted never used let use intended,,
1183,3d133e74e74b1ae02c4195a1de6c0160f9c66e32,ames Mead <james@floehopper.org>, 2009-03-05 11:30:19 +0000, , bacon loaded bacon_spec.rb run different process mocha loaded bacon_test.rb run bacon spec different process therefore mocha needed,,
1184,414cde3d50b78876cb912aad7d88ac5e31860460,ames Mead <james@floehopper.org>, 2009-03-05 10:11:41 +0000, , monkey patch minitest already monkey patched mocha,,
1185,c7999a1996be0e994b5ddef0dac6f8737538eba0,ames Mead <james@floehopper.org>, 2009-03-05 10:04:59 +0000, , monkey patch bacon already monkey patched mocha,,
1186,4a625823bfa61667e820f34dc5f27449bd31c62a,ames Mead <james@floehopper.org>, 2009-03-05 10:03:55 +0000, , confirm bacon context defined attempting monkey patch,,
1187,65a80ca25a9ecac1a368a8a65ad3f2d0db586bb5,ames Mead <james@floehopper.org>, 2009-03-05 10:02:30 +0000, , per commit 4e41149f rely user load bacon loading mocha rather loading bacon within mocha,,
1188,b8cd7a29e7b0e65c39d39f6b36c1cc1aeebc31b5,biratan Pires Alberton <u.alberton@gmail.com>, 2009-02-09 19:44:49 +0800, , implemented bacon integration signed ubiratan pires alberton u.alberton gmail.com signed james mead james floehopper.org,,
1189,4e41149f1624f4ae48a54e3b68ff4ca8b6b865db,ames Mead <james@floehopper.org>, 2009-03-04 19:15:43 +0000, , ken collins reported mocha always loading minitest available loading cause rail actionpack test break removed loading minitest mean user ensure want use minitest conjunction mocha must load minitest loading mocha http project 8994 ruby rail ticket 2060,,
1190,0bbdd98e308de56d6f8742e2b2ec96c45bca3418,ames Mead <james@floehopper.org>, 2009-03-03 12:39:59 +0000, , made commit 2df2193c taylorbarstow little general,,
1191,2df2193cea8209bb59c882903a12712a29ff6be5,aylor Barstow <taylorbarstow@gmail.com>, 2009-03-03 07:14:11 +0800, , fix exception raised hasentry match first param hash signed james mead james floehopper.org,,
1192,83b5b735f79141a2d8e781de3d016f32eca83de9,ames Mead <james@floehopper.org>, 2009-02-09 09:59:26 +0000, , renamed mocha standalone mocha api better reflect purpose added deprecation warning referencing mocha standalone,,
1193,a0349dac5117d689027b02618cf602355fe3276a,ames Mead <james@floehopper.org>, 2009-02-09 09:55:18 +0000, , make test brittle,,
1194,03f86943eb26a2c3cac01a9775f29658bd05aa6b,ames Mead <james@floehopper.org>, 2009-02-08 18:35:01 +0000, , inlined testcaseadapter minitestadapter separated different version test framework integration patch different module,,
1195,8b7869f9d4eb6b340a83b6489cf6360456082063,ames Mead <james@floehopper.org>, 2009-02-05 23:53:21 +0000, , inlined testcaseadapter module serving much purpose,,
1196,1fb66166c1858fde26fbc2312da8461f83490186,ames Mead <james@floehopper.org>, 2009-02-05 23:05:08 +0000, , move four different test unit monkey patch module separate file clarity,,
1197,db4ae0aa4234a499bb87a11c568769e7f62d4f62,ames Mead <james@floehopper.org>, 2009-02-05 15:34:13 +0000, , added support test unit gem version 2.0 note version test unit completely replacing testcase run method unfortunately version 2.0.0 method differs slightly method version 2.0.1 2.0.2 provide different implementation ensure internal working test unit compromised mocha note also unless test unit gem loaded requiring test unit lead mixture stdlib gem class loaded causing error avoid dependency rubygems gem loaded mocha_options set option intended use running mocha test might worthwhile create shim gem like allow test unit gem completely replace stdlib job another day change rakefile make default task run test unit gem version 2.0,,
1198,2ef7a2ff141f2f1797fb25198944d8b5a0a9cb0a,ames Mead <james@floehopper.org>, 2009-02-04 14:35:27 +0000, , per commit f0f0a42c explicitly require rubygems within mocha environmental choice user accordance considerably simplify logic loading minitest note version minitest 1.3 called miniunit therefore continue ignored new logic,,
1199,766354af26bc69beb2115721b0a90f493b17cca8,ames Mead <james@floehopper.org>, 2009-02-04 14:19:41 +0000, , following commit c14d31f7 vendor directory longer exists attempt add directory load_path,,
1200,c14d31f7fab236151b1f9117c71e61ff8b6adae5,ames Mead <james@floehopper.org>, 2009-02-04 14:16:58 +0000, , seems like overkill vendorize meta_project needed publishing file rubyforge removing installing locally gem need,,
1201,ee10ad6668f0d02e483396910caa918be3e4d105,ames Mead <james@floehopper.org>, 2009-02-04 14:11:55 +0000, , seems like overkill vendorize coderay needed generate example documentation removing installing locally gem need,,
1202,715a6bd99054ae29361622ea15e60b003c0ffff1,ames Mead <james@floehopper.org>, 2009-02-04 14:07:29 +0000, , per commit f0f0a42c consistent example requiring rubygems,,
1203,f0f0a42c3600fd20d5e0798f91be77f9cd907476,ames Mead <james@floehopper.org>, 2009-02-04 14:05:42 +0000, , first step removing requiring rubygems remove statement rakefile possible task may need rubygems loaded think thing vendorized anyway use rubyopt rubygems option need http gist.github.com 54177 describes requiring rubygems library code bad idea,,
1204,0901233a5407a2c3b113527473d738f8eaddb907,ames Mead <james@floehopper.org>, 2009-02-04 13:41:39 +0000, , version 2.0.1 test unit gem introduced private run_test method testcase clashed public testrunner run_test method latter method renamed run_as_test,,
1205,52c5752b2799d8ecf500bba34574e8f12942c292,ames Mead <james@floehopper.org>, 2009-02-01 16:15:56 +0000, , minor correction release note,,
1206,e9d2dc12c76275340cd01ac9dd4bba8fd4c84c9c,ames Mead <james@floehopper.org>, 2009-02-01 12:40:53 +0000, , ask git ignore file generated release process,,
1207,13098c05dfb291ce1d7b757dce92f3360ad749f0,ames Mead <james@floehopper.org>, 2009-02-01 12:39:44 +0000, , updated gemspec 0.9.5 release allow use github built gem,,
1208,16def148bc0ce7ee391df9d1386321189bd6ac09,ames Mead <james@floehopper.org>, 2009-02-01 12:35:57 +0000, , updated release note include later commit 0.9.5,,
1209,93cad010345ce5d68f31422cfc32ed9dd6de13ec,ames Mead <james@floehopper.org>, 2009-02-01 12:33:24 +0000, , added release rake task fully automate release process,,
1210,624244755b86bb36ca79ca255ffad9fbc49e566b,ames Mead <james@floehopper.org>, 2009-02-01 11:30:04 +0000, , prepare 0.9.5 release,,
1211,5615d965463451cf75d6f05616a514f46798f2ff,ames Mead <james@floehopper.org>, 2009-01-29 12:50:42 +0000,32, fixed lighthouse bug stub_everything mean mock responds anything,,
1212,492273272d97ff084edd40f9f16c67ea61fc68fe,ames Mead <james@floehopper.org>, 2009-01-29 12:07:52 +0000, , merge branch master tinogomes master,,
1213,6e04385e1b49f230edf364d497f1717034f74469,ames Mead <james@floehopper.org>, 2009-01-29 12:07:04 +0000, , fixed mistake doc mistake test tinogomes commit also tidied thing bit e.g enough document test invocation invocation invocation need invocation,,
1214,d4a19382c60de0b2d114aa3ad25de69888ff5c30,ames Mead <james@floehopper.org>, 2009-01-29 11:51:28 +0000, , per commit 130d2815 changed metaclass.send,,
1215,130d2815f70215fdd39912b93ec54d20e36d0086,ames Mead <james@floehopper.org>, 2009-01-29 11:39:24 +0000, , suggested alloy http is.gd heza changed metaclass.send definitely look simpler clearer,,
1216,b056bc5f05b4f734ed604ab66a9e93aa0d715360,inogomes <tinorj@gmail.com>, 2009-01-29 09:17:32 -0200, , method twice expectation,,
1217,911d45881e6a8e9206b20e57c381751f972e5acf,ames Mead <james@floehopper.org>, 2009-01-28 16:48:24 +0000, , long overdue update gemspec knew would forget manually need find automated solution,,
1218,7d47b39b093d869964092203ec3844eb7e8bae30,ames Mead <james@floehopper.org>, 2009-01-28 16:38:42 +0000, , ruby 1.9 requiring test unit load thin wrapper around minitest test unit testcase end inheriting minitest unit testcase need avoid including mocha module avoid nasty consequence,,
1219,ca229583b25c295983cf93b70f168ced9a9fb341,ames Mead <james@floehopper.org>, 2009-01-28 13:00:07 +0000, , ruby 1.9 includes rake rake contrib moment moved sshpublisher require rake task need least run test ruby 1.9. look like need build rake contrib gem similar get working properly http blog 2008 rake contrib,,
1220,33253b13e6be030bb99c3832755f9d455d476d15,ames Mead <james@floehopper.org>, 2008-12-30 18:19:37 +0000, , prepare 0.9.4 release,,
1221,8a59c6ff0f99f34b02bd99f19536a7893be2b340,ames Mead <james@floehopper.org>, 2008-12-30 18:17:11 +0000, , removed completed todo item,,
1222,421d9477e9bf535e8ee3e2aebc17d4c4e2ef1608,ames Mead <james@floehopper.org>, 2008-12-30 18:15:49 +0000, , updated link chris roos updated instruction installing plugin github instead rubyforge supplied better link downloading mocha file rubyforge,,
1223,f7487bd4bc4e971e132f91b27d31837dc94ba856,ames Mead <james@floehopper.org>, 2008-12-20 17:55:42 +0000, , updated generated gemspec include mailing list email address change commit cd78ad6,,
1224,cd78ad6011e72f9c5c50c97de92688fe83ffdb50,ames Mead <james@floehopper.org>, 2008-12-20 17:53:34 +0000, , updated mailing list email address gemspec rubyforge google group,,
1225,6f83693eb1e67819e547e58ed61894913929c342,ames Mead <james@floehopper.org>, 2008-12-20 16:41:41 +0000, , added mocha.gemspec file generated chad woolley new rake task floehopper mocha gem get built github,,
1226,94a273bd1970e81f7cc21428f3329c06453b2e2d,had Woolley <thewoolleyman@gmail.com>, 2008-12-18 18:04:02 -0700, , add rake task update mocha.gemspec unique version cause gem auto built github,,
1227,b17b78de6eb3f447c204219a2e83afe0795bbce1,ames Mead <james@floehopper.org>, 2008-12-02 20:42:23 +0000, , appear used think used used simulate activerecord messed test unit could make sure mocha worked rail,,
1228,1b3ed16c7755f8a548087d2d31bbcb44e2315281,ames Mead <james@floehopper.org>, 2008-12-02 17:04:01 +0000,23055, tobias crawley correctly pointed feature request 23055 stub with_hash working existing object following principle least surprise possible call objectmethods expects objectmethods stub hash method_names return_values like mock expects mock stub extracted shared logic sure best solution least keep duplication minimum also updated improved doc reflect change http rubyforge.org tracker index.php func detail aid 23055 group_id 1917 atid 7480,,
1229,d4a5b3e2efd5f31cbf5020589503a943a6215e46,ames Mead <james@floehopper.org>, 2008-11-27 16:07:10 +0000, , removed deprecated gem autorequire updated release,,
1230,8219bb2d2881c8529c93fc21e97a11d01203c759,ames Mead <james@floehopper.org>, 2008-11-27 15:42:53 +0000, , added commit number release 0.9.3,,
1231,b286ee0f4a4581c1944260f20ba1bfd9b913397f,ames Mead <james@floehopper.org>, 2008-11-25 22:06:50 +0000, , preparing 0.9.3 release,,
1232,5b7c135b363dc9dd09d1d6c23b1289c24c5697a1,ames Mead <james@floehopper.org>, 2008-11-25 21:28:42 +0000, , added item todo list,,
1233,990a1622c962761b54152a4eea95434b47f29817,ames Mead <james@floehopper.org>, 2008-11-22 22:07:38 +0000, , updated mailing list address google group,,
1234,b599e2b43f117ceaa363a180dfb84fd4f5c243b9,ames Mead <james@floehopper.org>, 2008-11-22 22:05:04 +0000, , updated readme indicate new support minitest,,
1235,3251107c3ad9cc241ac1b4191a55a59c9e59187f,ames Mead <james@floehopper.org>, 2008-11-22 21:59:33 +0000, , per jay field recommendation impetus talk ruby manor method added core class added including module mean mocha better citizen ruby world behaviour easily extended http 2008 ruby underuse modules.html http 2008 ruby redefine method behavior.html,,
1236,36f20a4c7b2523a16a68d988a92ec6dc8c016950,ames Mead <james@floehopper.org>, 2008-11-22 21:10:36 +0000, , seems current thinking better publish gem rubyforge removing gemspec switching gem building github,,
1237,6b927a30aadaa1eaf36844cfd21d9c4d33757a01,ames Mead <james@floehopper.org>, 2008-11-22 10:14:24 +0000, , seems like new version 0.9.3 case github manages build head,,
1238,04a4ef9f79d7f66c465b78a44ffc895a1929c0c4,ames Mead <james@floehopper.org>, 2008-11-22 10:13:03 +0000, , gemspec requires rake filelist,,
1239,d8d2168e1729c20e73a963a5ff1b87f6fe2ed657,ames Mead <james@floehopper.org>, 2008-11-22 10:08:14 +0000, , added gemspec enable github build gem currently duplicated rakefile,,
1240,1fd24c47873cf0be0d57dc5495080cdf897649d5,ames Mead <james@floehopper.org>, 2008-11-22 09:57:14 +0000, , sorted requires everything work ruby 1.8.6 ruby 1.9 without minitest gem installed suspect thing break take test unit miniunit using use_miniunit yes command run minitest available worth warning,,
1241,b5513eb2e2b8f258f9265f29fea5aeb43a230c79,ames Mead <james@floehopper.org>, 2008-11-21 18:28:36 +0000, , merge branch sprsquish master,,
