id,sha,author,date,issue,message,file,content
618,17a83d58dafff47b1dc802256cb1d78fc94ed14b,arkus F.X.J. Oberhumer <markus@oberhumer.com>, 2017-04-05 17:13:29 +0200, , clang format file,,
619,18a8e1b6d69442bf32a08b249a6a2034b31c5b26,arkus F.X.J. Oberhumer <markus@oberhumer.com>, 2017-04-05 16:37:32 +0200, , update travis,,
620,2c23cbb3592836eb4facad36662e81454a7e653d,arkus F.X.J. Oberhumer <markus@oberhumer.com>, 2017-04-05 16:33:09 +0200, , silence compiler warning,,
621,cdd58cf7575d6e7a52d70dcdac89305116dc3ee1,arkus F.X.J. Oberhumer <markus@oberhumer.com>, 2017-04-05 16:31:36 +0200, , use proper upx type,,
622,a0df325659b388bbe1f4147eea222f427d825ec3,ohn Reiser <jreiser@BitWagon.com>, 2017-04-03 20:26:23 -0700, , merge branch devel http github.com upx upx devel,,
623,a59005e836b84f070e1b2c541059317ed1936f4d,ohn Reiser <jreiser@BitWagon.com>, 2017-04-03 20:11:08 -0700,81, elf propagates via pt_gnu_stack except mips stub difficult http github.com upx upx issue modified .github modified p_elf_enum.h modified p_lx_elf.cpp modified p_lx_elf.h modified stub amd64 linux.elf entry.h modified stub i386 linux.elf fold.h modified stub powerpc linux.elf fold.h modified stub powerpc64le linux.elf fold.h modified stub src amd64 linux.elf entry.s modified stub src i386 linux.elf fold.s modified stub src powerpc linux.elf fold.s modified stub src powerpc64le linux.elf fold.s modified stub tmp amd64 linux.elf entry.bin.dump modified stub tmp i386 linux.elf fold.map modified stub tmp powerpc linux.elf fold.map modified stub tmp powerpc64le linux.elf fold.map,,
624,5da6a27e6bad725a0f72208f0f0984a73f438586,ohn Reiser <jreiser@BitWagon.com>, 2017-04-03 20:11:08 -0700,81, elf propates via pt_gnu_stack except mips stub difficult http github.com upx upx issue modified .github modified p_elf_enum.h modified p_lx_elf.cpp modified p_lx_elf.h modified stub amd64 linux.elf entry.h modified stub i386 linux.elf fold.h modified stub powerpc linux.elf fold.h modified stub powerpc64le linux.elf fold.h modified stub src amd64 linux.elf entry.s modified stub src i386 linux.elf fold.s modified stub src powerpc linux.elf fold.s modified stub src powerpc64le linux.elf fold.s modified stub tmp amd64 linux.elf entry.bin.dump modified stub tmp i386 linux.elf fold.map modified stub tmp powerpc linux.elf fold.map modified stub tmp powerpc64le linux.elf fold.map,,
625,ef97af71e37c4b16088e77998b7bb103f9834ebb,ohn Reiser <jreiser@BitWagon.com>, 2017-04-03 12:57:57 -0700, , merge branch jreiser devel,,
626,6ed67f4532550a4d823c159282fee5f0a150a9ce,ohn Reiser <jreiser@BitWagon.com>, 2017-04-03 12:53:27 -0700,4, unpack prefix appended data give message keep backup http github.com upx upx issue modified p_mach.cpp,,
627,1278d663b465a7666f2aabce88714411c12a36a3,ohn Reiser <jreiser@BitWagon.com>, 2017-04-02 14:56:26 -0700, , merge branch jreiser devel,,
628,0395c7b40733e6e84d32421f2ff23cadcb4ad9cd,ohn Reiser <jreiser@BitWagon.com>, 2017-04-02 14:55:39 -0700, , use stubtools arm64 modified stub makefile modified stub arm64 linux.elf entry.h modified stub arm64 linux.elf fold.h modified stub arm64 linux.shlib init.h modified stub tmp arm64 linux.elf entry.bin.dump modified stub tmp arm64 linux.elf fold.map modified stub tmp arm64 linux.shlib init.bin.dump,,
629,df3d15ffb3edb9d55d33a6004f7d41e33c813dc4,ohn Reiser <jreiser@BitWagon.com>, 2017-03-31 20:01:14 -0700, , enable stub arm64 shlib stub broken least pack modified p_lx_elf.cpp,,
630,6f673310d20507bd9dd248cac1661d144eab1aec,ohn Reiser <jreiser@BitWagon.com>, 2017-03-31 13:42:43 -0700, , powerpc64le lzma compression support http github.com upx upx pull integration based commit author thierry fauck tfauck free.fr date fri mar 2017 0100 powerpc64le lzma compression support signed thierry fauck tfauck free.fr modified powerpc64le darwin.dylib entry.h modified powerpc64le darwin.macho entry.h modified powerpc64le linux.elf entry.h modified powerpc64le modified src arch powerpc 64le lzma_d.s modified tmp powerpc64le darwin.dylib entry.bin.dump modified tmp powerpc64le darwin.macho entry.bin.dump modified tmp powerpc64le linux.elf entry.bin.dump modified tmp powerpc64le,,
631,978c3eca238f00b63f37b32bb6d52a960f5d5d27,ohn Reiser <jreiser@BitWagon.com>, 2017-03-31 13:24:36 -0700,65, android shlib preserve selected elf64_shdr http github.com upx upx issue modified p_lx_elf.cpp modified p_lx_elf.h,,
632,20bc848bd66781d2e33f0184721e2803dfdd0466,ohn Reiser <jreiser@BitWagon.com>, 2017-03-31 13:24:36 -0700, , android shlib preserve selected elf64_shdr modified p_lx_elf.cpp modified p_lx_elf.h,,
633,ce7f1292dcffeaf95e68018a427c61ca8d53868d,ohn Reiser <jreiser@BitWagon.com>, 2017-03-31 13:10:08 -0700, , merge branch devel jreiser,,
634,d97ff8bb40a6240e0ad707270af53427711d3a02,ohn Reiser <jreiser@BitWagon.com>, 2017-03-31 12:57:11 -0700, , cleanup modified p_lx_elf.cpp,,
635,8a9b46d82f479f6f6a5e2e1a2cdaadbff72dc253,ohn Reiser <jreiser@BitWagon.com>, 2017-03-31 12:42:14 -0700, , cleanup minor bug unpack et_exe modified p_lx_elf.cpp,,
636,12e57035418acf739c0ccc42ed448bc591c29a7d,ohn Reiser <jreiser@BitWagon.com>, 2017-03-31 12:20:02 -0700,80, stronger test better message pt_load .p_offset http github.com upx upx issue modified p_lx_elf.cpp,,
637,1b87fc2ee64b83214f86632086bdf14f4dfb1ddd,ohn Reiser <jreiser@BitWagon.com>, 2017-03-30 15:55:35 -0700, , dt_init restored android shlib modified p_lx_elf.cpp,,
638,ebd0c780a114200639750682ebab8c8a25b4ddc9,ohn Reiser <jreiser@BitWagon.com>, 2017-03-30 11:05:49 -0700, , unpacking android shlib work except restoring dt_init modified p_lx_elf.cpp,,
639,bd976cd56262885370b9a280ee03127dbd88ff1c,ohn Reiser <jreiser@BitWagon.com>, 2017-03-30 10:27:54 -0700, , merge branch devel jreiser modified packmast.cpp,,
640,0e511c3e0786c964fc77c6fa1aaa27e412560cc1,ohn Reiser <jreiser@BitWagon.com>, 2017-03-30 10:23:27 -0700, , visitallpackers list class name modified packmast.cpp,,
641,300d48940894ad5df6433eb0d3cfe6126ce58dba,ohn Reiser <jreiser@BitWagon.com>, 2017-03-29 18:31:39 -0700, , android shlib preserve selected elf32_shdr bit also wrong place unpacking modified main.cpp modified options.h modified p_elf_enum.h modified p_lx_elf.cpp modified p_lx_elf.h,,
642,024d081167d4ed67805dac3a1864637141f2fda9,ohn Reiser <jreiser@BitWagon.com>, 2017-03-27 16:48:33 -0700,73, fix unpack et_dyn http github.com upx upx issue modified p_lx_elf.cpp modified p_lx_elf.h,,
643,348173d3f12b3b0aaf75b81a281495839f0ac239,ohn Reiser <jreiser@BitWagon.com>, 2017-03-27 16:42:26 -0700, , fix editing glitch modified p_lx_elf.cpp,,
644,23e3814f8a6b2875ec7206187fd5e278f25d5432,ohn Reiser <jreiser@BitWagon.com>, 2017-03-27 16:10:12 -0700, , fix unpacking et_dyn modified p_lx_elf.cpp modified p_lx_elf.h,,
645,b818e2c4b8881517dce04f7c136b539860051c75,ohn Reiser <jreiser@BitWagon.com>, 2017-03-26 13:10:26 -0700, , arm64 aarch64 tested working nrv2b nrv2e et_exe linux tested lzma et_dyn linux mach modified bele.h modified conf.h modified filter ct.h modified filteri.cpp modified linker.cpp modified linker.h modified miniacc.h modified p_elf_enum.h modified p_lx_elf.cpp modified p_lx_elf.h modified packmast.cpp modified stub makefile modified stub arm64 darwin.macho entry.h modified stub arm64 darwin.macho fold.h new file stub arm64 linux.elf entry.h new file stub arm64 linux.elf fold.h new file stub arm64 linux.shlib init.h new file stub src arch arm64 makefile.extra modified stub src arch arm64 lzma_d arm.s modified stub src arch arm64 lzma_d.s modified stub src arch arm64 lzma_d_cf.s new file stub src arch arm64 lzma_d_cs.s modified stub src arch arm64 macros.s renamed stub src arch arm64 nrv2b_d8.s stub src arch arm64 nrv2b_d32.s renamed stub src arch arm64 nrv2d_d8.s stub src arch arm64 nrv2d_d32.s modified stub src arch arm64 nrv2e_d32.s deleted stub src arch arm64 nrv2e_d8.s modified stub src arm64 darwin.macho entry.s modified stub src arm64 darwin.macho fold.s new file stub src arm64 linux.elf entry.s new file stub src arm64 linux.elf fold.s new file stub src arm64 linux.elf fold.lds new file stub src arm64 linux.elf main.c new file stub src arm64 linux.shlib init.s modified stub src include linux.h modified stub tmp arm64 darwin.macho entry.bin.dump modified stub tmp arm64 darwin.macho fold.map new file stub tmp arm64 linux.elf entry.bin.dump new file stub tmp arm64 linux.elf fold.map new file stub tmp arm64 linux.shlib init.bin.dump,,
646,6adb3dc14255e0b5c53baa098238e2aca4078a2b,ohn Reiser <jreiser@BitWagon.com>, 2017-03-26 13:03:49 -0700, , ,,
647,0e154cc75941102e8324daee4b55f4826af2c0a9,ohn Reiser <jreiser@BitWagon.com>, 2017-03-25 20:22:04 -0700,74, hint need dt_init shared library http github.com upx upx issue modified p_lx_elf.cpp,,
648,9dce8d9bce217f67d81b310bd10c39f40e84622b,ohn Reiser <jreiser@BitWagon.com>, 2017-03-25 20:14:48 -0700, , separate amd64 bxx.s modified stub src arch amd64 bxx.s,,
649,0aa3b9c487f2bbe0c253c35af56ffd6bafbe9281,ohn Reiser <jreiser@BitWagon.com>, 2017-03-25 20:10:50 -0700, , revise comment modified stub src arch amd64 bxx.s,,
650,dc7ab3ed300ed3a040ed79baaec5f6eee9dce8b8,ohn Reiser <jreiser@BitWagon.com>, 2017-03-25 20:08:29 -0700, , sync git branch modified stub amd64 win64.pep.h modified stub tmp amd64,,
651,254259b354f8afe8abfcf53717dce555344d1f05,ohn Reiser <jreiser@BitWagon.com>, 2017-03-25 20:05:32 -0700, , fix comment modified stub src arch amd64 bxx.s,,
652,9651c70efdd8332b5b4ccd766772844aa8a22015,ohn Reiser <jreiser@BitWagon.com>, 2017-03-25 17:51:32 -0700, , revert powerpc linux.elf fold.s modified stub src powerpc linux.elf fold.s,,
653,5840190ed529cf6ec83da3af4e98f6200234d3cf,ohn Reiser <jreiser@BitWagon.com>, 2017-03-25 17:50:06 -0700, , revert xstrip.py modified stub script xstrip.py,,
654,a807b886943ef91287222cbcba12416e638db79a,ohn Reiser <jreiser@BitWagon.com>, 2017-03-25 17:40:24 -0700, ,  modified makefile,,
655,0db82e09e9817ccd579838bc7b72bf9df64c9db0,ohn Reiser <jreiser@BitWagon.com>, 2017-03-25 17:39:47 -0700, , suggest fix missing dt_init shared library modified p_lx_elf.cpp,,
656,e5865f171a5f232167e2bf6b968650cbf376a58f,ohn Reiser <jreiser@BitWagon.com>, 2017-03-25 17:09:16 -0700, , xstrip.py .bindump unused clear e_shnum e_shstrndx also allow compiler powerpc64le arm64 loosen checking modified stub makefile modified stub script xstrip.py modified stub amd64 darwin.dylib entry.h modified stub amd64 darwin.macho entry.h modified stub amd64 linux.elf entry.h modified stub amd64 modified stub amd64 linux.shlib init.h modified stub amd64 win64.pep.h modified stub arm.v4a linux.elf entry.h modified stub arm.v4a wince.pe.h modified stub arm.v4t wince.pe.h modified stub arm.v5a darwin.macho entry.h modified stub arm.v5a linux.elf entry.h modified stub arm.v5a modified stub arm.v5a modified stub arm.v5a linux.shlib init.h modified stub arm.v5t linux.shlib init.h modified stub arm64 darwin.macho entry.h modified stub armeb.v4a linux.elf entry.h modified stub armeb.v5a modified stub i086 dos16.com.h modified stub i086 dos16.exe.h modified stub i086 dos16.sys.h modified stub i386 bsd.elf entry.h modified stub i386 bsd.elf.execve entry.h modified stub i386 darwin.dylib entry.h modified stub i386 darwin.macho entry.h modified stub i386 dos32.djgpp2.h modified stub i386 dos32.tmt.h modified stub i386 modified stub i386 linux.elf entry.h modified stub i386 entry.h modified stub i386 entry.h modified stub i386 linux.elf.shell entry.h modified stub i386 modified stub i386 modified stub i386 linux.shlib init.h modified stub i386 netbsd.elf entry.h modified stub i386 win32.pe.h modified stub m68k atari.tos.h modified stub mips.r3000 linux.elf entry.h modified stub mipsel.r3000 linux.elf entry.h modified stub mipsel.r3000 ps1.h modified stub powerpc darwin.dylib entry.h modified stub powerpc darwin.macho entry.h modified stub powerpc linux.elf entry.h modified stub powerpc modified stub powerpc64le darwin.dylib entry.h modified stub powerpc64le darwin.macho entry.h modified stub powerpc64le linux.elf entry.h modified stub powerpc64le,,
657,166d198dcbcfa70462b9960d22cfe5067c19ef67,ohn Reiser <jreiser@BitWagon.com>, 2017-03-25 16:54:26 -0700, , default modified makefile,,
658,445795f2ec70206c36bad2c81f9d883948f6769b,ohn Reiser <jreiser@BitWagon.com>, 2017-03-25 16:50:38 -0700, , sync testsuite bit powerpc lzma modified .github,,
659,6be4a87dac0ef61c66235f81a4c0d05b1ce8fb15,ohn Reiser <jreiser@BitWagon.com>, 2017-03-25 16:38:30 -0700, , revert testsuite set reverts commit modified .github,,
660,17c47053d6a0960fe29ce42cd0b12a6408e4439f,ohn Reiser <jreiser@BitWagon.com>, 2017-03-25 16:34:01 -0700, , revert amd64 bxx.s reduce churn testsuite modified stub src arch amd64 bxx.s modified stub amd64 darwin.dylib entry.h modified stub amd64 darwin.macho entry.h modified stub amd64 darwin.macho fold.h modified stub amd64 linux.elf fold.h modified stub amd64 linux.shlib init.h modified stub amd64 win64.pep.h,,
661,b4e18f7521917a519e9212f81ef62030b8ed971f,ohn Reiser <jreiser@BitWagon.com>, 2017-03-25 15:48:18 -0700, , remove debugging straggler modified src powerpc linux.elf fold.s modified powerpc linux.elf fold.h modified tmp powerpc linux.elf fold.map,,
662,fbe4d287c7b18075409cf635b4dd24b0fc803664,ohn Reiser <jreiser@BitWagon.com>, 2017-03-25 14:52:08 -0700, , testsuite set modified .github,,
663,543fa3ae7929dc0a939d43d2cca8712569962df9,ohn Reiser <jreiser@BitWagon.com>, 2017-03-25 12:52:20 -0700,73, revert packlinuxelf32 unpack decompression armeb linux.elf upx 3.91 conflicting http github.com upx upx issue modified p_lx_elf.cpp,,
664,7cf855413ce47ba580c5049c064b707c3f5e7336,ohn Reiser <jreiser@BitWagon.com>, 2017-03-25 09:12:56 -0700, , sync testuite checksum powerpc modified .github,,
665,f5d65dc0bc4f0a865a3b3c6a504e59b63b5d5337,ohn Reiser <jreiser@BitWagon.com>, 2017-03-24 13:55:54 -0700, , arm64 unfilter modified stub src arm64 linux.elf fold.s modified stub arm64 linux.elf fold.h modified stub tmp arm64 linux.elf fold.map,,
666,2f6211a1d984a09e49c1bfb51994458766f00d35,ohn Reiser <jreiser@BitWagon.com>, 2017-03-24 10:54:56 -0700, , xstrip.py slight improvement powerpc64le arm64 modified stub script xstrip.py,,
667,513a57330a7d17a29aa4d3d0d98717be61c0c2a4,ohn Reiser <jreiser@BitWagon.com>, 2017-03-24 09:26:40 -0700, , xstrip.py .bindump unused clear e_shnum e_shstrndx modified stub script xstrip.py modified stub makefile modified stub amd64 darwin.dylib entry.h modified stub amd64 darwin.macho entry.h modified stub amd64 linux.elf entry.h modified stub amd64 modified stub amd64 linux.shlib init.h modified stub amd64 win64.pep.h modified stub arm.v4a linux.elf entry.h modified stub arm.v4a wince.pe.h modified stub arm.v4t wince.pe.h modified stub arm.v5a darwin.macho entry.h modified stub arm.v5a linux.elf entry.h modified stub arm.v5a modified stub arm.v5a modified stub arm.v5a linux.shlib init.h modified stub arm.v5t linux.shlib init.h modified stub arm64 darwin.macho entry.h modified stub arm64 linux.elf entry.h modified stub arm64 linux.shlib init.h modified stub armeb.v4a linux.elf entry.h modified stub armeb.v5a modified stub i086 dos16.com.h modified stub i086 dos16.exe.h modified stub i086 dos16.sys.h modified stub i386 bsd.elf entry.h modified stub i386 bsd.elf.execve entry.h modified stub i386 darwin.dylib entry.h modified stub i386 darwin.macho entry.h modified stub i386 dos32.djgpp2.h modified stub i386 dos32.tmt.h modified stub i386 modified stub i386 linux.elf entry.h modified stub i386 entry.h modified stub i386 entry.h modified stub i386 linux.elf.shell entry.h modified stub i386 modified stub i386 modified stub i386 linux.shlib init.h modified stub i386 netbsd.elf entry.h modified stub i386 win32.pe.h modified stub m68k atari.tos.h modified stub mips.r3000 linux.elf entry.h modified stub mipsel.r3000 linux.elf entry.h modified stub mipsel.r3000 ps1.h modified stub powerpc darwin.dylib entry.h modified stub powerpc darwin.macho entry.h modified stub powerpc linux.elf entry.h modified stub powerpc modified stub powerpc64le darwin.dylib entry.h modified stub powerpc64le darwin.macho entry.h modified stub powerpc64le linux.elf entry.h modified stub powerpc64le,,
668,715ddf0620279d3e43fb95e9c9ec186bb8aa0854,ohn Reiser <jreiser@BitWagon.com>, 2017-03-23 20:32:41 -0700, , arm64 hacking modified stub src arch arm64 macros.s new file stub src arch arm64 makefile.extra modified stub src arch arm64 lzma_d arm.s modified stub src arch arm64 lzma_d.s modified stub src arch arm64 lzma_d_cf.s new file stub src arch arm64 lzma_d_cs.s modified stub src arm64 darwin.macho entry.s modified stub arm64 darwin.macho entry.h modified stub arm64 linux.elf entry.h modified stub arm64 linux.shlib init.h modified stub tmp arm64 darwin.macho entry.bin.dump modified stub tmp arm64 linux.elf entry.bin.dump modified stub tmp arm64 linux.shlib init.bin.dump,,
669,6bb31e276e03ee0124e8cea358cda2fc4eafcb1e,ohn Reiser <jreiser@BitWagon.com>, 2017-03-23 13:27:09 -0700, , merge branch devel jreiser,,
670,b10f1df49f6624bf37af3212b1ab8291f1eaacbf,ohn Reiser <jreiser@BitWagon.com>, 2017-03-23 13:09:59 -0700, , merge branch devel http github.com upx upx devel,,
671,f999519b13acea45d1f543c1536aeb08c2eec624,ohn Reiser <jreiser@BitWagon.com>, 2017-03-23 13:08:36 -0700, , sync stub bit powerpc modified stub src arch powerpc makefile.extra modified stub src arch powerpc lzma_d_cf.s modified stub src arch powerpc lzma_d_cs.s modified stub powerpc darwin.dylib entry.h modified stub powerpc darwin.macho entry.h modified stub powerpc linux.elf entry.h modified stub powerpc,,
672,aedbf0283079c5b39948a244834eb38b59d1902d,arkus F.X.J. Oberhumer <markus@oberhumer.com>, 2017-03-23 17:43:23 +0100, , p_lx_elf.cpp silence clang 4.0 compilation warning,,
673,bd5479b25090030396e6d6555e6faa30700450f5,ohn Reiser <jreiser@BitWagon.com>, 2017-03-23 09:12:35 -0700, , arm64 omit zva valgrind complains modified src arm64 linux.elf entry.s modified src arm64 linux.elf fold.s modified arm64 linux.elf entry.h modified arm64 linux.elf fold.h modified tmp arm64 linux.elf entry.bin.dump modified tmp arm64 linux.elf fold.map,,
674,9d147156523efaa61932ac5b8c8eaeb3cad7bf94,arkus F.X.J. Oberhumer <markus@oberhumer.com>, 2017-03-23 13:00:42 +0100, , update travis,,
675,72156fcf1b4c53cbf3352db7c406d3e8bec66111,hierry Fauck <tfauck@free.fr>, 2017-03-23 11:21:50 +0100, , powerpc64le support fpie compiled binary signed thierry fauck tfauck free.fr modified powerpc64le linux.elf fold.h modified src powerpc64le linux.elf fold.s modified src powerpc64le linux.elf main.c modified tmp powerpc64le linux.elf fold.map,,
676,1c6eab00d1ab76119abd43b3d8a79a1681e5a190,arkus F.X.J. Oberhumer <markus@oberhumer.com>, 2017-03-23 02:07:08 +0100, , update travis,,
677,f9738c5b550e017fd27e9bd620c5a780a16a9548,arkus F.X.J. Oberhumer <markus@oberhumer.com>, 2017-03-01 13:20:50 +0100, , new acc version,,
678,3b630836193ba42856827aa7e7246112735258e2,ohn Reiser <jreiser@BitWagon.com>, 2017-03-22 16:50:52 -0700, , cleanup powerpc64 stub modified stub src powerpc64le darwin.macho fold.s modified stub src powerpc64le linux.elf entry.s modified stub powerpc64le darwin.macho fold.h modified stub powerpc64le linux.elf entry.h modified stub tmp powerpc64le darwin.macho fold.map modified stub tmp powerpc64le linux.elf entry.bin.dump,,
679,d5d7d8bc8437e768cb6bbe5a55aad5e027593774,ohn Reiser <jreiser@BitWagon.com>, 2017-03-22 16:45:09 -0700, , arm64 hacking modified stub src arm64 linux.elf fold.s modified stub src arm64 linux.elf main.c modified stub arm64 linux.elf fold.h modified stub tmp arm64 linux.elf fold.map,,
680,f26118cf5aab2645ba6527e285ca9804abe99bf8,ohn Reiser <jreiser@BitWagon.com>, 2017-03-22 14:17:40 -0700, , lzma powerpc64le need _restgpr0_ modified stub src arch powerpc 64le makefile.extra modified stub src arch powerpc 64le ppc_regs.h modified stub src powerpc64 savegpr0.s modified stub powerpc64le darwin.dylib entry.h modified stub powerpc64le darwin.macho entry.h modified stub powerpc64le linux.elf entry.h modified stub powerpc64le modified stub src arch powerpc 64le lzma_d_cf.s modified stub src arch powerpc 64le lzma_d_cs.s modified stub tmp powerpc64le darwin.dylib entry.bin.dump modified stub tmp powerpc64le darwin.macho entry.bin.dump modified stub tmp powerpc64le linux.elf entry.bin.dump modified stub tmp powerpc64le,,
681,5d6c4b475cd3825b06fd3fb5e626bb638ecf1476,ohn Reiser <jreiser@BitWagon.com>, 2017-03-22 09:03:13 -0700, , preloc modified stub src arm64 linux.elf main.c,,
682,2c4ef392f6e5ca18482ecd96788a65469c8a9803,ohn Reiser <jreiser@BitWagon.com>, 2017-03-21 21:54:49 -0700, , arm64 linux hacking return upx_main launch remains modified stub src arch arm64 lzma_d.s modified stub src arch arm64 nrv2b_d32.s modified stub src arch arm64 nrv2d_d32.s modified stub src arch arm64 nrv2e_d32.s modified stub src arm64 linux.elf entry.s modified stub src arm64 linux.elf fold.s modified stub src arm64 linux.elf main.c modified stub arm64 darwin.macho entry.h modified stub arm64 linux.elf entry.h modified stub arm64 linux.elf fold.h modified stub arm64 linux.shlib init.h modified stub tmp arm64 darwin.macho entry.bin.dump modified stub tmp arm64 linux.elf entry.bin.dump modified stub tmp arm64 linux.elf fold.map modified stub tmp arm64 linux.shlib init.bin.dump,,
683,2a128fe772b25aa02d3c5552398ee013dd84baf3,ohn Reiser <jreiser@BitWagon.com>, 2017-03-20 21:23:15 -0700, , work arm64 decompression renamed stub src arch arm64 nrv2b_d8.s stub src arch arm64 nrv2b_d32.s renamed stub src arch arm64 nrv2d_d8.s stub src arch arm64 nrv2d_d32.s modified stub src arch arm64 nrv2e_d32.s deleted stub src arch arm64 nrv2e_d8.s modified stub src arm64 darwin.macho entry.s modified stub src arm64 linux.elf entry.s modified stub src arm64 linux.elf fold.s modified stub src arm64 linux.shlib init.s modified stub arm64 darwin.macho entry.h modified stub arm64 linux.elf entry.h modified stub arm64 linux.elf fold.h modified stub arm64 linux.shlib init.h modified stub tmp arm64 darwin.macho entry.bin.dump modified stub tmp arm64 linux.elf entry.bin.dump modified stub tmp arm64 linux.elf fold.map modified stub tmp arm64 linux.shlib init.bin.dump,,
684,bb7d3ca3a12f681484044fc05f61c7fd741ff80b,ohn Reiser <jreiser@BitWagon.com>, 2017-03-20 21:21:46 -0700, , fix packlinuxelf32 unpack shared library modified p_lx_elf.cpp,,
685,a2bdba7eda23faa671a3eb3c2f6fffe6c6a9b765,ohn Reiser <jreiser@BitWagon.com>, 2017-03-14 21:36:18 -0700, , arm64 cache flogging initial move modified stub arm64 linux.elf entry.h modified stub src arm64 linux.elf entry.s modified stub tmp arm64 linux.elf entry.bin.dump,,
686,e8aabc998014a24194a2d5b41d9bfb0734a0e6cd,ohn Reiser <jreiser@BitWagon.com>, 2017-03-14 21:35:01 -0700, ,  modified linker.cpp,,
687,9f554a14fd09fd30e644ddd486e3e1921f43e4ff,ohn Reiser <jreiser@BitWagon.com>, 2017-03-14 20:08:28 -0700, , arm64 hacking modified p_lx_elf.cpp modified stub src arch arm64 macros.s modified stub src arm64 darwin.macho fold.s modified stub src arm64 linux.elf entry.s modified stub arm64 darwin.macho entry.h modified stub arm64 darwin.macho fold.h modified stub arm64 linux.elf entry.h modified stub arm64 linux.elf fold.h modified stub tmp arm64 darwin.macho fold.map modified stub tmp arm64 linux.elf entry.bin.dump modified stub tmp arm64 linux.elf fold.map,,
688,68a2b91ccb0174fb0de684dc23ed6a8049363033,ohn Reiser <jreiser@BitWagon.com>, 2017-03-05 21:05:13 -0800, , arm64 filter relocation definesymbols modified makefile modified bele.h modified filter ct.h modified filteri.cpp modified linker.cpp modified miniacc.h modified p_lx_elf.cpp modified stub arm64 linux.elf entry.h modified stub src arm64 linux.elf entry.s,,
689,4089cc6e6f55f87581721fc019e963eb6662c43e,ohn Reiser <jreiser@BitWagon.com>, 2017-03-05 18:07:29 -0800, , arm64 linux compiles modified conf.h modified linker.cpp modified linker.h modified p_elf_enum.h modified p_lx_elf.cpp modified p_lx_elf.h modified packmast.cpp modified stub makefile new file stub arm64 linux.shlib init.h new file stub src arm64 linux.shlib init.s new file stub tmp arm64 linux.elf entry.bin.dump new file stub tmp arm64 linux.elf fold.map new file stub tmp arm64 linux.shlib init.bin.dump,,
