id,sha,author,date,issue,message,file,content
2582,2680aabe068123d25cb1bc4b89dd734e81e84f6e,arkus F.X.J. Oberhumer <markus@oberhumer.com>, 2006-03-17 14:57:20 +0000, , removed bogus struct udll committer mfx mfx 1142607440 0000,,
2583,d5c0533b74ce4cff4942fc47bd458ca99247dac5,arkus F.X.J. Oberhumer <markus@oberhumer.com>, 2006-03-17 13:53:10 +0000, , allow section cross page boundary committer mfx mfx 1142603590 0000,,
2584,609307668be24426a1fbab7e26e650769ab91b6e,arkus F.X.J. Oberhumer <markus@oberhumer.com>, 2006-03-16 16:41:31 +0000, , use makefile_list dependency committer mfx mfx 1142527291 0000,,
2585,cdaf36572a3d91d66a22d3572ad3b77bd45bc354,arkus F.X.J. Oberhumer <markus@oberhumer.com>, 2006-03-16 16:39:54 +0000, , use src version.h committer mfx mfx 1142527194 0000,,
2586,033c8d5d51ff07c5b06924b3be68797bcb0022b7,arkus F.X.J. Oberhumer <markus@oberhumer.com>, 2006-03-16 15:40:08 +0000, , updated committer mfx mfx 1142523608 0000,,
2587,6216ec1d6a74912d4c50010373724541431d254b,arkus F.X.J. Oberhumer <markus@oberhumer.com>, 2006-03-16 15:17:52 +0000, , mention john main author committer mfx mfx 1142522272 0000,,
2588,6c9c67f6c514a90b170180290721d7ac1c969263,ászló Molnár <ezerotven+github@gmail.com>, 2006-03-16 11:23:01 +0000, , dep hack seems need patch flag section upx1 committer ml1050 ml1050 1142508181 0000,,
2589,5bd32b552119d5696319fe57b1f81460f5fd6a5b,arkus F.X.J. Oberhumer <markus@oberhumer.com>, 2006-03-14 05:04:38 +0000, , commented int3 debugging leftover committer mfx mfx 1142312678 0000,,
2590,549336f75bcdb5eeb5ee1b7e1e58fdbc131a6178,arkus F.X.J. Oberhumer <markus@oberhumer.com>, 2006-03-14 04:44:45 +0000, , use boolean instead bitwise logic committer mfx mfx 1142311485 0000,,
2591,f0e75f30b3d5b8cc5bfa033cf9db198cd1cb67a7,arkus F.X.J. Oberhumer <markus@oberhumer.com>, 2006-03-14 04:34:45 +0000, , fixed typo comment committer mfx mfx 1142310885 0000,,
2592,144c09f175cfd1d98dd153f3b2f7e1e717ca10e7,arkus F.X.J. Oberhumer <markus@oberhumer.com>, 2006-03-14 04:33:43 +0000, , rebuilt i386 linux stub gcc 3.4.6 committer mfx mfx 1142310823 0000,,
2593,ee50c0f97c8d1177babb28b5da204c803fa23bd2,arkus F.X.J. Oberhumer <markus@oberhumer.com>, 2006-03-14 04:19:48 +0000, , corrected app_ .pl dependency committer mfx mfx 1142309988 0000,,
2594,ade921bf0230e85ae7dbda85bf7a36e5bfe7b7cd,ohn Reiser <jreiser@BitWagon.com>, 2006-03-14 03:23:45 +0000, , .asy .asx depend onf app_i386 committer jreiser jreiser 1142306625 0000,,
2595,676cacff0452f1c569d1b13b30d78c565e7adc2f,ohn Reiser <jreiser@BitWagon.com>, 2006-03-14 03:03:58 +0000, , gcc 4.1.0 vs. mmap linux.hh fold_elf86.asm l_lx_elf.c fold_exec86.asm l_lx_exec.c fold_pti86.asm l_lx_pti.c fold_sh86.asm l_lx_sh.c l_lx_sh86.asm l_lx_sep.c committer jreiser jreiser 1142305438 0000,,
2596,a3097d5e25ad3834a145b514cb83a71bc9d3aa91,arkus F.X.J. Oberhumer <markus@oberhumer.com>, 2006-03-14 02:32:49 +0000, , added dependency committer mfx mfx 1142303569 0000,,
2597,fd7814855827d6e833231662455180d7fe25aa68,arkus F.X.J. Oberhumer <markus@oberhumer.com>, 2006-03-14 02:17:59 +0000, , fixed typo disabled code committer mfx mfx 1142302679 0000,,
2598,a4d79d73755feab0a924b57b0677104b485930ac,arkus F.X.J. Oberhumer <markus@oberhumer.com>, 2006-03-14 02:16:26 +0000, , small cosmetic change committer mfx mfx 1142302586 0000,,
2599,df04e8183df0ec1fea23ef366ea953d382cb6bcd,arkus F.X.J. Oberhumer <markus@oberhumer.com>, 2006-03-14 02:02:10 +0000, , filter parameter called instead committer mfx mfx 1142301730 0000,,
2600,c43c484a625e1f9dc3b301176b9ed4845481341b,arkus F.X.J. Oberhumer <markus@oberhumer.com>, 2006-03-14 01:59:46 +0000, , synced file little bit committer mfx mfx 1142301586 0000,,
2601,0608c356692e0c66bb1497e1df3ef451394f1ec2,arkus F.X.J. Oberhumer <markus@oberhumer.com>, 2006-03-14 01:13:10 +0000, , added objstrip small cleanup committer mfx mfx 1142298790 0000,,
2602,7dd4d06e261edf0ef576c50f58ae605e5e4299af,arkus F.X.J. Oberhumer <markus@oberhumer.com>, 2006-03-13 22:21:18 +0000, , added call nasm invocation committer mfx mfx 1142288478 0000,,
2603,1ee0310b864dbac08e167eb8416649ee49132631,ohn Reiser <jreiser@BitWagon.com>, 2006-03-13 21:35:49 +0000, , silence complaint find entry symbol _start defaulting 10000000 committer jreiser jreiser 1142285749 0000,,
2604,cc0a52038fe3426907368416e6d3fa40da19387a,arkus F.X.J. Oberhumer <markus@oberhumer.com>, 2006-03-13 11:06:58 +0000, , rebuilt i386 linux stub gcc 4.1.0 small size decrease committer mfx mfx 1142248018 0000,,
2605,6aed1fe23142e3bf1c13666d05665f8421a8a9a0,arkus F.X.J. Oberhumer <markus@oberhumer.com>, 2006-03-13 11:06:16 +0000, , updated committer mfx mfx 1142247976 0000,,
2606,680608fe188548a22575549fc9347ab19e684bde,arkus F.X.J. Oberhumer <markus@oberhumer.com>, 2006-03-13 11:04:32 +0000, , portability fix committer mfx mfx 1142247872 0000,,
2607,ec6acbc60211e751fbe9b9a76393299b5563b4a6,arkus F.X.J. Oberhumer <markus@oberhumer.com>, 2006-03-13 11:03:57 +0000, , small fix make valid ansi committer mfx mfx 1142247837 0000,,
2608,cb7ee4c5d23cb36b240fe3972907f174c22c7f2d,ohn Reiser <jreiser@BitWagon.com>, 2006-03-13 00:45:12 +0000, , _syscall1nr _exit still waste byte committer jreiser jreiser 1142210712 0000,,
2609,88d5798f457079397189d3815d429a6fab6ea635,arkus F.X.J. Oberhumer <markus@oberhumer.com>, 2006-03-11 15:22:56 +0000, , bumped version starting 1.95 development committer mfx mfx 1142090576 0000,,
2610,fcc22a0aa359234aa9c83ffe1940bad1a412c477,arkus F.X.J. Oberhumer <markus@oberhumer.com>, 2006-03-11 13:53:15 +0000, , added committer mfx mfx 1142085195 0000,,
2611,aabefff298db42e9575cab12021f17dfa8eac36e,arkus F.X.J. Oberhumer <markus@oberhumer.com>, 2006-03-11 12:57:42 +0000, , prepared release 1.94 committer mfx mfx 1142081862 0000,,
2612,ed25c64e97cad9a4f41eb41ddbda5890042d4e85,arkus F.X.J. Oberhumer <markus@oberhumer.com>, 2006-03-11 12:56:37 +0000, , updated committer mfx mfx 1142081797 0000,,
2613,b7dc870c2dc9a22703b23f047255b747d9e0128a,arkus F.X.J. Oberhumer <markus@oberhumer.com>, 2006-03-11 12:56:16 +0000, , centered string committer mfx mfx 1142081776 0000,,
2614,9bea608843fd07ba378688709db221a1362f0f65,arkus F.X.J. Oberhumer <markus@oberhumer.com>, 2006-03-11 12:44:01 +0000, , suppress error committer mfx mfx 1142081041 0000,,
2615,9db1732c36c53567d5e69af1ac00585a8de1e30b,arkus F.X.J. Oberhumer <markus@oberhumer.com>, 2006-03-11 10:59:34 +0000, , added note upgrade gcc 4.1.0 i386 linux committer mfx mfx 1142074774 0000,,
2616,39f1a70174a22f31531cc06bc26ea5748ac83a92,arkus F.X.J. Oberhumer <markus@oberhumer.com>, 2006-03-11 00:15:55 +0000, , small update committer mfx mfx 1142036155 0000,,
2617,181044035572a7e49a5759cea231e08dbff35662,arkus F.X.J. Oberhumer <markus@oberhumer.com>, 2006-03-11 00:10:33 +0000, , added __attribute__ __sentinel__ packer addloader new gcc 4.1 feature committer mfx mfx 1142035833 0000,,
2618,37ac8f179e663d9f1d975a266864de197ec24a05,arkus F.X.J. Oberhumer <markus@oberhumer.com>, 2006-03-11 00:03:05 +0000, , new acc version committer mfx mfx 1142035385 0000,,
2619,626a09328f1933b8178b45acb67f21e0a3634df4,arkus F.X.J. Oberhumer <markus@oberhumer.com>, 2006-03-08 08:42:16 +0000, , updated committer mfx mfx 1141807336 0000,,
2620,8d489d0d7703fee2e46744e7846086d02ab7c433,arkus F.X.J. Oberhumer <markus@oberhumer.com>, 2006-03-08 06:22:48 +0000, , new acc version committer mfx mfx 1141798968 0000,,
2621,776f3db0d7763395912484818833a6019a097c5a,arkus F.X.J. Oberhumer <markus@oberhumer.com>, 2006-03-08 05:32:58 +0000, , detabified committer mfx mfx 1141795978 0000,,
2622,6046057b889d21bb75e5217749754e4a1e5eb8bd,ohn Reiser <jreiser@BitWagon.com>, 2006-03-06 23:00:40 +0000, , commentary selinux upx committer jreiser jreiser 1141686040 0000,,
2623,7e85d9e5499d24871d12af2184469271f3309d72,arkus F.X.J. Oberhumer <markus@oberhumer.com>, 2006-03-06 21:04:04 +0000, , updated committer mfx mfx 1141679044 0000,,
2624,01c8a8b1c2a0978f4a85f5e86c3fb9ed9ff95707,arkus F.X.J. Oberhumer <markus@oberhumer.com>, 2006-03-06 11:01:18 +0000, , disabled expensive run time assertion committer mfx mfx 1141642878 0000,,
2625,c9bf6ac9aeb1c41ac5d9d00c6454f06cd724f30d,arkus F.X.J. Oberhumer <markus@oberhumer.com>, 2006-03-06 10:57:27 +0000, , need preserve eax clearstack committer mfx mfx 1141642647 0000,,
2626,62e4d69be956841fc3bcc04280109aed9f4b4855,ohn Reiser <jreiser@BitWagon.com>, 2006-03-06 00:41:50 +0000, , compile changed m_lx_elfppc32.c committer jreiser jreiser 1141605710 0000,,
2627,62ac733b093d5cb0a5e84ec48f4d4fec5a4bf828,ohn Reiser <jreiser@BitWagon.com>, 2006-03-04 16:06:38 +0000, , simplify save byte committer jreiser jreiser 1141488398 0000,,
2628,c3b3e1b1b95a09e50e0307f0bc11bc08db125100,ohn Reiser <jreiser@BitWagon.com>, 2006-03-04 15:02:59 +0000, , map_denywrite committer jreiser jreiser 1141484579 0000,,
2629,a791e96e00724db238342d334c3e21dd94fb4987,ohn Reiser <jreiser@BitWagon.com>, 2006-03-03 19:15:53 +0000, , fix do_xmap work selinux also trim unneeded code committer jreiser jreiser 1141413353 0000,,
2630,e87f5521c17c4a58aecc2c386032a68c4bc40eaa,ohn Reiser <jreiser@BitWagon.com>, 2006-03-03 05:59:55 +0000, , conditionally compile debugging printf committer jreiser jreiser 1141365595 0000,,
2631,366a708f3a6245730d2ea774cd0e2fabdd429448,ohn Reiser <jreiser@BitWagon.com>, 2006-03-03 01:21:16 +0000, , generalize pt_load using find_load_gap needed linux elfamd also simplifies applies pack unpack p_lx_elf.cpp p_lx_elf.h committer jreiser jreiser 1141348876 0000,,
2632,70ba6625744122d3c1e3c86d34e35ab4828b7aef,ohn Reiser <jreiser@BitWagon.com>, 2006-03-02 19:22:48 +0000, , avoid overwrite obuf hdr_buf non first method committer jreiser jreiser 1141327368 0000,,
2633,b389abd99faaf4cf34bdd0e90239e44646730010,ohn Reiser <jreiser@BitWagon.com>, 2006-03-02 19:13:12 +0000, , allows nrv2b nrv2e committer jreiser jreiser 1141326792 0000,,
2634,4aa2d14fe3147337886bbfeb2a953b1ea2aba18c,ohn Reiser <jreiser@BitWagon.com>, 2006-03-02 19:12:01 +0000, , acknowledge unused result avoid compiler warning treated error committer jreiser jreiser 1141326721 0000,,
2635,af7de75ad464d3d2d975f698b4cf304425142af7,ohn Reiser <jreiser@BitWagon.com>, 2006-03-01 22:42:40 +0000, , allow unfilter convenience end end checksum packer.h packer.cpp p_unix.cpp committer jreiser jreiser 1141252960 0000,,
2636,d461ebbda13c2d16d823527c21e6a3b53d2df540,ohn Reiser <jreiser@BitWagon.com>, 2006-03-01 19:36:03 +0000, , fix packextent checksum length uncompressed data hdr_ulen committer jreiser jreiser 1141241763 0000,,
2637,55ef94abcd4b2e0fb4412e03dc3a3234d6bd5551,ohn Reiser <jreiser@BitWagon.com>, 2006-02-26 22:44:33 +0000, , bit decompressors arm minimize space aggressively arm_nrv2b_d8.s arm_nrv2e_d8.s committer jreiser jreiser 1140993873 0000,,
2638,afaf489d9984afd31a96c4010de6b9f6aa8ee797,ohn Reiser <jreiser@BitWagon.com>, 2006-02-23 16:55:17 +0000, , save space aggressively committer jreiser jreiser 1140713717 0000,,
2639,20e4cbfd13d641d5c8908d304a685eb6153965b4,ohn Reiser <jreiser@BitWagon.com>, 2006-02-23 06:45:45 +0000, , pass first test untested feature large offset force minimum match length arm_nrv2b_d32.s arm_nrv2e_d32.s committer jreiser jreiser 1140677145 0000,,
2640,f3b8c9f34e91453fcb2d241a6be8b6d5d4c6e7fa,ohn Reiser <jreiser@BitWagon.com>, 2006-02-22 18:57:59 +0000, , debugging committer jreiser jreiser 1140634679 0000,,
2641,45e8ff25a5d6df1c6954fd3958066996f3293567,ohn Reiser <jreiser@BitWagon.com>, 2006-02-21 15:32:25 +0000, , hand tuned decompressors bit nrv arm arm_nrv2b_d32.s arm_nrv2e_d32.s committer jreiser jreiser 1140535945 0000,,
2642,268e322e1c9e046c6cfaaf51d6c116d57f33e8c2,ohn Reiser <jreiser@BitWagon.com>, 2006-02-18 05:37:10 +0000, , extra parameter packextent fix pas problem brute linux elf386 one decompression method allowed chosen smallest output .text elf header come first packer.cpp packer.h p_unix.cpp p_unix.h p_lx_elf.cpp committer jreiser jreiser 1140241030 0000,,
2643,d3bcba6a055969593c4b59a52e3904e7b25a1a54,arkus F.X.J. Oberhumer <markus@oberhumer.com>, 2006-02-15 11:14:54 +0000, , removed volatile global var opt needed long time ago work around problem ancient compiler committer mfx mfx 1140002094 0000,,
2644,cc4ef1944d3ad14540f092b7bfc98a9b427e8ad9,arkus F.X.J. Oberhumer <markus@oberhumer.com>, 2006-02-14 14:56:01 +0000, , make sure touch exactly one page update comment committer mfx mfx 1139928961 0000,,
2645,5aa8486265d1069ae57cbdd641550848a84b8674,arkus F.X.J. Oberhumer <markus@oberhumer.com>, 2006-02-14 14:48:37 +0000, , prefer restoring original protection flag committer mfx mfx 1139928517 0000,,
2646,fd181673cda9bcb3735f6306e3555378ad6839d3,ászló Molnár <ezerotven+github@gmail.com>, 2006-02-14 14:30:44 +0000, , little comment dep hack stuff committer ml1050 ml1050 1139927444 0000,,
2647,62c9547c4e1c7f130557e27057b8d1da5e870526,ászló Molnár <ezerotven+github@gmail.com>, 2006-02-14 11:55:35 +0000, , added comment dep hack stuff committer ml1050 ml1050 1139918135 0000,,
2648,cdd117bfb94fec61913441a415f635e55747651a,arkus F.X.J. Oberhumer <markus@oberhumer.com>, 2006-02-14 11:22:21 +0000, , rearranged debug option committer mfx mfx 1139916141 0000,,
2649,304ba57dad1ab3051a523093b677f0d4932d67f7,arkus F.X.J. Oberhumer <markus@oberhumer.com>, 2006-02-14 11:02:45 +0000, , clear dirty stack win32 committer mfx mfx 1139914965 0000,,
2650,69eaaa417767b1b0377d9870c48bbcdf9912ddfd,arkus F.X.J. Oberhumer <markus@oberhumer.com>, 2006-02-14 10:54:39 +0000, , revert previous checkin committer mfx mfx 1139914479 0000,,
2651,452ac52fcb2c90a4e48df9cfaaa91d809271ad0d,arkus F.X.J. Oberhumer <markus@oberhumer.com>, 2006-02-14 10:39:10 +0000, , added overloaded addloader method committer mfx mfx 1139913550 0000,,
2652,40cf4892909f66196273dd3845dc1f699346c3f4,arkus F.X.J. Oberhumer <markus@oberhumer.com>, 2006-02-14 01:46:32 +0000, , avoid possibly clobbering edx committer mfx mfx 1139881592 0000,,
2653,891d6be4a64d778e2e25a47ea142a989a26826c1,arkus F.X.J. Oberhumer <markus@oberhumer.com>, 2006-02-13 21:31:19 +0000, , removed options_t win32_pe strip_loadconf compatibility reason option still accepted ignored commandline parsing committer mfx mfx 1139866279 0000,,
2654,5d45ce5cf7b55d2ac0cf0f4cddd4d0adc2878ea9,arkus F.X.J. Oberhumer <markus@oberhumer.com>, 2006-02-13 21:02:03 +0000, , removed already fixed item committer mfx mfx 1139864523 0000,,
2655,a0f2241f3aa901579e2adc77df3c12b0729fbb52,arkus F.X.J. Oberhumer <markus@oberhumer.com>, 2006-02-13 20:31:08 +0000, , added comment committer mfx mfx 1139862668 0000,,
2656,aa513bf7d32e6c045f3e84958857d7a7941c1389,arkus F.X.J. Oberhumer <markus@oberhumer.com>, 2006-02-13 20:09:58 +0000, , quick fix win32 startup crash need testing committer mfx mfx 1139861398 0000,,
2657,b2d65febc8609e63df2f140546729174a9e84755,arkus F.X.J. Oberhumer <markus@oberhumer.com>, 2006-02-13 15:17:27 +0000, , small update committer mfx mfx 1139843847 0000,,
2658,23a6d326e8ffe157e9b30c06ff09ca3778720133,arkus F.X.J. Oberhumer <markus@oberhumer.com>, 2006-02-13 14:15:29 +0000, , bump tentative release date update readmes committer mfx mfx 1139840129 0000,,
2659,5b2f1b6d8b7b491e304fc2708e0a2f924538feba,arkus F.X.J. Oberhumer <markus@oberhumer.com>, 2006-02-13 10:22:43 +0000, , introduced committer mfx mfx 1139826163 0000,,
2660,b4e9ad031b880687378041ef5256bbd96868583d,arkus F.X.J. Oberhumer <markus@oberhumer.com>, 2006-02-12 23:26:05 +0000, , break string doe try expand keywords committer mfx mfx 1139786765 0000,,
2661,8b7ebcf040e94db20d8822d77c42a49278aefccb,arkus F.X.J. Oberhumer <markus@oberhumer.com>, 2006-02-12 21:14:43 +0000, , enter 2006 committer mfx mfx 1139778883 0000,,
2662,af05296631c5ac409eacaef3b43cf680c79f62e4,arkus F.X.J. Oberhumer <markus@oberhumer.com>, 2006-02-12 20:39:58 +0000, , made ps1 exe work committer mfx mfx 1139776798 0000,,
2663,29d693de2d9c386be3beba1d991574450bf7ab51,arkus F.X.J. Oberhumer <markus@oberhumer.com>, 2006-02-12 19:34:23 +0000, , new acc version committer mfx mfx 1139772863 0000,,
2664,51ac5172f5abebf3440fbfbfd08cb1e4f9d89f85,arkus F.X.J. Oberhumer <markus@oberhumer.com>, 2006-02-12 11:20:26 +0000, , undef page_ mask size fix build problem machine committer mfx mfx 1139743226 0000,,
2665,24ce1ef5e711e7cdbe651df330e6d04c196aa7fe,arkus F.X.J. Oberhumer <markus@oberhumer.com>, 2006-02-12 11:06:40 +0000, , enter 2006 committer mfx mfx 1139742400 0000,,
2666,f6d1e269d1123765dafcdaf83c738b6b460163ca,arkus F.X.J. Oberhumer <markus@oberhumer.com>, 2006-02-12 11:03:44 +0000, , prepare new release committer mfx mfx 1139742224 0000,,
2667,62c2f5228d19a6de17fc5e6d856420b9a5d965d0,arkus F.X.J. Oberhumer <markus@oberhumer.com>, 2006-02-12 11:02:10 +0000, , rebuilt stub committer mfx mfx 1139742130 0000,,
2668,9882d9683b98fafe4eb8476abe7debc0761c14f2,arkus F.X.J. Oberhumer <markus@oberhumer.com>, 2006-02-12 10:58:55 +0000, , updated committer mfx mfx 1139741935 0000,,
2669,45ce89ee1f04be3e6413ab6fe1824a1695769082,arkus F.X.J. Oberhumer <markus@oberhumer.com>, 2006-02-12 10:58:39 +0000, , removed trailing whitespace committer mfx mfx 1139741919 0000,,
2670,bfb9df1553150a762ea58a214921c6f8a9adfd94,ászló Molnár <ezerotven+github@gmail.com>, 2006-02-09 17:21:25 +0000, , win32 r6002 runtime error worked around committer ml1050 ml1050 1139505685 0000,,
2671,a5f79204ce7e720de6313a3e2e7e3f52a89472d7,ászló Molnár <ezerotven+github@gmail.com>, 2006-02-08 13:20:12 +0000, , set use_dep_hack true committer ml1050 ml1050 1139404812 0000,,
2672,e322613d84bfabfcb1399035dbb3a34673d8cba8,ászló Molnár <ezerotven+github@gmail.com>, 2006-02-08 10:17:03 +0000, , workaround added msvc runtime protection committer ml1050 ml1050 1139393823 0000,,
2673,fbb60f5191c42a99192c32b8cd36936c5285811b,arkus F.X.J. Oberhumer <markus@oberhumer.com>, 2006-02-03 16:40:02 +0000, , refactored new mem_replace function committer mfx mfx 1138984802 0000,,
2674,899e7d2f39a1bb28209c4f4241cb79a9ef4f5a68,arkus F.X.J. Oberhumer <markus@oberhumer.com>, 2006-02-03 09:46:50 +0000, , added internal debugging option fake stub version x.xx fake stub year xxxx might prove useful building test suite able check binary identity compressed executables upx release implementation specific format changed committer mfx mfx 1138960010 0000,,
2675,8e2aa0774748f5d0154f0b31ab7aa7902c1c80cb,ászló Molnár <ezerotven+github@gmail.com>, 2006-02-02 11:07:45 +0000, , load config support win32 dlls committer ml1050 ml1050 1138878465 0000,,
2676,a0d262cd769c09874d743477e9be02c2727e9f70,arkus F.X.J. Oberhumer <markus@oberhumer.com>, 2006-01-31 04:59:43 +0000, , new acc version committer mfx mfx 1138683583 0000,,
2677,b43a7edee461c319d654ad973a76790953cd5986,arkus F.X.J. Oberhumer <markus@oberhumer.com>, 2006-01-24 05:34:25 +0000, , preliminary bump version information committer mfx mfx 1138080865 0000,,
2678,7760bbd77cbab705322a9a979140d31f6aae94f0,arkus F.X.J. Oberhumer <markus@oberhumer.com>, 2006-01-24 05:26:25 +0000, , new acc version committer mfx mfx 1138080385 0000,,
2679,9c0f1b02a7c583c6211545178cd1b6451e054420,arkus F.X.J. Oberhumer <markus@oberhumer.com>, 2006-01-24 05:25:20 +0000, , small makefile update committer mfx mfx 1138080320 0000,,
2680,4ecfff4d8d8f19aa0b227ff9335ba73d807610e2,arkus F.X.J. Oberhumer <markus@oberhumer.com>, 2006-01-24 05:21:50 +0000, , print define _size enter 2006. add john name committer mfx mfx 1138080110 0000,,
2681,ac03b89f381df52e136d261af79ed487ed9dd2bb,ászló Molnár <ezerotven+github@gmail.com>, 2006-01-23 07:01:54 +0000, , doc update 1.94 committer ml1050 ml1050 1137999714 0000,,
2682,620174aea9e2672ab4adde9592bb1683bac8a8d2,ászló Molnár <ezerotven+github@gmail.com>, 2006-01-23 07:00:49 +0000, , copyright text added committer ml1050 ml1050 1137999649 0000,,
2683,ab50d28bc45713e54ae818d241ebee6e4555f5a1,arkus F.X.J. Oberhumer <markus@oberhumer.com>, 2005-12-18 17:19:05 +0000, , new acc version committer mfx mfx 1134926345 0000,,
2684,b5318602d1ca673c2511ea308e4ed317f7b41ffe,arkus F.X.J. Oberhumer <markus@oberhumer.com>, 2005-12-18 17:14:12 +0000, , fixed compilation problem committer mfx mfx 1134926052 0000,,
2685,bff2a63ea23f131a59f7a20d9276fada138c3cbd,ohn Reiser <jreiser@BitWagon.com>, 2005-11-18 05:02:00 +0000, , prefetching doe help length match l_lx_elf64amd.s amd_d_nrv2b.s amd_d_nrv2e.s committer jreiser jreiser 1132290120 0000,,
2686,aacfb8820e2b3dad69d982e722e4b0d43d8f8134,ászló Molnár <ezerotven+github@gmail.com>, 2005-11-15 17:59:37 +0000, , better load_conf directory support still need work committer ml1050 ml1050 1132077577 0000,,
2687,98e8c031d0946f786deee31b120b82c02d37721d,ohn Reiser <jreiser@BitWagon.com>, 2005-11-14 18:55:05 +0000, , generated header file fold_elf64amd.h l_lx_elf64amd.h committer jreiser jreiser 1131994505 0000,,
2688,beb4319d1e9e7d61112b690aff976f2ee37aa43f,ohn Reiser <jreiser@BitWagon.com>, 2005-11-14 18:54:31 +0000, , tune better branch prediction avoiding byte block amd_d_nrv2b.s amd_d_nrv2e.s l_lx_elf64amd.s committer jreiser jreiser 1131994471 0000,,
2689,2558243c83258407088ce1f49a3e43493867b872,ohn Reiser <jreiser@BitWagon.com>, 2005-11-14 04:46:30 +0000, , tabify also speculate byte load save cycle two amd_d_nrv2b.s amd_d_nrv2e.s l_lx_elf64amd.s committer jreiser jreiser 1131943590 0000,,
2690,b670e8d1acf564526277f74d0bd4b0a41d5ba925,ohn Reiser <jreiser@BitWagon.com>, 2005-11-14 03:34:03 +0000, , tuning amd_bxx.s amd_d_nrv2b.s amd_d_nrv2e.s l_lx_elf64amd.s committer jreiser jreiser 1131939243 0000,,
2691,68f8358f0648d8d408ead192fef3da6b3ec237ab,ohn Reiser <jreiser@BitWagon.com>, 2005-11-13 23:17:03 +0000, , tune avoid movsb literal inline default case nextb macro committer jreiser jreiser 1131923823 0000,,
2692,db5a099097616f462dfb10acff33292f4c0b39d3,ohn Reiser <jreiser@BitWagon.com>, 2005-11-13 03:54:12 +0000, , cld documentation amd_d_nrv2e.s l_lx_elf64amd.s fold_elf64amd.s committer jreiser jreiser 1131854052 0000,,
2693,ce33ffb62ae8c491a770b40b78ec2413c3dacbab,ohn Reiser <jreiser@BitWagon.com>, 2005-11-12 22:11:48 +0000, , handle compressed executables larger 3mb elf64amd committer jreiser jreiser 1131833508 0000,,
2694,59a2fb9cfdaada76f22789d7f7edaa3e5b1a7af9,ohn Reiser <jreiser@BitWagon.com>, 2005-11-12 19:44:59 +0000, , recompile generated source change fold_elf64amd.h l_lx_elf64amd.h committer jreiser jreiser 1131824699 0000,,
2695,75bba319dead709923b13ecc2d4e4d7091ada77e,ohn Reiser <jreiser@BitWagon.com>, 2005-11-12 19:44:15 +0000, , tuning prepare large executables 3mb compressed p_lx_elf.cpp stub a_lx_elf64.c stub amd_d_nrv2e.s stub fold_elf64amd.s stub l_lx_elf64amd.s committer jreiser jreiser 1131824655 0000,,
2696,f78e9261f3c859b80a22330d2f2eada5bb7446c3,ohn Reiser <jreiser@BitWagon.com>, 2005-11-10 04:45:22 +0000, , initloader properly instead relying amount stack space use called committer jreiser jreiser 1131597922 0000,,
2697,5f77562333d50d8e31f4f82f21854d3395d4a2fc,arkus F.X.J. Oberhumer <markus@oberhumer.com>, 2005-11-10 04:29:51 +0000, , cleanup committer mfx mfx 1131596991 0000,,
2698,5c4f01a68db507affa9b6e22bd168cb0b381c8d3,arkus F.X.J. Oberhumer <markus@oberhumer.com>, 2005-11-10 04:29:26 +0000, , new acc version committer mfx mfx 1131596966 0000,,
2699,35f6f998e6bf6ad8ad4a51a9b86bf9020991ea0a,arkus F.X.J. Oberhumer <markus@oberhumer.com>, 2005-11-10 03:36:55 +0000, , avoid warning detabified committer mfx mfx 1131593815 0000,,
2700,6737a3ae0911c35976529a711204e318163a9606,ohn Reiser <jreiser@BitWagon.com>, 2005-11-09 21:12:58 +0000, ,  p_lx_elf.h p_lx_elf.cpp packmast.cpp committer jreiser jreiser 1131570778 0000,,
2701,09559bee8c8defff13935f6a8a5ebac20c4cc7f3,ohn Reiser <jreiser@BitWagon.com>, 2005-11-09 21:08:50 +0000, , elf64 p_unix.h p_elf.h committer jreiser jreiser 1131570530 0000,,
2702,f487ea27a82fcc14ef18b9b9cdf4776d3dc468c2,ohn Reiser <jreiser@BitWagon.com>, 2005-11-09 20:32:13 +0000, ,  committer jreiser jreiser 1131568333 0000,,
2703,a3d95f239a8ee8631c3ef50ddf0488be7bb03d81,ohn Reiser <jreiser@BitWagon.com>, 2005-11-09 20:08:32 +0000, , generated header file amd x86_64 fold_elf64amd.h l_lx_elf64amd.h committer jreiser jreiser 1131566912 0000,,
2704,023c06e178e6d0763447b2bcf28e84f1bebc79d3,ohn Reiser <jreiser@BitWagon.com>, 2005-11-09 20:07:15 +0000, , support bit amd x86_64 makefile added file a_lx_elf64.c amd_bxx.s amd_d_nrv2e.s amd_regs.h fold_elf64amd.s l_lx_elf64amd.s committer jreiser jreiser 1131566835 0000,,
2705,414a6c1c9e671409106aab53e11889d46541e357,ohn Reiser <jreiser@BitWagon.com>, 2005-11-09 19:56:32 +0000, , enhance handle elf32 elf64 little big endian http cgi bin viewcvs.cgi trunk buildroot toolchain sstrip sstrip.c revision 11028 added tue aug 2005 pdt month week ago mjn3 committer jreiser jreiser 1131566192 0000,,
2706,910e18fb222068ae700cfea8bd89a72aeb0cc8df,ohn Reiser <jreiser@BitWagon.com>, 2005-11-09 19:37:40 +0000, , b_method 5th argument f_decompress l_lx_exec.c l_lx_pti.c l_lx_sep.c l_lx_sh.c committer jreiser jreiser 1131565060 0000,,
2707,ac441fd1cfa26c78047aa189ddb3bf04bbab3f34,ohn Reiser <jreiser@BitWagon.com>, 2005-11-09 19:32:12 +0000, , definition elf64_ committer jreiser jreiser 1131564732 0000,,
2708,0c328372b586206600f44ba8c948de977b156095,ohn Reiser <jreiser@BitWagon.com>, 2005-09-21 02:17:26 +0000, , allow __uclibc_main like committer jreiser jreiser 1127269046 0000,,
2709,55ef60a6d41b53cccbc7192986568eb634142e4c,arkus F.X.J. Oberhumer <markus@oberhumer.com>, 2005-09-20 03:48:21 +0000, , rebuilt gcc 3.4.4 committer mfx mfx 1127188101 0000,,
2710,c33584e683710128f77ca6e08018d4da8bf52f82,arkus F.X.J. Oberhumer <markus@oberhumer.com>, 2005-09-17 03:55:15 +0000, , detabified committer mfx mfx 1126929315 0000,,
2711,ee8c7453bdbbf766dd6623aa7475853630749ec9,arkus F.X.J. Oberhumer <markus@oberhumer.com>, 2005-09-17 03:21:23 +0000, , small update committer mfx mfx 1126927283 0000,,
