id,sha,author,date,issue,message,file,content
0,66fe8a624d1a4945173955b9edd626664708b383,ohn Reiser <jreiser@BitWagon.com>, 2021-05-16 10:14:03 -0700,441, sync stub http github.com upx upx issue 441 modified .github,,
1,a8f7e768dc78410031b79258ba4ab9789748412c,ohn Reiser <jreiser@BitWagon.com>, 2021-05-16 09:55:45 -0700, , merge branch devel http github.com upx upx devel,,
2,2a0ca3c9973afae386a834471138deb4b1b5a795,ohn Reiser <jreiser@BitWagon.com>, 2021-05-16 09:53:03 -0700,441, arm64 clear_cache end compress http github.com upx upx issue 441 modified stub src arch arm64 macros.s modified stub src arch arm64 lzma_d.s modified stub src arch arm64 nrv2b_d32.s modified stub src arch arm64 nrv2d_d32.s modified stub src arch arm64 nrv2e_d32.s modified stub arm64 darwin.macho entry.h modified stub arm64 linux.elf entry.h modified stub arm64 linux.shlib init.h modified stub tmp arm64 darwin.macho entry.bin.dump modified stub tmp arm64 linux.elf entry.bin.dump modified stub tmp arm64 linux.shlib init.bin.dump,,
3,f1e79fa6e479c8b0d7dd9f17df7770bcdfb4bfd4,arkus F.X.J. Oberhumer <markus@oberhumer.com>, 2021-05-15 07:24:16 +0200, , update,,
4,8c15723bbfecfb5678e65b4ae16173431b9ed424,arkus F.X.J. Oberhumer <markus@oberhumer.com>, 2021-05-15 06:03:48 +0200, , update submodules,,
5,bada64e46736d0907b9b92eb70ddeccd492b5164,ohn Reiser <jreiser@BitWagon.com>, 2021-05-08 12:30:08 -0700, , merge branch devel http github.com upx upx devel,,
6,650f083fec61ad73df23fc95ef0e636a729fa860,ohn Reiser <jreiser@BitWagon.com>, 2021-05-08 12:29:56 -0700,497, merge pull request 497 bitraid disable cfg disable cfg compress force http github.com upx upx pull 497,,
7,e9ce7722d046957abc3dded66ba446a9dd2cc81c,ohn Reiser <jreiser@BitWagon.com>, 2021-05-08 12:28:28 -0700,493, merge pull request 493 bitraid improve strip relocs improve strip relocs http github.com upx upx pull 493,,
8,9416df20bc4dfef692bd46f0a6d8fefedf25fc07,ohn Reiser <jreiser@BitWagon.com>, 2021-05-08 11:14:31 -0700, , wip un_shlib_1 modified p_lx_elf.cpp modified p_lx_elf.h,,
9,81ad09a66ec47353d617c2c213696c0841ccb78d,ohn Reiser <jreiser@BitWagon.com>, 2021-05-07 11:15:41 -0700,473, generated stub file http github.com upx upx issue 473 modified stub mips.r3000 linux.shlib init.h modified stub mipsel.r3000 linux.shlib init.h modified stub tmp mips.r3000 linux.shlib init.bin.dump modified stub tmp mipsel.r3000 linux.shlib init.bin.dump,,
10,04c619859541f338cb5a459c88c16fb882bf7944,ohn Reiser <jreiser@BitWagon.com>, 2021-05-07 09:36:07 -0700,473, proc self auxv at_pagesz musl call _init args http github.com upx upx issue 473 modified mipsel.r3000 linux.shlib init.s,,
11,65ab317d6f15d6761415ab9267808c0e87c1631c,itraid <bitraid@protonmail.ch>, 2021-05-01 18:05:27 +0300, , disable cfg compress force,,
12,a9cda91cb52337c2182efe0bd18fc5aa0202d995,itraid <bitraid@protonmail.ch>, 2021-04-25 20:15:07 +0300, , improve strip relocs remove .reloc section enable bit image abort explicitly set unsupported image use force remove aslr apply imagebase default,,
13,6f51bb15663efc9cad599ca31157ab1b97cc53cd,ohn Reiser <jreiser@BitWagon.com>, 2021-04-22 15:41:04 -0700, , merge branch devel http github.com upx upx devel,,
14,2dae2a39972bc7c562dd3b02444336050a0b242e,ohn Reiser <jreiser@BitWagon.com>, 2021-04-22 15:40:50 -0700,491, merge pull request 491 bitraid fix rebuild relocs fix unoptimizereloc process relocs http github.com upx upx pull 491 modified packer.cpp,,
15,84044ee8326f854c2ff2e3fac070bb93564afd51,itraid <bitraid@protonmail.ch>, 2021-04-21 23:06:55 +0300, , fix unoptimizereloc process relocs,,
16,6f06089dda5ae98cb5eb6dfb9f33f5d6eb30c817,ohn Reiser <jreiser@BitWagon.com>, 2021-04-12 06:01:43 -0700, , merge branch devel http github.com upx upx devel,,
17,8d42b12117130b944023335cc2b76072c145db4d,ohn Reiser <jreiser@BitWagon.com>, 2021-04-12 05:56:03 -0700,354, merge pull request 490 bitraid msvc expand wildcard build enable wildcard argument expansion msvc http github.com upx upx issue 354,,
18,24b169144c12ef0bc7b2e7bd704e1f91db6c3bdf,itraid <bitraid@protonmail.ch>, 2021-04-12 11:20:13 +0300, , build enable wildcard argument expansion msvc,,
19,0cfb96981998e09cd205221b33d5805ffecae036,ohn Reiser <jreiser@BitWagon.com>, 2021-04-11 15:19:24 -0700, , page_size varies apple 16k modified p_mach.cpp modified p_mach.h modified p_mach_enum.h,,
20,790029ffd0e8507fd98558e7a62d88a430a3da7f,ohn Reiser <jreiser@BitWagon.com>, 2021-04-11 15:16:34 -0700, , shlib compress xct_off except elf header modified p_lx_elf.cpp,,
21,44c6eb42b07e0cfda6a866c592e871bfd703eb56,ohn Reiser <jreiser@BitWagon.com>, 2021-04-11 15:09:55 -0700, , fix sht_nobits occupies space modified p_lx_elf.cpp,,
22,90279abdfcd235172eab99651043051188938dcc,ohn Reiser <jreiser@BitWagon.com>, 2021-04-10 10:11:48 -0700,485, packlinuxelf canunpack must checkehdr elf input http github.com upx upx issue 485 modified p_lx_elf.cpp,,
23,28e761cd42211dfe0124b7a29b2f74730f453e46,ohn Reiser <jreiser@BitWagon.com>, 2021-04-10 08:57:14 -0700,487, merge pull request 487 chibataiki devel complain http github.com upx upx pull 487,,
24,04c229340c7c3de16220a336c55892b5be3601eb,ohn Reiser <jreiser@BitWagon.com>, 2021-04-10 08:51:27 -0700, , sync testsuite checksum fix sizeofheaders http github.com upx upx pull 483 modified .github,,
25,a94c7b32e483ca6daca1f63d63a3c587655b2675,oushibee <goushibee@qq.com>, 2021-04-07 15:40:13 +0800, , fix issue 486,,
26,2638bee3c0f717e86d902e167873a973eccd7d15,ohn Reiser <jreiser@BitWagon.com>, 2021-04-06 13:19:49 -0700,482, merge pull request 482 ciscom31 default target add default goal makefile,,
27,20a9e89f338738b5f3fd8b17634d19290a74b0de,ohn Reiser <jreiser@BitWagon.com>, 2021-04-06 13:19:23 -0700,483, merge pull request 483 bitraid fix sectionheaders size fix sizeofheaders value,,
28,83e3458413206c8ec71d205f29764ec0a2917c2a,itraid <bitraid@protonmail.ch>, 2021-04-06 22:49:31 +0300, , fix sizeofheaders value,,
29,59a6617873c81bd5eed0dc5f36aca6a8457f4efb,ebastien Rosset (serosset) <serosset@cisco.com>, 2021-04-03 13:08:01 -0700, , add default goal,,
30,9c9fa84880eb67ae4b59aab0efd4376adbd6a302,ohn Reiser <jreiser@BitWagon.com>, 2021-04-03 12:59:07 -0700, , merge branch devel http github.com upx upx devel,,
31,79558173649ce03074780a83f242be973374e616,ohn Reiser <jreiser@BitWagon.com>, 2021-04-03 12:58:48 -0700,481, merge pull request 481 ciscom31 build instruction small fix build instruction gcc 6.1 make,,
32,1f2e0d3e2a41d86b2f67ab3146d70a375bba04e6,ohn Reiser <jreiser@BitWagon.com>, 2021-04-03 12:46:20 -0700, , enable usual grep function definition developer convenience space function name left paren modified compress.cpp,,
33,4fd1ff3902751c70ed02496d4a090a03761f5334,ebastien Rosset (serosset) <serosset@cisco.com>, 2021-04-03 11:57:05 -0700, , build instruction,,
34,6b80e09b2df1df124aa346056aceec9d018224ff,ohn Reiser <jreiser@BitWagon.com>, 2021-04-02 19:37:29 -0700, , sync testsuite checksum fix sizeofheaders http github.com upx upx pull 477 modified .github,,
35,d4d0d29b8c70fcf1151196a06324d7bb0d02f6c4,arkus F.X.J. Oberhumer <markus@oberhumer.com>, 2021-03-28 22:06:42 +0200, , testsuite change exit code fatal decompression checksum mismatch,,
36,eb61135d1131b2fef40c98f2935edc9d5e69745b,arkus F.X.J. Oberhumer <markus@oberhumer.com>, 2021-03-28 21:49:32 +0200, , testsuite change exit code checksum mismatch,,
37,057c23e933d6f554055b2fa6bf362e5b14f10d41,arkus F.X.J. Oberhumer <markus@oberhumer.com>, 2021-03-28 21:40:13 +0200, , revert change previous commit pacify clang winconsistent missing override warning,,
38,f3b6f0848295221cf1bda2247ee74b0f3f1b7d2f,arkus F.X.J. Oberhumer <markus@oberhumer.com>, 2021-03-28 21:19:29 +0200, , cleanup start working wsuggest override add final nfci,,
39,3e0cb3f7f56bb3230a346d66a8fd7dcd67c692c5,ohn Reiser <jreiser@BitWagon.com>, 2021-03-27 09:42:53 -0700,477, merge pull request 477 bitraid fix headersize fix sizeofheaders value optional header field,,
40,00950f1b210d61428cc703da9de195aad6830a08,itraid <bitraid@protonmail.ch>, 2021-03-25 21:41:49 +0200, , fix sizeofheaders value optional header field,,
41,275e5a18600d29e12288183ad3e6075c5bc3a64f,ohn Reiser <jreiser@BitWagon.com>, 2021-03-25 07:22:01 -0700,476, allow nbucket dt_hash dt_gnu_hash static linked rust program symbol http github.com upx upx issue 476,,
42,1823daa43b7eae18bdcd2a9934d9b1f626e817d0,ohn Reiser <jreiser@BitWagon.com>, 2021-03-25 07:10:40 -0700,473, fix headway argument http github.com upx upx issue 473 modified p_lx_elf.cpp,,
43,c4e00265a026cd415b66f439c5c0cc5dc70b39e2,ohn Reiser <jreiser@BitWagon.com>, 2021-03-23 18:21:45 -0700,473, get_te32 checking dt_gnu_hash chain mips .so http github.com upx upx issue 473 modified p_lx_elf.cpp,,
44,be68e83c6124fd20177f64c3f4a57da33bfd18a6,ohn Reiser <jreiser@BitWagon.com>, 2021-03-23 06:45:01 -0700,473, get_te32 checking dt_hash chain mips .so http github.com upx upx issue 473 modified p_lx_elf.cpp,,
45,5abedf40c9a2ac05e366159311f04645ca83fae5,ohn Reiser <jreiser@BitWagon.com>, 2021-03-16 18:46:11 -0700,471, check http github.com upx upx issue 471 modified p_lx_elf.cpp,,
46,4893d995f2985a0348ab757b4c9fbabc90bbcdb9,ohn Reiser <jreiser@BitWagon.com>, 2021-03-14 15:20:15 -0700,231, reject header overlap overlap leanify etc cause headache http github.com upx upx issue 231 modified p_w32pe.cpp modified p_w64pep.cpp modified pefile.cpp,,
47,39a15511fa895ad93c4cad5060644026e73d5da1,ohn Reiser <jreiser@BitWagon.com>, 2021-03-13 11:24:11 -0800,470, merge pull request 470 jsm174 artifact make artifact build,,
48,d25575f041cb987a675355a174238e91639e7f49,sm174 <jsm174@gmail.com>, 2021-03-09 09:36:08 -0500, , make artifact build,,
49,048b144edd7d2ad79390a6384f81ac4914179705,ohn Reiser <jreiser@BitWagon.com>, 2021-03-07 09:33:16 -0800, , turn enable build amd64 win64 gcc pas modified makefile,,
50,014f0b32120f16b13f6c95861112025de8115aed,ohn Reiser <jreiser@BitWagon.com>, 2021-03-06 15:31:56 -0800, , fix error detected make run testsuite total_out doe matter option writes output file subtle error generateelfhdr noted address sanitizer new member function is_load32 avoid confusion lo_proc modified p_lx_elf.cpp modified p_lx_elf.h,,
51,6d3ec0edc5a7a43427baa9c6f50165efb26c15d5,ohn Reiser <jreiser@BitWagon.com>, 2021-03-06 12:05:23 -0800, , change back lzma sdk modified lzma sdk,,
52,864fe894c0e0e0de90de082ca22a0c58e1661695,ohn Reiser <jreiser@BitWagon.com>, 2021-03-06 10:46:40 -0800, , change lzma sdk latest commit master,,
53,bbefbd7ed7126b6437d2485e5f4cd194cd5e74a5,ohn Reiser <jreiser@BitWagon.com>, 2021-03-06 10:01:59 -0800,462, merge branch jreiser jan15b devel mostly amd64 unpacking shared library http github.com upx upx issue 433 http github.com upx upx issue 462,,
54,ae893eaf71c84344e1ed1603fc2d485b71757464,ohn Reiser <jreiser@BitWagon.com>, 2021-03-06 09:59:51 -0800, , packmachfat canpack handle case packmachfat cpu_type_arm64 modified p_mach.cpp,,
55,57b49a5f4a85094a0e141ce977211e7a68e5e5d4,ohn Reiser <jreiser@BitWagon.com>, 2021-03-05 16:33:25 -0800, , remove nit packlinuxelf64 generateelfhdr address sanitizer modified p_lx_elf.cpp,,
56,c3dc33173596d34e7d1ebaab1ef2b9b6f8ef0be3,ohn Reiser <jreiser@BitWagon.com>, 2021-03-05 16:20:36 -0800, , wip packlinuxelf64 unpack working shared library non android modified p_lx_elf.cpp modified p_lx_elf.h modified p_unix.cpp,,
57,0bcd77b4c327b89eab9db4d4660e4ef437537c1b,ohn Reiser <jreiser@BitWagon.com>, 2021-02-28 17:12:20 -0800, , wip hacking un_shlib_1 modified p_lx_elf.cpp,,
58,343605a3bcf0eed68ffd1dc5b27c572d77525ab2,ohn Reiser <jreiser@BitWagon.com>, 2021-02-27 19:27:12 -0800, , wip un_shlib_1 modified p_lx_elf.cpp modified p_lx_elf.h,,
59,ef9809c4885315a220a89aa9124c9bad555204db,ohn Reiser <jreiser@BitWagon.com>, 2021-02-26 15:15:28 -0800,463, another http github.com upx upx issue 463 modified makefile modified p_mach.cpp,,
60,6dceecdd13a6188d788bdef5c52bd74b50b4d792,ohn Reiser <jreiser@BitWagon.com>, 2021-02-25 20:04:16 -0800,463, worst case http github.com upx upx issue 463 modified makefile modified mem.cpp,,
61,734f7cf19cc6630f9bf92ecb2d0f9c8f717a5ebc,ohn Reiser <jreiser@BitWagon.com>, 2021-02-23 02:24:24 -0800, , fewer byte code modified arm64 linux.elf fold.h modified tmp arm64 linux.elf fold.map,,
62,47c3544170777acb8683568be18f89e69b09ba40,ohn Reiser <jreiser@BitWagon.com>, 2021-02-22 16:15:03 -0800, , split packlinuxelf64 unpack main program shared library modified p_lx_elf.cpp,,
63,76d78f347d64654987e45a66e621702e3d4122e9,ohn Reiser <jreiser@BitWagon.com>, 2021-02-22 16:13:40 -0800, , total_in total_out move packunix modified p_lx_elf.cpp modified p_lx_elf.h modified p_lx_interp.cpp modified p_mach.cpp modified p_unix.cpp modified p_unix.h,,
64,092be6b898e65c311443fd46a82d915bd8f89a73,ohn Reiser <jreiser@BitWagon.com>, 2021-02-15 11:40:04 -0800, , remove unrelated debugging modified stub src arm64 linux.elf fold.s,,
65,51f69a20e0287904398bbf4c72ba2f809a0b0850,ohn Reiser <jreiser@BitWagon.com>, 2021-02-14 13:23:19 -0800,434, macos bigsur want mh_dyldlink mh_execute http github.com upx upx issue 434 modified p_mach.cpp,,
66,319b97711e74ad62f5ce6d49ba6ce0d1c6b3c3da,arkus F.X.J. Oberhumer <markus@oberhumer.com>, 2021-02-01 13:06:49 +0100, , fix current ubuntu problem,,
67,86f3af4f84d7f6ceeeb46560faf566d6646add51,ohn Reiser <jreiser@BitWagon.com>, 2021-01-30 16:11:32 -0800,446, padded mod http github.com upx upx issue 446 partial modified p_mach.cpp modified p_mach.h modified p_mach_enum.h,,
68,00113aad3ee2c2508e14286c25e828212ada49f5,ohn Reiser <jreiser@BitWagon.com>, 2021-01-30 16:11:32 -0800,446, padded mod http github.com upx upx issue 446 partial modified p_mach.cpp modified p_mach.h modified p_mach_enum.h,,
69,a0b64dfa1765abf1db9cbbf76552792defe041a8,ohn Reiser <jreiser@BitWagon.com>, 2021-01-24 16:59:48 -0800, , merge branch devel jreiser jan15b conflict src p_mach.cpp src packer.cpp src packer.h,,
70,731a494ffbaa7fe78a87aa8a8facb0dcfdab8f9d,ohn Reiser <jreiser@BitWagon.com>, 2021-01-23 15:37:52 -0800,455, robust packwcle decodefixups http github.com upx upx issue 455 modified p_wcle.cpp,,
71,f65e63cb086af709fab439d0c013ab4a681e3ce7,ohn Reiser <jreiser@BitWagon.com>, 2021-01-23 13:52:54 -0800,447, better checking .sizeofcmds improves earlier fix http github.com upx upx issue 447 modified p_mach.cpp,,
72,0465f8f302437b4ba9320c3744bb75a999e51e95,ohn Reiser <jreiser@BitWagon.com>, 2021-01-20 05:54:53 -0800, , clarify comment previous commit modified main.cpp,,
73,20161bc2d9eeaba3fded2e64f2f7d7f1439a8acd,ohn Reiser <jreiser@BitWagon.com>, 2021-01-19 19:20:23 -0800,456, merge pull request 456 liamjm reset counter upx_main,,
74,ec75e7ec4d5e0ef3b3b54958ad8e2a029ab7c0fd,iam Murphy <liamjm@google.com>, 2021-01-20 02:29:08 +0000, , add comment explaining code per review,,
75,06f02d4ec76a89f2424a1751b0336cdeb756a945,ohn Reiser <jreiser@BitWagon.com>, 2021-01-17 19:36:36 -0800, , ptrdiff_t hex printf modified p_wcle.cpp,,
76,501077a9bbaaf6ba6d6c5ba49bfe1f60b1efa68a,ohn Reiser <jreiser@BitWagon.com>, 2021-01-17 19:21:32 -0800,455, try run end selfrel_fixups http github.com upx upx issue 455 modified p_wcle.cpp modified packer.cpp,,
77,c55b57088daa4a95185b4b7355dac79a0f2cd65e,ohn Reiser <jreiser@BitWagon.com>, 2021-01-17 17:09:35 -0800,448, detect http github.com upx upx issue 448 modified p_mach.cpp,,
78,48b25a10b8f57b014a71918512cb0ef48a41418a,iam Murphy <liamjm@google.com>, 2021-01-18 00:16:49 +0000, , reset counter upx_main,,
79,6af60cf76eadd67e80e851d7857d6ec1ea33a025,ohn Reiser <jreiser@BitWagon.com>, 2021-01-16 11:08:24 -0800,451, merge pull request 451 kant patch typo fixed line,,
80,3d14416892d137523e7659e3adfedbe67c0e1960,ohn Reiser <jreiser@BitWagon.com>, 2021-01-15 15:03:26 -0800,447, compress allows old style lc_unixthread one lc_segment http github.com upx upx issue 447 modified p_mach.cpp,,
81,b59fc942c1b09810b19062040f5c917c57cec0fa,ohn Reiser <jreiser@BitWagon.com>, 2021-01-15 14:11:09 -0800, , wip unpacking elf shared library modified makefile modified lzma sdk modified p_lx_elf.cpp modified p_lx_elf.h modified p_mach.cpp modified p_unix.cpp modified p_unix.h modified packer.cpp modified packer.h modified stub arm64 linux.elf fold.h modified stub src arm64 linux.elf fold.s modified stub tmp arm64 linux.elf fold.map,,
82,62f4faf4e8c556d44e13ddbeae745c367c953232,arío Hereñú <magallania@gmail.com>, 2021-01-09 14:04:47 -0300, , typo fixed line,,
83,147fd85589953754f4b01860aee0d346216d02f0,arkus F.X.J. Oberhumer <markus@oberhumer.com>, 2021-01-05 22:03:29 +0100, , modernize libc usage cleanup,,
84,d62239a3e8316b8e89529affda650a89c309e9c7,arkus F.X.J. Oberhumer <markus@oberhumer.com>, 2021-01-05 18:52:05 +0100, , modernize libc usage stop using off_t use modern printf old version msvc msvcrt haunted long enough,,
85,d3eae136f2f3d59371dbd4fd689ff31dfa42ac67,arkus F.X.J. Oberhumer <markus@oberhumer.com>, 2021-01-04 22:03:23 +0100, , add sanitizer build,,
86,b449aa833405f5032521f97a465a540bad986873,arkus F.X.J. Oberhumer <markus@oberhumer.com>, 2021-01-04 21:13:49 +0100, , use correct native type alignas,,
87,f7f18bb0f95ef117bf0ff7e3c9feef98839ce9cc,arkus F.X.J. Oberhumer <markus@oberhumer.com>, 2021-01-04 21:02:07 +0100, , use alignas init struct field good practice,,
88,98e7da8b2b437b0a7d54e3c28aba3ecc81a472e8,arkus F.X.J. Oberhumer <markus@oberhumer.com>, 2021-01-04 20:26:31 +0100, , clang format file gofmt style nobody favourite gofmt everybody favourite rob pike,,
89,6a5684fed6e7fe5ed196254e0b847e978e3f92ab,arkus F.X.J. Oberhumer <markus@oberhumer.com>, 2021-01-04 19:07:17 +0100, , add use .clang format file,,
90,6343cfdc545031cb002f3da8c0780f2248826abb,arkus F.X.J. Oberhumer <markus@oberhumer.com>, 2021-01-04 17:27:48 +0100, , clang format 10.0.1 file,,
91,de6a9f4a325c9714fe228fd1c4ee887da291206c,arkus F.X.J. Oberhumer <markus@oberhumer.com>, 2021-01-04 17:23:57 +0100, , using upx stubtools 20210104 new clang format 10.0.1,,
92,ed2e394477850ab7b076b92bed741eac50630013,arkus F.X.J. Oberhumer <markus@oberhumer.com>, 2021-01-04 17:20:57 +0100, , various cosmetic update refactors nfci,,
93,1bfb84fd146a3e57dbcd6044491c9cb49d11c4e4,arkus F.X.J. Oberhumer <markus@oberhumer.com>, 2021-01-04 17:20:06 +0100, , makefile update default sanitizer flag,,
94,f084340ce4029b3821ab0ba67477eafe9f506edf,arkus F.X.J. Oberhumer <markus@oberhumer.com>, 2021-01-02 16:45:58 +0100, , update bele.h better work modern compiler,,
95,680ed51a709f8e885853b088cf8bef6d98326384,arkus F.X.J. Oberhumer <markus@oberhumer.com>, 2021-01-02 01:03:24 +0100, , add mingw64 build,,
96,8a411e8f71667b37c1b8577089efc20dc9c173cf,arkus F.X.J. Oberhumer <markus@oberhumer.com>, 2021-01-01 23:24:31 +0100, , update use lastest zlib update makefile,,
97,36670251fdbbf72f6ce165148875d369cae8f415,arkus F.X.J. Oberhumer <markus@oberhumer.com>, 2021-01-01 20:52:07 +0100, , update testsuite checksum caused version bump,,
98,c422f7968d32da710083b560ef6c1ea11b80c56e,arkus F.X.J. Oberhumer <markus@oberhumer.com>, 2021-01-01 20:45:11 +0100, , bump version date,,
99,96669e0bfa2adbcc6db8958e8ab29d191816c027,arkus F.X.J. Oberhumer <markus@oberhumer.com>, 2021-01-01 20:43:34 +0100, , remove obsolete project file,,
100,e1f8d16bc205276604cce48deafd310ccaa259a4,arkus F.X.J. Oberhumer <markus@oberhumer.com>, 2021-01-01 20:39:22 +0100, , welcome 2021,,
101,da4f9fd609e5859a6a64b8dac4cfc086d75034f1,arkus F.X.J. Oberhumer <markus@oberhumer.com>, 2020-12-15 02:15:34 +0100, , fix makefile breakage previous commit,,
102,36f2ff2fa0c2483f7fd86deb16f20cb33eb4af92,arkus F.X.J. Oberhumer <markus@oberhumer.com>, 2020-12-14 22:10:07 +0100, , extract upx_main compilation dwith_gui,,
103,d60c46371dc011808c253ca664539835fb0a9e02,arkus F.X.J. Oberhumer <markus@oberhumer.com>, 2020-12-14 20:53:54 +0100, , update makefile compiler check user inadvertently change mandatory compiler flag,,
104,3781df9da23840e596d5e9e8493f22666802fe6c,ohn Reiser <jreiser@BitWagon.com>, 2020-12-11 13:38:18 -0800,421, check dt_rel dt_rela dt_relsz dt_relasz http github.com upx upx issue 421 modified p_lx_elf.cpp,,
105,a46fd4f04087c9cabce73b4200b0bccdbf8a7ee5,ohn Reiser <jreiser@BitWagon.com>, 2020-12-11 12:34:38 -0800, , include lzma compression tuning option help modified help.cpp,,
106,648fa30f22ae195f591210d7d2fa264e69b233ae,ohn Reiser <jreiser@BitWagon.com>, 2020-12-11 11:38:38 -0800, , std modified makefile,,
107,e4d6eafb9ef708d8f613ddf622d7194f1d1f3d04,ohn Reiser <jreiser@BitWagon.com>, 2020-12-10 19:56:02 -0800, , tweak unoptimizereloc modified packer.cpp,,
108,bb7b3f027447cfdab33a1adb8ddbcf758392034a,ohn Reiser <jreiser@BitWagon.com>, 2020-12-10 19:35:05 -0800, , merge branch devel http github.com upx upx devel,,
109,8bc1f5bef9fdad6298e88c1df09564a93a0f69a3,ohn Reiser <jreiser@BitWagon.com>, 2020-12-10 19:31:56 -0800,438, fix overlap detection unoptimizereloc http github.com upx upx issue 438 modified packer.cpp,,
110,7ca75bf189b5761f881e46bf32dc1b79ef8bdb9b,arkus F.X.J. Oberhumer <markus@oberhumer.com>, 2020-12-08 07:13:11 +0100, , revert useless fast exit check b2c00aa637af,,
111,294f5cd29ea2f2a4a02f071365b616c77acc30b9,arkus F.X.J. Oberhumer <markus@oberhumer.com>, 2020-12-08 06:22:10 +0100, , update,,
112,4ccab00627b45ffb03a3b33885d4cc74dc0cd1c2,arkus F.X.J. Oberhumer <markus@oberhumer.com>, 2020-12-08 05:40:17 +0100, , start using feature,,
113,badc8928482291217c5075aa579b60a328d909c6,arkus F.X.J. Oberhumer <markus@oberhumer.com>, 2020-12-08 05:40:07 +0100, , update submodules,,
114,c37eef480d0dd9c914843332a1949c5acbc013fc,arkus F.X.J. Oberhumer <markus@oberhumer.com>, 2020-12-08 00:45:41 +0100, , start using noexcept,,
115,952000776a23ee0bc046ac2a1c5df0fa26188c03,arkus F.X.J. Oberhumer <markus@oberhumer.com>, 2020-12-07 23:05:13 +0100, , require 14. finally default gcc clang msvc 2019,,
116,08a37c91715a9a1e60d6be0cd7cbfd5c6549b005,arkus F.X.J. Oberhumer <markus@oberhumer.com>, 2020-12-07 23:04:37 +0100, , src makefile add wsign compare warning flag better match msvc,,
117,98846b3cbb84b1e381985e50c0611eee9c32cd37,arkus F.X.J. Oberhumer <markus@oberhumer.com>, 2020-12-07 23:04:01 +0100, , remove appveyor,,
118,830b2421df62e3699172c8b83b7148e276b934e9,ohn Reiser <jreiser@BitWagon.com>, 2020-12-06 15:22:58 -0800, , avoid complaint gcc wsign conversion modified modified,,
119,e73404e53c1756682bb72929b828acb7b4059782,ohn Reiser <jreiser@BitWagon.com>, 2020-12-05 15:02:48 -0800, , merge branch devel http github.com upx upx devel,,
120,653e7851d4318e5989dc3e50d66ba0cf82a47d91,ohn Reiser <jreiser@BitWagon.com>, 2020-12-05 15:02:26 -0800,432, merge pull request 432 liamjm migrate membuffer remove mem leak,,
121,db3c86d8080bed0016621b9ad45587b2dcf987bb,ohn Reiser <jreiser@BitWagon.com>, 2020-12-05 13:53:14 -0800, , use mb_ prefix instance membuffer modified pefile.cpp modified pefile.h,,
122,5ca0abe57b9ff53f8182a8a97953d2c409d8013b,ohn Reiser <jreiser@BitWagon.com>, 2020-12-05 13:44:19 -0800,428, prefer membuffer instead new delete http github.com upx upx issue 428 modified pefile.cpp modified pefile.h,,
123,cb9ee887c15332c6e8449bd16ae09b51fff19699,ohn Reiser <jreiser@BitWagon.com>, 2020-12-05 10:33:26 -0800, , merge branch devel http github.com upx upx devel,,
124,d9a247d0cf514d673db4beee915cd8165b1386a8,ohn Reiser <jreiser@BitWagon.com>, 2020-12-05 10:31:55 -0800,428, prefer membuffer instead new delete http github.com upx upx issue 428 modified p_lx_elf.cpp modified p_lx_elf.h,,
125,ad20c18c35e46338544083212ecb01c9cee2a0d8,arkus F.X.J. Oberhumer <markus@oberhumer.com>, 2020-12-05 14:04:46 +0100, , update,,
126,7978b8066f611b949769b7dc103dfd4ed398de27,arkus F.X.J. Oberhumer <markus@oberhumer.com>, 2020-12-05 06:29:57 +0100, , remove travis,,
127,a92aca6506c6eb3f0880b1586e36c1f7b7948d9e,arkus F.X.J. Oberhumer <markus@oberhumer.com>, 2020-12-05 04:37:30 +0100, , update github,,
128,3f30e411b07bdc83dd3ceff0b2e7d6c66e2046b4,arkus F.X.J. Oberhumer <markus@oberhumer.com>, 2020-12-03 18:16:11 +0100, , undo makefile change,,
129,35ae7c17146637bfcf64376c27828257651527b3,arkus F.X.J. Oberhumer <markus@oberhumer.com>, 2020-12-03 13:58:38 +0100, , add github action,,
130,159bec1cd4795f0ddc2dae95249cbb72979ab0fa,arkus F.X.J. Oberhumer <markus@oberhumer.com>, 2020-12-03 03:10:12 +0100, , fix warning,,
131,3da5f789016ff03429d14def2c9027468cfb9311,arkus F.X.J. Oberhumer <markus@oberhumer.com>, 2020-12-03 02:15:14 +0100, , run clang format,,
132,22d6706de50cf3a7eb5b7b6279a7199096e1437a,arkus F.X.J. Oberhumer <markus@oberhumer.com>, 2020-12-03 02:14:47 +0100, , avoid clang warning,,
133,45757069857e3bc80cce032f37a1ad8c1028c92d,arkus F.X.J. Oberhumer <markus@oberhumer.com>, 2020-12-03 02:10:05 +0100, , doc add note security consideration,,
134,62ff95e308c30e1c4a32e8a31df7bdb8c43648d8,arkus F.X.J. Oberhumer <markus@oberhumer.com>, 2020-12-03 01:46:30 +0100, , fix spelling constant,,
135,92064c30abf276d28b504bb3e8ad839161def2b2,arkus F.X.J. Oberhumer <markus@oberhumer.com>, 2020-12-03 01:44:09 +0100, , avoid msvc warning,,
136,231f07096f2f748ac7d935f76cb92581f02c114a,arkus F.X.J. Oberhumer <markus@oberhumer.com>, 2020-12-03 01:27:05 +0100, , update submodules,,
137,b19f5f3282316a7b9a0bd063fce9e657e09114fb,ohn Reiser <jreiser@BitWagon.com>, 2020-11-29 00:01:22 -0800,435, yet another attempt suppress msvc c4245 http github.com upx upx issue 435 modified pefile.cpp,,
138,037e53f42c4f890e0829cd4af5089a1d3a7d0dc6,ohn Reiser <jreiser@BitWagon.com>, 2020-11-28 23:53:49 -0800,435, another attempt suppress msvc c4245 http github.com upx upx issue 435 modified pefile.cpp,,
139,1bdfa39b4575d3a7dc31ff25dd5baebcfa20e201,ohn Reiser <jreiser@BitWagon.com>, 2020-11-28 20:23:01 -0800,435, attempt workaround msvc c4245 signed unsigned mismatch template argument http github.com upx upx issue 435 modified pefile.cpp,,
