id,sha,author,date,issue,message,file,content
266,c689d5570dec903c002670bffa38e0fd983e3bcd,arl Mastrangelo <carl-mastrangelo@users.noreply.github.com>, 2020-03-30 21:18:11 -0700, , stop exposing deps compile time remove reference reason groovy compiler really want link class includes base class problem private inner class perfmark abi present groovy compilation classpath groovy try compile look deps fails instead link proxy endpoint directly avoid groovy wart remove governator archaius drop apache fileupload move guava deps remove apache common guava hide haproxy bouncycastle remove ref apache lang,,
267,edec3c17f91435fe7829cace5d93d708c5d458b3,arl Mastrangelo <carl-mastrangelo@users.noreply.github.com>, 2020-03-30 16:50:39 -0700, , zuul core remove groovy language support,,
268,29a2d88b0b3d974674220839e130a0cc6becfd04,arl Mastrangelo <carl-mastrangelo@users.noreply.github.com>, 2020-03-30 16:11:15 -0700, , zuul core remove basefiltertest zuul core remove basefiltertest rename basefilter2test drop dep junit mockito,,
269,92e7e2dd6eeb656c301acc8cd15423fd04cb73cd,arl Mastrangelo <carl-mastrangelo@users.noreply.github.com>, 2020-03-30 15:20:23 -0700, , zuul core remove reference servo counter,,
270,959ebc21c1b1a36bcfe415dfd48077d7ec55ba5b,arl Mastrangelo <carl-mastrangelo@users.noreply.github.com>, 2020-03-27 15:17:38 -0700, , bump eureka deps,,
271,1fe773e4e0e65a4d28b0d649f0bf6c4d7e51bfac,arl Mastrangelo <carl-mastrangelo@users.noreply.github.com>, 2020-03-27 14:55:28 -0700, , bump ribbon version,,
272,c8cbeacc994f3681e6cae17b91232ca8a72b46d7,arl Mastrangelo <carl-mastrangelo@users.noreply.github.com>, 2020-03-25 15:43:18 -0700, , update latest netty version,,
273,4b855ae81a807424a89b5bfbdd277f1802d3c741,arl Mastrangelo <carl-mastrangelo@users.noreply.github.com>, 2020-03-24 11:29:57 -0700, , zuul processor support overriding package name,,
274,7092dabebe4fed59e41aa3750ff6513be0ded76d,arl Mastrangelo <carl-mastrangelo@users.noreply.github.com>, 2020-03-23 17:50:23 -0700, , zuul core split filterloader mutable immutable class,,
275,f13fa3db0ee7322a9c22ec84a93da95fb9f47c70,arl Mastrangelo <carl-mastrangelo@users.noreply.github.com>, 2020-03-23 10:38:40 -0700, , zuul core refactor filter loading mutable immutable part step needed support construction static filter registry dynamic loading still supported zuul moving towards fixed filter set model lower load live running server avoids dependency disk read wide deploying code live running server risky endeavor zuul develop necessary safeguard support change optional sole purpose populate loader registry,,
276,64b2a2b9d6606560c5111085610f163582bf31b4,arl Mastrangelo <carl-mastrangelo@users.noreply.github.com>, 2020-03-20 12:57:51 -0700, , zuul sample zuul core remove log4j reference use log4j2 sample,,
277,b16bd0014c75765d29e5907d3ac5eba0d8d8c5e5,arl Mastrangelo <carl-mastrangelo@users.noreply.github.com>, 2020-03-19 10:40:48 -0700, , update latest tcnative perfmark,,
278,17a9c63604bb28d4cf50ed2e9efed51367bec16b,arl Mastrangelo <carl-mastrangelo@users.noreply.github.com>, 2020-03-18 16:42:14 -0700, , zuul core fix host port parsing,,
279,378987ab07791d152390cb36613a37a2a537e12f,arl Mastrangelo <carl-mastrangelo@users.noreply.github.com>, 2020-03-12 19:29:30 -0700, , zuul core add filter annotation,,
280,0b8d92ec8eaee319aca3e4db4e34d2ccbf9849a7,arl Mastrangelo <carl-mastrangelo@users.noreply.github.com>, 2020-03-12 19:04:30 -0700, , update spectator api,,
281,4ec1fe28c09de65136a2cb33adbb1d6121340bc7,arl Mastrangelo <carl-mastrangelo@users.noreply.github.com>, 2020-03-12 18:55:40 -0700, , bump dependency lock,,
282,d9ee4b68bd2cd6202b43de9b9ccf60a8383e56ab,arl Mastrangelo <carl-mastrangelo@users.noreply.github.com>, 2020-03-12 12:00:39 -0700, , zuul processor add unit test,,
283,dd2fa7d0fbb9e8b31718cf236c7387d92dc27d18,arl Mastrangelo <carl-mastrangelo@users.noreply.github.com>, 2020-03-11 18:39:11 -0700, , zuul processor create annotation processor identify zuul filter based annotation zuul core add annotation processor filter zuul sample try new annotation processor format file better move annotation processor package fix generated dir marked test,,
284,d78f49026049c858d59c7fe180113d62d0cadc81,rthur Gonigberg <agonigberg@netflix.com>, 2020-03-10 17:24:50 -0700, , fix catching handshake timeouts,,
285,b28109c26b80c3ea2de323866330a2f54ce32b1a,arl Mastrangelo <carl-mastrangelo@users.noreply.github.com>, 2020-03-06 13:27:52 -0800, , zuul core fix generic filter loader,,
286,cd98880eb32e7103d331b3f5d1956508c997a740,arl Mastrangelo <carl-mastrangelo@users.noreply.github.com>, 2020-03-02 14:04:00 -0800, , zuul core update netty 4.1.46,,
287,ceee0a3f40d043ad57acb86b8e2a5e24ac3ba734,arl Mastrangelo <carl-mastrangelo@users.noreply.github.com>, 2020-02-26 11:08:15 -0800, , zuul core drop malformed request passing filter chain,,
288,98b8ef70369ab10cf757021bc089b66a6e4fb95b,arl Mastrangelo <carl-mastrangelo@users.noreply.github.com>, 2020-02-24 11:41:14 -0800, , zuul core set selected address address string smoke test depend exact string form address accidentally set 127.0.0.1 1234 rather 127.0.0.1 commented originally since unclear purpose know try adding test followup right code structured properly test,,
289,a39f2918a8c73b385c4d4d36acbf7f354181b9de,arl Mastrangelo <carl-mastrangelo@users.noreply.github.com>, 2020-02-21 18:53:54 -0800, , zuul core factor request rejection logic internal external use code need split internal code bad request failed,,
290,10e0091d7896ce5b8c69db078e544d1bdd7ce136,rgha C <007.argha@gmail.com>, 2020-02-20 16:28:28 -0800, , release netty object test,,
291,31d64e7f560fe50e574408ecf7004d7d3eb80fc8,rgha C <007.argha@gmail.com>, 2020-02-20 09:57:05 -0800, , address comment refactor move test correct package,,
292,30b612fcafa86d5ad9f1795f2b3cedb1e3df9e24,rgha C <007.argha@gmail.com>, 2020-02-19 16:01:25 -0800, , refactor channel handler proxy protocol reduced decision maker either delegate relevant handler remove pipeline,,
293,12a325105806cc717099b369425b4616cf183cf0,arl Mastrangelo <carl-mastrangelo@users.noreply.github.com>, 2020-02-19 11:49:02 -0800, , zuul core wire socket address needed ensure ipv6 support additionally pas localaddresses testing future avoids passing string host around force name resolution happen earlier connection address connect longer owned server object instead part connection pool server object function way logically reference backend additionally several argument longer used removed like path method attempt number multiple place lastly blocking dns read still possible change complicated make async future,,
294,0dd5b6477530d76d4cb6bb350c818fe029b62c8d,arl Mastrangelo <carl-mastrangelo@users.noreply.github.com>, 2020-02-18 16:38:51 -0800, , zuul core rethrow bind exception detail,,
295,ce3286b76776a446543f4bffea2acb3202caa1c2,uyi Liu <susiesuyiliu@gmail.com>, 2020-02-14 14:38:56 -0800, , zuul core add cause ssl handshake error origin ssl handler read message handshake failed example peer certificate verified populates handler eventually failure message away proxyendpoint later try talk origin usually get error sslengine closed already doe display actual reason closed change catch detailed failure cause add proxy attempt client know went wrong error general opensslengine problem cause certificate application name applicationname doe match expected name expectedname exceptiontype,,
296,1257d5d970a8d9b7b6de50ed67b3f5f8f79d116b,arl Mastrangelo <carl-mastrangelo@users.noreply.github.com>, 2020-02-05 17:10:33 -0800, , set publish var jdk8 build,,
297,036206669cee03a1c2d7d094a8eafaeeecdeeaf0,ody Rioux <crioux@netflix.com>, 2020-01-30 11:24:05 -0800, , injects used statically load via limit user ability bind various configuration loading mechanism via injector,,
298,9b6832d6395121ec3e6f542adf435695ff680288,arl Mastrangelo <carl-mastrangelo@users.noreply.github.com>, 2020-01-27 10:20:24 -0800, , zuul core fix generic,,
299,a065cccf757184219ca2cdd7dd098a497121e89f,arl Mastrangelo <carl-mastrangelo@users.noreply.github.com>, 2020-01-20 15:23:49 -0800, , zuul core update netty 4.1.45,,
300,30b8d150afec4b57bb51ac0798c1dcc44963c168,rgha C <007.argha@gmail.com>, 2020-01-17 10:48:08 -0800, , remove redundant ctor stick two variant,,
301,fc79123cc0277e3cc4d921a75038c7c4ef134df7,rgha C <007.argha@gmail.com>, 2020-01-16 15:00:38 -0800, , preserve backward compatible ctor,,
302,f6ff6d86eed0b268c750c1c07cef608406e93683,rgha C <971473+argha-c@users.noreply.github.com>, 2020-01-16 14:32:02 -0800,704, merge pull request 704 argha master zuul core include additional client address context,,
303,f3f66d462e70869beb524ca71a54c5e12c561365,rgha C <007.argha@gmail.com>, 2020-01-15 17:20:58 -0800, , modify api indicate optional value client destination port,,
304,0d4738f0bbef9a294cd26528b5fb72ad6873f2c8,rgha C <007.argha@gmail.com>, 2020-01-15 16:34:26 -0800, , zuul core include additional client address context especially relevant proxy protocol enabled,,
305,b46bf5a736cb0e4feb1f5a07c3b80755010e13dc,arl Mastrangelo <carl-mastrangelo@users.noreply.github.com>, 2020-01-07 10:37:31 -0800, , zuul core make client connection shutdown depend channel rather wait request come finish channel wait channel closefuture instead,,
306,0749aad47700ad05504b58d8487cfd79791917ad,arl Mastrangelo <carl-mastrangelo@users.noreply.github.com>, 2020-01-03 14:07:38 -0800, , zuul core support listing listening address,,
307,eac89e02665522450966103c33c2b6b650a73315,arl Mastrangelo <carl-mastrangelo@users.noreply.github.com>, 2019-12-20 09:43:49 -0800, , zuul core bump netty 4.1.44,,
308,0fc16b156ab950a54f1c380c43acedac6182f649,arl Mastrangelo <carl-mastrangelo@users.noreply.github.com>, 2019-12-10 13:36:55 -0800,692, merge pull request 692 carl mastrangelo roback rollback cookie logic based bad device,,
309,4b079248397e62e3697f3fb55752ee8197613523,arl Mastrangelo <cmastrangelo@netflix.com>, 2019-12-10 13:30:55 -0800, , revert zuul core rework cookie logic use non deprecated type reverts commit,,
310,f3032f4d0bf650b62be17cb49a1404dd7015d0f4,arl Mastrangelo <cmastrangelo@netflix.com>, 2019-12-10 13:28:45 -0800, , revert zuul core zuul sample avoid using deprecated cookie apis reverts commit,,
311,9e8b462c63d0dac2c4baceda81ae24d3136d5b28,arl Mastrangelo <carl-mastrangelo@users.noreply.github.com>, 2019-12-06 15:21:50 -0800, , zuul core zuul sample avoid using deprecated cookie apis,,
312,482e54cb47d391751d1a8460dc3738f4d8f196a4,arl Mastrangelo <carl-mastrangelo@users.noreply.github.com>, 2019-12-06 14:01:52 -0800, , zuul core set correct attribute using proxy protocol,,
313,aecce216100e94605ea483e65019f08a24562123,arl Mastrangelo <carl-mastrangelo@users.noreply.github.com>, 2019-12-06 10:21:03 -0800, , zuul core remove reference deprecated method type,,
314,e87ac0fb91d60a27d8eacfb181374550c7ddf853,arl Mastrangelo <carl-mastrangelo@users.noreply.github.com>, 2019-12-05 12:37:16 -0800, , zuul core rework cookie logic use non deprecated type doe thing deprecates cookie method cookie class add test cookie class update pushauthhandler use non deprecated type add test push,,
315,2d73386f8dd044d3624ab3bb9910738f51bd95bc,arl Mastrangelo <carl-mastrangelo@users.noreply.github.com>, 2019-12-05 11:45:47 -0800, , zuul core add doc source address,,
316,bf1ec2a1d8a72036cb5d22939a4e4c066176cfd9,arl Mastrangelo <carl-mastrangelo@users.noreply.github.com>, 2019-12-05 11:45:08 -0800, , zuul core add fast property outbound tlsv1.3 connection,,
317,76c90bf22f60e9305b60397503ca8b59c7dcb749,rgha C <971473+argha-c@users.noreply.github.com>, 2019-12-04 13:42:33 -0800,687, merge pull request 687 argha master improve readme specific description zuul,,
318,f018a88944094fb70e89798a29dc86e52e3fc276,rgha <>, 2019-12-04 09:38:03 -0800, , modify description zuul,,
319,01b635027311d3a7e823a9f7b146838490444d42,arl Mastrangelo <carl-mastrangelo@users.noreply.github.com>, 2019-12-03 08:52:25 -0800, , remove reference word port,,
320,684c38ad3d18f7b00053db81285f03c33b6c9e64,arl Mastrangelo <carl-mastrangelo@users.noreply.github.com>, 2019-11-26 10:00:01 -0800, , zuul core update latest guice work jdk11,,
321,6189058ab674e8a3ff4388787fa6e844022ca7a3,arl Mastrangelo <carl-mastrangelo@users.noreply.github.com>, 2019-11-21 10:50:18 -0800, , zuul core make direct memory gauge work jdk motivation netty jdk11 access internals field null modification lookup netty class class init time check field access reserved memory null return default netty normally return make stuff immutable ensure singleton property class result spammy log running jdk 11. tested manually note know field reflectively accessed actual getters class could,,
322,62bee357aed29bc216a71bb9766d5be98156b618,arl Mastrangelo <carl-mastrangelo@users.noreply.github.com>, 2019-11-16 17:06:42 -0800, , update perfmark 0.20.1,,
323,7d0d706d7637075fb2aff0cef4a28a71e36c1ede,arl Mastrangelo <carl-mastrangelo@users.noreply.github.com>, 2019-11-13 18:24:50 -0800, , fix open jdk11 build unbreaks jdk11 build stricter javadoc generator change remove doclet exclude jar seems source code lost able figure doe decompiling original purpose exclude testunit class used part main class since moved test directory instead feature longer needed fix javadoc usage technically incorrect place,,
324,3779b5edfe5989effe653fcef7d6c62826655e26,arl Mastrangelo <carl-mastrangelo@users.noreply.github.com>, 2019-11-13 15:49:21 -0800, , zuul core delete unused loadbalancer class,,
325,2d9dd6742a286ccd32a260ad7c9fc77f59f73694,arl Mastrangelo <carl-mastrangelo@users.noreply.github.com>, 2019-11-13 15:35:38 -0800, , test openjdk11 openjdk8,,
326,5dec91d9d52bbd2285551d1cf033b0becd1a3284,arl Mastrangelo <carl-mastrangelo@users.noreply.github.com>, 2019-11-13 15:35:15 -0800, , zuul sample prefer using addr instead port possible,,
327,b9f517cd46426ddde470bf088acf8eba6b258c3c,arl Mastrangelo <carl-mastrangelo@users.noreply.github.com>, 2019-11-12 18:58:13 -0800, , zuul core silence log spam build,,
328,8c9351514a7e1a4582a631ab606ccf9b234c435a,arl Mastrangelo <cmastrangelo@netflix.com>, 2019-11-12 17:25:51 -0800, , merge branch 2.1,,
329,f2f0a4b97727c55707e552b09a989688a57001c6,arl Mastrangelo <carl-mastrangelo@users.noreply.github.com>, 2019-11-12 14:15:54 -0800, , zuul core remove ability set port,,
330,23a9a7c6daaf3be3fec146a41e68bcbfb882eccb,arl Mastrangelo <carl-mastrangelo@users.noreply.github.com>, 2019-11-12 14:15:20 -0800, , zuul core remove unused serverstatus handler,,
331,61a866cf6bee714d00f8d586e29e6fc88502371d,arl Mastrangelo <carl-mastrangelo@users.noreply.github.com>, 2019-11-12 14:14:57 -0800, , zuul core remove ipv6 scope identifier source address,,
332,7d3fbc1913c5cac729beb1441ee548cfed9a513a,arl Mastrangelo <carl-mastrangelo@users.noreply.github.com>, 2019-11-12 14:13:43 -0800, , zuul core add documenation zuulmessage describing api contract,,
333,0a69e4684e22b3601db51ed698f8c02b40f95dea,arl Mastrangelo <carl-mastrangelo@users.noreply.github.com>, 2019-11-09 20:52:52 -0800, , zuul core use filter name profiling call 668 zuul core use filter name profiling call update filter runner trace filter event,,
334,7d942d24c4d15def4b7d17ec40f933c621934aca,rthur Gonigberg <agonigberg@netflix.com>, 2019-11-07 10:06:43 -0800,667, merge pull request 667 igorperikov patch add latest netflix article zuul2,,
335,46f856cffe1c9d87a5b03178606ed3d5c2708ccd,gor Perikov <IgorPerikov@users.noreply.github.com>, 2019-11-07 11:38:36 +0300, , add latest netflix article zuul2,,
336,87aa6692521e93e8eaccfd67a69c0dcc6043ee05,arl Mastrangelo <carl-mastrangelo@users.noreply.github.com>, 2019-11-06 14:22:49 -0800, , zuul core shrink stack handler pipeline,,
337,cee1d200bf2dd92fb6ad643ec3bad9c3f1d6488d,arl Mastrangelo <carl-mastrangelo@users.noreply.github.com>, 2019-10-31 15:09:38 -0700, , zuul core make sure max size enforced,,
338,a713d827b30a96aed871c42a44f0526ed7a2d12e,arl Mastrangelo <carl-mastrangelo@users.noreply.github.com>, 2019-10-31 11:03:29 -0700, , zuul core bump latest version junit needed use assertthrows,,
339,cda3c89f07a60eea7fdccc3ab421059b5345d832,arl Mastrangelo <carl-mastrangelo@users.noreply.github.com>, 2019-10-29 08:51:43 -0700, , zuul core support specific bind address,,
340,282a61257f629b5a51a620208d2dbe459db77245,hristian Clauss <cclauss@me.com>, 2019-10-28 18:37:40 +0100,569, .travis.yml sudo tag deprecated travis 570 fix 569,,
341,4b5133b341c026244745cd98809d7fa7ca56e3a2,arl Mastrangelo <carl-mastrangelo@users.noreply.github.com>, 2019-10-28 10:20:34 -0700, , zuul core make sure file license header add plugin check require,,
342,374557f6fd5fe494fc13b71575c1500c1c45f2c2,arl Mastrangelo <carl-mastrangelo@users.noreply.github.com>, 2019-10-28 10:12:35 -0700, , zuul core check unresolved address connecting,,
343,15946ef21c4879f34ccca80b3711e088e975d3f9,arl Mastrangelo <carl-mastrangelo@users.noreply.github.com>, 2019-10-25 15:41:41 -0700, , update netty 4.1.43 final,,
344,8d8c4b99f55fd697d810e6283b56b1a6918fd9b2,arl Mastrangelo <carl-mastrangelo@users.noreply.github.com>, 2019-10-25 13:33:52 -0700, , zuul core make sure origin client channel use compatible type,,
345,1a6db086a21055da8ac82158a73e9c63197811d3,arl Mastrangelo <carl-mastrangelo@users.noreply.github.com>, 2019-10-25 13:16:25 -0700, , update initializers use metricid,,
346,6345d4f0f18bc69a0105359281a2be74a5cf4518,arl Mastrangelo <carl-mastrangelo@users.noreply.github.com>, 2019-10-23 18:17:53 -0700, , zuul core remove another port reference,,
347,922f32c7f2e92c6199dac4060e54d956ed88d2bb,arl Mastrangelo <carl-mastrangelo@users.noreply.github.com>, 2019-10-23 17:36:49 -0700, , zuul core make prefer string port observation port number ever used metric recording anything networking related change overload constructor prefer metric suffix instead port deprecates field,,
348,735ac342f4921ae4f3ce31bd38d2db1b93c99763,arl Mastrangelo <carl-mastrangelo@users.noreply.github.com>, 2019-10-23 15:30:39 -0700, , zuul core add sockaddr overload server startup logging 649 lowered severity warn info made call final since think need overridden made generic relaxed since logger actually use value unchained int int serversslconfig since overload ssl log affect theory function could static think would api limiting future turned depend instance,,
349,7257087f872df7bee9ef922aeb44fcf6c2363973,arl Mastrangelo <carl-mastrangelo@users.noreply.github.com>, 2019-10-23 14:05:32 -0700, , zuul core make prefer using socket address 648 incremental change allow existing code slowly move socket address rather port old client still override existing method deprecation warning new client override socket address method,,
350,4db220720a69a16a28e74b4a4efd46c5cc3b570c,arl Mastrangelo <carl-mastrangelo@users.noreply.github.com>, 2019-10-23 12:11:32 -0700, , zuul core depend correct kqueue jar,,
351,9802da24397b86aecc01d8b08144e14882d2e23b,arl Mastrangelo <carl-mastrangelo@users.noreply.github.com>, 2019-10-23 11:29:06 -0700, , core make server easier use core make server easier use server attempt use socketaddress instead port number make easie rin future adapt using kind address like localaddress test automatically try select epoll kqueue nio based availablility requires runtime dependency present attempt avoid loading extra transport specific class log level reduced log statement actionable useful incase something going wrong,,
352,f81489cadf2a1b48f99c40d85cb42c95701defc9,arl Mastrangelo <carl-mastrangelo@users.noreply.github.com>, 2019-10-21 14:56:45 -0700, , dont cache perfmark tag forgot tag noop impl depending enabled make sense cache tag filter since filter instance created request,,
353,8346d970b2ba79a6ba390c105e95dd74cbbe7a05,arl Mastrangelo <carl-mastrangelo@users.noreply.github.com>, 2019-10-21 10:04:39 -0700, , zuul core add perfmark annotation,,
354,e6f76ec2259c25c76cb2a1d60595d333ff5fad24,WY <572039941@qq.com>, 2019-10-18 08:52:55 +0800, , update 638 change 364 line,,
355,8d541fb7bdf63c60d9f8ad63b3a534339084bb54,rthur Gonigberg <agonigberg@netflix.com>, 2019-10-15 10:15:34 -0700,637, merge pull request 637 netflix sni basic building block sni support,,
356,0bfbe3f20e58ee6a33afc0591a440a31ee873ebc,rthur Gonigberg <agonigberg@netflix.com>, 2019-10-14 17:51:46 -0700, , fix compile failure,,
357,b8a7e28627d0b48fef5fc9e0fc404d6ed6f1e8d7,rthur Gonigberg <agonigberg@netflix.com>, 2019-10-14 17:46:13 -0700, , add metric sni completion event,,
358,f7d3933ede4512fb2749348cf0a33a3d9adad79c,rthur Gonigberg <agonigberg@netflix.com>, 2019-10-14 11:52:34 -0700, , modfy use non port ssl info,,
359,4b9e3c0b6e8c4aacbb6a318cbe7240c41c33bf27,rthur Gonigberg <agonigberg@netflix.com>, 2019-10-11 17:29:05 -0700, , building block sni implementation,,
360,b47bfba2c651f614072a9a6e0945401fd6cea625,arl Mastrangelo <carl-mastrangelo@users.noreply.github.com>, 2019-10-09 12:02:33 -0700, , make zuul able work jdk bump gradle 5.6.2 update latest nebula update lock file using new nebula update guava 28.1,,
361,f4dd2cb566cfc224c3bd6509a49fffca492fdfb3,hil Rud <47129415+philrud@users.noreply.github.com>, 2019-10-08 10:36:23 -0700,636, merge pull request 636 philrud filter timing measure filter elapsed time nanos,,
362,f8ef3551d8dd57a512336315ec51bb6c0444c517,hilip Rud <prud@netflix.com>, 2019-10-07 18:24:28 -0700, , measure filter elapsed time nanos existing log message statistic around filter timing changed implementation access higher precision elapsed time reading,,
363,5fdf5d9da5cd7586f8567b90ff8a4700ca85c87c,arl Mastrangelo <carl-mastrangelo@users.noreply.github.com>, 2019-10-07 17:35:02 -0700, , zuul core use non deprecated http2 multiplex handler,,
364,bf1781196475e9534d18f61c88889694c45c1191,arl Mastrangelo <carl-mastrangelo@users.noreply.github.com>, 2019-10-07 16:46:34 -0700, , zuul core modernize filtertest,,
365,3eac370d6f8d2f995dd734531cdc8e5038a472ad,arl Mastrangelo <carl-mastrangelo@users.noreply.github.com>, 2019-10-03 13:25:01 -0700, , zuul core update netty 4.1.42,,
366,c677c91840f7119201b63157ae5141dc226aa3e6,arl Mastrangelo <carl-mastrangelo@users.noreply.github.com>, 2019-10-02 14:07:26 -0700, , zuul core fix ssl bug newer version netty failure write serverhello message result channel closed happen client sends clienthello quickly close connection change lower severity message logged add test proving connection clean test fails older version netty,,
367,d6f50c916497068a3449a63040f5031a47228ebd,arl Mastrangelo <carl-mastrangelo@users.noreply.github.com>, 2019-09-30 10:22:17 -0700, , move majority test test directory standard structure java project functionality changed part refactor confirm number test case 115,,
368,25c2f8b13ab9f44c61d74887bd0524a0e09ffb7d,arl Mastrangelo <carl-mastrangelo@users.noreply.github.com>, 2019-09-27 15:59:13 -0700, , core fire haproxymessage pipeline additionally release interior tlvs channel close future take care,,
369,9a447314aafb84e6c7b377493a10208388362da2,aya <gvaradarajan@netflix.com>, 2019-09-18 15:08:00 -0700, , cgw 121 adding access control max age header http header name cache,,
370,13235b0c2d58c15177a84962d868f0385662e6b0,arl Mastrangelo <carl-mastrangelo@users.noreply.github.com>, 2019-09-16 09:33:45 -0700,620, core raise generic bound discoveryclient exposed 620 bound discovery client eurekaclient rather discoveryclient,,
371,7fc7487579519b06f96e046948fe9363c5ba5744,arl Mastrangelo <carl-mastrangelo@users.noreply.github.com>, 2019-09-13 17:46:29 -0700, , core add initial unit test change fix generic call site breaking change needed type safety move default value dynamic property config key avoids npe unboxing value note connclosedelay doe default initializer pick default behavior change think okay add basic unit test tcp handler added code copied deduplicate later enough overlap future test,,
372,ba7f06aa5b4719693e268c7c5856a9ba7e9f3b11,arl Mastrangelo <carl-mastrangelo@users.noreply.github.com>, 2019-09-13 17:45:02 -0700, , core add unit test,,
373,f54278e59f877e6c6ea7e723c0fbf3c44cea6304,arl Mastrangelo <carl-mastrangelo@users.noreply.github.com>, 2019-09-13 17:44:36 -0700, , core release haproxy message correctly add test,,
374,2bfbea950f5c09cfe35a35e0668db633123b6113,arl Mastrangelo <carl-mastrangelo@users.noreply.github.com>, 2019-09-12 16:51:16 -0700, , revert core adjust release count 618 619 revert core adjust release count 618 reverts commit break internal build revert core make sure fire haproxy message completion reverts commit,,
375,6737e6259fc7fc444c70e7df68c8a73b4d0ef3a1,arl Mastrangelo <carl-mastrangelo@users.noreply.github.com>, 2019-09-10 14:52:10 -0700, , core adjust release count 618 occasionally message fall end event loop causing crash add safety release logging aid debugging,,
376,e1c7481e5ab52f0903fb10dcc0b29c1ab4ed7c77,arl Mastrangelo <carl-mastrangelo@users.noreply.github.com>, 2019-09-09 17:23:40 -0700, , core make sure fire haproxy message completion,,
377,f9a4d783d82f8770fa89189629113e0215b542a4,arl Mastrangelo <carl-mastrangelo@users.noreply.github.com>, 2019-09-09 09:40:50 -0700, , bump netty tcnative 2.0.25,,
378,011ffd11326ce3697b78e8b28168ea0a6f842123,¾²ç¦¾ä¸¶ <liangGTY@users.noreply.github.com>, 2019-09-07 04:58:20 +0800, , core fix sorting error,,
379,3d32677b5f66b4730711332313ea2ef178dee668,arl Mastrangelo <carl-mastrangelo@users.noreply.github.com>, 2019-09-06 02:36:01 -0700, , core delete netty forked class,,
380,5f572398eeb1145fb55aa1b96e3627b732aecf2e,kshay Pethani <pethaniakshay@users.noreply.github.com>, 2019-09-06 15:05:07 +0530, , removed broken link readme.md,,
381,d2006c37dc0d4f5337dc95fa7a274ac7373a819e,arl Mastrangelo <carl-mastrangelo@users.noreply.github.com>, 2019-08-30 15:41:02 -0700, , bump netty 4.1.39 final,,
382,40869019689b06caac0ea27d1ea8e87bb3653af7,ike Smith <michaels@netflix.com>, 2019-08-13 20:29:33 -0700, , attempting send 2nd graceful go_away frame check channel still active found practice client close connection receiving 1st go_away validly,,
