id,sha,author,date,issue,message,file,content
532,89faaff27e1e0e163627054c27296089e013b5ec,usheel Aroskar <saroskar@netflix.com>, 2018-04-05 14:02:38 -0700, , close connection server side upon returning 408 response,,
533,1906f769ad3df0a60b4ccae1e76ab8db54e0a211,ike Smith <michaels@netflix.com>, 2018-03-29 16:02:04 -0700, , call _before_ acquiring connection therefore also need decrement case unable establish new connection,,
534,0195bbfeacfdbb41b41117c2764ce5597c4a8067,rthur Gonigberg <agonigberg@netflix.com>, 2018-03-07 14:29:43 -0800, , add field tracking vip security,,
535,0d4087b2553bceda074e2825a3577302b84cde24,ike Smith <michaels@netflix.com>, 2018-03-05 14:38:48 -0800, , bugfix proxyendpoint execution listener invoked response header collected,,
536,9f02193cd387971c6cc6dab040724d1a82721579,ike Smith <michaels@netflix.com>, 2018-03-03 19:30:21 -0800, , fix proxyendpoint correctly invoking interface,,
537,a4f3fbefc93c57c069a23d3e8493d15f19ebc600,rthur Gonigberg <agonigberg@netflix.com>, 2018-03-01 14:21:29 -0800, , update readme.md,,
538,1baf63ab1f4a2326a6b6c4c03809e596ce3df4f5,rthur Gonigberg <agonigberg@netflix.com>, 2018-03-01 11:28:42 -0800, , add run task sample,,
539,580851dc8656c7ba2cf4f4bfd912575581a63403,ike Smith <michaels@netflix.com>, 2018-02-26 19:40:30 -0800, , merge branch 2.1 github.com netflix zuul 2.1,,
540,22e5ff0725463486da722f98e0c47ed64418f667,ike Smith <michaels@netflix.com>, 2018-02-26 19:40:25 -0800, , fix apply _parent_ channel tcp connection rather stream channel avoid http2exception getting logged error using signal graceful shutdown connection,,
541,fcba58c2ba30f26514d3d89a85d8fabaa3509714,udheer Vinukonda <svinukonda@netflix.com>, 2018-02-26 11:08:35 -0800, , merge branch 2.1 http github.com netflix zuul 2.1,,
542,f33cc057115f330fd77cb72facf0a843434a71aa,udheer Vinukonda <svinukonda@netflix.com>, 2018-02-26 11:06:44 -0800, , count retries made remote zuul zuul zuul scenario checking retry limit,,
543,210dc97a75d01b837e57886c5bca10962bd03b21,ike Smith <michaels@netflix.com>, 2018-02-25 12:28:20 -0800, , change logging _unusual_ event http request give false positive due http2 codec working bit differently http1,,
544,8c60ec06ed2e01ebf38f8a597b8f4b2775effdd7,ike Smith <michaels@netflix.com>, 2018-02-25 11:49:42 -0800, , set flag msg instanceof lasthttpcontent httpcontent previously setting flag fullhttprequest instance,,
545,128b07b09e465f8bc90b4216b5a34e728145777e,ike Smith <michaels@netflix.com>, 2018-02-25 11:15:52 -0800, , remove unused class,,
546,761c34282c5cef87b94e467c49e08c84574943cf,ike Smith <michaels@netflix.com>, 2018-02-25 11:07:54 -0800, , longer strip forwarded host header untrusted connection real advantage host header always faked anyway useful debugging,,
547,376f79ac23287b719698f8c025621002fa771f42,ike Smith <michaels@netflix.com>, 2018-02-25 11:06:16 -0800, , fix npe impl origin yet chosen simulator origin,,
548,3860ce4c9e7575dbce0a50d2cd079845acde675d,ike Smith <michaels@netflix.com>, 2018-02-25 11:05:25 -0800, , stop throwing exception receive unexepected message type netty pipeline instead debug log release refcnt continue became problem latest netty upgrade http window_update frame started getting propagated application code causing error,,
549,5aa652e140fbaa7ff3baa36bcc66aff95f6b451b,ike Smith <michaels@netflix.com>, 2018-02-21 11:25:01 -0800, , bugfix edge case,,
550,621ee7e83bb4eaa40d45955277e6fe4a8c440a44,ike Smith <michaels@netflix.com>, 2018-02-21 00:52:04 -0800, , revert switch back using openssl instead boringssl due boringssl longer seemingly supporting sslv3 latest tcnative boringssl reverts commit,,
551,db8156cda680ce43f74b5da393a7f0e3a24c956b,ike Smith <michaels@netflix.com>, 2018-02-20 16:04:43 -0800, , switch back using openssl instead boringssl due boringssl longer seemingly supporting sslv3 latest tcnative boringssl,,
552,f9c04050d90df489bb1cbad7f40d644ec9b3dbfb,ike Smith <michaels@netflix.com>, 2018-02-19 18:47:42 -0800, , netty upgrade seeing different variant ssl handshake timed client establishes tcp connection send data close point later catch specifically without flagging handshake failure metric,,
553,d936ef35df647fa12772e392be8cdfe0012a986d,ike Smith <michaels@netflix.com>, 2018-02-19 18:44:25 -0800, , due netty version upgrade changing configure http2codecs need move http2 specific handler onto,,
554,5b459adb15d38d1531a3a47d8b4089b45a3158fc,ike Smith <michaels@netflix.com>, 2018-02-19 18:10:04 -0800, , enable configured log specified frame type,,
555,ab16b6c277a5f22fe54ccf538beaf52f5ce9527a,ike Smith <michaels@netflix.com>, 2018-02-19 15:41:50 -0800, , merge branch 2.1 github.com netflix zuul 2.1,,
556,af9d8268a42c9a4995f78ed4f7b3d314d50cadf7,ike Smith <michaels@netflix.com>, 2018-02-19 15:41:46 -0800, , change http channelconfig default 100 5mb also rename property consistent server property server.http2,,
557,0d3667438c846d3bcded32bc7438e9f83a797da8,ike Smith <michaels@netflix.com>, 2018-02-19 15:39:45 -0800, , upgrade netty version 4.1.11 4.1.21 take fresh copy http2framecodec 4.1.21 implement pushpromise related modification delete longer required class,,
558,8da1425be03d9556dba1bab2b1279bfd2f40f42d,udheer Vinukonda <svinukonda@netflix.com>, 2018-02-19 11:27:12 -0800, , decrement channel abnormally closed,,
559,67c168a7d937e59b663b7151c9892b504e7eeef9,udheer Vinukonda <svinukonda@netflix.com>, 2018-02-19 11:21:12 -0800, , decrement serverstats abnormal channel close,,
560,7e27a15edae792aba4b8186b695e9b543c2bd2ad,rthur Gonigberg <agonigberg@netflix.com>, 2018-02-16 14:27:36 -0800, , small refactor ssl retry logic,,
561,d4c9c6d873c9a419c9af5883608d1368c5a8e05b,ike Smith <michaels@netflix.com>, 2018-02-15 23:14:27 -0800, , change log frame single line rather across multiple line,,
562,7df11a88a2b77fe601004c550d3693b6f8e82419,ike Smith <michaels@netflix.com>, 2018-02-15 23:13:39 -0800, , merge branch 2.1 github.com netflix zuul 2.1,,
563,d57061d256cac4103c0c01f3ce3a48aeebcfaa81,ike Smith <michaels@netflix.com>, 2018-02-15 23:13:33 -0800, , allow configuration http initial window size,,
564,7c7bd16757f74ccfd3d71a8ae03ebe925d314f94,rthur Gonigberg <agonigberg@netflix.com>, 2018-02-15 16:49:54 -0800,406, merge pull request 406 netflix retry ssl post fix post retries ssl origin,,
565,f26bb3b6aacc51c95737f2e8ea86d49a9bbe386f,rthur Gonigberg <agonigberg@netflix.com>, 2018-02-15 16:34:18 -0800, , add counter ssl retry population,,
566,03aba20ad4643a44ceba7d324f3a8b49c3961991,ike Smith <michaels@netflix.com>, 2018-02-09 19:04:50 -0800, , fix actually closing inbound channel idle timeout event fired,,
567,fc8032b26158a4f1eb4400800b0114f4809d834c,ike Smith <michaels@netflix.com>, 2018-02-09 19:04:05 -0800, , merge branch 2.1 github.com netflix zuul 2.1,,
568,01b3f70c0e3a0252882160d120a6a6d917f21e7b,ike Smith <michaels@netflix.com>, 2018-02-09 19:03:38 -0800, , channel closed client idle time ssl handshake completes treat handshake failure,,
569,0f4f80d6e961d41b3eb49fe5d9678e4e5710d7a5,rthur Gonigberg <agonigberg@netflix.com>, 2018-02-09 17:56:27 -0800, , fix post retries ssl origin,,
570,230ac42c8eb6117633dc6c0031e107812f98cfab,rthur Gonigberg <agonigberg@netflix.com>, 2018-02-09 13:57:32 -0800, , add event passport non success status retries,,
571,548ce12d75c514cda45425fcbaaf47e1a7c06a57,aksoras <susheel.aroskar@gmail.com>, 2018-02-09 12:08:34 -0800,405, merge pull request 405 netflix async concurrency limit runtime tunable concurrency async filter,,
572,89a1df59cbaa551308ddcaf4ab07a93f12bfc404,rthur Gonigberg <agonigberg@netflix.com>, 2018-02-07 18:07:37 -0800, , provide detail request attempt discovery enabled server,,
573,3c04b4bff72200c6f88efc45037a1f4d66d8e13b,ike Smith <michaels@netflix.com>, 2018-02-07 11:33:24 -0800, , useful error message logged avoid generating stacktraces invalid http request caught,,
574,c7d84d2877bc510ea2ae885a09bfef2af5058101,ike Smith <michaels@netflix.com>, 2018-02-07 11:09:51 -0800, , fix occasional npe,,
575,23b1bf64f617f964162136d4e7e1e30e5e23143f,usheel Aroskar <saroskar@netflix.com>, 2018-02-06 16:11:53 -0800, , runtime tunable concurrency async filter slow running async filter cause high number concurrent request piled frontend introduces controlled concurrency limit tuned individual filter single disable filter concurrency limit altogether find bug leak implementation,,
576,3dbae32c211a6952233b67032fb3f1fd1ee12e5d,ike Smith <michaels@netflix.com>, 2018-02-05 12:15:57 -0800, , merge branch 2.1 github.com netflix zuul 2.1,,
577,c681adcbd9e4dad8d34c9055b5604b5043e6ffdd,ike Smith <michaels@netflix.com>, 2018-02-05 12:15:54 -0800, , increment status status indicates receiving lastcontent anyway,,
578,4914f77622bdeb79130f478ead6b985b2419f2f1,usheel Aroskar <saroskar@netflix.com>, 2018-02-05 10:48:58 -0800, , merge branch 2.1 http github.com netflix zuul 2.1,,
579,600b77e4d12485228ccc33df1835b12546da4449,usheel Aroskar <saroskar@netflix.com>, 2018-02-05 10:47:09 -0800, , remove idle state handler origin connection pipeline origin connection use idle state handler conflict read time handler origin connection connection active use idle timeout read time origin connection used read timeout may effect,,
580,ec364dfe331f2b724f7e16d5606f6d293ece7cdd,ike Smith <michaels@netflix.com>, 2018-02-04 12:16:09 -0800, , revert static endpoint wait till whole request arrives writing response reverts commit,,
581,a6391521674e726b7c42cb477a50194e846ac90f,ike Smith <michaels@netflix.com>, 2018-02-04 12:12:43 -0800, , merge branch 2.1 github.com netflix zuul 2.1,,
582,93b5403872e93cb9d2e20123008a4bf4fa580bd2,ike Smith <michaels@netflix.com>, 2018-02-04 12:12:38 -0800, , bugfix incorrectly storing response state instance stored sessioncontext,,
583,812c51ca70f94a3519eddfb10d2f3d698219d8cd,usheel Aroskar <saroskar@netflix.com>, 2018-02-02 10:49:00 -0800, , merge branch 2.1 http github.com netflix zuul 2.1,,
584,c83fddd50576d0eac71b780b41790422ae8fd75d,usheel Aroskar <saroskar@netflix.com>, 2018-02-02 10:48:53 -0800, , static endpoint wait till whole request arrives writing response,,
585,8919f228080ed91bf990c35bf552051f4cc32a4b,ike Smith <michaels@netflix.com>, 2018-02-01 17:56:04 -0800, , make sure cleanup channelhandler state completeevent hang around channel next request,,
586,0be1b66a7e2fee5b22224bf0493eacb8b706988f,ike Smith <michaels@netflix.com>, 2018-02-01 17:55:43 -0800, , change respond received lastcontent request gate property switch back previous behaviour compare back back,,
587,10f800d61442f94e7ed6e66999a42b0d9ed7c3ba,ike Smith <michaels@netflix.com>, 2018-02-01 17:54:13 -0800, , add metric count ever start writing http response client channel _before_ finished receiving lastcontent request,,
588,508d755bbd46f4f63aca2e66098ba9ce7074582b,ike Smith <michaels@netflix.com>, 2018-01-31 14:52:43 -0800, , add percentiletimer connection establishment duration connectionpool metric,,
589,ef42020c834e2ed985611dd3c1d1ed5a71dc4bbf,ike Smith <michaels@netflix.com>, 2018-01-30 21:35:59 -0800, , stop logging stacktraces proxyendpoint origin error brownout info log level enabled,,
590,c77f64af43ed6d5ec1194246ac12e0e2ac32fc9c,ike Smith <michaels@netflix.com>, 2018-01-30 10:50:11 -0800, , refactor eventloop acceptor thread count new eventloopconfig class referenced multiple place,,
591,49c03d49c59a4faa560dc843e77159b1b1292678,rthur Gonigberg <agonigberg@netflix.com>, 2018-01-26 13:32:31 -0800, , add init method interface make sure call basic netty origin,,
592,71680bf3fc62dc1b568c0ab1fe2d92ca8c727044,ike Smith <michaels@netflix.com>, 2018-01-25 19:47:11 -0800, , change lazy loading field explicit post construct init method,,
593,d42417607720a0cbff334b44681f66aecb417a6d,usheel Aroskar <saroskar@netflix.com>, 2018-01-25 16:00:41 -0800, , enforce connection limit globally instead per event loop,,
594,ad171426a0af8181e7b44b0144517a687dc41c21,gonigberg <agonigberg@netflix.com>, 2018-01-11 10:21:37 -0800, , update sample config disable eureka fetch,,
595,0bdae8d738cd579d1bab23fa8f10f9acb941ccf9,ike Smith <michaels@netflix.com>, 2018-01-09 12:28:07 -0800, , remove unnecessary empty method,,
596,c1ae561358e6841bd24c5efcfdfe438ebc86baba,ike Smith <michaels@netflix.com>, 2018-01-09 12:27:20 -0800, , ensure invoked get 503 status origin server,,
597,2b405436e6980f9ac6fb99814f4a02b6bdc4b188,ike Smith <michaels@netflix.com>, 2018-01-09 12:26:40 -0800, , bugfix calling response parsed therefore header empty,,
598,8cc555039ef328586204a091fa5d6726e6f44c56,gonigberg <agonigberg@netflix.com>, 2018-01-08 17:18:46 -0800, , add removeif function header,,
599,dca17c2bb633902bedf577feb7a556906236c386,rthur Gonigberg <agonigberg@netflix.com>, 2018-01-05 11:11:09 -0800,392, merge pull request 392 sghill update key updated bintray api key,,
600,1585ede57460a74716eda9fd1ce312995d84eea8,teve Hill <sghill.dev@gmail.com>, 2018-01-05 11:05:33 -0800, , updated bintray api key,,
601,abdc1bd416ccf1fd03c32a12a403ea8de0a84cf0,gonigberg <agonigberg@netflix.com>, 2017-11-21 17:19:09 -0800, , initial commit working core sample zuul 2.0,,
602,33b4961ef5c2280486b5218e18ce7376ef19eea4,ike Smith <michaels@netflix.com>, 2017-12-11 11:40:53 -0800, , remove unused dependency rxjava string,,
603,58884ffa8d12e7de1782a6c8cfc17f38bfb0ede6,gonigberg <agonigberg@netflix.com>, 2017-11-17 14:22:46 -0800, , upgrade nebula version,,
604,970968c7dcc9370016b86ebf88dd1c9ac887f94b,gonigberg <agonigberg@netflix.com>, 2017-11-17 13:50:02 -0800, , fix partial loading filter chain startup,,
605,41068ccada3e98c549f3b35a4b4b8b9f0861d29b,gonigberg <agonigberg@netflix.com>, 2017-11-17 12:35:44 -0800, , update gradle config,,
606,f5de34f846cf47c8be06d09643114d755abee84c,gonigberg <agonigberg@netflix.com>, 2017-11-16 18:06:55 -0800, , change release scope snapshot build,,
607,8155e20e7efab2aba409a7ff22eaad3d62027570,gonigberg <agonigberg@netflix.com>, 2017-11-16 15:50:07 -0800, , remove module build,,
608,bd442b0aa28a5197e9edc6e4acda66909063d11f,gonigberg <agonigberg@netflix.com>, 2017-11-16 15:31:48 -0800, , remove servletapi sample,,
609,00ff085b28db5e3dc1324a43fd9af2bdf8517a50,gonigberg <agonigberg@netflix.com>, 2017-11-16 15:29:49 -0800, , fix debug test,,
610,ad97c50cbb6a0c4cf73f605035bbb5407579b684,gonigberg <agonigberg@netflix.com>, 2017-11-16 15:17:59 -0800, , fix compile failure,,
611,2324b630ff3bbb6d858fd2a10d31614f0e012c9b,rthur Gonigberg <agonigberg@netflix.com>, 2017-11-16 14:34:17 -0800,373, merge pull request 373 quidryan guice injection dropped guice injection branch original 3.x branch,,
612,24903c2a5df6b9e9c405d8b9d2a028f8b46bcbf0,ustin Ryan <jryan@netflix.com>, 2017-11-16 14:16:49 -0800, , merge branch guice injection guice injection dropped,,
613,61dec7059ea53c994e20266527f0c269e43a5146,usheel Aroskar <saroskar@netflix.com>, 2017-11-16 13:03:02 -0800, , merge branch 3.x http github.com netflix zuul 3.x,,
614,21eadcd0234cec311f0eafe47efb44f24ec03506,usheel Aroskar <saroskar@netflix.com>, 2017-11-16 13:02:57 -0800, , automatically set content length call setbody,,
615,262c676a54f0c2a9727de5cf0dd833a6752f3475,rthur Gonigberg <agonigberg@netflix.com>, 2017-11-16 12:16:35 -0800,354, merge pull request 354 quidryan guice injection support inject filter,,
616,1ab517e81b6db23ccf1921f7e2d9174f1d68baa1,usheel Aroskar <saroskar@netflix.com>, 2017-10-25 12:36:00 -0700, , gzip chunked encoded response,,
617,0b0467d1f5f9d54fd280a8c289f6fdb3e6c0e25d,usheel Aroskar <saroskar@netflix.com>, 2017-10-17 11:54:47 -0700, , support gzipping response size threshold,,
618,30ba9526596fe1f71582602c0feca72df356bb16,ustin Ryan <jryan@netflix.com>, 2017-09-26 13:33:32 -0700, , merge remote tracking branch origin 3.x guice injection,,
619,3b246ff3e9a43f2d258751340cadf70bc9bc820c,udheer Vinukonda <svinukonda@netflix.com>, 2017-09-26 11:22:19 -0700, , rename interface iscold,,
620,acc78f6e28142984cde9cd4862d76db9459da1ba,udheer Vinukonda <svinukonda@netflix.com>, 2017-09-25 11:18:38 -0700, , add interface,,
621,80d98ee2cf4f0f90738ebe3cd923f1f7d6a9e0d0,usheel Aroskar <saroskar@netflix.com>, 2017-09-25 10:34:05 -0700, , remove old filterprocessor machinery,,
622,e85b1e7acfb4387049ddc9d71bceb0dd87e3aed6,aksoras <susheel.aroskar@gmail.com>, 2017-09-19 13:09:59 -0700,361, merge pull request 361 quidryan mockito core consistently use mockito core instead mockito,,
623,4d17b5d96b62879c5cbf6e9747084e70ee1f206a,ustin Ryan <jryan@netflix.com>, 2017-09-19 10:56:38 -0700, , merge branch 3.x guice injection,,
624,ba1a9a7eb56b77fada28d3436363020e8b9e6fc9,ustin Ryan <jryan@netflix.com>, 2017-09-19 10:42:27 -0700, , consistently use mockito core instead mockito,,
625,c3c44716c4089412135204d30f04ca28f55c2233,udheer Vinukonda <svinukonda@netflix.com>, 2017-09-07 13:14:40 -0700, , add access control request header headernames,,
626,e6e68a376505423641e5483afa9f6f51d8153d7f,ustin Ryan <jryan@netflix.com>, 2017-08-31 09:42:53 -0700, , remove attempt fail non deterministic static variable,,
627,c9e7ec91a9ba641e6ea3c503917d65640a1e5f0a,ustin Ryan <jryan@netflix.com>, 2017-08-31 00:35:37 -0700, , convert filterloader injectable maintaining older constructor allow filterfactory provided create leverage guice instantiate filter allow inject work filter use governator unit test runner prove work context guide move provides method broke apart loading class name file test added loading package name used internally,,
628,0b0830e7c02e554c0818b90aff2b3c119ac74cf2,ike Smith <michaels@netflix.com>, 2017-08-25 15:17:07 -0700, , bugfix incorrect parsing uri query string key without value key1 key2,,
629,1a1e6b02d41a792f06cb6e7fec13249add9b885f,aksoras <susheel.aroskar@gmail.com>, 2017-08-16 17:03:21 -0700, , complete static error response body,,
630,ca4a3aa6b39ce7ce71f5f946642f884a75e50849,aksoras <susheel.aroskar@gmail.com>, 2017-06-27 21:30:40 -0700, , fix release http,,
631,bb5ede8fbf7a43631c046ee74e7c7a78aee88667,aksoras <susheel.aroskar@gmail.com>, 2017-06-26 20:20:15 -0700, , write body content refactoring,,
632,7cfaa3c0562a2c1d64ddbe91355225af0e728cbf,aksoras <susheel.aroskar@gmail.com>, 2017-06-22 18:41:29 -0700, , release buffer endpoint,,
633,223c53ac5deb60f0193e984ef73d4aeaa2c19759,aksoras <susheel.aroskar@gmail.com>, 2017-06-21 20:33:05 -0700, , change getbody impl,,
634,16678a0fb40f901a2c307c64d023c26eca825c2c,aksoras <susheel.aroskar@gmail.com>, 2017-06-08 21:20:14 -0700, , get latest eureka client,,
635,5be680d292109bf649d49b479e0ddea42bc1d3ea,aksoras <susheel.aroskar@gmail.com>, 2017-06-05 16:27:59 -0700, , rebase origin,,
636,c8c13f5f5c3e0408a1fd68710a5ef89cdd18a3e4,aksoras <susheel.aroskar@gmail.com>, 2017-06-05 16:11:26 -0700, , rebase 3.x,,
637,b8dd9cc359b5fb47d7d982d5c20a4f150dd85f40,ike Smith <michaels@netflix.com>, 2017-06-03 16:39:18 -0700, , changed interface add additional group parameter,,
638,6bc17bd2d6304236c6b6e9a965176caf98df3a49,aksoras <susheel.aroskar@gmail.com>, 2017-05-31 21:37:22 -0700, , make apply return generic type,,
639,557d32f8cb9075b33be0568f554cf99ee856de24,aksoras <susheel.aroskar@gmail.com>, 2017-05-09 11:09:11 -0700, , suppress long stack trace,,
640,241e21b4f8b982a76aa05b9ab394be9fa32cbddc,aksoras <susheel.aroskar@gmail.com>, 2017-05-03 12:35:47 -0700, , rebase 2.x,,
641,7dd84bac7f772ea5520ec5ab35ec34ad2298853b,aksoras <susheel.aroskar@gmail.com>, 2017-05-03 12:23:45 -0700, , merge branch 2.x github.com netflix zuul 3.x,,
642,159f6514603a7c23a7f9ed9d4a2a1ee26d0b3474,ike Smith <michaels@netflix.com>, 2017-04-11 13:42:58 -0700, , add handling forwarded proto version header,,
643,078fb54ba452bedaab2ccd050bebe9cc26e50fc9,aksoras <susheel.aroskar@gmail.com>, 2017-04-04 11:06:43 -0700, , merge branch 2.x github.com netflix zuul 3.x,,
644,d8ba9299a27afaaf9533172c61539ab7e3e1a306,ike Smith <michaels@netflix.com>, 2017-04-02 16:53:37 -0700, , optimize method use regex,,
645,f64be986d760ce3dfe09850a1c6fb68f4a16ee25,aksoras <susheel.aroskar@gmail.com>, 2017-03-31 15:22:28 -0700, , merge branch 2.x github.com netflix zuul 3.x,,
646,559d49ff9d2c898c3c2bb78c632e9daf12774f6f,aksoras <susheel.aroskar@gmail.com>, 2017-03-31 15:21:55 -0700, , check,,
647,b1f42e3b7cffca6e85162b09a4304b4301502f81,ike Smith <michaels@netflix.com>, 2017-03-26 23:49:38 -0700, , add link header httpheadernames,,
648,bd4eaa79e5467e736af476ee050e44a77cdcb3cc,aksoras <susheel.aroskar@gmail.com>, 2017-01-20 16:13:15 -0800, , norx,,
649,4e746d8d734b862f4d4a6ce1cd0f5ec37bb0b199,gonigberg <agonigberg@netflix.com>, 2017-02-03 11:38:28 -0800, , add tostring method request response impls,,
650,d05700e60938c718e578cf75a427a1966fdf64b4,ike Smith <michaels@netflix.com>, 2017-01-16 17:12:59 -0800, , automatically sethasbody true setting bodystream zuulmessage empty stream,,
651,9b9081c71e69a54c788f6caf78be89e3093881e5,ike Smith <michaels@netflix.com>, 2017-01-16 15:03:24 -0800, , change explicit setting,,
652,aa5ecf1f02b647de6fa1075b13ea8d516c563355,ike Smith <michaels@netflix.com>, 2016-12-06 17:26:44 -0800, , merge branch 2.x github.com netflix zuul 2.x,,
653,0654cf8a9a3ef1d0d5b8f6d59ef7463fa833e948,ike Smith <michaels@netflix.com>, 2016-12-06 17:26:01 -0800, , allow parallel loading groovy filter improve start time lot filter,,
654,2c394104f4cfbb630f13c7e702d661dfba7bbfdd,ike Smith <michaels@netflix.com>, 2016-12-05 17:37:20 -0800, , refactor use new cacheddynamic property class latest release archaius replace custom impl,,
655,9fe542a59c5ddf75bc7486d12e00c987644dcdb0,ikey Cohen <mikeycohen@gmail.com>, 2016-11-16 12:35:46 -0800,280, merge pull request 280 kohenchia 2.x rxjava string depends older version rxjava causing runtime,,
656,b2345bee9f4da348e4b293a7a68b6d23bb5471cf,ohen Chia <kohenc@zillow.com>, 2016-11-07 10:46:38 -0800, , rxjava string depends older version rxjava causing runtime error bumping rxjava string compatible newer rxjava,,
657,0c9124188d9b625ab1d8b5f677cdcd0aa8456b4c,gonigberg <agonigberg@netflix.com>, 2016-10-06 13:22:02 -0700, , add explicit rxjava dependency,,
658,d1e159038b8e6df84e5081fb7f408423d7eb8039,gonigberg <agonigberg@netflix.com>, 2016-10-06 11:55:34 -0700, , update usage,,
659,a56514c19294c8d833d8fa016b728ac9dc191214,ichael Smith <michaels@netflix.com>, 2016-10-03 17:39:49 -0700, , perf optimization method showing hotspot profiling,,
660,7de8ebd82a49945b9001ef0b654154356bb7b4c4,ike Smith <michaels@netflix.com>, 2016-09-29 11:44:27 -0700, , stop cloning sessioncontext copyrequestinfo want share context across inboundrequest,,
661,de48e95587e101ead5f2970256f955f3d2b26594,ike Smith <michaels@netflix.com>, 2016-09-28 12:26:35 -0700, , refactor unit test sample filter extends basefiltertest,,
662,bf7ee04f2cb9f042aaf4dff33934b9448ac44e31,ike Smith <michaels@netflix.com>, 2016-09-28 12:25:57 -0700, , removed old integration test code,,
663,6152ac7ce68bb646144a76836aa0fb1fbf8383f8,ike Smith <michaels@netflix.com>, 2016-09-28 12:25:40 -0700, , changed interface cope request without response,,
664,03d269731c533d853678256181334067b7334c5f,ike Smith <michaels@netflix.com>, 2016-09-21 17:28:52 -0700, , add zuulexception constructor allow avoiding generation stacktraces,,
665,c5e8178ebd3a0005ac29b9a298ee4c8ffdfc5dfa,ichael Smith <michaels@netflix.com>, 2016-09-19 14:36:56 -0700, , updating dependency lock,,
666,cfacc31947864ada1b897dfde8c6bb07adf6c52c,gonigberg <agonigberg@netflix.com>, 2016-09-19 10:25:15 -0700, , add common lang3 explicit dependency,,
667,0a3225505631de992dda69fcc2c59c21d52ee2e1,gonigberg <agonigberg@netflix.com>, 2016-09-16 13:37:13 -0700, , fix potential vulnerability setting header,,
668,297b621093c5ddf1f4a278b5586c6293a17be5a6,ichael Smith <michaels@netflix.com>, 2016-08-22 12:29:28 -0700, , remove used inconsistently,,
669,b13573a5356931b39e712306ba8954e9b875d6f7,ikey Cohen <mikeycohen@gmail.com>, 2016-08-15 10:30:04 -0700,251, merge pull request 251 gzurowski fix constant class prevent instantiation constant utility class,,
670,44c7e22c8df1854e315d771cd899068a444ac047,ikey Cohen <mikeycohen@gmail.com>, 2016-08-15 10:21:46 -0700,252, merge pull request 252 gzurowski fix license header remove duplicate license header,,
671,bb8d35dab7ef8c284734b04d5d4e92b135857161,regor Zurowski <gregor@zurowski.net>, 2016-08-09 00:34:47 +0200, , remove duplicate license header,,
672,83b185845eef92d49847e6ac8103f35e0622fba7,regor Zurowski <gregor@zurowski.net>, 2016-08-08 10:05:36 +0200, , prevent instantiation constant utility class zuul property constant cherry picked commit 5c81764,,
673,16157b0ec170927a1afa968c9cb30936f8a46dbf,regor Zurowski <gregor@zurowski.net>, 2016-08-08 00:17:23 +0200, , prevent instantiation constant utility class zuul header cherry picked commit 23177d5,,
674,b940881adc9e9c370704f26ecf2f23c18d5c932e,gonigberg <agonigberg@netflix.com>, 2016-08-01 18:21:27 -0700, , refactor processing chain allow extensibility show clearer intent,,
675,09740c7798190df3c8308a98790c7c054f7d153d,gonigberg <agonigberg@netflix.com>, 2016-08-01 18:20:39 -0700, , remove netty module,,
676,da30e3252f4880ad6da5b2d007b5a3892693605d,ike Smith <michaels@netflix.com>, 2016-06-10 16:10:09 +1000, , convert nfproxyendpoint groovy java able extend java filter well groovy,,
677,5267d633e4da48350c99ae2f4f1a6f6246dae021,ike Smith <michaels@netflix.com>, 2016-02-18 01:42:03 -0800, , catch throwable instead exception,,
678,a61289a0f01448e09b274de2d8ecde62a6264e0d,itesh Kant <nitesh1706@gmail.com>, 2016-02-01 23:05:31 -0800,205, merge pull request 205 niteshkant 2.x new fix bug snapshot adapter,,
679,dec78fe5f003d6752d8bf383040b6dcaed2da013,itesh Kant <nitesh1706@gmail.com>, 2016-02-01 23:00:54 -0800, , fix bug snapshot adapter scan operator version used use initial value factory made subscriber host stream sharing state instance since rxnetty clone client leading multiple subscription state instance mutated multiple thread fix factory initial state hence eliminating state instance sharing,,
