id,sha,author,date,issue,message,file,content
680,172557f6b901e59ab351c1909836d481d69de91e,olarbizzle <sabaka.dog@gmail.com>, 2016-01-31 08:29:52 -0800,203, merge pull request 203 polarbizzle 2.x fixing bug filter dao enums like filtertype,,
681,65f3036aca600fec62aabc702ac473013168f43c,hrisp <chrisp@netflix.com>, 2016-01-31 08:14:13 -0800, , fixing bug filter dao enums like filtertype store retrieves enums name,,
682,4b01523d9dbbf325b9c474d17a2b884f4a90e9f6,itesh Kant <nitesh1706@gmail.com>, 2016-01-29 15:38:16 -0800,201, merge pull request 201 niteshkant 2.x new upgrading latest rxnetty snapshot,,
683,612e80a32c9be2490fdbedf6fe780134e1681895,itesh Kant <nitesh1706@gmail.com>, 2016-01-29 15:33:44 -0800, , fix test failure since spectator monitor created got reused across test,,
684,1ca655abfcc974cebac6ddfa175f88480a7f2fc2,itesh Kant <nitesh1706@gmail.com>, 2016-01-29 10:43:33 -0800, , upgrading latest rxnetty snapshot,,
685,e0b7ba9ddd5fc50622baa0f296e72b0a44976a24,itesh Kant <nitesh1706@gmail.com>, 2016-01-13 11:30:38 -0800,197, merge pull request 197 niteshkant 2.x new bug fix session cleaned sync filter throw error,,
686,b3978fad60946a16cdf64ef544df105ad491920a,itesh Kant <nitesh1706@gmail.com>, 2016-01-13 10:50:11 -0800, , bug fix session cleaned sync filter throw error sessioncleaner getting called starting first async filter sync filter start chain throw error cleaner getting invoked,,
687,9cbfd45d94c3c1d39146059470f46b7ca568c1df,ike Smith <michaels@netflix.com>, 2015-12-31 14:45:15 -0800, , oops need strip content length request,,
688,9a8ac148ccd180bdb2468b5252d9c7dbe6bc1462,ike Smith <michaels@netflix.com>, 2015-12-31 14:17:15 -0800, , consolidate code adding forwarded header proxyutils make origin use,,
689,f9e8965d29b4322ec5c437156ef1e48195cd7e07,ike Smith <michaels@netflix.com>, 2015-12-31 14:15:24 -0800, , add new common zuul core,,
690,39fedc6a81576f7447fb70372024ec78f20e3077,ike Smith <michaels@netflix.com>, 2015-12-31 12:58:36 -0800, , stop stripping content length header request response default instead leave choice filter also refactored header method use headername abstraction instead string,,
691,6ef2ff0284841a99c982ec88a5f854e08af42daa,ike Smith <michaels@netflix.com>, 2015-12-30 18:32:42 -0800, , make handle null input gracefully,,
692,3d5137b42493c7e5da4ded6ab4243e893ec15764,ike Smith <michaels@netflix.com>, 2015-12-18 12:12:23 -0800, , performance optimization lazy caching expensive ops original inbound instance,,
693,3a0f0ebaaefc9694b61db814436eb25adff62148,ndrew Spyker <aspyker@netflix.com>, 2015-12-11 15:49:44 -0800, , adding ossmetadata netflixoss tracking,,
694,e02677d989cf737469e25007f1890f67752e0073,itesh Kant <nitesh1706@gmail.com>, 2015-12-08 15:39:39 -0800,194, merge pull request 194 iamjarvo travis badge add travis badge,,
695,08fae13d3c3719d826a4ab5fceed2f76cdfe4d42,earvon Dharrie <j.dharrie@gmail.com>, 2015-12-08 14:10:47 -0500, , add travis badge,,
696,83e3297afcd90054d347c40a00209308a9e28d0c,ike Smith <michaels@netflix.com>, 2015-11-25 21:09:56 -0800, , merge branch 2.x http github.com netflix zuul 2.x conflict zuul core src test java com netflix zuul,,
697,1cebb8f16b324dcf3ee00a21fe53f5907c203497,ike Smith <michaels@netflix.com>, 2015-11-25 21:02:14 -0800, , remove duplication unused method,,
698,e675e1420ade95e01734dfd464a96252d8276aa2,ike Smith <michaels@netflix.com>, 2015-11-25 21:02:14 -0800, , remove duplication unused method,,
699,9d2554e41416caf7250793fd89bf094056d0841f,ike Smith <michaels@netflix.com>, 2015-11-25 20:50:08 -0800, , cleanup filterprocessor code removed unused filterprocessor impls refactored remaining reduce duplication method,,
700,53c96879b0bdc401d83ded03989a56162e0c6ce7,ike Smith <michaels@netflix.com>, 2015-11-25 20:29:53 -0800, , add perf comparison impl,,
701,6203c7fca3a17e51dbdbb3a5c2b2196505eb962b,olarbizzle <sabaka.dog@gmail.com>, 2015-11-23 14:12:03 -0800,191, merge pull request 191 tbreitkopf 2.x implemented updated astyanaxcontext method 2.x,,
702,14109077ee7186f67549ec1fa3d2bafc3fcbec0e,om Breitkopf <thomas.j.breitkopf@gmail.com>, 2015-11-21 16:18:58 -0500, , implemented updated astyanaxcontext method,,
703,3c6a8c66de5586e9027ecebd1437a2fe96314cbc,ichael Smith <michaels@netflix.com>, 2015-11-20 18:41:59 -0800, , make frequently used property sessioncontext first class performance optimization,,
704,94f1049bf28a6de0692fba018d3c57f2707f90b9,ichael Smith <michaels@netflix.com>, 2015-11-20 17:59:51 -0800, , bugfix setting initialvalue choosing dynamic property,,
705,2440984d546abe07928ca7a60d7912a1684c4266,ichael Smith <michaels@netflix.com>, 2015-11-20 15:31:08 -0800, , added addcallback method delegate dynamicproperty impl,,
706,21457e9ffb1080fc70305828bf8b81d879404f8d,ichael Smith <michaels@netflix.com>, 2015-11-20 14:30:32 -0800, , switch using new cpu critical code path surprisingly calling quite cpu expensive high throughput,,
707,807f0ea45e812da792ce4f56473cd58f4b7c59bb,ichael Smith <michaels@netflix.com>, 2015-11-20 11:03:38 -0800, , optimised timing class bit made standard zuul timing first class property timing made timing instance first class property sessioncontext,,
708,2ff39f2fb2284ddee3c58a820015d7a2c94761dc,ike Smith <michaels@netflix.com>, 2015-11-18 13:38:52 -0800, , missed previous commit also needed make fix well,,
709,653316c480553701dab206a2575aa53db16b2d8a,ike Smith <michaels@netflix.com>, 2015-11-18 12:53:47 -0800, , merge branch 2.x http github.com netflix zuul 2.x,,
710,6601b429aa0462ebd0809f23345f6487d3ccc921,ike Smith <michaels@netflix.com>, 2015-11-18 12:53:42 -0800, , bugfix error filter ran flag set,,
711,c363bf57b77126598d9a21547a63d34f7e54607c,ike Smith <kerumai@users.noreply.github.com>, 2015-11-17 16:02:46 -0800,187, merge pull request 187 kerumai 2.x new filterprocessor implementation,,
712,563a402f4ad1a0f6fb025c53bdd5a68950ea6917,ichael Smith <michaels@netflix.com>, 2015-11-17 15:50:08 -0800, , removed functionality practice unintuitive use switched instead setting flag sessioncontext checking filter shouldfilter method needed also made one flag brownout mode first class property sessioncontext critical path need throttle reject high load added new interface overridden indicate filter still applied even flag set,,
713,4e5827e7bfac9ed70941a26fb58b957c884b3850,ichael Smith <michaels@netflix.com>, 2015-11-16 15:57:12 -0800, , extracted new interface synczuulfilter using instead concrete basesyncfilter superclass also fixed bug error filter handling,,
714,aca3076036c2b6fb7a692be4ba7a4361c3ef5ec6,ike Smith <michaels@netflix.com>, 2015-11-16 00:08:37 -0800, , temporarily adding method filterprocessor interface testing,,
715,461626695d65f57c0da8018d53fa7b6ec68835fb,ike Smith <michaels@netflix.com>, 2015-11-13 21:19:26 -0800, , add enum filtersynctype added interface made use instead requiring sync filter subclass basesyncfilter,,
716,9a02a94be56b769713ff1e7485c493eed431a8e3,ike Smith <michaels@netflix.com>, 2015-11-13 21:11:36 -0800, , tired comparing string changed enum filtertype,,
717,1391276561ce4c1d35a1e721f9d319dedf8c9c1c,ike Smith <michaels@netflix.com>, 2015-11-13 19:50:16 -0800, , got filterprocessor test working,,
718,a1f468a16ede03c55478cd632a0879cd5a51db60,ichael Smith <michaels@netflix.com>, 2015-11-13 16:57:55 -0800, , work new filterprocessor impl,,
719,897c4a1e2774fdd1f0b26e7ca213aa93b12bccda,ike Smith <michaels@netflix.com>, 2015-11-12 00:33:23 -0800, , refactor use new method,,
720,6d3f40f307587f58c3d9d9640a186cac3ca3dd6f,ike Smith <michaels@netflix.com>, 2015-11-11 23:56:37 -0800, , bugfixes recent refactorings changed take arg boolean instead func1,,
721,738144afeb83c3c5fda1caf3d8e64a616fdbe3a3,ike Smith <michaels@netflix.com>, 2015-11-11 22:49:52 -0800, , merge remote tracking branch upstream 2.x 2.x also added new method zuulfilter interface replace logic filterprocessor choosing fallback output errored filter conflict zuul core src test java com netflix zuul,,
722,88431f2a10f42f0cf90fd0c840119d7d0625dbe5,ike Smith <michaels@netflix.com>, 2015-11-11 21:58:19 -0800, , added another experimental filterprocessor impl refactored mock unit test,,
723,aae9f937a4877eda8f45cd6979e5979e6ce1f1f1,itesh Kant <nitesh1706@gmail.com>, 2015-11-09 11:03:48 -0800,184, merge pull request 184 niteshkant 2.x new adding callback retries,,
724,f10f94860a8e1a0bbb096bd939866fc9c8edd087,itesh Kant <nkant@netflix.com>, 2015-11-09 10:55:20 -0800, , adding callback retries new method .dobeforeretry added retrypolicy get callback retry done typically count number retries,,
725,6cf2921231049a396996d41227b8281ef9a7c61d,ike Smith <michaels@netflix.com>, 2015-11-07 20:12:19 -0800, , bugfix filterprocessor error handling endpoint filter threw exception error filter also threw exception request instead response object passed along outbound filter caused also improved unit test around,,
726,035da015d2fa289f91afed56e515786365f03165,ike Smith <michaels@netflix.com>, 2015-11-03 00:36:19 -0800, , experiment collapsing sync filter filterprocessor,,
727,079e9de92ff9bc596aae4e04cb97abdac1d39ba3,itesh Kant <nitesh1706@gmail.com>, 2015-11-02 11:35:01 -0800,183, merge pull request 183 niteshkant 2.x new zuul request handler fix,,
728,a38764f95ec997ee6c5c2cf2c9e4e1fe500f20be,itesh Kant <nkant@netflix.com>, 2015-11-02 11:33:20 -0800, , zuul request handler fix request handler returning zuulmessage instead void,,
729,62b91bc9e6be0ae8d4c137172981ce372b79201d,itesh Kant <nitesh1706@gmail.com>, 2015-10-29 22:17:03 -0700,181, merge pull request 181 niteshkant 2.x new http client metric fix,,
730,5a15ed65653fffb3ca8be4a6b4502cff1a0b7431,itesh Kant <nkant@netflix.com>, 2015-10-29 22:15:01 -0700, , http client metric fix name metric wrong hostsinpool decrement instead increment,,
731,5875286cdd57f7935deb5aa8ab2ef4be877e2a53,ichael Smith <michaels@netflix.com>, 2015-10-29 19:03:42 -0700, , added class used perf testing filterprocessor,,
732,0625c7272431516a744a190c31275b581d40f413,ichael Smith <michaels@netflix.com>, 2015-10-29 19:03:11 -0700, , fixed bug case error endpoint ran throw error seeing happened also added specific test case moved filterprocessor unit test class test directory,,
733,70df749340d3e652ffac62633da94f06d373180d,itesh Kant <nitesh1706@gmail.com>, 2015-10-29 14:07:26 -0700,180, merge pull request 180 niteshkant 2.x new fixing buffer leak body buffering,,
734,86d1cb521505f7ed633e62bab1b33659de812dd7,itesh Kant <nkant@netflix.com>, 2015-10-29 14:01:51 -0700, , fixing buffer leak body buffering,,
735,ed45b65c08370c5cf9d1f49e8d3519f3d3e3c1a0,itesh Kant <nitesh1706@gmail.com>, 2015-10-28 22:51:39 -0700,179, merge pull request 179 niteshkant 2.x new reverting change 2.x,,
736,2448e6a8a09f3a1066c9e26ed0eb616852bb5310,itesh Kant <nkant@netflix.com>, 2015-10-28 22:41:40 -0700, , updating netty module netty 0.5.x,,
737,2be96e6a69fe6c79ca6ccfaeaf0f220cd538efff,olarbizzle <sabaka.dog@gmail.com>, 2015-09-18 12:01:40 -0700,162, merge pull request 162 polarbizzle 2.x added isavailable,,
738,b29c4583298a760dba9f7f07992bfd67d3ab26a6,hrisp <chrisp@netflix.com>, 2015-09-18 11:48:50 -0700, , added isavailable allows check sending request see anything available respond given origin,,
739,4eaa8091721a55d15b89c76b86ad4381273df7cf,itesh Kant <nitesh1706@gmail.com>, 2015-09-10 17:15:09 -0700,159, merge pull request 159 rspieldenner 2xtravis 2xtravis,,
740,3251b15f2b2d47adafbc14f07bbeaff6da018db8,ob Spieldenner <rob.spieldenner@gmail.com>, 2015-09-10 13:24:04 -0700, , move gradle 2.6 3.0.0,,
741,b3a7903691219a59f9dad2326b012e35612c0b94,ob Spieldenner <rob.spieldenner@gmail.com>, 2015-09-10 13:03:01 -0700, , setup key travis build,,
742,90e4e9bbedbdb70d1f71ad21487e36bf2ede1a39,itesh Kant <nitesh1706@gmail.com>, 2015-09-04 16:49:55 -0700,154, merge pull request 154 niteshkant 2.x 2.x setting travis,,
743,186761d3789446b680bf8eb6c24a5492ffbdc9f9,itesh Kant <nkant@netflix.com>, 2015-09-04 16:47:14 -0700, , merge branch 2.x http github.com netflix zuul 2.x,,
744,775d807690fc6810acb855ac64ff9ae3ebffb972,itesh Kant <nkant@netflix.com>, 2015-09-04 16:46:59 -0700, , 2.x setting travis,,
745,603048c5502255ffccb9387ce7ef2f283e161053,ichael Smith <michaels@netflix.com>, 2015-09-03 15:52:19 -0700, , fix make log forwarded header present,,
746,82af26593b62fcb78844affea2d42ebadd7f0346,ichael Smith <michaels@netflix.com>, 2015-09-03 15:19:27 -0700, , made handling reading request body configurable either log continue empty body respond 400 status error client,,
747,976835aa79083943ed1d40fc597d0dc008c3a08c,ichael Smith <michaels@netflix.com>, 2015-09-01 16:57:11 -0700, , added method,,
748,d8b9c93243a891c864cf5bcb2013014d9272b14c,ichael Smith <michaels@netflix.com>, 2015-09-01 12:52:11 -0700, , revert removed unnecessary call reverts commit,,
749,721ea14d566bda74a94fdcff5555f8666fb631d4,ike Smith <michaels@netflix.com>, 2015-08-28 18:59:54 -0700, , changed tack cookiecleaner switched clean cookie header parsing therefore doe modify request header proxied onwards,,
750,83ec33f04015796ff0b285498e37fea5c45d24d4,ike Smith <michaels@netflix.com>, 2015-08-28 18:42:20 -0700, , bugfix header name case sensitivity cookiecleaner,,
751,f0b67b09c252f0eb6a6a96d2c6cc33a8d7377d09,ike Smith <michaels@netflix.com>, 2015-08-28 18:24:51 -0700, , added configurable mechism strip bad text inbound request cookie header,,
752,457877124764b0e40b52c1e1e53380ca37ecb19f,ike Smith <michaels@netflix.com>, 2015-08-28 13:49:20 -0700, , stop stripping server header response origin overwrite zuul filter want use server header origin rather removing default,,
753,9c5a33004463b9de6301d4892e6df01f066f06c6,ike Smith <michaels@netflix.com>, 2015-08-28 10:58:59 -0700, , merge branch 2.x github.com netflix zuul 2.x,,
754,49be63d83804f1b4bd6492241e56044df67c0c4f,ike Smith <michaels@netflix.com>, 2015-08-28 10:58:49 -0700, , changed manually reconstruct uri using string concatenation instead using java.net.uri uri class failing illegal character host header receive,,
755,0b1f6ca1c60bbcb13a2a6fa0c2f205e55975aa87,ichael Smith <michaels@netflix.com>, 2015-08-26 17:35:54 -0700, , change report millis instead nanos,,
756,7e27f1081ad0b61731c5e5e54beb3a9b0a45cd57,ichael Smith <michaels@netflix.com>, 2015-08-26 17:30:53 -0700, , bugfix timing class switched using nanosecond missed one place needed change,,
757,ec2c17558f99ea60ab68e8f2f5b253806986a6d8,ichael Smith <michaels@netflix.com>, 2015-08-26 14:55:16 -0700, , found stray subcribe removed remove isbodybuffered conditional well,,
758,b9bdd890a25a6b7d1084a1666ce329e79955c431,ichael Smith <michaels@netflix.com>, 2015-08-26 14:02:51 -0700, , bugfix filterprocessor constructor setting default usagenotifier null rather null,,
759,5b117faa79494ac405c52117aa0f809ac3f9adf1,ichael Smith <michaels@netflix.com>, 2015-08-26 13:47:28 -0700, , bugfix running filter finished processing changed run filter ran,,
760,d95bbac9024b86082e75655cf5ba9891970f7556,ichael Smith <michaels@netflix.com>, 2015-08-24 19:19:34 -0700, , response body already buffered byte array flush directly servlet outputstream,,
761,7318cd450d02e442eece2cb317316d38a2092715,ichael Smith <michaels@netflix.com>, 2015-08-24 13:29:12 -0700, , gave finally added staticresponse attribute sessioncontext inbound filter generate response filterprocessor use staticresponse instead running endpoint filter set,,
762,2bba8a88b175bbe5080178e57af29b68e099847c,ichael Smith <michaels@netflix.com>, 2015-08-24 11:56:53 -0700, , changed filterpriority enum int easier extend available value without make code change zuul core added new flag set filter want reject request run subsequent filter mostly throttling protection purpose,,
763,0674ed699b5d71a653fa3f802e79307510458915,ike Smith <michaels@netflix.com>, 2015-08-22 17:31:58 -0700, , removed unnecessary call,,
764,27b066450a6cb98c896277e370562ffdf004ad47,ike Smith <michaels@netflix.com>, 2015-08-22 17:23:47 -0700, , changed basefilter default priority high instead normal thats intuitive default,,
765,e64f52b5f7245360bf85f98ac304b328acbe3f15,ike Smith <michaels@netflix.com>, 2015-08-22 15:49:43 -0700, , added common header httpheadernames,,
766,880006f8c07fc9f8a05f7903a9a208f8824e20ca,ike Smith <michaels@netflix.com>, 2015-08-06 01:22:41 -0700, , perf optimization,,
767,b421f325b20fd20cdc5f04574f4332be3cf90398,ike Smith <michaels@netflix.com>, 2015-08-06 01:18:11 -0700, , changed cache first usage added reparsecookies method allow forcibly replacing cached cooky,,
768,7564f563caa4961805d659aef37946f6f237e545,ike Smith <michaels@netflix.com>, 2015-08-06 00:57:34 -0700, , moved filterpriority attribute sessioncontext full member rather entry map shown perf hotspot,,
769,9581d9ff899ae1f4e3790009c08b8adbe6e4551e,ike Smith <michaels@netflix.com>, 2015-08-05 18:10:48 -0700, , added cors header cache,,
770,6e026f2c994cc199b4b863d4bd0998a3954a39ea,ike Smith <michaels@netflix.com>, 2015-08-05 18:03:27 -0700, , added common http header name cache,,
771,9faef7bed677b06c28233d83675cafa0ef43320f,ike Smith <michaels@netflix.com>, 2015-08-05 16:59:57 -0700, , changed headers.keyset return set headername instead set string,,
772,487a3f1f75310743808175eee5b8cccc7f09baf6,ike Smith <michaels@netflix.com>, 2015-08-05 16:25:43 -0700, , added common http header constant,,
773,3d1ed9f05db9c83df3e924e08f309c12adabe39b,ike Smith <michaels@netflix.com>, 2015-08-05 16:19:37 -0700, , made sessioncontext initialsize configurable,,
774,f1ea8ddc0f8af8ea476a0a2d71fdf2420f3f0ada,ike Smith <michaels@netflix.com>, 2015-08-05 16:04:14 -0700, , added warn log statement constructed request object doe stored inboundrequest,,
775,af8916c5ef01840f44a416f7cf588b00e64c3e6f,ike Smith <michaels@netflix.com>, 2015-08-05 16:02:40 -0700, , made headername class configurably intern name string use equal,,
776,d5e54eb15df07a19b248acf5eccef05996bed0e7,ike Smith <michaels@netflix.com>, 2015-08-05 16:01:37 -0700, , change header class use httpheadernames cache rather instanciating headername instance directly,,
777,f067b7dfed65b4625d88d71f4d66003ef28bac6f,ike Smith <michaels@netflix.com>, 2015-08-05 13:47:42 -0700, , increase initial capacity sessioncontext map reduce resize perf cost,,
778,4dd944db59b0a82e7432c25822231e4a83296e77,ike Smith <michaels@netflix.com>, 2015-08-05 13:47:03 -0700, , perf optimization around header name reduce cost case insensitive string comparison added variant method header class allow using headername instead string created cache headernames already populated common http header name need start changing filter use headername cache instead string,,
779,54a834b8c69d5f75e2e401220959360c86e817e4,ike Smith <michaels@netflix.com>, 2015-08-05 00:18:19 -0700, , handle null,,
780,874ae0dfba990b1c5726fcd17330f6d40a0a97a5,ichael Smith <michaels@netflix.com>, 2015-08-03 18:43:03 -0700, , bugfix missed assigning new sessioncleaner constructor,,
781,b29bfaf779a2f48299485e8ec40a5885ab64352d,ichael Smith <michaels@netflix.com>, 2015-08-03 12:59:02 -0700, , consolidated zuulservlet class single introduced sessioncleaner interface used cleanup release resource related outbound origin request end processing,,
782,7de3d4c64cca9658c59b8cc7c91e9f4a8cbe4440,ike Smith <michaels@netflix.com>, 2015-08-01 15:32:14 -0700, , regenerated global dependency lock upped version jetty 9.3.1 zuul jetty sample,,
783,68a71d62b8a34b3e4a2d8dda159a270c4d0021a5,ike Smith <michaels@netflix.com>, 2015-08-01 15:30:07 -0700, , added explicit dependecy netty code http zuul core removed unused dependency turbine turn dependent older netty version,,
784,a1797d9a7bd076610690d4899fb68b849b1cb943,ike Smith <michaels@netflix.com>, 2015-08-01 15:28:51 -0700, , fix failing parse cooky whitespace value switched lax parsing option,,
785,4ada500d4e5a009adcabef4255c820bb674de68f,ichael Smith <michaels@netflix.com>, 2015-07-30 17:40:21 -0700, , bugfix ribbonorigin response body,,
786,aa55f6ae1f8b6ce1095585f0ef793eae949bc83f,ichael Smith <michaels@netflix.com>, 2015-07-30 14:31:11 -0700, , merge branch 2.x github.com netflix zuul 2.x,,
787,d9d5cbd9b52a2145eff420f8f8c42418b3c9a13d,ichael Smith <michaels@netflix.com>, 2015-07-30 14:30:51 -0700, , bugfix filterprocessor sending error response,,
788,85c939a725fb05fa1864def796d4a86fa80bbabd,ike Smith <michaels@netflix.com>, 2015-07-29 20:25:50 -0700, , copy x509 cert servletrequest attribute sessioncontext,,
789,7365b961f01d5b9b5eb77304daccba76ffd47334,ike Smith <michaels@netflix.com>, 2015-07-29 13:49:30 -0700, , changed header impl stop lower casing header name still compare case insensitively added header headername class encapsulate logic changed headers.entries method return collection header,,
790,fb9419efe87f1fe97671be788a1a8487b9a0b5c4,ike Smith <michaels@netflix.com>, 2015-07-29 12:33:10 -0700, , added test header class,,
791,6b5c84dff4faae6309a88d8b330bd131c6a88861,ike Smith <michaels@netflix.com>, 2015-07-28 23:42:46 -0700, , bugfix using instead addheader,,
792,f28c13a08c23c6043baa9e3d49e84632e27c98ec,ike Smith <michaels@netflix.com>, 2015-07-28 23:38:15 -0700, , added variation,,
793,98eb81b511acddda912647fdc34c61ad3b950669,ichael Smith <michaels@netflix.com>, 2015-07-28 14:52:28 -0700, , added method,,
794,225dd83cb5a4c527e4dfdb6a09b378fc571d9434,ike Smith <michaels@netflix.com>, 2015-07-21 23:28:20 -0700, , added contains method httpqueryparams,,
795,673403360ec044a4d8d582ced571067d01be3cf7,ike Smith <michaels@netflix.com>, 2015-07-19 17:33:11 -0700, , fixed bug observable handling around debug logging message body,,
796,33abc79be44d22cfcc4bfb2e0a6e294497a3d51d,ike Smith <michaels@netflix.com>, 2015-07-19 16:14:24 -0700, , added new uuid attribute sessioncontext started writing debug statement tie together log easily,,
797,9a507ec419d690fafb84d09ebf22a603cacbc341,ike Smith <michaels@netflix.com>, 2015-07-19 15:07:42 -0700, , fix improvement debug class usage,,
798,24bfb29239fac0d95deee72880fc0b0e8074d072,ike Smith <michaels@netflix.com>, 2015-07-19 15:07:11 -0700, , noticed gradle build running groovy unit test added,,
799,efa1830db74d3d28d82ebdec36707a5826c50271,ike Smith <michaels@netflix.com>, 2015-07-19 13:22:39 -0700, , added missing debug logging response body nfproxyendpoint bugfix zuulhostrequest,,
800,4019f6dafc3afe6e8770abfb8d17c469f664db58,ike Smith <michaels@netflix.com>, 2015-07-17 17:09:07 -0700, , allow null value header attempted assume mean remove existing header name,,
801,220eb501a8953f1001dc431c0703034e2319e7d3,ike Smith <michaels@netflix.com>, 2015-07-17 16:31:38 -0700, , moved parsecookies httprequestinfo,,
802,838d49183841e7a09bfa3f0ed26d6022017d8dc0,ike Smith <michaels@netflix.com>, 2015-07-17 16:20:32 -0700, , refactored message related class new package,,
803,85e51d3d17471535459ce15635323d578bf3a950,ike Smith <michaels@netflix.com>, 2015-07-17 16:16:57 -0700, , made copy header httpqueryparams object held immutable copy httprequestinfo backed immutable copy underlying multimaps,,
804,902acc10209419b3ecfcf89aa0e0481bfacf129a,ike Smith <michaels@netflix.com>, 2015-07-17 14:02:57 -0700, , replaced method first immutable httprequestinfo originallly received request 2nd mutable,,
805,27ffccaf61fdaccab01ed18be1be842a815961c7,ike Smith <michaels@netflix.com>, 2015-07-17 13:15:59 -0700, , renamed method inboundrequest inboundresponse refactored interface like done httprequestinfo changed class hierarchy match request,,
806,53244e6980f8e804912657fb500680688c2b2bbc,ike Smith <michaels@netflix.com>, 2015-07-16 01:13:29 -0700, , combined httprequestinfo class class hierarchy created separate interface implementation,,
807,f7e496aa7ee59f84d13d19989460ae08ec803251,ike Smith <michaels@netflix.com>, 2015-07-15 12:09:08 -0700, , exclude keep alive proxied response header,,
808,d1a5e3e916341c421693f8ba20c1d93e4847626c,ike Smith <michaels@netflix.com>, 2015-07-10 16:55:46 -0700, , added,,
809,40c9f8361ea10287ad3775eddbbfcc13cdd14296,ike Smith <michaels@netflix.com>, 2015-07-10 12:02:49 -0700, , changed error handling sockettimeout reading request body use instead doonerror error handler notified,,
810,ded4f3633516762b503d4807f5f3f183705863bb,ichael Smith <michaels@netflix.com>, 2015-07-09 17:51:53 -0700, , added,,
811,490ae283fceedae0d444a6a01f0d110dcb3453f2,ichael Smith <michaels@netflix.com>, 2015-07-09 16:50:16 -0700, , fixed erroring body null,,
812,33489f41bb4ae17168133935baaf5dc88dcaaf6a,ike Smith <michaels@netflix.com>, 2015-07-08 18:42:39 -0700, , added updating content length header gzip filter,,
813,79ae0713a88cb42a5b9f131028d116538e6db2c5,ike Smith <michaels@netflix.com>, 2015-07-08 15:28:02 -0700, , improvement handling sockettimout reading servlet request body flag proxy add specific error cause 400 status code,,
814,356cd5a0f39338c5f8dbbdf9b19d836df8918608,ike Smith <michaels@netflix.com>, 2015-07-08 14:34:13 -0700, , fixing incorrect placing error handling code sockettimeout reading servlet request inputstream,,
815,22f1758b868dbb69ce7ed97e88e3d43e23782292,ichael Smith <michaels@netflix.com>, 2015-07-07 18:45:30 -0700, , commenting test yet used jetty code,,
816,67b8899db3587aaf7fb7c90873d02156a3f055c6,ichael Smith <michaels@netflix.com>, 2015-07-07 18:45:00 -0700, , added method,,
817,e6014a9596fcc1801f83546f47635a6259c6e6aa,ichael Smith <michaels@netflix.com>, 2015-07-06 17:40:06 -0700, , storing original response info like already request,,
818,2693aba067f97cc4a6e31f20a5ed26ca9e2323d4,ichael Smith <michaels@netflix.com>, 2015-07-06 15:54:22 -0700, , bugfix filterprocessor casting msg either httprequest httpresponse,,
819,ad2ef6a413d1ee41fa2723d9f70365ae3aeee499,ichael Smith <michaels@netflix.com>, 2015-07-06 11:15:56 -0700, , fix bug handling port specified host header,,
820,ad88522cf642e86edf9111dc1bb267bf04a20da4,ichael Smith <michaels@netflix.com>, 2015-07-06 10:01:15 -0700, , block startup error compiling groovy filter,,
