id,sha,author,date,issue,message,file,content
0,8217d359e077c2f73c4596e0e7c4445b2bab9401,arl Mastrangelo <carl-mastrangelo@users.noreply.github.com>, 2021-06-03 10:01:19 -0700, , core make session context final,,
1,849a3880037a6f8018d9ace5393c7168be654c0c,ose Fernandez <me@jrfernandez.com>, 2021-05-26 14:17:04 -0700,1060, merge pull request 1060 jfernandez jfernandez duplicate host header block request multiple host header,,
2,72bce0d0d141659a11f535b6ee3f903e6954ec3b,ose Fernandez <josef@netflix.com>, 2021-05-26 13:18:04 -0700, , change error wording duplicate multiple,,
3,7f14d75153bf4fd53730327c74a5917eeccd4a86,arl Mastrangelo <carl-mastrangelo@users.noreply.github.com>, 2021-05-24 09:48:43 -0700, , core update perfmark 0.24.0 1070,,
4,2649852db7ece3038d02388b4ca458b80cc81d87,ashish Mittal <52948762+kashish9034z@users.noreply.github.com>, 2021-05-22 10:51:32 +0530,1068, updating log4j property file zuul sample 1068,,
5,94cb5bcaf6086b342506dfd0cf9d62460620b118,arl Mastrangelo <carl-mastrangelo@users.noreply.github.com>, 2021-05-21 11:02:36 -0700, , core add doc test originname,,
6,56fa76181776dbd320ce47e1f6606d6d4befab37,arl Mastrangelo <carl-mastrangelo@users.noreply.github.com>, 2021-05-20 16:33:00 -0700, , zuul core add overload originname trust,,
7,e22dc37d351db1da4562fd6ed71892224a18afb4,rgha C <971473+argha-c@users.noreply.github.com>, 2021-05-12 12:46:24 -0700, , add basic builder request message 1056,,
8,c1b0b5f9b7a96b56c2e4ea8cca5e517f42e49188,ose Fernandez <josef@netflix.com>, 2021-05-12 11:17:44 -0700, , remove redundant,,
9,236bf03544b5d1d74866e08811b9cc5897df8d4b,ose Fernandez <josef@netflix.com>, 2021-05-12 10:50:34 -0700, , block request duplicate host header,,
10,3f8e4ee545cd0c1752aab99fda2af34af16a2d65,arl Mastrangelo <carl-mastrangelo@users.noreply.github.com>, 2021-05-11 12:03:12 -0700, , zuul core add ability create trusted origin name authority 1055,,
11,2ca73f056cc283ffef37fbd37478a5a94e255e27,rgha C <971473+argha-c@users.noreply.github.com>, 2021-04-29 10:53:33 -0700, , begin 2.3.1 snapshot 1052,,
12,530adfb6ed323f54bd122e0d3da0d4d60ba66070,arl Mastrangelo <carl-mastrangelo@users.noreply.github.com>, 2021-04-20 14:03:40 -0700, , zuul guice update guice 1050 needed run later jdks better maintained classfile generator reading api compatible guice 4.2,,
13,f7e1e88068197549895bacba0dd3f06c1db08273,rthur Gonigberg <agonigberg@netflix.com>, 2021-04-15 14:52:49 -0700,1049, merge pull request 1049 netflix fixnpeproxyedpt fix potential npe proxyendpoint,,
14,1ce5cb03331b3c5700f0a61b8bf35b9dd481d39b,rthur Gonigberg <artgon@gmail.com>, 2021-04-15 14:42:17 -0700, , try different approach fix null chosenserver,,
15,941a79b13b822f909e038b288094cde59f9ecc80,rthur Gonigberg <artgon@gmail.com>, 2021-04-15 14:12:03 -0700, , fix npe,,
16,d08b812dca63568dee6c992fec7616b268184de1,rgha C <971473+argha-c@users.noreply.github.com>, 2021-04-15 10:58:21 -0700, , test completion event reason 1047 test completion event reason,,
17,8e99f226cc0def48efa21b3d0ebad38b62829d23,rgha-c <007.argha@gmail.com>, 2021-04-15 10:30:27 -0700, , defer localaddress since bind rely,,
18,9b090bc200a9836a83e28d946e413bb58dfb096b,ean C. Sullivan <github@seansullivan.com>, 2021-04-14 11:54:57 -0700, , downgrade logging change log.warn log.debug motivation observed large number warn message production log message occurs frequently received complete event still handling request reason close,,
19,de3a03b39e48462c87068d045c3a52e6a6031ea3,rgha-c <007.argha@gmail.com>, 2021-04-13 18:50:15 -0700, , remove unnecessary event propagation,,
20,6b36e092f6d6d9fd5f50a6c62efc121289a66ca0,rgha-c <007.argha@gmail.com>, 2021-04-13 15:11:34 -0700, , set statuscategory explicitly http pipelining,,
21,941711a234ab77c34b1e5bb01de69ea237124df8,rthur Gonigberg <agonigberg@netflix.com>, 2021-04-13 13:21:15 -0700,1031, merge pull request 1031 netflix simplify timeouts simplify read timeout functionality move using duration,,
22,79301afd83730ea38026a601ec168e892f1df845,arl Mastrangelo <carl-mastrangelo@users.noreply.github.com>, 2021-04-09 16:48:18 -0700, , revert zuul guice use later guice doesnt need aop work around 1042 reverts commit,,
23,9102c930641baccd9e6ace901e653b1ba30add70,arl Mastrangelo <carl-mastrangelo@users.noreply.github.com>, 2021-04-09 16:10:47 -0700, , zuul guice use later guice doesnt need aop work around,,
24,8825757c84c7ad95edf35b9b7449f7ec4bf4def2,ependabot[bot] <49699333+dependabot[bot]@users.noreply.github.com>, 2021-04-07 13:41:48 -0700, , build deps bump action cache v2.1.4 1011 bump action cache http github.com action cache v2.1.4 release note http github.com action cache release commits http github.com action cache compare ... signed dependabot bot support github.com authored dependabot bot 49699333 dependabot bot,,
25,dc4d229bce5ce25d9619f31d40c78f48bf5d5dd5,rgha-c <007.argha@gmail.com>, 2021-04-07 12:01:04 -0700, , cleanup star import,,
26,5b78ee28d8584e7c4e80d75b82791189a3381a4b,ependabot[bot] <49699333+dependabot[bot]@users.noreply.github.com>, 2021-04-07 09:22:30 -0700, , build deps bump action setup java 1039 build deps bump action setup java bump action setup java http github.com action setup java release note http github.com action setup java release commits http github.com action setup java compare ... signed dependabot bot support github.com fix include required field authored dependabot bot 49699333 dependabot bot authored carl mastrangelo cmastrangelo netflix.com,,
27,a0cf67dcabfe7021ccc9c6431e017783c61a02a0,ullis <github@seansullivan.com>, 2021-04-07 09:13:34 -0700, , chore enable gradle wrapper validation release.yml 1025 http blog.gradle.org gradle wrapper checksum verification github action,,
28,53aa752a1da29790ba177263ea45d53310e91be9,arl Mastrangelo <carl-mastrangelo@users.noreply.github.com>, 2021-04-01 11:50:30 -0700, , update netty 4.1.63,,
29,2e31fab9814080fa1408c8196cfdd23cfebc0f23,arl Mastrangelo <carl-mastrangelo@users.noreply.github.com>, 2021-03-31 10:05:55 -0700, , update netty 4.1.62 1036,,
30,967a7fa2c896d89b2df4223b9d9d1698d82b2668,rthur Gonigberg <agonigberg@netflix.com>, 2021-03-23 18:21:37 -0700,1032, merge pull request 1032 netflix downgrade log downgrade noisy logging,,
31,1b328f211ff2ef8db3b44564ee402231480d90b0,rthur Gonigberg <artgon@gmail.com>, 2021-03-23 18:17:09 -0700, , downgrade noise logging,,
32,489765350ccdd58b0719be1652368c736dae5769,rthur Gonigberg <artgon@gmail.com>, 2021-03-23 13:45:24 -0700, , fix test typo,,
33,f71b274f8757a30db06264cc9225be2bd7becb38,rthur Gonigberg <artgon@gmail.com>, 2021-03-23 10:45:10 -0700, , add license,,
34,269c9af2e087cbc97f6ad1a18ca6ba3bdbbff1db,rthur Gonigberg <artgon@gmail.com>, 2021-03-23 10:31:01 -0700, , fix timeout computation logic add test,,
35,f58d10bf86c34aab83d30af65017ec4ec4b27e86,rthur Gonigberg <artgon@gmail.com>, 2021-03-23 09:58:43 -0700, , add comment clean method signature,,
36,023b30f6961b7ca5a7cc2c846d739be6e96944d1,oberto Perez Alcolea <rperezalcolea@netflix.com>, 2021-03-22 20:55:06 -0700, , replace jcenter mavencentral 1030,,
37,46ffcb6aa9024f76faf57ae6d25c05f7cb8a68c2,rthur Gonigberg <artgon@gmail.com>, 2021-03-22 18:35:26 -0700, , simplify read timeout functionality move using duration,,
38,a505245a36d0b4308e457f762d41899ede5ae2c3,rgha-c <007.argha@gmail.com>, 2021-03-16 15:12:24 -0700, , instanceinfo sot secure port advertisement,,
39,042680eff6efc51244d3b5d93d2f2982a51243aa,rthur Gonigberg <agonigberg@netflix.com>, 2021-03-12 16:46:42 -0800,1012, merge pull request 1012 netflix timeout refactor abstract origin timeout logic,,
40,fd331add04b47e6c26bd56ed761b214b70d59d3f,rthur Gonigberg <artgon@gmail.com>, 2021-03-12 13:51:57 -0800, , revert dep downgrade,,
41,0e818fbe3c0381827aa1dd01a4de13c55682a41a,rgha-c <007.argha@gmail.com>, 2021-03-10 15:43:09 -0800, , test bug fix server ref update conn. acquire,,
42,62878797cbab4ff4ca0fdc2884f7e7a85c081643,rgha-c <007.argha@gmail.com>, 2021-03-10 13:37:30 -0800, , test discoveryresult ipaddr equality,,
43,d04ba095882a5182dbc67ace849f0a39e1ecd6dc,rgha-c <007.argha@gmail.com>, 2021-03-10 10:29:05 -0800, , add todo avoid string interpolation,,
44,38fed77875e8e68defad57b22c831d8c38cc0824,rthur Gonigberg <artgon@gmail.com>, 2021-03-09 15:15:53 -0800, , remove ribbon dep downgrade deps,,
45,74bd73d56d10917ca55882f1788656c0842ceea5,rthur Gonigberg <artgon@gmail.com>, 2021-03-05 10:36:15 -0800, , null check,,
46,6f22bd5ac9c102a1f32ff0dbc559b7395676f689,rthur Gonigberg <artgon@gmail.com>, 2021-03-04 13:50:33 -0800, , add license,,
47,803f9bcf11b8de3c011717e28a166d367f0838f1,rthur Gonigberg <artgon@gmail.com>, 2021-03-04 13:42:38 -0800, , abstract origin timeout logic,,
48,9776b8556f915aa4372dc62ec0f30849f0d976ea,rgha-c <007.argha@gmail.com>, 2021-03-08 15:02:28 -0800, , add basic test,,
49,3851d6310da01e57b6daa21bf889bbd625921df1,rgha-c <007.argha@gmail.com>, 2021-03-08 14:37:33 -0800, , force stats use per server cache,,
50,1a47cc08389aed1e37ade4a19a1f4610eabe716a,rgha-c <007.argha@gmail.com>, 2021-03-06 11:34:53 -0800, , fix bug updating server ref origin connect failure,,
51,494d79fa40ca140fbbd92f2c22cec8ae32dc5f0f,rgha-c <007.argha@gmail.com>, 2021-03-05 19:46:57 -0800, , check sentinel value origin server resolved,,
52,1b4257c81006b6fa1a0dc17ad691cf5a590bbc67,rgha-c <007.argha@gmail.com>, 2021-03-05 18:58:51 -0800, , add sentinel value empty discovery result,,
53,d1df10b2c374757123b8f2c843691532d4764be7,rgha-c <007.argha@gmail.com>, 2021-03-05 16:07:17 -0800, , defensive check host port,,
54,0c7491c2d0fa91a500f65823267389d9746fbb1f,rgha-c <007.argha@gmail.com>, 2021-03-05 15:27:09 -0800, , delegate object hashcode,,
55,3acc68fd3662ab46e0683001a9abdcbb62d52e2a,rgha-c <007.argha@gmail.com>, 2021-03-05 12:00:27 -0800, , allow resolver injection pluggable,,
56,d929953d619f790c9167afc06378bf47d4ca96e9,rgha-c <007.argha@gmail.com>, 2021-03-04 17:04:55 -0800, , expose server read access,,
57,f3d62652571239d238d9f5d78a8374a884639b00,rgha-c <007.argha@gmail.com>, 2021-03-02 09:50:48 -0800, , incorporate feedback add validation hostname port,,
58,c6d1484dfcc86beab6ab7a4b669a6a1784462184,rgha-c <007.argha@gmail.com>, 2021-03-01 12:22:53 -0800, , add license header,,
59,75801533b9a839432ca5fb3ed98a9807e26282dc,rgha-c <007.argha@gmail.com>, 2021-03-01 11:01:41 -0800, , refine resolver result add test,,
60,4d598d20ca6bafea895c75b208753b9f33380381,rgha-c <007.argha@gmail.com>, 2021-02-26 10:34:42 -0800, , make pretty make test pas,,
61,a404df4d26843b6bbfcb6ae98ef8374e35f9e56c,rgha-c <007.argha@gmail.com>, 2021-02-26 09:47:10 -0800, , remove couple ribbon deps thing blocking removal ribbon loadbalancer,,
62,96c56ef1bcfdfca06a6da5b4a59b2ff918364cce,rgha-c <007.argha@gmail.com>, 2021-02-24 13:26:46 -0800, , remove reference server type,,
63,9d4a4e5156781fedcb5e627726b07130c5f423a5,rgha-c <007.argha@gmail.com>, 2021-02-10 15:42:53 -0800, , originserver wrap discovery enabled backend server,,
64,a6f6d8933c41f5b06aa8b794c515194a0549f1c6,arl Mastrangelo <carl-mastrangelo@users.noreply.github.com>, 2021-03-03 11:29:01 -0800, , zuul core enable plaintext body caching 1008 despite name actuall metatron body caching optimistically enabled caching need happen proxyendpoint server yet decided dont know cached copy needed case retries cached copy get stored multiple failure indicating second attempt retried stable one region week ready default,,
65,dec7149aad4811c33562f6bbc3d0135d033124dc,oberto Perez Alcolea <rperezalcolea@netflix.com>, 2021-03-03 11:23:59 -0800, , replace travisci github action 1010,,
66,0c2b916541fc782bb401d5e1a3ac3b7caf13fe14,oberto Perez Alcolea <rperezalcolea@netflix.com>, 2021-03-03 10:42:15 -0800,1009, merge pull request 1009 netflix fix encrypted file encrypt credential file publishing,,
67,b2f43dc4606497ac6230079317809e2378a6a7f1,oberto Perez Alcolea <rperezalcolea@netflix.com>, 2021-03-03 10:27:36 -0800, , encrypt credential file publishing,,
68,279b20d9c21960c030ae045b092e8304128fc358,oberto Perez Alcolea <rperezalcolea@netflix.com>, 2021-03-02 18:41:34 -0800, , upgrade replace bintray publication update travisci secret 1006,,
69,c7a387cb6dc19a7247109763b16f033b12a21780,arl Mastrangelo <carl-mastrangelo@users.noreply.github.com>, 2021-03-02 18:36:41 -0800, , zuul core include netty handler tracing,,
70,211546f2194972a8869ec2f2678cf955fb3934b1,rthur Gonigberg <agonigberg@netflix.com>, 2021-02-22 16:14:04 -0800,1001, merge pull request 1001 netflix remove governator remove unnecessary governator dependency,,
71,8b6011fff051a48c1d94b631cba9ccca8daeee25,rthur Gonigberg <artgon@gmail.com>, 2021-02-22 13:17:53 -0800, , rename base test clarity,,
72,7f94d9366d1383332b03292644807e778de6a195,rthur Gonigberg <artgon@gmail.com>, 2021-02-22 10:51:01 -0800, , cleanup add license,,
73,f91b8d3042be8dc7a5645be46074fff13a04b02d,rthur Gonigberg <artgon@gmail.com>, 2021-02-22 10:45:57 -0800, , remove unnecessary governator dependency,,
74,bec2832f6d84ef70d8eaca2747090293d3c5c967,rgha-c <007.argha@gmail.com>, 2021-02-15 11:25:10 -0800, , remove duplicate conns count reduce synchronization,,
75,055f9260550915326bb1494eea97634642788705,rgha-c <007.argha@gmail.com>, 2021-02-12 13:04:03 -0800, , fix race condition conns gauge,,
76,0b85220dfabeed6aa93b5ac07c3e56f5ac758d12,rgha-c <007.argha@gmail.com>, 2021-02-11 16:53:15 -0800, , separate exception counters.inject registry cleanly,,
77,834a93e9b08f4e09898174f95187c04241555aac,rgha-c <007.argha@gmail.com>, 2021-02-11 16:23:42 -0800, , basic test server conn count,,
78,4ae5c5ac32b16ce5e39da1959fd83b80f826a813,rgha-c <007.argha@gmail.com>, 2021-02-11 17:13:57 -0800, , remove registry mock test,,
79,4d9b53670328389fb8de9c7ca32d23718d986f73,rgha-c <007.argha@gmail.com>, 2021-02-09 17:13:01 -0800, , merge passport state server conn metric,,
80,daad0d763b67aa2a9fbb928a548b3d96609afb4a,ullis <github@seansullivan.com>, 2021-02-09 16:25:12 -0800, , zuul sample log4j 2.14.0,,
81,235f1ddb2dec57a014049e77a004ad3630e92503,ullis <github@seansullivan.com>, 2021-02-09 16:18:11 -0800, , gradle 6.8.2 990,,
82,88edc8d9b068b60ca18fedc67a0f2dbf53837367,rgha-c <007.argha@gmail.com>, 2021-02-09 13:12:55 -0800, , remove unnecessary event passing,,
83,65d302ea75f57eff08a7a9e94ca9892663509727,rgha-c <007.argha@gmail.com>, 2021-02-09 12:43:49 -0800, , move conn. throttled counter handler,,
84,737e8474ac6f98f5506e9e8b0918ee6eaac7b97e,rgha-c <007.argha@gmail.com>, 2020-11-23 11:30:22 -0800, , zuul core cleanup unused toggle remove deprecated api,,
85,9f10384490167aefc8a1cc55e99eb78a7155c4a0,rgha-c <007.argha@gmail.com>, 2021-02-08 17:13:29 -0800, , remove duplicate counter fix eof weirdness,,
86,ff472b3c6806c5f4ef62106cf27f57a6adcb1285,rgha-c <007.argha@gmail.com>, 2021-02-08 12:36:51 -0800, , maintain reference registry obj,,
87,9ce0f9b983705791eff91d880a2db557b25f3a12,rgha-c <007.argha@gmail.com>, 2021-02-08 12:21:25 -0800, , zuul core counter conn. close idle state,,
88,411aeffb7473ccd36a5c8c40ae4ad1c2ce8081c2,arl Mastrangelo <carl-mastrangelo@users.noreply.github.com>, 2021-02-02 14:04:17 -0800, , core avoid noisy assert test noopgauge used,,
89,37cfe0cbab46d617e6e53047af0fabd3bcd72915,rthur Gonigberg <agonigberg@netflix.com>, 2021-02-01 15:14:19 -0800,988, merge pull request 988 netflix downgrade netty 4157 downgrade netty 4.1.57,,
90,2bffe73834735d818710b66da339965d2a6e8218,rthur Gonigberg <artgon@gmail.com>, 2021-02-01 14:45:18 -0800, , downgrade 4.1.55,,
91,001e4fc0e7109dc77651ed5d18b421612ea90858,rthur Gonigberg <artgon@gmail.com>, 2021-02-01 14:00:06 -0800, , downgrade netty 4.1.57,,
92,cf528fef06432f34eac7437d992ccb668adb18e4,ullis <github@seansullivan.com>, 2021-02-01 10:30:14 -0800, , upgrade gradle 6.8.1 987 http docs.gradle.org 6.8.1 release notes.html,,
93,2b86803f0005486b1924187faa629c16e434a1b3,arl Mastrangelo <carl-mastrangelo@users.noreply.github.com>, 2021-01-29 10:02:38 -0800, , zuul core silence ssl related failure normal,,
94,feeade8ca42ebf4241671bdb41db03146099458a,arl Mastrangelo <carl-mastrangelo@users.noreply.github.com>, 2021-01-28 14:34:23 -0800, , core silence uri exception spam log,,
95,4752fcf3d3eed0e177224cf9d81fc4a688233521,arl Mastrangelo <carl-mastrangelo@users.noreply.github.com>, 2021-01-22 14:06:33 -0800, , core separate server starting waiting expose listening socket,,
96,21c534c376bfb9cc840f73b2503a889acc53c1b0,arl Mastrangelo <carl-mastrangelo@users.noreply.github.com>, 2021-01-21 17:44:31 -0800, , core add named socket class use server startup,,
97,a93cbf615d7efcd129122868fc398a1fda1a9d53,rian Tarricone <brian@tarricone.org>, 2021-01-20 15:49:28 -0800, , ensure sessioncontext modified iterating 978 routing debugging enabled zuul record change session context filter run context already routingdebug property fine comparison code side effect add property however added active iterator context code try fetch next element iterator thrown,,
98,12b62a9e9299718a087a82b3f77fbe415730fc50,arl Mastrangelo <carl-mastrangelo@users.noreply.github.com>, 2021-01-20 15:04:25 -0800, , core add check chunked encoding http,,
99,dd64a3b3017382220c80219587f178002e8a984c,arl Mastrangelo <carl-mastrangelo@users.noreply.github.com>, 2021-01-20 14:16:49 -0800, , update netty tcnative 2.0.36 979,,
100,41beba15417a093da893f81265a07e087e5a08b7,ullis <github@seansullivan.com>, 2021-01-20 14:09:11 -0800, , netty 4.1.58.final 972 release note http netty.io news index.html,,
101,73ecf3a3d3dfc33a3f5b0986d908286ffd2a9123,arl Mastrangelo <carl-mastrangelo@users.noreply.github.com>, 2021-01-14 11:42:37 -0800, , zuul core selectively enable body caching retries change modifies proxy logic cache request body recently throttling event mean get back 503 agressively cache request body able retry request previously zuul would cache body origin secure manually request cache found expensive since result caching time even origin healthy change make zuul look see failure past minute zuul cache body retry expectation origin recover mean first request fails due throttling retried subsequent failure enough time past last throttle zuul stop caching zuul configured unconditionally cache setting value ,,
102,08ac94aebad9e3c6c9759a5b618aef621e6ccf8c,ullis <github@seansullivan.com>, 2021-01-12 18:09:15 -0800, , spectator 0.123.1 970 http github.com netflix spectator release,,
103,6215bf99b5bf0ed50aca7a33228471984af0cb80,arl Mastrangelo <carl-mastrangelo@users.noreply.github.com>, 2021-01-11 15:37:20 -0800, , zuul core use duration readtimeouts,,
104,06a8f2bc4b66cd938a80ddc227135a17411f4991,ullis <github@seansullivan.com>, 2021-01-11 11:58:52 -0800, , upgrade jackson 2.12.1 968 http github.com fasterxml jackson wiki jackson release 2.12,,
105,5d8c899516dcf37964a59a007bf7ccdf40e3e52e,arl Mastrangelo <carl-mastrangelo@users.noreply.github.com>, 2021-01-06 10:41:55 -0800, , zuul core add overload connection counter extra dimension,,
106,e0485e83a03658f8559bc4d09a3043b66e6eaf21,arl Mastrangelo <carl-mastrangelo@users.noreply.github.com>, 2021-01-05 13:12:51 -0800, , core avoid using deprecated,,
107,5261ea9c2d0a8cd6765fd2d801c752ac03adad16,ullis <github@seansullivan.com>, 2020-12-20 12:56:48 -0800, , bump jackson 2.12.0,,
108,1e576dc5fa1064d3980abb1e1118e61c2c622398,arl Mastrangelo <carl-mastrangelo@users.noreply.github.com>, 2020-12-16 16:55:10 -0800, , zuul core make conn time split metric name rather tag,,
109,f0e5a0fc600a8dd453f573da26b61c73cf832f70,arl Mastrangelo <carl-mastrangelo@users.noreply.github.com>, 2020-12-16 16:38:09 -0800, , zuul core make sure lock conn counter properly,,
110,bae0b467c2e9d1d4b8e586d75f8067956dd59655,arl Mastrangelo <carl-mastrangelo@users.noreply.github.com>, 2020-12-16 11:33:44 -0800, , zuul core include hapm port server conn dimension,,
111,4dca895301357811743a53159b1965ee1ef2738f,arl Mastrangelo <carl-mastrangelo@users.noreply.github.com>, 2020-12-15 10:43:55 -0800, , zuul core add active connection counter zuul,,
112,1f1f6e972a548c1ba03e73eae9bf9b6c82f72dd5,rthur Gonigberg <agonigberg@netflix.com>, 2020-12-14 14:29:10 -0800,956, merge pull request 956 netflix reverse custom vip logic combine injection condition one origin ever created orâ,,
113,f234c84d76b7e25020ae55e9458eed91a600d63b,rthur Gonigberg <artgon@gmail.com>, 2020-12-14 14:12:39 -0800, , combine injection condition one origin ever created fetched,,
114,b95759670ec802d88c40778025c852572d1225c4,arl Mastrangelo <carl-mastrangelo@users.noreply.github.com>, 2020-12-11 16:51:47 -0800, , zuul core selectively increase precision conn timer,,
115,203d851240ba1371224f09e4cfba370164330a15,arl Mastrangelo <carl-mastrangelo@users.noreply.github.com>, 2020-12-10 15:19:30 -0800, , zuul core add back plaintext cache avoidance retries,,
116,517e0c136187ba5105f4c9b989314efbea54d696,arl Mastrangelo <carl-mastrangelo@users.noreply.github.com>, 2020-12-09 14:09:21 -0800, , zuul core always cache full body regardless ssl scope retrying post body response 503 zuul keep copy body send certain circumstance normally body sent origin zuul sent anything client zuul compromise http spec consider post retryable many thing depend wrong behavior would risky change current code netty ssl handler mutate body sending proxyendpoint keep pristine copy body assuming full body present case ssl requested zuul depends netty clearing buffer sends thus keep copy around internally netflix want automatically upgrade ssl possible proxyendpoint code decided cache origin may explicit ask ssl eventually use late set niws issecure bit cache body requesting ssl per origin using ssl per server ensure 503 retryable depend netty http subtlety change unconditionally cache body pessimistically assumes body could mutated allows auto ssl upgrade later call chain well sorry test code definitely warrant test ridiculously difficult add one taking loan tech debt hope one day pay back,,
117,f94164b786f98b3e3c0ceeabffcc0d42b536c93b,arl Mastrangelo <carl-mastrangelo@users.noreply.github.com>, 2020-12-08 11:03:09 -0800, , bump netty 4.1.55,,
118,edfc6f98c5fa20db2b8930b6be20a5587c5bddfe,rgha-c <007.argha@gmail.com>, 2020-12-08 10:45:13 -0800, , fix exception xff port present empty,,
119,6f4d9ceb9c01864e3298bdbb27959f3e102f5cea,arl Mastrangelo <carl-mastrangelo@users.noreply.github.com>, 2020-12-03 14:47:38 -0800, , zuul core record live netty buffer usage rather java,,
120,16d644ce1209b446338f6e03fd16f0def8f3c75d,arl Mastrangelo <carl-mastrangelo@users.noreply.github.com>, 2020-12-02 10:38:32 -0800, , zuul core replace vip origin name clientname composite object top level idea make vip origin name niws client name app name single struct passed around throughout pooling code additionally need get away verbiage idiom come dependency niws eureka ribbon high level change replace string form origin name client name vip composite originname class class primary key origin vip renamed target target something used looking server connect vip prefix origin name client name renamed niwsclientname used define iclientconfig value well use fast property niwsclientname also normalized metric usable atlas metric usefullvip variant wired code effect building originname,,
121,232d7a8c968073edddae8b1cb5ae37fd2dcd0e69,rgha-c <007.argha@gmail.com>, 2020-11-20 13:56:58 -0800, , 2.20 released move 2.3.0 snapshot,,
122,97b86d453b612e5f119abecadd239409f88a9793,rgha-c <007.argha@gmail.com>, 2020-11-16 13:41:37 -0800, , zuul core remove deprecated port attrs use _address instead,,
123,47071dcf44a9bca3e6e0a2e1c408de44924bb0fe,rgha-c <007.argha@gmail.com>, 2020-11-20 11:11:54 -0800, , begin 2.2.0 snapshot prep 2.2.0 release,,
124,6aa44ba1d16240431f9a3afd13c41268fb0cc6cb,arl Mastrangelo <carl-mastrangelo@users.noreply.github.com>, 2020-11-19 16:27:37 -0800, , zuul core remove unused debugging util deepcopy,,
125,f2f3ae93c8e6b83e33bef874774ae6e9f0164ba5,arl Mastrangelo <carl-mastrangelo@users.noreply.github.com>, 2020-11-18 18:01:57 -0800, , zuul core fix npe currentpassport debugging,,
126,17195fa86cdf124ceb1b1dc3173cc7ded43d1da7,arl Mastrangelo <carl-mastrangelo@users.noreply.github.com>, 2020-11-18 16:10:36 -0800, , zuul core complain passport held current thread zuul core complain passport held current thread expose remote stack,,
127,6bc3f53a0696e30fc4a99a211a851f81c649b7b8,rgha-c <007.argha@gmail.com>, 2020-11-18 13:54:28 -0800, , basic test codec swapping,,
128,1ec3a08c1e9844026a9f2641169ad2b48347a391,arl Mastrangelo <carl-mastrangelo@users.noreply.github.com>, 2020-11-18 12:31:44 -0800, , zuul core add debugging locking around currentpassport needed help debug seemingly impossible passport live entirely single thread entrant code check passport locked also accidentally owns already lock keep access safe doe stop sharing object know object accessed disable code,,
129,d8d26defb0ef1859d1f859d21f0eb25f51e66d4b,rgha-c <007.argha@gmail.com>, 2020-11-17 16:46:14 -0800, , delete unused code.remove redundant cast,,
130,d70d769e36574ee30a4524573d3b351381c8972c,rgha-c <007.argha@gmail.com>, 2020-11-10 10:10:36 -0800, , always allow alpn config,,
131,4373bb576f8d546fb484452115fba6e152c73d4b,rgha-c <007.argha@gmail.com>, 2020-11-12 16:42:05 -0800, , make builder public,,
132,af3d244e941911f1c3a72d39c1040038628b5af4,rgha-c <007.argha@gmail.com>, 2020-11-12 13:57:28 -0800, , add sslcontext builder disabled,,
133,81993350d9f35cd3d204c17103fa7a4342778324,arl Mastrangelo <carl-mastrangelo@users.noreply.github.com>, 2020-11-11 12:58:44 -0800, , update netty 4.1.54,,
134,4508b4311714db0d50ca56efc4893bf1fdf1c15c,rgha-c <007.argha@gmail.com>, 2020-11-10 16:38:33 -0800, , revert always allow alpn config reverts commit,,
135,0ec80df44e8e8e105fbacda6aec294c379320676,rgha-c <007.argha@gmail.com>, 2020-11-10 10:10:36 -0800, , always allow alpn config,,
136,15179f47bc4ac0b41703a15710998661b4a900ce,arl Mastrangelo <carl-mastrangelo@users.noreply.github.com>, 2020-11-04 15:46:44 -0800, , zuul core pick new server address deciding create new connection,,
