id,sha,author,date,issue,message,file,content
0,332be6e5c8005f699a708568939d31dd85e9cffb,inchinWeb <w_minchin@hotmail.com>, 2021-07-13 01:35:22 -0600, , support date format code used iso date 2902,,
1,0919507ae7d8cf802b8a0043ab6692b9d110b67b,ustin Mayer <entroP@gmail.com>, 2021-07-13 09:33:34 +0200,2901, merge pull request 2901 minchinweb writer doc document add new writer,,
2,58e3770b80a1e9649f29a0081041a81984e8f983,inchinWeb <w_minchin@hotmail.com>, 2021-07-09 08:28:15 -0600,2899, document add new writer c.f 2899,,
3,82098a634f24c0a73192e1c82fe8f3c54f36f472,ristan Miller <psychonaut@nothingisreal.com>, 2021-07-07 08:48:10 +0200,2884, fix formatting jinja example code fix 2884 2886,,
4,ee8fb6998cd4b1312814dce4b7c2cbac175838a8,ustin Mayer <entroP@gmail.com>, 2021-06-30 08:56:28 +0200,2892, merge pull request 2892 minchinweb typo fix fix typo docstring,,
5,7dfac1c0c02092f3f9ff7de5e03d426d887a2798,ustin Mayer <entroP@gmail.com>, 2021-06-30 08:54:04 +0200,2882, merge pull request 2882 minchinweb patch allow easy subclassing writer,,
6,2cafe926fa854b5b8c84b944d77b628574a2ec61,inchinWeb <w_minchin@hotmail.com>, 2021-06-15 22:41:38 -0600, , typo fix current two,,
7,e800b23b4d9ec45663dbac6c5cb4775b0cacdb57,ristan Miller <psychonaut@nothingisreal.com>, 2021-06-12 15:48:32 +0200,2883, update link jinja doc fix 2883 2885,,
8,c10792c6793aa3f99917e644784b394b43435d44,ustin Mayer <entroP@gmail.com>, 2021-06-12 08:45:58 -0500,2878, merge pull request 2878 jzc filename metadata typo fix doc render correctly,,
9,845acfe1ac7c156513d928b01e4acdad0c47f6ee,inchinWeb <w_minchin@hotmail.com>, 2021-06-07 21:46:15 -0600, , allow easy subclassing writer write custom writer get called setting none writer simply subclass built writer pelican error critical relative_urls source error __init__.py,,
10,c041bf2192dbf95cb2ac63f1ea979a0d955690b7,ustin Mayer <entroP@gmail.com>, 2021-06-08 11:40:27 -0500, , fix failing test jinja,,
11,c41b8abb133b85db83515bfe259e7fac5c4a7b7f,zc <justincai.lps@gmail.com>, 2021-05-20 00:11:58 -0600, , fix doc render correctly,,
12,add3628a6474f2bd145fe2ea55c5e5255e9970ba,io <sethg@ipi.org>, 2021-04-16 19:07:35 -0500, , add support hidden article,,
13,487da3550bffb96ebfed9dbf206d8b3574886a21,etr Viktorin <encukou@gmail.com>, 2020-12-29 19:22:37 +0100, , add period_num var period_archives template make easier create template language agnostic need extra processing date period,,
14,7893455b4315f09877bfc507b92a6f647dd589e0,ustin Mayer <entroP@gmail.com>, 2021-04-27 20:14:10 +0200,2838, merge pull request 2838 namn patch use top instead bottom border hentry,,
15,fb9df68477d5df58d5467b38247d917296ac2f45,ustin Mayer <entroP@gmail.com>, 2021-04-27 14:42:22 +0200,2869, merge pull request 2869 getpelican rich add progress spinner animation generation,,
16,40f3d2df91e847ccbc64d015fe837650055b67bd,ustin Mayer <entroP@gmail.com>, 2021-04-21 09:51:06 +0200, , add progress spinner animation generation first step enriching console output via rich project,,
17,14afc6c54a7e361bbc465fdc25511831cce29812,ustin Mayer <entroP@gmail.com>, 2021-04-21 10:16:28 +0200, , update pelican feature documentation,,
18,fd3ad0c16e19b0b024bd375a1cbd0870701dda3d,ustin Mayer <entroP@gmail.com>, 2021-04-21 10:05:28 +0200, , update contributing doc poetry repository url,,
19,c461def10ac480647097b9ce09ffcff711f1e9b8,ustin Mayer <entroP@gmail.com>, 2021-04-21 09:57:08 +0200, , update cache github action,,
20,dac01831f29cb9b8670d7fb6ec86f54f2fca7f5b,ustin Mayer <entroP@gmail.com>, 2021-04-19 16:44:29 +0200,2868, merge pull request 2868 minchinweb patch fix invoke test task problem window,,
21,a00284f744450623f20e0409a98b07c2d5ccc2e6,omain Porte <microjoe@microjoe.org>, 2021-04-19 15:59:41 +0200, , automatically open browser invoke task start web server 2764 serve livereload target invoked web browser automatically opened pointing locally served website web browser found module open call return false exception raised mean still possible call livereload remote machine access without error triggered signed romain porte microjoe microjoe.org,,
22,88953d45d55d55ee7e79804749a40d47aa08c412,ustin Mayer <entroP@gmail.com>, 2021-04-19 09:49:03 +0200,2843, strip html tag notmyidea page template title fix 2843,,
23,cf4e8d527d6468fad5c4910d254642c3353a2f76,inchinWeb <w_minchin@hotmail.com>, 2021-04-18 22:20:54 -0600, , update tasks.py pty supported window,,
24,1219bcd029a9386fdc2a398b79a72e60fb1fdb08,otpub <botpub@autopub.rocks>, 2021-03-23 10:31:21 +0000, , release pelican 4.6.0,,
25,9a9dbcf523b719981aa489f7878500b07c8a9b0b,ustin Mayer <entroP@gmail.com>, 2021-03-23 09:24:07 +0100, , prepare release,,
26,1449840199febf204c81fd0357dbcfe2b80dc549,ustin Mayer <entroP@gmail.com>, 2021-03-23 08:23:07 +0100, , make tox github job python version match otherwise result error,,
27,2b08497c3237e7d98366f529d62c6b52d2a75227,ustin Mayer <entroP@gmail.com>, 2021-03-23 08:06:58 +0100, , relax dependency minimum version specifying floor ceiling core dependency help prevent dependency resolution conflict dependency affect functional test output pinned tightly,,
28,ce4994bec8b4124a610b947281b35edcb11babc8,ustin Mayer <entroP@gmail.com>, 2021-03-19 12:58:58 +0100, , doc fix link category plugin,,
29,4b6b5f046166899ed7eb2c3c15db058690b7b650,ustin Mayer <entroP@gmail.com>, 2021-02-19 09:31:04 +0100, , clarify documentation,,
30,31398d4247d4d7f78c5ee2e15145af3ffe9cacc0,ustin Mayer <entroP@gmail.com>, 2021-02-19 08:22:16 +0100, , improve consistency makefile target help,,
31,d44821b733e77edeeae2d885981bea3ece87c376,ustin Mayer <entroP@gmail.com>, 2021-02-18 18:13:44 +0100,2852, merge pull request 2852 getpelican pygments 2.8 update pygments dev dependency v2.8,,
32,eaa801f14a81c40b1236657a297ca24648cc0fa1,ustin Mayer <entroP@gmail.com>, 2021-02-18 18:11:02 +0100,2850, merge pull request 2850 avaris ignore none return value get_generators signal,,
33,0db5afb920bd8c3b840e363a3a3eac1ea7804c20,ustin Mayer <entroP@gmail.com>, 2021-02-18 15:18:45 +0100, , update functional test output pygments 2.8,,
34,872c4dbd30fd0d891a850ae8685b73139c83bcbd,ustin Mayer <entroP@gmail.com>, 2021-02-18 15:16:36 +0100, , update pygments dev dependency v2.8,,
35,cdec5305729c461721f4bea1477bbc4df776caf0,ustin Mayer <entroP@gmail.com>, 2021-02-18 15:06:29 +0100, , add .yaml file extension editorconfig,,
36,68817845b048f160bb65887aaa8da1f5308da5fa,ustin Mayer <entroP@gmail.com>, 2021-02-18 12:30:44 +0100, , change faq entry new tag cloud plugin repo,,
37,27762d2cf70fd76f0f3f76ea02b7cf8bfa4e1236,ustin Mayer <entroP@gmail.com>, 2021-02-18 12:29:18 +0100, , make pkg_path var invoke tasks.py dry,,
38,aa7c821c7084252ae6e0d9b5b6bfff78f03ec7a9,eniz Turgut <dturgut@gmail.com>, 2021-02-12 21:17:42 +0300, , ignore none return value get_generators signal,,
39,7a26f509dfc76d7fcd4d2d28eac02aae0a8fbd17,ustin Mayer <entroP@gmail.com>, 2021-02-09 21:28:54 +0100,2847, merge pull request 2847 mirekdlugosz livereload cleanup livereload task improvement,,
40,f846191edddabb6996c4a15490439f3b2ade1249,irek DÅugosz <mirek@mirekdlugosz.com>, 2021-02-08 22:16:25 +0100, , livereload task improvement use custom build command caching turned reduces site build time around testing machine collect glob pattern list call server.watch item allows single place callback function must specified use .html glob template track change subdirectory,,
41,8bb5f1b786b6f2b22d1dc4501796d6df9a658a05,ustin Mayer <entroP@gmail.com>, 2021-01-15 13:19:19 +0100, , drop unsupported python 3.5 test matrix,,
42,ce5d0635137009300b65edb15f73081f0ac4231b,ustin Mayer <entroP@gmail.com>, 2021-01-15 13:04:07 +0100, , allow latest python markdown installed pinning dependency specific version creates conflict package require recent version part allowing wider range dependency version specifying oldest version still work meanwhile ensure test environment use specific pinned dependency order match expected functional test output,,
43,e01cde7fcb6ff4e3720059cd59a498972630f3d3,ustin Mayer <entroP@gmail.com>, 2021-01-15 12:55:57 +0100, , adjust functional test output pygments 2.7.x class lineno changed linenos,,
44,34fc7f2a8498da4d8c8f801318ba1b172ffed66f,am Nguyen <namn@users.noreply.github.com>, 2021-01-06 12:19:46 -0800, , allow latest pygments installed otherwise installation conflict result plugins theme require recent pygments version,,
45,ab3001391e6fad0c5c6b527c8a8d4f4f7351bd3a,ustin Mayer <entroP@gmail.com>, 2021-01-15 12:49:33 +0100, , match test output line ending current rendering,,
46,f9abcb30e30eebde03d7090894da808fe2791dc6,ustin Mayer <entroP@gmail.com>, 2021-01-14 10:54:57 +0100,2826, merge pull request 2826 someone somenet org patch add http prefix pelican listen output,,
47,5971c5ad9039c7cf77c9aeaf229def6bda41c4d3,ustin Mayer <entroP@gmail.com>, 2021-01-14 10:51:00 +0100,1401, merge pull request 1401 arty name support last page pattern,,
48,89a31141ff51377ca97cde0f3da2f3651f46079d,om Adler <me@arty.name>, 2014-07-13 08:59:09 +0200, , support last page pattern,,
49,507d68e5c6cb6eb6e184283944d8f4c543996619,am Nguyen <namn@users.noreply.github.com>, 2021-01-07 14:09:38 -0800, , update functional test,,
50,659c4cbf0f0cd823d5eb199220e5a087f167733d,ustin Mayer <entroP@gmail.com>, 2021-01-07 17:17:14 +0100,2836, merge pull request 2836 namn patch fix typo faq steamline streamline,,
51,b17e4a5ffaab2f4f235cbb76c6a05b91cf69c878,ustin Mayer <entroP@gmail.com>, 2021-01-06 07:36:21 +0100, , add faq atom full post vs. summary feed replaces faq upgrading old version pelican relevant folk point,,
52,b12443f48a11f542d613f2c52a59fb38919f5604,am Nguyen <namn@users.noreply.github.com>, 2021-01-05 10:40:31 -0800, , use top instead bottom border hentry hentry clear intention placing separator line 1px border entry however wrongly using border bottom instead border top make separator clear make space clear preceding float hence border bottom enjoy clear effect,,
53,9e72b29fc1a9bbd10725cc98878840e015d626a0,otpub <botpub@autopub.rocks>, 2021-01-04 16:16:16 +0000, , release pelican 4.5.4,,
54,dc601059265bfd0722b8d07c67dd1f39b091fbfa,rederik Ring <frederik.ring@gmail.com>, 2021-01-04 17:13:32 +0100, , stringify plugin definition pickled caching 2835,,
55,783a70da460e2d498041dabed28b2380ac8f489a,am Nguyen <namn@users.noreply.github.com>, 2021-01-03 21:24:10 -0800, , fix typo faq steamline streamline,,
56,049bb2e1b3d06721023a12be8e0885b96fed9a0e,omeone <someone@somenet.org>, 2020-12-09 22:52:42 +0100, , add http prefix port,,
57,8033162ba4393db60791b201fb100d1be0f04431,otpub <botpub@autopub.rocks>, 2020-12-01 20:36:51 +0000, , release pelican 4.5.3,,
58,9435a6c0451a32ab3dba602fba3b79b3c06c929c,eonardo Giordani <giordani.leonardo@gmail.com>, 2020-12-01 18:07:51 +0000, , fix code indented incorrectly generator logging 2823,,
59,246da3b4d815ac340e8bde889964022b20a5ac48,otpub <botpub@autopub.rocks>, 2020-11-22 16:16:28 +0000, , release pelican 4.5.2,,
60,afdf0fb3cf6cd376a6f241e2d5bbf99cf0e348c2,eonardo Giordani <giordani.leonardo@gmail.com>, 2020-11-22 16:13:51 +0000, , improve logging generator writer loader 2821,,
61,a9d9ccb58300c467d0b2aa721f5189706583a0b4,ustin Mayer <entroP@gmail.com>, 2020-11-20 16:30:18 +0100, , improve doc plugin code style compliance,,
62,f21969a0161621642f60139b5735190ee633e7e6,ustin Mayer <entroP@gmail.com>, 2020-11-20 16:22:39 +0100, , ensure invoke lint task doc sync someday entire pelican code base perhaps black isort formatting applied make sense linter check actually done change lint invoke task run flake8 changed line bring line current pre commit configuration also doc erroneously stated invoke test would also check code style compliance herein fixed,,
63,4b79d6dae67844ba7faff10101dc8b18780692d4,ustin Mayer <entroP@gmail.com>, 2020-11-20 15:46:05 +0100, , update pypi url new equivalent,,
64,67e27ca7cd36f4b9cd27418d171cb2e5c25df9ea,ustin Mayer <entroP@gmail.com>, 2020-11-20 15:39:52 +0100, , pelican plugins show auto discovered plugins document clarify pip installed namespace plugins shown running pelican plugins command,,
65,e3c7a915e500e17b668ddebfb1cc7e30673dbf33,ustin Mayer <entroP@gmail.com>, 2020-11-02 17:18:38 +0100, , fix changelog entry formatting issue link,,
66,06d4eff4a52bf75c5fc447aa779b1694f44028c9,otpub <botpub@autopub.rocks>, 2020-11-02 13:15:26 +0000, , release pelican 4.5.1,,
67,98b1a46362f6217216306527fb8715316982b995,ustin Mayer <entroP@gmail.com>, 2020-11-02 14:10:02 +0100, , prepare release,,
68,09822c16a7d3cf29982d892b4dc7fe0ce9edfb48,ustin Mayer <entroP@gmail.com>, 2020-11-02 14:08:30 +0100,2794, merge pull request 2794 farseerfc include jinja2 template include jinja2 template manifest.in,,
69,b454f76f72dea65db9d360dc1bf51b8ddb76149d,ustin Mayer <entroP@gmail.com>, 2020-11-02 13:17:53 +0100, , count cpu core via psutil parallel testing psutil doe much better job accurately counting cpu core pytest xdist take advantage purpose running test concurrently,,
70,c345268de6b754d31dbae67d0fc23efc0db5e6fe,ustin Mayer <entroP@gmail.com>, 2020-11-02 12:40:13 +0100,2818, merge pull request 2818 shniubobo issue 2817 fix plugins running twice autoreload mode,,
71,587e1a4ad89da2be46368baafb4f00b3b3d0c64a,hniubobo <shniubobo@outlook.com>, 2020-10-31 20:34:45 +0800,2817, fix plugins running twice autoreload mode fix 2817,,
72,e4d9c41a77b45cb7ff6b8d1732623990adf65931,ustin Mayer <entroP@gmail.com>, 2020-10-19 21:02:01 +0200,2799, merge pull request 2799 kdeldycke trove classifier cleanup trove classifier tweak,,
73,f4bb0d89331f001eca4789c65e0c07b757bfae59,ustin Mayer <entroP@gmail.com>, 2020-10-19 20:53:05 +0200,2813, merge pull request 2813 avaris 2805 fix legacy plugin loading package,,
74,197cd1e12ef9f14b2ba277e23504c8ac26a0467f,ustin Mayer <entroP@gmail.com>, 2020-10-19 20:43:18 +0200,2812, merge pull request 2812 avaris 2646 try unescaped path intrasite link discovery,,
75,20a1ac0e6f26f5ee07e48160cfe2d7c2d8f810a0,ustin Mayer <entroP@gmail.com>, 2020-10-19 20:36:28 +0200,2811, merge pull request 2811 avaris python39 add python 3.9,,
76,fd0923d2f24c9833021c01f247f97f4d1d8e67b4,eniz Turgut <dturgut@gmail.com>, 2020-10-04 19:29:32 +0300, , try unescaped path intrasite link discovery content parser escape link path html output i.e docutils html escaping markdown url encoding intrasite link discovery refactored also attempt html url unescaped version path order match permissively,,
77,8b8a0147e886d6a42b6d8c5c76d96627b7e1241d,eniz Turgut <dturgut@gmail.com>, 2020-10-12 18:38:46 +0300, , add python3.9,,
78,6da975fc73311d683593e59c1b4b24822ddaa0e4,eniz Turgut <dturgut@gmail.com>, 2020-10-12 14:53:18 +0300, , restore pelican.signals explicit importerror mentioning move,,
79,991c00af95ac3cdb197b0d04e7349d801d6c951d,eniz Turgut <dturgut@gmail.com>, 2020-10-12 14:50:42 +0300, , resolve package legacy plugins updated legacy plugin loader handle pakcages plugins entry contains also add test,,
80,8fffcbef7af4d6e6f8fa07257e562cde10fe9f15,evin Deldycke <kevin@deldycke.com>, 2020-09-04 13:04:50 +0200, , add new classifier added canonical list http github.com pypa trove classifier pull,,
81,30c9f6bb523e291f336932de063d60e4b40550aa,evin Deldycke <kevin@deldycke.com>, 2020-09-03 11:30:11 +0200, , refine classification,,
82,aed71c30f86f5b929e735e17a36e838b5ee527ec,evin Deldycke <kevin@deldycke.com>, 2020-09-03 11:21:52 +0200, , need maintain license python version classifier poetry take care http python poetry.org doc pyproject classifier,,
83,7a6686f4679adabdd690668a4ba7cedaf494e243,ustin Mayer <entroP@gmail.com>, 2020-08-29 12:46:44 +0200, , fix variable name changelog,,
84,3565094b10b74217f0b78d9c1f2f06f2c1cf61ea,iachen Yang <farseerfc@gmail.com>, 2020-08-24 22:34:02 +0900, , manifest.in include jinja2 template,,
85,0ab6ac97983952c00b7b7e8b8de3c1e0cd22127f,ustin Mayer <entroP@gmail.com>, 2020-08-20 19:20:51 +0200, , fix pypi related rest readme issue,,
86,4bda2745ac2d654efd436d20e31895f3d7705036,ustin Mayer <entroP@gmail.com>, 2020-08-20 17:57:21 +0200, , prepare release pelican 4.5,,
87,e11a7de051e3a8bb0158ba462bc8e69322047bf0,ustin Mayer <entroP@gmail.com>, 2020-08-20 13:51:23 +0200, , add missing pelican entry point pyproject.toml,,
88,94bdcb7f185e14b9ef946ff5cc49b800e9aaad70,ustin Mayer <entroP@gmail.com>, 2020-08-20 13:46:09 +0200, , remove travis since switched github action,,
89,fafe0207ca69ab3bce5a6a8cf6d39200ce9cbc7d,ason K. Moore <moorepants@gmail.com>, 2019-10-13 11:58:41 -0700,2635, include test package source distribution fix 2635,,
90,64fcdb51723609550a7e28cb9529f23860ffdb32,ernc <kerncece@gmail.com>, 2020-08-19 20:25:19 +0200, , rename setting 2792 avoids clash summary plugin ref http github.com getpelican pelican plugins pull 1284 issuecomment 660715086,,
91,ade70cb2e2622da5b136d6a01e04483805fc5dee,ustin Mayer <entroP@gmail.com>, 2020-08-17 09:47:57 +0200, , rename branch github page repo quickstart,,
92,145cd4be92c60cf1ae2eabc17c00f37660bdc7e1,ustin Mayer <entroP@gmail.com>, 2020-08-17 07:21:57 +0200, , minor improvement installation doc,,
93,a0335711afdb3354ca887673729992d9048139e6,ustin Mayer <entroP@gmail.com>, 2020-08-17 07:14:29 +0200, , remove outdated reference python 2.7 doc,,
94,16975bc3a259b77b03673cf9cface69c77ff50f9,ustin Mayer <entroP@gmail.com>, 2020-08-17 07:04:00 +0200, , prefix pip command python doc ensures pip command executed current python interpreter say whichever python interpreter happens associated usr local bin pip,,
95,863421b1b8fbd352dbf34d1b66d9dfd0494c5fd2,ustin Mayer <entroP@gmail.com>, 2020-08-17 06:45:38 +0200,2786, use reliable installation command doc shell environment may interpret bracket glob pattern wrapping argument quotation mark help ensure correct behavior environment ref 2786,,
96,26a8909580364e93b0ec540cfe735e49a1a30082,ustin Mayer <entroP@gmail.com>, 2020-08-16 20:03:35 +0200,2785, merge pull request 2785 jwodder lower rst summary lowercase metadata field name comparing rst reader,,
97,64bb392fefef1ad895626c6d4dc989fe73173766,ustin Mayer <entroP@gmail.com>, 2020-08-16 07:23:13 +0200, , auto detect physical cpu core via pytest xdist,,
98,adbefe836355305c69818f8abb59decf0adf9cf9,ustin Mayer <entroP@gmail.com>, 2020-08-16 07:19:47 +0200, , upgrade pytest xdist dev dependency v2.0 also stop pinning pytest version since older version combined pytest xdist 2.0 caused test error,,
99,b769144a6380e7fd49ec4aa6bcdf66620e4b9eba,ustin Mayer <entroP@gmail.com>, 2020-08-15 08:36:56 +0200,2789, support booleans extra setting ref 2789,,
100,45c5cb9029bc2d475ae7440ee1fed3065e353811,ustin Mayer <entroP@gmail.com>, 2020-08-13 12:07:58 +0200,2789, fix error extra setting feature ref 2789,,
101,74692a37a64c6f51647427e2a83d37a900bd15b0,ustin Mayer <entroP@gmail.com>, 2020-08-11 19:12:08 +0200,2779, merge pull request 2779 shakram02 doc fix custom reader example fix usage pelican_open doc page,,
102,449a8e6ac485e49488817a844fc554f235e4118f,ustin Mayer <entroP@gmail.com>, 2020-08-11 13:04:19 +0200,2766, merge pull request 2766 davidjb patch fix port remove duplicate port argument makefile,,
103,b0cdae78d2ca00a0b446493164a939013037746a,ustin Mayer <entroP@gmail.com>, 2020-08-11 13:02:29 +0200,2788, merge pull request 2788 elboulangero makefile sync tag directory makefile include tag directory rsync command,,
104,04c0ea53e6bc79a1447e1ead246037103f39aca9,ustin Mayer <entroP@gmail.com>, 2020-08-11 12:50:08 +0200, , document extra setting option flag,,
105,d728cd2696ecaef0f1070faf3c12ce1fd2819c6f,ustin Mayer <entroP@gmail.com>, 2020-08-11 12:48:15 +0200, , rename cli flag syntax setting override feature,,
106,1c50a18d0a45d76f6b50647536faf25954740d20,eter Sabaini <peter.sabaini@canonical.com>, 2020-05-09 18:15:16 +0200, , override setting command line add setting override key val command line option override default setting defined setting file add flexibility running pelican help reduce sprawl setting file cast int str setting override respective type support setting type treating json fall back json override typecast error make possible set int value none resp json none,,
107,40d09875e6d45f6609b19ea367d1fd70affa3332,rnaud Rebillout <elboulangero@gmail.com>, 2020-08-11 16:23:35 +0700, , makefile include tag directory rsync command default rsync option exclude excludes tag directory blog bit unfortunate quite common tag directory blog either tag page tag feed commit force rsync include directory save little headache user wonder tag present output directory present server,,
108,f80bf187a9c2a7d3d41fd91ebcdd09a7b0d2dd13,ustin Mayer <entroP@gmail.com>, 2020-08-11 09:14:55 +0200, , update pypi classifier add funding tracker link,,
109,18a2720ea73da4ccb05739a57864c3cb3f008973,ustin Mayer <entroP@gmail.com>, 2020-08-11 09:13:00 +0200, , adjust isort task v5.2 recursive default,,
110,d2bbfd967e70351d014ab11ec3e8dc8dbcf58867,ustin Mayer <entroP@gmail.com>, 2020-08-02 10:58:32 +0200, , remove self referential template page link doc,,
111,18b626aa8b43f513067d6c9ed00711e5e046ebca,ohn T. Wodder II <git@varonathe.org>, 2020-07-30 14:39:46 -0400, , lowercase metadata field name comparing rst reader,,
112,dc6fb57c418c7b60138ad5c8105cc7138ac8339d,ustin Mayer <entroP@gmail.com>, 2020-07-29 09:38:14 +0200, , update order dependency pyproject,,
113,6289452e9580a95fa2a4b87eec28ca8d7142e4d8,ustin Mayer <entroP@gmail.com>, 2020-07-29 06:41:28 +0200, , document inability control plugin execution order,,
114,2372e8e5740bc7780d750a318a4459008ceea489,ustin Mayer <entroP@gmail.com>, 2020-07-23 22:31:34 +0200,2767, merge pull request 2767 lucas invoke template minor improvement,,
115,f05a806164a4ac202b109eeaf01db95c79743026,hakram02 <ahmedhamdyau@gmail.com>, 2020-07-11 17:39:30 +0200, , fix usage pelican_open doc,,
116,b7cfe0c4f91beb17a6d0c95b66e6eb3a50755fc8,ustin Mayer <entroP@gmail.com>, 2020-06-12 14:33:18 +0200,2768, merge pull request 2768 magicbrothers patch fix sentence doc,,
117,d200c4363cf4c690754e63968f966f4cd3320860,agicbrothers <47381891+magicbrothers@users.noreply.github.com>, 2020-06-12 11:24:42 +0000, , fix sentence doc,,
118,ee80399be1583fff15af09fbc487130c020a62b5,ucas Cimon <lucas.cimon@gmail.com>, 2020-06-09 18:12:24 +0200, , fixups post review,,
119,d3c4bcc2541f61421d07debdbc731b4d59c4e526,ucas Cimon <lucas.cimon@gmail.com>, 2020-06-09 16:01:46 +0200, , invoke template avoiding spawn unnecessary process passing cli args pelican,,
120,4d70447a5ae89cbfafb8aad158333f72350c24d1,ustin Mayer <entroP@gmail.com>, 2020-06-07 06:58:22 +0200,2763, merge pull request 2763 kernc root logger force root logger fatallogger class,,
121,d3aa4f7c7c875b39ae78c394ee43d46ab6a386ed,avid Beitey <david@davidjb.com>, 2020-06-07 01:46:16 +0000, , remove duplicate port argument makefile port variable check earlier makefile set argument part pelicanopts prior change duplicated serve target,,
122,d6623c642fc6999fb57a5bbf8ce5a11c03c752de,ernc <kerncece@gmail.com>, 2020-06-05 14:27:37 +0200, , doc minor fix code block indent,,
123,20067da9f52b56510c3a510b9fe175b60b344543,ernc <kerncece@gmail.com>, 2020-06-05 14:24:55 +0200, , document logging plugins,,
124,cd3048d4cf6d69ba95bf22ca55a2e9ddd6c91bff,ernc <kerncece@gmail.com>, 2020-06-05 01:48:11 +0200, , force root logger fatallogger class enforces fatallogger policy upon pelican plugins might contain code import logging log log.warning ...  logging.warning ...,,
125,78edd878a31d9dd900e79477a0a2789384ff75f1,ustin Mayer <entroP@gmail.com>, 2020-06-04 11:14:37 +0200, , improve namespace plugin documentation,,
126,9db937e581e03aee857a4e95d1a170a6d98ff687,ustin Mayer <entroP@gmail.com>, 2020-05-26 15:18:24 +0200, , document pelican plugins command,,
127,d0457dcfb8a10e48fdf6d6f7535ce0194bf601ee,ustin Mayer <entroP@gmail.com>, 2020-05-10 07:50:32 +0200,2431, build setting path string instead posix_join fix 2431,,
128,0ed7d6641eaf3d40b265d477dd237d2e38e8c152,ustin Mayer <entroP@gmail.com>, 2020-05-17 07:32:28 +0200, , add pull request template,,
129,7c9c1c63cc7e58add15cc7b9d87456c51f1a2c81,ustin Mayer <entroP@gmail.com>, 2020-05-17 07:04:26 +0200, , add issue template,,
130,f0841dc45404834649298953e87d1b779fd7002f,ustin Mayer <entroP@gmail.com>, 2020-05-17 06:26:30 +0200, , add faq entry markdown syntax variant,,
131,f6ee00f87774b554a5366b46a68c47ca7aa749cd,ustin Mayer <entroP@gmail.com>, 2020-05-14 22:12:35 +0200,2755, merge pull request 2755 avaris lint fix linting error,,
132,873df9094a91c6a063ff932ce8cf803788fea7eb,eniz Turgut <dturgut@gmail.com>, 2020-05-12 23:30:03 +0300, , fix linting error,,
133,21242e3a475be7fcacc4de2e0ef54c396d421b93,ustin Mayer <entroP@gmail.com>, 2020-05-10 08:11:00 +0200, , switch readme badge travis github action,,
134,ca1c58e20186c3128955aedb97ce1c1da569cff2,ustin Mayer <entroP@gmail.com>, 2020-05-10 07:32:54 +0200,2753, merge pull request 2753 avaris log dict fix dictionary logging formatter,,
135,2eb9c26cdb367033692cb75f3c8d9937cf7db94d,ustin Mayer <entroP@gmail.com>, 2020-05-10 07:29:27 +0200,2750, merge pull request 2750 avaris autoreload refactor file folder watcher autoreload,,
136,177bc2262cc81a0dff06fa096304c36d31e09409,ustin Mayer <entroP@gmail.com>, 2020-05-10 07:16:47 +0200,2747, merge pull request 2747 avaris github action add github action workflow,,
137,50281c42e5bd8d170bd666668ae527170997f357,eniz Turgut <dturgut@gmail.com>, 2020-05-09 19:39:54 +0300, , fix dictionary logging formatter python special case single mapping argument logging adjusts baseformatter skip fancy formatting argument type mapping also add various formatted log output,,
138,c19075816bd7b909421bbf20a463f332ee9e03be,eniz Turgut <dturgut@gmail.com>, 2020-05-09 19:30:21 +0300, , use context manager log testing,,
